{
  "title": "10 Best Free Storyboard Creator Software of 2024",
  "authors": [
    "Yiyang Zhang"
  ],
  "tags": [
    "Content"
  ],
  "description": "Learn how to create a storyboard for your needs. Discover the 10 best free storyboard creator software to improve your creation in 2024.",
  "created": 1704758400000,
  "updated": 1704758400000,
  "layout": "blog",
  "id": "paNMFmhijPKfD2DPeEjbq",
  "slug": "10-best-free-storyboard-creator-software",
  "cover": "/blobs/A2l5x9x6exA3MqL0lwfcP0cB-Smtk2Ofg0cEsiiq3rE=",
  "md": "---\n\n\ntitle: \"10 Best Free Storyboard Creator Software of 2024\"\n\n\nauthor: \"Yiyang Zhang\"\n\n\ntags: Content\n\n\nslug: 10-best-free-storyboard-creator-software\n\n\ndescription: \"Learn how to create a storyboard for your needs. Discover the 10 best free storyboard creator software to improve your creation in 2024.\"\n\n\ncreated: 2024-01-09\n\n\nupdated: 2024-01-09\n\n\nlayout: blog\n\n\npublish: true\n\n\n---\n\n\n\n![A2l5x9x6exA3MqL0lwfcP0cB-Smtk2Ofg0cEsiiq3rE=](/blobs/A2l5x9x6exA3MqL0lwfcP0cB-Smtk2Ofg0cEsiiq3rE=)\n\n\nLights, camera, action! Whether you're a budding filmmaker, an aspiring animator, or simply someone with a story to tell, storyboarding is essential for bringing your creative visions to life. A storyboard acts as a visual blueprint for your ideas, helping you plan the sequence of shots and scenes before diving into production. But where can you find the perfect storyboard creator software that won't break the bank?\nLook no further! In this article, we'll explore the 10 best free storyboard creator software of 2024 that will ignite your imagination and streamline your storytelling process. So grab some popcorn and get ready to discover these incredible tools that will turn your dreams into reality onscreen!\n\n\n# What is a Storyboard?\n\n\nA storyboard is a visual representation of a story, typically presented in the form of sequential panels. Each panel features illustrations or images accompanied by notes describing key scenes or shots, including details of action and dialogue. Similar to a comic strip, storyboards provide a blueprint for a project, allowing creators to visualize the unfolding narrative before investing resources in production. Widely used in film, animation, video games, advertising, and presentations, storyboards serve as a crucial communication tool among creative team members. By mapping out scenes using storyboarding software, creators can experiment with various visual elements, such as angles, compositions, and lighting, facilitating collaboration and ensuring a smoother creative process.\n\n\n# How to Create A Storyboard in 8 Steps?\n\n\nWhen it comes to creating a storyboard, there are several key steps you can follow to ensure that your vision and ideas come to life in a clear and organized manner.\n\n\n\n![nW08zFfvEsR8508nJ6l2krLxVY32woBU7BbFc1WmZOY=](/blobs/nW08zFfvEsR8508nJ6l2krLxVY32woBU7BbFc1WmZOY=)\n\n\n### Step 1: Outline Main Story Elements\n\n\n* Identify key characters, settings, and plot points.\n\n\n* Establish a clear understanding of the essential elements of your story.\n\n\n### Step 2: Plan Scene Sequence\n\n\n* Consider the flow of events in your story.\n\n\n* Determine how each scene will logically progress to the next.\n\n\n### Step 3: Structure Overall Storyboard\n\n\n* Develop the framework for your storyboard.\n\n\n* Define the structure that will guide the visual narrative.\n\n\n### Step 4: Sketch Individual Panels\n\n\n* Begin sketching each panel or frame.\n\n\n* Use simple illustrations or stick figures to represent shots or actions.\n\n\n### Step 5: Include Relevant Notes\n\n\n* Add notes or descriptions to each panel.\n\n\n* Provide additional context on scene details, dialogue, and sound effects.\n\n\n### Step 6: Review and Refine\n\n\n* Evaluate the overall storyboard for pacing and coherence.\n\n\n* Refine scenes, transitions, and storytelling clarity as needed.\n\n\n### Step 7: Share and Collaborate\n\n\n* Share the storyboard with others for feedback.\n\n\n* Collaborate with team members to ensure a cohesive visual narrative.\n\n\n### Step 8: Finalize Before Production\n\n\n* Make any necessary adjustments based on feedback.\n\n\n* Ensure the storyboard is polished and ready before moving to production.\nBy following these steps, you can create a comprehensive and well-thought-out storyboard that serves as a valuable guide throughout the production process.\n\n\nBy following these steps and utilizing a free storyboard creator software like AFFiNE, you can efficiently bring your ideas together into an effective visual narrative that will guide future development processes!\n\n\n# 10 Best Free Storyboard Creator Software of 2024\n\n\nLooking for the best free storyboard creator software to bring your creative ideas to life? Look no further! In this article, we'll be discussing the top 10 options that you can use in 2024. Whether you're a filmmaker, animator, or simply someone who loves storytelling, these tools will help you visualize your concepts and streamline your production process.\n\n\n### 1. [AFFiNE](https://affine.pro/)\n\n\nAFFiNE provides professionals with a unified platform that enables them to plan a knowledge base, collaborate with teammates, and develop content. This flexible tool empowers users to create their storyboards and set their goals while staying in sync and building content with blocks. The limitless workspace stimulates user-driven innovation. AFFiNE offers safe data storage, open-source benefits, and collaborative functionality. With its user-friendly interface and powerful features, creating a storyboard becomes effortless.\n\n\n\n\n\n<div style=\"text-align:center;\">\n\n\n<iframe width=\"560\" height=\"315\" src=\"https://www.youtube.com/embed/3cfeKOufZWU?si=IiXDIdwfnM2Z7KPL\" title=\"YouTube video player\" frameborder=\"0\" allow=\"accelerometer; autoplay; clipboard-write; encrypted-media; gyroscope; picture-in-picture; web-share\" allowfullscreen></iframe>\n\n\n</div>\n\n\n\n\n\n**Key features:**\n\n\n* **Craft Your Storyboard with AFFiNE's [Storyboard Template](https://affine.pro/blog/free-best-8-storyboard-templates-examples)**: AFFiNE's Storyboard template tackles the challenge of transforming complex ideas into compelling narratives. Tailored for directors, marketers, innovators, and creative thinkers, it provides a structured approach to visual storytelling. This tool ensures your [vision](https://affine.pro/blog/8-free-printable-vision-board-templates-examples-2023) gains clarity, resonating with precision and impact, perfectly aligning with your target demographic's needs.\n\n\n<video muted autoplay loop preload=\"auto\" playsinline>\n  <source src=\"/blobs/7GLm6YhELBIGxeSp_QZ7_wpVyjXPtNuq0MaYn1_brsY=\" type=\"video/mp4\" />\n</video>\n\n\n* **Tailored Storyboarding Precision with AFFiNE's Database**:  AFFiNE's database seamlessly integrates Kanban and Table views for dynamic storyboarding. By smoothly transforming your blocks into a Kanban view, effortlessly classify based on storyboard properties such as date, progress, and link. This allows for intuitive drag-and-drop functionality, ensuring precise organization and alignment of your project execution. Switching to the Table view offers a comprehensive project overview, enhancing the efficiency of your narrative development. With intuitive controls, track deadlines and manage unscheduled tasks seamlessly.\n\n\n\n![bY0EkoVLJfBpOjymBoGUxE0LAiQuW1bNgYA-FU1OQlA=](/blobs/bY0EkoVLJfBpOjymBoGUxE0LAiQuW1bNgYA-FU1OQlA=)\n\n\n* **Effortless Storyboarding with AFFiNE's Frame & Presentation**: In edgeless mode, create and frame content effortlessly, forming standout decks with ease. Just tap the presentation button to bring your ideas to life seamlessly. Our latest update optimizes frame visuals, eliminating borders for a sleek, uncluttered presentation. Enjoy distraction-free storyboarding with a polished and refined display, making your narratives shine with AFFiNE.\n\n\n\n![cXPfaH7yGKuxN6x24MrIF_2SxJEMnAdSfT2q9HhQpD4=](/blobs/cXPfaH7yGKuxN6x24MrIF_2SxJEMnAdSfT2q9HhQpD4=)\n\n\n* **Show Your Storyboard with AFFiNE's Single Page Sharing**: No more oversharing of your workspace; now, you can precisely control what's shared with just a few clicks. With AFFiNE's single page sharing, storyboard improvement is made simple, offering a tailored approach to sharing and refining your storyboard.\n\n\n\n![VsmRQKKT_JWfocv6kdTdmSw3-22k1EUrdWeyjhL8xjQ=](/blobs/VsmRQKKT_JWfocv6kdTdmSw3-22k1EUrdWeyjhL8xjQ=)\n\n\n### 2. [Canva](https://www.canva.com/pro/)\n\n\n\n![NtaeL3aNpzwgd-ixQthL83L4_vDRxRLI0rafsL0kaHc=](/blobs/NtaeL3aNpzwgd-ixQthL83L4_vDRxRLI0rafsL0kaHc=)\n\n\nKnown for its user-friendly interface and extensive library of templates and assets, Canva allows you to easily create professional-looking storyboards with just a few clicks. Canva is an online tool for graphic designing that can be used for layout designing, sharing, presentations, and printing business cards, logos, and storyboards. It is available on Android devices, tablets, iPhones, and iPads. Canva’s intuitive drag-and-drop editor makes creating beautiful designs from templates quick and easy.\n\n\n**Key features:**\n\n\n* It has more than 50000 templates.\n\n\n* You can create different types of graphs and charts.\n\n\n* It has features for photo editing.\n\n\n**Pros of Canva**\n\n\n* Ideal for various visual project\n\n\n* Lots of well-designed templates\n\n\n**Cons of Canva**\n\n\n* Not as intuitive as other purpose-built storyboard makers\n\n\n* Slow to load and difficult to keep organized\n\n\n### 3. [Miro](https://miro.com/)\n\n\n\n![eHTlTmHafD1N4rp966-7N_gqBjBy27VCPVKVgyRDGM4=](/blobs/eHTlTmHafD1N4rp966-7N_gqBjBy27VCPVKVgyRDGM4=)\n\n\nMiro embraces more than 1,000 templates, including storyboards, Kanban boards, Gantt charts, product wireframes, research boards, and flowcharts. Miro provides an online collaborative platform where teams can brainstorm ideas, map workflows, and design prototypes all in one place. This versatile tool combines whiteboarding, collaboration, and project management functionalities, taking visual communication to new heights.\n\n\n**Key features:**\n\n\n* Provide real-time collaborative drawing\n\n\n* Built-in comments, video, chat, and seamless communication\n\n\n* Unlimited team workspaces with granular permissions, privacy & sharing controls\n\n\n**Pros of Miro**\n\n\n* Easy to build smart-looking storyboards and mind maps\n\n\n* Simple to collaborate with teammates\n\n\n* Intuitive UI\n\n\n**Cons of Miro**\n\n\n* Hard to import or export content from time to time\n\n\n* Difficult to navigate large accounts\n\n\n### 4. [Boords](https://boords.com/)\n\n\n\n![bpPQ9I3anFa9le4JxlNTzo_kUvoTvc8NLr1kgu-l68k=](/blobs/bpPQ9I3anFa9le4JxlNTzo_kUvoTvc8NLr1kgu-l68k=)\n\n\nBoords is an easy-to-use storyboarding tool for planning creative projects. Boords is a fully featured Storyboard Software designed to serve Startups, SMEs, and enterprises. Boords provides end-to-end solutions designed for Web App. This online Storyboard system offers Storyboard, Image Import, and Artwork Library in one place.\n\n\n**Key features:**\n\n\n* Easy image uploads,\n\n\n* Drag and drop panel organization,\n\n\n* The ability to share boards with clients and receive comments\n\n\n**Pros of Boords**\n\n\n* Drag-and-drop functionality\n\n\n* Built-in collaboration tools\n\n\n* AI Storyboard Generator\n\n\n**Cons of Boords**\n\n\n* A bit clunky to de-select and re-select\n\n\n* Limited customized storyboard layouts and visuals\n\n\n### 5. [Milanote](https://milanote.com/)\n\n\n\n![WmBo4aLKmaGT4NaFrsQvexR8rhZnwri6HvdyjNYeb6I=](/blobs/WmBo4aLKmaGT4NaFrsQvexR8rhZnwri6HvdyjNYeb6I=)\n\n\nMilanote is a visual collaboration tool that allows users to organize ideas and projects into customizable boards filled with various types of content such as text, images, links, notes, and more. It is one of the leading tools for creative thinkers to organize life. It provides a flexible and intuitive workspace for creative teams, individuals, and businesses to brainstorm, plan, and execute their ideas effectively.\n\n\n**Key features:**\n\n\n* Customizable boards with various types of content\n\n\n* Collaboration features\n\n\n* Real-time updates and notifications to keep everyone on the same page\n\n\n**Pros of Milanote**\n\n\n* Easy-to-use templates and pre-built workflows\n\n\n* Ability to export boards in various formats, including PDF and CSV\n\n\n* Cross-platform support for desktop and mobile devices\n\n\n**Cons of Milanote**\n\n\n* No version history of boards or notes\n\n\n### 6. [ClickUp](https://clickup.com/)\n\n\n\n![2iyWX2ClhNW7M_nOyP4Q8pJtsfi3LvCelqDUHF8SQ3Y=](/blobs/2iyWX2ClhNW7M_nOyP4Q8pJtsfi3LvCelqDUHF8SQ3Y=)\n\n\nManage multiple workflows, collaborate more effectively, and streamline your work into one place with ClickUp – a free project management solution for teams. Whether you're new to project management apps or a seasoned user, ClickUp's customizable features can adapt to any team size. Plus, stay on top of your projects while on the go with the ClickUp mobile app.\n\n\n**Key features:**\n\n\n* Customization without code or add-ons\n\n\n* Collaboration capabilities\n\n\n* Real-time reporting\n\n\n**Pros of ClickUp**\n\n\n* A highly customizable workspace\n\n\n* Comprehensive reporting\n\n\n**Cons of ClickUp**\n\n\n* Steep learning curve\n\n\n* Limited integrations\n\n\n### 7. [Lucidchart](https://affine.pro/blog/8-best-habit-tracker-apps-your-need-2023-features-price)\n\n\n\n![J2pJhlgbXV56asxtD97_v0HSSBS3S7j6ciNtGa7V_SE=](/blobs/J2pJhlgbXV56asxtD97_v0HSSBS3S7j6ciNtGa7V_SE=)\n\n\nLucidchart is an intelligent diagramming application that empowers teams to clarify complexity, align their insights, and build the future—faster. With its intuitive interface and extensive template library, Lucidchart is a popular choice among professionals. It offers collaboration features and seamless integration with other tools like Google Drive.\n\n\n**Key features:**\n\n\n* Intelligent diagramming\n\n\n* 1,000+ templates\n\n\n* Ability to share outside of Google Docs\n\n\n**Pros of Lucidchart**\n\n\n* Intuitive user interface\n\n\n* Smooth performance on all tested platforms\n\n\n* Adequate shapes and templates\n\n\n**Cons of Lucidchart**\n\n\n* No desktop apps\n\n\n* Quite limiting free account\n\n\n### 8. [Visme](https://www.visme.co/storyboard-creator/)\n\n\n\n![K6Nix8VLZ3fXs1VvPTMJddkcpsfrYTApmunlcLcN88k=](/blobs/K6Nix8VLZ3fXs1VvPTMJddkcpsfrYTApmunlcLcN88k=)\n\n\nVisme offers templates and tools for making professional slide decks, social media posts, online ads, tables, and more. That means people can work from ready-made samples and quickly turn them into their own branded content. Its strongest features are its user-friendly presentation, infographic & document creator, as well as its tool kit.\n\n\n**Key features:**\n\n\n* Access Controls/Permissions.\n\n\n* Activity Dashboard.\n\n\n* Table-making.\n\n\n**Pros of Visme**\n\n\n* Numerous templates for slideshows and marketing materials\n\n\n* User-friendly presentation\n\n\n**Cons of Visme**\n\n\n* Lower-priced plans are too restrictive\n\n\n* Does not support guest collaborators\n\n\n### 9. [Adobe](https://www.adobe.com/creativecloud/video/discover/storyboarding.html)\n\n\n\n![RQxkxAN15GNKTiyvfzcqMPGw0CZggglgGA7SnEJWPVk=](/blobs/RQxkxAN15GNKTiyvfzcqMPGw0CZggglgGA7SnEJWPVk=)\n\n\nAdobe serves as a versatile design and prototyping tool, allowing users to simulate user interactions with their designs. It offers the flexibility to modify objects as needed and incorporate elements like animations, voice interactions, and transitions. Once designs are finalized and approved, they can be readily published for further development.\n\n\n**Key features:**\n\n\n* Animations and transition designs\n\n\n* Prototype design tools\n\n\n* Agile editing and integration\n\n\n**Pros of Adobe**\n\n\n* The integration across Adobe products and the Creative Cloud\n\n\n* Allows for signature customization with great flexibility\n\n\n* Create & edit shared PDF's instantly with exact text within the document\n\n\n**Cons of Adobe**\n\n\n* User Interface for Adobe Software is somewhat convoluted and frustrating to use\n\n\n* A little bit of learning curve\n\n\n### 10. [Gliffy](https://www.gliffy.com/)\n\n\n\n![7wdxG82IbPGOLeez0WF3GpUXd7GUoxIhijSAlidAcSM=](/blobs/7wdxG82IbPGOLeez0WF3GpUXd7GUoxIhijSAlidAcSM=)\n\n\nGliffy is a great choice for teams in need of a reliable and integrated diagramming tool on Confluence. With its intuitive user interface, plenty of ready-to-use components, and automatic updating of diagrams, there's no need to worry about having an outdated image - you'll always have the latest version. As if that weren't enough, Gliffy has Cloud Fortified certification, over 18 million users, and a long pedigree within Atlassian's products.\n\n\n**Key features:**\n\n\n* Links and syncs diagrams\n\n\n* Real-Time collaboration in Confluence cloud\n\n\n* Advanced security and access management features\n\n\n**Pros of Gliffy**\n\n\n* Wide range of shapes, symbols, and templates designed for storyboard\n\n\n* Support collaboration\n\n\n**Cons of Gliffy**\n\n\n* Occasional lags and errors when you work with a large diagram\n\n\n* Limited option to export selected areas directly as PNG or JPEG\n\n\nWith so many fantastic options available at no cost, there's no excuse not to start creating amazing storyboards today! Experiment with different tools until you find the one that suits your needs the best-happy storyboarding!\n\n\n# Improve Your Storyboard Creation with AFFiNE\n\n\nWhile there are plenty of free storyboard creator software options available, one tool that stands out from the rest is AFFiNE. With its user-friendly interface and powerful features, AFFiNE takes your storyboard creation to a whole new level. AFFiNE offers a wide range of customizable templates and elements that allow you to bring your ideas to life. Whether you're creating storyboards for films, animations, or presentations, AFFiNE has got you covered. It provides you with the flexibility to add images and text to enhance your storytelling.\n\n\n\n![nG1zIBSH0S-8U7e52_D9rWQS2HZasYlld44LSON-T7g=](/blobs/nG1zIBSH0S-8U7e52_D9rWQS2HZasYlld44LSON-T7g=)\n\n\nNow that you have learned about the definition and creation of a storyboard, it's time to put your knowledge into action. And what better way to do that than with AFFiNE? Commence improving your plans by using AFFiNE's user-friendly tool. Presently, **AFFiNE** has launched its **[Stable Version](https://affine.pro/download)**, with ongoing efforts to develop a more comprehensive and dependable iteration. Join us on our voyage through our social media channels and be part of the experience. **Come and join us on our journey over on our media platforms.** 🚀\n\n\n* Official Website: [https://affine.pro/](https://affine.pro/)\n\n\n* GitHub: [https://github.com/toeverything/AFFiNE](https://github.com/toeverything/AFFiNE)\n\n\n* Discord: [https://discord.gg/Arn7TqJBvG](https://discord.gg/Arn7TqJBvG)\n\n\n* Twitter: [https://twitter.com/AffineOfficial](https://twitter.com/AffineOfficial)\n\n\n",
  "publish": true
}