{
  "title": "10 Best Memorizing Techniques & Tools to Upgrade Your Memory",
  "authors": [
    "Yiyang Zhang"
  ],
  "tags": [
    "Content"
  ],
  "description": "This article showcases the 10 best free memorizing tools/softwares to help you upgrade your memory, memory improvement is not a distant dream but a tangible reality achievable through effective techniques and AFFiNE.",
  "created": 1703116800000,
  "updated": 1704758400000,
  "layout": "blog",
  "id": "mI3S17DXlTQKd9W-CKXVP",
  "slug": "10-best-Memorizing-techniques-tools-upgrade-your-memory",
  "cover": "/blobs/N8_t4WU0NV-mhc3oUoAz35IvsD8Qh7u-Mz_rE55PYVQ=",
  "md": "---\n\n\ntitle: \"10 Best Memorizing Techniques & Tools to Upgrade Your Memory\"\n\n\nauthor: \"Yiyang Zhang\"\n\n\ntags: Content\n\n\nslug: 10-best-Memorizing-techniques-tools-upgrade-your-memory\n\n\ndescription: \"This article showcases the 10 best free memorizing tools/softwares to help you upgrade your memory, memory improvement is not a distant dream but a tangible reality achievable through effective techniques and AFFiNE.\"\n\n\ncreated: 2023-12-21\n\n\nupdated: 2024-01-09\n\n\nlayout: blog\n\n\npublish: true\n\n\n---\n\n\n\n![N8_t4WU0NV-mhc3oUoAz35IvsD8Qh7u-Mz_rE55PYVQ=](/blobs/N8_t4WU0NV-mhc3oUoAz35IvsD8Qh7u-Mz_rE55PYVQ=)\n\n\n\n\n\nIn a world where the promise of instant memory improvement through artificial intelligence looms on the horizon, the present offers a plethora of memorizing techniques and tools to enhance your cognitive abilities. While the future may bring AI-assisted memory boosts, exploring the current landscape of memory enhancement is both practical and accessible.\n\n\nMemory enhancement involves a two-step process: encoding and retrieval. During encoding, new information is stored through cognitive processes like elaboration, association, and visual imagery. In this article, we delve into the intricacies of memory enhancement, providing insights into the top 10 memorizing techniques and tools, with a spotlight on the innovative AFFiNE.\n\n\n### Mastering Memory: 5 Steps to Memorize Faster\n\n\nIn the intricate realm of memory enhancement, mastering the art of memorization involves a comprehensive understanding of the processes that lead to faster recall. This section introduces a strategic approach, comprising five pivotal steps to accelerate your ability to memorize information efficiently.\n\n\n",
  "publish": true
}