{
  "title": "10 Best Airtable Alternatives to Manage Your Project Management in 2024 (Free & Paid)",
  "authors": [
    "Yanxi Liu"
  ],
  "tags": [
    "Content"
  ],
  "description": "Explore the best Airtable alternatives in 2024 for project management. Find the perfect fit for your workflow and organization needs.",
  "created": 1705536000000,
  "updated": 1705881600000,
  "layout": "blog",
  "id": "w24IK8MToIf-mQ6Ad_qkJ",
  "slug": "10-best-airtable-alternatives-to-manage-your-project-free-paid",
  "cover": "https://insider.affine.pro/api/workspaces/qf73AF6vzWphbTJdN7KiX/blobs/3N_88cWb1FmN8oxQVKa-SCUve93-OB-bt9tgv9JnTGE=.webp",
  "md": "---\n\ntitle: \"10 Best Airtable Alternatives to Manage Your Project Management in 2024 (Free & Paid)\"\n\nauthor: \"Yanxi Liu\"\n\ntags: Content\n\nslug: 10-best-airtable-alternatives-to-manage-your-project-free-paid\n\ndescription: \"Explore the best Airtable alternatives in 2024 for project management. Find the perfect fit for your workflow and organization needs.\"\n\ncreated: 2024-01-18\n\nupdated: 2024-01-22\n\nlayout: blog\n\npublish: true\n\n---\n\n\n![3N_88cWb1FmN8oxQVKa-SCUve93-OB-bt9tgv9JnTGE=](https://insider.affine.pro/api/workspaces/qf73AF6vzWphbTJdN7KiX/blobs/3N_88cWb1FmN8oxQVKa-SCUve93-OB-bt9tgv9JnTGE=)\n\nAirtable is a popular project management software that works like Excel or Google Sheets, with a spreadsheet-like interface. It's great for businesses that prefer the familiarity of spreadsheets and want to track their projects in a similar way.\n\nBut, Airtable does have its limitations. Its structured views and spreadsheet format may not be suitable for scaling your company, and it doesn't offer as many features as some other options available in the market.\n\n# Why Consider an Alternative to Airtable?\n\n1. **Task Management Features:** While Airtable allows you to create a spreadsheet grid for task assignment, it lacks built-in task management features. This means you'll have to manually edit the grid, which can become tedious, especially if you regularly assign tasks to your team.\n1. **Communication Features:** In today's remote work environment, effective communication and collaboration are crucial. Airtable's only collaboration option is through comments, which may be sufficient for basic feedback but falls short for complex discussions.\n1. **Workflow Automation Tools:** Workflow automation is an essential feature in project management tools. Unfortunately, Airtable lacks comprehensive automation capabilities.\n1. **Cost:** Airtable's pricing can be expensive, especially for larger teams. The Plus plan starts at $12 per month per user, meaning a team of 10 would cost $120 per month.\nFortunately, we have researched and found the best Airtable alternatives that address these limitations.\n\n# Top 10 Airtable alternatives in 2024\n\nLooking for alternatives to Airtable? You're in luck! We've compiled a list of top Airtable alternatives for 2024. If you feel limited by Airtable's features, it's important to find a solution that suits your business model and makes you comfortable.\n\n## 1. [AFFiNE](http://affine.pro)\n\n\n![MvPuJwMVS0vN9b_4qmeq27HIggpf7g0QZuhvctyyqI8=](https://insider.affine.pro/api/workspaces/qf73AF6vzWphbTJdN7KiX/blobs/MvPuJwMVS0vN9b_4qmeq27HIggpf7g0QZuhvctyyqI8=)\n\nIf you're seeking a recommendation for an app to help manage ADHD,[AFFiNE](http://affin.pro)could be a strong contender. AFFiNE is an innovative application crafted to facilitate organization, [task management](https://affine.pro/blog/8-free-project-tracker-templates-work-management-2023), and[collaboration](https://affine.pro/blog/navigating-organizational-strategies-a-path-to-project-success)on various projects and information sets, particularly useful when overseeing a project. The standout feature of AFFiNE is its commitment to accessibility and inclusivity; it is a complimentary, open-source platform that leverages offline capabilities, ensuring that it remains accessible to users regardless of their internet connectivity status.\n\n**Key Features:**\n\n* **Write, [Draw](https://affine.pro/blog/best-free-digital-whiteboard-apps-2023), and [Plan](https://affine.pro/blog/best-project-planning-tools-software-for-teams-2023) All-in-One:** Enjoy your all-in-one KnowledgeOS solution for effortlessly writing, drawing, and planning on a hyper-fused platform. It supports [kanban](https://affine.pro/blog/affine-080-launch-week-day3), table, and rich-text paragraphs as building blocks to form pages or whiteboards. It carries out integrated processing here in document editing, data processing, or brainstorming.\n\n![knv3GLQpB1H8ce4w2ztMzCiGuUMPG0JRDZA49U3AgIw=](https://insider.affine.pro/api/workspaces/qf73AF6vzWphbTJdN7KiX/blobs/knv3GLQpB1H8ce4w2ztMzCiGuUMPG0JRDZA49U3AgIw=)\n\n* **[Collaborative Capabilities:](https://affine.pro/blog/affine-0-10-0-launch-week-day-5-5-stable-with-cloud-support-finally-available-to-every-pro-in-your-team)** For group work, the app should have collaborative features, making it easy to share and coordinate projects with others in your group work.\n  \n![71MN7zgKOg2C73idwSU66YEnVUK8x41Jqwwe2z9CiPU=](https://insider.affine.pro/api/workspaces/qf73AF6vzWphbTJdN7KiX/blobs/71MN7zgKOg2C73idwSU66YEnVUK8x41Jqwwe2z9CiPU=)\n\n* **[Offline Accessibility](https://affine.pro/blog/5-best-offline-alternatives-to-notion):** The best task management tool should allow users to access their essential details offline. This feature is particularly valuable when going outside with limited internet connectivity.\n\n![7tLzErsXRl3O-9-0m62ySSd00VYnYYtRKFaZUFit2Jg=](https://insider.affine.pro/api/workspaces/qf73AF6vzWphbTJdN7KiX/blobs/7tLzErsXRl3O-9-0m62ySSd00VYnYYtRKFaZUFit2Jg=)\n\n**Pricing: Free!** If you are interested, please check the specific [Pricing plan](https://affine.pro/pricing).\n\n## 2. [Monday.com](https://affine.pro/blog/8-best-monday-alternatives-for-project-management-2023)\n\n\n![Y5aNedo6Wbxac8XCO1zZ6UDLm9UEUGXqegZzs2AI-cg=](https://insider.affine.pro/api/workspaces/qf73AF6vzWphbTJdN7KiX/blobs/Y5aNedo6Wbxac8XCO1zZ6UDLm9UEUGXqegZzs2AI-cg=)\n\n[Monday.com](https://Monday.com)is one of the top Airtable alternatives if you are looking for a functional yet clear way to manage your projects. While Airtable uses tables to store and manage data, [Monday.com](https://Monday.com) is guided by tasks. The platform offers task management, dependency tracking and several app integrations, such as Slack, Jira, Asana and HubSpot CRM.\n\n**Key features:**\n\n* Boards & Columns\n* Tasks automation\n* Checklists\n* Apps Integration\n* File views, Kanban views, form views, chart views\n**Pricing:** [Monday.com](https://Monday.com) has a free plan for up to 2 users with some feature limitations. Basic plans start at $8/user/month. Get a 14-day free trial.\n\n## 3. [ClickUp](https://affine.pro/blog/seven-best-open-source-clickup-alternatives-2023)\n\n\n![xM2en6s6iq45ZIxxrj4UwJ5bndp3NMhrT9y0D-yLjeM=](https://insider.affine.pro/api/workspaces/qf73AF6vzWphbTJdN7KiX/blobs/xM2en6s6iq45ZIxxrj4UwJ5bndp3NMhrT9y0D-yLjeM=)\n\n**ClickUp** is an alternative to Airtable with a highly efficient dashboard view and collaboration features. The platform free version offers features that you only get in the paid plan of Airtable, such as goals, embedded emails, conditional automation, task checklists, custom task statuses, sprints, and 24/7 support. ClickUp also offers native email, several templates and free integrations, which makes it one of the top Airtable alternatives.\n\n**Key Features:**\n\n* Workload view\n* Team chat\n* Smart Notification\n**Pricing:** ClickUp has a free plan, with paid plan options starting at $5 per member, per month.\n\n## 4. [Notion](https://affine.pro/blog/notion-alternatives-to-revolutionise-your-personal-workflow)\n\n\n![H7xkEUi_IDFX2Nrf28b_LkmTKzI5q7EbheWgNGI6y8Q=](https://insider.affine.pro/api/workspaces/qf73AF6vzWphbTJdN7KiX/blobs/H7xkEUi_IDFX2Nrf28b_LkmTKzI5q7EbheWgNGI6y8Q=)\n\n**Notion** is another one of the most popular Airtable alternatives because it offers spreadsheet-styled project management capabilities using its â€˜tablesâ€™ feature. From there you can adjust the functions of the columns and rows similarly to how you would in most other spreadsheet applications. Notion also allows you to view your table in a calendar and list view, giving you the ability to approach your spreadsheet from different perspectives quickly.\n\n**Key Features:**\n\n* Create calendar and list views of your table\n* Save your table as a template button for future use\n* Includes several other useful project management tools\n**Pricing:** You can try Notion for free with limited features and they offer paid plans for small teams and big companies starting at $8/user/month.\n\n## 5. [Jira](https://affine.pro/blog/15-best-free-jira-alternatives-agile-project-management-2023)\n\n\n![15mxIHEa4Cmk0dybqSEDzWQStRbKWXXlJ3UDt37Vv5w=](https://insider.affine.pro/api/workspaces/qf73AF6vzWphbTJdN7KiX/blobs/15mxIHEa4Cmk0dybqSEDzWQStRbKWXXlJ3UDt37Vv5w=)\n\n[Jira is a project management tool](https://affine.pro/blog/15-best-free-jira-alternatives-agile-project-management-2023) geared specifically towards Agile and [Scrum software development teams](https://www.atlassian.com/agile/tutorials/how-to-do-scrum-with-jira-software).\n\nOriginally created as a bug-tracking tool, Jira evolved over the years to become a highly customizable management software.\n\n**Features**\n\n* Flexible Agile views with a customizable Scrum and Kanban board\n* Detailed reports including velocity charts, burn up charts, burndown charts, etc.\n* Customizable project dashboards\n* Power search to find a specific task\n**Pricing:** Jira offers free plan includes basic agile project managementfeatures for up to 10 team members, with premium plan that cose for $14/month per user that has additional functionality and unlimited storage.\n\n## 6. [nTask](https://www.ntaskmanager.com/)\n\n\n![z_s-kRfAoPtjRWlUby2BWss0znTuUPSWzd3NWDZMqi0=](https://insider.affine.pro/api/workspaces/qf73AF6vzWphbTJdN7KiX/blobs/z_s-kRfAoPtjRWlUby2BWss0znTuUPSWzd3NWDZMqi0=)\n\nAnother one of the top Airtable alternatives is **nTask,** a project, task and team management application that helps track and organize your companyâ€™s workflow. The software has risk management and issue-tracking features to monitor risks that can derail a project. nTask offers meeting management tools to coordinate agendas with your team members and clients. Like Airtable, nTask also offers Gantt charts and Kanban boards for different views of tasks within a single interface and for tracking the projectâ€™s performance as it develops.\n\n**Key features:**\n\n* Gantt Chart and Kanban board\n* Time-tracking & timesheet\n* Risk management\n**Pricing:** There is a free version for anyone who would like to use the software with limited features, then you have the option to access more tools starting at $3/user/month.\n\n## 7. [Zoho Sheet](https://www.zoho.com/sheet/)\n\n\n![AQcQcze1ggVnJNBwgFCP-71Q08S96TZdByc7RI5xlKM=](https://insider.affine.pro/api/workspaces/qf73AF6vzWphbTJdN7KiX/blobs/AQcQcze1ggVnJNBwgFCP-71Q08S96TZdByc7RI5xlKM=)\n\n**Zoho Sheet** is a free collaborative spreadsheet tool that you can consider as an alternative to Airtable. The cloud-based software allows users to organize data with an automated processor and use AI-assisted analysis for data handling and management. It also includes interactive application building tools with automatic data cleaning features.\n\nOne thing to note is that while Airtable has a bigger customer base, Zoho Sheet offers customer support via phone, which can be a great help depending on the type of issues youâ€™re trying to fix. Zoho Sheet also has the ability to import data from a variety of sources, including Google Drive, Dropbox, and Excel spreadsheets making it easy to bring all of your data together in one place (another reason itâ€™s one of our favorite Airtable alternatives).\n\n**Key Features:**\n\n* Advanced formulas and over 350 functions, with advanced functions like VLOOKUP and XMATCH\n* Visualize data with charts, graphs, and pivot tables to analyze and identify patterns or trends\n* Multiple users can collaborate on a single document in real-time and share data\n* Mobile app that allows users to access their spreadsheets on-the-go\n**Pricing:** Zoho Sheet is free to use if you sign up for a Zoho account. They offer paid plans to unlock more features for small teams and big companies starting at $8/user/month.\n\n## 8. [Stackby](https://stackby.com/)\n\n\n![myDMgoNW75axJ40VvximX8BZiBXC3blmIRv_ydHo82I=](https://insider.affine.pro/api/workspaces/qf73AF6vzWphbTJdN7KiX/blobs/myDMgoNW75axJ40VvximX8BZiBXC3blmIRv_ydHo82I=)\n\n[**Stackby**](https://stackby.com/) is an excellent task management alternative to Airtable due to its highly customizable design. Like Airtable, it offers spreadsheet-style databases that make it easy to manage and organize data.\n\nStackby has the ability to connect with various business APIs allowing for real-time updates within your spreadsheets and databases, eliminating the need for manual updates, a feature not as flexible in Airtable. Stackby doesnâ€™t have a steep learning curve, facilitating onboarding and adaptability.\n\n**Key Features:**\n\n* Advanced database features like data linking between tables and data grouping for organized views\n* Custom API integrations with services like YouTube, Google Analytics, etc.\n* User-level permission settings\n**Pricing:**Stackby has a free forever plan, with the only limit being the number of rows and attachment storage you can get per stack. Paid plans start at $4 for single users and $8/user/month for teams.\n\n## 9. [Smartsheet](https://affine.pro/blog/10-best-free-smart-sheet-alternatives-for-project-management-2023)\n\n\n![WGUd0IjzGHZCGBZuokHL6679xD4MTvMzymcUYLPQjY8=](https://insider.affine.pro/api/workspaces/qf73AF6vzWphbTJdN7KiX/blobs/WGUd0IjzGHZCGBZuokHL6679xD4MTvMzymcUYLPQjY8=)\n\nSmartsheet is one of the best Airtable alternatives, but it also provides some additional features that you donâ€™t get with Airtable. With its powerful tracking functions and a built-in resource management tool, Smartsheet gives its users great customization options and excellent project management tools.\n\n**Key Features:**\n\n* Team portals to connect users\n* Built-in resource management tool\n**Pricing:** Available to try for 14 days for free, you can try this program out without the obligations of a monthly fee. If you want to upgrade to the paid version, individual plans start at $7/month, and enterprise businesses should call to get a price.\n\n## 10. [Podio](https://www.podio.com/)\n\n\n![rHDhZJJ0wP4Vl59cN7RagH6NwBUmLU0G_9ZOnh2JC1c=](https://insider.affine.pro/api/workspaces/qf73AF6vzWphbTJdN7KiX/blobs/rHDhZJJ0wP4Vl59cN7RagH6NwBUmLU0G_9ZOnh2JC1c=)\n\n[**Podio**](https://podio.com/) is a task management alternative to Airtable with simple interface, efficient automation, strong integrations and affordable plans. While Airtable offers more flexibility in terms of customization, including formulas, pivot tables, and custom views, it can also have a steep learning curve. Itâ€™s quite common to need an Airtable consultant coming in to teach your team how to use the platform or to build specific automation on the platform.\n\nWith Podio, you might not have this extra cost, but also might have limited capabilities. But if you have a large team, Podio might not be a solution for you. Their free plan allows only five users. While itâ€™s on our Airtable alternatives list, this is something to consider when evaluating tools.\n\n**Key Features:**\n\n* File sharing\n* Extensions\n* Feature Index\n* Mobile Apps\n* Task Management\n**Pricing:** Podioâ€™s paid plan starts at $11.20 per month.\n\n# Start your project management journey with AFFiNE\n\n\n![JEAWWEj9dlB-xw9bsZU-uxG8pxh2zBDMW6fkCKQ4N1A=](https://insider.affine.pro/api/workspaces/qf73AF6vzWphbTJdN7KiX/blobs/JEAWWEj9dlB-xw9bsZU-uxG8pxh2zBDMW6fkCKQ4N1A=)\n\nWhile there are numerous free alternatives to Airtable, one tool that stands out is **AFFiNE**. With its user-friendly interface and powerful features, AFFiNE elevates your project management experience. It offers a diverse array of customizable templates and elements, enabling you to bring your ideas to life. Whether you're taking notes, creating your yearly plan, or designing a daily routine, AFFiNE has you covered. It provides the flexibility to incorporate images and text, enhancing your overall productivity.\n\n\n\n<div style=\"text-align:center;\">\n\n<iframe width=\"560\" height=\"315\" src=\"https://www.youtube.com/embed/3cfeKOufZWU?si=IiXDIdwfnM2Z7KPL\" title=\"YouTube video player\" frameborder=\"0\" allow=\"accelerometer; autoplay; clipboard-write; encrypted-media; gyroscope; picture-in-picture; web-share\" allowfullscreen></iframe>\n\n</div>\n\nNow that you have learned about the definition and creation of a storyboard, it's time to put your knowledge into action. And what better way to do that than with **AFFiNE**? Commence improving your plans by using AFFiNE's user-friendly tool. Presently, **AFFiNE** has launched its [Stable Version](https://affine.pro/download), with ongoing efforts to develop a more comprehensive and dependable iteration. Join us on our voyage through our social media channels and be part of the experience. **Come and join us on our journey over on our media platforms. ðŸš€**\n\n* Official Website:[https://affine.pro/](https://affine.pro/)\n* GitHub:[https://github.com/toeverything/AFFiNE](https://github.com/toeverything/AFFiNE)\n* Discord:[https://discord.gg/Arn7TqJBvG](https://discord.gg/Arn7TqJBvG)\n* Twitter:[https://twitter.com/AffineOfficial](https://twitter.com/AffineOfficial)\n\n\n",
  "publish": true
}