{
  "title": "10 Best AI Productivity Tools Must Know to Upgrade Your Workflow and Improve Business in 2024",
  "authors": [
    "Yiyang Zhang"
  ],
  "tags": [
    "Content"
  ],
  "description": "Unleash your fullest potential with the top 10 AI-powered tools in 2024, and revolutionize your workflow to achieve unprecedented business success.",
  "created": 1714348800000,
  "updated": 1714348800000,
  "layout": "blog",
  "id": "C0dVZ5N3nr02_mPfb2XQK",
  "slug": "10-best-ai-productivity-tools-must-know-upgrade-workflow-improve-business",
  "cover": "/blobs/SrYSfYt4kUMOCaVWEKjResd7wapWBgAwMv3O92x1hfw=",
  "md": "---\n\n\ntitle: \"10 Best AI Productivity Tools Must Know to Upgrade Your Workflow and Improve Business in 2024\"\n\n\nauthor: \"Yiyang Zhang\"\n\n\ntags: Content\n\n\nslug: 10-best-ai-productivity-tools-must-know-upgrade-workflow-improve-business\n\n\ndescription: \"Unleash your fullest potential with the top 10 AI-powered tools in 2024, and revolutionize your workflow to achieve unprecedented business success.\"\n\n\ncreated: 2024-04-29\n\n\nupdated: 2024-04-29\n\n\nlayout: blog\n\n\npublish: true\n\n\n---\n\n\n\n![SrYSfYt4kUMOCaVWEKjResd7wapWBgAwMv3O92x1hfw=](/blobs/SrYSfYt4kUMOCaVWEKjResd7wapWBgAwMv3O92x1hfw=)\n\n\nExploring ways to enhance your [workflow](https://affine.pro/blog/best-free-social-media-scheduler-tools-to-empower-workflow) and propel your business forward in 2024?\n\n\nLet's explore the incredible world of [AI productivity](https://affine.pro/blog/top-25-free-best-%20ai-productivity-tools) tools together! As a passionate advocate for efficiency and innovation, I've experienced firsthand the game-changing impact of artificial intelligence. In today's fast-paced digital landscape, integrating AI-powered apps isn't just a trend – it's vital for staying ahead of the curve. Join me as we uncover the top AI productivity tools that have transformed my work and can do the same for you. Get set to boost your productivity and elevate your business to new heights!\n\n\n\n\n\n# **What Types of Work can AI Productivity Tools Help to Optimize?**\n\n\n\n![-nF61hlq9gofLsCAeoipQFtG-8WAOxQNUsferGnL2Zs=](/blobs/-nF61hlq9gofLsCAeoipQFtG-8WAOxQNUsferGnL2Zs=)\n\n\nAI productivity tools are remarkably versatile, offering optimization across a spectrum of tasks spanning various industries.\n\n\nIn the field of data analysis, [AI](https://affine.pro/blog/how-to-ask-ai-question-efficiently) can quickly navigate through vast amounts of data, uncovering patterns and insights that might otherwise go unnoticed, saving significant time and effort. [Project management](https://affine.pro/blog/10-best-airtable-alternatives-to-manage-your-project-free-paid) can benefit from AI's ability to automate routine tasks like scheduling and resource allocation, freeing up teams to focus on more strategic aspects of their projects. AI can also significantly improve customer service experiences, with chatbots providing instant responses to inquiries and efficiently resolving issues. In marketing, AI enables personalized campaigns tailored to individual customer preferences and behaviors, enhancing engagement and conversion rates. Additionally, in cybersecurity, AI-powered tools act as guards, quickly detecting threats and proactively safeguarding sensitive data against breaches.\n\n\nRegardless of your industry—whether it's finance, healthcare, e-commerce, or beyond—there's an AI productivity tool poised to streamline operations and deliver tangible results.\n\n\n\n\n\n# **Benefits of AI Productivity Tools You May Ignore**\n\n\nIn the bustling world of business, the benefits of AI productivity tools are vast, yet sometimes overlooked. Integrating AI technology into your workflow not only boosts productivity and leads to cost savings but also enhances decision-making processes, positioning your business for sustained success.\n\n\n\n![gJH6bgALpM6KwfI9W2SwJil8p5n5w5Uq4WI9Hz952go=](/blobs/gJH6bgALpM6KwfI9W2SwJil8p5n5w5Uq4WI9Hz952go=)\n\n\n* **AI-Driven Process Optimization Platform**: Develop a platform that uses AI to analyze business processes, identify bottlenecks, and suggest optimizations for repetitive tasks. This tool could offer tailored recommendations for automation, potentially integrating with existing software tools to implement these changes directly.\n\n\n* **Real-Time Analytics Dashboard**: Create a dashboard that leverages AI for real-time data analysis and reporting. This tool would provide businesses with instant insights into performance metrics, customer behavior, and market trends, enabling quick decision-making and strategy adjustments.\n\n\n* **AI-Powered Collaboration Hub**: Design an AI-powered platform that enhances team collaboration by intelligently managing project timelines, tasks, and [communications](https://affine.pro/blog/10-free-project-communication-plan-templates-examples). This hub could use natural language processing to summarize discussions, suggest action items, and even predict project risks based on team interactions.\n\n\n* **Automated Quality Assurance System**: Implement a system that uses AI to automatically review and check the quality of work produced, from code to content creation. By learning from past errors and inconsistencies, the system could help reduce mistakes and improve the overall quality of outputs.\n\n\n* **Bias Detection and Correction Tool**: Develop an AI tool specifically focused on identifying and correcting biases in data analysis and decision-making processes. This could be particularly useful in HR for recruitment and performance evaluations, ensuring decisions are based on objective criteria.\n\n\n* **Dynamic Resource Allocation Engine**: Create an AI engine that dynamically allocates resources based on project needs, employee skills, and availability. This tool would optimize team composition for various projects, ensuring the best fit and enhancing productivity.\n\n\n* **Predictive Trend Analysis Software**: Offer software that uses AI to analyze market data and predict emerging trends, giving businesses a head start in developing products or services that meet future demands. This could include sentiment analysis on social media and predictive modeling based on economic indicators.\n\n\n* **Customized Learning and Development Platform**: Build an AI-driven platform that personalizes learning and development opportunities for employees based on their skills, interests, and career aspirations. This tool could help in identifying skill gaps and recommending courses or projects to aid in professional growth.\n\n\n* **Intelligent Error Correction for Creative** [Work](https://affine.pro/blog/best-free-social-media-scheduler-tools-to-empower-workflow): Design an AI tool that assists in the creative process, such as writing or design, by suggesting improvements and corrections in real time. This could help enhance creativity while maintaining high standards of quality.\n\n\n* **AI-Assisted Customer Service Enhancements**: Implement AI tools that improve customer service through chatbots, personalized recommendations, and automated support ticket prioritization. This would not only improve customer satisfaction but also free up human agents to handle more complex inquiries.\n\n\nEach of these ideas leverages the strengths of AI in different aspects of business operations, from process optimization and decision-making to quality assurance and team collaboration, aiming to enhance efficiency, accuracy, and strategic insight.\n\n\n\n\n\n# **10 Top AI Productivity Tools Must Know of Two Category in 2024**\n\n\n\nAre you ready to take your workflow and business efficiency to the next level in 2024? With the rapid advancements in artificial intelligence, there are now a plethora of AI productivity tools available that can revolutionize the way you work. Let's delve into 10 must-known top AI productivity tools categorized for maximum impact.\n\n\nCategory one includes AI tools like AI-powered [writing assistant](https://affine.pro/blog/quillbot-alternatives-ai-writing), which helps enhance your written communication with advanced grammar and style suggestions.\n\n\n## **1. [Notion AI](https://www.notion.so/product/ai)**\n\n\n\n![aF1DFvPEtv0hX5DHz8C2F5tqs3DDFdEdjbbuS8vyQBk=](/blobs/aF1DFvPEtv0hX5DHz8C2F5tqs3DDFdEdjbbuS8vyQBk=)\n\n\nNotion AI comprises a suite of AI tools seamlessly integrated within Notion's collaborative workspace platform. These tools offer a range of functionalities, including summarizing lengthy texts, generating outlines for emails and blog posts, and transforming meeting notes into actionable items. Notion is renowned for its adaptability as a productivity tool, excelling in managing various tasks such as project management, documenting product information, and note-taking.\n\n\n**Key Features:**\n\n\n* Multilingual Conversion: Provides an intuitive solution for effortlessly translating words into different languages, enhancing accessibility and communication.\n\n\n* Automatic Summarization: Enables the automatic creation of summaries from lengthy texts, streamlining information processing and comprehension.\n\n\n* Grammar Correction: Ensures polished and error-free writing by identifying and correcting grammar errors, enhancing overall clarity and professionalism.\n\n\n\n\n\n## **2. [WordAi](https://wordai.com/)**\n\n\n\n![4uYrf7ODNxMrL0bhDuCZA6IhSw_DafZURIBdG4FLFF4=](/blobs/4uYrf7ODNxMrL0bhDuCZA6IhSw_DafZURIBdG4FLFF4=)\n\n\nWordAi emerges as an innovative writing tool leveraging AI to streamline content creation processes. By harnessing advanced algorithms and natural language processing, it simplifies the generation of high-quality, human-like text, including articles, blog posts, and product descriptions, with minimal effort. A standout feature of WordAi is its ability to produce AI-generated content that closely resembles human-written text, thus optimizing content output. The tool ensures grammatical accuracy and fluent readability through in-depth analysis of sentence and paragraph structures.\n\n\n**Key Features:**\n\n\n* Article Rewriting: Prioritizes article rewriting services, catering to users seeking enhanced content refinement.\n\n\n* Anti-Detection Mechanism: Features a dedicated section to prevent the detection of AI-generated content within spun articles, ensuring authenticity and originality.\n\n\n* Batch Upload Functionality: Enables users to efficiently upload multiple saved articles for rewriting, facilitating compliance with plagiarism standards such as Copyscape.\n\n\n\n\n\n## **3. [Grammarly](https://app.grammarly.com/)**\n\n\n\n![ZfSBppkNCUWCv2d58mapQZh3J-482xO6J7JJhk4c92k=](/blobs/ZfSBppkNCUWCv2d58mapQZh3J-482xO6J7JJhk4c92k=)\n\n\nGrammarly has evolved significantly beyond its initial role as a simple spelling and grammar checker, emerging as a leading free AI writing assistant with a dedicated and enthusiastic user base. One of Grammarly's standout features is its educational approach—it doesn't just highlight errors; it explains them. This unique feature enables users to grasp the reasoning behind suggested changes, fostering a learning environment with each writing session. Serving as an additional set of discerning eyes, Grammarly helps identify oversights that might evade your notice. Moreover, the tool goes beyond mere proofreading, assisting in strengthening your arguments by suggesting potential counterarguments and filling any content gaps effectively.\n\n\n**Key Features:**\n\n\n* AI Writer: Facilitates brainstorming content ideas, accelerating progress towards your communication objectives.\n\n\n* Polished Draft Prompts: Grammarly provides prompts for refining drafts, ensuring a polished final product.\n\n\n* Voice Assistance AI: Tailors your content by adjusting tone, formality, and professional context, enhancing overall clarity and impact.\n\n\n\n\n\n## **4. [Jasper AI](http://jasper.com/)**\n\n\n\n![5bnlHzsTW0NefPuJf4p_KOyrV1aEWNZe7UWNQ6ak_fo=](/blobs/5bnlHzsTW0NefPuJf4p_KOyrV1aEWNZe7UWNQ6ak_fo=)\n\n\nJasper AI is a software powered by ChatGPT 3.5, designed to streamline various writing tasks. Positioned as one of the top ChatGPT alternatives, Jasper AI enhances the business content creation experience by offering customizable templates. With continued usage, Jasper AI improves its capability to consistently deliver 100% satisfactory results. Notably, Jasper AI prioritizes originality and addresses concerns about plagiarism by providing a free, built-in plagiarism checker—a reliable companion for ensuring content integrity. While its primary focus lies in generating blog content, Jasper AI offers versatility, allowing users to create social media posts, articles, emails, ads, and more.\n\n\n**Key Features:**\n\n\n* Facilitates the generation of exceptional content tailored for business purposes.\n\n\n* Includes a built-in plagiarism checker to ensure content authenticity and integrity.\n\n\n* Enables users to generate multiple content pieces simultaneously, enhancing productivity and efficiency.\n\n\n## **5. [Rytr](https://rytr.me/)**\n\n\n\n![94AV9ulkC-L2pixavmilQpFfMOPwCaSW1FtNvfsbTu0=](/blobs/94AV9ulkC-L2pixavmilQpFfMOPwCaSW1FtNvfsbTu0=)\n\n\nRytr stands out as an AI-powered writing assistant, catering to users of all writing proficiency levels and enabling them to effortlessly create written content within minutes. With Rytr, users can easily provide descriptions and instructions for their desired tone, as its advanced AI technology generates unique and engaging content that mimics human writing. Renowned in the AI writing landscape, Rytr has earned recognition from G2 as one of the top brands in its category. Notably, users can customize different tones to align with various scenarios, projects, or clients.\n\n\n**Key Features:**\n\n\n* Document Management System: Efficiently organizes writing projects for seamless workflow management.\n\n\n* Multilingual Support: Supports over 30 languages, including English, Spanish, Chinese, Arabic, and more, ensuring accessibility to a diverse user base.\n\n\n* Magic Command Feature: Empowers users to issue specific and customized requests to the AI writer, enhancing flexibility and control over content generation.\n\n\n\n\n\nMoving on to category two, we have AI tools such as chatbot, a powerful conversational assistant that can automate customer support and improve response times.\n\n\n## **6. [ChatGPT](https://chat.openai.com/)**\n\n\n\n![oGsMXaAhWAqk7tqY7OrCkvXLYKugmD-8oyAAOn4GJnc=](/blobs/oGsMXaAhWAqk7tqY7OrCkvXLYKugmD-8oyAAOn4GJnc=)\n\n\nChatGPT stands as a sophisticated artificial intelligence model developed by OpenAI, rooted in the powerful GPT (Generative Pre-trained Transformer) architecture. Primarily, it aims to comprehend and generate text resembling human language based on the input it receives. Powered by state-of-the-art natural language processing (NLP) techniques, ChatGPT excels in conversational engagement, question answering, information provision, and even creative content generation.\n\n\n**Key Features:**\n\n\n* Natural Language Understanding: Demonstrating proficiency across a broad spectrum of topics, questions, and conversational styles, facilitating seamless interactions.\n\n\n* Contextual Responses: Ensuring coherence and relevance in conversations by generating responses based on the context provided.\n\n\n* Diverse Conversational Capability: From casual small talk to specialized subjects, ChatGPT adeptly engages in a wide array of conversational topics.\n\n\n\n\n\n## **7. [Bing AI (Microsoft Copilot)](https://www.bing.com/search?q=Bing+AI&showconv=1&FORM=hpcodx)**\n\n\n\n![L9Q6SYodxNP-x8zvaVSV-pujk327mXN3guUeQEZfLgk=](/blobs/L9Q6SYodxNP-x8zvaVSV-pujk327mXN3guUeQEZfLgk=)\n\n\nMicrosoft's collaboration with OpenAI has significantly enhanced Bing Search, introducing capabilities to search the web and generate answers based on retrieved results. This partnership extends to DALL·E 3, enriching the search experience with the ability to request images and receive four visual variations of the prompt. Notably, Microsoft is consolidating its AI offerings under the umbrella of Microsoft Copilot, marking a significant rebranding effort across its product line.\n\n\n**Key Features:**\n\n\n* Real-time Collaboration: Instant access to web search results and answer generation based on retrieved information, facilitating seamless collaboration.\n\n\n* Contextual Awareness: Understanding user queries to deliver relevant and accurate responses tailored to the context of the search, enhancing the user experience.\n\n\n* Image Request Functionality: Enabling users to request images and receive multiple visual variations of their prompts, further enriching the search experience.\n\n\n\n\n\n## **8. [Claude 2](https://www.anthropic.com/news/claude-2)**\n\n\n\n![WZMpGDL8KF3ab1NXuFiwTn04BYbOkuhuigUsRCZzKeA=](/blobs/WZMpGDL8KF3ab1NXuFiwTn04BYbOkuhuigUsRCZzKeA=)\n\n\nAnthropic's chatbot, Claude 2, is renowned for its safety measures and creative prowess. With an impressive memory capacity, Claude 2 can retain up to 150,000 words in each conversation, enabling extensive and detailed discussions of complex problems or seamless interactions with uploaded PDF files. Moreover, users can leverage Claude 2's integration with Zapier to connect to thousands of other apps, enhancing automation possibilities and workflow customization.\n\n\n**Key Features:**\n\n\n* Extensive Memory Capacity: Claude 2 can store up to 150,000 words in each conversation, facilitating in-depth discussions and comprehensive information retention.\n\n\n* PDF Upload Capability: Users can effortlessly upload PDF files to Claude 2 and ask questions, ensuring easy access to relevant information and resources.\n\n\n* Seamless Integration with Zapier: Claude 2 seamlessly connects with thousands of other apps through Zapier, empowering users to automate tasks and customize workflows according to their specific needs.\n\n\n\n\n\n## **9. [Perplexity AI](https://www.perplexity.ai/)**\n\n\n\n![ER_icREzVYhCjUwrl_BYvz4xmsbT6v6yQ-r5u3929ag=](/blobs/ER_icREzVYhCjUwrl_BYvz4xmsbT6v6yQ-r5u3929ag=)\n\n\nPerplexity AI harnesses cutting-edge AI technology, leveraging ChatGPT and a diverse range of language models to deliver articulate responses to user inquiries. Positioned as an AI-driven search engine, Perplexity AI provides real-time, data-centric answers to queries. Notably, the software prioritizes transparency by consistently attributing the source of information—a feature particularly valuable for researchers and academics seeking verifiable data. Moreover, users can enhance their queries by attaching files, enabling Perplexity AI to analyze PDFs and offer nuanced insights. However, it's important to note the limitations of Perplexity AI. Primarily, it lags behind ChatGPT in response generation speed, and its language support is currently limited to English, which may pose challenges for non-English-speaking users.\n\n\n**Key Features:**\n\n\n* Offers answers based on the most up-to-date information.\n\n\n* Ensures transparency by consistently attributing the source of information.\n\n\n* Automatically summarizes complex answers to facilitate comprehension.\n\n\n\n\n\n## **10. [Lyro](https://www.tidio.com/chatbot-ai/)**\n\n\n\n![n79WemzawjTs0bGy54FvEWWtVSf1rVI31Yti6lBWEI8=](/blobs/n79WemzawjTs0bGy54FvEWWtVSf1rVI31Yti6lBWEI8=)\n\n\nLyro epitomizes cutting-edge conversational AI, meticulously crafted to seamlessly engage with your customers by leveraging your existing support content. Revered for its proficiency in enhancing customer support and augmenting sales, Lyro stands as a premier conversational AI chatbot, driven by deep learning algorithms. Functioning as an intuitive presence on your website, it effortlessly initiates and sustains natural conversations, requiring minimal training. Impressively, Lyro autonomously learns from your data, adeptly addressing up to 80% of frequently asked questions (FAQs), thereby streamlining operational efficiency without incurring additional hiring costs. With its round-the-clock availability, Lyro ensures uninterrupted accessibility to customers, thereby maximizing sales opportunities.\n\n\nKey Features:\n\n\n* Self-Training AI: Lyro's chatbot automatically learns from interactions to handle up to 80% of FAQs, reducing the need for manual training and cutting labor costs.\n\n\n* 24/7 Availability: It operates non-stop, engaging with customers at any time, ensuring continuous service and no missed sales opportunities.\n\n\n* Natural Conversations: Equipped with advanced NLP technology, the bot conducts smooth and natural dialogues, enhancing user experience on your website.\n\n\n\n\n\nThese innovative AI productivity tools are game-changers in boosting your workflow efficiency and driving business growth. Stay ahead of the curve by incorporating these cutting-edge technologies into your daily operations for a competitive edge in 2024.\n\n\n\n\n\n# Embrace Innovation: Enhancing Workflows and Business Performance with AI Tools in 2024\n\n\nAs we enter the realm of 2024, the undeniable influence of AI tools on productivity and business operations becomes increasingly apparent. Embracing the capabilities of artificial intelligence applications offers a pathway to revolutionize your workflow and foster unparalleled growth for your business. If you're looking to take your performance to the next level, we recommend checking out [AFFiNE AI](https://affine.pro/). This tool combines popular AI chatbots and AI-powered writing tools to help you unlock a world of possibilities and achieve your goals. Give it a try and see what it can do for you!\n\n\n<div style=\"text-align:center;\">\n<iframe width=\"560\" height=\"315\" src=\"https://www.youtube.com/embed/WqOe9HgpsDY?si=PHGuSeRbOT9GxuPO\" title=\"YouTube video player\" frameborder=\"0\" allow=\"accelerometer; autoplay; clipboard-write; encrypted-media; gyroscope; picture-in-picture; web-share\" allowfullscreen></iframe>\n</div>\n\n\nAFFiNE AI revolutionizes content creation by offering immediate insights, effortless content refinement, and enhanced creativity through dynamic mind maps and polished presentation slides. It empowers users to envision grand ideas, boost productivity, and streamline workflows, ultimately saving valuable time on every endeavour. Whether brainstorming ideas, crafting presentations, or sketching visuals, AFFiNE AI amplifies creativity and upgrades workflow efficiency. It combines the functionalities of Notion AI, Miro AI, Figma AI, Canva AI, and Clickup AI into one comprehensive platform.\n\n\n**Best Features of AFFiNE AI:**\n\n\n* **AI Chatbox:** Instantly access insights and support across projects with AFFiNE AI's intuitive chatbox. Seamlessly integrated into documents and whiteboards, it provides real-time assistance and acceleration. Whether brainstorming ideas or organizing tasks, users can simply ask questions and receive immediate responses. For instance, jot down daily tasks on one page and inquire about plans for the day on another using the chatbox.\n\n\n\n![TixIkRzZgGOIrsqcfRoj1ZrH4_tQmDu27NQGaKyOR7U=](/blobs/TixIkRzZgGOIrsqcfRoj1ZrH4_tQmDu27NQGaKyOR7U=)\n\n\n* **AI-Generated Visuals:** Elevate presentations and content creation with AFFiNE AI's unparalleled visual capabilities. Craft polished, presentation-ready slides with just one click, eliminating tedious manual design work. From drawing images for articles to creating mind maps, flow charts, or professional slides, AFFiNE AI simplifies the process, allowing users to focus on content rather than formatting.\n\n\n\n![uLPLW1mOWz9QB-t3JOzIPWbHWNWTxiz9bLWL7xUXqWU=](/blobs/uLPLW1mOWz9QB-t3JOzIPWbHWNWTxiz9bLWL7xUXqWU=)\n\n\n* AI Writer: Perfect writing effortlessly with AFFiNE AI's advanced AI Writer feature. Say goodbye to spelling and grammar errors, tone inconsistencies, and lengthy editing sessions. With AFFiNE AI, users can translate content, adjust length, improve clarity, generate action items, and create drafts, outlines, or timelines with ease. Whether crafting social media posts or penning creative stories, AFFiNE AI empowers users to express themselves confidently and efficiently.\n\n\n\n![XhwBfbXzNmPOjL70F28JGgQizULkEy6j45lW63QPypE=](/blobs/XhwBfbXzNmPOjL70F28JGgQizULkEy6j45lW63QPypE=)\n\n\nFrom automating repetitive tasks to unveiling invaluable insights through data analysis, AI tools present a myriad of benefits crucial for thriving in today's competitive landscape. Embrace these cutting-edge technologies and experience firsthand how they elevate your efficiency to unprecedented heights.\n\n\n**But don’t take our word for it. Try AFFiNE for yourself to see if we deserve this spot on the list. AFFiNE AI will be launched soon. Please stay tuned! Come and join us on our journey over on our media platforms. 🚀**\n\n\n* Official Website: [https://affine.pro/](https://affine.pro/)\n\n\n* GitHub: [https://github.com/toeverything/AFFiNE](https://github.com/toeverything/AFFiNE)\n\n\n* Discord: [https://discord.gg/Arn7TqJBvG](https://discord.gg/Arn7TqJBvG)\n\n\n* Twitter: [https://twitter.com/AffineOfficial](https://twitter.com/AffineOfficial)\n\n\n\n\n\n",
  "publish": true
}