{
  "title": "10 Best Free Risk Assessment Templates and Examples for 2024",
  "authors": [
    "Yiyang Zhang"
  ],
  "tags": [
    "Content"
  ],
  "description": "Unravel the elegance of the inventory template for your need. Discover the 10 best templates to upgrade your work efficiency in 2024.",
  "created": 1692662400000,
  "updated": 1704153600000,
  "layout": "blog",
  "id": "ieCufMYZSn",
  "slug": "10-best-free-risk-assessment-templates-examples-2023",
  "cover": "/blobs/m3SGotpYsRX7BP9X_1PvOmZ7p946kDJt3cDxcVF2NXk=",
  "md": "---\n\n\ntitle: \"10 Best Free Risk Assessment Templates and Examples for 2024\"\n\n\nauthor: Yiyang Zhang\n\n\ntags: Content\n\n\nslug: 10-best-free-risk-assessment-templates-examples-2023\n\n\ndescription: \"Unravel the elegance of the inventory template for your need. Discover the 10 best templates to upgrade your work efficiency in 2024.\"\n\n\ncreated: 2023-08-22\n\n\nupdated: 2024-01-02\n\n\nlayout: blog\n\n\npublish: true\n\n\n---\n\n\n\n![m3SGotpYsRX7BP9X_1PvOmZ7p946kDJt3cDxcVF2NXk=](/blobs/m3SGotpYsRX7BP9X_1PvOmZ7p946kDJt3cDxcVF2NXk=)\n\n\nAre you ready to tackle risks head-on and ensure the safety and success of your projects?\n\n\nWhere do you start to identify, evaluate and mitigate potential hazards when work out a [project](https://affine.pro/blog/how-to-write-best-agile-project-charter-template-streamline-your-workflow-2023)?\n\n\nThat's where risk assessment templates come in. These handy resources provide a structured framework for assessing risks in various industries and scenarios. In this article, we'll explore what makes a good risk assessment template, and we'll share with you the 10 best free options available for 2024. Whether you're managing a construction project or running a small business, these templates will streamline your risk assessment process and enable you to take proactive steps towards minimizing threats.\n\n\n### What is a Risk Assessment Template\n\n\nA risk assessment template is a pre-designed document or framework that guides you through the process of identifying, analyzing, and [managing](https://affine.pro/blog/free-lessons-learned-templates-for-project-management) risks within your organization. Typically, it contains sections that identify specific risks, assess likelihood and severity, design control measures, and formulate contingency plans. In evaluating potential threats, the risk assessment template serves as a roadmap to ensure that all relevant factors are considered.\n\n\nWith risk assessment templates at your disposal, you can [streamline](https://affine.pro/blog/how-to-write-best-agile-project-charter-template-streamline-your-workflow-2023) your risk management processes and make informed decisions about how best to mitigate potential hazards. By leveraging templates effectively, you'll be better equipped to protect against threats while maximizing opportunities for success.\n\n\n### What Makes a Good Risk Assessment Template\n\n\nA good risk assessment template is one that effectively identifies, evaluates, and mitigates potential risks within a given context. It should provide a clear structure for assessing risks, documenting findings, and formulating appropriate actions.\n\n\n\n![W2GhJ7d0lGFhhKKZWlv43tGrx7xk557QqGM_g8sj7ew=](/blobs/W2GhJ7d0lGFhhKKZWlv43tGrx7xk557QqGM_g8sj7ew=)\n\n\n* **Be comprehensive**. It should cover all relevant areas of concern specific to the industry or project at hand. This ensures that no potential risks are overlooked during the evaluation process.\n\n\n* **Be user-friendly and easy to navigate**. Clear instructions and prompts can help guide users through each step of the assessment, making it accessible to individuals with varying levels of expertise in risk management.\n\n\n* **Incorporate flexibility**. Each organization or project may have unique characteristics that require customization of the template to ensure accurate assessments.\n\n\n* **Prioritize risks**. These risks are based on their likelihood and impact on business operations or project success.\n\n\nA good risk assessment template encourages ongoing review and updates as circumstances change over time.\n\n\n### 10 Best Free Risk Assessment Templates & Examples for 2024\n\n\nWhen it comes to risk assessment, having a reliable and effective template can make all the difference. In 2024, there are several free templates available that can help streamline your risk assessment process and ensure comprehensive coverage.\n\n\n1.**[AFFiNE](https://affine.pro/) Basic Risk Assessment Template**\n\n\n\n![yoWxzyf-hCESzS1I6bw3sHj0zpm_ctxQZ3WEn1RjC8s=](/blobs/yoWxzyf-hCESzS1I6bw3sHj0zpm_ctxQZ3WEn1RjC8s=)\n\n\nAFFiNE's basic risk assessment template allows you to identify hazards, assess risks, and implement control measures. As well as a section for detailing a risk mitigation action plan, if further action is required, the customizable form includes a description of the risk, its source, existing control measures, and its level.\n\n\n2.**[AFFiNE](https://affine.pro/) Risk Assessment and Control Template**\n\n\n\n![lrRHpTctpLBACNg0uw3AkSZeCeSj9yYJcikhCCIMdhE=](/blobs/lrRHpTctpLBACNg0uw3AkSZeCeSj9yYJcikhCCIMdhE=)\n\n\nAFFiNE risk assessment and control template provide a high-level view of potential risks and hazards. It includes descriptions of control measures, frequency of controls, and who is responsible for maintaining all up-to-date controls.\n\n\n3.**[WPS](https://www.wps.com/) Self-evaluation Risk Assessment Form Template**\n\n\n\n![rUoxPVd9iPwKHolmVLTkYR2eULYskZ5AXApZUWqht9I=](/blobs/rUoxPVd9iPwKHolmVLTkYR2eULYskZ5AXApZUWqht9I=)\n\n\nThe purpose of the WPS Self-evaluation risk assessment form template is to identify or evaluate one's own abilities. In this template, questions are asked and the individual must answer them in order to be evaluated.\n\n\n4.**[WPS](https://www.wps.com/) Accounting Risk Assessment Template**\n\n\n\n![5See68z8eRuevnOb3o7OL_2XKDpxzqvI743vr9UhI28=](/blobs/5See68z8eRuevnOb3o7OL_2XKDpxzqvI743vr9UhI28=)\n\n\nWPS accounting risk assessment template is used for assessing an individual in a workplace. It evaluates an individual in a company and how much knowledge he has of finance. There are columns for evaluating indicators, assessment indexes, weights, ratings, criteria, and individual analysis.\n\n\n5.**[Smartsheet](https://affine.pro/blog/top-advanced-smartsheet-alternatives-project-management-2023) Job Risk Assessment Template**\n\n\n\n![uwtCIdG6eII3gExNu9VqxeXkYMRPXkJsWChPc5TTuFY=](/blobs/uwtCIdG6eII3gExNu9VqxeXkYMRPXkJsWChPc5TTuFY=)\n\n\nSmartsheet job risk assessment template helps users classify jobs by department, project, or another relevant category. In accordance with existing security measures, record the hazards associated with each job, the resources impacted, the existing controls, and the probability and likelihood of each risk.\n\n\n6.**[Smartsheet](https://affine.pro/blog/top-advanced-smartsheet-alternatives-project-management-2023) Event Assessment Template**\n\n\n\n![aYSZUYaunoI-Rky_L7uO4lL4c9Xsshjqyju_3iNI2i8=](/blobs/aYSZUYaunoI-Rky_L7uO4lL4c9Xsshjqyju_3iNI2i8=)\n\n\nSmartsheet event risk assessment template helps users identify and classify potential risks for an event using this customizable template. Determine if any further action is needed to mitigate each risk and detail existing control measures.\n\n\n7.**[ClickUp](https://clickup.com/) Pi Planning Risk Assessment Template**\n\n\n\n![pFLe2KYAaXaU55u613-xDCAr2hzKWDcHXB_XywHAK2s=](/blobs/pFLe2KYAaXaU55u613-xDCAr2hzKWDcHXB_XywHAK2s=)\n\n\nWith ClickUp's Pi planning template, you will get a clear picture of your pi planning process with step-by-step frames that guide you through the whole risk assessment process. The template provides you with a clear picture of your team members' backlog, including capacity, workload, and risks.\n\n\n8.**[ClickUp](https://clickup.com/) Value Risk Assessment Matrix Example**\n\n\n\n![wuP-H-WBndOuR48oXzIEDWVLIfILZsyiF6T7ZPLRi5c=](/blobs/wuP-H-WBndOuR48oXzIEDWVLIfILZsyiF6T7ZPLRi5c=)\n\n\nClickUp’s Value Risk Matrix Template to can be used to go over each possible risk that might arise. Since it's a simple template, it's easy to walk through the process and fill out the value risk matrix quickly, so it's a great way to practice proactive risk management.\n\n\n9.[ProjectManager](https://www.projectmanager.com/) Excel Risk Assessments Matrix Template\n\n\n\n![K3cHM1_qGsO9fPbyOfO9Iewt87cV2ifdjF_LX2eZPno=](/blobs/K3cHM1_qGsO9fPbyOfO9Iewt87cV2ifdjF_LX2eZPno=)\n\n\nWith Project Manager risk assessment matrix template, you can use any potential threat and determine its impact and extent on a specific project. This template helps you start a risk management process to identify and correct problems before they become serious.\n\n\n10.**[ProjectManager](https://www.projectmanager.com/) IT Risk Assessment Template**\n\n\n\n![w0RHezGy4iEGn67vbrtM-xnM8NtLtt4XguEXRYNOq0A=](/blobs/w0RHezGy4iEGn67vbrtM-xnM8NtLtt4XguEXRYNOq0A=)\n\n\nWith the Project Manager IT risk assessment template, you can take into consideration the number of equipment and personnel needed to continue operating, as well as how long it takes to restore the data or system functionality.\n\n\nRemember that these templates serve as starting points but should be tailored according to your specific needs.\n\n\n### Mapping out a Dynamic Risk Assessment Plan with AFFiNE\n\n\nBe proactive about [managing](https://affine.pro/blog/15-best-free-jira-alternatives-agile-project-management-2023) risks because prevention is better than cure! Remember that while risk assessment templates provide a great starting point for conducting assessments systematically; they should always be customized according to your specific needs. And when it comes down to mapping out a dynamic risk assessment plan that keeps pace with evolving threats is of great importance – don't hesitate. Try AFFiNE now!\n\n\n**Key features:**\n\n\n1.**[Database](https://affine.pro/blog/affine-070-launch-week-day3):** Easily create, organize, and track your daily tasks like never before. Say goodbye to complex processes and welcome an unprecedented ease-of-use way.\n\n\n\n![wzNppJMgVjC8ThVR9TlhVkPu5OXTEsEsqnuv-Xmrr0g=](/blobs/wzNppJMgVjC8ThVR9TlhVkPu5OXTEsEsqnuv-Xmrr0g=)\n\n\n2.**On-page function:** With the On-page function, you can easily hide specific notes on the edgeless mode when switching to page mode with just a single click.\n\n\n\n![ZETGazT_BPkhNQd63eLKwKik3ebNScmlrNx6njd0aBo=](/blobs/ZETGazT_BPkhNQd63eLKwKik3ebNScmlrNx6njd0aBo=)\n\n\n3.**Blockslicer:** To provide you with enhanced customization options, AFFiNE has a pair of scissors that allows you to divide your agenda into as many pieces as you desire, opening up more possibilities for the layout of edgeless mode.\n\n\n\n![3TFGwfygZi1ykMGTGdJOvICIyYvtWg3FW-z7bKEVDhM=](/blobs/3TFGwfygZi1ykMGTGdJOvICIyYvtWg3FW-z7bKEVDhM=)\n\n\nWhile each of the wonderful inventory templates discussed offers its own appealing features, with a humble perspective, we still propose that **AFFiNE** emerges as the best tool, providing a comprehensive and versatile solution for managing inventory workflow and goals, catering to a wide range of user requirements. **AFFiNE** is free to try! Currently, **AFFiNE** has released its [stable version](https://affine.pro/download), but we are continuing to build to a more feature-rich and stable build. **Come and join us on our journey over on our media platforms.**\n\n\n* Official Website: [https://affine.pro/](https://affine.pro/)\n\n\n* GitHub: [https://github.com/toeverything/AFFiNE](https://github.com/toeverything/AFFiNE)\n\n\n* Discord: [https://discord.gg/Arn7TqJBvG](https://discord.gg/Arn7TqJBvG)\n\n\n* Twitter: [https://twitter.com/AffineOfficial](https://twitter.com/AffineOfficial)\n\n\n\n\n\n",
  "publish": true
}