{
  "title": "10 Best Free AI Virtual Assistants to Improve Productivity in 2024",
  "authors": [
    "Yiyang Zhang"
  ],
  "tags": [
    "Content"
  ],
  "description": "Enhance your productivity with the top 10 free AI virtual assistants for 2024. Find the perfect fit for your workflow improvement.",
  "created": 1710115200000,
  "updated": 1710115200000,
  "layout": "blog",
  "id": "KBB9bQYgaxCSCQEE-nJ3E",
  "slug": "10-best-free-ai-virtual-assistants-improve-productivity",
  "cover": "/blobs/lSyxyE7C9DtW5rESi0Rn0eYlxLxDo72gxJ1Kz117lqk=",
  "md": "---\n\n\ntitle: \"10 Best Free AI Virtual Assistants to Improve Productivity in 2024\"\n\n\nauthor: \"Yiyang Zhang\"\n\n\ntags: Content\n\n\nslug: 10-best-free-ai-virtual-assistants-improve-productivity\n\n\ndescription: \"Enhance your productivity with the top 10 free AI virtual assistants for 2024. Find the perfect fit for your workflow improvement.\"\n\n\ncreated: 2024-03-11\n\n\nupdated: 2024-03-11\n\n\nlayout: blog\n\n\npublish: true\n\n\n---\n\n\n\n![lSyxyE7C9DtW5rESi0Rn0eYlxLxDo72gxJ1Kz117lqk=](/blobs/lSyxyE7C9DtW5rESi0Rn0eYlxLxDo72gxJ1Kz117lqk=)\n\n\nAre you ready to supercharge your productivity and [streamline your workflow](https://affine.pro/blog/best-free-social-media-scheduler-tools-to-empower-workflow) in 2024?\n\n\nSay hello to the future of efficiency with AI virtual assistants! These digital helpers are here to revolutionize the way you work, communicate, and [organize your tasks](https://affine.pro/blog/best-8-free-event-planning-templates-checklists-customize). In this article, we'll explore how AI virtual assistants can elevate your writing skills and unveil the top 10 free tools that will take your productivity to new heights. Get ready to meet your new favorite work companion!\n\n\n### **In this post, we'll cover the 10 best AI virtual assistants:**\n\n\n1. **Siri**\n\n\n1. **Google Assistant**\n\n\n1. **Alexa**\n\n\n1. **Vonage**\n\n\n1. **Bixby**\n\n\n1. **Rytr**\n\n\n1. **Aido**\n\n\n1. **Writerly.ai**\n\n\n1. **ChatGPT**\n\n\n1. **Socratic**\n\n\n# **What Makes an Agile AI Virtual Assistant?**\n\n\nAn agile AI virtual assistant is a digital tool that can perform a variety of tasks efficiently. These intelligent assistants are quick to adapt to your needs, whether it's [scheduling meetings](https://affine.pro/blog/top-10-best-agile-project-scheduling-software-2023), setting reminders, or drafting emails. They learn and improve over time, which sets them apart from traditional tools.\nAI virtual assistants are equipped with advanced natural language processing capabilities, which enable them to understand complex commands and context. This makes interactions more seamless and user-friendly. They can analyze data quickly and provide valuable insights and recommendations that enhance decision-making processes. Additionally, their integration with other apps and platforms ensures a smooth workflow across different systems.\n\n\nThe agility of AI virtual assistants lies in their ability to multitask without compromising accuracy or speed. By [automating repetitive tasks](https://affine.pro/blog/top-10-best-free-digital-planner-apps-2023) and handling mundane activities, they free up valuable time for users to focus on high-priority projects. In essence, an agile AI virtual assistant is a dynamic that empowers you to work smarter, not harder.\n\n\n# **How Can An AI Virtual Assistant Improve Your Writing?**\n\n\n\n![1RHcLSKKAO87hmn8SqxTK9uiP0ZXwdZNOUcJX0O_hfg=](/blobs/1RHcLSKKAO87hmn8SqxTK9uiP0ZXwdZNOUcJX0O_hfg=)\n\n\n* **Real-Time Feedback:** Receive instantaneous suggestions for refining grammar, punctuation, and style, transforming your writing into polished prose.\n\n\n* **Digital Writing Coach:** Benefit from personalized guidance, as AI assistants offer constructive feedback to enhance clarity and effectiveness, serving as a reliable companion throughout the writing process.\n\n\n* **Ideation and Planning Support:** Utilize advanced algorithms to generate ideas, [organize thoughts](https://affine.pro/blog/10-best-flowchart-software-tools-2023-features-pricing), and recommend relevant research sources, streamlining brainstorming and planning stages with efficiency and precision.\n\n\n* **Proofreading Assistance:** Leverage AI's prowess in detecting spelling errors, typos, and inconsistencies, ensuring your work is impeccably polished before submission or publication.\n\n\n* **Enhanced Productivity:** By automating manual editing processes, AI virtual assistants enable you to focus more on crafting compelling narratives, significantly boosting productivity levels and empowering you to write with confidence.\n\n\n# **Top Recommendations: 10 Best Free AI Virtual Assistants to Try**\n\n\nWhen it comes to boosting productivity and efficiency, having the right AI virtual assistant can make a world of difference. With so many options available, finding the perfect one for your needs is essential.\n\n\n### **[Siri](https://www.apple.com/siri/)**\n\n\n\n![hvhM4a8socZSON4q6e8pPD-A0BChtuNAQVXS_QdvbaU=](/blobs/hvhM4a8socZSON4q6e8pPD-A0BChtuNAQVXS_QdvbaU=)\n\n\nSiri is a virtual assistant that runs on Apple devices and can be operated by voice commands. It allows users to get information, perform tasks, and execute commands through voice interaction. Being one of the most well-known AI assistants, Siri uses a natural language user interface (UI) and voice queries to perform several useful functions. Siri is available on major Apple platforms such as IOS, macOS, and iPadOS. It is highly personalized, adapting to users’ languages, searches, preferences, and more.\n\n\n**Key features:**\n\n\n* Integration with the Apple ecosystem, including seamless communication with other Apple devices.\n\n\n* Natural language processing capabilities for understanding user commands and queries.\n\n\n* Continuously improving with regular updates and enhancements.\n\n\n### **[Google Assistant](https://assistant.google.com/)**\n\n\n\n![746F3A1aafSbyq2D3A_bpXLr6-_4yG-DCNl3-vyYZE8=](/blobs/746F3A1aafSbyq2D3A_bpXLr6-_4yG-DCNl3-vyYZE8=)\n\n\nGoogle Assistant is available on Android devices as well as Google Home devices and provides personalized assistance and information retrieval to users. Since its launch in 2016, Google Assistant has emerged as one of the top voice-powered virtual assistants in the market today, backed by one of the world’s leading companies. Among the various AI assistants available, Google Assistant is considered to be one of the most advanced, thanks to its partnerships with several companies. It can now be accessed through many devices such as smartphones, headphones, home appliances, and cars.\n\n\n**Key features:**\n\n\n* Wide range of features and integrations, including access to Google's vast array of services.\n\n\n* Excellent voice recognition and contextual understanding, allowing for conversational interactions.\n\n\n* Seamless integration with Google services like Gmail, Calendar, and Maps.\n\n\n\n\n\n### **[Alexa](https://www.amazon.com/b?ie=UTF8&node=21576558011)**\n\n\n\n![54v3tf6DiZwQM36YCwMXb_nlNhH2Z-vBmNxkViuCW0w=](/blobs/54v3tf6DiZwQM36YCwMXb_nlNhH2Z-vBmNxkViuCW0w=)\n\n\nAmazon's Alexa has become one of the most popular AI-powered virtual assistants in recent years. It is available on various devices and can perform tasks through voice interaction, natural language processing, voice queries, and more. Users can create [to-do lists](https://affine.pro/blog/top-12-to-do-list-excel-templates-examples-free-download), set alarms, play audiobooks, and stream podcasts. Additionally, Alexa provides real-time information on traffic, news, weather, sports, and other topics. One of the unique features of Alexa is its wake-up word, which enables users to activate it with a single word, distinguishing it from other devices that require a button press. Currently, Alexa is being used on over 100 million devices.\n\n\n**Key features:**\n\n\n* Extensive third-party skills and smart home device integrations, enabling users to perform a wide variety of tasks.\n\n\n* Advanced capabilities for smart home automation, including music playback and audiobooks\n\n\n* Constant updates and new features, expanding its functionality over time.\n\n\n\n\n\n### **[Vonage](https://www.vonage.hk/unified-communications/features/ai-virtual-assistant/)**\n\n\n\n![Febqj7-ouqms8QluFZQDMWDKgzpj56MBJRmrsWrXQVI=](/blobs/Febqj7-ouqms8QluFZQDMWDKgzpj56MBJRmrsWrXQVI=)\n\n\nVonage is a highly rated VoIP service provider, ranking fourth on our list of the best VoIP software providers. It offers a wide range of features that can be scaled up to meet the growing needs of [small businesses](https://affine.pro/blog/10-best-b2b-social-media-marketing-strategies). The service boasts robust onboarding solutions that can help your team get familiar with the service quickly and efficiently. Vonage is an excellent choice for businesses, especially those operating in the retail and customer service industries.\n\n\n**Key features:**\n\n\n* Allow sending and receiving faxes through your online account, email, or both.\n\n\n* Video chat is essential for a hybrid workforce.\n\n\n* Block unwanted calls from spammers, so your business line isn't busy when it shouldn't be.\n\n\n### **[Bixby](https://www.samsung.com/us/apps/bixby/)**\n\n\n\n![fYhpeL_G7EmNwBL59hYKmldoyTuurD39TAaG_nbd8hk=](/blobs/fYhpeL_G7EmNwBL59hYKmldoyTuurD39TAaG_nbd8hk=)\n\n\nBixby is Samsung's virtual assistant that can be found on Samsung smartphones, TVs, and other devices. It enables users to control their devices using voice commands, receive personalized assistance, and interact with their devices. Bixby was designed to work seamlessly across various Samsung products and is even integrated into other devices such as Samsung's Family Hub fridges and TVs. As a voice assistant, users can interact with it using their voice.\n\n\n**Key features:**\n\n\n* Deep integration with Samsung devices and services, including control over device settings and features.\n\n\n* Enhanced functionality for Samsung device control, such as adjusting settings and launching apps via voice commands.\n\n\n* Continuously evolving with updates to [improve performance](https://affine.pro/blog/10-best-free-performance-review-templates-examples-2023) and expand capabilities.\n\n\n### **[Rytr](https://rytr.me/)**\n\n\n\n![94AV9ulkC-L2pixavmilQpFfMOPwCaSW1FtNvfsbTu0=](/blobs/94AV9ulkC-L2pixavmilQpFfMOPwCaSW1FtNvfsbTu0=)\n\n\nRytr is an AI-powered writing assistant that helps users of all writing proficiency levels create written content in a matter of minutes. With Rytr, you can easily provide descriptions and instructions for the desired tone. The AI technology of Rytr generates unique and engaging content that sounds like it's written by a human, not a machine. In the AI writing space, Rytr is recognized by G2 as one of the top brands. You can also customize different tones to match various scenarios, projects, or clients.\n\n\n**Key features:**\n\n\n* A [document management](https://affine.pro/blog/10-best-free-online-table-maker-tools-2023) system helps to efficiently organize writing projects.\n\n\n* Supports over 30 languages including English, Spanish, Chinese, Arabic, and more.\n\n\n* The Magic Command feature empowers users to issue specific and customized requests to the AI writer.\n\n\n### **[Aido](https://aidorobot.com/)**\n\n\n\n![6nRGHw-sYSS7hbkAWYJoFYy3YrQVHg_1MvIaGmZYfJ0=](/blobs/6nRGHw-sYSS7hbkAWYJoFYy3YrQVHg_1MvIaGmZYfJ0=)\n\n\nAido aims to improve the quality of life for humans by providing affordable and easy-to-use robotics and automation products. Aido is a modular service robot designed for households, hospitality, healthcare, and retail. He can play with your kids, help you with household chores, manage your schedule, and keep your home connected and safe.\n\n\n**Key features:**\n\n\n* Advanced medical device compatibility, connecting and configuring inputs from custom medical devices.\n\n\n* Companion for older adults, keeping families close.\n\n\n* Equipped with a multimedia projector that can convert any wall into a movie screen.\n\n\n### **[Writerly.ai](https://www.writerly.ai/)**\n\n\n\n![VRjazRxeHfRmW3Qs-JuAiEALx8N7aGKjeP7RcS9yRyQ=](/blobs/VRjazRxeHfRmW3Qs-JuAiEALx8N7aGKjeP7RcS9yRyQ=)\n\n\nWriterly.ai is a well-known AI writing assistant that helps users create unique and high-quality content in less time than it would take to write manually. It is a powerful productivity software that is easy to use. Trusted by over a million organizations and creators worldwide, Writerly uses generative AI to [improve business outcomes](https://affine.pro/blog/how-to-build-go-to-market-strategy-free-templates). The no-code cloud platform is suitable for individual creators and large enterprise teams.\n\n\n**Key features:**\n\n\n* Unlimited output and intelligent brand personas.\n\n\n* Advanced SEO optimization.\n\n\n* Supports more than 25 languages.\n\n\n\n\n\n### **[ChatGPT](https://chat.openai.com/)**\n\n\n\n![oGsMXaAhWAqk7tqY7OrCkvXLYKugmD-8oyAAOn4GJnc=](/blobs/oGsMXaAhWAqk7tqY7OrCkvXLYKugmD-8oyAAOn4GJnc=)\n\n\nChatGPT is an advanced artificial intelligence model, developed by OpenAI, which is based on the GPT (Generative Pre-trained Transformer) architecture. Its main objective is to understand and generate human-like text based on the input it receives. ChatGPT utilizes cutting-edge natural language processing (NLP) techniques, which enable it to engage in conversations, answer questions, provide information, and even generate [creative content](https://affine.pro/blog/free-best-8-storyboard-templates-examples).\n\n\n**Key features:**\n\n\n* Natural Language Understanding, comprehends a wide range of topics, questions, and conversational styles, allowing for fluid interactions.\n\n\n* Responses are based on context, maintaining coherence and relevance in conversations.\n\n\n* Capable of engaging in diverse conversations ranging from casual chit-chat to more specialized topics.\n\n\n\n\n\n### **[Socratic](https://socratic.org/)**\n\n\n\n![dT6B4EmZ3YIWfFBRxDMgxPNfJNh-PnkG6IDFbC1dS3I=](/blobs/dT6B4EmZ3YIWfFBRxDMgxPNfJNh-PnkG6IDFbC1dS3I=)\n\n\nSocratic is one of the most popular AI-powered educational assistants. It is an app that helps students with their math and homework. The app allows students to take pictures of their work with their phone camera and then uses AI to offer visual explanations of the concepts. Socratic relies on text and speech recognition and can be used for different subjects such as science, math, literature, and social studies. The app can be downloaded on both iOS and Android, and it is compatible with the iPad.\n\n\n**Key features:**\n\n\n* Built to support all subjects.\n\n\n* Natural language understanding capabilities.\n\n\n* Continuously improving with updates.\n\n\n\n\n\n# Make You More Productive with an AI Virtual Assistant\n\n\nEmbracing an AI virtual assistant can truly revolutionize the way you work and boost your productivity to new heights. With the 10 best free AI virtual assistants mentioned in this article, you have a plethora of options to choose from based on your specific needs. From enhancing your writing skills to streamlining your tasks, these virtual assistants are here to make your life easier. By the way, [**AFFiNE**](https://affine.pro/) AI is right on the way!\n\n\n\n![eHMyjy-Aq0AI9SYHlhHyIDFftXVQdEFUwt8PTqLtrVE=](/blobs/eHMyjy-Aq0AI9SYHlhHyIDFftXVQdEFUwt8PTqLtrVE=)\n\n\nAFFiNE stands out as a state-of-the-art AI content creation app, meticulously crafted to employ AI to streamline the [organization](https://affine.pro/blog/15-types-events-event-management-categories-examples), management, and collaboration on tasks, [projects](https://affine.pro/blog/best-project-planning-tools-software-for-teams-2023), and real-time information. What distinguishes AFFiNE is its unique offering as a free and [open-source](https://affine.pro/blog/five-best-open-source-miro-alternatives-2023) program, leveraging offline technology to ensure accessibility for all users.\n\n\n<div style=\"text-align:center;\">\n\n\n<iframe width=\"560\" height=\"315\" src=\"https://www.youtube.com/embed/3cfeKOufZWU?si=IiXDIdwfnM2Z7KPL\" title=\"YouTube video player\" frameborder=\"0\" allow=\"accelerometer; autoplay; clipboard-write; encrypted-media; gyroscope; picture-in-picture; web-share\" allowfullscreen></iframe>\n\n\n</div>\n\n\n**AFFiNE AI: Transforming Ideas into Visuals and Words Seamlessly**\n\n\nExplore AFFiNE AI, your true multimodal AI copilot, dedicated to turning \"all your ideas into reality.\"\n\n\n* **[Write](https://affine.pro/blog/how-to-write-sop-step-by-step-guide-5-best-free-tools-templates) with You:** Leveraging AI technology, [AFFiNE AI](https://affine.pro/blog/affine-0-12-0-launch-week-day-3-early-access-affine-ai-self-host-upcoming-0-13-unveiled) provides intelligent assistance for every step of your writing process, from crafting sentences to entire articles. Whether you're creating content, professionally rewriting, adjusting tone, or correcting spelling and grammar, AFFiNE AI makes your text more vivid and accurate.\n\n\n<video muted autoplay loop preload=\"auto\" playsinline>\n  <source src=\"/blobs/DqPULcqb7FjaGpuBQY8YqRryU3jCKwsTZ9gR4MeHh8Q=\" type=\"video/mp4\" />\n</video>\n\n\n* **[Draw](https://affine.pro/blog/top-8-figma-competitors-alternatives-design-prototyping) with You:** With the power of AI, AFFiNE AI can transform your outlines or ideas into eye-catching visual works. Whether it's creating presentations or building [mind maps](https://affine.pro/blog/top-5-mind-maps-examples-and-tools), AFFiNE AI helps you clearly express and share your creativity.\n\n\n<video muted autoplay loop preload=\"auto\" playsinline>\n  <source src=\"/blobs/3g0Mjm75iB2Ee8zCuxYI_toeVDT_kX3ZH5U7FrNUs60=\" type=\"video/mp4\" />\n</video>\n\n\n* **[Plan](https://affine.pro/blog/15-best-free-daily-planner-apps-features-free) with You:** AFFiNE AI's smart planning tools help you [manage](https://affine.pro/blog/best-time-management-tools-techniques-create) and organize knowledge with auto-sorting and tagging features. Based on principles of [open source](https://affine.pro/blog/tips-where-and-how-contribute-open-source-projects) and privacy protection, it ensures your information is secure and easily accessible.\n\n\n* **Data privacy:** The self-host version of AFFiNE is designed with your data privacy and security in mind, allowing you to utilize the latest functionalities with peace of mind. For detailed instructions on how to get started, please visit https://docs.AFFiNE.pro/docs/self-host-AFFiNE.\n\n\n**Join our waiting list now to be among the first to experience the leap in creativity and efficiency brought by AFFiNE AI！**\n\n\nSo why wait? Incorporate an AI virtual assistant into your workflow today and experience firsthand how it can optimize your efficiency and help you achieve more in less time. Let technology be your ally in navigating the demands of modern-day productivity. Try out an AI virtual assistant and unlock a world of possibilities! Presently, **AFFiNE** has launched its [**Stable Version**](https://affine.pro/download), with ongoing efforts to develop a more comprehensive and dependable iteration. Join us on our voyage through our social media channels and be part of the experience. **Come and join us on our journey over on our media platforms. 🚀**\n\n\n* Official Website: [https://affine.pro/](https://affine.pro/)\n\n\n* GitHub: [https://github.com/toeverything/AFFiNE](https://github.com/toeverything/AFFiNE)\n\n\n* Discord: [https://discord.gg/Arn7TqJBvG](https://discord.gg/Arn7TqJBvG)\n\n\n* Twitter: [https://twitter.com/AffineOfficial](https://twitter.com/AffineOfficial)\n\n\n",
  "publish": true
}