{
  "title": "10 Best Free Chore Chart Templates for Kids and Adults",
  "authors": [
    "Yiyang Zhang"
  ],
  "tags": [
    "Content"
  ],
  "description": "Discover 10 free chore chart templates that can organize your workload. Get ready to enhance your productivity and organization.",
  "created": 1709510400000,
  "updated": 1709510400000,
  "layout": "blog",
  "id": "3f-WxD9U73KU-_ilaSyho",
  "slug": "10-best-free-chore-chart-templates-kids-adults",
  "cover": "/blobs/a0qv7R3HnaWHSdG-U3ICE8IxfCXit9Px7nnwN3QO12Q=",
  "md": "---\n\n\ntitle: \"10 Best Free Chore Chart Templates for Kids and Adults\"\n\n\nauthor: \"Yiyang Zhang\"\n\n\ntags: Content\n\n\nslug: 10-best-free-chore-chart-templates-kids-adults\n\n\ndescription: \"Discover 10 free chore chart templates that can organize your workload. Get ready to enhance your productivity and organization.\"\n\n\ncreated: 2024-03-04\n\n\nupdated: 2024-03-04\n\n\nlayout: blog\n\n\npublish: true\n\n\n---\n\n\n\n![a0qv7R3HnaWHSdG-U3ICE8IxfCXit9Px7nnwN3QO12Q=](/blobs/a0qv7R3HnaWHSdG-U3ICE8IxfCXit9Px7nnwN3QO12Q=)\n\n\nTired of the endless cycle of nagging and reminding your kids (or yourself) to do chores?\n\n\nSay goodbye to chaos and hello to an organization with chore chart templates! Whether you're looking to instill a sense of responsibility in your little ones or simply trying to stay on top of household tasks, chore charts are a game-changer. In this article, we'll explore the 10 best free chore chart templates for both kids and adults that will revolutionize the way you tackle daily responsibilities. Let's dive in!\n\n\n# What is a Chore Chart Template?\n\n\n\n![uIzYaSKVCs7VqedZ7DS71H-faQp7IAsgnR7ckKIPcto=](/blobs/uIzYaSKVCs7VqedZ7DS71H-faQp7IAsgnR7ckKIPcto=)\n\n\nA chore chart template simplifies household organization by visually laying out tasks and responsibilities. Typically set up in a grid format with columns for tasks and rows for days of the week, it assigns chores to each family member. This system ensures clarity and accountability, reducing confusion over who is responsible for what and when. Customizable to suit specific needs, chore charts help establish routines and promote teamwork within the household. They serve as gentle reminders, preventing conflicts over overlooked tasks and celebrating completed ones. With various designs available, from straightforward layouts to colorful styles, chore chart templates cater to different preferences while streamlining household management effectively.\n\n\n# Why Use a Chore Chart Template?\n\n\n\n![3KgtqgQuaOiWZluOoYkILgCHjK3Z3eEn9HiLLJwkPCo=](/blobs/3KgtqgQuaOiWZluOoYkILgCHjK3Z3eEn9HiLLJwkPCo=)\n\n\n* **Organization and clarity**\n\n\nChore chart templates provide a structured framework, typically presented in a grid or table format, ensuring tasks and responsibilities are laid out.\n\n\n* **Accountability and responsibility**\n\n\nAssigning specific chores to each family member fosters accountability, reducing confusion and conflicts over who is responsible for what and when.\n\n\n* **Customizability**\n\n\nThese templates can be easily customized to fit the unique needs and preferences of each household, whether it's daily chores, weekly tasks, or recurring responsibilities.\n\n\n* **Routine establishment**\n\n\nBy offering a clear outline of expectations, chore charts contribute to establishing consistent routines within the household, which is essential for maintaining order and efficiency.\n\n\n* **Promotion of teamwork**\n\n\nBreaking down household chores into manageable daily tasks encourages collaboration among family members, instilling a sense of ownership and contribution to the overall functioning of the household.\n\n\n* **Visual reminders**\n\n\nChore chart templates serve as effective visual reminders of pending tasks and deadlines, helping users stay organized and on track with their responsibilities.\n\n\n# 10 Best Free Chore Chart Templates for Kids and Adults\n\n\nLooking for a fun and effective way to organize household tasks for both kids and adults? Chore chart templates are the way to go! These templates help track chores, assign responsibilities, and encourage accountability in a visually appealing manner.\n\n\n##### 1. **[AFFiNE](https://app.affine.pro/) Weekly Chore Chart Template**\n\n\n\n![gfz-NlTNLNXClUnG-tAShA57LxbuvaFb0OegHCLXwgY=](/blobs/gfz-NlTNLNXClUnG-tAShA57LxbuvaFb0OegHCLXwgY=)\n\n\nThis AFFiNE weekly chore chart template captures a harmonious blend of work appointments, personal fitness goals, family events, and educational engagements, all color-coded for quick reference. It's a snapshot of a well-orchestrated week where every commitment, from morning meetings to weekend picnics, is visually mapped out for easy navigation.\n\n\n##### 2. **[AFFiNE](https://app.affine.pro/) Getting Things Done Kanban Template**\n\n\n<video muted autoplay loop preload=\"auto\" playsinline>\n  <source src=\"/blobs/gyNyluUbfJw8fUGSKON7eRiMQApCi2SupeMj3nBq0mo=\" type=\"video/mp4\" />\n</video>\n\n\nThe nature of project progress is constantly changing and requires an agile methodology. The AFFiNE GTD Kanban template is designed for this purpose and is equally useful for startup teams looking to grow and solo entrepreneurs navigating their business ventures. It serves as an agile [board](https://affine.pro/blog/8-free-printable-vision-board-templates-examples-2023) for developing teams and a productivity booster for freelancers. The getting things done Kanban template is invaluable, catering to both teams and individual learners and empowering users to efficiently manage evolving workloads.\n\n\n##### 3. **[AFFiNE](https://app.affine.pro/) Family Chore Chart Template**\n\n\n\n![kIRsUTe1kkBwdn2UQCSVTRrBmuMCmckf_2FsQyDIDIw=](/blobs/kIRsUTe1kkBwdn2UQCSVTRrBmuMCmckf_2FsQyDIDIw=)\n\n\nThe AFFiNE family chore chart aims to streamline household responsibilities and foster a sense of shared accountability among family members. Made up of a comprehensive table, this template organizes various tasks such as laundry, dishes, vacuuming, and more, assigning each task to specific family members. By specifying start dates, and due dates, and tracking progress, the chore chart promotes efficient task management and ensures that chores are completed in a timely manner. Additionally, the inclusion of a reminder emphasizes the importance of regular updates and effective communication within the family to maintain a smoothly running household.\n\n\n##### 4. **[AFFiNE](https://app.affine.pro/) Personal One-day Chore Chart Template**\n\n\n\n![-jt2lRBNxTf77jzy4_mHMbUqzip6BHz3mKJjQbQZwMk=](/blobs/-jt2lRBNxTf77jzy4_mHMbUqzip6BHz3mKJjQbQZwMk=)\n\n\nThe AFFiNE personal one-day chore chart aims to assist adults in effectively managing their daily responsibilities and tasks. Made up of a comprehensive list of one-day tasks, this template provides a structured approach to household chores, meal planning, personal finance, self-care, and home maintenance. Each task is accompanied by a detailed description and reminders to help individuals stay organized and on track throughout the day. By utilizing this chore chart, adults can prioritize their tasks, streamline their daily routines, and achieve a better balance between work, household responsibilities, and personal well-being.\n\n\n##### 5. **[Creately](https://creately.com/guides/chore-chart-templates/) Family Chore Chart Template**\n\n\n\n![0Wih-wfUfiIA2EGL7XfU5KHMWQPextp4PoLbxiIWZVA=](/blobs/0Wih-wfUfiIA2EGL7XfU5KHMWQPextp4PoLbxiIWZVA=)\n\n\nThe Creately family chore chart template aims to streamline household organization by seamlessly integrating work appointments, fitness goals, family events, and educational engagements. Made up of a color-coded grid with each family member's name in the first row and days of the week along the top, it provides a visually intuitive snapshot of the week's commitments. This well-orchestrated tool ensures every task, from morning meetings to weekend picnics, is easily navigable and efficiently managed, fostering harmony and productivity within the family unit.\n\n\n##### 6. **[Larksuite](https://www.larksuite.com/en_us) Chore Chart Template**\n\n\n\n![57Jizrcf-Y_TXHHVlfP8GJac7eBtXNafCsYPc6BjUXU=](/blobs/57Jizrcf-Y_TXHHVlfP8GJac7eBtXNafCsYPc6BjUXU=)\n\n\nThe Lark chore chart template is a good solution for households of all sizes and types. Whether you are a family with children, roommates living together in an apartment, or a couple who wants to share household duties, this template will help you establish a fair and effective chore system. Moreover, it is an excellent tool to instill responsibility and accountability in children.\n\n\n##### 7. **Template.net Home Kanban Template**\n\n\n\n![9H35-GYmMearty0JOQ4sodrwZcV_q-SZLTzHMXQh_K4=](/blobs/9H35-GYmMearty0JOQ4sodrwZcV_q-SZLTzHMXQh_K4=)\n\n\nThis home Kanban template from Template.net is designed for easy task and chore management. It is customizable, compatible with various software, and comes with reminders and commendations for a job well done.\n\n\n##### 8. **[Vertex42](https://www.vertex42.com/) Kids Chore Chart Template**\n\n\n\n![pOAp-dfbV6_hGv8BdkAM1VafveTpSWjk70WnFXyLpEQ=](/blobs/pOAp-dfbV6_hGv8BdkAM1VafveTpSWjk70WnFXyLpEQ=)\n\n\nThe Vertex42 printable kids' chore chart can be used as a chore checklist or schedule. If you have a household with multiple children, it can be difficult to keep track of who is responsible for what chore each day. In order to streamline this process, you may find it helpful to create a chore chart. The chore chart can be customized to fit your family's specific needs. If you have one child, a generic chart may suffice. However, if you have multiple children, you can write their names in the blanks to keep track of who is responsible for which chore each day. This can help to avoid any confusion or arguments over who is supposed to do what.\n\n\n##### 9. **[InkPx](https://inkpx.com/word-art-generator) Blank Weekly Colorful Chore Chart**\n\n\n\n![C_bj7F4FDWRAe2SVqdBpMbj-p808uDwoOfaFK0svZFw=](/blobs/C_bj7F4FDWRAe2SVqdBpMbj-p808uDwoOfaFK0svZFw=)\n\n\nInkPx offers a free customizable chore template that comes in a colorful design. To edit the text on this template, just double-click on the text area and replace it with your own. You can also easily reposition the elements on the template by clicking and dragging them to the desired location. The graphic editor provides guidelines to help you align the elements when you move them. Additionally, you can select and move multiple elements simultaneously by holding down the mouse button and dragging them to the desired location. And if you want to remove an element, just select it by clicking on it and pressing the \"Delete\" key.\n\n\n##### 10. **[ClickUp](https://clickup.com/) Getting Things Done Template**\n\n\n\n![_qVmf85NVry-Bq60dekImbFhUwUrJm_3cFuY45v9bKU=](/blobs/_qVmf85NVry-Bq60dekImbFhUwUrJm_3cFuY45v9bKU=)\n\n\nCheck out the ClickUp getting things done template! It's a useful tool that will help you manage your busy schedule with ease. It provides a structured approach to handling your responsibilities, reducing stress, and increasing process efficiency. This Folder template offers various Lists and views to ensure clear organization. To get started, use the Inbox list to note down and describe all your tasks. Then, make sure to estimate the time required to complete each task, and rate them on an effort scale.\n\n\n# Create Chore Charts with AFFiNE\n\n\nThe time to act is now. Whether you prefer digital formats or printable versions, [**AFFiNE**](https://affine.pro/) has got you covered. Say goodbye to scattered sticky notes and disorganized schedules – with AFFiNE, managing chores becomes a breeze. By utilizing AFFiNE's innovative tools, you can customize chore charts to match your specific needs and preferences. AFFiNE provides professionals with a unified platform that enables them to plan a knowledge base, collaborate with teammates, and develop content.\n\n\n<div style=\"text-align:center;\">\n<iframe width=\"560\" height=\"315\" src=\"https://www.youtube.com/embed/WqOe9HgpsDY?si=PHGuSeRbOT9GxuPO\" title=\"YouTube video player\" frameborder=\"0\" allow=\"accelerometer; autoplay; clipboard-write; encrypted-media; gyroscope; picture-in-picture; web-share\" allowfullscreen></iframe>\n</div>\n\n\n* **Template Gallery in AFFiNE:** There is a curated collection of powerful [whiteboard](https://affine.pro/blog/best-free-whiteboard-layout-ideas-organization) templates in AFFiNE. From the robust concept map to the insightful Kanban board and the comprehensive charts, an array of additional templates awaits your exploration, promising to expand the horizons of your marketing and sales pipeline crafting and execution. These templates serve as your launchpad, enabling you to skip the groundwork and jump straight into action. Crafted for seamless collaboration, AFFiNE's templates provide structured canvases for various tasks, saving you valuable time and enhancing efficiency in project management, content creation, and [planning](https://affine.pro/blog/top-10-best-free-digital-planner-apps-2023).\n\n\n\n![OP3GdbE7dwmQKK2uKzBgJbhpVJxkLuDsVtomxcggvSQ=](/blobs/OP3GdbE7dwmQKK2uKzBgJbhpVJxkLuDsVtomxcggvSQ=)\n\n\n* **Tailored Precision with AFFiNE's Database:** AFFiNE's database seamlessly integrates Kanban and Table views for dynamic charter creation. By smoothly transforming your blocks into a Kanban view, effortlessly classify based on charter properties such as date, progress, and link. This allows for intuitive drag-and-drop functionality, ensuring precise organization and alignment of your project execution. Switching to the Table view offers a comprehensive project overview, enhancing the efficiency of your narrative development. With intuitive controls, track deadlines and manage unscheduled tasks seamlessly.\n\n\n\n![bY0EkoVLJfBpOjymBoGUxE0LAiQuW1bNgYA-FU1OQlA=](/blobs/bY0EkoVLJfBpOjymBoGUxE0LAiQuW1bNgYA-FU1OQlA=)\n\n\n* **Collaborative Editing:** Foster collaboration among team members by using AFFiNE's collaborative editing tools, and foster collaboration among team members. Multiple team members can work on email content simultaneously, ensuring a seamless and efficient content creation [process](https://affine.pro/blog/top-10-best-process-mapping-tools-software-2023-free-paid). Share files, exchange ideas, and provide feedback in real time through AFFiNE. With AFFiNE, everyone can contribute to the same set of notes in real time.\n\n\n\n![O88V12dZ7eALpdMD8-6eyyfRec5yZyWiQxCnvNEb3r0=](/blobs/O88V12dZ7eALpdMD8-6eyyfRec5yZyWiQxCnvNEb3r0=)\n\n\nStart incorporating chore charts into your daily routine today with the help of AFFiNE. Experience the benefits of increased productivity, improved time management skills, and a more organized household or workspace. Take control of your tasks and responsibilities by creating personalized chore charts that work best for you. Try out AFFiNE now and elevate your daily routine! Presently, **AFFiNE** has launched its [**Stable Version**](https://affine.pro/download), with ongoing efforts to develop a more comprehensive and dependable iteration. Join us on our voyage through our social media channels and be part of the experience. **Come and join us on our journey over on our media platforms. 🚀**\n\n\n* Official Website: [https://affine.pro/](https://affine.pro/)\n\n\n* GitHub: [https://github.com/toeverything/AFFiNE](https://github.com/toeverything/AFFiNE)\n\n\n* Discord: [https://discord.gg/Arn7TqJBvG](https://discord.gg/Arn7TqJBvG)\n\n\n* Twitter: [https://twitter.com/AffineOfficial](https://twitter.com/AffineOfficial)\n\n\n",
  "publish": true
}