{
  "title": "10 Cool Apps for Enhanced Productivity and Simplified Living in 2024",
  "authors": [
    "Yiyang Zhang"
  ],
  "tags": [
    "Content"
  ],
  "description": "Explore a carefully curated selection of 10 innovative apps that can significantly enhance your work efficiency and streamline your daily routine in 2024.",
  "created": 1713484800000,
  "updated": 1713484800000,
  "layout": "blog",
  "id": "YtEMD8GOsbz3OMP9D62w9",
  "slug": "10-cool-apps-enhanced-productivity-simplified-living",
  "cover": "/blobs/0fAMwabHHVUUGF3CsyCqAVTWIaplwY5-JcrWyFERa7g=",
  "md": "---\n\n\ntitle: \"10 Cool Apps for Enhanced Productivity and Simplified Living in 2024\"\n\n\nauthor: \"Yiyang Zhang\"\n\n\ntags: Content\n\n\nslug: 10-cool-apps-enhanced-productivity-simplified-living\n\n\ndescription: \"Explore a carefully curated selection of 10 innovative apps that can significantly enhance your work efficiency and streamline your daily routine in 2024.\"\n\n\ncreated: 2024-04-19\n\n\nupdated: 2024-04-19\n\n\nlayout: blog\n\n\npublish: true\n\n\n---\n\n\n\n![0fAMwabHHVUUGF3CsyCqAVTWIaplwY5-JcrWyFERa7g=](/blobs/0fAMwabHHVUUGF3CsyCqAVTWIaplwY5-JcrWyFERa7g=)\n\n\nAre you eager to skyrocket your productivity and add a touch of simplicity to your daily hustle?\n\n\nIn our whirlwind of modern living, mastering organization and efficiency is the ultimate superpower. Thankfully, we're living in an era where [revolutionary apps](https://affine.pro/blog/15-top-examples-saas-application) are at our fingertips, ready to transform the way we tackle tasks and embrace life's adventures. Come along as we unveil the ultimate lineup of 10 life-changing apps that promise to redefine how you work and play in 2024. Ready to embark on this digital journey?\n\n\n# How to Improve Your Productivity and Simplify Living?\n\n\nPicture this: a day where you're ticking off tasks like a pro, feeling accomplished and in control. It's not some distant dream; it's within your grasp.\n\n\n\n![vdEU4jvP7dVb4AjiKS55sk6O-5Alh2hfW6822FwAPjo=](/blobs/vdEU4jvP7dVb4AjiKS55sk6O-5Alh2hfW6822FwAPjo=)\n\n\nFirst off, set clear goals and priorities of [project planning](https://affine.pro/blog/8-top-best-mindmap-making-software-project-planning-2023) each day to map out your path to success. Then, tackle distractions head-on by using apps to block notifications and set designated work hours.\n\n\nNext, tidy up your physical and digital space to clear the clutter and create a serene environment that fosters focus. Embracing minimalist principles in all aspects of life can lead to less stress and more clarity.\n\n\nAnd the best part? There's a whole array of **apps** out there ready to lend a hand in simplifying your life and supercharging your productivity. With a little organization and the help of technology, you'll be well on your way to conquering chaos and reclaiming your sanity.\n\n\n\n\n\n# How can a Cool App Upgrade Your Work and Life\n\n\nDiscover the transformative power of productivity apps – your ultimate allies in the quest for efficiency and simplicity. These digital marvels are more than just tools; they're gateways to a more organized, focused, and productive lifestyle. Here's how they can revolutionize your approach to work and living:\n\n\n\n![Ce7fp4_H2ISBDcTClhBhn4z8UYpcIInK-V7Uhj6AxA0=](/blobs/Ce7fp4_H2ISBDcTClhBhn4z8UYpcIInK-V7Uhj6AxA0=)\n\n\n* **Streamlined Organization:** Keep all your tasks, deadlines, and appointments neatly organized in one place for easy access and management.\n\n\n* **Effortless [Time Management](https://affine.pro/blog/top-10-best-time-management-software-tools-2023):** Set reminders and notifications to stay on track with your schedule, ensuring you never miss an important deadline or appointment again.\n\n\n* **Enhanced Collaboration:** Collaborate seamlessly with colleagues or team members in real-time, whether you're in the office or on the go, fostering better communication and teamwork.\n\n\n* **Instant Access to Resources:** Gain instant access to valuable resources, documents, and information, saving time and minimizing the need for extensive searches.\n\n\n* **Increased Focus and Productivity:** Utilize features like task prioritization and focus timers to boost concentration and productivity, helping you accomplish more in less time.\n\n\nBy harnessing these benefits, productivity apps empower you to [work smarter](https://affine.pro/blog/8-free-project-tracker-templates-work-management-2023), not harder, and unlock your full potential in both professional and personal spheres.\n\n\n\n\n\n# Top 10 Life-Changing Apps You Need in 2024\n\n\nIn the fast-paced world of 2024, staying organized and productive is key to success. Thankfully, technology has blessed us with a plethora of apps that can enhance our daily lives in unimaginable ways. Here are the top 10 life-changing apps you need to download now.\n\n\n\n\n\n## **1. [ChatGPT](https://chat.openai.com/)**\n\n\n\n![OoyX_gxYM0L19_7hiVebXZJvD_QAPZ23ETjyetXwntM=](/blobs/OoyX_gxYM0L19_7hiVebXZJvD_QAPZ23ETjyetXwntM=)\n\n\nChatGPT is one of the most popularAI toolsaround. You can use it to carry out entire conversations or put it to use as a content ideation tool. However, it also comes with many features that most users don’t know about. With the right prompts, it can compose audio tracks and generate logos.\n\n\n**Key features:**\n\n\n* **Answering Questions**: ChatGPT can respond to inquiries in a conversational manner, conveying complex ideas in various tones and styles. It is adept at providing responses to user queries, making it a versatile tool for information retrieval.\n\n\n* **Text Summarization**: ChatGPT excels in text summarization tasks, allowing users to condense lengthy documents, news articles, and other texts into concise summaries, enhancing efficiency in information processing.\n\n\n* **Translating the language:** ChatGPT can be used as fine-tuned for language translation tasks, which can be useful for customer service or chatbot applications.\n\n\n\n\n\n## **2. [Asana](https://asana.com/)**\n\n\n\n![VXkMKNp-wEpH6wtW-1PtrgsCKrl5IbXb-XnR7X9GUuo=](/blobs/VXkMKNp-wEpH6wtW-1PtrgsCKrl5IbXb-XnR7X9GUuo=)\n\n\nAsana is an effective tool for scheduling projects that can help teams stay organized, collaborate efficiently, and manage projects effectively. With its customizable views, automation capabilities, and integrations, it is a versatile and flexible solution that can adapt to the specific needs and workflows of different teams. Offering both task management and project tracking features, Asana helps teams streamline their agile processes with ease.\n\n\n**Key features:**\n\n\n* **Task Tracking:** Asana allows users to create tasks, assign them to team members, and set due dates. This feature helps teams stay organized and ensures that everyone knows what needs to be done and when.\n\n\n* **Real-time Collaboration:** With Asana, team members can collaborate in real-time on tasks and projects. They can add comments, attachments, and updates to tasks, enabling seamless communication and fostering a collaborative work environment.\n\n\n* **Commenting on Tasks:** Asana provides a dedicated space for users to comment on tasks, facilitate discussions, provide feedback, and address any questions or concerns. This feature promotes clear and transparent communication among team members.\n\n\n\n\n\n\n\n\n  ## **3. [AFFiNE](https://affine.pro/)**\n\n\n\n![5VZZiy69UNGfpn8KOwMVuvVmBr6icqfRjmd42C36r9g=](/blobs/5VZZiy69UNGfpn8KOwMVuvVmBr6icqfRjmd42C36r9g=)\n\n\n**AFFiNE** is a versatile editor that lets you write, [draw](https://affine.pro/blog/affine-0-10-0-launch-week-day-4-5-write-draw-plan-present-collaboratively-anywhere), plan, and present all in one place. Easily capture detailed information about your new business using the page mode, allowing for straightforward document editing. Efficiently organize your projects by using a [database](https://affine.pro/blog/affine-0-11-0-launch-day-3-beyond-text-color-history-table-of-content-possibilities) to keep track of deadlines, assign responsibilities, and effortlessly [manage project progress](https://affine.pro/blog/10-best-free-smart-sheet-alternatives-for-project-management-2023). Take advantage of AFFiNE's powerful whiteboard feature to brainstorm ideas with your team. Moreover, craft visually appealing posters about your business for seamless publication and display on different social media platforms. AFFiNE offers a user-friendly platform for comprehensive business management and seamless [team collaboration](https://affine.pro/blog/top-asynchronous-communication-tools-free-2024).\n\n\n**Key features:**\n\n\n* **Template Gallery in AFFiNE:** There is a curated collection of powerful [whiteboard](https://affine.pro/blog/best-free-whiteboard-layout-ideas-organization) templates in AFFiNE. From the robust Gantt charts to the insightful Kanban board and the comprehensive project management charts, an array of additional templates awaits your exploration, promising to expand the horizons of your marketing and sales pipeline crafting and execution. These templates serve as your launchpad, enabling you to skip the groundwork and jump straight into action. Crafted for seamless collaboration, AFFiNE's templates provide structured canvases for various tasks, saving you valuable time and enhancing efficiency in project management, content creation, and [planning](https://affine.pro/blog/top-10-best-free-digital-planner-apps-2023).\n\n\n\n![OP3GdbE7dwmQKK2uKzBgJbhpVJxkLuDsVtomxcggvSQ=](/blobs/OP3GdbE7dwmQKK2uKzBgJbhpVJxkLuDsVtomxcggvSQ=)\n\n\n* **Tailored Precision with AFFiNE's Database:** AFFiNE's database seamlessly integrates Kanban and [Table](https://affine.pro/blog/8-best-free-table-contents-templates-examples-2023) views for dynamic content creation. By smoothly transforming your blocks into a Kanban view, effortlessly classify based on properties such as date, progress, and link. This allows for intuitive drag-and-drop functionality, ensuring precise organization and alignment of your project execution. Switching to the Table view offers a comprehensive project overview, enhancing the efficiency of your narrative development. With intuitive controls, track deadlines and manage unscheduled tasks seamlessly.\n\n\n\n![bY0EkoVLJfBpOjymBoGUxE0LAiQuW1bNgYA-FU1OQlA=](/blobs/bY0EkoVLJfBpOjymBoGUxE0LAiQuW1bNgYA-FU1OQlA=)\n\n\n* **Boost Productivity with Bookmark Preview:** Bookmark allows seamless previewing of links from platforms like YouTube, GitHub, and Figma within the application. Instantly play YouTube videos without leaving the current page, enhancing browsing efficiency. This integration simplifies link management and recognition, ensuring a smoother and more intuitive workflow.\n\n\n\n![_3wbyagun1HHX0v2uZb4hE8T8lDGxEJbdUzt3ZnTL4c=](/blobs/_3wbyagun1HHX0v2uZb4hE8T8lDGxEJbdUzt3ZnTL4c=)\n\n\n* **Track your daily notes and routine effortlessly with AFFiNE's Journals:** AFFiNE's Journals are designed to streamline your note-taking experience. The integrated calendar at the top of the editor facilitates easy navigation throughout the week. Users can view documents created and updated on specific dates, ensuring seamless access to your notes with just a single click.\n\n\n\n![5XAkqzC7euvRLTVUDgQ32gyFLTdY_0R8nPNDLdt549w=](/blobs/5XAkqzC7euvRLTVUDgQ32gyFLTdY_0R8nPNDLdt549w=)\n\n\n\n\n\n### **3. [Trello](https://trello.com/zh-Hant)**\n\n\n\n![RJ1GiFLJMtnQK9vFEqaH8E4bSUpMQw0Kard9CvSEV1k=](/blobs/RJ1GiFLJMtnQK9vFEqaH8E4bSUpMQw0Kard9CvSEV1k=)\n\n\nTrello is a popular choice known for its intuitive interface and customizable boards. With Trello, you can create task lists and collaborate with others seamlessly. Trello's implementation of the Kanban methodology provides a simple and effective way to manage tasks and workflows, particularly for smaller projects and teams.\n\n\n**Key features:**\n\n\n* **Set Reminders:** Trello allows users to set reminders for tasks and deadlines. This feature ensures that important dates and tasks are not overlooked, helping teams stay organized and on track.\n\n\n* **Kanban Board View:** Trello utilizes a Kanban board view, where tasks are represented as cards that can be moved across different lists or stages. This visual approach provides a clear overview of the workflow and allows teams to track the progress of tasks at a glance.\n\n\n* **Assign Tasks:** Trello enables task assignments to specific team members. Users can easily assign tasks to individuals, promoting accountability and facilitating collaboration within the team.\n\n\n\n\n\n### **4. [Basecamp](https://basecamp.com/)**\n\n\n\n![mAZvVeli9jeyRtd0npgHSANAh1lXyoJybw_WqwsvutE=](/blobs/mAZvVeli9jeyRtd0npgHSANAh1lXyoJybw_WqwsvutE=)\n\n\nBasecamp is a project management and team collaboration platform developed by Basecamp, LLC. It is designed to help teams and organizations [manage projects](https://affine.pro/blog/top-10-best-agile-project-scheduling-software-2023), share files, communicate, and collaborate effectively. Basecamp has been a popular choice for its simplicity and focus on centralizing project-related information in an easily accessible and organized manner.\n\n\n**Key Features:**\n\n\n* **Projects and To-Do Lists:** Basecamp allows users to create projects and organize tasks using to-do lists, facilitating project planning and task management.\n\n\n* **Message Boards and Discussions:** The platform includes [message boards](https://affine.pro/blog/8-best-habit-tracker-apps-your-need-2023-features-price) for team discussions, providing a centralized space for communication and updates.\n\n\n* **File Sharing:** Basecamp supports file sharing, enabling team members to upload and share documents, images, and other project-related files.\n\n\n### **5. [Wrike](https://www.wrike.com/)**\n\n\n\n![8bzt_Ox-TVn6Wvz-dlNhbdDJstu0D9B_7iTcXT68CWM=](/blobs/8bzt_Ox-TVn6Wvz-dlNhbdDJstu0D9B_7iTcXT68CWM=)\n\n\nAn online project management software that gives you full visibility and control over your tasks. Wrike is your project management pal, keeping everyone on track and in sync with its intuitive interface and powerful features. It's like having a personal assistant who helps you juggle deadlines and deliverables effortlessly.\n\n\n**Key features:**\n\n\n* **Seamless Connectivity**: Integrate effortlessly with popular apps such as Zapier, Github, and Gmail. This functionality allows for fluid data flow and enhanced collaboration across platforms, optimizing workflow efficiency.\n\n\n* **Real-time Insights**: Access comprehensive and insightful reports for up-to-the-minute updates. These detailed reports provide valuable data-driven insights, facilitating informed decision-making and agile project management.\n\n\n* **Team Updates**: Stay informed with a dedicated project newsfeed for team updates. This feature ensures everyone is on the same page by consolidating vital project-related information in one accessible location.\n\n\n\n\n\n### **6. [Slack](https://slack.com/intl/en-gb/)**\n\n\n\n![Td9FnFrXjNg-ZPHDQBfriiePqjGbTJBCHagGb7nRVwk=](/blobs/Td9FnFrXjNg-ZPHDQBfriiePqjGbTJBCHagGb7nRVwk=)\n\n\nSlack is a widely used team collaboration platform that provides messaging, file sharing, and collaboration features for teams and businesses. It is known for its real-time communication capabilities and has gained popularity as a tool for improving team collaboration and reducing reliance on email. While primarily known as a messaging app, Slack's file-sharing capabilities make it a viable option for small teams needing basic document collaboration features.\n\n\n**Key Features:**\n\n\n* **Channels:** Slack organizes communication into channels, allowing teams to create dedicated spaces for specific projects, departments, or topics.\n\n\n* **Real-time Messaging:** Users can send direct messages, and group messages, and participate in real-time conversations, facilitating quick and efficient communication.\n\n\n* **File Sharing and Integration:** Slack allows users to share files, documents, and links directly within the platform. It also integrates with a wide range of third-party apps and services, enhancing its functionality.\n\n\n\n\n\n### **7. [Airtable](https://www.airtable.com/platform)**\n\n\n\n![9R366xlXBVFXenVNIeKbokLabHHlxe6ENozoqMrv1wc=](/blobs/9R366xlXBVFXenVNIeKbokLabHHlxe6ENozoqMrv1wc=)\n\n\nAirtable is a cloud-based collaboration platform that combines the features of a spreadsheet with a flexible database. It is known for its versatility and is used for various purposes, including [project management](https://affine.pro/blog/best-work-schedule-apps-2023-review), content planning, customer relationship management (CRM), and more.\n\n\n**Key features:**\n\n\n* **Flexible Database Structure:** Airtable allows users to create custom databases with a variety of field types, including text, attachments, checkboxes, and more. This flexibility makes it adaptable for different use cases.\n\n\n* **Collaboration:** Teams can collaborate on databases in real time, similar to working on a shared spreadsheet. Multiple users can view and edit data simultaneously.\n\n\n* **Rich Integrations:** Airtable supports integrations with a wide range of apps and services, allowing users to connect their databases with other tools to streamline workflows.\n\n\n\n\n\n### **8. [Parabola](https://parabola.io/)**\n\n\n\n![AW6dRgepX9EahxOitpkApjX0ugqrq204kGiGLiSBcSU=](/blobs/AW6dRgepX9EahxOitpkApjX0ugqrq204kGiGLiSBcSU=)\n\n\nParabola is an advanced data automation and visualization tool designed to help non-technical users manage, analyze, and visualize their data. It offers a user-friendly, drag-and-drop interface that allows users to connect their data sources, build custom data flows, and create [insightful visualizations](https://affine.pro/blog/top-12-to-do-list-excel-templates-examples-free-download). Parabola's key features include data import/export, data transformation and cleaning, API integration, and scheduling and automation capabilities.\n\n\n**Key features:**\n\n\n* **Easy to use:** The intuitive drag-and-drop interface makes it easy for non-technical users to work with data.\n\n\n* **Improved efficiency:** Automation capabilities can save tech startups significant time on manual data tasks.\n\n\n* **Increased data accuracy:** By automating data tasks, Parabola reduces the risk of human error, leading to more accurate data.\n\n\n\n\n\n### **9. [MeisterTask](https://www.meistertask.com/zh?gclid=CjwKCAjww_iwBhApEiwAuG6ccJWs2vb9i1UMhJzd9Bug-68RttXg5z9YYwrAuhQC_qgAPbhjzGiCuhoCD18QAvD_BwE&utm_campaign=US_en_PBPQ_GA_SS_MT&utm_medium=ppc&utm_source=adwords)**\n\n\n\n![QUD-0rFuAaElmZOfiHKlySEsgqlvICfHekdE_9n6fBs=](/blobs/QUD-0rFuAaElmZOfiHKlySEsgqlvICfHekdE_9n6fBs=)\n\n\nWith MeisterTask, members can manage their team’s daily business using sleek and customizable Kanban boards that are based on the Kanban system. With project management features such as unlimited sections, automation, and multiple checklists, teams can communicate and collaborate throughout their workflow.\n\n\n**Key features:**\n\n\n* **Activity Stream**: Foster team collaboration with an activity stream for every board. This stream captures ongoing interactions, discussions, and updates, facilitating seamless teamwork and transparency.\n\n\n* **Customizable Project Boards**: Tailor project boards to your needs and receive real-time updates. This feature allows personalized project management spaces that adapt to your workflow, ensuring optimal organization.\n\n\n* **Built-in Notepad**: Enhance productivity with a built-in notepad for quick idea capture and essential [note-taking](https://affine.pro/blog/10-best-free-online-sticky-notes-free-software-tools). This tool provides a convenient space to jot down concepts, reminders, and insights, ensuring no valuable thoughts are lost.\n\n\nThese apps are not just tools but companions in our journey towards enhanced productivity and simplified living in 2024!\n\n\n\n\n\n# Our Pick for 2024: AFFiNE\n\n\nAs we navigate the fast-paced world of technology and strive to enhance our productivity while simplifying our daily lives, having the right tools at our fingertips is crucial. In this ever-evolving landscape of apps designed to make life easier, one standout app that encompasses all these qualities is **AFFiNE**.\n\n\n\n![5VZZiy69UNGfpn8KOwMVuvVmBr6icqfRjmd42C36r9g=](/blobs/5VZZiy69UNGfpn8KOwMVuvVmBr6icqfRjmd42C36r9g=)\n\n\nAFFiNE not only streamlines your tasks and schedules but also provides groundbreaking AI functions tailored to your specific needs. With its user-friendly interface and advanced features, AFFiNE truly stands out as a must-have app for anyone looking to boost productivity and simplify living in 2024.\n\n\n<div style=\"text-align:center;\">\n<iframe width=\"560\" height=\"315\" src=\"https://www.youtube.com/embed/WqOe9HgpsDY?si=PHGuSeRbOT9GxuPO\" title=\"YouTube video player\" frameborder=\"0\" allow=\"accelerometer; autoplay; clipboard-write; encrypted-media; gyroscope; picture-in-picture; web-share\" allowfullscreen></iframe>\n</div>\n\n\nSo why wait? Take control of your workflow, maximize your efficiency, and achieve more with ease by incorporating **AFFiNE** into your daily routine. Download it today and experience firsthand how this innovative app can revolutionize the way you work and live in the digital age.\n\n\nPresently, **AFFiNE** has launched its [**Stable Version**](https://affine.pro/download), with ongoing efforts to develop a more comprehensive and dependable iteration. Join us on our voyage through our social media channels and be part of the experience. **Come and join us on our journey over on our media platforms. 🚀**\n\n\n* Official Website:[https://affine.pro/](https://affine.pro/)\n\n\n* GitHub:[https://github.com/toeverything/AFFiNE](https://github.com/toeverything/AFFiNE)\n\n\n* Discord:[https://discord.gg/Arn7TqJBvG](https://discord.gg/Arn7TqJBvG)\n\n\n* Twitter:[https://twitter.com/AffineOfficial](https://twitter.com/AffineOfficial)\n\n\n",
  "publish": true
}