{
  "title": "Explore the Art of the Brief: Master 10 Creative Templates Now.",
  "authors": [
    "Yanxi Liu"
  ],
  "tags": [
    "Content"
  ],
  "description": "Unleash Your creativity: master the 10 Free Creative Templates for Seamless.",
  "created": 1718323200000,
  "updated": 1718323200000,
  "layout": "blog",
  "id": "rb2nFsSOFVoIF4apdRS99",
  "slug": "10-creative-and-customized-templates",
  "cover": "https://app.affine.pro/api/workspaces/qf73AF6vzWphbTJdN7KiX/blobs/HaPhTNbEJvYeGFKmuCRkKXULQ6qQGuZrgD4eujfoHb4=.webp",
  "md": "---\n\n\ntitle: \"Explore the Art of the Brief: Master 10 Creative Templates Now.\"\n\n\nauthor: \"Yanxi Liu\"\n\n\ntags: Content\n\n\nslug: 10-creative-and-customized-templates\n\n\ndescription: \"Unleash Your creativity: master the 10 Free Creative Templates for Seamless.\"\n\n\ncreated: 2024-06-14\n\n\nupdated: 2024-06-14\n\n\nlayout: blog\n\n\npublish: true\n\n\n---\n\n\n\n![HaPhTNbEJvYeGFKmuCRkKXULQ6qQGuZrgD4eujfoHb4=](https://app.affine.pro/api/workspaces/qf73AF6vzWphbTJdN7KiX/blobs/HaPhTNbEJvYeGFKmuCRkKXULQ6qQGuZrgD4eujfoHb4=.webp)\n\n\nWhen faced with a wall of text, people tend to switch off. To captivate and maintain their interest, a multi-modal approach to communication is key. Research reveals that the human brain processes [visual information](https://affine.pro/blog/the-7-key-stages-marketing-sales-pipeline-visual-guide) 60,000 times faster than text.\n\n\nThis is the realm where creative briefs excel. Crafting one allows you to proactively define requirements and strategize your creative journey. Moreover, it provides a platform to outline the unique scope, deadlines, and deliverables inherent to your project's creative aspects.\n\n\n# **What is Creative Brief**\n\n\nWhat, pray tell, is a creative brief? In essence, it is a document wielded by marketing agencies to unveil the intricacies of a marketing client and their unique needs. But it doesn't end there; it also encapsulates the very essence of the end goals of a project, providing a benchmark for the creative team to gauge their efforts and advancement.\n\n\nThe creative brief is a marketing agency's secret weapon, applicable to a myriad of scenarios: a client's marketing campaign, a brand's rebirth, the debut of a business, or the promotion of a product. It is the compass that guides the creative team, providing direction before a project commences and only coming to fruition with the client's blessing.\n\n\nBut why, one might ask, is it called a 'brief'? Perhaps because it is a concise, succinct overview, a snapshot of the creative vision.\n\n\n# **Why do You Need a Creative Brief?**\n\n\nCreative Brief Template have many benfits, it can help you to plan, to elucidate, to forge a path.\n\n\n1. **Clear Goal Alignment:** Ensures everyone is working towards shared objectives.\n\n\n1. **Consistency & Structure:** Brings order and strategy to the creative process.\n\n\n1. **Efficient Documentation:** Captures key details, preventing confusion and streamlining workflows.\n\n\n1. **Defining the Scope:** Outlines the elements and deliverables of a campaign, providing direction.\n\n\n1. **Reducing Friction:** Minimizes conflicts and wastes time, driving better results.\n\n\n# **8 Essential Elements of Creative Briefs You Should Know**\n\n\n###### **1. Title and Description: Setting the Stage**\n\n\nEvery creative journey begins with a title and a concise description. This is where you introduce the nature of your project, providing a glimpse into what your team aims to achieve.\n\n\n###### **2. Goals and Objectives: Defining Success**\n\n\nWhat are your aspirations for this project? Outline your goals and objectives clearly, setting measurable milestones to define success. This section is pivotal in aligning the team's efforts with the desired outcomes.\n\n\n###### **3. Audience: Knowing Your Target**\n\n\nIdentify your target audience. Understanding whom you are creating for is pivotal to tailoring your message and choosing the right channels. This knowledge will influence design choices, tone, and distribution strategies.\n\n\n###### **4. Messaging and Tone: Crafting the Voice**\n\n\nHere, you define the key messages you want to convey and the tone that best resonates with your audience. Are you aiming for a playful, authoritative, or empathetic tone? Consistency in messaging and tone ensures a cohesive and memorable brand experience.\n\n\n###### **5. Assets and Deliverables: The Creative Toolbox**\n\n\nGather and outline the creative assets required for your project, including logos, images, copy, and any other necessary elements. Additionally, specify the expected deliverables, ensuring everyone is clear on the scope and outcome.\n\n\n###### **6. Stakeholders: The Collaborators**\n\n\nIdentify the key stakeholders involved in the project. This includes individuals or teams who will contribute, approve, or be affected by the outcome. Clear stakeholder identification ensures effective collaboration and manages expectations.\n\n\n###### **7. Budget and Timeline: Practical Considerations**\n\n\nProvide an overview of the allocated budget and the timeframe for the project. These practical constraints guide the scope and pace of the creative process, helping the team plan accordingly.\n\n\n###### **8. Distribution Process: Reaching the Audience**\n\n\nFinally, outline your distribution strategy. How will your creative work reach the intended audience? This section ensures that your message is delivered effectively, utilizing the right channels to maximize impact.\n\n\n\n\n\n# **10 Creative Brief Templates You need to Know**\n\n\n### **1. Notion Simple Project Brief**\n\n\n\n![A9WENVx4TDPLscuO1kpPoXcF81VJn_XDtAUh3gCCQJ0=](https://app.affine.pro/api/workspaces/qf73AF6vzWphbTJdN7KiX/blobs/A9WENVx4TDPLscuO1kpPoXcF81VJn_XDtAUh3gCCQJ0=.webp)\n\n\nOrganize and simplify project management information, save time by centralizing resources and documentation in one place, [visualize and monitor project progress](https://affine.pro/blog/the-7-key-stages-marketing-sales-pipeline-visual-guide) as it adapts to each project.\n\n\n### **2. Notion Content Deliverables Template**\n\n\n\n![DJozvA9EJIX7XvIOnQnxSN7iLD4QE9eC_ixPRU45670=](https://app.affine.pro/api/workspaces/qf73AF6vzWphbTJdN7KiX/blobs/DJozvA9EJIX7XvIOnQnxSN7iLD4QE9eC_ixPRU45670=.webp)\n\n\nDevin Reed's Content Deliverables Template is designed to help you effectively plan and track your content deliverables for an entire quarter. This template lets you record the deliverable name, its status, project description, demand, target audience, lift, and ETA. The option to view by status, lift, or ETA gives you the flexibility to manage your content projects in a way that best suits your workflow. Simplify your content planning and stay ahead of your deliverables with this efficient Notion template.\n\n\n### **3. AFFiNE Creative Brief Whiteboard Template**\n\n\n\n![wPEND94wkVUapsB6HuSuNHVG3wA3Oby1APX5ErOw8vo=](https://app.affine.pro/api/workspaces/qf73AF6vzWphbTJdN7KiX/blobs/wPEND94wkVUapsB6HuSuNHVG3wA3Oby1APX5ErOw8vo=.webp)\n\n\nThe Creative Brief Whiteboard Template by AFFiNE elevates your brief by integrating a pre-built list of creative project tasks into your workspace, coupled with a brainstorming diagram enhanced by the [collaborative Whiteboards feature](https://affine.pro/blog/best-free-whiteboard-layout-ideas-organization).\n\n\nWhiteboards offer a dynamic canvas to capture an d[evolve your ideas](https://affine.pro/blog/10-best-whiteboard-layout-ideas-boost-your-productivity). Utilize this diagram to explore and structure your creative project's goals, delve into target audience demographics, plan deliverables, and envision potential workflows. When your ideas crystallize, seamlessly transform text, shapes, or notes into actionable AFFiNE tasks.\n\n\n### **4. AFFiNE Campaign Brief Template**\n\n\n\n![kegeEaFUf8FbCPe6EbRn2k7eQFmopqzwNFkF2rkGR0w=](https://app.affine.pro/api/workspaces/qf73AF6vzWphbTJdN7KiX/blobs/kegeEaFUf8FbCPe6EbRn2k7eQFmopqzwNFkF2rkGR0w=.webp)\n\n\nCrafting a creative campaign brief demands a meticulous approach, requiring collaboration across various departments. Campaigns are intricate, encompassing multiple smaller projects harmonizing towards a grand vision. The Campaign Brief Template by AFFiNE simplifies this complex dance, offering a concise, one-page template in AFFiNE Docs.\n\n\nThis template elegantly outlines key campaign parameters, ensuring alignment on messaging and goals. It prompts you to define the campaign goal, target audience, budget, deliverables, and resources, providing a comprehensive framework. Delve into each section, unveiling intricate details that guide the campaign's creative direction.\n\n\n### **5. ClickUp SEO Content Brief Template**\n\n\n\n![l4z2I8c3v1og_FsSoBVPOuBHkbxIkCVe7A-Xe2JdwVo=](https://app.affine.pro/api/workspaces/qf73AF6vzWphbTJdN7KiX/blobs/l4z2I8c3v1og_FsSoBVPOuBHkbxIkCVe7A-Xe2JdwVo=.webp)\n\n\nThe SEO Content Brief Template by AFFiNE is an indispensable tool for writers, offering a comprehensive framework to craft captivating and search-optimized content. This meticulously designed template includes essential elements such as the SEO title, meta description, and word count, providing a strategic starting point.\n\n\nThe OKR section efficiently guides the content's focus, with dedicated spaces for objectives, key results, target audience analysis, and keyword information. Additionally, the outline section assists writers in structuring their content, ensuring a seamless flow of ideas that engage and captivate the reader.\n\n\n### **6. ClickUp Creative Brief Demand Planning Template**\n\n\n\n![bNrZ4jICQ-NKxSBU_98_P6AKgn8g3q7GIJPri17EsrQ=](https://app.affine.pro/api/workspaces/qf73AF6vzWphbTJdN7KiX/blobs/bNrZ4jICQ-NKxSBU_98_P6AKgn8g3q7GIJPri17EsrQ=.webp)\n\n\nThis List template is designed for teams managing several creative campaigns at a time. With five custom statuses arranged on an interactive Kanban board using ClickUp board view you’re able to visually manage every small step in progress across multiple projects using the whopping 20 Custom Fields included in this template.\n\n\n### **7. Aha! Agency creative brief template**\n\n\n\n![Ji5oOQlhQNPFDBU-RxDpxgc7EGL8rxX5N6EP6K_JNmQ=](https://app.affine.pro/api/workspaces/qf73AF6vzWphbTJdN7KiX/blobs/Ji5oOQlhQNPFDBU-RxDpxgc7EGL8rxX5N6EP6K_JNmQ=.webp)\n\n\nAgency creative briefs are often used within marketing agencies. An account manager can use this template to capture what a client wants to achieve and essential details about their audience, key messages, and brand voice. This helps the agency team better understand their clients' needs so they can deliver outstanding service that fits their brand.\n\n\n### **8. Aha！Content Creative Brief Template**\n\n\n\n![YiVNG_eX4kjv2j9J0hjW1704u_3MH7EaLYldYO02VnI=](https://app.affine.pro/api/workspaces/qf73AF6vzWphbTJdN7KiX/blobs/YiVNG_eX4kjv2j9J0hjW1704u_3MH7EaLYldYO02VnI=.webp)\n\n\nThe Content Creative Brief Template is an essential instrument for writers and designers, offering a strategic roadmap to create captivating content that resonates with the audience. This type of creative brief is particularly effective for planning expansive content pieces such as ebooks, whitepapers, or case studies, although it can be adeptly tailored for more routine content creation, such as blog posts.\n\n\n### **9. Asana Campaign Lunch Creative Brief Template**\n\n\n\n![jxd4KpcHmp1Kyb5DulALZVdUryabZ9aE5pDEzBDWeOQ=](https://app.affine.pro/api/workspaces/qf73AF6vzWphbTJdN7KiX/blobs/jxd4KpcHmp1Kyb5DulALZVdUryabZ9aE5pDEzBDWeOQ=.webp)\n\n\nThe Asana Campaign Launch Creative Brief Template is a meticulously designed, comprehensive guide. It includes campaign objectives, target audience insights, and creative strategies. This template ensures a harmonized campaign launch, covering messaging and visual aesthetics for a captivating impact.\n\n\n### **10. Monday.com Creative Request Template**\n\n\n\n![ZnsSh_D8b7r9YenKkgucntdJULTcZF-R-EMyaPb3psQ=](https://app.affine.pro/api/workspaces/qf73AF6vzWphbTJdN7KiX/blobs/ZnsSh_D8b7r9YenKkgucntdJULTcZF-R-EMyaPb3psQ=.webp)\n\n\nThe Creative Brief Request Template sets the stage, translating marketing aspirations into reality. Submission of the online form triggers a harmonious dance on monday.com, with Slack notifications gently rousing the team lead, and a timer marking the passage of time.\n\n\n# **Select the Best Creative Brief Template Now.**\n\n\nA creative brief is not merely a document but an essential tool that promotes clear and concise communication. By preventing last-minute changes, misunderstandings, and conflicting objectives, it saves time and brings your team together to [make the idea shine](https://affine.pro/blog/10-best-whiteboard-layout-ideas-boost-your-productivity). This article presents a selection of templates from AFFiNE, Asana, Notion, Aha!, Monday.com, and ClickUp, each designed to provide a clear task overview and foster collaboration towards shared goals. We believe that these templates will enhance productivity and ensure consistent outcomes, bringing your creative visions to life.\n\n\nThis article presents the top 10 Creative Brief Templates to guide you in [designing customized](https://affine.pro/blog/free-customized-travel-itinerary-planner-templates) brief that tailored to your specific needs. Incorporating the right tools can undoubtedly propel your business to success. After scrutinizing a myriad of top-tier, free tools, we believe that one app truly shines in this arena: AFFiNE.\n\n\nGet ready to embrace the stable version of AFFiNE, your trusted companion in the creation of meticulous briefs. Continuously honing its capabilities, AFFiNE is committed to supporting your journey to business success.\n\n\n* Official Website: [https://affine.pro/](https://affine.pro/)\n\n\n* GitHub: [https://github.com/toeverything/AFFiNE](https://github.com/toeverything/AFFiNE)\n\n\n* Discord: [https://discord.gg/Arn7TqJBvG](https://discord.gg/Arn7TqJBvG)\n\n\n* Twitter: [https://twitter.com/AffineOfficial](https://twitter.com/AffineOfficial)\n\n\n",
  "publish": true
}