{
  "title": "Supercharge Your Day: 10 Free Customized Checklist Templates to Streamline Your Schedule.",
  "authors": [
    "Yanxi Liu"
  ],
  "tags": [
    "Content"
  ],
  "description": "Unleash Your Productivity: Discover the Top 10 Free Custom Checklist Templates for Seamless Project Management.",
  "created": 1718323200000,
  "updated": 1718323200000,
  "layout": "blog",
  "id": "6CF2g2BsCwUx1KHEBuY3u",
  "slug": "10-free-and-customized-templates",
  "cover": "/blobs/bEhv5wat6XUquk-8MrEhdjS23Qo3BfVfTQCgW45scdE=",
  "md": "---\n\n\ntitle: \"Supercharge Your Day: 10 Free Customized Checklist Templates to Streamline Your Schedule.\"\n\n\nauthor: \"Yanxi Liu\"\n\n\ntags: Content\n\n\nslug: 10-free-and-customized-templates\n\n\ndescription: \"Unleash Your Productivity: Discover the Top 10 Free Custom Checklist Templates for Seamless Project Management.\"\n\n\ncreated: 2024-06-14\n\n\nupdated: 2024-06-14\n\n\nlayout: blog\n\n\npublish: true\n\n\n---\n\n\n\n![bEhv5wat6XUquk-8MrEhdjS23Qo3BfVfTQCgW45scdE=](/blobs/bEhv5wat6XUquk-8MrEhdjS23Qo3BfVfTQCgW45scdE=)\n\n\nChecklists are not just for grocery shopping or mundane tasks—they are powerful tools that have revolutionized industries, from aviation to manufacturing, and now, they are set to transform the way we approach our daily routines and long-term goals. These unsung heroes of productivity are about to become your secret weapon for success, whether you're a student navigating the complexities of academia or a professional climbing the corporate ladder.\n\n\nIn this article, we'll explore the top 10 free, customizable checklist templates to boost your productivity and help you achieve your goals. So, get ready to embrace a more organized and successful future!\n\n\n# **What Does a Checklist Template Do?**\n\n\nA checklist is a powerful tool that helps ensure no task is overlooked when working towards a specific goal. It serves as a guide, enhancing accuracy and consistency, especially for processes or activities that need to be executed correctly. The design of a checklist depends on the specific requirements of the project or task at hand, and it should always be tailored to the user's needs. Checklists also help you stay focused and ensure that all necessary steps are completed in the right sequence. They provide clear direction and boost your confidence in task completion. By properly addressing each item, checklists improve efficiency and enhance your overall workflow.\n\n\n# **Five Reasons for Why Use Checklist Template?**\n\n\n\n![LQdfNyQ7KrWYtXvJBMKVgNCbn3iDhKYtQcAUzzuXgQY=](/blobs/LQdfNyQ7KrWYtXvJBMKVgNCbn3iDhKYtQcAUzzuXgQY=)\n\n\n1. **Delegate Tasks:** Breaking down a daunting task into manageable, step-by-step guides makes it approachable. A checklist helps you delegate and boost your confidence by providing a clear path to completion, ensuring nothing is missed.\n\n\n1. **Clarity and Productivity:** A [well-organized to-do list](https://affine.pro/blog/top-12-to-do-list-excel-templates-examples-free-download) helps you prioritize tasks and stay focused. It minimizes distractions and enhances productivity, making audits and inspections a breeze while reducing errors.\n\n\n1. **Enhanced Organization:** With a properly configured checklist, you can stay on top of projects. It ensures you don't skip critical steps, keeping all essential records in one place for easy reference, especially crucial for employee health and safety.\n\n\n1. **Boost Work Quality:** Delivering complete and high-quality work is key. [A clear to-do list](https://affine.pro/blog/top-12-to-do-list-excel-templates-examples-free-download) ensures you don't miss any steps and gives each task the attention it deserves, resulting in impeccable outcomes.\n\n\n1. **Foster Motivation:** Checklists keep you motivated by helping you focus on one task at a time. The sense of accomplishment from ticking off tasks fuels your drive to tackle the next challenge.\n\n\n# **What are the 4 Essential Elements of Best Checklist Template？**\n\n\n\n![BSjxfjrIISMjcb90bmIoOg3q3YJpNcS_h5vQ2uRjYaU=](/blobs/BSjxfjrIISMjcb90bmIoOg3q3YJpNcS_h5vQ2uRjYaU=)\n\n\n1. **Tailored to You:** First and foremost, a checklist should be unique to its user. While a standard checklist can be a great starting point, true power lies in customization. Adapt it to fit your specific requirements and workflow—make it your own.\n\n\n1. **Fostering Teamwork and Discipline:** A well-crafted checklist promotes a culture of collaboration and disciplined action. It's not just about checking off boxes; it's about using the checklist as a tool to achieve a shared goal.\n\n\n1. **Ever-Evolving:** The best checklists are living documents that are regularly reviewed and refined. Change is inevitable, and a good checklist adapts to new insights, challenges, and environments.\n\n\n1. **Precision and Efficiency:** A practical checklist is precise, efficient, and user-friendly, even in high-pressure situations. It should be designed to remind users of critical steps without replacing their experience, training, or skills.\n\n\n# **Top 10 Free Customized Checklist Templates You Should Download Now**\n\n\n### **1. AFFiNE Hiring Checklist Template**\n\n\n\n![8BDs_R0W9sYdjS7iiJMXX5BYtxHylAEXN9qHumBQmRs=](/blobs/8BDs_R0W9sYdjS7iiJMXX5BYtxHylAEXN9qHumBQmRs=)\n\n\nThe AFFiNE Hiring Checklist Template serves as an invaluable tool to facilitate a seamless and efficient onboarding process for your new hires. This beginner-friendly template empowers your HR team to actively manage the onboarding journey, offering [a streamlined and organized experience](https://affine.pro/blog/best-free-task-management-software-streamline-workflow). Alternatively, it can be effortlessly transitioned into a self-management resource for new employees, guiding them through their initial weekly tasks and providing a comprehensive checklist to review all onboarding documentation. Through this template, your company can ensure that new members feel welcomed, acquainted with their roles.\n\n\n### \n\n\n### **2. AFFiNE Basic Task Checklist Template**\n\n\n\n![xOnMeHyHbhwc_iypMJXuWqEID92sipeXZdJDmWBX74g=](/blobs/xOnMeHyHbhwc_iypMJXuWqEID92sipeXZdJDmWBX74g=)\n\n\nElegantly simple in its design, this AFFiNE Task Checklist template presents a fundamental outline, gracefully complemented by [a kanban view](https://affine.pro/blog/free-kanban-board-templates-examples-boost-work-efficiency) that can be tailored to your personal style. The flexibility of this template allows you to change the kanban view into a table view, and easily adjust the list by moving blocks to prioritize tasks. This template not only boasts great visual appeal but also excels in functionality, with dedicated sections for noting the due date and status of each task, thereby facilitating a seamless and efficient planning journey.\n\n\n\n\n\n### **3. ClickUp Product Launch Checklist Template**\n\n\n\n![R5R11wS2aL5rbFMhNFC90ArZUlhbT2dt94kbjnAQ6BI=](/blobs/R5R11wS2aL5rbFMhNFC90ArZUlhbT2dt94kbjnAQ6BI=)\n\n\nThe ClickUp Product Launch Checklist Template is an invaluable tool for product launches or re-launches. It offers a comprehensive suite of organizational features, including a Gantt chart, visual timeline, well-defined milestones, and exhaustive to-do lists. The template's customization options are noteworthy, with custom fields ensuring no detail is overlooked. The integration with the RACI Matrix delineates roles and responsibilities, fostering a shared vision of success. This template ensures every task requisite for a unique launch is accounted for, providing a seamless and efficient experience.\n\n\n\n\n\n### **4. ClickUp Change Management Checklist Template**\n\n\n\n![_sx6nh9Lw6PvyTIdT4DhITmWMkzCiUPgJvr6XCNJZYM=](/blobs/_sx6nh9Lw6PvyTIdT4DhITmWMkzCiUPgJvr6XCNJZYM=)\n\n\nThe Click Up Change Management Checklist Template is a comprehensive tool that transforms daunting changes into exciting opportunities. With this template, you'll geek out over the numerous functions and features designed to navigate transitions effortlessly. This includes a getting-started guide, a monthly checklist, a calendar view, a timeline, and even custom fields to ensure a seamless implementation process. The template also facilitates team performance reviews, ensuring that everyone is on the same page.\n\n\n\n\n\n### **5. Gantt Chart Task List Template**\n\n\n\n![rS99amluP0_1VCVavwKEPomtNGENbUCk8MGoDeCQNBY=](/blobs/rS99amluP0_1VCVavwKEPomtNGENbUCk8MGoDeCQNBY=)\n\n\nVisualize your scheduled tasks and embark on a journey of efficient time management with this meticulously crafted Gantt Chart Template. Often employed in the realm of project management, a Gantt chart presents a distinctive perspective by illustrating the duration of each task as a horizontal bar, seamlessly spanning start and end dates. This innovative visualization facilitates a profound understanding of the different project phases, unravels intricate dependencies, and provides a strategic framework for task prioritization.\n\n\n\n\n\n### **6. Word Business Trip Checklist Template**\n\n\n\n![X8sQsxZZ5yTpRuNcZd4vXVl11AqFdE76x-ab-E5eQG4=](/blobs/X8sQsxZZ5yTpRuNcZd4vXVl11AqFdE76x-ab-E5eQG4=)\n\n\nWhen you use this checklist to prepare for your next business trip, you’ll know that everything back home and at the office is taken care of—and you can focus on your work goals.\n\n\nThis template includes four sections: one for preparing the office, one for preparing your home, one for packing, and one for information to leave with caregivers. It’ll give you peace of mind while you’re away. ✌️\n\n\n\n\n\n### **7. Google Docs Construction Checklist Template by Template.net**\n\n\n\n![4GyZjxhKA4KwtD8oVypaErLhpIfrezqYKX31cMicvY0=](/blobs/4GyZjxhKA4KwtD8oVypaErLhpIfrezqYKX31cMicvY0=)\n\n\nPrepare for your next construction project with this checklist template. It’s a contract signing through final home inspection checklist, and it covers all the steps in between. It can be used as a daily tracker template or your doc for everything in the project from start to finish.\n\n\nWhether your construction team is working on a new build or an extensive remodel, this list will help you keep track of every step and the contractor who’s in charge of it.\n\n\n\n\n\n### **8. Excel Checklist Template**\n\n\n\n![sPvjTDBnSmtY-dgFMtn9nAmTqfIGuarpcbY_IKynPNs=](/blobs/sPvjTDBnSmtY-dgFMtn9nAmTqfIGuarpcbY_IKynPNs=)\n\n\nThis Microsoft Excel template will [help you create a to-do list](https://affine.pro/blog/top-12-to-do-list-excel-templates-examples-free-download) and categorize it based on the due date, priority, and area of your life where it’s most relevant.\n\n\nGet an overview of your personal, family, home, and work projects in one place, and track your daily and weekly progress with colorful bar graphs in this Excel format. because who doesn’t love a graph to see your daily checklist or weekly tasks! 📊\n\n\n\n\n\n### **9. Google Sheets Checklist Template**\n\n\n\n![ZIZuC-bOhWEOzKP9RVmIpuUd_InglcVJPdIi6Qta9DQ=](/blobs/ZIZuC-bOhWEOzKP9RVmIpuUd_InglcVJPdIi6Qta9DQ=)\n\n\nThis simple to-do list template is an easy way to track your daily tasks with checkboxes and editable list items. You’ll have to create your own to-dos, but that makes it a flexible list template for tracking your chores, creating a shopping list, or staging a project where you need to complete one task before moving onto the next.\n\n\nIt’s not the best template for organized complex projects, but it makes a good daily checklist template.\n\n\n\n\n\n### **10. Action Item List Template**\n\n\n\n![n9jlpJVthlBHa233ZtXDGgQwwnQTWtgmcU_lwBvsx2w=](/blobs/n9jlpJVthlBHa233ZtXDGgQwwnQTWtgmcU_lwBvsx2w=)\n\n\nHelp your team stay organized and on task with this action item list from Smartsheet. The template includes a tracking number for each action item, start and due dates, the assigned owner for each task, and a notes section for adding updates or resolving issues. By defining and [scheduling tasks](https://affine.pro/blog/11-free-customizable-weekly-schedule-planner-templates-2023) as actionable items, you can track individual and team progress — and in the process, create a useful communication tool for all team members.\n\n\n# **Select the best Checklist Template that align with your personal habits.**\n\n\nThe creation of effective Checklist Templates is a cornerstone of efficient time management for individuals. These templates not only provide a clear task overview but also ensure that groups work in unison towards shared goals, thereby boosting productivity and delivering consistent outcomes. This article presents the top 10 Checklist Templates to guide you in [designing customized checklists](https://affine.pro/blog/free-customized-travel-itinerary-planner-templates) tailored to your specific needs.\n\n\nIncorporating the right tools can [streamline your checklist creation process](https://affine.pro/blog/best-free-task-management-software-streamline-workflow). We've examined several top-notch, free tools that stand out in this arena: **AFFiNE**\n\n\nGet ready to welcome the stable version of AFFiNE, your trusted partner in crafting checklists. Continuously refining its capabilities to support your business success.\n\n\n* Official Website: [https://affine.pro/](https://affine.pro/)\n\n\n* GitHub: [https://github.com/toeverything/AFFiNE](https://github.com/toeverything/AFFiNE)\n\n\n* Discord: [https://discord.gg/Arn7TqJBvG](https://discord.gg/Arn7TqJBvG)\n\n\n* Twitter: [https://twitter.com/AffineOfficial](https://twitter.com/AffineOfficial)\n\n\n\n\n\n\n\n\n\n\n\n\n\n\n\n\n\n\n\n\n\n\n\n\n\n\n\n\n\n\n\n\n\n\n\n\n\n\n\n\n\n\n\n\n\n\n\n\n\n\n\n\n\n",
  "publish": true
}