{
  "title": "10 Free Meeting Agenda Templates to maximizes the meetingâ€™s effectiveness (Examples & Tips) ",
  "authors": [
    "Yanxi Liu"
  ],
  "tags": [
    "Content"
  ],
  "description": null,
  "created": 1710720000000,
  "updated": 1710720000000,
  "layout": "blog",
  "id": "gMuvXuqg3GNnU-xX3JhM5",
  "slug": "10-free-meeting-agenda-template-to-maximizes-the-meeting-effectiveness-examples-and-tips",
  "cover": "https://app.affine.pro/api/workspaces/qf73AF6vzWphbTJdN7KiX/blobs/Odl8OsLIW9x6vlF7DQ7qAaRjIk2Pub0XqX0lj7yv2kc=.webp",
  "md": "---\n\ntitle: \"10 Free Meeting Agenda Templates to maximizes the meetingâ€™s effectiveness (Examples & Tips) \"\n\nauthor: \"Yanxi Liu\"\n\ntags: Content\n\nslug: 10-free-meeting-agenda-template-to-maximizes-the-meeting-effectiveness-examples-and-tips\n\nDescription: \"Unlock the power of productive me with 10 free meeting agenda templates. Boost effectiveness and engagement with expert examples and valuable tips.\"\n\ncreated: 2024-03-18\n\nupdated: 2024-03-18\n\nlayout: blog\n\npublish: true\n\n---\n\n\n![Odl8OsLIW9x6vlF7DQ7qAaRjIk2Pub0XqX0lj7yv2kc=](https://app.affine.pro/api/workspaces/qf73AF6vzWphbTJdN7KiX/blobs/Odl8OsLIW9x6vlF7DQ7qAaRjIk2Pub0XqX0lj7yv2kc=)\n\nAre you tired of spending hours creating meeting agendas from scratch? Look no further! We've got something amazing for you. Introducing our collection of 10 Free Meeting Agenda Templates that will revolutionize the way you conduct your meetings. These templates will be your secret weapon for [efficient and engaging meetings.](https://affine.pro/blog/how-to-create-kickoff-meeting-agenda-step-by-step-guide) Designed to save you time and boost collaboration, they're a game-changer for any [team](https://affine.pro/blog/asana-vs-monday.com-which-is-best-for-your-team).\n\nWhy settle for mediocrity when you can have extraordinary meetings? Get your hands on these free templates today and unleash the power of [productive](https://affine.pro/blog/best-free-whiteboard-layout-ideas-organization) discussions. Elevate your team's success with a closer look at this article!\n\n# **What is a meeting agenda?**\n\nA well-crafted meeting agenda acts as a strategic guide, mapping out the meeting's objectives, topics, and time allocation. It empowers participants with a clear framework, ensuring an organized and fruitful discussion that maximizes efficiency and productivity.\n\n# **How to write a meeting agenda**\n\n1. **Define the objective:** Clearly state the meeting's purpose and what you aim to achieve. For example, \"Discuss marketing strategy for Q2\" or \"Brainstorm ideas for new product development.\"\n1. **Identify agenda items:** List the topics to be discussed or addressed during the meeting. Include specific details or questions to guide the conversation. For instance, \"Sales performance review: Identify challenges and propose solutions\" or \"[Team collaboration tools](https://affine.pro/blog/asana-vs-monday.com-which-is-best-for-your-team): Evaluate options and make a recommendation.\"\n1. **Allocate time:** Estimate how much time to allocate for each agenda item. This will help you manage the meeting's duration and ensure that important topics receive adequate attention. For example, \"Sales performance review (15 minutes)\" or \"Team collaboration tools (30 minutes).\"\n1. **Order the agenda items:** Arrange them in a logical sequence for smooth flow. Consider starting with a warm-up activity or addressing urgent matters first.\n1. **Share in advance:** Distribute the agenda to participants before the meeting. This allows them to come prepared, gather any necessary information, and contribute effectively.\n# **Tips to create an effective meeting agenda**\n\n1. **Use clear headings:** Organize the agenda with clear and descriptive headings for each agenda item. This helps participants quickly understand the purpose of each discussion topic.\n1. **Include time estimates:** Allocate estimated time for each agenda item to ensure the meeting stays on track. This helps participants manage their time and allows for effective time management during the meeting.\n1. **Prioritize important topics:** Place the most critical or time-sensitive topics at the beginning of the agenda. This ensures that important discussions are addressed when participants are most attentive and focused.\n1. **Leave room for flexibility:** Include a section for \"Other Business\" or \"Open Discussion\" to allow participants to bring up additional topics or concerns. This provides flexibility and encourages active participation from all attendees.\n# **Why are meeting agendas important?**\n\nMeeting agendas are important because they help maximize the potential of each meeting. Whether you're working remotely or meeting in person, meetings can be draining without a clear focus. Starting with small talk may be enjoyable, but it doesn't contribute to goal-oriented and [productive](https://affine.pro/blog/best-free-whiteboard-layout-ideas-organization) discussions. By using a meeting agenda, you can ensure that your team stays focused, achieves [objectives](https://affine.pro/blog/best-free-okr-templates-2023), and makes the most of their time together.\n\n# **10 Free Meeting Agenda Template Examples**\n\nNow it's time to look at these free meeting agenda templates. All of them can provide a starting point for structuring your meetings and can be customized to fit your specific needs.\n\n## **1. Basic Meeting Agenda Note Template by [AFFiNE](http://affine.proaffine.pro)**\n\n\n![X9g_HJjEKKUKaOtpzLBXsNHaE2JhQL10x7QFqCcanwI=](https://app.affine.pro/api/workspaces/qf73AF6vzWphbTJdN7KiX/blobs/X9g_HJjEKKUKaOtpzLBXsNHaE2JhQL10x7QFqCcanwI=)\n\nThis simple and straightforward meeting note template includes sections for meeting details, key takeaways, and action items.\n\n## **2. Team Meeting Agenda Template by AFFiNE**\n\n\n![fbvgTUz5-lyIwQ4TFjXrxpSiFzhS1wtUhbSWYSnqHXE=](https://app.affine.pro/api/workspaces/qf73AF6vzWphbTJdN7KiX/blobs/fbvgTUz5-lyIwQ4TFjXrxpSiFzhS1wtUhbSWYSnqHXE=)\n\nSpecifically designed for team meetings, this template includes sections for team updates, discussion topics, and next steps.\n\n## **3. Project Kickoff Meeting Agenda Template by AFFiNE**\n\n\n![Y6tL6yE9zUbkdv7j9rek2B7A5hmXc-gO7sfqbuNI98Q=](https://app.affine.pro/api/workspaces/qf73AF6vzWphbTJdN7KiX/blobs/Y6tL6yE9zUbkdv7j9rek2B7A5hmXc-gO7sfqbuNI98Q=)\n\nThis template is tailored for [project kickoff meetings](https://affine.pro/blog/how-to-create-kickoff-meeting-agenda-step-by-step-guide), covering project objectives, roles and responsibilities, and project timelines.\n\n## **4. Board Meeting Agenda Template**\n\n\n![WyXuEv-YYnyB-_5j6E2_fYMKMrIJLMaqeWmRqsuY2-8=](https://app.affine.pro/api/workspaces/qf73AF6vzWphbTJdN7KiX/blobs/WyXuEv-YYnyB-_5j6E2_fYMKMrIJLMaqeWmRqsuY2-8=)\n\nIdeal for board meetings, this template includes sections for reviewing previous minutes, discussing agenda items, and voting on decisions.\n\n## 5. **Brainstorm Meeting Agenda Template by Owl Labs**\n\n\n![JwjvHN-uwbatKMMPKxIq4hBU3V9-zXIRzZO4adU9nM4=](https://app.affine.pro/api/workspaces/qf73AF6vzWphbTJdN7KiX/blobs/JwjvHN-uwbatKMMPKxIq4hBU3V9-zXIRzZO4adU9nM4=)\n\nThis creative brainstorming meeting agenda is a great way to keep your brainstorming meetings on track from week to week.\n\n## 6. **Marketing meeting agenda template by Hugo**\n\n\n![WG853WthMsVZ_xvNMFom4a4NU03pG-GHzLaLqnmLlZU=](https://app.affine.pro/api/workspaces/qf73AF6vzWphbTJdN7KiX/blobs/WG853WthMsVZ_xvNMFom4a4NU03pG-GHzLaLqnmLlZU=)\n\nThis marketing meeting agenda will help marketing department to celebrate wins, align on goals, and identify project blockers.\n\n## **7. Training Session Agenda Template**\n\n\n![2XACKTX5YwNrKUrEnKTL4_sJUBpRIAQZiUzdyEALTmw=](https://app.affine.pro/api/workspaces/qf73AF6vzWphbTJdN7KiX/blobs/2XACKTX5YwNrKUrEnKTL4_sJUBpRIAQZiUzdyEALTmw=)\n\nPerfect for training sessions, this template includes sections for learning [objectives](https://affine.pro/blog/best-free-okr-templates-2023), training activities, and evaluation.\n\n## **8. Performance Improvement Plan (PIP) Meeting Agenda Template by Hypercontext**\n\n\n![br9LN-MC_59E5MzgmT5fe38TDCPN0V4ie2jfNKvhdtE=](https://app.affine.pro/api/workspaces/qf73AF6vzWphbTJdN7KiX/blobs/br9LN-MC_59E5MzgmT5fe38TDCPN0V4ie2jfNKvhdtE=)\n\nThe purpose of a PIP is to save an employee, turn them around and fix whatever issues are present. In many cases, a PIP is used as a last resort.\n\n## **9. Committee Meeting Agenda Template by Vertex42**\n\n\n![0UZFdJpDiOKqAFzq9I41a9dOb3ePusoIkMv5IdcwqX0=](https://app.affine.pro/api/workspaces/qf73AF6vzWphbTJdN7KiX/blobs/0UZFdJpDiOKqAFzq9I41a9dOb3ePusoIkMv5IdcwqX0=)\n\nThis template is suitable for committee meetings, this template covers committee reports, discussion topics, and decisions.\n\n## **10. One-on-One Meeting Agenda Template by Hypercontext**\n\n\n![2ADUWOU9YF_8YE1IuXF8-LkIZopFVlux7qypPWB4rLY=](https://app.affine.pro/api/workspaces/qf73AF6vzWphbTJdN7KiX/blobs/2ADUWOU9YF_8YE1IuXF8-LkIZopFVlux7qypPWB4rLY=)\n\nDesigned for individual meetings, this template includes sections for goal setting, progress review, and feedback.\n\n# Running an Effective Meeting With AFFiNE\n\n<div style=\"text-align:center;\">\n<iframe width=\"560\" height=\"315\" src=\"https://www.youtube.com/embed/WqOe9HgpsDY?si=PHGuSeRbOT9GxuPO\" title=\"YouTube video player\" frameborder=\"0\" allow=\"accelerometer; autoplay; clipboard-write; encrypted-media; gyroscope; picture-in-picture; web-share\" allowfullscreen></iframe>\n</div>\n\nWe all understand the importance of creating an effective [meeting agenda](https://affine.pro/blog/how-to-create-kickoff-meeting-agenda-step-by-step-guide) and how this will contribute to company success. So why wait? Consider using AFFiNE, the next-generation project management and [team cooperation](https://affine.pro/blog/asana-vs-monday.com-which-is-best-for-your-team) tool.\n\nBy using AFFiNE, you can consolidate your meeting agenda, minutes, and action items into a single platform, eliminating the need for multiple tools. With seamless sharing capabilities, you can effortlessly distribute the agenda to your team and assign items in real-time, ensuring nothing gets overlooked.\n\nPresently, AFFiNE has launched its [**Stable Version**](https://affine.pro/download), with ongoing efforts to develop a more comprehensive and dependable iteration. Join us on our voyage through our social media channels and be part of the experience. **Come and join us on our journey over on our media platforms. ðŸš€**\n\n* Official Website: [https://affine.pro/](https://affine.pro/)\n* GitHub: [https://github.com/toeverything/AFFiNE](https://github.com/toeverything/AFFiNE)\n* Discord: [https://discord.gg/Arn7TqJBvG](https://discord.gg/Arn7TqJBvG)\n* Twitter: [https://twitter.com/AffineOfficial](https://twitter.com/AffineOfficial)\n\n\n",
  "publish": true
}