{
  "title": "10 Free Editable RACI Chart Templates & Examples for Excel and PowerPoint",
  "authors": [
    "Yiyang Zhang"
  ],
  "tags": [
    "Content"
  ],
  "description": "Discover the top 10 free editable RACI chart templates that improve overall project efficiency. Prioritize teamwork with our diverse gallery of templates for all your needs.",
  "created": 1710115200000,
  "updated": 1710115200000,
  "layout": "blog",
  "id": "5JP9Y8utwyt-2m0_LS_WK",
  "slug": "10-free-editable-raci-chart-templates-examples",
  "cover": "https://app.affine.pro/api/workspaces/qf73AF6vzWphbTJdN7KiX/blobs/xkCaj615Oko_keqD3T2x164f0GaKW2OUPIeVbID6huE=.webp",
  "md": "---\n\ntitle: \"10 Free Editable RACI Chart Templates & Examples for Excel and PowerPoint\"\n\nauthor: \"Yiyang Zhang\"\n\ntags: Content\n\nslug: 10-free-editable-raci-chart-templates-examples\n\ndescription: \"Discover the top 10 free editable RACI chart templates that improve overall project efficiency. Prioritize teamwork with our diverse gallery of templates for all your needs.\"\n\ncreated: 2024-03-11\n\nupdated: 2024-03-11\n\nlayout: blog\n\npublish: true\n\n---\n\n\n![xkCaj615Oko_keqD3T2x164f0GaKW2OUPIeVbID6huE=](https://app.affine.pro/api/workspaces/qf73AF6vzWphbTJdN7KiX/blobs/xkCaj615Oko_keqD3T2x164f0GaKW2OUPIeVbID6huE=.webp)\n\nAre you tired of confusion surrounding responsibilities within your team?\n\nEnter the RACI chart, a powerful tool to clarify roles and streamline workflow. In this article, we will explore everything you need to know about RACI [charts](https://affine.pro/blog/10-best-free-chore-chart-templates-kids-adults) and provide you with 10 free editable templates to enhance task delegation in Excel and PowerPoint. Let's dive in and revolutionize how your team collaborates!\n\n# **What is a RACI Matrix?**\n\nA RACI matrix is a tool that defines and clarifies roles and responsibilities within an organization or project. The acronym RACI stands for Responsible, Accountable, Consulted, and Informed. The \"Responsible\" role designates the person or team responsible for completing a specific task. The \"Accountable\" individual takes ultimate ownership of the task's success or failure. Those who are \"Consulted\" provide input and expertise during task execution. Individuals marked as \"Informed\" are kept up-to-date on progress but do not play an active role. By using a RACI matrix, teams can avoid confusion surrounding duties, enhance communication channels, increase accountability levels, and ultimately [improve overall project efficiency](https://affine.pro/blog/8-free-project-tracker-templates-work-management-2023).\n\n# **How to Create a RACI Chart?**\n\nCreating a RACI chart is a straightforward process that can help streamline project management and improve team clarity.\n\n\n![rkplH7HhgrVOoJYbLJjmQMMRGP0p5k0Utr3UOCAuIBM=](https://app.affine.pro/api/workspaces/qf73AF6vzWphbTJdN7KiX/blobs/rkplH7HhgrVOoJYbLJjmQMMRGP0p5k0Utr3UOCAuIBM=.webp)\n\n**Step 1: Task Identification**\n\n* Begin by listing all tasks or activities required for project completion.\n\n**Step 2: Responsibility Assignment**\n\n* Identify individuals responsible for each task, who hold ultimate accountability for its successful completion.\n\n**Step 3: Accountability Determination**\n\n* Determine accountable parties who oversee task success without direct execution, ensuring alignment with project objectives.\n\n**Step 4: Consultation Designation**\n\n* Designate key stakeholders whose input is crucial before finalizing decisions or actions, enhancing project quality and [stakeholder engagement](https://affine.pro/blog/10-best-free-performance-review-templates-examples-2023).\n\n**Step 5: Information Specification**\n\n* Specify individuals who should be informed of project progress regularly, promoting transparency and maintaining stakeholder alignment.\n\nFollowing these steps meticulously ensures the creation of a comprehensive RACI chart that fosters [collaboration](https://affine.pro/blog/how-to-write-marketing-action-plan-step-by-step-guide), accountability, and ultimately, project success.\n\n\n\n# **10 Best Free RACI Chart Templates**\n\nLooking for the best free RACI chart templates to streamline your project management process? Look no further! We've curated a list of 10 top-notch options that are sure to enhance your task delegation and accountability.\n\n#### 1. **[AFFiNE](https://affine.pro/) Cross-Functional Team RACI Matrix**\n\n\n![uPMc5AXXcgwQ4lT-yOPNmQ6BHrNNjugSNmejXHYjCLo=](https://app.affine.pro/api/workspaces/qf73AF6vzWphbTJdN7KiX/blobs/uPMc5AXXcgwQ4lT-yOPNmQ6BHrNNjugSNmejXHYjCLo=.webp)\n\nThe AFFiNE cross-functional team RACI matrix template aims to streamline project management and enhance collaboration within diverse teams. Made up of a comprehensive breakdown of tasks and corresponding responsibilities, this template facilitates clear communication and accountability across various functional areas. Ideal for complex projects involving multiple departments, this matrix helps [clarify responsibilities across teams](https://affine.pro/blog/business-owner-value-team-pi-objectives).\n\n#### 2. **[AFFiNE](https://affine.pro/) Weekly RACI Chart Template**\n\n\n![fLPfHqyNDnEjNW1jUz--_Nio2mNF4nK7ugpJ2jNO5iY=](https://app.affine.pro/api/workspaces/qf73AF6vzWphbTJdN7KiX/blobs/fLPfHqyNDnEjNW1jUz--_Nio2mNF4nK7ugpJ2jNO5iY=.webp)\n\nThe AFFiNE weekly RACI matrix template is designed to help manage task delegation and accountability within projects weekly. This template provides clear task definitions and corresponding responsibilities to help coordinate tasks effectively and track progress throughout the week. Assigning roles such as Responsible, Accountable, Consulted, and Informed for each task ensures a smooth workflow and alignment toward weekly objectives.\n\n#### 3. **[Vertex42](https://www.vertex42.com/ExcelTemplates/raci-matrix.html) RACI Matrix Template**\n\n\n![jd2kt6_AafYzTQI9_DSb_-6GFn11_Hs7WbcWemLK_WY=](https://app.affine.pro/api/workspaces/qf73AF6vzWphbTJdN7KiX/blobs/jd2kt6_AafYzTQI9_DSb_-6GFn11_Hs7WbcWemLK_WY=.webp)\n\nThe Vertex42 RACI matrix template is a free tool that is both simple and customizable. The matrix is color-coded using automated conditional formatting. You can assign R, A, C, or I values by selecting from a drop-down box or entering combined roles such as A/R. Additionally, you can edit the table of abbreviations and descriptions to customize this template for other variants of this method, such as DRASCI, RASI, RASIC, CAIRO, and so on.\n\n#### 4. **[ProjectManager](https://www.projectmanager.com/templates/raci-matrix-template) RACI Matrix Template for Excel**\n\n\n![ruPR3a7sx3cVsHWysNwJa39M99IN7kPTe9nFPf6fAIQ=](https://app.affine.pro/api/workspaces/qf73AF6vzWphbTJdN7KiX/blobs/ruPR3a7sx3cVsHWysNwJa39M99IN7kPTe9nFPf6fAIQ=.webp)\n\nThe RACI matrix template provided by ProjectManager can be a crucial tool for ensuring the success of your project. By utilizing this document effectively, it can serve as a guiding reference that every team member can refer to as the project progresses. A well-implemented RACI matrix can keep your project on course by clearly defining who is responsible for what tasks. When each team member knows precisely what their responsibilities are, the team can avoid miscommunication, wasted time, and confusion.\n\n#### 5. **[Smartsheet](https://www.smartsheet.com/content/raci-templates-excel) Excel RACI Template**\n\n\n![tEIRkpo8WcNdOCM_5n61dtDOaVLsaxa8Jst9dz3-CBg=](https://app.affine.pro/api/workspaces/qf73AF6vzWphbTJdN7KiX/blobs/tEIRkpo8WcNdOCM_5n61dtDOaVLsaxa8Jst9dz3-CBg=.webp)\n\nThis Smartsheet RACI model template is an effective tool for managing project roles and responsibilities with precision. The template's color-coded column sections divide roles into groups such as project leadership, project team members, project sub-teams, and external resources. You can then assign tasks to individual roles, such as executive sponsor, tech lead, or subject matter expert.\n\n#### 6. **[Teamgantt](https://www.teamgantt.com/blog/responsibility-assignment-matrix-template) RACI Matrix Template for Excel**\n\n\n![7D6e4MAqwY5knToLYNgdMxLOwvU8PvT8WSCYLeDS2fo=](https://app.affine.pro/api/workspaces/qf73AF6vzWphbTJdN7KiX/blobs/7D6e4MAqwY5knToLYNgdMxLOwvU8PvT8WSCYLeDS2fo=.webp)\n\nTeamgantt offers a free, ready-made [Excel](https://affine.pro/blog/top-12-to-do-list-excel-templates-examples-free-download) RACI matrix template that you can customize for any project you manage. This blank template is fully editable, and it includes drop-downs for assigning RACI roles more easily. You can also refer to the included RACI chart example tab for guidance if you need it.\n\n#### 7. **[Miro](https://miro.com/templates/raci-matrix/) RACI Matrix Template**\n\n\n![Fs6njAGhYsjqvqzUXnG2gS7H_hXwEEYhSIR71fbeY8g=](https://app.affine.pro/api/workspaces/qf73AF6vzWphbTJdN7KiX/blobs/Fs6njAGhYsjqvqzUXnG2gS7H_hXwEEYhSIR71fbeY8g=.webp)\n\nThe Miro RACI chart template is an essential management tool that helps teams keep track of roles and responsibilities and avoid confusion during projects. From complex, cross-functional team projects to internal, ongoing tasks, a RACI matrix enables you to clarify roles and delegate tasks, bringing your team together to execute your project.\n\n#### **8. [Creately](https://creately.com/usage/raci-matrix-template/) RACI Chart Template**\n\n\n![fln4Qmp-CUK4cy7JC-T562Co15ZJt5lFiVOIaqjazjA=](https://app.affine.pro/api/workspaces/qf73AF6vzWphbTJdN7KiX/blobs/fln4Qmp-CUK4cy7JC-T562Co15ZJt5lFiVOIaqjazjA=.webp)\n\nYou can get started with a ready-made RACI chart template for project planning and management provided by Creately. Share your RACI matrix template with stakeholders and capture instant feedback with contextual comments. By using Kanban boards, timelines, and grids, you can visually [organize your project data](https://affine.pro/blog/10-best-free-online-sticky-notes-free-software-tools) on an infinite canvas and gain a comprehensive big-picture understanding of your projects.\n\n#### **9. [Venngage](https://venngage.com/templates/diagrams/raci-matrix-planning-chart-16afc712-c961-4759-8885-e9dcf28b2508) RACI Matrix Template**\n\n\n![8d2yS3bG0FX0bD8TPVYTr8Rb-evBPqdqyPTROIyduYU=](https://app.affine.pro/api/workspaces/qf73AF6vzWphbTJdN7KiX/blobs/8d2yS3bG0FX0bD8TPVYTr8Rb-evBPqdqyPTROIyduYU=.webp)\n\nThe free RACI matrix chart template offered by Venngage is the perfect tool for project managers who need to organize their team's responsibilities. By using this template, you can easily [assign tasks](https://affine.pro/blog/how-to-make-work-plan-step-by-step-guide) and keep track of their progress. Moreover, it's an ideal design to promote and share with others! You can customize it as much as you want - add colors, change sizes, and select the best photos or icons from our free stock libraries to create your perfect design in Venngage.\n\n#### **10. [SlideModel](https://slidemodel.com/templates/raci-matrix-powerpoint-template/) RACI Matrix PowerPoint Template**\n\n\n![BLR62VcXXecuqcXmYZjDHIcoxgH_NlsgWxh-UxIL4jY=](https://app.affine.pro/api/workspaces/qf73AF6vzWphbTJdN7KiX/blobs/BLR62VcXXecuqcXmYZjDHIcoxgH_NlsgWxh-UxIL4jY=.webp)\n\nThe RACI matrix PowerPoint template available on SlideModel is designed to showcase table layouts for presenting the concept and its application. The template has a slide that displays four rows of RACI with an innovative layout of bold letters and clipart icons. This RACI chart template is useful for training and educational [presentations](https://affine.pro/blog/10-best-free-storyboard-creator-software) where you can explain the definition of the RACI matrix and provide brief information about the methods.\nWith these diverse options at your disposal, you'll be equipped to tackle any project efficiently while keeping all team members accountable and engaged in the process.\n\n# **Improve Task Distribution with RACI Chart Templates**\n\nWhether you are new to using RACI charts or looking to streamline your current processes, these 10 best free templates offer a wide range of options to suit your specific needs. From simple matrix layouts to more detailed examples, with AFFiNE's templates, there is a template suitable for every project and team dynamic.\n\n<div style=\"text-align:center;\">\n<iframe width=\"560\" height=\"315\" src=\"https://www.youtube.com/embed/WqOe9HgpsDY?si=PHGuSeRbOT9GxuPO\" title=\"YouTube video player\" frameborder=\"0\" allow=\"accelerometer; autoplay; clipboard-write; encrypted-media; gyroscope; picture-in-picture; web-share\" allowfullscreen></iframe>\n</div>\n\n**Key features:**\n\n* **Template Gallery in AFFiNE:** There is a curated collection of powerful [whiteboard](https://affine.pro/blog/best-free-whiteboard-layout-ideas-organization) templates in AFFiNE. From the robust Gantt charts to the insightful Kanban board and the comprehensive project management charts, an array of additional templates awaits your exploration, promising to expand the horizons of your marketing and sales pipeline crafting and execution. These templates serve as your launchpad, enabling you to skip the groundwork and jump straight into action. Crafted for seamless collaboration, AFFiNE's templates provide structured canvases for various tasks, saving you valuable time and enhancing efficiency in project management, content creation, and [planning](https://affine.pro/blog/top-10-best-free-digital-planner-apps-2023).\n\n\n![OP3GdbE7dwmQKK2uKzBgJbhpVJxkLuDsVtomxcggvSQ=](https://app.affine.pro/api/workspaces/qf73AF6vzWphbTJdN7KiX/blobs/OP3GdbE7dwmQKK2uKzBgJbhpVJxkLuDsVtomxcggvSQ=.webp)\n\n* **Tailored Precision with AFFiNE's Database:** AFFiNE's database seamlessly integrates Kanban and Table views for dynamic charter creation. By smoothly transforming your blocks into a Kanban view, effortlessly classify based on charter properties such as date, progress, and link. This allows for intuitive drag-and-drop functionality, ensuring precise organization and alignment of your project execution. Switching to the Table view offers a comprehensive project overview, enhancing the efficiency of your narrative development. With intuitive controls, track deadlines and manage unscheduled tasks seamlessly.\n\n\n![bY0EkoVLJfBpOjymBoGUxE0LAiQuW1bNgYA-FU1OQlA=](https://app.affine.pro/api/workspaces/qf73AF6vzWphbTJdN7KiX/blobs/bY0EkoVLJfBpOjymBoGUxE0LAiQuW1bNgYA-FU1OQlA=.webp)\n\n* **Collaborative Editing:** Foster collaboration among team members by using AFFiNE's collaborative editing tools, and foster collaboration among team members. Multiple team members can work on email content simultaneously, ensuring a seamless and efficient content creation [process](https://affine.pro/blog/top-10-best-process-mapping-tools-software-2023-free-paid). Share files, exchange ideas, and provide feedback in real-time through AFFiNE. With AFFiNE, everyone can contribute to the same set of notes in real-time.\n\n\n![O88V12dZ7eALpdMD8-6eyyfRec5yZyWiQxCnvNEb3r0=](https://app.affine.pro/api/workspaces/qf73AF6vzWphbTJdN7KiX/blobs/O88V12dZ7eALpdMD8-6eyyfRec5yZyWiQxCnvNEb3r0=.webp)\n\nTake advantage of the power of RACI charts today by using [**AFFiNE**](https://affine.pro/) and start optimizing task distribution within your projects. Watch as productivity increases, collaboration improves, and projects are completed with greater success. Empower your team with clear roles and responsibilities using RACI chart templates - the key to effective task management. Presently, **AFFiNE** has launched its [**Stable Version**](https://affine.pro/download), with ongoing efforts to develop a more comprehensive and dependable iteration. Join us on our voyage through our social media channels and be part of the experience. **Come and join us on our journey over on our media platforms. ðŸš€**\n\n* Official Website: [https://affine.pro/](https://affine.pro/)\n\n* GitHub: [https://github.com/toeverything/AFFiNE](https://github.com/toeverything/AFFiNE)\n\n* Discord: [https://discord.gg/Arn7TqJBvG](https://discord.gg/Arn7TqJBvG)\n\n* Twitter: [https://twitter.com/AffineOfficial](https://twitter.com/AffineOfficial)\n\n",
  "publish": true
}