{
  "title": "The 12 Best Speedwrite Alternatives and Competitors 2024",
  "authors": [
    "Xuan Pang"
  ],
  "tags": [
    "Content"
  ],
  "description": "Discover the top 12 alternatives and competitors to Speedwrite in 2024. Explore innovative tools and platforms for boosting productivity and efficiency in your writing projects.",
  "created": 1715817600000,
  "updated": 1715817600000,
  "layout": "blog",
  "id": "NWWGgdAmJRmobExQ3HSDP",
  "slug": "12-best-speedwrite-alternatives-competitors",
  "cover": "/blobs/klT57hl_pGW0T-UtmBrBB2DfRGAi_j-VxB62OXkQIpM=",
  "md": "---\ntitle: \"The 12 Best Speedwrite Alternatives and Competitors 2024\"\nauthor: \"Xuan Pang\"\ntags: Content\nslug: 12-best-speedwrite-alternatives-competitors\ndescription: \"Discover the top 12 alternatives and competitors to Speedwrite in 2024. Explore innovative tools and platforms for boosting productivity and efficiency in your writing projects.\"\ncreated: 2024-05-16\nupdated: 2024-05-16\nlayout: blog\npublish: true\n---\n\n\n\n![klT57hl_pGW0T-UtmBrBB2DfRGAi_j-VxB62OXkQIpM=](/blobs/klT57hl_pGW0T-UtmBrBB2DfRGAi_j-VxB62OXkQIpM=)\n\n\nAre you a frequent user of [Speedwrite](https://speedwrite.com/)?\n\n\nIf so, you're already familiar with its innovative approach to [content creation](https://affine.pro/blog/top-20-free-ai-content-creation-tools)– effortlessly paraphrasing any text, on any subject, to produce 100% unique content. With Speedwrite, adhering to writing best practices becomes second nature, crafting reader-friendly content with unparalleled ease.\n\n\nSince its inception, Speedwrite has attracted a diverse user base, including students, researchers, content writers, copywriters, SEO professionals, and [marketing experts](https://affine.pro/blog/top-10-social-media-advertising-benefits-marketing-experts) alike.\n\n\n**However, despite its impressive capabilities, it's crucial to recognize Speedwrite's limitations.**While it excels at generating unique content, its speed may not always meet expectations.\n\n\nImagine needing to produce a 5000-word article – inputting the initial 5000 words approximately and waiting for Speedwrite to rephrase each one may not be the most efficient approach. Hence, we've curated this blog, offering you a selection of the 12 best speedwrite alternatives and competitors for 2024, aimed at [enhancing your workflow](https://affine.pro/blog/best-free-task-management-software-streamline-workflow).\n\n\n# **What Should You Look for in Speedwrite Alternatives?**\n\n\n\n![7SG9wUwTnd49uRjHQFwB5tzLOb0TX_nMD7Ur7TeiwMk=](/blobs/7SG9wUwTnd49uRjHQFwB5tzLOb0TX_nMD7Ur7TeiwMk=)\n\n\nWhat criteria should you consider when searching for alternatives to Speedwrite? With a plethora of [AI content generators](https://affine.pro/blog/top-20-free-ai-content-creation-tools) available, it can be challenging to discern the essential features amidst the abundance of promises. Are you prioritizing speed, originality, or collaborative capabilities? Is mobile accessibility a must? Even free Speedwrite alternatives exist, but are they worth it? Let's delve into the key features to keep in mind.\n\n\n1. **User-Friendly Interface:** Opt for solutions that offer seamless navigation and a clean, intuitive interface to enhance your writing experience.\n\n\n1. **Grammar and Spell Checking:** The primary purpose of [AI writing tools](https://affine.pro/blog/top-25-free-best-%20ai-productivity-tools) is to save time. If you find yourself manually checking grammar and spelling, the tool may not be fulfilling its intended purpose.\n\n\n1. A**dvanced Editing Capabilities:** Look for text generators that offer more than just basic content generation. Features like [natural language processing](https://www.oracle.com/th/artificial-intelligence/what-is-natural-language-processing/#:~:text=Processing%20(NLP)%3F-,Natural%20Language%20Processing%20(NLP)%20Defined,natural%20language%20text%20or%20voice.), word count, readability analysis, synonym suggestions, tone adjustments, and voice formatting can significantly enhance your [writing process](https://affine.pro/blog/quillbot-alternatives-ai-writing).\n\n\n1. **Integration and Export Options:** For professional use in marketing, sales, or product development, consider tools that seamlessly integrate with collaboration platforms and offer flexible exporting options. Integration with cloud storage services adds further convenience.\n\n\n# **The 12 Best Speedwrite Alternatives and Competitors 2024**\n\n\n## **1. [Copy.ai](https://clickup.com/blog/copy-ai-alternatives/)**\n\n\n\n![HBbOVS6vi8JEauM4wwmH1A6-xFxsMWIefCNScEhtorY=](/blobs/HBbOVS6vi8JEauM4wwmH1A6-xFxsMWIefCNScEhtorY=)\n\n\n[Copy.ai](https://www.copy.ai/) is another [popular AI writing tool](https://clickup.com/blog/ai-writing-tools/) that helps you create content faster. What differentiates Copy.ai from some of the other AI writers is that it allows you to provide very clear context, like what are the main points you want to cover, what brand guidelines to follow, and so on.\n\n\n**Key features:**\n\n\n* **Data Collection:** Chat by Copy.ai offers real-time data collection capabilities, allowing users to gather information seamlessly through conversational interfaces.\n\n\n* **Content Editor:** With an in-line doc editor, users can effortlessly edit and refine AI-generated content to ensure clarity, coherence, and accuracy.\n\n\n* **Prompts:** Copy.ai provides pre-built prompts designed to facilitate the generation of high-quality outputs for various purposes, such as blogs or [AI generated bios](https://clickup.com/blog/bio-generators/), streamlining the content creation process.\n\n\n## **2. [AFFiNE](http://www.affine.pro)**\n\n\n\n![3cHuIOWvlXd4DYnYlVqH-Y6V0rsG4kEyD7SlB8oY2i8=](/blobs/3cHuIOWvlXd4DYnYlVqH-Y6V0rsG4kEyD7SlB8oY2i8=)\n\n\nAFFiNE stands out as a state-of-the-art AI content generator app, meticulously crafted to employ AI to streamline the [organization](https://affine.pro/blog/15-types-events-event-management-categories-examples), management, and collaboration on tasks, [projects](https://affine.pro/blog/best-project-planning-tools-software-for-teams-2023),  and real-time information. Explore AFFiNE AI, your true multimodal AI copilot, dedicated to turning \"all your ideas into reality.\"\n\n\n**Key feature:**\n\n\n* **[Write](https://affine.pro/blog/how-to-write-sop-step-by-step-guide-5-best-free-tools-templates) better:** Leveraging AI technology, [AFFiNE AI](https://affine.pro/blog/affine-0-12-0-launch-week-day-3-early-access-affine-ai-self-host-upcoming-0-13-unveiled) provides intelligent assistance for every step of your writing process, from crafting sentences to entire articles. Whether you're creating content, professionally rewriting, adjusting tone, or correcting spelling and grammar, AFFiNE AI makes your text more vivid and accurate.\n\n\n\n![INHDh3kyXsl2uJt60QjeQkVcaB03eDRPmrdewQdj45k=](/blobs/INHDh3kyXsl2uJt60QjeQkVcaB03eDRPmrdewQdj45k=)\n\n\n* **[Draw](https://affine.pro/blog/top-8-figma-competitors-alternatives-design-prototyping) faster:** With the power of AI, AFFiNE AI can transform your outlines or ideas into eye-catching visual works. Whether it's creating presentations or building [mind maps](https://affine.pro/blog/top-5-mind-maps-examples-and-tools), AFFiNE AI helps you clearly express and share your creativity.\n\n\n\n![H5CNIxTdo4IoGXjI_siXOt3Dz25GicbU99DJi9jDofg=](/blobs/H5CNIxTdo4IoGXjI_siXOt3Dz25GicbU99DJi9jDofg=)\n\n\n* **[Present](https://affine.pro/blog/Best-10-Free-Online-AI-Presentation-Maker-for-Generating-Project-in-Minutes) smarter:** AFFiNE's AI-powered PowerPoint generator allows you to craft polished and presentation-ready slides with just one click. By inputting your content descriptions, AFFiNE effortlessly generates visually stunning slides that captivate your audience. This feature enables you to create professional presentations quickly and efficiently, making the process seamless and visually appealing.\n\n\n\n![bXL-j2K4UUVpjcKZtsO8IJWBakgCIjcs7f0Bfzfq0LU=](/blobs/bXL-j2K4UUVpjcKZtsO8IJWBakgCIjcs7f0Bfzfq0LU=)\n\n\n\n\n\n## **3. [ChatGPT](https://chat.openai.com/)**\n\n\n\n![OoyX_gxYM0L19_7hiVebXZJvD_QAPZ23ETjyetXwntM=](/blobs/OoyX_gxYM0L19_7hiVebXZJvD_QAPZ23ETjyetXwntM=)\n\n\n**[ChatGPT](https://chat.openai.com/)** is one of the most popular **AI tools** around. You can use it to carry out entire conversations or put it to use as a content ideation tool. However, it also comes with many features that most users don’t know about. With the right prompts, it can compose audio tracks and generate logos.\n\n\n**Key features:**\n\n\n* **Versatility in Content Creation**: GPT models, like ChatGPT, can generate a wide range of content types beyond simple paraphrasing. They can write essays, create dialogue, generate creative writing, provide detailed explanations, and even code.\n\n\n* **Contextual Understanding**: GPT models have a deep understanding of context and can maintain coherence across longer pieces of text. This means they can provide more accurate and contextually appropriate responses.\n\n\n* **Interactive and Real-Time Assistance**: GPT-powered tools can engage in interactive conversations, allowing users to refine and iterate on their content in real-time. This interactive approach facilitates a more dynamic and responsive writing process, offering immediate feedback and adjustments, which is something Speedwrite’s static paraphrasing cannot match.\n\n\n\n\n\n## **4. [ClickUp](https://www.googleadservices.com/pagead/aclk?sa=L&ai=DChcSEwir5sn_gIqFAxUhCXsHHSQJABIYABABGgJ0bQ&ase=2&gclid=EAIaIQobChMIq-bJ_4CKhQMVIQl7Bx0kCQASEAAYASABEgKqdPD_BwE&ohost=www.google.com.hk&cid=CAASJeRoIYPsfCWhqfZSePyMfBG1F8qPduy9c_JWSmCt1_se1fUURz8&sig=AOD64_14e7HtEGv8RW_sjiokh3hDgdA1nw&q&nis=4&adurl&ved=2ahUKEwiezMT_gIqFAxW0mq8BHRZbDK8QqyQoAHoECAYQDA)**\n\n\n\n![exGjzFOxWc38bllU5Frx_ei15yA_69M8rMZY-K9zBcQ=](/blobs/exGjzFOxWc38bllU5Frx_ei15yA_69M8rMZY-K9zBcQ=)\n\n\nClickUp is an all-in-one project management software that offers hundreds of customizable features to give individuals and teams the flexibility and tools they need to work smarter and boost productivity. ClickUp has launched an AI content assistant feature, ClickUp AI, a content ideation and creation tool in ClickUp Docs that help with [generating ideas, copywriting, copyediting](https://clickup.com/blog/copywriting-tools/), summarizing a long text to writing content, and so much more.\n\n\n**Key features:**\n\n\n* **Content Research and Ideation:** With this feature, users can generate instant and high-quality content ideas for various purposes such as blog posts, emails, advertising copy, and more.\n\n\n* **Copy Editing Assistance:** This functionality provides users with valuable suggestions to enhance the quality and clarity of their written content.\n\n\n## **5. [Bing AI (Microsoft Copilot)](https://www.bing.com/search?q=Bing+AI&showconv=1&FORM=hpcodx)**\n\n\n\n![L9Q6SYodxNP-x8zvaVSV-pujk327mXN3guUeQEZfLgk=](/blobs/L9Q6SYodxNP-x8zvaVSV-pujk327mXN3guUeQEZfLgk=)\n\n\nMicrosoft's close relationship with OpenAI was a positive step to [Bing Search](https://www.bing.com/search?q=Bing+AI&showconv=1&FORM=hpcodx): it can search the web and generate answers based on the results. It's also connected to DALL·E 3, so if you ask for images, you'll get four visual variations of your prompt. Microsoft is bringing all its AI features into a single name—[Microsoft Copilot](https://zapier.com/blog/microsoft-copilot/)—so look out for that rebranding across its product line.\n\n\n**Key features:**\n\n\n1. **Real-Time Collaboration**: Bing AI facilitates real-time collaboration by providing instant access to web search results and generating answers based on the information retrieved.\n\n\n1. **Contextual Awareness**: Bing AI demonstrates contextual awareness by understanding user queries and providing relevant and accurate responses tailored to the context of the search.\n\n\n1. **Multimodal Capabilities**: Bing AI offers multimodal capabilities through its integration with DALL·E 3, allowing users to request images and receive multiple visual variations of their prompts, enhancing the search experience.\n\n\n\n\n\n## **6. Wordtune**\n\n\n\n![rEI-BVEtEstZWnBln6sHcnw6LT1bUAOHR6Hm6vhJIfs=](/blobs/rEI-BVEtEstZWnBln6sHcnw6LT1bUAOHR6Hm6vhJIfs=)\n\n\n[Wordtune](https://www.wordtune.com/) helps you find plenty of wording alternatives to improve your text. When you input the text you want to check, you can easily browse synonyms, ask to rewrite entire sentences, and adapt the suggestions into a final draft.\n\n\n**Key features:**\n\n\n* **Sentence Rewriting:** Enhances sentence structure and style, providing alternative phrasing options that can improve clarity and engagement.\n\n\n* **Tone Adjustment:** Allows users to adjust the tone of their text to suit different contexts or audiences, ensuring appropriate communication.\n\n\n## **7. [Narrato](https://narrato.io/)**\n\n\n\n![xgobqjmQjTOwD7T-61vRRI1MgNxw5u66ZpwO_5jq6Lg=](/blobs/xgobqjmQjTOwD7T-61vRRI1MgNxw5u66ZpwO_5jq6Lg=)\n\n\n[Narrato](https://narrato.io/) is an AI-powered content workspace that lets you manage your entire content creation process in one place. At the core of Narrato is the powerful [AI content creation and planning assistant](https://narrato.io/workspace/features/ai-writer-tool) that assists with AI content ideation ( topic /content ideas generator), AI content creation (for multiple use cases like blog posts, web and ad copy, emails, AI images and illustrations, video script outlines, product descriptions and many more), plus content planning and optimization.\n\n\n**Key features:**\n\n\n* **AI writing assistant with multiple use cases**: Helps generate content for blogs, emails, web copy, product descriptions, press releases, emails, video scripts, etc.\n\n\n* [**SEO content brief generator**](https://clickup.com/blog/seo-project-management/): Builds content briefs in under a minute, offering keyword suggestions, most often asked questions about topics, references, and content structuring suggestions\n\n\n* **AI topic generator**: For brainstorming and ideation\n\n\n\n\n\n## **8. ProWritingAid**\n\n\n\n![sf6vU06BKjB-FlNuxvCC7xwFnpVa8CSP5FVS_ok-LB4=](/blobs/sf6vU06BKjB-FlNuxvCC7xwFnpVa8CSP5FVS_ok-LB4=)\n\n\n[ProWritingAid](https://prowritingaid.com/) is a direct competitor of Grammarly, offering plenty of statistics to help you track grammar, style, and spelling scores. One of the main advantages here is its lifetime plan, helping you leverage all these features without adding a new recurring bill. Find out which is the best for you in our [ProWritingAid vs. Grammarly](https://zapier.com/blog/prowritingaid-vs-grammarly/) comparison.\n\n\n**Key features:**\n\n\n* **Style Guide Tool:** Customizable style guides ensure that all written content adheres to brand-specific guidelines, maintaining consistency across all communications.\n\n\n* **Writing Reports:** Generates reports on overused words, sentence length, writing style, and other textual elements, providing insights that help writers refine their drafts before finalizing.\n\n\n\n\n\n## **9. [Yoast SEO](https://yoast.com/seo-for-everyone-3/)**\n\n\n\n![d1Y0pgVjeS8PxpIi36fsBMs3we-adleLOqO4FaPDxwc=](/blobs/d1Y0pgVjeS8PxpIi36fsBMs3we-adleLOqO4FaPDxwc=)\n\n\n[Yoast SEO](https://yoast.com/seo-for-everyone-3/) is a powerful WordPress plugin that helps content creators ensure that their content is optimized for search engines. The plugin provides the necessary tools to help you improve elements like meta descriptions and titles, meta keywords, readability, and content structure. The plugin uses a simple but powerful traffic light system that informs you whether your content meets the SEO requirements or not.\n\n\n**Key features:**\n\n\n* **Automated XML Sitemap Creation:** Yoast SEO stands out with its automatic XML sitemap generation, facilitating enhanced search engine comprehension of your website's structure for improved content crawling and ranking.\n\n\n* **Real-time Content Analysis:** Yoast SEO's content analysis tool offers live evaluations of your content, pinpointing areas that require SEO enhancements such as keyword optimization and link building, ensuring your content aligns with top-notch search engine ranking standards.\n\n\n\n\n\n## **10. [Zest](https://www.zest.ai/)**\n\n\n\n![S3Tho03Es8bb5q5kPCLGfW5y1KvQBUcj35X3F18o9OY=](/blobs/S3Tho03Es8bb5q5kPCLGfW5y1KvQBUcj35X3F18o9OY=)\n\n\n[Zest](https://www.zest.ai/) is a free Chrome plug-in designed specifically for content marketers. It helps content marketers create high-quality content by providing them with the best industry insights. The tool provides a feed of new marketing content to users based on the topics they have added to their preferences.\n\n\n**Key features:**\n\n\n* **Efficient Topic Search:** Zest enables users to swiftly search for specific topics, ensuring quick access to the information they need.\n\n\n* **User-Friendly Content Curation Dashboard:** With a purpose-designed, user-friendly dashboard, Zest empowers content marketers to effortlessly curate their own content, enhancing the efficiency of content curation processes.\n\n\n## **11. [AIContenfy](https://aicontentfy.com/)**\n\n\n\n![-LHXWshb6U7BR_r2-1haHr5mwQnhHDksG896WJzw6pc=](/blobs/-LHXWshb6U7BR_r2-1haHr5mwQnhHDksG896WJzw6pc=)\n\n\n[AIContenfy](https://aicontentfy.com/) uses advanced natural language processing (NLP) algorithms and machine learning (ML) models to generate content that is customized to a business's needs. The tool can create various types of content, including articles and blog posts. Users can specify their desired tone, style, and target audience, and the tool will generate content that matches these criteria.\n\n\n**Key features:**\n\n\n* **Efficient Scalability:** AIContenfy excels in generating content at scale, enabling businesses to produce large volumes quickly and allocate resources to other operational areas.\n\n\n* **Cost-Effective Content Creation:** The tool proves economical compared to hiring human writers, providing significant savings in content creation costs for businesses.\n\n\n* **Enhanced SEO Optimization:** AIContenfy enhances businesses' SEO efforts by generating content rich in relevant keywords and phrases, leading to improved visibility and higher rankings on search engine results pages (SERPs).\n\n\n## **12. [Outwrite](https://www.outwrite.com/)**\n\n\n\n![d07QbGQual01JjPhd550FdJIWOkLr_D5usku8BMmJ1E=](/blobs/d07QbGQual01JjPhd550FdJIWOkLr_D5usku8BMmJ1E=)\n\n\n\n![d07QbGQual01JjPhd550FdJIWOkLr_D5usku8BMmJ1E=](/blobs/d07QbGQual01JjPhd550FdJIWOkLr_D5usku8BMmJ1E=)\n\n\nWhile it’s not exactly a text-generating tool, but rather an [artificial intelligence-powered writing assistant](https://clickup.com/blog/writing-assistant-software/), Outwrite still makes a solid paid or free Speedwrite alternative for those interested in using machine learning to improve their writing.\n\n\n**Key features:**\n\n\n* **Support for English, French, and Spanish:** Outwrite offers multilingual support in English, French, and Spanish, catering to a diverse range of users worldwide.\n\n\n* **Readability and style insights and stats:** Users benefit from comprehensive readability and style insights and statistics, enhancing the quality and effectiveness of their writing.\n\n\n* **Paraphrasing tools available in this Speedwrite alternative:** With paraphrasing tools readily available, Outwrite stands out as a versatile alternative to Speedwrite, ensuring flexibility and creativity in content generation.\n\n\n# **Which is the Best Speedwrite Alternatives?**\n\n\nThese alternatives offer various features, including multilingual support, readability insights, advanced editing capabilities, real-time collaboration, and scalability. Users should prioritize ease of use, grammar and spell checking, advanced editing features, and integration/exporting options when selecting the best alternative. By considering these factors, individuals and teams can find the perfect tool to enhance their content creation process and boost productivity.\n\n\n**Stay tuned as AFFiNE unveils its upcoming [AFFiNE AI](https://affine.pro/ai) – for more details, click the [ProductHunt](https://www.producthunt.com/posts/affine-ai).**\n\n\nFollow our journey on our social media platforms and become a part of our growing community. Embark on this adventure with us through our media channels.\n\n\n* Official Website: [https://affine.pro/](https://affine.pro/)\n\n\n* GitHub: [https://github.com/toeverything/AFFiNE](https://github.com/toeverything/AFFiNE)\n\n\n* Twitter: [https://twitter.com/AffineOfficial](https://twitter.com/AffineOfficial)\n\n\n* Community: [https://community.affine.pro/home](https://community.affine.pro/home)\n\n\n* Discord: [https://discord.gg/Arn7TqJBvG](https://discord.gg/Arn7TqJBvG)\n\n\n* Telegram: [https://t.me/affineworkos](https://t.me/affineworkos)\n\n\n\n\n\n\n\n\n\n\n\n",
  "publish": true
}