{
  "title": "14 Best Free Content Planning Apps in 2024 (Price & Features)",
  "authors": [
    "Yixuan Guo"
  ],
  "tags": [
    "Content"
  ],
  "description": "Explore the 14 free content planning apps. Find the best templates for your needs.",
  "created": 1704672000000,
  "updated": 1704672000000,
  "layout": "blog",
  "id": "tLHp_nymwiUtg6uquVRj3",
  "slug": "14-best-free-content-planning-apps-price-features",
  "cover": "/blobs/z0boLvewJH16Fihd73Vrq5eDmIFsi_loN_FIkUTnmsE=",
  "md": "---\n\n\ntitle: \"14 Best Free Content Planning Apps in 2024 (Price & Features)\"\n\n\nauthor: \"Yixuan Guo\"\n\n\ntags: Content\n\n\nslug: 14-best-free-content-planning-apps-price-features\n\n\ndescription: \"Explore the 14 free content planning apps. Find the best templates for your needs.\"\n\n\ncreated: 2024-01-08\n\n\nupdated: 2024-01-08\n\n\nlayout: blog\n\n\npublish: true\n\n\n---\n\n\n\n![z0boLvewJH16Fihd73Vrq5eDmIFsi_loN_FIkUTnmsE=](/blobs/z0boLvewJH16Fihd73Vrq5eDmIFsi_loN_FIkUTnmsE=)\n\n\nImagine this: you're a dedicated content creator or a vital member of a marketing team. Every day brims with fresh ideas and inspirations. Yet, the challenge lies in transforming these sparks of creativity into structured, tangible content. Are you exhausted from trying to mentally map out complex content publication schedules? Do you often find yourself adrift in an overwhelming sea of disorganized information? Whether you're a business professional, a designer, or someone eager to visually streamline your thoughts, encountering project chaos is a common hurdle.\n\n\n\n\n\nA content planner app simplifies content [management](https://affine.pro/blog/15-types-events-event-management-categories-examples). It helps organize tasks, sets reminders, and provides tools for planning and [analysis](https://affine.pro/blog/top-10-free-editable-swot-analysis-template-examples). This makes the process of creating and publishing content efficient and systematic. The app transforms complex content strategies into streamlined operations.\n\n\n\n\n\nNo more headaches! Content planner apps are here to sort out your chaotic content schedule and bring order to your work. In this article, we're going to look at the best 14 content planner apps for 2024. We'll check out what each app offers, along with its benefits and downsides, so you can easily pick the right one for you. Let's dive in and find out how these apps can make your content planning a breeze!\n\n\n# What is Content Planning?\n\n\n\n![Xt8aERW0z13y2Btr2gcE-AlFmTBt-sp3hBQv0MQ54ys=](/blobs/Xt8aERW0z13y2Btr2gcE-AlFmTBt-sp3hBQv0MQ54ys=)\n\n\nContent planning in digital marketing strategically organizes, develops, and manages content across platforms. It ensures every piece serves a purpose, aligning with broader business goals. Whether for blogs, [social media](https://affine.pro/blog/how-to-introduce-new-business-social-media-strategic-steps-examples), or emails, it maximizes content impact.\n\n\n* **Strategic Alignment**: Align content creation with overarching business goals, ensuring each piece serves a purpose and contributes to the company's objectives. This strategic approach enhances the effectiveness of content in achieving desired outcomes and ROI.\n\n\n* **Audience-Centric Approach**: Conduct thorough audience research to understand preferences, needs, and behaviors. Tailor content to resonate with the target audience, fostering stronger connections and engagement. This approach enhances the relevance and impact of the content.\n\n\n* **Content [Calendar](https://affine.pro/blog/free-8-printable-customizable-monthly-calendar-templates-examples) and Consistency**: Develop a well-structured content calendar that outlines the timing and distribution of content across various platforms. Consistency in messaging and timing establishes brand authority and improves audience anticipation, driving sustained engagement over time.\n\n\n* **SEO Integration and Discoverability**: Integrate relevant keywords and optimize content for search engines to enhance discoverability. This ensures that the content reaches a wider audience and improves visibility on search engine result pages, contributing to organic traffic growth.\n\n\n* **Metrics-Driven Optimization**: Define key performance indicators (KPIs) and leverage analytics to measure the success of content. Regularly analyze metrics to gain insights into audience behavior, adapt strategies accordingly, and continuously optimize content for better performance and impact.\n\n\n# Why Planning Your Content Matters?\n\n\n\nIn today's fast-paced digital environment, keeping up with content goals and maintaining a consistent publishing schedule can be a daunting task. That's where content planning apps become invaluable tools.\n\n\n* **Staying Ahead of the Curve:** The digital landscape is incredibly competitive. A well-planned content strategy helps you stay relevant and interesting, keeping your audience engaged and attracted to your brand.\n\n\n* **Resource Management:** Effective content planning allows for better resource allocation. Knowing what content is needed and when helps in optimizing the use of time, manpower, and finances.\n\n\n* **Targeted Content:** [Planning](https://affine.pro/blog/top-10-best-free-digital-planner-apps-2023) helps in creating content that resonates with your target audience. By understanding what your audience wants, you can tailor your content to meet their needs and interests.\n\n\n* **Consistency in Messaging**: A content plan ensures that all your communications are consistent, both in terms of frequency and the quality of the message, reinforcing your brand's voice and identity.\n\n\n# 2024 Best 14 Content Planner Apps You Have To Try\n\n\n## 1. [AFFiNE](http://affine.pro)\n\n\n[AFFiNE](http://affine.pro) is an amazing app for anyone managing content projects. It's designed to help you organize and handle your work easily. With AFFiNE, you get really cool [templates](https://affine.pro/blog/affine-0-11-0-launch-day-4-navigating-canvas-complexity-templates-clarity-free-online-whiteboard) for planning and visual tools like concept maps, which make organizing your ideas a breeze. It's super versatile and perfect for both individual users and teams. AFFiNE makes the whole process of planning and tracking your content projects straightforward and efficient, turning what could be a complicated task into something simple and enjoyable. Whether you're overseeing a big project or just getting your ideas together, AFFiNE has got your back.\n\n\n**Key features:**\n\n\n* [Structured Knowledge Exploration](https://affine.pro/blog/affine-0-11-0-launch-day-4-navigating-canvas-complexity-templates-clarity-free-online-whiteboard) (Concept Map Template): This template aids in breaking down complex theories and ideas into digestible diagrams. It's particularly useful for content planners in academic or research fields, as well as for teams in corporate strategy or product development who need to visualize the interplay of ideas.\n\n\n\n![pxhD46X-uF6kOOtmL9Hjkd8N_mFa-F2hpnTIVSXVVH8=](/blobs/pxhD46X-uF6kOOtmL9Hjkd8N_mFa-F2hpnTIVSXVVH8=)\n\n\n* **Visual Project Tracking**: The Project-Tracking Kanban is designed for agile project management, offering a clear visual representation of project progress. This is essential for content planners to track different stages of content creation and publication, ensuring that all tasks are managed efficiently.\n\n\n\n![KcGmB8LXCuT4hT9V0ZAaY5uvOatc9HEI7pgoh8oZeKY=](/blobs/KcGmB8LXCuT4hT9V0ZAaY5uvOatc9HEI7pgoh8oZeKY=)\n\n\n* Write, [Draw](https://affine.pro/blog/affine-0-11-0-launch-day-4-navigating-canvas-complexity-templates-clarity-free-online-whiteboard), and [Plan](https://affine.pro/blog/best-project-planning-tools-software-for-teams-2023) All at Once: Enjoy your all-in-one KnowledgeOS solution for effortlessly writing, drawing, and planning on a hyper-fused platform. It supports kanban, table, and rich-text paragraphs as building blocks to form pages or whiteboards. It carries out integrated processing here in document editing, data processing, or brainstorming.\n\n\n\n![crjX5_HRaAu3feQ3mQMTVmg-FqXutYjATZJpEZEMi98=](/blobs/crjX5_HRaAu3feQ3mQMTVmg-FqXutYjATZJpEZEMi98=)\n\n\n**Price:** FREE! If you are interested, please check the specific [Pricing plan.](https://affine.pro/pricing)\n\n\n## [2. Planable](https://planable.io/schedule-social-media/)\n\n\nPlanable is an effective content planning tool ideal for teams of all sizes, streamlining collaborative content creation. It's particularly suited for marketers to manage a variety of written content, including social media posts, blogs, and newsletters.\n\n\n\n![ClMQEw-wKBN6Qp_J_C3f3HbaItkbZ0u0pHI81Ea6wEM=](/blobs/ClMQEw-wKBN6Qp_J_C3f3HbaItkbZ0u0pHI81Ea6wEM=)\n\n\n**Key Featuresï¼š**\n\n\n* **Content Creation:** It allows team collaboration in real-time. Multiple marketers can work simultaneously, using comments and Planable's advanced social media AI tool. The platform clearly defines roles and permissions, distinguishing between content creators and approvers.\n\n\n* **Content Approval:** Planable simplifies approval with custom workflows, suitable even for multi-level processes. This feature enables one-click approvals while ensuring all relevant team members are updated.\n\n\n* **Content Scheduling:** The tool supports scheduling posts for automatic publishing on major social media platforms such as Instagram, Facebook, LinkedIn, Twitter, TikTok, Google My Business, YouTube, and Pinterest. The sync on/off feature is useful for managing the same post across different platforms.\n\n\n**Price:** starting at $12 per month\n\n\n## [3. Notion](https://affine.pro/blog/notion-alternatives-to-revolutionise-your-personal-workflow)\n\n\nNotion, as a content planner application, offers a key advantage in providing an intuitive and efficient platform for managing and optimizing the content creation process. It combines the simplicity of a note-taking app with the functionality of spreadsheet software, allowing teams to plan content, collect ideas, and track goals all on one unified platform. This makes Notion an ideal tool for various marketing needs, adaptable to the rapidly changing demands of content creation while maintaining high organizational and collaborative efficiency.\n\n\n\n![6owlmQzrv_8aWmSdLN0Q1cozKHlJjMTslcxnSAqRLDQ=](/blobs/6owlmQzrv_8aWmSdLN0Q1cozKHlJjMTslcxnSAqRLDQ=)\n\n\n\n**Key Features:**\n\n\n* **Centralized Content Management**: Users can capture, store, and organize all content ideas in one place, making it easily accessible and modifiable at any time.\n\n\n* **Flexible Calendar Planning Tool**: Offering a visual calendar view, it helps users plan and track their content publishing schedule, ensuring content goals are met on time.\n\n\n* **Collaboration and Feedback Mechanisms**: Supports real-time collaboration among team members, including shared documents, comment sections, and tagging, to enhance communication and creative exchange within the team.\n\n\n**Price:** free\n\n\n# [4. Canva](https://www.canva.com/pro/content-planner/)\n\n\n\nCanva is famous mainly for being a handy design tool, but it also has a content planner. Itâ€™s a basic content calendar for social media with a major advantage â€” an opportunity to schedule a post directly from your Canva workspace.\n\n\n\n![3Qt2CwP8BYRDKCgtiAIX4YD-4yoyfI43cFy5zq_dAlE=](/blobs/3Qt2CwP8BYRDKCgtiAIX4YD-4yoyfI43cFy5zq_dAlE=)\n\n\nKey Features:\n\n\n* Smart and fast content planning. Teams schedule posts to social media accounts straight from the creation dashboard. Canva also recommends the best time to post for maximum engagement.\n\n\n* Collaboration tools. Team members who create designs together, plan together, using comments and edits. Canva also has an app to manage assets and content planning on the go.\nPrice: Free trial. Canva Pro Bundle is $12.99 per month.\n\n\n# [5.Airtable](https://www.airtable.com/)\n\n\n\nAirtable is a low-code platform that combines spreadsheets, databases, and custom app creation. For content masters, itâ€™s a nifty way to organize content and sync on each step in the content creation process. For content folks, Airtable has a pre-made content calendar template.\nThis is a planning and collaboration tool that isnâ€™t specifically for editorial calendars. Teams in all kinds of industries can use it to organize work in either a grid, calendar, kanban, gallery, or form view.\nThe calendar feature in AirTable can help you keep track of campaigns and publish dates. You can also keep track of tasks and communicate with project members.\n\n\n\n![jZ3Rtdrh98D5BaxflavRWw8CNV5OAmw67DBLQUL9918=](/blobs/jZ3Rtdrh98D5BaxflavRWw8CNV5OAmw67DBLQUL9918=)\n\n\n\n\n**Key Featuresï¼š**\n\n\n* **Task tracking:** Assign different content tasks, set deadlines, track progress, nudge your colleagues, and never miss the deadline again. As a bonus, get a comprehensive look at your content efforts in the calendar.\n\n\n* **Schedule and publish:** Once your content is ready, you can post it to your social media platform of choice.\n\n\n**Price:** starting at $20 per month\n\n\n# [6. ClickUp](https://affine.pro/blog/seven-best-open-source-clickup-alternatives-2023)\n\n\n\nClickUp is a full-featured work management platform that supports marketing teams from planning and ideation to publication. It offers unlimited customization options for every content team, large and small, to manage their projects and campaigns. ClickUpâ€™s Template Center contains ready-to-use templates and workflows, including the Content Calendar Template.\nThis template is a must for content teams producing a lot of content. Simplify complicated or overwhelming tasks and get started quickly with your content planning in no time.\n\n\n\n![r5cAfA1Zq4SVGsQuOR4cdxlIIeSNH6f7OuWdJwu85zE=](/blobs/r5cAfA1Zq4SVGsQuOR4cdxlIIeSNH6f7OuWdJwu85zE=)\n\n\n\n**Key Featuresï¼š**\n\n\n* **Six statuses:** Open, Writing, Approval, Updated Required, Scheduled, and Published to keep track of progress and give visibility to stakeholders\n\n\n* **Custom fields:** Keep track of granular details such as publication date, channel, and pricing\n\n\n* **Views:** Choose from a Calendar, List, Board, Workflow, Channels, or Timeline View to help build your content database\n\n\n* **Best use cases:** Blog calendar, editorial calendar, marketing strategy, and content marketing\n\n\n**Price:** starting at $7 per month\n\n\n# [7.Monday.com](https://affine.pro/blog/8-best-monday-alternatives-for-project-management-2023)\n\n\n\nMonday is also customizable to your project needs, with Kanban, calendar, and other templates available. In addition to setting a schedule, you can assign tasks to team members and keep track of their progress.\nIt also integrates with your existing project and communications apps, including Excel, Google apps, Trello, Dropbox, and Slack.\n\n\n\n![sHeZNZCwILjJ-e-f-1Nrgu9K7EsM3a-eijqZfJl5ucM=](/blobs/sHeZNZCwILjJ-e-f-1Nrgu9K7EsM3a-eijqZfJl5ucM=)\n\n\n\n**Key Featuresï¼š**\n\n\n* [Team Collaboration](https://affine.pro/blog/power-of-collaboration-why-teams-need-to-work-together-for-success) **and Task Management:** It offers robust collaboration tools, allowing teams to work together effectively. The platform's focus on task management helps in organizing and tracking project progress, making it a suitable tool for teams aiming to streamline their workflow.\n\n\n* **Customizable Boards for Project Management:** At the core of Monday are its customizable boards, which are essential for managing projects and workflows. These boards can be tailored to reflect specific workflow needs. The platform provides various templates, including those for social media management, aiding in campaign planning and tracking.\n\n\n* [Social Media](https://affine.pro/blog/how-to-introduce-new-business-social-media-strategic-steps-examples) **Campaign Management:** Monday includes features specifically for managing social media campaigns. It allows team members to suggest and track social media post ideas and campaigns, with boards that can categorize campaigns into upcoming, live, completed, or stuck statuses, ensuring a clear overview of all social media activities.\n\n\n**Price:** starting at $8 per month\n\n\n# [8.Brand24](https://brand24.com/)\n\n\nBrand24 is a digital tool primarily focused on brand monitoring and social media analytics rather than content planning. It specializes in analyzing the emotional undertones of brand mentions online, providing crucial insights for reputation management through its sentiment analysis feature. The platform also keeps users updated with real-time alerts on significant changes in online conversations about their brand, enabling prompt and effective responses. Additionally, Brand24 offers robust data exporting capabilities, allowing businesses to generate comprehensive reports and infographics for better strategic decision-making and sharing insights across various departments.\n\n\n\n![REc-xLysg9EY2Mp3VRZk6SxhM_teWYTjC27yRIPfkso=](/blobs/REc-xLysg9EY2Mp3VRZk6SxhM_teWYTjC27yRIPfkso=)\n\n\n\n**Key Features:**\n\n\n* **Detailed Sentiment Analysis:** Brand24 delves deep into the emotional context of brand mentions. This feature is crucial for understanding and managing public perception of a brand. It helps businesses to identify the tone of conversations about their brand and respond appropriately.\n\n\n* **Real-Time Alerts:** The platform provides immediate updates on significant changes in the conversation surrounding a brand. This feature is essential for businesses to quickly address potential issues or capitalize on positive engagement, keeping them ahead in managing their online reputation.\n\n\n* **Extensive Data Exporting Capabilities:** Brand24 allows for the seamless generation of reports and infographics, making it easy to share and analyze key social media monitoring insights across different departments of a business. This feature ensures that valuable information is accessible and usable for strategic decision-making.\n\n\n**Price:** starts at $49 per month.\n\n\n# [9.Hootsuite](https://www.hootsuite.com/)\n\n\nHootsuite stands as a premier choice in the realm of social media management tools, equipped with a wide array of features ideal for various aspects of social media management. Particularly for content-related tasks, it offers capabilities like automated posting, effective content management, keyword filtering, simultaneous management of multiple accounts, and scheduling of posts. Additionally, it supports collaboration among a small group of marketers, proving to be more economical in such scenarios. On their blog, Hootsuite provides a free, adaptable content calendar template for a weekly schedule, primarily focusing on major social networks like Facebook, Instagram, Twitter, and LinkedIn. This template is highly customizable to fit different platform preferences and includes a special section for evergreen content, which is valuable for consistently high-performing blog posts throughout the year.\n\n\n\n![Cz-1K8IEdpDd0Y2HKYJO40SBrqU2mp8C3lTt8cunLUk=](/blobs/Cz-1K8IEdpDd0Y2HKYJO40SBrqU2mp8C3lTt8cunLUk=)\n\n\n**Key Features:**\n\n\n* **Limited Social Media Account Management:** The Free plan allows you to manage up to two social media accounts, integrating with major platforms like Facebook, Twitter, Instagram, LinkedIn, YouTube, and Pinterest. This feature suits users who are active on a few platforms.\n\n\n* **Basic Publishing Capabilities:** Users can schedule a limited number of messages (up to five) at any specific time. The platform also facilitates easy content creation, offering access to free images from Pixabay and supporting drag-and-drop for media uploads. You can post immediately, save drafts, or schedule posts for later.\n\n\n* **Content Organization and Filtering:** Social media accounts and their content are organized into separate boards, making it simpler to track scheduled and published content. Additionally, there's a feature to filter posts according to their status, such as viewing only drafts, enhancing content management efficiency.\n\n\n\n**Price:** Priced at $49 per month, it includes 1 user, 10 social profiles, unlimited scheduling, auto-scheduling, a publishing calendar, and more.\n\n\n# [10.Loomly](https://loom.ly/)\n\n\nLoomly, initially designed as a user-friendly social media calendar, excels in simplifying the management of social media content. It supports a wide range of social media platforms, including Pinterest and Snapchat, addressing the needs of social media teams efficiently. The platform enables users to manage the lifecycle of social media content â€” from idea tracking and creation to optimization, scheduling, and performance tracking. Additionally, Loomly facilitates direct engagement with users interacting with your social media posts, making it a comprehensive tool for content marketing campaigns and social media management. This tool is particularly helpful for social media managers in organizing, optimizing, and analyzing content, ensuring effective audience engagement.\n\n\n\n![5M3gWuiJVMAa9q_elCsAnmdcJY3LKWQ15avd_wt1yPo=](/blobs/5M3gWuiJVMAa9q_elCsAnmdcJY3LKWQ15avd_wt1yPo=)\n\n\n\n**Key  Features :**\n\n\n* **Custom workflow for every calendar:** Social media managers can choose how many statuses their content will have and how many approvals it would need to go live.\n\n\n* **Content ideas:** Loomly curates post ideas based on your chosen industry, special events, and news. This feature is particularly helpful for social media marketers who need to generate engaging content ideas.\n\n\n**Price:** Loomly has four paid plans starting at $26/month.\n\n\n# [11.Sendible](https://www.sendible.com/ )\n\n\nSendible is one of the leading social media scheduling and management tools. It offers a powerful calendar that makes content planning a breeze. You can use its calendar to plan and customize posts for different platforms, assign posts to various team members, and import designed media. If you need to include a client, you can also use it to share content with them for approval before you schedule it for publishing.\n\n\n\n![9NNf7BqYKMJD0VfCrw5JW-FoecELoQSHFMR88p3O6qw=](/blobs/9NNf7BqYKMJD0VfCrw5JW-FoecELoQSHFMR88p3O6qw=)\n\n\n\n\n**Key  Features :**\n\n\n* **Comprehensive Social Media Management:** Sendible's unique \"Services\" feature allows users to manage various social media channels and profiles effectively. This includes capabilities like Facebook moderation, where it can automatically remove comments and posts containing specified words or phrases, and the ability to upload and schedule Facebook Page cover photos to align with marketing campaigns.\n\n\n* **Content Scheduling and Publishing:** Sendible excels in scheduling content across social platforms and drafting and publishing posts on major blogging platforms. The tool includes a powerful calendar for planning and customizing posts for different platforms, and it integrates with Canva for creating social media graphics. Users can also use Sendibleâ€™s Google Chrome Extension to publish or schedule content found on the web.\n\n\n* **Content Discovery and Sharing:** The platform offers a content discovery tool, RSS feeds, and Google Alerts integration, assisting users in finding high-quality content to share with followers. It also features smart queues to ensure a consistent flow of evergreen content.\n\n\n**Price:** starting at $25\n\n\n# [12.Google Docs](https://docs.google.com/document/u/0/)\n\n\n\nGoogle Docs, a product of Google's extensive range of internet applications, revitalizes your documents with its advanced editing and formatting capabilities. It offers a dynamic platform for content creation, enabling you to incorporate images, drawings, and hyperlinks, along with a variety of font options â€” all at no cost. A standout feature of Google Docs is its auto-save function, ensuring every change is immediately stored as you work. Additionally, the platform's revision history is a powerful tool, allowing you to track past document versions, including details of edits and editors. While Google Docs was once the go-to choice, it now faces competition from a range of content planning tools, though it remains a valuable resource, especially for collaborative efforts.\n\n\n\n![xsE88zy-Mq9phr6Sv5neDwM03JHKRObR3TYnRAgS1O0=](/blobs/xsE88zy-Mq9phr6Sv5neDwM03JHKRObR3TYnRAgS1O0=)\n\n\n\n**Key Featuresï¼š**\n\n\n* **Collaboration Tools:** Google Docs is renowned for its robust collaboration capabilities. Multiple users can work on the same document simultaneously, making real-time editing and feedback possible. This feature is particularly useful for team projects and content planning, as it allows seamless cooperation among team members.\n\n\n* **Advanced Editing and Styling Tools:** Google Docs offers a wide range of editing and styling tools. These include various font choices, the ability to add images and drawings, and smart paragraphing. These features enhance the visual appeal and readability of documents, allowing for the creation of professional-looking content.\n\n\n* **Automatic Saving and Revision History:** An essential feature of Google Docs is its auto-save functionality. Every change made in a document is saved automatically, eliminating the worry of losing progress. Additionally, the revision history feature allows users to view previous versions of the document, including details about when each edit was made and by whom. This is invaluable for tracking changes over time and understanding the evolution of a document.\n\n\n**Price:** Free\n\n\n# [13.Agorapulse](https://www.agorapulse.com/)\n\n\n\nAgoraPulse equips you with a robust suite of Content Planning Tools, making it a powerhouse for teams and agencies. Its features are designed to optimize and schedule content across multiple platforms, ensuring your posts are perfectly timed and crafted. The platformâ€™s Writing Assistant aids in enhancing the quality of your content, while real-time collaboration tools keep your team in sync. UTM tracking and consistent branding tools are also included, providing a comprehensive solution for your content planning needs. AgoraPulseâ€™s all-in-one social inbox and detailed analytics help you stay on top of your social media game.\n\n\n\n![3E8muFVOG2DDDazW8qtzCd2d6JGFOYHweNruMBkHXCA=](/blobs/3E8muFVOG2DDDazW8qtzCd2d6JGFOYHweNruMBkHXCA=)\n\n\n\n\n**Key Features:**\n\n\n* **All-in-One Social Inbox:** Centralizes all social media interactions in one place, significantly enhancing the efficiency of managing and responding to messages, comments, and mentions across various platforms.\n\n\n* **Detailed Analytics:** Offers comprehensive insights into social media performance, allowing for data-driven decision-making. This feature helps in understanding audience engagement, measuring ROI, and identifying successful content strategies.\n\n\n* **Content Planning and Scheduling Tools:** A robust set of tools for optimizing and scheduling content across multiple social media platforms. This feature ensures posts are crafted and timed perfectly, facilitating effective and consistent content delivery.\n\n\n**Price:** Priced at $49 per user per month, billed annually.\n\n\n\n\n\n# [14.Slickplan](https://slickplan.com/content)\n\n\n\nSlickplan offers a specialized suite for website planning, equipped with integrated collaboration features, ensuring smooth transitions and interactions among users. Our top-tier tools, renowned in the industry, consistently attract customers for repeated projects. This suite encompasses a visual sitemapper and site crawler for efficient site layout planning, a diagramming tool to map user flows, enhancing user experience, and our comprehensive online content planner for streamlined content management.\n\n\n\n![AXPiGP7srqHehGxj3RhV75XMw0b-vG-zizEnxKfuCtw=](/blobs/AXPiGP7srqHehGxj3RhV75XMw0b-vG-zizEnxKfuCtw=)\n\n\n**Key Features:**\n\n\n* **Diagramming Tool for User Flow Mapping**: Enhances the planning of user navigation and improves website user experience.\n\n\n* **Online Content Planner:** Simplifies the content creation and management process with drag-and-drop content blocks.\n\n\n* **Collaboration Capabilities:** Supports teamwork with multiple editors, enabling collaborative content creation.\n\n\n**Price:** Access to the content planner tier (and many other tools) begins at $31.49/month when paid annually.\n\n\n\n\n\nWith top-notch software like AFFiNE at your disposal along with its diverse range of templates and user-friendly features, creating concept maps has never been easier or more effective. Commence concept mapping by using AFFiNE's user-friendly tool. Presently, **AFFiNE** has launched its **[Stable Version](https://affine.pro/download)**, with ongoing efforts to develop a more comprehensive and dependable iteration. Join us on our voyage through our social media channels and be part of the experience. **Come and join us on our journey over on our media platforms.** ðŸš€\n\n\n* Official Website: [https://affine.pro/](https://affine.pro/)\n\n\n* GitHub: [https://github.com/toeverything/AFFiNE](https://github.com/toeverything/AFFiNE)\n\n\n* Discord: [https://discord.gg/Arn7TqJBvG](https://discord.gg/Arn7TqJBvG)\n\n\n* Twitter: [https://twitter.com/AffineOfficial](https://twitter.com/AffineOfficial)\n\n\n",
  "publish": true
}