{
  "title": "15 Best Free ADHD Apps for Knowledge Management in 2024 ",
  "authors": [
    "Yanxi Liu",
    "Yuhang Zhao"
  ],
  "tags": [
    "Content"
  ],
  "description": "Discover 2024's top 15 free ADHD-friendly apps for knowledge management, enhancing focus, organization, and learning efficiency.",
  "created": 1705017600000,
  "updated": 1705017600000,
  "layout": "blog",
  "id": "zbiWWxhn3ToqvUcrY4wCE",
  "slug": "15-best-free-adhd-app-for=knowledge=management",
  "cover": "/blobs/oI3WbzP5AhbOJ132LFHt5-fKO6n5FujCmxD2RLX7S9w=",
  "md": "---\n\n\ntitle: \"15 Best Free ADHD Apps for Knowledge Management in 2024 \"\n\n\nauthor: \"Yanxi Liu, Yuhang Zhao\"\n\n\ntags: Content\n\n\nslug: 15-best-free-adhd-app-for=knowledge=management\n\n\ndescription: \"Discover 2024's top 15 free ADHD-friendly apps for knowledge management, enhancing focus, organization, and learning efficiency.\"\n\n\ncreated: 2024-01-12\n\n\nupdated: 2024-01-12\n\n\nlayout: blog\n\n\npublish: true\n\n\n---\n\n\n\n![oI3WbzP5AhbOJ132LFHt5-fKO6n5FujCmxD2RLX7S9w=](/blobs/oI3WbzP5AhbOJ132LFHt5-fKO6n5FujCmxD2RLX7S9w=)\n\n\n# What are ADHD apps?\n\n\nADHD apps are digital aids tailored to assist individuals with ADHD in navigating their symptoms and enhancing life quality. These applications come equipped with:\n\n\n* Tools for organization and time management, including checklists, alerts, planners, and task hierarchy systems.\n\n\n* Features to bolster focus and reduce distractions, like ambient sounds, productivity timers, focus-enhancing settings, and interruption shields.\n\n\n* Systems for tracking and building habits to maintain routines and ensure timely task execution.\n\n\n* Enhancements for productivity with integrated task organizers, aspiration tracking, and milestone monitoring.\n\n\n* Platforms for social interaction and guidance from mental health experts.\n\n\nADHD apps act as supportive resources for better symptom control and life enhancement, customizable to each user’s needs.\n\n\n# Four Benefits of Using ADHD Apps include:\n\n\n* Economic accessibility with numerous free or inexpensive choices.\n\n\n* On-the-go usability with mobile device compatibility.\n\n\n* A broad spectrum of apps tailored to various ADHD-related needs.\n\n\n* Clinical research support, indicating improvements in organizational skills and reduced delay in task completion.\n\n\n# Choosing the Right ADHD App nvolves:\n\n\n* Identifying your predominant ADHD-related difficulties to find an app with corresponding features.\n\n\n* Considering your age group and daily activities to ensure the app is appropriate for your lifestyle.\n\n\n* Aligning with your financial plan, selecting an app that fits your budget.\n\n\n* Reviewing other users’ experiences to assess the app's potential impact on your symptom management.\n\n\n# The 15 Best ADHD apps in 2024\n\n\n\n![8l27_d2Q9AOqw08fUQhR_oBuhf6FpTXWvQPKbtMvXPg=](/blobs/8l27_d2Q9AOqw08fUQhR_oBuhf6FpTXWvQPKbtMvXPg=)\n\n\nBelow we have compiled a list of what we believe are the best ADHD apps on the market as of 2024, which can help mitigate various aspects of ADHD symptoms.\n\n\n## 1. [AFFiNE](http://affine.pro)\n\n\nIf you're seeking a recommendation for an app to help manage ADHD, [AFFiNE](https://affine.pro) could be a strong contender. AFFiNE is an innovative application crafted to facilitate organization, [task management](https://affine.pro/blog/8-free-project-tracker-templates-work-management-2023), and [collaboration](https://affine.pro/blog/navigating-organizational-strategies-a-path-to-project-success) on various projects and information sets, particularly useful when overseeing a project. The standout feature of AFFiNE is its commitment to accessibility and inclusivity; it is a complimentary, open-source platform that leverages offline capabilities, ensuring that it remains accessible to users regardless of their internet connectivity status.\n\n\n\n\n\n<div style=\"text-align:center;\">\n\n\n<iframe width=\"560\" height=\"315\" src=\"https://www.youtube.com/embed/3cfeKOufZWU?si=IiXDIdwfnM2Z7KPL\" title=\"YouTube video player\" frameborder=\"0\" allow=\"accelerometer; autoplay; clipboard-write; encrypted-media; gyroscope; picture-in-picture; web-share\" allowfullscreen></iframe>\n\n\n</div>\n\n\n\n\n\n**Key Features:**\n\n\n* **Powerful Templates in Whiteboard**: With a rich and convenient library of templates such as [concept maps](https://affine.pro/blog/top-8-concept-map-templates-examples), flowcharts and monthly [calendars](https://affine.pro/blog/free-8-printable-customizable-monthly-calendar-templates-examples), AFFiNE's whiteboard lets you focus on schedule reminders and mind maps to help ADHD focus and improve efficiency.\n\n\n\n![jAQMqziny2mtnZPcnk-TmuhayWB6zs2x6p_ibSScaPU=](/blobs/jAQMqziny2mtnZPcnk-TmuhayWB6zs2x6p_ibSScaPU=)\n\n\n\n![Kq-F0aUdgSH67WPI-eElwTofNKtSluDn3i9g5xkt_x4=](/blobs/Kq-F0aUdgSH67WPI-eElwTofNKtSluDn3i9g5xkt_x4=)\n\n\n\n\n\n* **Write, [Draw](https://affine.pro/blog/best-free-digital-whiteboard-apps-2023), and [Plan](https://affine.pro/blog/best-project-planning-tools-software-for-teams-2023) All-in-One:** Enjoy your all-in-one KnowledgeOS solution for effortlessly writing, drawing, and planning on a hyper-fused platform. It supports [kanban](https://affine.pro/blog/affine-080-launch-week-day3), table, and rich-text paragraphs as building blocks to form pages or whiteboards. It carries out integrated processing here in document editing, data processing, or brainstorming.\n\n\n\n![O88V12dZ7eALpdMD8-6eyyfRec5yZyWiQxCnvNEb3r0=](/blobs/O88V12dZ7eALpdMD8-6eyyfRec5yZyWiQxCnvNEb3r0=)\n\n\n* **[Collaborative Capabilities](https://affine.pro/blog/affine-0-10-0-launch-week-day-5-5-stable-with-cloud-support-finally-available-to-every-pro-in-your-team)**: For group work, the app should have collaborative features, making it easy to share and coordinate projects with others in your group work.\n\n\n* **[Offline Accessibility](https://affine.pro/blog/5-best-offline-alternatives-to-notion)**: The best task management tool should allow users to access their essential details offline. This feature is particularly valuable when going outside with limited internet connectivity.\n\n\n**Cons**\n\n\n* Some features are only available on paid plans\n\n\n**Verdict:**\n\n\nExtremely impressed with the quality and capabilities of AFFiNE, particularly its simple and intuitive interface. The attention to detail that has been put into every aspect of the product, from its design to its functionality, is truly exceptional. The product's innovative features and capabilities are sure to make a significant impact in the industry, providing customers with a seamless and user-friendly experience.\n\n\n## 2. [Sensa](https://sensa.health/)\n\n\n\n![uNhr13_Juo1vPMuk5FkEsvUP90_i5hPFTzI_Fk3EEUA=](/blobs/uNhr13_Juo1vPMuk5FkEsvUP90_i5hPFTzI_Fk3EEUA=)\n\n\nSensa is a comprehensive ADHD app that offers a variety of features to help users manage their symptoms. The app is based on CBT- a proven and effective treatment for ADHD. Its a good option for those looking to mitigate their ADHD symptoms and to improve their overall quality of life.\n\n\n**Pros**\n\n\n* Personalised CBT exercises\n\n\n* Mood tracking\n\n\n* Mindfulness exercises\n\n\n* Community support\n\n\n* Evidence-based approach\n\n\n**Cons**\n\n\n* Subscription-based\n\n\n* Some users find the app to be text-heavy\n\n\n* No free version\n\n\n**Verdict**\n\n\nI would recommend Sensa to people with ADHD who are looking for a comprehensive self-help tool to help them manage their symptoms and improve their quality of life. Sensa offers a variety of features, including personalised CBT exercises, mood tracking, mindfulness exercises, and community support. It is based on CBT, a proven effective treatment for ADHD.\n\n\n## 3. [Focus@Will](https://www.focusatwill.com/)\n\n\n\n![ObWvBRAQely8UADn0BUkLJw8Q11aJGdfTunWcbnrA1k=](/blobs/ObWvBRAQely8UADn0BUkLJw8Q11aJGdfTunWcbnrA1k=)\n\n\nFocus@Will is a music streaming service that uses neuroscience-based music to help people focus and concentrate. It offers a variety of different music channels, each designed to promote focus and concentration in a different way.\n\n\nFocus@Will is a popular choice for people with ADHD, as it can help them to stay focused on their work or studies and to reduce distractions. However, it can also be used by people without ADHD who simply want to improve their focus and concentration.\n\n\n**Pros**\n\n\n* Variety of music channels to choose from\n\n\n* Effective at promoting focus and concentration\n\n\n* Easy to use and navigate\n\n\n* Affordable subscription price\n\n\n**Cons**\n\n\n* Some users find the music to be repetitive\n\n\n* Can be distracting for people who are easily distracted by music\n\n\n* No free version\n\n\n**Verdict**\n\n\nFocus@Will is recommended to people who are looking for a way to improve their focus and concentration. It is a particularly good option for people with ADHD, but it can also be used by people without ADHD. Focus@Will is easy to use and navigate, and it offers a variety of different music channels to choose from. However, it is important to note that Focus@Will is not a cure for ADHD, and it should be used in conjunction with other treatments.\n\n\n## 4. [Epic Win](https://apps.apple.com/us/app/epicwin/id372927221)\n\n\n\n![9mP-s4864Pldm4Ibi4Ld51jgcq3QEv_AbS7Oc4DAwyw=](/blobs/9mP-s4864Pldm4Ibi4Ld51jgcq3QEv_AbS7Oc4DAwyw=)\n\n\nEpicWin is a to-do list app with a gamified twist. It allows users to create to-do lists, set priorities, and complete tasks in order to level up their character and earn rewards. The app also includes a variety of features to help users stay organised and on track, such as reminders, due dates, and subtasks.\n\n\n**Pros**\n\n\n* Gamified approach to task management\n\n\n* Fun and engaging interface\n\n\n* Variety of rewards and achievements\n\n\n* Easy to use and navigate\n\n\n* Affordable subscription price\n\n\n**Cons**\n\n\n* Not as comprehensive as some other to-do list apps\n\n\n* Some users find the gamification to be too distracting\n\n\n* No free version\n\n\n**Verdict**\n\n\nOverall, the Epic Win app is a well-regarded app that can be effective for helping people with ADHD to manage their to-do lists and tasks. It is a good option for people who find traditional to-do list apps to be boring or ineffective.\n\n\n## 5. [RescueTime](https://www.google.lv/aclk?sa=l&ai=DChcSEwjJx_rz8KSCAxUai2gJHT_MA1wYABAAGgJ3Zg&ase=2&gclid=CjwKCAjwkY2qBhBDEiwAoQXK5SeAaQbDoRPKJm-EncX7Ro9WeBg75-QZx_HzuxpVCDnKvD76ntgiMBoCYbwQAvD_BwE&sig=AOD64_1L7aWLxDEa4i-FVUfBwFiqwBy87Q&q&nis=4&adurl&ved=2ahUKEwieyfLz8KSCAxU9SfEDHX4ZCd4Q0Qx6BAgFEAE)\n\n\n\n![y7ahbjWdHaN_U1gcUvkpVVHdIJColBk8sPelVgQvyNw=](/blobs/y7ahbjWdHaN_U1gcUvkpVVHdIJColBk8sPelVgQvyNw=)\n\n\nRescueTime is a time tracking app that helps users understand how they spend their time. It runs in the background on computers and mobile devices, tracking all of the user’s activity. RescueTime then provides users with detailed reports on how they spent their time, including which websites and apps they used, and for how long.\nRescueTime is a popular tool for people with ADHD, as it can help them to identify and reduce distractions. It can also be used by people who simply want to be more mindful of how they spend their time.\n\n\n**Pros**\n\n\n* Detailed reports on how you spend your time\n\n\n* Ability to track time across all devices\n\n\n* Ability to set goals and track progress\n\n\n* Ability to block distracting websites and apps\n\n\n* Variety of pricing plans to choose from\n\n\n**Cons**\n\n\n* Can be addictive to track your time constantly\n\n\n* Can be difficult to interpret the data, especially for new users\n\n\n* Can be expensive for some users\n\n\n**Verdict**\n\n\nRescueTime is a powerful tool that can help users to understand and manage their time more effectively. It is especially useful for people with ADHD, as it can help them to identify and reduce distractions. However, it is important to note that RescueTime can be addictive and make you to track your time constantly. Furthermore. the data can be difficult to interpret, especially for new users and RescueTime can be expensive for some users.\n\n\n## 6. [Todoist](https://todoist.com/)\n\n\n\n![G0_kRx7S7GOL4WBAJVyUQE8FVcRF8AuTguxY6J-wilo=](/blobs/G0_kRx7S7GOL4WBAJVyUQE8FVcRF8AuTguxY6J-wilo=)\n\n\nTodoist is a to-do list app that helps users to stay organised and on track. It allows users to create to-do lists, set due dates, add notes, and prioritize tasks. Todoist also includes a variety of features to help users collaborate with others, such as shared projects and task assignments.\nTodoist is a popular choice for people with ADHD, as it can help them to stay organized and avoid feeling overwhelmed. It can also be used by people without ADHD who simply want to be more productive.\n\n\n**Pros**\n\n\n* Simple and easy to use\n\n\n* Variety of features, including to-do lists, due dates, notes, priorities, shared projects, and task assignments\n\n\n* Available on all devices\n\n\n* Free plan available, as well as paid plans with additional features\n\n\n**Cons**\n\n\n* Can be difficult to keep up with if you have a lot of tasks\n\n\n* Can be overwhelming for new users\n\n\n* Some features are only available on paid plans\n\n\n**Verdict**\n\n\nTodoist is a comprehensive to-do list app that offers a variety of features to help users stay organised and on track. It is a good option for people with ADHD, as it can help them to stay organised and avoid feeling overwhelmed. Todoist is also a good option for people without ADHD who simply want to be more productive.\n\n\n## 7. [Remember the Milk](https://www.rememberthemilk.com/)\n\n\n\n![TEI4aBNWS2WTrvBx7aY10AHaHw0HoCaQ-WC61Ol6Uek=](/blobs/TEI4aBNWS2WTrvBx7aY10AHaHw0HoCaQ-WC61Ol6Uek=)\n\n\nRemember the Milk is a to-do list app that helps users stay organized and on track. It allows users to create to-do lists, set due dates, add notes, and prioritize tasks. Remember the Milk also includes a variety of features to help users collaborate with others, such as shared lists and task assignments.\nRemember the Milk is a popular choice for people with ADHD, as it can help them stay on top of their tasks and avoid feeling overwhelmed. It is also a good option for people without ADHD who simply want to be more productive.\n\n\n**Pros**\n\n\n* Simple and easy to use\n\n\n* Variety of features, including to-do lists, due dates, notes, priorities, shared lists, and task assignments\n\n\n* Available on all devices\n\n\n* Free plan available, as well as paid plans with additional features, such as location-based reminders and recurring tasks\n\n\n**Cons**\n\n\n* Can be difficult to keep up with if you have a lot of tasks\n\n\n* Can be overwhelming for new users\n\n\n* Some features are only available on paid plans\n\n\n**Verdict**\n\n\nRemember the Milk is a comprehensive to-do list app that offers a variety of features to help users stay organised and on track. We would recommend Remember the Milk to people who are looking for a simple and easy-to-use to-do list app with a variety of features. It is a good option for people with ADHD, as well as for people without ADHD who simply want to be more productive.\n\n\n## 8. [Asana](https://asana.com/apps)\n\n\n\n![WCSvlp3qohgfAmN-x7tcxixBSCqODOdd3Wm7-fj3tIU=](/blobs/WCSvlp3qohgfAmN-x7tcxixBSCqODOdd3Wm7-fj3tIU=)\n\n\nAsana is a popular project management tool that can also be used by individuals with ADHD to stay organised, focused, and productive. It offers a variety of features that can be helpful for people with ADHD, including task management, due dates and priorities, notifications and collaborations.\n\n\n**Pros**\n\n\n* Comprehensive task management features\n\n\n* Easy to use and navigate\n\n\n* Available on all devices\n\n\n* Free plan available, as well as paid plans with additional features\n\n\n**Cons**\n\n\n* Can be overwhelming for new users\n\n\n* Some features are only available on paid plans\n\n\n**Verdict**\n\n\nAsana is recommended for people with ADHD who are looking for a comprehensive task management tool. Asana is easy to use and navigate, and it offers a variety of features that can be helpful for people with ADHD.\n\n\n## 9. [Trello](https://trello.com/)\n\n\n\n![eIgF7uJwtvaVWoPHMLL9JBOP2uyh80J4imKQGO23nAo=](/blobs/eIgF7uJwtvaVWoPHMLL9JBOP2uyh80J4imKQGO23nAo=)\n\n\nTrello is a popular Kanban board-based project management tool that can also be used by individuals with ADHD to stay organised, focused, and productive. It offers a variety of features that can be helpful for people with ADHD, including visual task management, flexibility and collaboration options.\n\n\n**Pros**\n\n\n* Visual task management\n\n\n* Flexibility\n\n\n* Collaboration\n\n\n* Easy to use and navigate\n\n\n* Available on all devices\n\n\n* Free plan available, as well as paid plans with additional features\n\n\n**Cons**\n\n\n* Can be overwhelming for new users\n\n\n* Some features are only available on paid plans\n\n\n**Verdict**\n\n\nOne of the main things that makes Trello so effective for people with ADHD is its visual interface. Trello uses a board layout with lists and cards, which allows users to see all of their tasks at a glance. This can help people with ADHD to stay focused and avoid feeling overwhelmed.\nTrello is also very flexible, which makes it a good option for people with ADHD who have changing needs. Trello can be used to manage a wide variety of tasks, from simple to complex. This means that people with ADHD can use Trello to manage their work, school, and personal tasks all in one place.\n\n\nOverall, Trello is a powerful tool that can help people with ADHD stay organised, focused, and productive. It is easy to use, flexible, and collaborative. Trello is recommended to people with ADHD who are looking for a task management tool that can help them achieve their goals.\n\n\n## 10. [Brain Focus](https://play.google.com/store/apps/details?id=com.AT.PomodoroTimer&hl=en&gl=US)\n\n\n\n![VzSEB0PY68tMdBUkYzOGZLuEGOSrnBaR5tHNs025KqI=](/blobs/VzSEB0PY68tMdBUkYzOGZLuEGOSrnBaR5tHNs025KqI=)\n\n\nBrainFocus is a web-based app that uses music and neuroscience to help people focus and concentrate. It offers a variety of features that can be helpful for people with ADHD, including personalised focus music, focus sessions and focus tracking.\n\n\n**Pros**\n\n\n* Personalised focus music\n\n\n* Focus sessions\n\n\n* Focus tracking\n\n\n* Easy to use and navigate\n\n\n* Affordable subscription price\n\n\n**Cons**\n\n\n* Subscription-based\n\n\n* Not as comprehensive as some other focus apps\n\n\n* Some users find the music to be repetitive\n\n\n**Verdict**\n\n\nBrainFocus is recommended to people with ADHD who are looking for a way to improve their focus and concentration. It is a good option for people with ADHD who want to try using music to help them focus. BrainFocus is also a good option for people with ADHD who are looking for a simple and easy-to-use focus app. However, it is important to note that BrainFocus is not a cure for ADHD, and it should be used in conjunction with other treatments, such as medication and therapy.\n\n\n## 11. [Pomodoro](https://apps.apple.com/us/app/pomodoro-focus-timer/id1265128036)\n\n\n\n![ZKuRzQOT56BypzfAVkPgfYkf-4ze4c8VZL-_AQStPNU=](/blobs/ZKuRzQOT56BypzfAVkPgfYkf-4ze4c8VZL-_AQStPNU=)\n\n\nPomodoro Focus Timer is a simple and effective app that can help people with ADHD stay focused and on track. It uses the Pomodoro Technique, a time management method that involves working in short, focused bursts of 25 minutes, separated by short breaks. The Pomodoro Technique can be especially helpful for people with ADHD, as it helps to break down large tasks into smaller, more manageable chunks. It also helps to reduce distractions and improve focus. The Pomodoro Focus Timer app makes it easy to follow the Pomodoro Technique. It provides a simple timer interface with customizable settings, so you can create a Pomodoro routine that works best for you.\n\n\n**Pros**\n\n\n* Simple and easy to use\n\n\n* Customizable Pomodoro settings\n\n\n* Task management\n\n\n* Notifications\n\n\n* Statistics\n\n\n**Cons**\n\n\n* Some users find the timer to be too distracting\n\n\n* Some users find the app to be too basic\n\n\n**Verdict**\n\n\nWe would recommend Pomodoro Focus Timer to people with ADHD who are looking for a simple and effective way to improve their focus and productivity. It is a good option for people with ADHD who want to try the Pomodoro Technique. Pomodoro Focus Timer is also a good option for people with ADHD who are looking for a free Pomodoro timer app.\n\n\n## 12. [Evernote](https://evernote.com/)\n\n\n\n![EG7dZnCUU_2l28AnuhqNIcDMtMvbH94EuHMV-gaKCWE=](/blobs/EG7dZnCUU_2l28AnuhqNIcDMtMvbH94EuHMV-gaKCWE=)\n\n\nEvernote is a note-taking app that can be a lifesaver for people with ADHD. It offers a variety of features that can help people with ADHD stay organised, focused, and on track, including ability to create notebooks and tags, mark reminders and due dates. Furthermore, it has built in search and filtering and it offers multi-device support.\n\n\n**Pros**\n\n\n* Comprehensive note-taking features\n\n\n* Notebooks and tags for organization\n\n\n* Reminders and due dates for staying on track\n\n\n* Powerful search and filtering features\n\n\n* Multi-device support\n\n\n**Cons**\n\n\n* Can be overwhelming for new users\n\n\n* Some features are only available on paid plans\n\n\n**Verdict**\n\n\nWe would recommend Evernote to people with ADHD who are looking for a comprehensive note-taking app with a variety of features. It is a good option for people with ADHD who want to be able to organise their thoughts and ideas, set reminders and due dates, and easily find the notes they need. Evernote is also a good option for people with ADHD who are on the go a lot, as it is available on all devices.\n\n\n## 13. [SimpleMind](https://simplemind.eu/)\n\n\n\n![nCzX5uyv23Qo14_6zOgYdMx2n39h_6r0pM056S9JPlc=](/blobs/nCzX5uyv23Qo14_6zOgYdMx2n39h_6r0pM056S9JPlc=)\n\n\nSimpleMind is a mind-mapping app that can be a helpful tool for people with ADHD. Mind mapping is a visual way to organize and brainstorm ideas, and it can be especially helpful for people with ADHD who have difficulty staying focused and organized. The app offers ability to make visual mind maps, offers wide range of customisation options and also enables users to collaborate with one another.\n\n\n**Pros**\n\n\n* Visual mind mapping\n\n\n* Customisation\n\n\n* Collaboration\n\n\n* Easy to use\n\n\n* Available on all devices\n\n\n* Free plan available, as well as paid plans with additional features\n\n\n**Cons**\n\n\n* Can be overwhelming for new users\n\n\n* Some features are only available on paid plans\n\n\n**Verdict**\n\n\nSimpleMind can be a great tool for people with ADHD who are looking for a visual way to organise and brainstorm ideas. It is a good option for people with ADHD who want to be able to see the big picture and to understand how different ideas relate to each other. SimpleMind is also a good option for people with ADHD who work on team projects or who need help from others to brainstorm and organise their ideas.\n\n\n## 14. [MindMeister](https://www.google.lv/aclk?sa=l&ai=DChcSEwiXp8bn8qSCAxXpi2gJHY2WDbsYABABGgJ3Zg&ase=2&gclid=CjwKCAjwkY2qBhBDEiwAoQXK5WpQbAxiRqGxvHvzcOO1u-kDwZcqMmol620mF4O3e_jJLz1P8Gm-PRoC37gQAvD_BwE&sig=AOD64_0smE5gqGlXTzVnnvshWxhPmN08dw&q&nis=4&adurl&ved=2ahUKEwjTrr_n8qSCAxW5a_EDHRHwCHIQ0Qx6BAgGEAM)\n\n\n\n![FSnaypZzxkahQ01z6rl4Xm17YHSkRchvNoR7MPr5Q1I=](/blobs/FSnaypZzxkahQ01z6rl4Xm17YHSkRchvNoR7MPr5Q1I=)\n\n\nMindMeister is a web-based mind-mapping app that can be a valuable tool for people with ADHD. It offers a variety of features that can help people with ADHD stay organised, focused, and productive. Similarly as SimpleMind, the app offers options such as visual mind mapping and collaboration options. The app can be further noted for its flexibility and ease of use.\n\n\n**Pros**\n\n\n* Visual mind mapping\n\n\n* Collaboration\n\n\n* Flexibility\n\n\n* Ease of use\n\n\n* Available on all devices\n\n\n* Free plan available, as well as paid plans with additional features\n\n\n**Cons**\n\n\n* Can be difficult to use for people with visual processing difficulties\n\n\n* Can be overwhelming for people with executive functioning difficulties\n\n\n* Can be addictive\n\n\n**Verdict**\n\n\nWe would recommend MindMeister to people with ADHD who are looking for a visual mind mapping tool that is easy to use and flexible. MindMeister is a good option for people with ADHD who want to be able to see the big picture, collaborate with others, and manage a variety of tasks.\n\n\n## 15. [Productive- Habit Tracker](https://productiveapp.io/)\n\n\n\n![vpnjGeS3JggOrx9oiByBbgfHaj0VXa5GuB6YV432Awc=](/blobs/vpnjGeS3JggOrx9oiByBbgfHaj0VXa5GuB6YV432Awc=)\n\n\nProductive Habit Tracker is a habit tracker app that can be helpful for people with ADHD. It allows users to create and manage a list of habit tasks, track their progress, set reminders, and get insights into their habit tracking data.\n\n\n**Pros**\n\n\n* Comprehensive habit tracking features\n\n\n* Task management\n\n\n* Habit tracking\n\n\n* Reminders\n\n\n* Insights and reports\n\n\n* Easy to use\n\n\n* Available on all devices\n\n\n* Free plan available, as well as paid plans with additional features\n\n\n**Cons**\n\n\n* Can be difficult to maintain streaks\n\n\n* Can be addictive\n\n\n* Can be expensive for individuals and small teams\n\n\n**Verdict**\n\n\nProductive Habit Tracker is recommended to people with ADHD who are looking for a comprehensive habit tracker app with a variety of features. It is a good option for people with ADHD who want to be able to track their habits, set reminders, and get insights into their habit-tracking data.\n\n\n# Start your knowledge management with AFFiNE\n\n\n\n![nG1zIBSH0S-8U7e52_D9rWQS2HZasYlld44LSON-T7g=](/blobs/nG1zIBSH0S-8U7e52_D9rWQS2HZasYlld44LSON-T7g=)\n\n\nWhile there are plenty of free adhd software options available, one tool that stands out from the rest is AFFiNE. With its user-friendly interface and powerful features, AFFiNE takes your knowledge management to a whole new level. AFFiNE offers a wide range of customizable templates and elements that allow you to bring your ideas to life. Whether you're taking notes, making your year plan or designing a daily routine, AFFiNE has got you covered. It provides you with the flexibility to add images and text to enhance your productivity.\n\n\nNow that you have learned about the definition and creation of a storyboard, it's time to put your knowledge into action. And what better way to do that than with AFFiNE? Commence improving your plans by using AFFiNE's user-friendly tool. Presently, **AFFiNE** has launched its **[Stable Version](https://affine.pro/download)**, with ongoing efforts to develop a more comprehensive and dependable iteration. Join us on our voyage through our social media channels and be part of the experience. **Come and join us on our journey over on our media platforms.** 🚀\n\n\n* Official Website: [https://affine.pro/](https://affine.pro/)\n\n\n* GitHub: [https://github.com/toeverything/AFFiNE](https://github.com/toeverything/AFFiNE)\n\n\n* Discord: [https://discord.gg/Arn7TqJBvG](https://discord.gg/Arn7TqJBvG)\n\n\n* Twitter: [https://twitter.com/AffineOfficial](https://twitter.com/AffineOfficial)\n\n\n",
  "publish": true
}