{
  "title": "15 Top Examples of Software as a Service (SaaS) Applications You Need to Know in 2024",
  "authors": [
    "Yiyang Zhang"
  ],
  "tags": [
    "Content"
  ],
  "description": "Unravel the elegance of SaaS for your needs. Discover the 15 top examples of SaaS to upgrade your work efficiency in 2024.",
  "created": 1711324800000,
  "updated": 1711324800000,
  "layout": "blog",
  "id": "DpcYkJHcr6POa9iWK3tdb",
  "slug": "15-top-examples-saas-application",
  "cover": "https://app.affine.pro/api/workspaces/qf73AF6vzWphbTJdN7KiX/blobs/_5rdzYJBxykB04pcdsRXi1pOmQYbxxkQgrLinAJwtlE=.webp",
  "md": "---\n\ntitle: \"15 Top Examples of Software as a Service (SaaS) Applications You Need to Know in 2024\"\n\nauthor: \"Yiyang Zhang\"\n\ntags: Content\n\nslug: 15-top-examples-saas-application\n\ndescription: \"Unravel the elegance of SaaS for your needs. Discover the 15 top examples of SaaS to upgrade your work efficiency in 2024.\"\n\ncreated: 2024-03-25\n\nupdated: 2024-03-25\n\nlayout: blog\n\npublish: true\n\n---\n\n\n![_5rdzYJBxykB04pcdsRXi1pOmQYbxxkQgrLinAJwtlE=](https://app.affine.pro/api/workspaces/qf73AF6vzWphbTJdN7KiX/blobs/_5rdzYJBxykB04pcdsRXi1pOmQYbxxkQgrLinAJwtlE=.webp)\n\nIn today's digital age, Software as a Service (SaaS) has revolutionized the way we access and use software. Gone are the days of purchasing expensive physical copies and dealing with tedious installations. With SaaS, you can simply log in and start using powerful applications right away.\n\n**But what exactly is SaaS? Why has it become so popular? And most importantly, what are some examples of SaaS that you need to know in 2024?**\n\nDon't worry, we've got you covered! In this article, we'll dive into the world of SaaS and explore the reason why it becomes so popular. We'll also highlight 15 must-know examples of SaaS that will shape our technological landscape in 2024. So let's get started on this exciting journey towards software innovation!\n\n# **What is Software as a Service (SaaS)**\n\nSoftware as a Service (SaaS) is a groundbreaking model of software delivery that has transformed the way businesses and individuals access and use applications. There are majorly 3 cloud-based services - SaaS, PaaS and IaaS from which SaaS is the most popular one. Cloud computing makes it extremely convenient to access and store cloud data via web-enabled devices like laptops, smartphones, and other Internet-enabled devices using Software as a Service (SaaS). Unlike traditional software, where you purchase a physical copy or download it onto your device, SaaS operates in the cloud.\n\n# **Why is Software as a Service (SaaS) So Popular**\n\nSoftware as a Service, or SaaS, has gained immense popularity in recent years. But why are SaaS solutions so widely embraced? There are several key reasons driving their popularity.\n\n\n![iPGrBu__VLgfRpgA0_3nUS1YNogGynVfUcIBQnWSUx4=](https://app.affine.pro/api/workspaces/qf73AF6vzWphbTJdN7KiX/blobs/iPGrBu__VLgfRpgA0_3nUS1YNogGynVfUcIBQnWSUx4=.webp)\n\n* **Cost-effectiveness:** Unlike traditional software models that require upfront purchases and installations, SaaS follows a subscription-based model.\n* **Flexibility and accessibility:** With cloud-based infrastructure, users can access these services from any device with an internet connection.\n* **Scalability:** Able to accommodate growing business needs effortlessly. As companies expand their operations and user base, they can quickly add more licenses or storage space without disrupting workflow or causing downtime.\n* **Data security:** These companies invest heavily in robust cybersecurity measures compared to individual organizations' capabilities – protecting sensitive information against cyber threats effectively.\n# **15 Examples of SaaS You Need to Know in 2024**\n\nSoftware as a Service (SaaS) has become increasingly popular in recent years, providing businesses with a cost-effective and flexible solution for their software needs. In 2024, there will be even more innovative SaaS options available to help companies streamline their operations and drive growth. Let's take a look at 15 examples of SaaS that you need to know about:\n\n### \n\n### **1. [AFFiNE](https://affine.pro/)**\n\n<div style=\"text-align:center;\">\n<iframe width=\"560\" height=\"315\" src=\"https://www.youtube.com/embed/WqOe9HgpsDY?si=PHGuSeRbOT9GxuPO\" title=\"YouTube video player\" frameborder=\"0\" allow=\"accelerometer; autoplay; clipboard-write; encrypted-media; gyroscope; picture-in-picture; web-share\" allowfullscreen></iframe>\n</div>\n\nAFFiNE is a versatile editor that lets you write, [draw](https://affine.pro/blog/affine-0-10-0-launch-week-day-4-5-write-draw-plan-present-collaboratively-anywhere), plan, and present all in one place. Easily capture detailed information about your new business using the page mode, allowing for straightforward document editing. Efficiently organize your projects by using a [database](https://affine.pro/blog/affine-0-11-0-launch-day-3-beyond-text-color-history-table-of-content-possibilities) to keep track of deadlines, assign responsibilities, and effortlessly [manage project progress](https://affine.pro/blog/10-best-free-smart-sheet-alternatives-for-project-management-2023). Take advantage of AFFiNE's powerful whiteboard feature to brainstorm ideas with your team. Moreover, craft visually appealing posters about your business for seamless publication and display on different social media platforms. AFFiNE offers a user-friendly platform for comprehensive business management and seamless [team collaboration](https://affine.pro/blog/top-asynchronous-communication-tools-free-2024).\n\n* **Tailored Precision with AFFiNE's Database:** AFFiNE's database seamlessly integrates Kanban and Table views for dynamic content creation. By smoothly transforming your blocks into a Kanban view, effortlessly classify based on properties such as date, progress, and link. This allows for intuitive drag-and-drop functionality, ensuring precise organization and alignment of your project execution. Switching to the Table view offers a comprehensive project overview, enhancing the efficiency of your narrative development. With intuitive controls, track deadlines and manage unscheduled tasks seamlessly.\n\n![bY0EkoVLJfBpOjymBoGUxE0LAiQuW1bNgYA-FU1OQlA=](https://app.affine.pro/api/workspaces/qf73AF6vzWphbTJdN7KiX/blobs/bY0EkoVLJfBpOjymBoGUxE0LAiQuW1bNgYA-FU1OQlA=.webp)\n\n* **Boost Productivity with Bookmark Preview:** Bookmark allows seamless previewing of links from platforms like YouTube, GitHub, and Figma within the application. Instantly play YouTube videos without leaving the current page, enhancing browsing efficiency. This integration simplifies link management and recognition, ensuring a smoother and more intuitive workflow.\n\n![_3wbyagun1HHX0v2uZb4hE8T8lDGxEJbdUzt3ZnTL4c=](https://app.affine.pro/api/workspaces/qf73AF6vzWphbTJdN7KiX/blobs/_3wbyagun1HHX0v2uZb4hE8T8lDGxEJbdUzt3ZnTL4c=.webp)\n\n* **Collaborative Editing:** Foster collaboration among team members by using AFFiNE's collaborative editing tools, and foster collaboration among team members. Multiple team members can work on email content simultaneously, ensuring a seamless and efficient content creation [process](https://affine.pro/blog/top-10-best-process-mapping-tools-software-2023-free-paid). Share files, exchange ideas, and provide feedback in real-time through AFFiNE. With AFFiNE, everyone can contribute to the same set of notes in real-time.\n\n![O88V12dZ7eALpdMD8-6eyyfRec5yZyWiQxCnvNEb3r0=](https://app.affine.pro/api/workspaces/qf73AF6vzWphbTJdN7KiX/blobs/O88V12dZ7eALpdMD8-6eyyfRec5yZyWiQxCnvNEb3r0=.webp)\n\n#### **Early Access of [AFFiNE AI](https://affine.pro/blog/whats-new-affine-20240315)**\n\n**Transforming Ideas into Visuals and Words Seamlessly!**\n\nAFFiNE AI, your true multimodal AI copilot, dedicated to turning \"all your ideas into reality\", is on the horizon!\n\n1. **Write with You:** Leveraging AI technology, AFFiNE AI provides intelligent assistance for every step of your writing process, from crafting sentences to entire articles. Whether you're creating content, professionally rewriting, adjusting tone, or correcting spelling and grammar, AFFiNE AI makes your text more vivid and accurate.\n1. **Draw with You:** With the power of AI, AFFiNE AI can transform your outlines or ideas into eye-catching visual works. Whether it's creating presentations or building mind maps, AFFiNE AI helps you clearly express and share your creativity.\n1. **Plan with You:** AFFiNE AI's smart planning tools help you manage and organize knowledge with auto-sorting and tagging features. Based on principles of open source and privacy protection, it ensures your information is secure and easily accessible. Join our waiting list now to be among the first to experience the leap in creativity and efficiency brought by AFFiNE AI.\n\n![eHMyjy-Aq0AI9SYHlhHyIDFftXVQdEFUwt8PTqLtrVE=](https://app.affine.pro/api/workspaces/qf73AF6vzWphbTJdN7KiX/blobs/eHMyjy-Aq0AI9SYHlhHyIDFftXVQdEFUwt8PTqLtrVE=.webp)\n\n### \n\n### **2. Monday.com**\n\n\n![MO0CXOaL-QpZxoTCi8fEx-WQD-_NfONeIT1sG7uxe_s=](https://app.affine.pro/api/workspaces/qf73AF6vzWphbTJdN7KiX/blobs/MO0CXOaL-QpZxoTCi8fEx-WQD-_NfONeIT1sG7uxe_s=.webp)\n\nMonday.com provides you with all of the no-code building blocks so you can shape your workflows, your way. With Monday.com, you can run every aspect of your work by layering industry-specific products on top of the Work OS. Combine building blocks to customize anything you need to improve the way your business runs.\n\n**Key features:**\n\n1. Intuitive project management.\n1. Workflow automation.\n1. Extensive integrations.\n\n\n### **3. [HubSpot](https://www.hubspot.com/)**\n\n\n![pjRN1aS9iOXbG1LJMUiM5rsgmTgfQRKZa1dJUwSobUU=](https://app.affine.pro/api/workspaces/qf73AF6vzWphbTJdN7KiX/blobs/pjRN1aS9iOXbG1LJMUiM5rsgmTgfQRKZa1dJUwSobUU=.webp)\n\nWith HubSpot's simple UI, companies can automate their sales and marketing efforts. Customers can get easy access to all relevant information so that they can make informed decisions about marketing and sales.\n\n**Key features:**\n\n* Automated CRM database and workflows\n* Marketing reporting and metrics\n* SaaS CRM with in-depth insights into contacts\n\n\n### **4. [ClickUp](https://clickup.com/)**\n\n\n![3e2Mn0xF8wUB-qDJ058_coEJCimIQw-h8LKEC3NhqeU=](https://app.affine.pro/api/workspaces/qf73AF6vzWphbTJdN7KiX/blobs/3e2Mn0xF8wUB-qDJ058_coEJCimIQw-h8LKEC3NhqeU=.webp)\n\nClickUp is one of the most popular (and highest-rated) cloud-based project management tools on the market today. Companies of all sizes, from solopreneurs to enterprise teams, use this platform to bring all their work into one centralized hub.\n\n**Key features:**\n\n* Fully customizable platform\n* Management automation workflows\n* Collaborative Docs and Whiteboards\n\n\n### **5. [Salesforce](https://www.salesforce.com/ca/?ir=1)**\n\n\n![-5Cq7J4i3WChcQVeofZrgtm89-M1K8sw_FH1UucG9Us=](https://app.affine.pro/api/workspaces/qf73AF6vzWphbTJdN7KiX/blobs/-5Cq7J4i3WChcQVeofZrgtm89-M1K8sw_FH1UucG9Us=.webp)\n\nSalesforce, also known as the \"gold standard\" of SaaS, helps you manage and integrate every aspect of your business with its CRM platform. In addition, Salesforce works to provide you with the latest technology to help your business be more efficient and productive.\n\n**Key features:**\n\n* Process automation\n* Account and contact management\n* Lead management\n\n\n### **6. [Quixy](https://quixy.com/)**\n\n\n![rUrM91Ezh5uykRqup2jq8vs2qGDrTHMbG8u_fDdPZz8=](https://app.affine.pro/api/workspaces/qf73AF6vzWphbTJdN7KiX/blobs/rUrM91Ezh5uykRqup2jq8vs2qGDrTHMbG8u_fDdPZz8=.webp)\n\nQuixy stands out because users can create applications without writing any code. It takes a few minutes with Quixy's easy-to-use visual interface to create simple, complex workflows. No-code platform Quixy empowers citizen developers to bring their ideas to life by solving unique challenges.\n\n**Key features:**\n\n* Manage tasks easily and effectively\n* No-Code App Development\n* Generate documents.\n\n\n### **7. [Dropbox](https://www.dropbox.com/)**\n\n\n![c0oNjZbCl9umaQpbeaBsKwa5AU7I0mtD11YwkPOy3MY=](https://app.affine.pro/api/workspaces/qf73AF6vzWphbTJdN7KiX/blobs/c0oNjZbCl9umaQpbeaBsKwa5AU7I0mtD11YwkPOy3MY=.webp)\n\nDropbox creates a special folder on the user's computer that keeps all files together in one place. As of now, Dropbox's servers and other devices where Dropbox is installed sync the contents or files of this folder.\n\n**Key features:**\n\n* Store and access files from anywhere.\n* Allows you to create and edit your work.\n* Provides desktop experience with smart content suggestions.\n\n\n### **8. [Shopify](https://www.shopify.com/)**\n\n\n![8GtMBM1TAC0uGqlq1ZJvSikTiYDURnGI_5ZZplh7sRI=](https://app.affine.pro/api/workspaces/qf73AF6vzWphbTJdN7KiX/blobs/8GtMBM1TAC0uGqlq1ZJvSikTiYDURnGI_5ZZplh7sRI=.webp)\n\nShopify is a one-stop eCommerce store solution for those who want to sell their products online. In this CMS (content management system), small & medium businesses can build a simple static website as well as a complex and highly functional eCommerce website.\n\n**Key features:**\n\n* User-friendly interface.\n* Quick customer service.\n* Mobile commerce ready.\n\n\n### 9**. [Intercom](https://www.intercom.com/)**\n\n\n![kBiiEcy3i5imZ4nROP_kLfVF3H8JSnTT1nUyt0HRNhw=](https://app.affine.pro/api/workspaces/qf73AF6vzWphbTJdN7KiX/blobs/kBiiEcy3i5imZ4nROP_kLfVF3H8JSnTT1nUyt0HRNhw=.webp)\n\nBy using Intercom, one can gain valuable insight into who uses your products and services. You can use the software to create personalized communicators and send emails and messages based on behavior.\n\n**Key features:**\n\n* Messenger for business\n* Customizable bots\n* Answers are generated automatically\n\n\n### **10. [Zapier](https://zapier.com/)**\n\n\n![zIi5HQwtglNEoq9Vnqid-kJ2Q9zfmbuwScUSewzw-VI=](https://app.affine.pro/api/workspaces/qf73AF6vzWphbTJdN7KiX/blobs/zIi5HQwtglNEoq9Vnqid-kJ2Q9zfmbuwScUSewzw-VI=.webp)\n\nZapier is a powerful tool allows you to automate your routine work by exchanging data and messages between Intercom, Salesflare, Slack, Google Sheets, SQL databases, and many other platforms.\n\n**Key features:**\n\n* Rule-based workflow management\n* Business process automation\n* Dashboard\n\n\n### **11. [Zoom](https://zoom.us/)**\n\n\n![erCSOtRwsYfOlDRvLXF1J0ONv8d21_VlS2bomG25tfI=](https://app.affine.pro/api/workspaces/qf73AF6vzWphbTJdN7KiX/blobs/erCSOtRwsYfOlDRvLXF1J0ONv8d21_VlS2bomG25tfI=.webp)\n\nZoom is easy to use, reliable, and affordable to use Zoom, a cloud-based video and audio conferencing, chat, and webinar platform. For personal and professional purposes, virtual communication is primarily used by freelancers, teams, and businesses of all sizes.\n\n**Key features:**\n\n* Chats and meetings\n* Workspaces and rooms\n* Systems for phone calls\n\n\n### **12. [Zendesk](https://www.zendesk.com/in/)**\n\n\n![G_JoaL9pkgMNSAOFVMPXdj-Pet3HmyxOCfV-39vBUHE=](https://app.affine.pro/api/workspaces/qf73AF6vzWphbTJdN7KiX/blobs/G_JoaL9pkgMNSAOFVMPXdj-Pet3HmyxOCfV-39vBUHE=.webp)\n\nZendesk offers a SaaS application that allows representatives to respond more efficiently to incoming customer requests via any communication channel - email, web, social media, phone, or chat. In addition to the basic chat version.\n\n**Key features:**\n\n* Live chat and messaging\n* Analyses and reporting\n* Software for customer service\n\n\n### **13. [Slack](https://slack.com/intl/en-in)**\n\n\n![FG0qtGAH3DaBFoxfVHdK0hLSNO7qHbF_He_hBPLubsY=](https://app.affine.pro/api/workspaces/qf73AF6vzWphbTJdN7KiX/blobs/FG0qtGAH3DaBFoxfVHdK0hLSNO7qHbF_He_hBPLubsY=.webp)\n\nSlack is a business communication platform that offers a multitude of features among the most prominent examples of SaaS applications. It is a SaaS application development solution that offers a wide variety of features.\n\n**Key features:**\n\n* Flexible communication to talk things through live.\n* Work faster by switching tabs less.\n* Automate routine actions and communications.\n\n\n### **14. [Buffer](https://buffer.com/)**\n\n\n![rhLtIGbgJU8OzwsZx2g7OkaCYercX3iVBNk3uodp3xA=](https://app.affine.pro/api/workspaces/qf73AF6vzWphbTJdN7KiX/blobs/rhLtIGbgJU8OzwsZx2g7OkaCYercX3iVBNk3uodp3xA=.webp)\n\nBuffer helps small businesses grow their audience organically, build their brand, and engage customers on social media. With Buffer's suite of products, users can optimize their social media marketing strategy in three easy steps: Analyze, Publish, and Engage—analyze results, schedule content, and interact with your audience.\n\n**Key features:**\n\n* Multi-account management\n* Multi-channel campaigns\n* Reporting, statistics, analytics\n\n\n### **15. [G Suite](https://www.gsuite.bsuite.in/)**\n\n\n![uUSoVsLGI9YGvrixItGGnYVxZMsel5cMOP4QcEGMiZY=](https://app.affine.pro/api/workspaces/qf73AF6vzWphbTJdN7KiX/blobs/uUSoVsLGI9YGvrixItGGnYVxZMsel5cMOP4QcEGMiZY=.webp)\n\nGoogle has actually made the world a better place to live for people of all demographics and businesses of all domains. With its comprehensive product line, G Suite offers a comprehensive ecosystem for individuals, small companies, and enterprises. Its accessibility on all devices and Android compatibility separate it from the competition.\n\n**Key features:**\n\n* Provides every user with a professional email address.\n* Stores everything Cloud.\n* Search across apps with powerful Cloud storage.\nThese are just some examples of the vast array of SaaS solutions available today—and this list is only going to expand as technology advances further! So keep an eye out for these innovative tools and stay ahead of the game in 2024.\n\n# **Get Started with AFFiNE**\n\nIn 2024 and beyond, we can expect even more exciting advancements in the world of SaaS. With technology constantly evolving, new players will likely emerge while existing ones continue to refine their offerings based on user feedback. Go ahead and unlock the full potential of cloud-based software!\n\n\n![iAkxI4vjnArhF6y4orPOS0piuCYS-KQkmSdCyYVIsJQ=](https://app.affine.pro/api/workspaces/qf73AF6vzWphbTJdN7KiX/blobs/iAkxI4vjnArhF6y4orPOS0piuCYS-KQkmSdCyYVIsJQ=.webp)\n\nThe examples highlighted in this article are just a glimpse into the vast landscape of SaaS offerings available today. However, they represent some of the most widely used and highly regarded options in their respective categories. With a humble perspective, we propose that **AFFiNE** is worthy of trying, providing a comprehensive and versatile solution for managing workflow, catering to a wide range of user requirements. Currently, **AFFiNE** has released its [stable version](https://affine.pro/download), but we are continuing to build to a more feature-rich and stable build. **Come and join us on our journey over on our media platforms.**\n\n* Official Website: [https://affine.pro/](https://affine.pro/)\n* GitHub: [https://github.com/toeverything/AFFiNE](https://github.com/toeverything/AFFiNE)\n* Discord: [https://discord.gg/Arn7TqJBvG](https://discord.gg/Arn7TqJBvG)\n* Twitter: [https://twitter.com/AffineOfficial](https://twitter.com/AffineOfficial)\n# **Support Us: Become an Early Access Sponsor for AFFiNE Cloud**\n\n\n![BXytVyyo5RfdYDrB3IVBUYtvCRKM7sTzEfSmba_L6Eo=](https://app.affine.pro/api/workspaces/qf73AF6vzWphbTJdN7KiX/blobs/BXytVyyo5RfdYDrB3IVBUYtvCRKM7sTzEfSmba_L6Eo=.webp)\n\nJoin us as an early access sponsor for the AFFiNE Cloud, and unlock advanced collaboration capabilities while upholding the local-first nature of your data. As a token of our appreciation, **you'll enjoy**:\n\n* **Early Access**, be among the first to experience AFFiNE Cloud's powerful features, including permission settings and control.\n* **One-year Free Pro Plan**, have a complimentary one-year premium AFFiNE Pro Plan subscription, packed with advanced tools to boost your productivity and creativity.\n* **Lifetime 50% Discount on Pro Plan**, benefit from a lasting 50% discount as long as you continue to find value in your subscription. **Other details:**\n  * AFFiNE Cloud enhances collaboration without compromising your data's local-first\n  * The free plan will remain available and always an option, with ongoing improvements.\n  * More details: [https://affine.pro/blog/affine-cloud-early-access](https://affine.pro/blog/affine-cloud-early-access)\n\n\n",
  "publish": true
}