{
  "title": "5 Best Free Daily Planner Apps for 2024 (Features, Price)",
  "authors": [
    "Jackie Peng"
  ],
  "tags": [
    "Content"
  ],
  "description": "In this article, we‚Äôll highlight the 5 best free Daily Planner apps with features available today that help you plan, prioritize, schedule, and streamline your day and your life, easy to get started, so you can conquer the chaos and focus on what matters most.",
  "created": 1679011200000,
  "updated": 1709510400000,
  "layout": "blog",
  "id": "oapgNIuMNG",
  "slug": "5-best-free-daily-planner-apps-for-2023",
  "cover": "/blobs/Wl2EmuRNH4xjlrWLBKzZIToWPXkzTIwdP2xVewmIDRk=",
  "md": "---\n\n\ntitle: \"5 Best Free Daily Planner Apps for 2024 (Features, Price)\"\n\n\nauthor: Jackie Peng\n\n\ntags: Content\n\n\nslug: 5-best-free-daily-planner-apps-for-2023\n\n\ndescription: \"In this article, we‚Äôll highlight the 5 best free Daily Planner apps with features available today that help you plan, prioritize, schedule, and streamline your day and your life, easy to get started, so you can conquer the chaos and focus on what matters most.\"\n\n\ncreated: 2023-03-17\n\n\nupdated: 2024-03-04\n\n\nlayout: blog\n\n\npublish: true\n\n\n---\n\n\n\n![Wl2EmuRNH4xjlrWLBKzZIToWPXkzTIwdP2xVewmIDRk=](/blobs/Wl2EmuRNH4xjlrWLBKzZIToWPXkzTIwdP2xVewmIDRk=)\n\n\n\n\n\nImagine this:\n\n\nYou‚Äôre sitting in your office, or maybe at your kitchen table, sipping coffee and trying to plan your day. You have a meeting in an hour, a project deadline looming, and an ever-growing list of errands to run. As you frantically scribble notes and reminders on sticky notes and random scraps of paper, you can‚Äôt help but feel like there must be a better way to stay on top of it all.\n\n\nEnter daily planner apps‚Äî these digital lifesavers help you plan, prioritize, schedule and streamline your day and your life, so you can conquer the chaos and focus on what matters most.\n\n\nIn this article, we‚Äôll discuss the importance of daily planner software and highlight the 5 best free daily apps in 2024 with features available today.\n\n\nLet‚Äôs begin.üìñ ‚úçÔ∏è\n\n\n# What is the definition of Daily Planner apps?\n\n\nA daily planner app is a software or app specifically designed to help you organize, schedule, and prioritize tasks, appointments, and other daily activities. These apps typically offer a wide range of features, such as task lists, calendars, reminders, time tracking, and goal setting, to keep you focused and on track. To be considered a top daily planner app, it must meet the following criteria:\n\n\n* Free and open-source: Allows for accessibility and customization even if you don‚Äôt have much of money.\n\n\n* Enhances productivity: Streamlines task management and helps you get more done in less time.\n\n\n* Keeps things organized: Provides a clear and structured interface to manage tasks, events, and ideas.\n\n\n* User-friendly: Intuitive design and ease of use, catering to users of varying technical expertise.\n\n\n* Robust feature set: Offers a comprehensive suite of apps and functionalities to address a wide range of daily planning and organizing needs. For instance, agenda planner, travel planner, schedule planner, routine planner for all well-management\n\n\n# 5 Best Daily Planner apps For 2024\n\n\n## 1. [AFFiNE](http://affine.pro)\n\n\n<div style=\"text-align:center;\">\n<iframe width=\"560\" height=\"315\" src=\"https://www.youtube.com/embed/WqOe9HgpsDY?si=PHGuSeRbOT9GxuPO\" title=\"YouTube video player\" frameborder=\"0\" allow=\"accelerometer; autoplay; clipboard-write; encrypted-media; gyroscope; picture-in-picture; web-share\" allowfullscreen></iframe>\n</div>\n\n\n\n\n\n[AFFiNE](http://affine.pro) is an innovative and comprehensive free daily planner app designed to help you organize, manage, and collaborate on tasks, projects, and information. As a next-generation knowledge base, AFFiNE combines the best features of popular apps like Notion and Miro into one powerful, flexible, and user-friendly platform. It focuses on data security, privacy, and collaboration, making it the perfect choice for managing your daily plans, personal knowledge repository, and team projects.\n\n\n\n\n\nWhat you can do with AFFiNE‚Äôs key features:\n\n\n* **Write: Drag-and-drop blocks for easy paperwork**\n\n\n\n![zAbvFaQ1LgFS1CEQ1CejnmXp8p9MvocvkJjMgiyNUss=](/blobs/zAbvFaQ1LgFS1CEQ1CejnmXp8p9MvocvkJjMgiyNUss=)\n\n\n\n\n\n* **Plan: Kanban & Database to better plan your daily arrangements**\n\n\n  * Unlike typical Kanban boards limited to tagging, we provide unparalleled customization. Now, you can classify based on almost any property, allowing for personalized categorization that aligns perfectly with your needs.\n\n\n  \n![uhiB1umZ-ASVLXrhgsYMWiQn_ON4EsUFocPKhu0jP6k=](/blobs/uhiB1umZ-ASVLXrhgsYMWiQn_ON4EsUFocPKhu0jP6k=)\n\n\n  * Experience synchronization between Kanban and table views. Any changes made in the Kanban view will automatically reflect in the corresponding table view. Enjoy the convenience of two ways to manage your data seamlessly.\n\n\n\n![crjX5_HRaAu3feQ3mQMTVmg-FqXutYjATZJpEZEMi98=](/blobs/crjX5_HRaAu3feQ3mQMTVmg-FqXutYjATZJpEZEMi98=)\n\n\n* **Draw**: Switching to the whiteboard for **Smooth drawing and Visualizationand creative brainstorming**\n\n\n  * Visualize and connect your daily ideas smoothly with better cartoon-style shape, slick pen, and connectors. No constraints. Limited only by your imagination. Ohhh, by the way, images now are supported to upload!! We just make everything easy for you, now you may enjoy your drawing time!\n\n\n\n![x1qC27f1zMYaIC05JYQEo3Jz1Gw3hUH2eIqg9_hfYHs=](/blobs/x1qC27f1zMYaIC05JYQEo3Jz1Gw3hUH2eIqg9_hfYHs=)\n\n\n* **[Diversified concept maps templates](https://community.affine.pro/c/general-discussion/new-templates-available-soon)**\n\n\n  * In AFFiNE's upcoming 0.11 release, we've curated a collection of the most requested templates, including the **Gantt chart, Project Tracking Kanban, Monthly Calendar, Flowchart, and many more**.\n\n\n  \n![28yOlp-42GeWL2GJ6Lm9CIQgf44JwsEXwZ7s1Bm7pMc=](/blobs/28yOlp-42GeWL2GJ6Lm9CIQgf44JwsEXwZ7s1Bm7pMc=)\n\n\n**AFFiNE‚Äôs Price:**\n\n\nIn addition to those mentioned above, AFFiNE is a fantastic, completely free daily planner app that wel¬∑¬∑comes everyone to experience its powerful features, making it a delightful surprise for those seeking a comprehensive solution for their daily planning needs.\n\n\n* Come and check with our latest [Stable version](https://affine.pro/download), enjoy your creative moments.\n\n\n* For more things related to AFFiNE, Come and check out our website:&nbsp;[AFFiNE ‚Äî All In One KnowledgeOS](https://affine.pro/)\n\n\n* Wanna try it online:[https://app.affine.pro/](https://app.affine.pro/)\n\n\n## 2. [Clickup](https://clickup.com/)\n\n\n\n![b70Gt0FlogAH6EnUHu_95PmZiiCV6bdDl02r9OnNDl4=](/blobs/b70Gt0FlogAH6EnUHu_95PmZiiCV6bdDl02r9OnNDl4=)\n\n\nClickUp is an outstanding productivity app and one of the top online planners designed for individuals and teams of all sizes to manage their to-do lists effectively.\n\n\nRegardless of your role ‚Äî be it a task manager, a student handling assignments, or a parent putting together a grocery list ‚Äî ClickUp has the potential to be your ideal weekly planner app.\n\n\nHere‚Äôs a quick look into some useful Clickup features:\n\n\n* **Task Management**: Create tasks, subtasks, and checklists to break down your daily plan into manageable steps. You can easily set priorities, due dates, and assign tasks to team members.\n\n\n* **Customizable Views**: Choose from various views like list, board, calendar, and Gantt chart to visualize your daily plan in a way that suits your workflow best.\n\n\n* **Time Tracking**: Use the built-in time tracking feature to monitor the time spent on tasks, helping you stay on track with your daily plan and improve productivity.\n\n\n* **Reminders and Notifications**: Set reminders for important tasks and receive notifications about upcoming deadlines, ensuring you stay on top of your daily plan.\n\n\n* **Goal Setting**: Define and track your goals in ClickUp, which helps you stay focused on the objectives that matter most in your daily plan.\n\n\nClickup Price:\n\n\nClickUp has a¬†**Free Plan,**¬†but it won‚Äôt cover all the funtionalities you need most, $5/user per month is necessary if there‚Äôs more you wanna do with clickup\n\n\nKnowing more about AFFiNE or Clickup, which one is most suitable to you, can check this article:¬†[https://affine.pro/blog/seven-best-open-source-clickup-alternatives-2023](https://affine.pro/blog/seven-best-open-source-clickup-alternatives-2023)\n\n\n## 3.[Notion](https://affine.pro/blog/notion-alternatives-to-revolutionise-your-personal-workflow)\n\n\n\n![P_a2i4g2vgHb2cRUrkCJpruNZVJQfYSSOv4HkmcVaKU=](/blobs/P_a2i4g2vgHb2cRUrkCJpruNZVJQfYSSOv4HkmcVaKU=)\n\n\nNotion is a versatile all-in-one workspace application designed to help users with note-taking, project management, and task organization. It has gained significant popularity among professionals and teams across various industries. As an excellent app for managing daily work plans, Notion‚Äôs flexibility and wide range of features cater to users with diverse requirements, making it a go-to choice for many.\n\n\n* **Tasks and to-do lists**: Create tasks and to-do lists to track and manage your daily responsibilities.\n\n\n* **Project boards**: Use Kanban-style project boards to visualize your daily work plan and monitor progress.\n\n\n* **Calendar view**: Plan and schedule your tasks in a calendar view, making it easy to see what‚Äôs coming up in your daily work plan.\n\n\n* **Databases**: Create and manage databases to store and organize information related to your daily tasks and projects.\n\n\n* **Templates**: Use templates to quickly set up pages or databases for recurring tasks or projects, saving time in your daily planning.\n\n\n**Notion price:**\n\n\nNotion‚Äôs free plan still provides a comprehensive set of features for individual users and small teams. However, for those who need more advanced capabilities, collaboration options, and support, upgrading to a paid plan might be necessary.\n\n\nKnowing more about AFFiNE or Notion, which one is most suitable to you, can check this article:¬†[5 Best Open Source Alternatives to Notion (affine.pro)](https://affine.pro/blog/best-open-source-notion-alternatives)\n\n\n## 4.[Trello](https://affine.pro/blog/best-trello-alternatives-2023-project-management)\n\n\n\n![wv0wkqJD-zn10JH1_ADAGHwYccWEz7mtzTj5tAdBAN0=](/blobs/wv0wkqJD-zn10JH1_ADAGHwYccWEz7mtzTj5tAdBAN0=)\n\n\nTrello is a popular visual project management app that uses boards, lists, and cards to help you organize your daily tasks. With its simple, drag-and-drop interface, Trello is easy to use and offers a variety of integrations with other productivity apps.\n\n\n* Create boards for projects or categories, lists for stages or tasks, and cards for individual tasks or subtasks, making it easy to organize and prioritize your daily work plan.\n\n\n* Drag-and-drop Interface: Trello‚Äôs intuitive drag-and-drop interface allows you to quickly move tasks between different stages or lists, making it simple to update your daily work plan as priorities change.\n\n\n* Due Dates and Reminders: Assign due dates to cards and receive reminders before the deadlines, ensuring that you stay on track with your daily work plan.\n\n\n**Trello price**:\n\n\nTrello also offers the¬†**Free Plan,**¬†but there are some limitations that might affect its usability for certain users or more complex projects. So you still need to pay extra $10 to have more useful features.\n\n\n* Wanna read more comparison articles related to Trello, check this:¬†[6 Best Project Management Tools to boost productivity in 2023 (affine.pro)](https://affine.pro/blog/best-project-management-tools-2024)\n\n\n## 5.[Todoist](https://todoist.com/)\n\n\n\n![To7hLoepQGZ0P0udBe8CBFlT0uxGI1_Hrqr_4o9Rt8Y=](/blobs/To7hLoepQGZ0P0udBe8CBFlT0uxGI1_Hrqr_4o9Rt8Y=)\n\n\nTodoist is a popular to-do list and task management app that helps you organize and prioritize your daily tasks. With its clean and user-friendly interface, Todoist offers features like due dates, recurring tasks, and reminders to help you stay on top of your daily plan.\n\n\n* **Task creation**: Easily create tasks with deadlines, labels, and priorities to stay organized and focused on what matters most.\n\n\n* **Project organization**: Organize tasks into projects and sections to visualize and manage your daily work plan more effectively.\n\n\n* **Recurring tasks**: Set up tasks that repeat daily, weekly, monthly, or with a custom frequency to help you manage your routine activities.\n\n\n**Todoist price:**\n\n\nTodoist offers various pricing plans to cater to different users‚Äô needs. These include a Free plan, a Premium plan, and a Business plan. However, the free plan doesn‚Äôt include reminders, which can be crucial for staying on track with daily tasks and deadlines.\n\n\n# Which Daily Planner App offers the best solution?\n\n\nWhile each of the daily planner apps discussed offers its own unique and appealing features, we encourage users to choose the ideal option based on their specific needs and pain points. However, with a humble perspective, we still propose that [AFFiNE](https://affine.pro/) emerges as the ultimate winner in this evaluation, providing a comprehensive and versatile solution for daily task management and goals setting, catering to a wide range of user requirements.\n\n\n\n\n\n<div style=\"text-align:center;\">\n\n\n<iframe width=\"560\" height=\"315\" src=\"https://www.youtube.com/embed/3cfeKOufZWU?si=IiXDIdwfnM2Z7KPL\" title=\"YouTube video player\" frameborder=\"0\" allow=\"accelerometer; autoplay; clipboard-write; encrypted-media; gyroscope; picture-in-picture; web-share\" allowfullscreen></iframe>\n\n\n</div>\n\n\n\n\n\nAFFiNE is [stable](https://affine.pro/download) now, easy to get started and free to use, and we are continuing to build to a more feature-rich and stable one. Come and join us on our journey over on our media platforms.\n\n\n* Official Website:¬†[https://affine.pro/](https://affine.pro/)\n\n\n* GitHub:¬†[https://github.com/toeverything/AFFiNE](https://github.com/toeverything/AFFiNE)\n\n\n* Discord:¬†[https://discord.gg/Arn7TqJBvG](https://discord.gg/Arn7TqJBvG)\n\n\n* Telegram:¬†[https://t.me/affineworkos](https://t.me/affineworkos)\n\n\n\n\n\n\n\n\n",
  "publish": true
}