{
  "title": "The 5 Best Open Source Notion Alternatives",
  "authors": [
    "AFFiNE"
  ],
  "tags": [
    "Content"
  ],
  "description": "Notion is a popular note-taking and collaboration tool that has gained a lot of attention in recent years. However, it's not the only option out there.",
  "created": 1678924800000,
  "updated": 1678924800000,
  "layout": "blog",
  "id": "-eqyGf3UwK",
  "slug": "5-best-open-source-notion-alternatives",
  "cover": "/blobs/nTDck1M0zz5E0zJwpxuArUaWAXC7eKBqsJ1AK2HNhAw=",
  "md": "---\n\n\ntitle: The 5 Best Open Source Notion Alternatives\n\n\nauthor: AFFiNE\n\n\ntags: Content\n\n\nslug: 5-best-open-source-notion-alternatives\n\n\ndescription: Notion is a popular note-taking and collaboration tool that has gained a lot of attention in recent years. However, it's not the only option out there.\n\n\ncreated: 2023-03-16\n\n\nupdated: 2023-03-16\n\n\nlayout: blog\n\n\npublish: true\n\n\n---\n\n\n\n\n\n\n![nTDck1M0zz5E0zJwpxuArUaWAXC7eKBqsJ1AK2HNhAw=](/blobs/nTDck1M0zz5E0zJwpxuArUaWAXC7eKBqsJ1AK2HNhAw=)\n\n\n<script type=\"text/javascript\">\n\n\nwindow.location.href=\"https://affine.pro/blog/best-open-source-notion-alternatives\";\n\n\n</script>\n\n\n\n\n\nNotion is a popular note-taking and collaboration tool that has gained a lot of attention in recent years. However, it's not the only option out there. In this article, we'll be helping you to exploring some of the best open source Notion alternatives available.\n\n\n## 1. AFFiNE\n\n\nAFFiNE is a next-generation knowledge base that combines the best of Notion and Miro into one app. It is a powerful and flexible open-source tool that offers a wide range of features for note-taking, task management, and project collaboration.\n\n\nOne of the standout features of AFFiNE is its ability to seamlessly switch between paper mode and whiteboard mode, making it a versatile tool for brainstorming, planning, and collaboration. It has a sleek and intuitive interface that makes it easy to use, and it's highly customizable to suit your needs.\n\n\nOne of the biggest advantages of AFFiNE over other Notion alternatives is its flexibility. You can use it for personal note-taking, team collaboration, project management, and more. It also offers advanced features like time tracking, data visualization, and automation. If you're looking for a powerful and flexible tool that can handle all your note-taking, task management, and project collaboration needs, then [AFFiNE](https://affine.pro/blog/affine-the-next-gen-knowledge-base-to-notion-and-miro) is definitely worth checking out.\n\n\n## 2. Appflow\n\n\nAppflowy is another great open-source Notion alternative that's worth checking out. It's a simple but powerful tool that's designed for note-taking and task management. It has a minimalist interface that's easy to navigate, and it's highly customizable to fit your workflow.\n\n\nThe biggest advantage of APPflowy lies in its Rust+Flutter technology architecture. This technology combination makes APPflowy perform better and its interface smoother and easier to use. In addition, the Rust+Flutter technology architecture also makes APPflowy more stable and secure, ensuring that your data is always protected. Although APPflowy is very simple and easy to use, it also offers many advanced features, such as Markdown support, tagging, encryption, and synchronization.\n\n\n## 3. Turtl\n\n\nTurtl is a secure and private open-source tool that's designed for note-taking and bookmarking. It has a strong focus on privacy and security, which makes it an excellent choice for sensitive information. It also offers a range of features like cross-device syncing, tagging, and encryption.\n\n\n## 4. Joplin\n\n\nJoplin is a powerful open-source tool that's designed for note-taking, to-do lists, and task management. It has a clean and modern interface that's easy to use, and it's highly customizable to fit your needs. It also offers advanced features like Markdown support, encryption, and synchronization.\n\n\n## 5. Laverna\n\n\nLaverna is a simple but powerful open-source tool that's designed for note-taking and task management. It has a clean and minimalist interface that's easy to use, and it's highly customizable to fit your workflow. It also offers advanced features like Markdown support, encryption, and synchronization.\n\n\n## Conclusion\n\n\nIn conclusion, there are plenty of great open-source Notion alternatives available, each with its own strengths and weaknesses. However, if you're looking for a powerful and flexible tool that can handle all your note-taking, task management, and project collaboration needs, then AFFiNE is the clear winner. With its advanced features, intuitive interface, and flexible design, it's the perfect tool for individuals and teams alike.\n\n\n\n\n\n",
  "publish": true
}