{
  "title": "5 Best Free Tools to Create Agile Roadmap Templates to map out 2024",
  "authors": [
    "Yiyang Zhang"
  ],
  "tags": [
    "Content"
  ],
  "description": "Learn how to create your own roadmaps to enhance productivity. Explore 5 best tools for agile roadmap templates to find the perfect solution in 2024. ",
  "created": 1689120000000,
  "updated": 1704153600000,
  "layout": "blog",
  "id": "r29jM6LxqB",
  "slug": "5-best-free-tools-agile-roadmap-templates-2023",
  "cover": "/blobs/0rCR9xCmInt5r_pAyxOumovXzPerRBBOUKelXKxiF9A=",
  "md": "---\n\n\ntitle: \"5 Best Free Tools to Create Agile Roadmap Templates to map out 2024\"\n\n\nauthor: Yiyang Zhang\n\n\ntags: Content\n\n\nslug: 5-best-free-tools-agile-roadmap-templates-2023\n\n\ndescription: \"Learn how to create your own roadmaps to enhance productivity. Explore 5 best tools for agile roadmap templates to find the perfect solution in 2024. \"\n\n\ncreated: 2023-07-12\n\n\nupdated: 2024-01-02\n\n\nlayout: blog\n\n\npublish: true\n\n\n---\n\n\n\n![0rCR9xCmInt5r_pAyxOumovXzPerRBBOUKelXKxiF9A=](/blobs/0rCR9xCmInt5r_pAyxOumovXzPerRBBOUKelXKxiF9A=)\n\n\nIn today's fast-paced digital age, planning and strategizing are essential for success in any endeavor. Whether you're launching a new product, embarking on a project, or setting goals for the year ahead, roadmap templates comes in handy. A roadmap template provides a clear path to follow, ensuring that everyone involved stays on track and focused on the end goal.\n\n\n\n![NtYzMB4Tlo4WafpLnz7RV1pcE_78_ZRSCER7vSun8n4=](/blobs/NtYzMB4Tlo4WafpLnz7RV1pcE_78_ZRSCER7vSun8n4=)\n\n\nIn this article, we'll explore the different types of roadmaps, walk you through the steps to create one, and introduce you to the five best tools to create roadmap templates for 2024. So let's dive in and start mapping out your future success!\n\n\n\n![QMoSDEq0T34mYrDtavmO905_NmNdQLmTFWpVgRGNQ7Y=](/blobs/QMoSDEq0T34mYrDtavmO905_NmNdQLmTFWpVgRGNQ7Y=)\n\n\nRoadmap templates come in various formats, including spreadsheets, presentations, or online tools. They usually include sections to define objectives, timelines, tasks, milestones, dependencies, and resources needed. By using these templates, you can save valuable time and energy by avoiding the need to create a roadmap from scratch.\n\n\nBy utilizing a roadmap template in your planning process, you can ensure that all aspects are considered comprehensively. It allows you to break down complex projects into manageable phases, set realistic deadlines, and identify any potential roadblocks or bottlenecks along the way. So whether you're an entrepreneur striving for business growth or part of an organization aiming to reach new heights in 2024.\n\n\nNow let's explore some different types of roadmaps before we dive into creating one ourselves!\n\n\n## Different Types of Roadmaps\n\n\nRoadmaps come in various forms, each designed to serve a specific purpose and cater to different needs. Here are some of the different types of roadmaps that you can use to plan out your goals for 2024.\n\n\n* Product Roadmap: This type of roadmap is commonly used by product managers to outline the development and release schedule for a particular product or service.\n\n\n* Project Roadmap: Project managers often use project roadmaps to visualize project timelines, deliverables, dependencies, resources required, and potential risks involved in achieving project goals successfully.\n\n\n* Strategic Roadmap: A strategic roadmap provides an overview of an organization's long-term vision and goals along with high-level initiatives required to achieve them over time.\n\n\nBy understanding these different types of roadmaps available at your disposal in 2024 , you can choose one that aligns best with your specific needs - whether it be managing products effectively or executing complex projects flawlessly!\n\n\n## How to Create a Roadmap in 3 steps\n\n\nCreating a roadmap for your business or project can provide a clear direction and help you stay organized. Here are three simple steps to create an effective roadmap:\n\n\n**Step 1: Define Your Goals**\n\n\nStart by identifying the objectives you want to achieve with your roadmap. Are you looking to launch a new product, improve customer satisfaction, or expand into new markets?\n\n\n**Step 2: Prioritize Tasks**\n\n\nDetermine the key tasks that need to be completed in order to reach them. Consider factors like resources, dependencies, and timelines when prioritizing these tasks.\n\n\n**Step 3: Communicate and Iterate**\n\n\nShare your roadmap with team members, stakeholders, and other relevant parties involved in achieving the set goals. Gather feedback from them regularly and make necessary adjustments based on changing circumstances or priorities.\n\n\n\n![i7TVC1NVTHpmZ09E1xbIr_QxqA1Ur8bsVUxkiFdpvDs=](/blobs/i7TVC1NVTHpmZ09E1xbIr_QxqA1Ur8bsVUxkiFdpvDs=)\n\n\nRemember that creating a roadmap is not just a one-time task but an ongoing process that requires constant evaluation and adjustment as circumstances change over time.\n\n\nReady to find your next favorite roadmap template creating tool?\n\n\n## 5 Best Tools to Create Roadmap Templates for 2024\n\n\n### ① AFFiNE\n\n\n\n![1aXY6hQfxVa_4PNZd9mUVIIU7pvXfkqzcszKucRqfu8=](/blobs/1aXY6hQfxVa_4PNZd9mUVIIU7pvXfkqzcszKucRqfu8=)\n\n\n[AFFiNE](https://affine.pro/) is an innovative and comprehensive task management software designed to help you organize, manage, and collaborate on tasks, projects, and information, as well as [streamline your workflow](https://affine.pro/blog/best-free-task-management-software-streamline-workflow). As a next-generation knowledge base, AFFiNE combines the best features of popular apps like Notion and Miro into one powerful, flexible, and user-friendly platform. It focuses on data security, privacy, and collaboration, making it the perfect choice for managing your daily plans, personal knowledge repository, and team projects.\n\n\nKey features:\n\n\n1.Local-first design: AFFiNE prioritizes data security and privacy, ensuring your data remains stored on your local device unless you actively delete it.\n\n\n* Powerful search functionality: Quickly locate the documents, tags, or actions you want with a modern search app that can handle multiple workspaces and pages.\n\n\n* Time tracking and goal setting: Use AFFiNE’s built-in features to track your time spent on tasks and set goals to improve your productivity.\n\n\n* Open-source: As an open-source app, you can access AFFiNE’s code, allowing for customization and the ability to deploy the server on your own computer or data center. Here are some quick views of what you can do with AFFiNE core features\n\n\n2.Shifting between two modes: You start on the whiteboard, freely connecting and arranging your thoughts, creating a visual representation of your workflow-Best for roadmap creation!\n\n\n* Powerful edgeless mode: Easily create, organize, and track your daily tasks like never before. Say goodbye to complex processes and welcome an unprecedented ease-of-use way.\n\n\n* Multiple tools: Visualize and connect your daily tasks smoothly with better cartoon-style shape, slick pen, and connectors. No constraints. Limited only by your imagination.\n\n\n\n![UtWiPpyoCYEH-hdrAfL1Gcz8n2Lh25RiPZKY7CxTulY=](/blobs/UtWiPpyoCYEH-hdrAfL1Gcz8n2Lh25RiPZKY7CxTulY=)\n\n\n### ② Clickup\n\n\n\n![zI5nBNDlxheO1dJ2peGN9qM8w5zjh512sR2yp14PHSI=](/blobs/zI5nBNDlxheO1dJ2peGN9qM8w5zjh512sR2yp14PHSI=)\n\n\nAll-in-one productivity platform ClickUp helps teams of all sizes and across industries manage projects, create complex roadmap templates, and optimize processes. ClickUp is flexible enough to align with any workflow—no matter what your project style is—no matter if you're a solopreneur or a large-scale enterprise team.\n\n\nKey features:\n\n\n1. Task Creation and Assignment: It's easy to create and assign tasks to multiple team members with ClickUp.\n\n\n1. Effortless Workflow Updates: With ClickUp's intuitive interface, updating workflow details, attaching files, and modifying formatting is easy.  As a result, tasks can be easily customized and collaboration can be seamless.\n\n\n1. Real-time Communication: ClickUp understands the importance of effective team communication. With their in-app chat functionality, you can easily add comments and tag team members, facilitating real-time discussions and updates.\n\n\n### ③ Smartsheet\n\n\n\n![SbxeYpREgWL1QKOQKYtp6UiPlCuxmgk0VxGP-7WY6Yw=](/blobs/SbxeYpREgWL1QKOQKYtp6UiPlCuxmgk0VxGP-7WY6Yw=)\n\n\nSmartsheet is a platform that can scale from a single project to end-to-end work management, connecting businesses on a no-code, cloud-based platform where anyone can create the roadmap templates they need — backed by the control and security IT requires.\n\n\nKey features:\n\n\n1. Collaborative and adaptable: Provide people with a flexible roadmap templates that can adapt to the ever-changing demands of work today, and that can grow with any project or initiative, no matter how big or small.\n\n\n1. Unified and scalable: As Smartsheet connects to your systems of record and your team's productivity apps, it unifies all of the work across your organization on a single platform.\n\n\n1. Secure and user driven: Empower everyone to map out projects, automate workflows, and rapidly build the solutions that deliver on their business needs on an easy-to-use, no-code platform. Securely manage business risks with enterprise-grade security controls.\n\n\n### ④ Miro\n\n\n\n![lRVBlgYnIvnM_4E9Z6mOB-A3SfE1FDgn3v-bo8kP6a0=](/blobs/lRVBlgYnIvnM_4E9Z6mOB-A3SfE1FDgn3v-bo8kP6a0=)\n\n\nWith Miro, distributed teams of any size can dream, design, and build the future together in an online workspace. You can take advantage of a complete set of collaboration capabilities, make cross-functional teamwork effortless, and organize meetings and workshops: use video chat, presentation, sharing, and many other features.\n\n\nKey features:\n\n\n1. Collaborative Whiteboarding: Miro is renowned for its collaborative whiteboarding capabilities. It allows teams to brainstorm, create diagrams, and visually collaborate in real-time on a virtual canvas. Multiple team members can contribute simultaneously, fostering creativity and enhancing collaboration.\n\n\n1. Agile Framework Support: Miro offers dedicated features to support agile methodologies such as Scrum and Kanban. Teams can create agile boards, organize and prioritize tasks, track progress, and visualize workflows.\n\n\n1. Integration Ecosystem: Miro integrates seamlessly with various popular tools and platforms, including Jira, Slack, and Google Drive. This integration ecosystem enhances productivity by centralizing project information and streamlining workflows across multiple applications.\n\n\n\n\n\n### ⑤ Monday.com\n\n\n\n![2rtTUikP6JpyA0JIUzgPszfk55U-qY93Kw-ACopShIA=](/blobs/2rtTUikP6JpyA0JIUzgPszfk55U-qY93Kw-ACopShIA=)\n\n\nMonday.com provides you with all of the no-code building blocks so you can shape your workflows, your way. With Monday.com, you can run every aspect of your work by layering industry-specific products on top of the Work OS. Combine building blocks, like apps and integrations, to customize anything you need to improve the way your business runs.\n\n\ney features:\n\n\n1. Intuitive Project Management: Monday.com provides an intuitive and visual platform for managing projects. Teams can create customizable boards, track tasks, and collaborate seamlessly, promoting transparency and productivity.\n\n\n1. Workflow Automation: Monday.com offers powerful automation capabilities to streamline repetitive tasks and workflows. Users can automate notifications, assignments, and updates, saving time and reducing manual effort.\n\n\n1. Extensive Integrations: Monday.com integrates seamlessly with various popular tools and platforms, such as Slack and Google Drive. This allows teams to centralize information, enhance collaboration, and optimize their workflow by connecting their favorite tools.\n\n\n## Conclusion\n\n\nThroughout this article, we explored what roadmap templates are and discussed different types of roadmaps that can be used depending on your specific needs. We also walked through three simple steps to create an effective roadmap. To make things even easier for you, we shared our top picks for the best free tools to create roadmap templates to plan out in 2024. These tools also provide roadmap templates offering various designs and formats to cater to different preferences and requirements. With a well designed roadmap at your disposal, mastering [project management](https://affine.pro/blog/15-best-free-jira-alternatives-agile-project-management-2023) doesn't have to be overwhelming – it just takes practice.\n\n\nWhile each of the roadmap templates creating tools discussed offers its own unique and appealing features, we supposed that AFFiNE emerges as the ultimate winner, providing a comprehensive and versatile solution for managing daily tasks and goals, catering to a wide range of user requirements.\n\n\nAFFiNE has released its stable version, but we are continuing to build to a more feature-rich and stable build. Come and join us on our journey over on our media platforms.\n\n\n* Official Website: [https://affine.pro/](https://affine.pro/)\n\n\n* GitHub: [https://github.com/toeverything/AFFiNE](https://github.com/toeverything/AFFiNE)\n\n\n* Discord: [https://discord.gg/Arn7TqJBvG](https://discord.gg/Arn7TqJBvG)\n\n\n* Telegram: [https://t.me/affineworkos](https://t.me/affineworkos)\n\n\n",
  "publish": true
}