{
  "title": "The 5 Best Offline Alternatives to Notion",
  "authors": [
    "Jackie Peng"
  ],
  "tags": [
    "Content"
  ],
  "description": "Notion is a cloud-based project management and collaboration tool - this article introduces some of the best offline alternatives you might like to try.",
  "created": 1685059200000,
  "updated": 1685664000000,
  "layout": "blog",
  "id": "u1uW7CjbrT",
  "slug": "5-best-offline-alternatives-to-notion",
  "cover": "/blobs/r9DhZ2hJzhf6caxBDfcCc4Nf4OKNPB0bQwVR0nU3lsw=",
  "md": "---\n\n\ntitle: The 5 Best Offline Alternatives to Notion\n\n\nauthor: Jackie Peng\n\n\ntags: Content\n\n\nslug: 5-best-offline-alternatives-to-notion\n\n\ndescription:  Notion is a cloud-based project management and collaboration tool - this article introduces some of the best offline alternatives you might like to try.\n\n\ncreated: 2023-05-26\n\n\nupdated: 2023-06-02\n\n\nlayout: blog\n\n\npublish: true\n\n\n---\n\n\n\n![r9DhZ2hJzhf6caxBDfcCc4Nf4OKNPB0bQwVR0nU3lsw=](/blobs/r9DhZ2hJzhf6caxBDfcCc4Nf4OKNPB0bQwVR0nU3lsw=)\n\n\n**ðŸŽ‰AFFiNE is now on ProductHunt, support us and leave your feedback here: [https://www.producthunt.com/posts/affine-3](https://www.producthunt.com/posts/affine-3)**\n\n\n\n![uO1ZB4KWJaUGczcj2ij-OuUOEy0qu6eGa08hzMPp6yk=](/blobs/uO1ZB4KWJaUGczcj2ij-OuUOEy0qu6eGa08hzMPp6yk=)\n\n\nNotion has become a go-to productivity and note-taking app for many users. However, its reliance on a constant internet connection may be a drawback for those who need to work offline. To ensure you remain organized and efficient even when offline, we've curated a list of the five best alternatives to Notion. In this article, we'll delve into the key features, pros, and cons of each application, equipping you with the information you need to make an informed decision for your note-taking requirements.\n\n\n**1.AFFiNE**\n\n\n<div style=\"text-align:center;\">\n<iframe width=\"560\" height=\"315\" src=\"https://www.youtube.com/embed/WqOe9HgpsDY?si=PHGuSeRbOT9GxuPO\" title=\"YouTube video player\" frameborder=\"0\" allow=\"accelerometer; autoplay; clipboard-write; encrypted-media; gyroscope; picture-in-picture; web-share\" allowfullscreen></iframe>\n</div>\n\n\nKey Features Introduction: AFFiNE is a free, open-source note-taking app designed as a cost-effective alternative to Notion. It offers a user-friendly experience, emphasizing its free availability and providing features such as local-first and offline support, privacy-focused workspaces, powerful content organization, and seamless collaboration capabilities. With Affine, users enjoy an accessible tool for efficient note-taking and project management without compromising on functionality or convenience.\n\n\n**Pros:**\n\n\n* **Local workspace storage logic:**\n\n\n  * The [beta version](https://affine.pro/download) provides the option for our users to customize the storage path of their data. Now our users can get full control over where and how they are able to store their own data in the workspace setting.\n\n\n\n![li0gGIVGrQi2wEiCulDV9_bL40QXYOcDq9Bmu8KPebc=](/blobs/li0gGIVGrQi2wEiCulDV9_bL40QXYOcDq9Bmu8KPebc=)\n\n\n* Database\n\n\n  * Easily create, organize, and track your daily note like never before. Say goodbye to complex processes and welcome an unprecedented ease-of-use way\n\n\n\n![s1-kYhapEsBPNhy4eDA2SnXKwB_ws6Ke7dGXUqpMjDo=](/blobs/s1-kYhapEsBPNhy4eDA2SnXKwB_ws6Ke7dGXUqpMjDo=)\n\n\n* Powerful Edgeless mode\n\n\n  * Visualize and connect your daily ideas smoothly with better cartoon-style shape, slick pen, and connectors. No constraints. Limited only by your imagination. Ohhh, by the way, images now are supported to upload!! We just make everything easy for you, now you may enjoy your drawing time!\n\n\n  \n![6ANoWk9Wn5mf2IsgS-yy-MRN-cf1iRf4VZfF9ihUAgs=](/blobs/6ANoWk9Wn5mf2IsgS-yy-MRN-cf1iRf4VZfF9ihUAgs=)\n\n\n* Notion/html/markdown import-supported\n\n\n  * Effortlessly import Notion, HTML, or Markdown content into AFFiNE with just a few simple clicks, preserving formatting, and structure, and saving time, enhancing user experience. Say goodbye to the complicated process of manually converting and adjusting content.\n\n\n\n\n\n  \n![Funez4FG6_YYPlgBYoKy3M7F2NJLCtwrE7NplHuuB4Q=](/blobs/Funez4FG6_YYPlgBYoKy3M7F2NJLCtwrE7NplHuuB4Q=)\n\n\n* Featuring an all-page UI update with filter options\n\n\n  * Users can now effortlessly access the all-page, which enables them to conveniently sort previous articles in ascending or descending order, or favourites with the filter function. Enjoy efficient organization, quick access to desired content, and a seamless browsing experience.\n\n\n\n![1g2H5Hhy5gspGUGP2LnD5e2O2dyKzVpE-6rvabbR5oA=](/blobs/1g2H5Hhy5gspGUGP2LnD5e2O2dyKzVpE-6rvabbR5oA=)\n\n\n**Cons:**\n\n\n* AFFiNE may not have as many features or integrations as some other productivity tools.\n\n\n* Some users may prefer a cloud-first approach instead of the local-first approach offered by AFFiNE.\n\n\nIf you wanna know more about what you can do with the use of AFFiNE, can read:\n\n\n* Come and check with our latestÂ [beta version](https://affine.pro/blog/whats-new-affine-0518), enjoy your creative moments.\n\n\n* [5 Best Free Daily Planner Apps for 2023 (Features, Price) | AFFiNE â€” All In One KnowledgeOS](https://affine.pro/blog/5-best-free-daily-planner-apps-for-2023)\n\n\n* For more things related to AFFiNE, Come and check out our website:Â [AFFiNE â€” All In One KnowledgeOS](https://affine.pro/)\n\n\n* Wanna try it online:Â [https://app.affine.pro/](https://app.affine.pro/)\n\n\n**2.Microsoft OneNote**\n\n\n\n![YwrguKxoU9VvTBtoRzC8UlsdFBaAlqR8of8KpsNSw-o=](/blobs/YwrguKxoU9VvTBtoRzC8UlsdFBaAlqR8of8KpsNSw-o=)\n\n\nKey Features Introduction:Microsoft OneNote is a versatile note-taking application that offers hierarchical organization of notes into notebooks, sections, and pages, rich-text formatting, multimedia attachments, audio recording, and seamless synchronization across devices.\n\n\n**Pros:**\n\n\n* Free and available on multiple platforms, providing accessibility to users\n\n\n* Seamless integration with Microsoft Office Suite, enhancing productivity\n\n\n* Offline access to notebooks, allowing users to work without an internet connection\n\n\n* Supports collaboration, making it ideal for team projects and group work\n\n\n**Cons:**\n\n\n* Can be resource-intensive, potentially affecting performance on lower-end devices\n\n\n* Limited customization options, which may be limiting for users seeking a personalized experience\n\n\n* Lack of Markdown support, which may be a downside for developers and tech-savvy users\n\n\n**3.Evernote**\n\n\n\n![hFs6PfMFwSE9CmOMAPYubvceoC3Nz3IvRjJYlvLTjRE=](/blobs/hFs6PfMFwSE9CmOMAPYubvceoC3Nz3IvRjJYlvLTjRE=)\n\n\nKey Features Introduction:Evernote is a powerful note-taking app that provides notebooks and tags for organization, rich-text formatting, multimedia attachments, document scanning, offline access to notes (Premium feature), web clipping, and email forwarding.\n\n\n**Pros:**\n\n\n* Cross-platform compatibility, ensuring a consistent experience across devices\n\n\n* Powerful search capabilities, enabling users to locate information quickly\n\n\n* Integrations with third-party apps, allowing for a seamless workflow\n\n\n**Cons:**\n\n\n* Offline access only available for Premium subscribers, limiting accessibility for free users\n\n\n* Limited free version with restrictions on uploads and device syncing, which can be constraining\n\n\n* Can become sluggish with large notebooks, potentially affecting the user experience\n\n\n**4.Joplin**\n\n\n\n![UHk83BGY0kkQ9okPlPxtw9gXzlBsSAdSdhZn6FNqXDs=](/blobs/UHk83BGY0kkQ9okPlPxtw9gXzlBsSAdSdhZn6FNqXDs=)\n\n\nKey Features Introduction:Joplin is an open-source, privacy-focused note-taking app that supports Markdown, offers notebooks and tags for organization, end-to-end encryption, and synchronization with various cloud services.\n\n\n**Pros:**\n\n\n* Free and open-source, providing transparency and affordability\n\n\n* Privacy-focused and customizable, ensuring data security and control over the app's appearance\n\n\n* Markdown support, catering to developers and users who prefer this formatting style\n\n\n**Cons:**\n\n\n* Lacks a built-in WYSIWYG editor, which may be inconvenient for users who prefer this editing style\n\n\n* Limited collaboration features, making it less suitable for team projects and group work\n\n\n* May require technical expertise for advanced customization, which may not suit non-technical users\n\n\n**5.Zoho Notebook**\n\n\n\n![7bLO7UEbBzf59NU7yj4LVI7whZyrH4zG-mpOVL2Hhso=](/blobs/7bLO7UEbBzf59NU7yj4LVI7whZyrH4zG-mpOVL2Hhso=)\n\n\nKey Features Introduction:Zoho Notebook is a visually appealing note-taking app that features color-coded notebooks, rich-text formatting, multimedia attachments, offline access to notes, and synchronization across devices.\n\n\n**Pros:**\n\n\n* Free and user-friendly, providing an accessible experience for all users\n\n\n* Visually appealing design, enhancing the overall user experience\n\n\n* Integrations with other Zoho services, facilitating a cohesive workflow\n\n\n**Cons:**\n\n\n* Limited collaboration features, making it less ideal for group projects and teamwork\n\n\n* Less robust search functionality compared to competitors, which may hinder information retrieval\n\n\n* May not be suitable for heavy-duty users, due to its more simplistic feature set\n\n\n\n---\n\n\nAFFiNE is still in beta, but we are continuing to build to a more feature-rich and stable build. Come and join us on our journey over on our media platforms.\n\n\n* Official Website:Â [https://affine.pro/](https://affine.pro/)\n\n\n* GitHub:Â [https://github.com/toeverything/AFFiNE](https://github.com/toeverything/AFFiNE)\n\n\n* Discord:Â [https://discord.gg/Arn7TqJBvG](https://discord.gg/Arn7TqJBvG)\n\n\n* Telegram:Â [https://t.me/affineworkos](https://t.me/affineworkos)\n\n\n* [5 Best Free Daily Planner Apps for 2023 (Features, Price) | AFFiNE â€” All In One KnowledgeOS](https://affine.pro/blog/5-best-free-daily-planner-apps-for-2023)\n\n\n",
  "publish": true
}