{
  "title": "Upgrade Your Note-Taking Game with These 6 Free Customizable OneNote Alternative Templates in 2023",
  "authors": [
    "Yanxi Liu"
  ],
  "tags": [
    "Content"
  ],
  "description": "Are you tired of staring at a blank page whenever you open OneNote? Our Free OneNote Templates 2023 are here to save the day!",
  "created": 1687910400000,
  "updated": 1687910400000,
  "layout": "blog",
  "id": "uQQhkFcLm_",
  "slug": "6-free-cusomizable-onenote-alternative-templates-2023",
  "cover": "https://insider.affine.pro/api/workspaces/H6vffRmJbCfA-r3kq_36_/blobs/WAaV6lKGuv9esOtGiKK3SsJMg0iTpq1iV4ALxlNcdmM=.webp",
  "md": "---\n\ntitle: \"Upgrade Your Note-Taking Game with These 6 Free Customizable OneNote Alternative Templates in 2023\"\n\nauthor: Yanxi Liu\n\ntags: Content\n\nslug: 6-free-cusomizable-onenote-alternative-templates-2023\n\ndescription: Are you tired of staring at a blank page whenever you open OneNote? Our Free OneNote Templates 2023 are here to save the day!\n\ncreated: 2023-06-28\n\nupdated: 2023-06-28\n\nlayout: blog\n\npublish: true\n\n---\n\n\n![WAaV6lKGuv9esOtGiKK3SsJMg0iTpq1iV4ALxlNcdmM=](https://insider.affine.pro/api/workspaces/H6vffRmJbCfA-r3kq_36_/blobs/WAaV6lKGuv9esOtGiKK3SsJMg0iTpq1iV4ALxlNcdmM=)\n\nFrom project planning to meeting notes, our templates will help you stay organized and on top of your game. So why is waste time creating templates from scratch when you can create your customized templates freely on AFFiNE? Get started now and take the first step towards a more productive trip!\n\n## What is the OneNote Templates\n\n\n![rBVy3Qo2GcoNWST1UrNPjfSwIzDkSCZOgDVb7CnDNdI=](https://insider.affine.pro/api/workspaces/H6vffRmJbCfA-r3kq_36_/blobs/rBVy3Qo2GcoNWST1UrNPjfSwIzDkSCZOgDVb7CnDNdI=)\n\nOneNote templates are a preformatted OneNote page or default Notebook section that serves as a starting point for your notes, saving you time and effort in setting up the layout and design of a new page. These ready-made templates provide a structured framework that helps you maintain consistency and organization across your notebooks.\n\n**Benefits of using OneNote Template**s\n\n1. Time-saving: OneNote templates provide a preformatted starting point for your notes, saving you time and effort in setting up the layout and design of a new page.\n1. Consistency: Ready-made templates provide a structured framework that helps you maintain consistency and organization across your notebooks.\n1. Variety: OneNote templates cater to different needs and purposes with a variety of designs and styles, so you should always find the perfect template for your use case.\nExploring the Different Types of OneNote Templates\n\nThere are several types of OneNote templates, including academic, business, personal, productivity, and travel templates. Each type caters to different needs and purposes with a variety of designs and styles, so you should always find the perfect template for your use case.\n\n1. Academic templates: These templates are designed specifically for students and educators, with features like class schedules, lecture notes, and study guides.\n1. Business templates: These templates are ideal for professionals, with features like meeting notes, project plans, and expense reports.\n1. Personal templates: These templates are perfect for personal use, with features like to-do lists, travel itineraries, and fitness trackers.\n1. Productivity templates: These templates are focused on boosting productivity, with features like goal tracking, habit trackers, and time management tools.\n1. Travel templates: These templates are perfect for travelers, with features like packing lists, itinerary planners, and travel journals.\nWhere to Download OneNote Templates\n\nAllow us to simplify your search by presenting you with seven top websites that offer a diverse range of free OneNote templates for download. These templates can help enhance your productivity and organization.\n\n### **[Calendarlabs](https://www.calendarlabs.com/)**\n\n\n![OOLaeljWnS-Noti4U7vG-BkTYrTfZYdJNpDRtbPQ3KQ=](https://insider.affine.pro/api/workspaces/H6vffRmJbCfA-r3kq_36_/blobs/OOLaeljWnS-Noti4U7vG-BkTYrTfZYdJNpDRtbPQ3KQ=)\n\nMake sure to mark your calendar and get ready for a more organized life with Calendarlabs. Their wide range of OneNote templates provides a smooth and effortless way to incorporate calendars, planners, and event trackers into your digital notebooks.\n\n### **[Notegram](https://notegram.azurewebsites.net/)**\n\n\n![9bm2zlN_ypL1RvE8M-asrVKZZGEJh5448hl0D4DPg1s=](https://insider.affine.pro/api/workspaces/H6vffRmJbCfA-r3kq_36_/blobs/9bm2zlN_ypL1RvE8M-asrVKZZGEJh5448hl0D4DPg1s=)\n\nWith Notegram, you can easily save template files using your Microsoft account. To do so, just log in to Notegram using your Microsoft account, choose the template you want, and click on the Save button. The template will then be added to your default notebook section for easy access.\n\n### **[The Better Grind](https://www.thebettergrind.com/)**\n\n\n![V2DZm7p0niqAt_YeMDxDQvEtwL6v38hc1WOPi6Sh2Es=](https://insider.affine.pro/api/workspaces/H6vffRmJbCfA-r3kq_36_/blobs/V2DZm7p0niqAt_YeMDxDQvEtwL6v38hc1WOPi6Sh2Es=)\n\nExplore a wealth of OneNote templates that can help increase your productivity on The Better Grind website. Their meticulously curated collection of free templates is tailored to streamline your daily routine and improve your work-life balance.\n\n**Limitations of OneNote Templates**\n\nHowever, despite their benefits, OneNote templates also have their limitations. Here are some of the most notable limitations to consider before using them.\n\n1. Limited customization: While OneNote templates are customizable, they may not meet all of your specific needs. You may need to modify the template further to suit your unique use case.\n1. Limited availability: While many OneNote templates are available, there may not be a template that fits your specific needs. In that case, you may need to create a custom template from scratch.\n1. Limited usability: Some OneNote templates may be difficult to use or require a steep learning curve, which may discourage some users from using them.\n1. Limited access: OneNote templates may not be accessible to all users, particularly those who do not have a Microsoft account or access to OneNote.\n## Top 5 alternative OneNote templates you should try on AFFiNE:****\n\nIf you're looking for [alternative OneNote](https://affine.pro/blog/top-6-onenote-alternatives-features-pricing) template apps, you might want to consider AFFiNE.\n\n\n![noMdtrK1-xLDD6DpcwrfAoEpE2FeoGN3wxppqhqYbHY=](https://insider.affine.pro/api/workspaces/H6vffRmJbCfA-r3kq_36_/blobs/noMdtrK1-xLDD6DpcwrfAoEpE2FeoGN3wxppqhqYbHY=)\n\n\n![kuEf4F6avCaCcEEbJMkIcwDzcWsZpyvesS22SL5qClk=](https://insider.affine.pro/api/workspaces/H6vffRmJbCfA-r3kq_36_/blobs/kuEf4F6avCaCcEEbJMkIcwDzcWsZpyvesS22SL5qClk=)\n\n[AFFiNE](https://affine.pro/) is a next-gen knowledge base that brings planning, sorting, and creating all together in the [workspace](https://affine.pro/blog/best-5-google-workspace-alternatives-features-price). It offers a range of powerful features that enhance productivity, with its fantastic whiteboard being a standout feature.\n\nWhile OneNote is an excellent tool for note-taking, AFFiNE shines as a [comprehensive productivity tool](https://affine.pro/blog/how-to-increase-productivity-in-the-workplace) that could potentially serve your needs better. Whether you need a better app for taking notes or file and calendar management options, pick from this list of 5 free templates to boost your productivity!\n\n### 1.AFFiNE OKR Template\n\n\n![eYCf6-8f6dC-uZXzGAwlfbv92g5jDFK9iZ0_pu8ibZg=](https://insider.affine.pro/api/workspaces/H6vffRmJbCfA-r3kq_36_/blobs/eYCf6-8f6dC-uZXzGAwlfbv92g5jDFK9iZ0_pu8ibZg=)\n\nThe [AFFiNE OKR Template](https://affine.pro/blog/best-free-okr-templates-2023) is perfect for team members to be accountable for their work by tracking progress against specific outcomes with evidence, motivating them to take ownership of their responsibilities and deliver results.\n\nWith a powerful dashboard and progress tracking feature, the AFFiNE page mode will enable users to ensure their goals and outcomes align with the company's overall strategy.\n\n### 2.AFFiNE Standard Operation Procedure Template\n\n\n![A5b_ca3uGBVXBfZipIXHXCgzDmMQkbpNvOgJrj66VeU=](https://insider.affine.pro/api/workspaces/H6vffRmJbCfA-r3kq_36_/blobs/A5b_ca3uGBVXBfZipIXHXCgzDmMQkbpNvOgJrj66VeU=)\n\nThe AFFiNE [Standard Operating Procedure Template](https://affine.pro/blog/how-to-write-sop-step-by-step-guide-5-best-free-tools-templates) is appropriate for any organization or team that wants to document and standardize their processes and procedures.\n\nBy using the AFFiNE strong databse feature, the SOPs templates will provide user with a clear and concise set of instructions for carrying out specific tasks or activities, which can also help them improve efficiency, reduce errors, and ensure consistency.\n\n### 3.AFFiNE To-Do List Template\n\n\n![rGeA1a-JJsiDE_gvHffV5wYtQijbrKeewz4M75g9-RA=](https://insider.affine.pro/api/workspaces/H6vffRmJbCfA-r3kq_36_/blobs/rGeA1a-JJsiDE_gvHffV5wYtQijbrKeewz4M75g9-RA=)\n\nThe AFFiNE To-Do List Template is suitable for anyone who needs to organize and prioritize their tasks and activities. They are particularly useful for individuals who have a lot of tasks to complete and need a simple and effective way to keep track of what needs to be done.\n\n### 4.AFFiNE  Mind Map Whiteboard Template\n\n\n![RrCa5L_OgLVoeOpryP4EdmirwGYYzyfY6Ah6OpxNcdM=](https://insider.affine.pro/api/workspaces/H6vffRmJbCfA-r3kq_36_/blobs/RrCa5L_OgLVoeOpryP4EdmirwGYYzyfY6Ah6OpxNcdM=)\n\nThe [AFFiNE Mind Map Whiteboard Template](https://affine.pro/blog/top-5-mind-maps-examples-and-tools) is perfect for individuals or teams to organize and structure information, ideas, and concepts in a non-linear way. It can be used for brainstorming, project management, decision-making, etc.\n\n### 5.AFFiNE Travel Plan Template\n\n\n![gDmbTnQA4j4W3olXLHr7zE84ZbgSJu3x1hqwDfZg4yg=](https://insider.affine.pro/api/workspaces/H6vffRmJbCfA-r3kq_36_/blobs/gDmbTnQA4j4W3olXLHr7zE84ZbgSJu3x1hqwDfZg4yg=)\n\nThe [AFFiNE Travel Plan Template](https://affine.pro/blog/best-5-free-digital-planner-apps-2023) is best for visualizing your travel ideas smoothly with a cartoon-style shape and a freely customized style. You can upload beautiful images Note down travel tips, and plan for a lovely trip with powerful AFFiNE edgeless mode!\n\n## **Boost Your Productivity With AFFiNE**\n\nAFFiNE offers a powerful and versatile alternative to OneNote templates, addressing various organizational and productivity needs. Whether you’re a student, professional, or simply looking to improve your productivity, AFFiNE’s diverse range of templates can help streamline your workflow, enhance collaboration, and ultimately boost your efficiency.If you want more information, please refer to these links:\n\n* Official Website: [https://affine.pro/](https://affine.pro/)\n* GitHub: [https://github.com/toeverything/AFFiNE](https://github.com/toeverything/AFFiNE)\n* Discord: [https://discord.gg/Arn7TqJBvG](https://discord.gg/Arn7TqJBvG)\n* Telegram: [https://t.me/affineworkos](https://t.me/affineworkos)\n",
  "publish": true
}