{
  "title": "8 Top Best Mindap-Making Software for Project Planning 2024",
  "authors": [
    "Yiyang Zhang"
  ],
  "tags": [
    "Content"
  ],
  "description": "Uncover 8 top best mindmap-making software options for 2023. Find the most agile map-making software for project planning in 2024.",
  "created": 1696896000000,
  "updated": 1704153600000,
  "layout": "blog",
  "id": "skgse5AQGc",
  "slug": "8-top-best-mindmap-making-software-project-planning-2023",
  "cover": "/blobs/RpoNhfr9ZWY3mDKoUI1Xx_0HL07pbhsubjyNa7XJ_CY=",
  "md": "---\n\n\ntitle: 8 Top Best Mindap-Making Software for Project Planning 2024\n\n\nauthor: Yiyang Zhang\n\n\ntags: Content\n\n\nslug: 8-top-best-mindmap-making-software-project-planning-2023\n\n\ndescription: Uncover 8 top best mindmap-making software options for 2023. Find the most agile map-making software for project planning in 2024.\n\n\ncreated: 2023-10-10\n\n\nupdated: 2024-01-02\n\n\nlayout: blog\n\n\npublish: true\n\n\n---\n\n\nAre you tired of struggling with paper mindmaps or complicated software to manage your projects? No need to worry anymore! There is a revolutionary solution in the world of technology that can take your project planning experience to the next level. Mindmap-making software is the answer to all your project planning needs in 2024.\n\n\n\n![RpoNhfr9ZWY3mDKoUI1Xx_0HL07pbhsubjyNa7XJ_CY=](/blobs/RpoNhfr9ZWY3mDKoUI1Xx_0HL07pbhsubjyNa7XJ_CY=)\n\n\nIn this article, we will explore eight top options that can help elevate your project planning game. Let's embark on this journey together and embrace the digital era of mind mapping. Say goodbye to pen and paper and discover the many benefits of advanced software.\n\n\n\n\n\n### What is Mindmap-Making Software?\n\n\nUtilizing mind mapping software enables individuals to effectively arrange and structure information, thoughts, and ideas in a visual format. Through diagrams or maps, this tool visually connects related concepts and aids in improving brainstorming, note-taking, project planning, and problem-solving skills. The software comes in various sizes to cater to different needs and offers additional functions. Mindmap-making software empowers individuals and organizations with the ability to create visually appealing and informative mindmaps for project planning purposes.\n\n\n\n\n\n### What Should You Look for in Mindmap-Making Software?\n\n\n\n![A9z8PH9dO1-MLvrBYj4Esj0yD-qR-f_lytVbSZR7FGM=](/blobs/A9z8PH9dO1-MLvrBYj4Esj0yD-qR-f_lytVbSZR7FGM=)\n\n\nWhen it comes to choosing the right mindmap-making software for your project planning needs, there are a few key factors that you should consider.\n\n\n* **Ease of use**. You want software that is intuitive and user-friendly, allowing you to create mindmaps quickly and efficiently.\n\n\n* **Multiple features**. Does it have all the tools and functionalities that you need? Can it handle complex mapping tasks? Make sure to evaluate these aspects before making a decision.\n\n\n* **Compatibility.** Will the mindmap-making software integrate seamlessly with your existing systems? This can save you time and effort in transferring data between different applications.\n\n\n* **Flexibility in customization options**. Look for software that allows you to personalize your maps according to your specific requirements. Whether it's adding labels or symbols, or adjusting colors and styles, having this level of control over your maps can greatly enhance their effectiveness.\n\n\n* **Support and resources**. Are there tutorials or online forums where users can seek assistance if needed? Having access to reliable support can make a significant difference in using map-making software effectively.\n\n\nBy keeping these factors in mind during your search for mindmap-making software, you'll be better equipped to find one that meets all your project planning needs.\n\n\n\n\n\n### 8 Top Best Mindmap-Making Software for Project Planning 2024\n\n\nWe've put together a list of the top 8 best options that are sure to meet your needs. These software tools not only make it easy to create detailed mindmaps, but they also offer features designed specifically for project planning.\n\n\n##### 1. AFFiNE\n\n\n\n![YH36anE_zJJmOERM6MmnWzXGxmmPz11Ok853_MybLCY=](/blobs/YH36anE_zJJmOERM6MmnWzXGxmmPz11Ok853_MybLCY=)\n\n\n\n\n\nAFFiNE is the next-gen knowledge base for professionals that brings planning, sorting, and creating together. It comes with an edgeless mode and a rich toolbar, whose conversion converts doc files to whiteboard. The data modified by users on the whiteboard can be synchronized after conversion to docs, enabling freer editing and writing. Without switching different tools, you can create mindmaps, flowcharts, and inventory. What sets AFFiNE apart is that it is a free and open-source program that employs offline technology to ensure it is accessible to all users.\n\n\n**Key features:**\n\n\n  * **Mind Maps in Edgeless Mode**: In our Edgeless Mode, mindmaps and flowcharts creation can be a piece of cake. You can also tailor your workflow since we offer shape customization options.Get ready to unlock new levels of productivity and immerse yourself in a seamless and efficient workflow.\n\n\n  \n![q1kRb852K7CyMTlg9CXig9gOklaMKSlob1bGxmyH11k=](/blobs/q1kRb852K7CyMTlg9CXig9gOklaMKSlob1bGxmyH11k=)\n\n\n  \n\n\n  * **Reliable Offline Capability**: We prioritize your privacy and have made the decision to provide offline support for AFFiNE. With offline support, your work is saved on your device, allowing you to make uninterrupted progress even during internet disruptions. This feature enhances productivity and ensures high-quality decision-making.\n\n\n  \n![re72pCW0_OP8yctTXT2gXUXC9J6wLqAh-bLN8IZNjCM=](/blobs/re72pCW0_OP8yctTXT2gXUXC9J6wLqAh-bLN8IZNjCM=)\n\n\n\n\n\n  * **Advanced Collaboration Capability**: AFFiNE Cloud keeps all your data synced in real-time across multiple devices, no matter where you are. It makes collaboration seamless, and its advanced features make teamwork effortless. With AFFiNE Cloud, you can invite friends or colleagues to collaborate in your workspace, and easily share your workspaces with others.\n\n\n\n![geVdzkEXxJy55-tagrtTlTRCSJjFXK03lLprTpvrv5M=](/blobs/geVdzkEXxJy55-tagrtTlTRCSJjFXK03lLprTpvrv5M=)\n\n\n### 2. XMind\n\n\n\n![hq19crCuNvdxL0tb4JJ0nGUDke6FKqLRB23_MOWLaaQ=](/blobs/hq19crCuNvdxL0tb4JJ0nGUDke6FKqLRB23_MOWLaaQ=)\n\n\nXmind is a versatile tool for mind mapping and brainstorming, promoting creativity and productivity. Its capabilities extend to teams working on various projects. It revolutionizes traditional mind mapping by transforming it into a digital and agile format, accessible to all team members and easily presented to management as a reflection of ideas and thought processes.\n\n\n**Key features:**\n\n\n* Rich text styles for partial text within one topic.\n\n\n* Brainstorming templates available for various needs\n\n\n* The equation feature lets you add mathematical and chemical equations\n\n\n**Pros of Xmind:**\n\n\n* Brainstorming mode benefits groups.\n\n\n* Not having to sift through multiple menus.\n\n\n**Cons of Xmind:**\n\n\n* Export options are limited.\n\n\n* Cannot freely position elements.\n\n\n**Pricing**: Start at $39.99 for six months.\n\n\n\n\n\n### 3. Lucidchart\n\n\n\n![2OcBEcPtKFwIN0zpps1Da1Tdj5eYu38C4RfnhzfIno4=](/blobs/2OcBEcPtKFwIN0zpps1Da1Tdj5eYu38C4RfnhzfIno4=)\n\n\nLucidchart is an intelligent diagramming application that empowers teams to clarify complexity, align their insights, and build the future—faster. With its intuitive interface and extensive template library, Lucidchart is a popular choice among professionals. It offers collaboration features and seamless integration with other tools like Google Drive.\n\n\n**Key features:**\n\n\n* Intelligent diagramming\n\n\n* 1,000+ templates\n\n\n* Ability to share outside of Google Doc\n\n\n**Pros of Lucidchart:**\n\n\n* Intuitive user interface\n\n\n* Smooth performance on all tested platforms\n\n\n* Adequate shapes and templates\n\n\n**Cons of Lucidchart:**\n\n\n* No desktop apps\n\n\n* Quite limiting free account\n\n\n* Mobile apps don't have an offline mode\n\n\n**Pricing**: $4.95 per month for basic plan; $9.95 per month for pro plan\n\n\n\n\n\n### 4. Mindly\n\n\n\n![mOiSUvKD60se9ItoWbqQOz5_Cv4j06cRmdQ_Sf-UDUw=](/blobs/mOiSUvKD60se9ItoWbqQOz5_Cv4j06cRmdQ_Sf-UDUw=)\n\n\nMindly software is a valuable tool for brainstorming, sorting, and refining your ideas. With various features such as summary creation, task automation, and process documentation, it provides a comprehensive platform for idea development. Mindly boasts a user-friendly interface that allows for easy navigation on both phone and portrait mode without the need for pinch and zoom.\n\n\n**Key features:**\n\n\n* Option to attach notes, images, or icons to any element\n\n\n* Visual clipboard to reorganize your ideas and map content\n\n\n* Passcode to protect your maps and ideas\n\n\n**Pros of Mindly:**\n\n\n* Create an infinite hierarchy of elements\n\n\n* Supports multiple devices\n\n\n**Cons of Mindly:**\n\n\n* Limited integration options\n\n\n* No task management capabilities\n\n\n**Pricing**: The full version costs $6.99 on iOS, $29.99 on the Mac app store, and $5.49 on Android.\n\n\n\n\n\n### 5. Miro\n\n\n\n![yqGbxR5Lpay-KancTPQDMXE8Kafc0wcJBADdMdtEJtI=](/blobs/yqGbxR5Lpay-KancTPQDMXE8Kafc0wcJBADdMdtEJtI=)\n\n\nMiro embraces more than 1,000 templates, including mind maps, Kanban boards, Gantt charts, product wireframes, research boards, and flowcharts. Miro provides an online collaborative platform where teams can brainstorm ideas, map workflows, and design prototypes all in one place. This versatile tool combines whiteboarding, collaboration, and project management functionalities, taking visual communication to new heights.\n\n\n**Key features:**\n\n\n* Provide real-time collaborative drawing\n\n\n* Built-in comments, video, chat, and seamless communication\n\n\n* Unlimited team workspaces with granular permissions, privacy & sharing controls\n\n\n**Pros of Miro:**\n\n\n* Easy to build smart-looking flowcharts and mind maps\n\n\n* Simple to collaborate with teammates\n\n\n**Cons of Miro:**\n\n\n* Hard to import or export content from time to time\n\n\n* Difficult to navigate large accounts\n\n\n**Pricing**: $8/month per user for starter; $16/month per user for business\n\n\n\n\n\n### 6. Venngage\n\n\n\n![7VE2HOcYb6yiiHC6NVroiR-nwLgDl4nTaYpJA1dlc5A=](/blobs/7VE2HOcYb6yiiHC6NVroiR-nwLgDl4nTaYpJA1dlc5A=)\n\n\nVenngage provides a range of business-to-business templates, which can be used to communicate complex information, both within and outside the organization, without the need for a designer. You can use Venngage to create and organize important visual assets for your organization, such as reports, organizational structure, onboarding guides, research documents, and white papers.\n\n\n**Key features:**\n\n\n* Sync collaboration support.\n\n\n* Mindmaps tracks and auto-layouts that shape mindmaps\n\n\n* Powerful mindmap examples for strategic planning\n\n\n**Pros of Venngage:**\n\n\n* Multiple design solutions for non-designers.\n\n\n* Offer employ of templates\n\n\n**Cons of Venngage:**\n\n\n* Many templates are the same, and difficult to edit for users' purposes.\n\n\n* Clunky and nonintuitive for graphic creation.\n\n\n**Pricing:** Premium: $10/user per month.\n\n\n\n\n\n### 7. MindMeister\n\n\n\n![6mRarQP_bAYAPOzIO14gbeXIJFK7kRFhTJyKyjaG2UQ=](/blobs/6mRarQP_bAYAPOzIO14gbeXIJFK7kRFhTJyKyjaG2UQ=)\n\n\n\n\n\nMindMeister simplifies the process of designing impressive mind maps. As a Trusted Cloud certified service and fully compliant with EU-GDPR regulations, MindMeister guarantees security and privacy. It seamlessly integrates into the Meister Suite, ensuring smooth workflow management from start to finish.\n\n\n**Key features:**\n\n\n* Embrace the essentials of mindmap-making.\n\n\n* Advanced visual mode.\n\n\n* Integrations and embeds function.\n\n\n**Pros of MindMeister:**\n\n\n* Add notes, links, icons, images, or videos to mind maps\n\n\n* Integrate mind maps into project management with MeisterTask\n\n\n**Cons of MindMeister:**\n\n\n* The Free plan has limited features\n\n\n* Can’t create free-flowing maps\n\n\n**Pricing**: A free basic plan is available; Paid plans start at $2.49/user per month.\n\n\n\n\n\n### 8. Trello\n\n\n\n![Z3jWQt-k4TawgNoqiderKlhVGdvXgI8i9X6kheR_pXw=](/blobs/Z3jWQt-k4TawgNoqiderKlhVGdvXgI8i9X6kheR_pXw=)\n\n\nBecause of its focus on project management, Trello is also among the finest communication tools for distributed teams. You can see the large picture of all your projects at once thanks to the Kanban view it employs. If you open the card for a certain project, you can see where it stands. By creating a board for each undertaking, you will be able to do more than ever before.\n\n\n**Key features:**\n\n\n* Support the Kanban board system for organizing tasks.\n\n\n* Customizable lists to represent a stage of a project.\n\n\n* Map view that is available to track location-based tasks.\n\n\n**Pros of Trello:**\n\n\n* Agile collaboration.\n\n\n* Superb notification system.\n\n\n**Cons of Trello:**\n\n\n* Limited advanced features for complex projects.\n\n\n* Over-reliance on third-party integrations.\n\n\n**Pricing**: Standard: $5.00 per user per month\n\n\n\n\n\n### Map out Your Project Planning in 2024\n\n\nTo enhance your project planning efficiency, you may want to consider using mindmap-making software. This will enable you to visually represent tasks, timelines, and resources in an organized manner. There are numerous mindmap-making tools available, each with distinctive features and benefits that can assist with project management. For a user-friendly option with comprehensive task-tracking capabilities, **AFFiNE** is an excellent choice.\n\n\n\n![AGktpsX8erKLUUNNpY-lvQS6tcQn5Pt5qi9VUQhV7gY=](/blobs/AGktpsX8erKLUUNNpY-lvQS6tcQn5Pt5qi9VUQhV7gY=)\n\n\nGet your hands on AFFiNE today! The timing is opportune, and it's never too late to embark on this transformative journey. Commence improving your mindmap-making tasks by using AFFiNE's user-friendly tool. Presently, AFFiNE has launched its Stable Version, with ongoing efforts to develop a more comprehensive and dependable iteration. Join us on our voyage through our social media channels and be part of the experience. Come and join us on our journey over on our media platforms.\n\n\n* Official Website: [https://affine.pro/](https://affine.pro/)\n\n\n* GitHub: [https://github.com/toeverything/AFFiNE](https://github.com/toeverything/AFFiNE)\n\n\n* Discord: [https://discord.gg/Arn7TqJBvG](https://discord.gg/Arn7TqJBvG)\n\n\n* Twitter: [https://twitter.com/AffineOfficial](https://twitter.com/AffineOfficial)\n\n\n\n\n\n### Support Us: Become an Early Access Sponsor for AFFiNE Cloud\n\n\n\n![BXytVyyo5RfdYDrB3IVBUYtvCRKM7sTzEfSmba_L6Eo=](/blobs/BXytVyyo5RfdYDrB3IVBUYtvCRKM7sTzEfSmba_L6Eo=)\n\n\nJoin us as an early access sponsor for the AFFiNE Cloud, and unlock advanced collaboration capabilities while upholding the local-first nature of your data. As a token of our appreciation, **you'll enjoy**:\n\n\n* **Early Access:** Be among the first to experience AFFiNE Cloud's powerful features, including advanced permission settings and control. This exclusive opportunity allows you to shape the future of collaboration.\n\n\n* **One-year Free Pro Plan**: Enjoy a complimentary one-year subscription to the premium AFFiNE Pro Plan, filled with advanced tools designed to enhance your productivity and creativity. This plan provides you with a comprehensive suite of resources to optimize your work.\n\n\n* **Lifetime 50% Discount on Pro Plan**: Benefit from a lasting 50% discount on the Pro Plan for as long as you continue to find value in your subscription. This ongoing discount ensures that you can always access AFFiNE Cloud's premium features at an affordable rate.\n\n\n* **Other details:**\n\n\n  * AFFiNE Cloud enhances collaboration without compromising your data's local-first\n\n\n  * The free plan will remain available and always an option, with ongoing improvements.\n\n\n  * More details: [https://affine.pro/blog/affine-cloud-early-access](https://affine.pro/blog/affine-cloud-early-access)\n\n\n",
  "publish": true
}