{
  "title": "The Advantages and Disadvantages of Email Marketing You Should Know (And How to Get Started)",
  "authors": [
    "Yiyang Zhang"
  ],
  "tags": [
    "Content"
  ],
  "description": "Discover the advantages and disadvantages of email marketing. Prioritize your business with AFFiNE in all respects.",
  "created": 1706486400000,
  "updated": 1706486400000,
  "layout": "blog",
  "id": "RGZBV1V3Y2J08b45rsOT1",
  "slug": "advantages-disadvantages-email-marketing-you-should-know-get-started",
  "cover": "/blobs/y2lTIJiiYAf_POmHQTDKb5nksfwN75-ZyUsRjVHezsQ=",
  "md": "---\n\n\ntitle: \"The Advantages and Disadvantages of Email Marketing You Should Know (And How to Get Started)\"\n\n\nauthor: \"Yiyang Zhang\"\n\n\ntags: Content\n\n\nslug: advantages-disadvantages-email-marketing-you-should-know-get-started\n\n\ndescription: \"Discover the advantages and disadvantages of email marketing. Prioritize your business with AFFiNE in all respects.\"\n\n\ncreated: 2024-01-29\n\n\nupdated: 2024-01-29\n\n\nlayout: blog\n\n\npublish: true\n\n\n---\n\n\n\n![y2lTIJiiYAf_POmHQTDKb5nksfwN75-ZyUsRjVHezsQ=](/blobs/y2lTIJiiYAf_POmHQTDKb5nksfwN75-ZyUsRjVHezsQ=)\n\n\nEver wondered how you can effortlessly captivate your target audience and skyrocket your business growth?\n\n\nCurious about the game-changing [strategy](https://affine.pro/blog/11-free-customizable-weekly-schedule-planner-templates-2023) that holds the key?\n\n\nThe answer lies in email marketing! Ready to unlock the secrets of connecting directly and intimately with a multitude of people simultaneously? Brace yourself as we delve into the unparalleled benefits and potential pitfalls of email marketing. Are you prepared to make an informed decision that could reshape the destiny of your business? Let's embark on this journey together!\n\n\n# What is Email Marketing?\n\n\nEmail marketing is a powerful [digital](https://affine.pro/blog/8-free-project-tracker-templates-work-management-2023) marketing strategy that involves sending commercial messages to a group of people via email. It allows businesses to reach out to their customers, prospects, or leads in a personalized and targeted manner, resulting in better engagement and conversion rates.\n\nWith email marketing, businesses can create and send newsletters, promotional offers, updates, event invitations, and more. These messages can be tailored to the specific interests and needs of the recipients, making them more likely to engage with the content and [take action](https://affine.pro/blog/top-10-best-agile-project-scheduling-software-2023).\n\nOverall, email marketing is a valuable tool for businesses looking to build relationships with their customers, generate leads, and drive sales.\n\n\n# Advantages of Email Marketing\n\n\n\n![PdyL5jSjhhgj1pQ_nJd7DYW3ninPlElybC8tetma5ac=](/blobs/PdyL5jSjhhgj1pQ_nJd7DYW3ninPlElybC8tetma5ac=)\n\n\n* **Wide Reach:**\n\n\n  * One of the biggest advantages of email marketing is its ability to reach a wide audience.\n\n\n  * With billions of people using email every day, you have the potential to connect with customers all over the world.\n\n\n* **Cost-Effective:**\n\n\n  * Compared to traditional advertising methods, email marketing is incredibly cost-effective.\n\n\n  * There are no printing or postage costs involved, and you can easily track your ROI through analytics.\n\n\n* **Targeted Messaging:**\n\n\n  * Unlike other forms of advertising, email allows you to segment your audience.\n\n\n  * Send personalized messages based on their preferences and behaviors, creating a more tailored and relevant experience for each recipient.\n\n\n* **Increased Conversion Rates:**\n\n\n  * Studies have shown that email marketing has higher conversion rates compared to social media or search engine advertising.\n\n\n  * By nurturing leads through targeted [campaigns](https://affine.pro/blog/15-types-events-event-management-categories-examples), you can guide them toward making a purchase decision.\n\n\nIn conclusion, email marketing offers numerous advantages for businesses looking to expand their reach and engage with customers effectively.\n\n\n# Disadvantages of Email Marketing\n\n\nWhile email marketing has its fair share of advantages, it's important to acknowledge the potential drawbacks that come along with this [strategy](https://affine.pro/blog/10-best-Memorizing-techniques-tools-upgrade-your-memory).\n\n\n\n![P0WvV6HMc_o5KbyW2hNiNWdZKuEy-JFPYARAlQPCMMA=](/blobs/P0WvV6HMc_o5KbyW2hNiNWdZKuEy-JFPYARAlQPCMMA=)\n\n\n* **The risk of being marked as spam:**\n\n\n  * With overflowing inboxes and people becoming increasingly wary of unsolicited emails, your carefully crafted message might end up getting filtered out or deleted without even being opened.\n\n\n  * This can lead to a significant decrease in your open rates and engagement levels.\n\n\n* **Diverse audience interests:**\n\n\n  * Not everyone on your email list will be interested in every message you send, despite segmenting your audience and targeting specific groups.\n\n\n  * There will always be recipients who simply aren't interested in what you have to offer at that particular time, resulting in lower click-through rates and conversions.\n\n\n* **Consistent effort and resources:**\n\n\n  * Maintaining an effective email marketing campaign requires consistent effort and resources.\n\n\n  * From creating compelling content to monitoring analytics and managing subscriber lists, it can be quite time-consuming for [businesses](https://affine.pro/blog/how-to-introduce-new-business-social-media-strategic-steps-examples) with limited marketing teams or budgets.\n\n\n* **Unsubscribing due to overwhelm or irrelevance:**\n\n\n  * Some individuals may choose to unsubscribe from your emails altogether if they feel overwhelmed by the frequency or find them irrelevant.\n\n\n  * Losing subscribers means losing potential customers or leads for future sales opportunities.\n\n\nWhile email marketing can yield impressive results when executed properly, it's essential to consider these disadvantages before diving headfirst into a campaign. By understanding both the advantages and disadvantages associated with this strategy, businesses can make informed decisions about whether email marketing aligns with their goals and resources.\n\n\n\n\n\n# How to Get Started with Email Marketing\n\n\n\n![_cj1pDSxzwTwqqgLkx-d77hFJSBskfl0_qntj-FtUWM=](/blobs/_cj1pDSxzwTwqqgLkx-d77hFJSBskfl0_qntj-FtUWM=)\n\n\n**Step 1: Define Your Goals and Audience**\n\n\n* Clearly outline your objectives for email marketing. Whether it's promoting products, building brand awareness, or driving sales, having well-defined goals will guide your strategy. Identify your target audience to tailor your messages effectively.\n\n\n**Step 2: Choose an Email Marketing Platform**\n\n\n* Select a reliable email marketing platform that suits your needs. Platforms like Mailchimp, Constant Contact, or Sendinblue offer user-friendly interfaces, customizable templates, and analytics tools. Sign up, create an account, and explore the platform's features.\n\n\n**Step 3: Build and Organize Your Email List**\n\n\n* Start building your email list by collecting contacts from your website, social media, or other touchpoints. Segment your list based on demographics or preferences to send targeted and relevant content. Ensure compliance with email marketing regulations, such as obtaining consent and providing opt-out options.\n\n\n**Step 4: Design Engaging Email Campaigns**\n\n\n* Create visually appealing and engaging email campaigns. Use the platform's templates or customize your designs to align with your brand. Craft compelling subject lines and content that encourage opens and clicks. Test different elements to optimize performance.\n\n\n**Step 5: Analyze and Iterate**\n\n\n* After sending your campaigns, analyze key metrics like open rates, click-through rates, and conversion rates. Use this data to understand your audience's preferences and refine your future campaigns. Continuously iterate and experiment to improve the effectiveness of your email marketing strategy.\n\n\n# Email Marketing FAQs\n\n\nNow that we have explored the advantages and disadvantages of email marketing, let's address some common questions about this powerful marketing tool.\n\n\n\n![fR19qfL76fnqy_sM3L00iyWZlFFTaqi5f4-Hd9UvFzs=](/blobs/fR19qfL76fnqy_sM3L00iyWZlFFTaqi5f4-Hd9UvFzs=)\n\n\n#### Is email marketing still effective in today's digital landscape?\n\n\nAbsolutely! Despite the rise of social media and other communication channels, email remains a highly effective way to reach your target audience. With careful planning and [strategic](https://affine.pro/blog/how-to-build-go-to-market-strategy-free-templates) targeting, you can create personalized and engaging emails that resonate with your subscribers.\n\n\n#### What is an ideal open rate for email campaigns?\n\n\nThe average open rate for email campaigns across industries is around 20%. However, it's important to benchmark against similar companies within your industry as benchmarks vary widely. Focus on continuously improving your open rates by crafting compelling subject lines, optimizing send times, and segmenting your lists based on subscriber preferences.\n\n\n#### How can I increase engagement with my emails?\n\n\nTo boost engagement with your emails, consider personalizing content based on recipient data such as demographics or past purchase behavior. Additionally, ensure that your emails are mobile-responsive since a majority of people now access their inboxes from smartphones or tablets.\n\n\n#### How can I measure the success of my email campaigns?\n\n\nTrack key metrics like open rates, click-through rates (CTR), conversion rates, unsubscribe rates, and overall ROI (Return On Investment). By analyzing these metrics over time, you can gain insights into the effectiveness of your campaigns and make data-driven improvements.\n\n\n# Upgrade Your Email Marketing by Using **[AFFiNE](https://affine.pro/)!**\n\n\n\n![5VZZiy69UNGfpn8KOwMVuvVmBr6icqfRjmd42C36r9g=](/blobs/5VZZiy69UNGfpn8KOwMVuvVmBr6icqfRjmd42C36r9g=)\n\n\nAFFiNE is a versatile editor that lets you write, draw, [plan](https://affine.pro/blog/how-to-make-work-plan-step-by-step-guide), and present all in one place. Easily capture detailed information about your new business using the page mode, allowing for straightforward document editing. Efficiently organize your projects by using a database to keep track of deadlines, assign responsibilities, and effortlessly monitor project progress. Take advantage of AFFiNE's powerful [whiteboard](https://affine.pro/blog/best-free-whiteboard-layout-ideas-organization) feature to brainstorm ideas with your team. Moreover, craft visually appealing posters about your business for seamless publication and display on different social media platforms. AFFiNE offers a user-friendly platform for comprehensive business management and seamless team collaboration.\n\n\n**Key features:**\n\n\n* **Tailored Marketing Precision with AFFiNE's Database:** Employ AFFiNE's database functionality to keep track of email [marketing](https://affine.pro/blog/the-7-key-stages-marketing-sales-pipeline-visual-guide) metrics and campaign performance. Monitor open rates, click-through rates, and other key analytics to refine your future email strategies. AFFiNE's database seamlessly integrates Kanban and Table views for dynamic scheduling. Kanban view allows intuitive drag-and-drop functionality, ensuring precise organization and alignment of your project execution. Switching to the Table view offers a comprehensive project overview, enhancing the efficiency of your narrative development.\n\n\n\n![bY0EkoVLJfBpOjymBoGUxE0LAiQuW1bNgYA-FU1OQlA=](/blobs/bY0EkoVLJfBpOjymBoGUxE0LAiQuW1bNgYA-FU1OQlA=)\n\n\n* **Content Creation & Visual Brainstorming:** Use AFFiNE to design visually appealing posters for email promotions. Create eye-catching visuals that can be embedded within your emails to highlight special offers, product launches, or events. Boasting essential features like a plethora of colors, [diverse font options](https://affine.pro/blog/docs-edgeless-stylized-embody-your-creativity-better-and-easier), shapes, and connectors, this powerful tool is designed to elevate your creative process. Transform your ideas into compelling business posters with unparalleled ease and versatility!\n\n\n\n![cXPfaH7yGKuxN6x24MrIF_2SxJEMnAdSfT2q9HhQpD4=](/blobs/cXPfaH7yGKuxN6x24MrIF_2SxJEMnAdSfT2q9HhQpD4=)\n\n\n* **Collaborative Editing:** Foster collaboration among team members by using AFFiNE's collaborative editing tools, and foster collaboration among team members. Multiple team members can work on email content simultaneously, ensuring a seamless and efficient content creation [process](https://affine.pro/blog/top-10-best-process-mapping-tools-software-2023-free-paid). Share files, exchange ideas, and provide feedback in real time through AFFiNE. With AFFiNE, everyone can contribute to the same set of notes in real time.\n\n\n\n![O88V12dZ7eALpdMD8-6eyyfRec5yZyWiQxCnvNEb3r0=](/blobs/O88V12dZ7eALpdMD8-6eyyfRec5yZyWiQxCnvNEb3r0=)\n\n\nUpgrade your email marketing, embrace the power of AFFiNE, and witness the transformative impact on your marketing abilities. Now that you have learned about the advantages and disadvantages of email marketing, it's time to put your knowledge into action. And what better way to do that than with **AFFiNE**? Commence your marketing by using AFFiNE's user-friendly tool. Presently, **AFFiNE** has launched its [**Stable Version**](https://affine.pro/download), with ongoing efforts to develop a more comprehensive and dependable iteration. Join us on our voyage through our social media channels and be part of the experience. **Come and join us on our journey over on our media platforms. 🚀**\n\n\n* Official Website:[https://affine.pro/](https://affine.pro/)\n\n\n* GitHub:[https://github.com/toeverything/AFFiNE](https://github.com/toeverything/AFFiNE)\n\n\n* Discord:[https://discord.gg/Arn7TqJBvG](https://discord.gg/Arn7TqJBvG)\n\n\n* Twitter:[https://twitter.com/AffineOfficial](https://twitter.com/AffineOfficial)\n\n\n\n\n\n",
  "publish": true
}