{
  "title": "AFFiNE 0.10.0 - Launch week - Day 1/5: An Lightening Up Visual Experience",
  "authors": [
    "Yuhang Zhao",
    "Yanxin Lu"
  ],
  "tags": [
    "Release Note"
  ],
  "description": "Explore AFFiNE 0.10.0: Elevating User-Friendliness with Enhanced Visuals and Flexible Document Management. Discover improved icons, a revamped toolbar, enhanced shapes, connector customization, and the new All Pages feature for a more user-friendly digital experience.",
  "created": 1699056000000,
  "updated": 1699228800000,
  "layout": "blog",
  "id": "MwZ_jdgxn21NHn_hJL7kH",
  "slug": "affine-0-10-0-launch-week-day-1-lightening-up-visual-experience",
  "cover": "/blobs/Wvrf1UxtXV4F0fJwu1HhUlVLBB0HUR4OuQ1CxAkcZ5w=",
  "md": "---\n\n\ntitle: \"AFFiNE 0.10.0 - Launch week - Day 1/5: An Lightening Up Visual Experience\"\n\n\nauthor: \"Yuhang Zhao, Yanxin Lu\"\n\n\ntags: Release Note\n\n\nslug: affine-0-10-0-launch-week-day-1-lightening-up-visual-experience\n\n\ndescription: \"Explore AFFiNE 0.10.0: Elevating User-Friendliness with Enhanced Visuals and Flexible Document Management. Discover improved icons, a revamped toolbar, enhanced shapes, connector customization, and the new All Pages feature for a more user-friendly digital experience.\"\n\n\ncreated: 2023-11-04\n\n\nupdated: 2023-11-06\n\n\nlayout: blog\n\n\npublish: true\n\n\n---\n\n\n\n![Wvrf1UxtXV4F0fJwu1HhUlVLBB0HUR4OuQ1CxAkcZ5w=](/blobs/Wvrf1UxtXV4F0fJwu1HhUlVLBB0HUR4OuQ1CxAkcZ5w=)\n\n\nWelcome to AFFiNE 0.10.0's launch week, where we're excited to unveil a series of **UI/UX improvements** that will transform your digital experience. Our focus has been on enhancing every aspect of usability, from **the** **vibrant new look in light mode** to **the innovative design of the toolbar for our whiteboard**. With an all-encompassing approach, we've combined features and streamlined interactions to provide a more user-friendly and efficient platform. Let's explore how AFFiNE's latest update makes digital tasks smoother and more enjoyable.\n\n\n# **Unveiling a New Palette: From Deep to Light Tones!**\n\n\nAre you ready to engage with our vibrant new look? Explore the refreshing transformation of our visual identity as we embrace a shift from rich, **deep hues to bright, light tones**, bringing an overall uplift to our design ethos. This shift extends beyond our app icon, weaving through the homepage and our client interfaces, marrying professionalism with a modern aesthetic for a fresh, contemporary look. This stylish change reduces visual distractions, ensuring that our brand is **easily recognized** and **accessible on different devices and environments**, and allowing you to concentrate on your core note-taking tasks.\n\n\n\n![hhlG01W4mXrYfSNYTNlT69ERrkTs4gECjIk4-knJxuY=](/blobs/hhlG01W4mXrYfSNYTNlT69ERrkTs4gECjIk4-knJxuY=)\n\n\n# **Tool Bar Aesthetic Enhancement for Whiteboard: Revamped Look**\n\n\n### 1. **The New Approach to Interacting With Selection and Hand Tool**\n\n\nTired of toggling between selection and hand tools on a whiteboard? AFFiNE 0.10.0 streamlines the process by **merging these icons** and enabling **spacebar interaction in edgeless mode**. This simplifies tool switching, promoting smoother drag-and-drop actions. Focus on creativity, not complex tool operations, and enjoy a seamless creation experience.\n\n\n\n![eC-Udv3gMaQ-23fQxwDtCCDqJKDBqkcLOyT85Qcs6oQ=](/blobs/eC-Udv3gMaQ-23fQxwDtCCDqJKDBqkcLOyT85Qcs6oQ=)\n\n\n\n![zjjH88qLk0ESukygj_DLF0orRHra6W_VpRxUuC5HdIw=](/blobs/zjjH88qLk0ESukygj_DLF0orRHra6W_VpRxUuC5HdIw=)\n\n\n\n\n\n### 2. Enhanced Shape Functionality: Drag-and-Drop and Animation Support\n\n\nImagine being able to select a shape directly from the toolbar without the need for multiple clicks and then **seamlessly dragging it onto the whiteboard**. Additionally, we have optimized the visual animations to make the **appearance of shapes smoother**.\n\n\n\n![ILUYZFG-7I0c0gjd5lXksnS1oTvE73LkHCKJosv7sYI=](/blobs/ILUYZFG-7I0c0gjd5lXksnS1oTvE73LkHCKJosv7sYI=)\n\n\n\n\n\n### 3. Innovative Connector Design: The Beauty of Wavy Lines and Customization\n\n\nAre you tired of the same old straight and zigzag connectors? Our latest addition, **the wavy connector,** brings a touch of elegance and fluidity to your creations. We understand that the beauty of details is meant to enhance your AFFiNE experience, making it not only practical but also visually pleasing. Furthermore, we've added new features such as **start and end point styles** and the **flip direction** to provide you with even more **customization options** for your creative journey.\n\n\n\n![gvf7MywWUkKZzq22bzcYKdPJAj1S0lfSjv49Okoeha4=](/blobs/gvf7MywWUkKZzq22bzcYKdPJAj1S0lfSjv49Okoeha4=)\n\n\n\n\n\n# Streamlined Document Organization: All Pages Reimagined\n\n\n### 1. Drag and Drop for Effortless Organization\n\n\nHow many times have you wished for an easier way to manage your documents? Well, your wish has been granted! Our redesigned **All Pages** feature now allows you to **effortlessly drag and drop your documents into the trash or your preferred collections**. Whether you're tidying up or sorting your notes, you can simply drag a document to the trash can or your chosen collection. It's a user-friendly way to **manage your notes**, **saving you time** and providing a **more engaging note-taking experience**.\n\n\n\n![tEW8ksCLWzDhIIuCu5jV6-lkwR1wxfcHnJRz_UrfvA8=](/blobs/tEW8ksCLWzDhIIuCu5jV6-lkwR1wxfcHnJRz_UrfvA8=)\n\n\n### 2. Multi-Selection for Efficient Deletion\n\n\nTired of the hassle of deleting notes one by one? We've got a smarter solution for you! Another game-changing addition to the All Pages feature is multi-selection. Now, you can easily **select multiple documents at once** and execute batch actions, such as **deletion**. With just a few clicks, you can efficiently **clean up your notes**, elevating your overall note-taking experience.\n\n\n\n![D7DwiOYCqwTOd9F398XslSvQm_UOlgB6McdcYkULFKA=](/blobs/D7DwiOYCqwTOd9F398XslSvQm_UOlgB6McdcYkULFKA=)\n\n\n\n\n\nAs you dive into AFFiNE 0.10.0, you're not just witnessing updates; you're embracing **a whole new level of usability**. Our dedication to improving every facet of your experience, from the aesthetics of **App Icons** to the functionality of the **whiteboard toolbar**, is aimed at making your digital journey efficient and enjoyable. With the power of **enhanced visual presentation and flexible document management**, we're here to empower you.\n\n\nAre you ready to redefine how you interact with your digital world? Join us today and experience a more user-friendly and efficient digital workspace.\n\n\n\n\n\n# Get ready to unlock new levels of productivity\n\n\n* Official Website: [https://affine.pro/](https://affine.pro/)\n\n\n* GitHub: [https://github.com/toeverything/AFFiNE](https://github.com/toeverything/AFFiNE)\n\n\n* Twitter: [https://twitter.com/AffineOfficial](https://twitter.com/AffineOfficial)\n\n\n* Communityï¼š[https://community.affine.pro/home](https://community.affine.pro/home)\n\n\n* Discord: [https://discord.gg/Arn7TqJBvG](https://discord.gg/Arn7TqJBvG)\n\n\n* Telegram: [https://t.me/affineworkos](https://t.me/affineworkos)\n\n\n",
  "publish": true
}