{
  "title": "AFFiNE 0.7.0 Preview - Launch week - day 2/5",
  "authors": [
    "Xuan Pang",
    "Jackie Peng"
  ],
  "tags": [
    "Release Note"
  ],
  "description": "Discover the power of AFFiNE, the ultimate alternative to Notion, Miro, and Monday. This article introduces the latest AFFiNE 0.7.0 Preview, unveiling game-changing features for Doc & Text Editing and PDF & PNG Export.",
  "created": 1688947200000,
  "updated": 1689033600000,
  "layout": "blog",
  "id": "n7_RfkqYBk",
  "slug": "affine-070-launch-week-day2",
  "cover": "/blobs/tio605CdAeKqVuaxtFSIv9qkOyD4Jkz6073-hnjtvZM=",
  "md": "---\n\n\ntitle: \"AFFiNE 0.7.0 Preview - Launch week - day 2/5\"\n\n\nauthor: Xuan Pang, Jackie Peng\n\n\ntags: Release Note\n\n\nslug: affine-070-launch-week-day2\n\n\ndescription: \"Discover the power of AFFiNE, the ultimate alternative to Notion, Miro, and Monday. This article introduces the latest AFFiNE 0.7.0 Preview, unveiling game-changing features for Doc & Text Editing and PDF & PNG Export.\"\n\n\ncreated: 2023-07-10\n\n\nupdated: 2023-07-11\n\n\nlayout: blog\n\n\npublish: true\n\n\n---\n\n\n**Welcome to the highly anticipated launch week of AFFiNE 0.7.0 Preview!** We are thrilled to present an array of new features and a redesigned user experience to bring the knowledge closer to you and your collaborators.\n\n\nOn the second day of the AFFiNE 0.7.0 Preview launch week, we will introduce you to the exciting updates, including enhanced Docs & Text editing and the addition of PDF & PNG Export functionality. Get ready to unlock new levels of productivity and immerse yourself in a seamless and efficient workflow.\n\n\n\n![tio605CdAeKqVuaxtFSIv9qkOyD4Jkz6073-hnjtvZM=](/blobs/tio605CdAeKqVuaxtFSIv9qkOyD4Jkz6073-hnjtvZM=)\n\n\n# **Revolutionize Your Document Experience - Docs & Text editing**\n\n\n## ① Bookmark - Quick Access to Related Webpage\n\n\nThe blue hyperlinks, while functional and efficient, have been around for decades and leave much to be desired in terms of aesthetics. Finally, we're excited to offer you the ability to effortlessly transform any link into a bookmark, allowing for substantial improvements in the clarity of information previews and rapid access to your saved web pages.\n\n\n\n![cBxTEQZtUd-B5Q4d6R4YbeFr48t6Np1l2efsPtr_aZE=](/blobs/cBxTEQZtUd-B5Q4d6R4YbeFr48t6Np1l2efsPtr_aZE=)\n\n\n## ② Tags - Enhance Content Organization and Discoverability\n\n\nToo many pages? Now you can tag your content with descriptive labels, making it easier to find and access  whenever you need it.\n\n\n\n![CgxJfxH0NgPs6vyUnGLDNyJXoZf9DNl8NYJwo5TZ25I=](/blobs/CgxJfxH0NgPs6vyUnGLDNyJXoZf9DNl8NYJwo5TZ25I=)\n\n\n## ③ Backlinks - Seamless Connections with Other Pages\n\n\nWe know that navigating from page to page currently takes time, so here is what we offer. Seamless navigation through setup backlinks, and enhances content accessibility.\n\n\n\n![0ZvMGNB3m1GojJ4VU21vNjIAwc9PAg-TsXR1dTJQDcg=](/blobs/0ZvMGNB3m1GojJ4VU21vNjIAwc9PAg-TsXR1dTJQDcg=)\n\n\n# **Effortless Sharing and Versatility - PDF & PNG Export**\n\n\n## ① Export to PDF - Share and Present with Ease\n\n\nNow AFFiNE supports PDF export! It's super handy as it lets you save and share documents more easily.\n\n\n\n![fQqamSP6xdvwVnW2MTSI2BdaUYRsc59K6nZPTYYTkUA=](/blobs/fQqamSP6xdvwVnW2MTSI2BdaUYRsc59K6nZPTYYTkUA=)\n\n\n## ② Export to PNG - Showcase Stunning Visuals\n\n\nWant something easier than sending a pdf? In addition to PDF export, you can simply choose any block on the edgeless, and copy it as a PNG image! Hope it can save you some time on finding another online snapshot(~~meme~~) editing tool.\n\n\n\n![ccRhVoGAC2zki8aOJ_v76BoU1LYytimoNQofens8oJg=](/blobs/ccRhVoGAC2zki8aOJ_v76BoU1LYytimoNQofens8oJg=)\n\n\nRest assured, the AFFiNE 0.7.0 beta will be made available at a very recent date. Stay tuned for the official launch and get ready to experience a seamless and reliable note-taking solution.Get ready to unlock new levels of productivity\n\n\n## Get ready to unlock new levels of productivity\n\n\n* Official Website: [https://affine.pro/](https://affine.pro/)\n\n\n* GitHub: [https://github.com/toeverything/AFFiNE](https://github.com/toeverything/AFFiNE)\n\n\n* Discord: [https://discord.gg/Arn7TqJBvG](https://discord.gg/Arn7TqJBvG)\n\n\n* Telegram: [https://t.me/affineworkos](https://t.me/affineworkos)\n\n\n\n\n\n",
  "publish": true
}