{
  "title": "AFFiNE 0713 V0.0.1-alpha.0.1.0 Release Notes",
  "authors": [
    "Jiachen He",
    "Fangyuan Zheng",
    "Fanjing Zhang"
  ],
  "tags": [
    "Release Note"
  ],
  "description": "Thank you very much for your attention to AFFiNE! Some exciting changes in AFFiNE are as follows",
  "created": 1657670400000,
  "updated": 1657670400000,
  "layout": "blog",
  "id": "630ad1a7bdda4d3a872e428a9d5d88c7",
  "slug": "affine-0713-v0.0.1-alpha.0.1.0-release-notes",
  "cover": "/blobs/JspchPzbMyAw5RLMQCH5uLCCNB4O_zaOzzY6MW2t_ls=",
  "md": "---\n\n\ntitle: AFFiNE 0713 V0.0.1-alpha.0.1.0 Release Notes\n\n\nauthor: Jiachen He, Fangyuan Zheng, Fanjing Zhang\n\n\ntags: Release Note\n\n\nslug: affine-0713-v0.0.1-alpha.0.1.0-release-notes\n\n\ndescription: Thank you very much for your attention to AFFiNE! Some exciting changes in AFFiNE are as follows\n\n\ncreated: 2022-07-13\n\n\nupdated: 2022-07-13\n\n\nlayout: blog\n\n\npublish: true\n\n\n---\n\n\n\n![JspchPzbMyAw5RLMQCH5uLCCNB4O_zaOzzY6MW2t_ls=](/blobs/JspchPzbMyAw5RLMQCH5uLCCNB4O_zaOzzY6MW2t_ls=)\n\n\n**Thank you very much for your attention to AFFiNE! Some exciting changes in AFFiNE are as follows:**\n\n\n### **Bug Fixes**\n\n\nIn our continued effort to make AFFiNE the most reliable all in one knowledge base 展开, fixing bugs is always our main concern. Here's our work in last few days:\n\n\n* Fixed: Covered Popovers when changing global views;\n\n\n* Fixed: Occasionally disappeared placeholder when opening a new page;\n\n\n* Fixed: Incorrect display of the Popover for Settings;\n\n\n* Fixed: Incorrect display of menu icons when changing groups.\n\n\nAFFiNE is currently in the early alpha stage and will be launched in the autumn of 2022.\n\n\nAFFiNE is an open-source project which can be viewed on Github: [https://github.com/toeverything/AFFiNE#readme](https://github.com/toeverything/AFFiNE#readme)\n\n\nIf you endorse this open source project, please help us by clicking the GitHub star, which is crucial for the future development of AFFiNE.\n\n\nAFFiNE is very grateful to all open source contributors and will work to build a more positive open source ecosystem.\n\n\nHope you have a nice time with AFFiNE!\n\n\n",
  "publish": true
}