{
  "title": "AFFiNE Unleashed: Demo Example for Every Professional",
  "authors": [
    "Jackie Peng",
    "Xuan Pang",
    "Yanxi Liu"
  ],
  "tags": [
    "Content"
  ],
  "description": "Explore what you can do with AFFiNE with the current features empowered and Example we refined from daily work.",
  "created": 1690761600000,
  "updated": 1690848000000,
  "layout": "blog",
  "id": "cKqPZqj2di",
  "slug": "affine-demo-templates-for-professional",
  "cover": "https://insider.affine.pro/api/workspaces/H6vffRmJbCfA-r3kq_36_/blobs/PCLco4M8VGHSLj0GN_vjE4nFHuPp3tLvs9MrAL_Mk6M=.webp",
  "md": "---\n\ntitle: \"AFFiNE Unleashed: Demo Example for Every Professional\"\n\nauthor: Jackie Peng, Xuan Pang, Yanxi Liu\n\ntags: Content\n\nslug: affine-demo-templates-for-professional\n\ndescription: Explore what you can do with AFFiNE with the current features empowered and Example we refined from daily work.\n\ncreated: 2023-07-31\n\nupdated: 2023-08-01\n\nlayout: blog\n\npublish: true\n\n---\n\n\n![PCLco4M8VGHSLj0GN_vjE4nFHuPp3tLvs9MrAL_Mk6M=](https://insider.affine.pro/api/workspaces/H6vffRmJbCfA-r3kq_36_/blobs/PCLco4M8VGHSLj0GN_vjE4nFHuPp3tLvs9MrAL_Mk6M=)\n\nWe know that most of our users are coming from different domains with quite diverse backgrounds, including project managers, software engineers, students, and so forth. We are thrilled by the genuine interest you've shown **in our product and are eager to provide** you with more information about what we can offer, and what benefits you can reap from using AFFiNE.\n\nThe article is all about the demo example (you cannot download but only refer to) that were based on and refined from the AFFiNE team's daily routines, project management endeavours, issue tracking, progress monitoring, and goal-setting. Whether you're a project manager, a student, a software engineer, or come from any other background, Here are some of the example that you can refer to and get started for various use cases based on AFFiNE. Check them out!\n\nThough we feel a little bit pity that we can only embody the demo example, but we've been working hard on the buildup of the template ecosystem and encouraging users to unleash their creativity and domain professions on example. Hopefully, this day won't be so late.\n\n## ① AFFiNE's Personal project management\n\n\n![WuKyElFCYptiAMEjieUkllICKRrNDYZNcpBykR-LTCA=](https://insider.affine.pro/api/workspaces/H6vffRmJbCfA-r3kq_36_/blobs/WuKyElFCYptiAMEjieUkllICKRrNDYZNcpBykR-LTCA=)\n\n\n![hIkutdh6nb2sG1Ji93Lb52tYw2tBZBN3TOXQ2WLVwgE=](https://insider.affine.pro/api/workspaces/H6vffRmJbCfA-r3kq_36_/blobs/hIkutdh6nb2sG1Ji93Lb52tYw2tBZBN3TOXQ2WLVwgE=)\n\nWhile AFFiNE continues to undergo active development, with a promising set of features in the pipeline, including Kanban, Gantt graph, and more, its current state already exemplifies a remarkable project management tool. This hyper-fused platform effortlessly centralizes most of your work apps within a dynamic work hub, presenting a truly professional yet good enough solution for your personal project management needs.\n\n**Main Elements of this Project Management Template**\n\n* Task List Creation:\n  * The ability to create and maintain a to-do list of tasks for personal projects.\n  * Option to add details like task description, due dates, and priority levels.\n* Task Prioritization:\n  * Tools to prioritize tasks based on urgency and importance to tackle the most critical ones first.\n* Progress Tracking:\n  * Visual indicators or progress bars to track the completion status of tasks and projects.\n* Goal Setting and Milestones:\n  * Capability to set personal goals and milestones, with the ability to break them down into smaller achievable tasks\n## ② AFFiNE OKR and Progress Tracking Template\n\nAFFiNE provides you with a dynamic OKR (Objectives and Key Results) Template, specifically tailored to empower your organization or team to set ambitious goals and achieve remarkable outcomes. With this template, you'll be able to align objectives, track key results, and drive progress in a focused and transparent manner.\n\n### **Main Elements of this Project Management Template**\n\n* Objective and key results:\n  * Define clear and inspiring objectives that represent the desired outcomes and strategic priorities.\n  * Key results should be quantifiable and relevant to the success of the objectives.\n* Owners and Stakeholders:\n  * Assign owners and stakeholders to each objective, key result, and initiative.\n  * Clearly define responsibilities and accountabilities.\n* Timeframe and Progress Tracking:\n  * Set a timeframe for each OKR cycle (typically quarterly) to create a sense of urgency and focus.\n  * Use visual indicators or progress bars to track the status of each key result and initiative.\n* Evaluation and Assessment:\n  * Evaluate the effectiveness of OKRs in driving performance and achieving desired outcomes.\n\n![B84YGfp-h0mtU3CsjyOK1RRq7waeAzeeYxcIF5-tCLE=](https://insider.affine.pro/api/workspaces/H6vffRmJbCfA-r3kq_36_/blobs/B84YGfp-h0mtU3CsjyOK1RRq7waeAzeeYxcIF5-tCLE=)\n\n\n![PcgwMgBw95nbLIZIB5MfV7BjoUyvWcQaQzXSpYbAXMs=](https://insider.affine.pro/api/workspaces/H6vffRmJbCfA-r3kq_36_/blobs/PcgwMgBw95nbLIZIB5MfV7BjoUyvWcQaQzXSpYbAXMs=)\n\n## ③ AFFiNE Issue Tracker Template\n\n\n![SaoAnH2bS2P1FhXX1ugo2nW7GUoRdlDfy9Ih1Qutbwg=](https://insider.affine.pro/api/workspaces/H6vffRmJbCfA-r3kq_36_/blobs/SaoAnH2bS2P1FhXX1ugo2nW7GUoRdlDfy9Ih1Qutbwg=)\n\nSpecifically designed to make your work easier, this AFFiNE issue tracker template will make you feel earlier when it comes to tracking and managing software issues. With this template, you'll have a structured system in place to document and tackle bugs, feature requests, and all those technical hiccups that come up during development. It's like having a personal assistant dedicated to keeping things organized and ensuring nothing slips through the cracks. You'll be able to collaborate seamlessly with your team, easily prioritize tasks, and stay on top of everything.\n\n### **Main Elements of this Project Management Template**\n\n* Issue List Creation:\n  * The ability to create and maintain a to-do list of tasks for untackled issues\n  * Option to add details like bug description, due dates, and priority levels.\n* Bug Prioritization:\n  * Using a tag system to prioritize issues based on the severity standards of minor, severe, and fatal allows you to tackle the most critical ones first\n* Progress Tracking:\n  * Visual indicators or progress bars to track the completion status of tasks and projects.\n* Deadline Reminder:\n  * With a clearly defined column for fixed deadlines, this feature will provide you with timely reminders for bug fixes.\n## ④ AFFiNE Cornell Notes System Template\n\n\n![FNPhBUZOSxcPyPx1aFOda8WlKT7fx_Qx53ZbC54JQMw=](https://insider.affine.pro/api/workspaces/H6vffRmJbCfA-r3kq_36_/blobs/FNPhBUZOSxcPyPx1aFOda8WlKT7fx_Qx53ZbC54JQMw=)\n\nWelcome to AFFiNE's Cornell Notes System Template, a powerful and organized way to take and review notes. Whether you're a student or professional, this template will enhance your note-taking efficiency and boost your retention of key information. With its unique format, the Cornell Notes System divides your notes into sections, making it easy to identify main ideas, key details, and reflections.\n\n### **Main Elements of this Project Management Template**\n\n* Heading:\n  * At the top of your note page, write the title of the lecture, meeting, or subject, along with the date and any other relevant information.\n* Note-taking Section:\n  * This is where you'll take the bulk of your notes during the lecture or presentation.\n  * Focus on writing concise and organized points, capturing main ideas and key details.\n  * Use bullet points or numbered lists to keep information clear and easy to review.\n* Cue Column:\n  * On the left side of the page, create a cue column where you'll write down questions, keywords, or prompts that correspond to the main points in your note-taking section.\n  * These cues will serve as valuable study aids when reviewing your notes later.\n* Summary Section:\n  * At the bottom of your page, leave some space for a summary section.\n  * After the lecture or meeting, write a brief summary of the main points covered in your notes.\n  * Use this space to reflect on the material and connect it to your existing knowledge.\n## ⑤ AFFiNE Project Proposal Template\n\n\n![5EQsDazcTAk7e_n4AJNDq8r6Yr0Y9ZlBAjxbvRAeTgA=](https://insider.affine.pro/api/workspaces/H6vffRmJbCfA-r3kq_36_/blobs/5EQsDazcTAk7e_n4AJNDq8r6Yr0Y9ZlBAjxbvRAeTgA=)\n\nAFFiNE crafts a well-designed Project Proposal Template to help you effectively outline and communicate your project ideas to stakeholders, clients, or team members. With this template, you'll be equipped to showcase the feasibility, benefits, and strategies of your proposed project in a structured and professional manner.\n\n### **Main Elements of this Project Management Template**\n\n* roject Overview:\n  * Provide a concise summary of the project, including its purpose, goals, and objectives.\n  * Briefly describe the problem or opportunity the project aims to address.\n* Scope and Deliverables:\n  * Clearly define the scope of the project, outlining what will be included and excluded.\n  * List the specific deliverables or outcomes that the project will produce.\n* Timeline and Milestones:\n  * Present a detailed timeline for the project, including start and end dates.\n  * Identify key milestones and deadlines to track progress and ensure timely completion.\n* Budget and Resources:\n  * Specify the estimated budget for the project, including costs for materials, equipment, and labor.\n  * Outline the resources required, such as personnel, expertise, and technology, to execute the project successfully.\n## ⑥ Standard Operating Procedure\n\n\n![trIP8D8yCCmDnXoaq1Q0flrCqfXbSxPNgPeR84rU6x8=](https://insider.affine.pro/api/workspaces/H6vffRmJbCfA-r3kq_36_/blobs/trIP8D8yCCmDnXoaq1Q0flrCqfXbSxPNgPeR84rU6x8=)\n\nIntroducing our comprehensive SOP (Standard Operating Procedure) template, designed to simplify and streamline your business processes. With this template, you'll have a reliable and standardized framework to outline the step-by-step procedures for various tasks and operations within your organization.\n\n### **Main Elements of this Project Management Template**\n\n* Title and Purpose:\n  * Clearly state the title of the SOP and its intended purpose or scope.\n  * Define the specific area or process the SOP covers to avoid ambiguity.\n* Roles and Responsibilities:\n  * Clearly define the roles and responsibilities of each team member involved in the process.\n  * This ensures everyone knows their tasks and accountabilities.\n* Procedures and Steps:\n  * Present a detailed step-by-step guide for each task or process covered by the SOP.\n  * Include any necessary sub-steps, guidelines, or best practices to ensure consistency.\n* Performance Metrics:\n  * Define key performance indicators (KPIs) to measure the success and efficiency of the process.\n  * This helps in evaluating the effectiveness of the SOP and making improvements if needed.\n**Looking for more example to enhance your productivity and streamline your work processes? Join our vibrant community and post your template request to get access to a wide range of example!**\n\n\n\nAFFiNE has released its stable version, but we are continuing to build to a more feature-rich and stable build. Come and join us on our journey over on our media platforms.\n\n* Official Website: [https://affine.pro/](https://affine.pro/)\n* GitHub: [https://github.com/toeverything/AFFiNE](https://github.com/toeverything/AFFiNE)\n* Discord: [https://discord.gg/Arn7TqJBvG](https://discord.gg/Arn7TqJBvG)\n* Twitter: [https://twitter.com/AffineOfficial](https://twitter.com/AffineOfficial)\n",
  "publish": true
}