{
  "title": "AFFiNE 0.7.0 preview - Launch Week - Day 1/5",
  "authors": [
    "Xuan Pang",
    "Jackie Peng",
    "Enther"
  ],
  "tags": [
    "Release Note"
  ],
  "description": "Discover the power of AFFiNE, the ultimate alternative to Notion, Miro, and Monday. This article introduces the latest AFFiNE 0.7.0 Preview, unveiling game-changing features for Filter, Collections, and a redesigned UI/UX.",
  "created": 1688860800000,
  "updated": 1688947200000,
  "layout": "blog",
  "id": "busXz33Wz4",
  "slug": "affine-070-launch-week-day1",
  "cover": "/blobs/sM99o3QC34TB77621cnRhCmoJz_XuBQ3C0Hz4G9kQMU=",
  "md": "---\n\n\ntitle: \"AFFiNE 0.7.0 preview - Launch Week - Day 1/5\"\n\n\nauthor: Xuan Pang, Jackie Peng, Enther\n\n\ntags: Release Note\n\n\nslug: affine-070-launch-week-day1\n\n\ndescription: \"Discover the power of AFFiNE, the ultimate alternative to Notion, Miro, and Monday. This article introduces the latest AFFiNE 0.7.0 Preview, unveiling game-changing features for Filter, Collections, and a redesigned UI/UX.\"\n\n\ncreated: 2023-07-09\n\n\nupdated: 2023-07-10\n\n\nlayout: blog\n\n\npublish: true\n\n\n---\n\n\n\n![sM99o3QC34TB77621cnRhCmoJz_XuBQ3C0Hz4G9kQMU=](/blobs/sM99o3QC34TB77621cnRhCmoJz_XuBQ3C0Hz4G9kQMU=)\n\n\n**Welcome to the highly anticipated launch week of AFFiNE 0.7.0 Preview!** We are thrilled to present an array of groundbreaking features and a redesigned user experience that will redefine the way you work.\n\n\nOn the first day of the AFFiNE 0.7.0 Preview launch week, we will introduce you to the exciting updates, including enhanced organization with Filter and Collections, as well as a visually revamped UI/UX. Get ready to unlock new levels of productivity and immerse yourself in a seamless and efficient workflow.\n\n\n# **Enhanced Organization and Efficient Filtering**\n\n\n## ① Docs Filter - Refine and Sort with Ease\n\n\nFilter by creation date, update date, favourites, and tags, ensuring efficient knowledge management.\n\n\n\n![KSzOi0HHfUE3MHiWFE1sb7xKV4LOGrVFoQVixdqZQpI=](/blobs/KSzOi0HHfUE3MHiWFE1sb7xKV4LOGrVFoQVixdqZQpI=)\n\n\n## ② Collections - Unleash the Power of Smart Collections\n\n\nA few steps to set criteria, collect filtered pages, and effortlessly curate frequently used content, ensuring efficient organization and easy retrieval and comprehensive management.\n\n\n\n![lWmboopIBpGPXguszJKPus_9hg3AgCrQUUmJARNPtJQ=](/blobs/lWmboopIBpGPXguszJKPus_9hg3AgCrQUUmJARNPtJQ=)\n\n\n# **Revamped Visuals and User Interface**\n\n\n## ① New Settings Page - New Pop-up for Effortless Configuration.\n\n\nPersonalize your note-taking environment with our new pop-up settings page. Better dark-mode settings and a translucent sidebar are available now.\n\n\n\n![bcLPsSFM3T3DNmaqbVXMrUwVc3nsAlD-7FXPE2U3tgI=](/blobs/bcLPsSFM3T3DNmaqbVXMrUwVc3nsAlD-7FXPE2U3tgI=)\n\n\n## ② Integrated Titlebar and Animation-Enhanced UI/UX Experience\n\n\nTitlebar now harmoniously blends with the page, creating a unified visual experience, in particular for Windows users.\n\n\n\n![orMPWEgelZYCBw4dU_HXVQp-jhr9icO9dIyTLc7sCro=](/blobs/orMPWEgelZYCBw4dU_HXVQp-jhr9icO9dIyTLc7sCro=)\n\n\nWe know that sometimes it takes hard work to finish a list of tasks. So we tried a better animation on our new checkbox, to make life easier.\n\n\n\n![WZrddOXN7UxOFLxCkFAP5gVyk_0WF7vm2jodI-6dfNw=](/blobs/WZrddOXN7UxOFLxCkFAP5gVyk_0WF7vm2jodI-6dfNw=)\n\n\n## ③ Better Customizing - A Superior User Experience Tailored to Your Needs\n\n\nFull-width mode is now supported on our pages.\n\n\n\n![Q85_3R3Lo9tSqSHv_REmdZNohewjY7iIC49lxb73IKM=](/blobs/Q85_3R3Lo9tSqSHv_REmdZNohewjY7iIC49lxb73IKM=)\n\n\nElevate your note-taking experience with a stylish sidebar.\n\n\n\n![SbsOK0ZzT5dKfFHoiB0c-1tah8AdaQOQGoHQnMV4xJI=](/blobs/SbsOK0ZzT5dKfFHoiB0c-1tah8AdaQOQGoHQnMV4xJI=)\n\n\nWe are trying to improve our design about detail in dark mode all the time, and it is getting better now.\n\n\n\n![dOGXue3awsQSYTmDYakSIRD82hGJzthWYRRXQyWinSg=](/blobs/dOGXue3awsQSYTmDYakSIRD82hGJzthWYRRXQyWinSg=)\n\n\nRest assured, the AFFiNE 0.7.0 beta will be made available at a very recent date. Stay tuned for the official launch and get ready to experience a seamless and reliable note-taking solution.Get ready to unlock new levels of productivity\n\n\n* Official Website: [https://affine.pro/](https://affine.pro/)\n\n\n* GitHub: [https://github.com/toeverything/AFFiNE](https://github.com/toeverything/AFFiNE)\n\n\n* Discord: [https://discord.gg/Arn7TqJBvG](https://discord.gg/Arn7TqJBvG)\n\n\n* Telegram: [https://t.me/affineworkos](https://t.me/affineworkos)\n\n\n",
  "publish": true
}