{
  "title": "Asana Vs Monday.com: Which Is Best For Your Team In 2024?",
  "authors": [
    "Yanxi Liu"
  ],
  "tags": [
    "Content"
  ],
  "description": "Deciding between Asana and Monday.com? Discover which project management software is the perfect fit for your team in 2024.",
  "created": 1704672000000,
  "updated": 1704672000000,
  "layout": "blog",
  "id": "kwVwJxEGSdVeqldc4ImFx",
  "slug": "asana-vs-monday.com-which-is-best-for-your-team",
  "cover": "https://app.affine.pro/api/workspaces/qf73AF6vzWphbTJdN7KiX/blobs/2oqZVVRmpiRYQAXynviodCzK5QKOK54GUdJlheDkm6o=.webp",
  "md": "---\n\ntitle: \"Asana Vs Monday.com: Which Is Best For Your Team In 2024?\"\n\nauthor: \"Yanxi Liu\"\n\ntags: Content\n\nslug: asana-vs-monday.com-which-is-best-for-your-team\n\ndescription: \"Deciding between Asana and Monday.com? Discover which project management software is the perfect fit for your team in 2024.\"\n\ncreated: 2024-01-08\n\nupdated: 2024-01-08\n\nlayout: blog\n\npublish: true\n\n---\n\n\n![2oqZVVRmpiRYQAXynviodCzK5QKOK54GUdJlheDkm6o=](https://app.affine.pro/api/workspaces/qf73AF6vzWphbTJdN7KiX/blobs/2oqZVVRmpiRYQAXynviodCzK5QKOK54GUdJlheDkm6o=.webp)\n\nAsana and Monday are both project management software options that offer affordable pricing and a free version. However, they have different strengths and are best suited for different purposes. Asana excels in task management, while Monday is more focused on workflow management. Let's dive deeper into the comparison between Asana and Monday to help you determine which one is the best fit for your specific business needs and team building in 2024.\n\n# What is Asana?\n\nAsana is a robust task and project management tool available on web and mobile platforms. It excels in creating and assigning tasks, tracking deadlines, and managing various project aspects seamlessly.\nWith Asana, you can collaborate with team members and manage tasks and subtasks using different views like task lists, Kanban boards, timelines, calendars, and Gantt charts.\nFor effective communication and accountability, Asana allows discussions on tasks and subtasks, as well as direct and group messaging. You can also set up reporting dashboards that automatically update based on task status and integrate with external apps using Asana integrations.\n\n# What is [Monday.com](http://Monday.com)?\n\nMonday.com is a versatile platform for tracking tasks, managing processes, tracking sales, and basic financial management. Its flexible table and board views offer multiple project and task perspectives, along with a word-processing tool, automation capabilities, and over 200 integrations. A standout feature of Monday.com is its pre-designed templates, which can be used for projects, forms, and other views.\nWith the use of forms, both internal and external stakeholders can easily add new projects or requests directly to your project queue. Monday.com integrates seamlessly with popular apps like Slack, Google Workspace, Github, and others that focus on marketing and customer relationship management.\nMonday.com offers three paid plan tiers tailored for small businesses, unlocking additional features such as time tracking, dependency columns, different views, free viewers, automations, and integrations.\n\n# Asana vs. Monday.com: Task management\n\n\n![Zj_wLoFokkjp3d9uVF8xUCAu6DKcNf98SyvXQeDtdlM=](https://app.affine.pro/api/workspaces/qf73AF6vzWphbTJdN7KiX/blobs/Zj_wLoFokkjp3d9uVF8xUCAu6DKcNf98SyvXQeDtdlM=.webp)\n\n**Winner: Asana**\n\nIf your primary focus is task management, Asana is a more streamlined option. It excels at task management with multiple views and easy switching between tasks and projects. It's suitable for businesses that require multiple views for task and subtask tracking. While Monday.com offers more features, they can be distracting for task tracking alone.\n\n# Asana vs. Monday.com: Workflow management\n\n**Winner: Monday**\n\nFor comprehensive workflow management, Monday.com is the better choice. It offers specialized features for finance, project management, marketing workflows, creative and design processes, IT, task management, operations, sales, construction, and HR. Asana also supports workflow management, with dashboard tools for tracking roadmaps, pipelines, and campaigns, and the ability to create repeatable workflows with templates.\n\n# Asana vs. Monday.com: Integrations\n\n**Winner: Tie**\n\nBoth Asana and Monday.com support over 200 integrations, providing a wide range of options for task and project management. The choice of integrations depends on your specific goals. Asana focuses more on specific tasks, time tracking, and reporting, while Monday.com supports CRMs, development platforms, financial tools, marketing platforms, and various application use cases.\n\n# Asana vs. Monday.com: Usability\n\n**Winner: Asana**\n\nAsana is easier to learn and use, making it a more user-friendly option. Most people comfortable with computers can quickly get up and running with Asana, requiring minimal training for the team. Monday.com, with its extensive features and options, has a steeper learning curve but offers more capabilities for those willing to invest the time.\n\n# Asana vs. Monday: Customer support\n\n**Winner: Monday.com**\n\nBoth Asana and [Monday.com](http://Monday.com) have comprehensive help sections to address common questions. Asana directs users to a chatbot for support ticket creation and email communication if answers are not found in the help section. Monday provides options for live chat, email, and callback requests through their contact page. Live chat requires logging in, while anyone can send an email. Phone calls are limited to billing inquiries.\n\n# Suitability for your business\n\nThese two are competitors because they are both suitable for some of the same types of projects. While both platforms would manage your tasks well, each is better suited for a specific type of workflow process. It would be best if you picked the one that suited YOUR business and worked within your workflow instead of trying to adjust to the workflow of a program. Choose the platform that marries up to your process, not one that will be a square peg in a round hole.\n\nSo in this instance, these platforms do better within these two specific applications:\n\nAsana is particularly well-suited for teams needing a comprehensive project management platform to handle complex workflows and tasks. It is also a good choice for teams that value automation and efficiency.\n\n[Monday.com](http://Monday.com) is a good choice for teams that prioritize visual and customizable workflows. Its customizable interface allows teams to create boards and workflows that fit their specific needs, making it a good choice for creative teams needing flexibility.\n\n# Another leading option: [AFFiNE](http://affine.pro)\n\n\n![-_OPJAICQM-hdycw2wCuxDqMLnm_Gx64Yk2i_PX6Vjc=](https://app.affine.pro/api/workspaces/qf73AF6vzWphbTJdN7KiX/blobs/-_OPJAICQM-hdycw2wCuxDqMLnm_Gx64Yk2i_PX6Vjc=.webp)\n\nAFFiNE provides professionals with a unified platform that enables them to plan a knowledge base, collaborate with teammates, and develop content. This flexible tool empowers users to brainstorm, take notes, and set their goals while staying in sync and building content with blocks. The limitless workspace stimulates user-driven innovation. AFFiNE offers safe data storage, open-source benefits, and collaborative functionality. Users can visualize and connect information effortlessly, making business model Canvas templates an engaging and enjoyable experience.\n\n**Key features**\n\n* **Template Gallery in AFFiNE**: There is a curated collection of powerful whiteboard templates in AFFiNE. From the robust Gantt chart to the insightful concept map and the comprehensive monthly calendar, an array of additional templates awaits your exploration, promising to expand the horizons of your project planning and execution. These templates serve as your launchpad, enabling you to skip the groundwork and jump straight into action. Crafted for seamless collaboration, AFFiNE's templates provide structured canvases for various tasks, saving you valuable time and enhancing efficiency in project management, content creation, and planning.\n\n![OP3GdbE7dwmQKK2uKzBgJbhpVJxkLuDsVtomxcggvSQ=](https://app.affine.pro/api/workspaces/qf73AF6vzWphbTJdN7KiX/blobs/OP3GdbE7dwmQKK2uKzBgJbhpVJxkLuDsVtomxcggvSQ=.webp)\n\n* **Collaborative Editing**: Multiple users can seamlessly collaborate in real-time on the same business model canvas, fostering collective input and refinement. Invite your [team members](https://affine.pro/blog/team-building-activities-for-collaboration-success) into one workspace regardless of their location or time zone.\n\n![O88V12dZ7eALpdMD8-6eyyfRec5yZyWiQxCnvNEb3r0=](https://app.affine.pro/api/workspaces/qf73AF6vzWphbTJdN7KiX/blobs/O88V12dZ7eALpdMD8-6eyyfRec5yZyWiQxCnvNEb3r0=.webp)\n\n* **Show Your Business Model Canvas Templates with AFFiNE's Single Page Sharing**: No more oversharing of your workspace; now, you can precisely control what's shared with just a few clicks. AFFiNE's single-page sharing makes business model canvas improvement simple, offering a tailored approach to showing your business model canvas to your business partners.\n\n![VsmRQKKT_JWfocv6kdTdmSw3-22k1EUrdWeyjhL8xjQ=](https://app.affine.pro/api/workspaces/qf73AF6vzWphbTJdN7KiX/blobs/VsmRQKKT_JWfocv6kdTdmSw3-22k1EUrdWeyjhL8xjQ=.webp)\n\n# Comparing AFFiNE vs Asana\n\nSo what does AFFiNE offer that Asana doesnâ€™t? AFFiNE offers all of the features teams need to succeed in todayâ€™s workplace, including:\n\n* Data Import\n* Customizable templates\n* Custom forms\n# Compare AFFiNE with [Monday.com](http://Monday.com)\n\nAFFiNE has more robust project management and collaboration features, including:\n\n* Rich database and timesheets\n* Abundant templates gallery\n* Real-time collaboration with team members\n\n\n<div style=\"text-align:center;\">\n\n<iframe width=\"560\" height=\"315\" src=\"https://www.youtube.com/embed/3cfeKOufZWU?si=IiXDIdwfnM2Z7KPL\" title=\"YouTube video player\" frameborder=\"0\" allow=\"accelerometer; autoplay; clipboard-write; encrypted-media; gyroscope; picture-in-picture; web-share\" allowfullscreen></iframe>\n\n</div>\n\n\n\nSo why wait? Start exploring AFFiNE today and take your process mapping to new heights! The timing is opportune, and it's never too late to embark on this transformative journey. Commence improving your plans by using AFFiNE's user-friendly tool. Presently, **AFFiNE** has launched its **[Stable Version](https://affine.pro/download)**, with ongoing efforts to develop a more comprehensive and dependable iteration. Join us on our voyage through our social media channels and be part of the experience.\n\n**Come and join us on our journey over on our media platforms**. ðŸš€\n\n* Official Website: [https://affine.pro/](https://affine.pro/)\n* GitHub: [https://github.com/toeverything/AFFiNE](https://github.com/toeverything/AFFiNE)\n* Discord: [https://discord.gg/Arn7TqJBvG](https://discord.gg/Arn7TqJBvG)\n* Twitter: [https://twitter.com/AffineOfficial](https://twitter.com/AffineOfficial)\n",
  "publish": true
}