{
  "title": "The Best 5 AI Content Detector Tools in 2024",
  "authors": [
    "Yiyang Zhang"
  ],
  "tags": [
    "Content"
  ],
  "description": "Discover the top 5 content detection tools of 2024 to unlock AI's potential. Stay ahead of the writing journey and make better decisions.",
  "created": 1715817600000,
  "updated": 1715817600000,
  "layout": "blog",
  "id": "9SBKiTVybXdyf9MyVv1f9",
  "slug": "best-5-ai-content-detector-tool",
  "cover": "/blobs/Nolv-NGWiFCQqFn2DCW_AX4HPlKE8O6EgaYF2jd9VdQ=",
  "md": "---\n\n\ntitle: \"The Best 5 AI Content Detector Tools in 2024\"\n\n\nauthor: \"Yiyang Zhang\"\n\n\ntags: Content\n\n\nslug: best-5-ai-content-detector-tool\n\n\ndescription: \"Discover the top 5 content detection tools of 2024 to unlock AI's potential. Stay ahead of the writing journey and make better decisions.\"\n\n\ncreated: 2024-05-16\n\n\nupdated: 2024-05-16\n\n\nlayout: blog\n\n\npublish: true\n\n\n---\n\n\n\n![Nolv-NGWiFCQqFn2DCW_AX4HPlKE8O6EgaYF2jd9VdQ=](/blobs/Nolv-NGWiFCQqFn2DCW_AX4HPlKE8O6EgaYF2jd9VdQ=)\n\n\nIn today's digital world, where content is of utmost importance, ensuring authenticity, relevance, and compliance has become essential. As an expert in [AI](https://affine.pro/blog/Best-10-Free-Online-AI-Presentation-Maker-for-Generating-Project-in-Minutes) software solutions, I understand the difficulties in finding effective content detection tools. It can be challenging to navigate through numerous options, complex interfaces, and hope for accuracy.\n\n\nHowever, there is good news. AI-powered content detection tools have emerged, revolutionizing how we manage [digital content](https://affine.pro/blog/10-creative-content-marketing-ideas-examples-inspire-you). These tools use advanced AI algorithms and offer a solution to the problem of information overload.\n\n\nOne of the significant challenges that users face is the sheer volume of content. Even for seasoned professionals, identifying plagiarism or ensuring compliance can be overwhelming. AI content detection tools provide invaluable assistance in managing this flood of data.\n\n\nJust imagine the ease of quickly pinpointing plagiarized passages or detecting subtle nuances in language to flag misinformation. With AI-powered tools, these tasks become streamlined, and users are empowered. Efficiency, accuracy, and integrity are paramount in today's [digital](https://affine.pro/blog/top-10-best-free-digital-planner-apps-2023) landscape.\n\n\n\n\n\n# **The Next Frontier in Content Detection with [AI](https://affine.pro/blog/how-to-ask-ai-question-efficiently)**\n\n\nIn today's fast-paced digital ecosystem, the demand for top-notch, authentic content has reached unprecedented levels. Amidst the deluge of information flooding the internet, the challenge of ensuring your content stands out has become increasingly daunting. Enter AI content detectors—a vital solution to combat plagiarism and safeguard authenticity.\n\n\nNo longer do writers need to painstakingly scour every sentence for duplication or improper sourcing. AI content detectors offer a swift and efficient means to sift through extensive text, swiftly flagging potential issues within seconds. These tools not only [streamline the process](https://affine.pro/blog/how-to-write-best-agile-project-charter-template-streamline-your-workflow-2023) but also champion ethical [writing](https://affine.pro/blog/top-10-wordai-alternative-ai-generating-and-rewriting-tool) practices by encouraging originality.\n\n\nWith search engines intensifying their crackdown on duplicate content and readers placing a premium on authenticity, the adoption of AI content detectors transcends mere convenience—it's now imperative. Stay ahead of the curve and elevate your content to meet the highest standards by harnessing the power of these innovative tools.\n\n\n\n\n\n# **The Core Features of the Best AI Content Detector Tools and Practical Evaluation Strategies**\n\n\nGiven the significance of AI content detector tools in maintaining the authenticity and quality of [online content](https://affine.pro/blog/10-best-free-online-table-maker-tools-2023), it's prudent to consider what attributes define the best among them. So, what exactly should you seek in an optimal AI content detector tool?\n\n\n\n![FeQAEX6UrPNI8i9Fl3lsU2laqiySycY5Bl0DbXBqjHA=](/blobs/FeQAEX6UrPNI8i9Fl3lsU2laqiySycY5Bl0DbXBqjHA=)\n\n\n* **Precision:** The foremost requirement is accuracy. Look for a tool that can detect plagiarism, grammar errors, and inconsistencies with precision.\n\n\n* **Comprehensive Database:** The tool needs to have a comprehensive database that can efficiently cross-reference content, thereby enhancing its detection abilities.\n\n\n* **User-Friendliness:** Opt for a tool that is easy to navigate, providing clear instructions and detailed reports for users of all skill levels.\n\n\n* **Customization Options:** Look for a tool that offers customization options, allowing users to tailor settings according to their specific needs, whether it's academic writing or professional content creation.\n\n\n* **Continuous Updates:** Choose a tool that prioritizes continuous updates and improvements to stay ahead of evolving trends and techniques used by plagiarists. Regular updates ensure the tool's algorithms remain effective and relevant over time.\n\n\nIf you're wondering how to test the effectiveness of AI content detection tools, I'm here to help! To make sure these tools are doing a great job, you can follow these simple steps:\n\n\n\n![h7RWRsccshuU5NpQ6CMqF1VxqT4Zbl1fNm-VXtALpQY=](/blobs/h7RWRsccshuU5NpQ6CMqF1VxqT4Zbl1fNm-VXtALpQY=)\n\n\n1. **Select a Topic:** Choose a topic that you know has been written by a human to establish a baseline for comparison. This could be an article you've previously written or any other human-generated content.\n\n\n1. **Generate AI-Generated Content:** Request AI-generated content on the same topic from AI models. Prompt them to create an article of a specified length based on the chosen topic.\n\n\n1. **Create Mixed Content:** Combine the beginning of your human-written article with a portion of the AI-generated content to create a mixed piece of content.\n\n\n1. **Testing the Tools:** Utilize various AI content detection tools to analyze the four pieces of text: the fully human-written article, the AI-generated content, and the mixed content piece.\n\n\n1. **Evaluation Criteria:** Assess the accuracy of each tool in identifying AI-generated content. Look for features such as the tool's ability to detect unnatural language patterns, inconsistency in writing style, or the presence of commonly used phrases associated with AI-generated text.\n\n\n1. **Comparative [Analysis](https://affine.pro/blog/top-10-free-editable-swot-analysis-template-examples):** Compare the results obtained from each tool to determine their effectiveness in distinguishing between human-written and AI-generated content.\n\n\nTo make informed decisions about which AI-powered tool suits your needs, it's important to test their capabilities systematically and compare the results. Keep in mind that it's not just about the features of the tool itself, but also how well it integrates with your workflow and complements your content creation process. By testing the options thoroughly and considering these factors, you can leverage the power of AI to enhance the authenticity and quality of your content.\n\n\n\n\n\n# **The Top 5 Best AI Content Detector Tools in 2024**\n\n\nWhen it comes to AI content detector tools in 2024, staying ahead of the curve is essential for [businesses](https://affine.pro/blog/top-10-free-competitive-analysis-templates-boost-your-business) and content creators alike. The top players in this field offer cutting-edge technology that can analyze and enhance your content with precision.\n\n\n\n\n\n### **1. [GPTZero](https://gptzero.me/)**\n\n\n\n![IIv4vQMYhOz7_C10xZxWjvE7PZIJhrbg0xf35pPJ_mI=](/blobs/IIv4vQMYhOz7_C10xZxWjvE7PZIJhrbg0xf35pPJ_mI=)\n\n\nGPTZero is a tool that uses artificial intelligence to detect text that has been generated by large language models. It features 7 components that process text and determine if it was written by AI. This tool is not just for detecting AI-generated text, it also helps students improve their writing skills by finding a balance between AI-generated text and their authentic voice. GPTZero uses a multi-step approach to produce predictions with maximum accuracy and minimal false positives. Its AI detection model is specialized in detecting content from [Chat GPT](https://affine.pro/blog/10-best-chatgpt-alternatives-you-can-look-for), GPT 4, Gemini, Claude, and LLaMa models.\n\n\n**Key features:**\n\n\n* **Request edits:** In select classrooms, reviewers can request edits from writers to add their authentic contributions and write in a controlled environment.\n\n\n* **Writing sandbox:** Monitor copy-pastes and receive a report on writing improvements.\n\n\n* **Source scanning:** Scan documents for plagiarism and support AI copyright checks.\n\n\n**How to use GPTZero:**\n\n\nTo check a document for AI-generated content, simply copy and paste the text or upload a file to GPTZero. The detector will provide you with an overall analysis of the document and will highlight any sentences where AI is detected on a sentence-by-sentence basis. Unlike other detectors, GPTZero provides detailed descriptions of the results to help you better understand them, rather than just a number.\n\n\n### **2. [Copyleaks](https://copyleaks.com/)**\n\n\n\n![FMFyov1-knHxOSxHl5vxNwCauaCzk3cPnUjKHXC7TRU=](/blobs/FMFyov1-knHxOSxHl5vxNwCauaCzk3cPnUjKHXC7TRU=)\n\n\nCopyleaks is a plagiarism detection application powered by AI. It goes beyond the conventional approach of detecting word-for-word matches and identifies text that is similar in meaning or paraphrased. This tool is useful for schools and businesses to verify the authenticity of content, while also preventing copyright infringement. The application's interface is simple and user-friendly. Copyleaks offers basic support channels, but each option is comprehensive and responsive. The help centre on the web application is easy to use and contains a lot of information. The customer support team is quick to respond to inquiries.\n\n\n**Key features:**\n\n\n* **Plagiarism detector:** Identify potential plagiarism, multiple forms of paraphrasing, copyright infringement, and more.\n\n\n* **Writing [assistant](https://affine.pro/blog/10-best-free-ai-virtual-assistants-improve-productivity):** Empower error-free writing with suggestions on sentence structure, mechanics and word choice.\n\n\n* **Codeleaks:** Source code plagiarism and AI detection to proactively mitigate risk and ensure full source code transparency.\n\n\n**How to use Copyleaks**\n\n\nThe process of verifying whether a document contains any instances of plagiarism is a simple and expedient one that yields a comprehensive breakdown of the text. Copyleaks' plagiarism detection tool operates through a series of step-by-step procedures after you have provided the text for analysis. Initially, the tool identifies the textual elements before breaking down the entire document into smaller chunks of semantically related phrases. From there, the tool filters out unique characters and symbols and begins checking for plagiarism in local portals. The tool then employs specific algorithms to monitor the larger chunks of data and conducts further comparisons using search engines. Finally, the tool generates a detailed report on the presence of plagiarism in the document.\n\n\n### **3. [Originality.ai](https://originality.ai/)**\n\n\n\n![q2PXusTQBIZU88BoYmtCY2Rknux3YGrQa7RpUEKr0zw=](/blobs/q2PXusTQBIZU88BoYmtCY2Rknux3YGrQa7RpUEKr0zw=)\n\n\nOriginality.ai is a comprehensive tool that checks the uniqueness of text by comparing it against public-facing web content. It is both a plagiarism and AI content detection tool that is capable of detecting GPT-4 writing. It also has a writing visualizer tool. Originality.ai was one of the first public AI detectors, although GLTR preceded it. The tool is affordable, with some of the lowest prices in the industry.\n\n\n**Key features:**\n\n\n* **AI detection:** Return the per cent likely writing has been created with [AI](https://affine.pro/blog/top-25-free-best-%20ai-productivity-tools), but you can now view exactly which lines come back the most suspicious.\n\n\n* **Content readability checker:** This tool is completely free and is great for testing the level of writing you or your contractors have been producing.\n\n\n* **Fast Chrome extension:** Let you 1-click check content for both plagiarism and AI across any website.\n\n\n**How to use Originality.ai**\n\n\nTo use Originality.ai's multi-language AI detection feature, you can begin by selecting \"Start New Scan\" and either writing or pasting your content in the supported language. Once the content is added, at the bottom of the scan, there will be a box that allows you to choose the model you want to use. If you are scanning in a non-English language, the multi-language model will be selected by default. However, if the model is not selected, you can manually choose it by clicking on the option and selecting \"multi-language\". Once the selection is made, you can click the \"Scan Now\" button above the scan box and your scan will begin.\n\n\n### **4. [WriterZen](https://writerzen.net/)**\n\n\n\n![KvCjQa3M8juI5B5mIrE2xUWQtIt0IjB46xqIYb5c5gM=](/blobs/KvCjQa3M8juI5B5mIrE2xUWQtIt0IjB46xqIYb5c5gM=)\n\n\nWriterZen is a comprehensive content creation platform that aims to simplify the SEO and content marketing workflows of businesses. It provides a user-friendly interface that consolidates tools for content research, planning, writing, optimization, and team [management](https://affine.pro/blog/11-types-events-management-different-specializations). With WriterZen, you can identify high-potential topics, perform thorough keyword research, create content outlines, benefit from [AI writing](https://affine.pro/blog/top-10-best-wordai-alternatives-competitors-ai-writing) assistance, check for plagiarism, collaborate with your team, and more—all within the same platform.\n\n\n**Key features:**\n\n\n* **Content Creator:**Get instant content outlines from top SERPs, Reddit, and Google Suggest. Get guidance on headings, bullets, and more.\n\n\n* **Plagiarism Checker:** This will help you avoid any issues and ensure that your articles are of the highest quality.\n\n\n* **SEO Editor:**Includes readability metrics, character count, and automatic saving.\n\n\n**How to use WriterZen:**\n\n\nTo create a new [project](https://affine.pro/blog/10-free-project-communication-plan-templates-examples), click on the \"new project\" button. Give it a name and set the location and language if necessary. Hit \"Add\". You can set the seed keyword, writer's name, priority, deadline, and notes. These options are available if you are outsourcing your writing or organizing your [work](https://affine.pro/blog/top-5-team-building-activities-exercises-work).\n\n\n### **5. [Winston AI](https://gowinston.ai/)**\n\n\n\n![zsM-vBLo6UpshMXJ_93TwR2IJ8iu6L87fedMeEMURWk=](/blobs/zsM-vBLo6UpshMXJ_93TwR2IJ8iu6L87fedMeEMURWk=)\n\n\nWinston AI detects AI-generated content, identifying content produced by platforms like ChatGPT, GPT-4, Bard, Bing chat, Claude, and more. It's an ideal tool for publishers and content creators who want to prioritize a human touch in their work. Winston AI has a user-friendly interface and powerful features to detect [AI-generated content](https://affine.pro/blog/top-25-ai-art-prompts-ideas-spark-your-creativity) and check for plagiarism, making it a reliable tool for SEO professionals. For customer support, Winston AI is a reliable tool in the SEO toolkit.\n\n\n**Key features:**\n\n\n* **Optical character recognition:** Extract text from an image we want to copy and paste elsewhere.\n\n\n* **Plagiarism detection:** The plagiarism graph shows a percentage of content that may have been taken from another source.\n\n\n* **AI Detection:** The tool gives a \"Human Score\" to estimate the human-written content percentage and a \"Readability Score\" for comparing an author's current and past work.\n\n\n**How to use Winston AI:**\n\n\nTo get started with checking for AI content, the first step is to create your free account. Once you've done that, simply enter the text you want to check and get your results within seconds. The AI prediction map will give you a sentence-by-sentence analysis. In addition to this, Winston AI creates a report that can be easily printed for your records.\n\n\n\n\n\n# **Optimize Your Content with the AI Content Detector Suits You the Best**\n\n\nWith the rapid advancement of technology, AI content detector tools have become increasingly valuable for creators and businesses alike. In addition to the AI content detector tools mentioned above, AFFiNE AI can be relied upon as a trustworthy companion that provides powerful features and accurate AI content detection capabilities. By utilizing the capabilities of AFFiNE AI, you can improve your content creation process while recognizing the vital role of human judgment and creativity.\n\n\n<video muted autoplay loop preload=\"auto\" playsinline>\n  <source src=\"/blobs/LfqGtgWNK2I1QTfoWExiQ4bKKy1PIBy40rlXIpdxVlI=\" type=\"video/mp4\" />\n</video>\n\n\nAFFiNE AI revolutionizes content creation by offering immediate insights, effortless content refinement, and [enhanced](https://affine.pro/blog/10-cool-apps-enhanced-productivity-simplified-living) creativity through dynamic mind maps and polished presentation slides. It empowers users to envision grand ideas, [boost productivity](https://affine.pro/blog/10-best-ai-productivity-tools-must-know-upgrade-workflow-improve-business), and streamline workflows, ultimately saving valuable time on every endeavour. Whether [brainstorming ideas](https://affine.pro/blog/best-free-brainstorming-templates-techniques-guide), crafting presentations, or sketching visuals, AFFiNE AI amplifies creativity and upgrades workflow efficiency. It combines the functionalities of Notion AI, Miro AI, Figma AI, Canva AI, and Clickup AI into one comprehensive platform.\n\n\n**Best Features of AFFiNE AI:**\n\n\n* **AI Writer:** Perfect writing effortlessly with AFFiNE AI's advanced AI Writer feature. Say goodbye to spelling and grammar errors, tone inconsistencies, and lengthy editing sessions. With AFFiNE AI, users can translate content, adjust length, improve clarity, generate action items, and create drafts, outlines, or timelines with ease. Whether crafting social media posts or penning creative stories, AFFiNE AI empowers users to express themselves confidently and efficiently.\n\n\n  \n![XhwBfbXzNmPOjL70F28JGgQizULkEy6j45lW63QPypE=](/blobs/XhwBfbXzNmPOjL70F28JGgQizULkEy6j45lW63QPypE=)\n\n\n  * **Unlocking Writing Excellence with AFFiNE Inline AI Writing:** Have you ever wished for a writing partner who could magically transform your tone, making you sound more professional or conversational at the snap of your fingers? Enter AFFiNE Inline AI Writing! It helps refine your writing style and captivates your audience with the perfect tone.\n\n\n  * **Guardian for Spelling and Grammar:** Imagine having a trusty sidekick that swoops in to catch those pesky spelling and grammar errors before they ruin your masterpiece. That's exactly what AFFiNE AI does! With its real-time corrections, you can bid farewell to embarrassing typos and grammar slip-ups, ensuring your content shines with flawless precision.\n\n\n  * **Tailoring Text Length to Perfection:** Need to trim down that lengthy paragraph or beef up your content with more detail? Look no further than AFFiNE AI! It lets you effortlessly adjust the length of your text, helping you strike the perfect balance between brevity and depth.\n\n\n* **AI Chatbox:** Instantly access insights and support across projects with AFFiNE AI's intuitive chatbox. Seamlessly integrated into documents and[whiteboards](https://affine.pro/blog/10-best-whiteboard-layout-ideas-boost-your-productivity), it provides real-time assistance and acceleration. Whether brainstorming ideas or organizing tasks, users can simply ask questions and receive immediate responses. For instance, jot down daily tasks on one page and inquire about plans for the day on another using the chatbox.\n\n\n\n![TixIkRzZgGOIrsqcfRoj1ZrH4_tQmDu27NQGaKyOR7U=](/blobs/TixIkRzZgGOIrsqcfRoj1ZrH4_tQmDu27NQGaKyOR7U=)\n\n\nRemember, while AI tools can assist in identifying potential issues, they should complement rather than replace the thorough editing and proofreading processes guided by human expertise. Together, let's strive for excellence in content creation, blending the strengths of artificial intelligence with human ingenuity. The right AI content detector tool has the potential to revolutionize your writing process and help you achieve unparalleled results. Choose wisely and unlock new possibilities for optimizing your content strategy today!\n\n\n**Check out AFFiNE – a powerful tool that can help you optimize your content strategy today! See it in action for yourself and decide if it deserves a spot on your list of must-have tools. Join us on our journey by visiting our media platforms. 🚀**\n\n\n* Official Website: [https://affine.pro/](https://affine.pro/)\n\n\n* GitHub: [https://github.com/toeverything/AFFiNE](https://github.com/toeverything/AFFiNE)\n\n\n* Discord: [https://discord.gg/Arn7TqJBvG](https://discord.gg/Arn7TqJBvG)\n\n\n* Twitter: [https://twitter.com/AffineOfficial](https://twitter.com/AffineOfficial)\n\n\n",
  "publish": true
}