{
  "title": "10 Best Time Management Tools and Techniques to Create Your Productivity in 2024",
  "authors": [
    "Xuan Pang"
  ],
  "tags": [
    "Content"
  ],
  "description": "Discover the top 10 time management tools and techniques to supercharge your productivity in 2024. Learn how to make the most of your time with these powerful strategies.",
  "created": 1705276800000,
  "updated": 1705276800000,
  "layout": "blog",
  "id": "XfJT0BPnGjFV6vFhVcJJL",
  "slug": "best-time-management-tools-techniques-create",
  "cover": "https://app.affine.pro/api/workspaces/qf73AF6vzWphbTJdN7KiX/blobs/9CpHtbMtQxZ20ABRHYqQgAO9yqYOTq5Csvk2ku0iIAw=.webp",
  "md": "---\n\n\ntitle: \"10 Best Time Management Tools and Techniques to Create Your Productivity in 2024\"\n\n\nauthor: \"Xuan Pang\"\n\n\ntags: Content\n\n\nslug: best-time-management-tools-techniques-create\n\n\ndescription: \"Discover the top 10 time management tools and techniques to supercharge your productivity in 2024. Learn how to make the most of your time with these powerful strategies.\"\n\n\ncreated: 2024-01-15\n\n\nupdated: 2024-01-15\n\n\nlayout: blog\n\n\npublish: true\n\n\n---\n\n\nIf you're eager to enhance your productivity and make the most of your valuable work hours, this article is tailored just for you. ğŸ˜Š Whether you're a freelancer seeking to maintain order within tight schedules or a project manager aiming to optimize your team's efficiency, effective time management has never been more critical. ğŸš€\n\n\n\n![9CpHtbMtQxZ20ABRHYqQgAO9yqYOTq5Csvk2ku0iIAw=](https://app.affine.pro/api/workspaces/qf73AF6vzWphbTJdN7KiX/blobs/9CpHtbMtQxZ20ABRHYqQgAO9yqYOTq5Csvk2ku0iIAw=.webp)\n\n\nWhile you can certainly find a plethora of time management tips for work, nothing beats the efficiency and precision offered by top-tier online time management tools. â°ğŸ’¼ Regardless of your work style or industry, incorporating time management apps into your routine is essential for monitoring and optimizing your workday.\n\n\n## **What Should You Look for in Time Management Software?**\n\n\n\n![4q0sFTQLten4-TY6kXhUOSTDthT9VUWAoz63RfO7Q0k=](https://app.affine.pro/api/workspaces/qf73AF6vzWphbTJdN7KiX/blobs/4q0sFTQLten4-TY6kXhUOSTDthT9VUWAoz63RfO7Q0k=.webp)\n\n\n1. **Intuitive User Interface:**Effective time management software should have an easy-to-navigate interface. Look for tools with a user-friendly design that allows you to quickly access and organize your tasks, schedules, and priorities without a steep learning curve.\n\n\n1. **Task and Project Management:**The software should provide robust task and project management features. It should enable you to create, assign, and track tasks, set deadlines, and manage dependencies, helping you stay organized and on top of your workload.\n\n\n1. **Time Tracking and Reporting:** Time management software should offer time tracking capabilities. It should allow you to record the time spent on various tasks and projects, generate reports, and gain insights into your productivity. Detailed time data helps you identify areas for improvement.\n\n\n1. **Integration and Collaboration:** Look for software that seamlessly integrates with other tools and platforms you use. Integration with calendars, email, and project management apps can streamline your workflow. Additionally, collaboration features such as shared calendars and task assignments can enhance team productivity.\n\n\n\n\n\nNow that we've outlined the criteria ğŸ“‹, let's dive into the top 10 time management tools â°âš™ï¸. These tools will supercharge your productivity and help you make the most of your time! ğŸ’ªğŸ’¼\n\n\n\n\n\n## **The 10 Best Time Management Software Available in 2023**\n\n\n## 1.[AFFiNE](https://affine.pro/)\n\n\n\n![m-dCyw47pgAR_dS7v2-wNm9fNsuClv1CdsRt9PuyBRk=](https://app.affine.pro/api/workspaces/qf73AF6vzWphbTJdN7KiX/blobs/m-dCyw47pgAR_dS7v2-wNm9fNsuClv1CdsRt9PuyBRk=.webp)\n\n\nAFFiNE is a cutting-edge time management software that is designed to assist you in organizing, managing, and cooperating on tasks, projects, and information. What sets AFFiNE apart is that it is a free and open-source program that employs offline technology to ensure that it is accessible to all users. This makes it an invaluable resource for individuals who require a comprehensive time management solution for their daily needs.\n\n\n**Key features:**\n\n\n* **Write, [Draw](https://affine.pro/blog/best-free-digital-whiteboard-apps-2023), and [Plan](https://affine.pro/blog/best-project-planning-tools-software-for-teams-2023) All-in-One:**Enjoy your all-in-one KnowledgeOS solution for effortlessly writing, drawing, and planning on a hyper-fused platform. It supports [kanban](https://affine.pro/blog/affine-080-launch-week-day3), table, rich-text paragraphs as building blocks to form pages or whiteboards. It carries out integrated processing here in document editing, data processing, or brainstorming.\n\n\n\n![crjX5_HRaAu3feQ3mQMTVmg-FqXutYjATZJpEZEMi98=](https://app.affine.pro/api/workspaces/qf73AF6vzWphbTJdN7KiX/blobs/crjX5_HRaAu3feQ3mQMTVmg-FqXutYjATZJpEZEMi98=.webp)\n\n\n* **Reliable [Offline](https://affine.pro/blog/5-best-offline-alternatives-to-notion) Capability:**We prioritize your privacy and have made the decision to provide offline support for AFFiNE. With offline support, your work is saved on your device, allowing you to make uninterrupted progress even during internet disruptions. This feature enhances productivity and ensures high-quality decision-making.\n\n\n\n![b170NZ_-DTtnErSRI_iPhSOzNlf5B9Nt2716NlXYe6Y=](https://app.affine.pro/api/workspaces/qf73AF6vzWphbTJdN7KiX/blobs/b170NZ_-DTtnErSRI_iPhSOzNlf5B9Nt2716NlXYe6Y=.webp)\n\n\n* **Privacy focussed:**AFFiNE is built with your privacy in mind and is one of our key concerns. We want you to keep control of your data, allowing you to store it as you like, where you like, while still being able to freely edit and view your data on-demand. With AFFiNE, you own your data, no matter what. With no sacrifice to collaborate and share, all your data is in your hands.\n\n\n\n![7tLzErsXRl3O-9-0m62ySSd00VYnYYtRKFaZUFit2Jg=](https://app.affine.pro/api/workspaces/qf73AF6vzWphbTJdN7KiX/blobs/7tLzErsXRl3O-9-0m62ySSd00VYnYYtRKFaZUFit2Jg=.webp)\n\n\n## 2.[ClickUp](https://clickup.com/)\n\n\n\n![1yKIgqBw9WXrac9_ECD5k7pvRoH2UdURoQx6KayezAU=](https://app.affine.pro/api/workspaces/qf73AF6vzWphbTJdN7KiX/blobs/1yKIgqBw9WXrac9_ECD5k7pvRoH2UdURoQx6KayezAU=.webp)\n\n\nManage multiple workflows, collaborate more effectively, and streamline your work into one place with ClickUp â€“ a free project management solution for teams. Whether you're new to project management apps or a seasoned user, ClickUp's customizable features can adapt to any team size. Plus, stay on top of your projects while on the go with the ClickUp mobile app.\n\n\n**Key features:**\n\n\n* ğŸ”§ Customization without code or add-ons: ClickUp offers a highly customizable workspace where you can tailor your tasks, workflows, and views to suit your specific needs. You can create custom fields, statuses, and workflows without the need for coding or additional add-ons. ğŸ› ï¸âœ¨\n\n\n* ğŸ¤ Collaboration capabilities: ClickUp excels in fostering collaboration among team members. It provides features like task assignments, commenting, and file sharing, ensuring that your team can work together seamlessly no matter where they are located. ğŸ¤—ğŸ‘¥\n\n\n* ğŸ“Š Real-time reporting: With ClickUp, you can access real-time reporting and analytics that give you insights into your projects and team's performance. Monitor progress, track key metrics, and make data-driven decisions to optimize your workflow. ğŸ“ˆğŸ“Š\n\n\n\n\n\n## 3. [Miro](https://miro.com/)\n\n\n\n![mjm8K6XuY-jJV6XcgjoXXJMvd2b1cKhCL-25ZalaM8Q=](https://app.affine.pro/api/workspaces/qf73AF6vzWphbTJdN7KiX/blobs/mjm8K6XuY-jJV6XcgjoXXJMvd2b1cKhCL-25ZalaM8Q=.webp)\n\n\nMiro is an online workspace and collaborative platform that offers a collaborative whiteboard app for effortless teamwork. It has been a trusted tool in this space for years, with an increasing range of integrations and features that people love. Whether you're in a hybrid or remote team focused on UX design or sales departments that need visual task monitoring, Miro can meet your needs. With video chat and whiteboard capabilities, team meetings become less necessary.\n\n\n**Key features:**\n\n\n* ğŸ–‹ï¸ Collaborative Whiteboarding: Miro provides a digital canvas where teams can collaborate in real-time, just like a physical whiteboard. Multiple users can brainstorm, draw diagrams, create flowcharts, and work together seamlessly, regardless of their physical location. ğŸ¤ğŸ¨\n\n\n* ğŸƒâ™‚ï¸ Agile Framework Support: Miro is designed to support agile methodologies and frameworks. Teams can use it for sprint planning, retrospectives, and visualizing agile processes like Scrum or Kanban. It offers templates and features tailored to agile workflows, making it a valuable tool for Agile teams. ğŸğŸ‹ï¸â™‚ï¸\n\n\n* ğŸ”Œ Integration Ecosystem: Miro boasts a robust integration ecosystem that allows you to connect it with a wide range of other tools and platforms. Whether it's integrating with project management software, productivity apps, or cloud storage solutions, Miro ensures that it fits seamlessly into your existing workflow. ğŸŒğŸ”—\n\n\n## 4. [Microsoft Project](https://www.microsoft.com/en-us/microsoft-365/project/project-management-software)\n\n\n\n![rk_fBcpsfL1WeZknBaukVBouwfl4-7w5NqtOw-5GhUY=](https://app.affine.pro/api/workspaces/qf73AF6vzWphbTJdN7KiX/blobs/rk_fBcpsfL1WeZknBaukVBouwfl4-7w5NqtOw-5GhUY=.webp)\n\n\nIn Microsoft Project, project managers and teams can utilize various views, but the platform lacks collaboration features. The software is commonly known by different names, including MS Project and its current official name, Project Professional. To access other Microsoft Project products, such as Project Online, Server, and for the Web, a subscription to Microsoft Project Plan is required. This service offers three pricing options with varying features.\n\n\n**Key features:**\n\n\n* ğŸ“Š Support Gantt charts and Kanban boards to plan work: Microsoft Excel offers powerful tools for project management, including the ability to create Gantt charts and Kanban boards. These visual planning tools help teams organize tasks, track progress, and manage timelines efficiently. ğŸ“…âœ…\n\n\n* ğŸ’¬ A cost-effective communication solution with Microsoft Teams: Microsoft Excel seamlessly integrates with Microsoft Teams, providing a cost-effective and collaborative communication solution for teams and organizations. You can easily share Excel files, collaborate in real-time, and conduct meetings within the Teams platform. ğŸ’¼ğŸ‘¥\n\n\n* ğŸ“ˆ Pre-built reports that can track progress, resources, programs, and portfolios: Excel includes a variety of pre-built templates and functions that enable users to create reports for tracking progress, managing resources, assessing program performance, and analyzing portfolios. These reports help businesses make informed decisions and stay on top of their objectives. ğŸ“ŠğŸ”\n\n\n\n\n\n## 5. [Asana](https://asana.com/?noredirect)\n\n\n\n![ydqTK-yAEcy3MQ_9m9YdOA1zo6fLg_rmzMQGo2Vh51E=](https://app.affine.pro/api/workspaces/qf73AF6vzWphbTJdN7KiX/blobs/ydqTK-yAEcy3MQ_9m9YdOA1zo6fLg_rmzMQGo2Vh51E=.webp)\n\n\n**Key features:**\n\n\n* Task Tracking ğŸ“‹: Asana allows users to create tasks, assign them to team members, and set due dates. This feature helps teams stay organized and ensures that everyone knows what needs to be done and when. ğŸ—“ï¸âœ…\n\n\n* Real-time Collaboration ğŸ¤: With Asana, team members can collaborate in real-time on tasks and projects. They can add comments, attachments, and updates to tasks, enabling seamless communication and fostering a collaborative work environment. ğŸ”„ğŸ’¬\n\n\n* Commenting on Tasks ğŸ’¬: Asana provides a dedicated space for users to comment on tasks, facilitate discussions, provide feedback, and address any questions or concerns. This feature promotes clear and transparent communication among team members. ğŸ’¬ğŸ“£\n\n\n\n\n\n## 6. [ProofHub](https://www.proofhub.com/)\n\n\n\n![fSnF9uJw1GD_z4KkiTiITuy5cHvlugzQi9eSuZUrERk=](https://app.affine.pro/api/workspaces/qf73AF6vzWphbTJdN7KiX/blobs/fSnF9uJw1GD_z4KkiTiITuy5cHvlugzQi9eSuZUrERk=.webp)\n\n\n**Key features:**\n\n\n* To-Do Lists ğŸ“: ProofHub provides a comprehensive task management system, allowing users to create and organize to-do lists. This feature enables teams to stay organized, track progress, and efficiently manage their tasks. ğŸ—‚ï¸ğŸ“Š\n\n\n* Custom Workflows and Kanban Boards ğŸ”„: ProofHub allows users to create custom workflows and set up kanban boards. This feature enables teams to visualize their workflows, track work progress, and easily manage tasks through different stages of completion. ğŸ¯ğŸ“‹\n\n\n* Gantt Charts ğŸ“…: ProofHub offers Gantt charts for project planning and scheduling. This visual representation of tasks and their dependencies helps teams effectively manage timelines, allocate resources, and track project progress. ğŸ“Šâ³\n\n\n\n\n\n## 7. [Monday.com](https://monday.com/)\n\n\n\n![wykgqQp_M4er492onizMjlV0_C0tCqVXjQuUgJ9pBXg=](https://app.affine.pro/api/workspaces/qf73AF6vzWphbTJdN7KiX/blobs/wykgqQp_M4er492onizMjlV0_C0tCqVXjQuUgJ9pBXg=.webp)\n\n\n**Key features:**\n\n\n* Intuitive Project Management ğŸš€: Monday.com provides an intuitive and visual platform for managing projects. Teams can create customizable boards, track tasks, and collaborate seamlessly, promoting transparency and productivity. ğŸ“ŠğŸ‘¥\n\n\n* Workflow Automation ğŸ¤–: Monday.com offers powerful automation capabilities to streamline repetitive tasks and workflows. Users can automate notifications, assignments, and updates, saving time and reducing manual effort. â°âœ‰ï¸\n\n\n* Extensive Integrations ğŸŒ: Monday.com integrates seamlessly with various popular tools and platforms, such as Slack, Google Drive, and Trello. This allows teams to centralize information, enhance collaboration, and optimize their workflow by connecting their favorite tools. ğŸ› ï¸ğŸ”—\n\n\n\n\n\n## 8. [Trello](https://trello.com/)\n\n\n\n![RJ1GiFLJMtnQK9vFEqaH8E4bSUpMQw0Kard9CvSEV1k=](https://app.affine.pro/api/workspaces/qf73AF6vzWphbTJdN7KiX/blobs/RJ1GiFLJMtnQK9vFEqaH8E4bSUpMQw0Kard9CvSEV1k=.webp)\n\n\n**Key features:**\n\n\n* Set Reminders â°: Trello allows users to set reminders for tasks and deadlines. This feature ensures that important dates and tasks are not overlooked, helping teams stay organized and on track. ğŸ“†ğŸ””\n\n\n* Kanban Board View ğŸ“Š: Trello utilizes a Kanban board view, where tasks are represented as cards that can be moved across different lists or stages. This visual approach provides a clear overview of the workflow and allows teams to track the progress of tasks at a glance. ğŸ“‚ğŸ‘€\n\n\n* Assign Tasks ğŸ‘¤: Trello enables task assignments to specific team members. Users can easily assign tasks to individuals, promoting accountability and facilitating collaboration within the team. ğŸ¤âœ…\n\n\n\n\n\n## 9. [Wrike](https://trial.wrike.com/all-in-one-collaboration-project-management-software-va2/?targetID=kwd-299868607390&gclsrc=aw.ds&ga_campaign=20564950253&ga_adgroup=152924891199&ga_keyword=project%20managemnet%20software&gad=1&gclid=EAIaIQobChMI4rutjqrIgQMVLzHUAR0_egJXEAAYAyAAEgIWU_D_BwE)\n\n\n\n![PDCtAV5DyijnE0J4SYZhWGv0K86fO9i-UAw8fvc4xUY=](https://app.affine.pro/api/workspaces/qf73AF6vzWphbTJdN7KiX/blobs/PDCtAV5DyijnE0J4SYZhWGv0K86fO9i-UAw8fvc4xUY=.webp)\n\n\n**Key features:**\n\n\n* Customizable Dashboards ğŸ“Š: Wrike allows users to create customizable dashboards to visualize and track project progress. Teams can personalize their dashboards by adding widgets, charts, and project overviews, providing a centralized view of their tasks and milestones. ğŸ“ˆğŸ‘ï¸\n\n\n* Workload Charts for Resource Management ğŸ“Š: Wrike provides workload charts that help teams effectively manage resources and allocate work. Users can view team members' workloads, identify potential bottlenecks, and balance workload distribution to optimize productivity and meet project deadlines. âš–ï¸ğŸ‘¥\n\n\n* Time Tracking Support â±ï¸: Wrike supports time tracking functionality, allowing users to track and log the time spent on tasks and projects. This feature helps monitor project progress, measure productivity, and accurately bill clients or allocate resources. â²ï¸ğŸ“ˆ\n\n\n\n\n\n## 10.[Notion](http://www.notion.so)\n\n\n\n![FVGBtGK-f4lc9JTiSgFC0Ny6qzuDU2IrG5Y1HFRcqmo=](https://app.affine.pro/api/workspaces/qf73AF6vzWphbTJdN7KiX/blobs/FVGBtGK-f4lc9JTiSgFC0Ny6qzuDU2IrG5Y1HFRcqmo=.webp)\n\n\n**Key features:**\n\n\n* Public View ğŸ”“: Notion allows users to make their documents publicly accessible through a public view. This feature enables teams to share information, collaborate with external stakeholders, or publish content for public consumption. ğŸŒğŸ“„\n\n\n* Real-time Collaboration ğŸ¤: Notion facilitates real-time collaboration on pages and databases. Multiple team members can work together simultaneously, making edits, adding comments, and collaborating seamlessly, enhancing productivity and teamwork. ğŸ”„ğŸ’¬\n\n\n* Templates for Various Use Cases ğŸ“‹: Notion provides a wide range of templates for various purposes such as HR, design, and project management. These templates offer pre-designed structures and layouts that users can customize to fit their specific needs, saving time and streamlining workflows. ğŸ“„âœï¸\n\n\n### Which time management tool offers the best solution?\n\n\nWhile each of the daily time management tools discussed offers its own unique and appealing features, we encourage users to choose the ideal option based on their specific needs and pain points. However, with a humble perspective, we still propose that AFFiNE emerges as the ultimate winner in this evaluation, providing a comprehensive and versatile solution for managing daily tasks and goals, catering to a wide range of user requirements.\n\n\nCurrently,**AFFiNE**has released its[stable version](https://affine.pro/download), but we are continuing to build to a more feature-rich and stable build.**Come and join us on our journey over on our media platforms.**\n\n\n* Official Website:[https://affine.pro/](https://affine.pro/)\n\n\n* GitHub:[https://github.com/toeverything/AFFiNE](https://github.com/toeverything/AFFiNE)\n\n\n* Discord:[https://discord.gg/Arn7TqJBvG](https://discord.gg/Arn7TqJBvG)\n\n\n* Twitter:[https://twitter.com/AffineOfficial](https://twitter.com/AffineOfficial)\n\n\n\n\n\nWith top-notch software like AFFiNE at your disposal along with its diverse range of templates and user-friendly features, creating concept maps has never been easier or more effective. Commence concept mapping by using AFFiNE's user-friendly tool. Presently,**AFFiNE**has launched its[**Stable Version**](https://affine.pro/download), with ongoing efforts to develop a more comprehensive and dependable iteration. Join us on our voyage through our social media channels and be part of the experience.**Come and join us on our journey over on our media platforms.** ğŸš€\n\n\n* Official Website:[https://affine.pro/](https://affine.pro/)\n\n\n* GitHub:[https://github.com/toeverything/AFFiNE](https://github.com/toeverything/AFFiNE)\n\n\n* Discord:[https://discord.gg/Arn7TqJBvG](https://discord.gg/Arn7TqJBvG)\n\n\n* Twitter:[https://twitter.com/AffineOfficial](https://twitter.com/AffineOfficial)\n\n\n",
  "publish": true
}