{
  "title": "10 Best Free Social Media Scheduler Tools to Empower Your Workflow (Free and Paid)",
  "authors": [
    "Xuan Pang"
  ],
  "tags": [
    "Content"
  ],
  "description": "Supercharge your social media workflow with our curated list of the 10 best free social media scheduler tools. Explore both free and paid options to optimize your scheduling and enhance your online presence effortlessly.",
  "created": 1707350400000,
  "updated": 1707350400000,
  "layout": "blog",
  "id": "MoXbjrBAhb6kBnI613Y4n",
  "slug": "best-free-social-media-scheduler-tools-to-empower-workflow",
  "cover": "https://app.affine.pro/api/workspaces/qf73AF6vzWphbTJdN7KiX/blobs/IHUFaFq-ngoDJpsKrYy0h_WRbC3v5o5f3pEhlmMqmiU=",
  "md": "---\n\n\ntitle: \"10 Best Free Social Media Scheduler Tools to Empower Your Workflow (Free and Paid)\"\n\n\nauthor: \"Xuan Pang\"\n\n\ntags: Content\n\n\nslug: best-free-social-media-scheduler-tools-to-empower-workflow\n\n\ndescription: \"Supercharge your social media workflow with our curated list of the 10 best free social media scheduler tools. Explore both free and paid options to optimize your scheduling and enhance your online presence effortlessly.\"\n\n\ncreated: 2024-02-08\n\n\nupdated: 2024-02-08\n\n\nlayout: blog\n\n\npublish: true\n\n\n---\n\n\n\n![IHUFaFq-ngoDJpsKrYy0h_WRbC3v5o5f3pEhlmMqmiU=](https://app.affine.pro/api/workspaces/qf73AF6vzWphbTJdN7KiX/blobs/IHUFaFq-ngoDJpsKrYy0h_WRbC3v5o5f3pEhlmMqmiU=)\n\n\nEver felt the **pressure** of posting at the [perfect time](https://affine.pro/blog/top-10-best-time-management-software-tools-2023) or **struggled** to keep up with content creation?\n\n\nEnter social media scheduling tools ‚Äì your newfound allies. üïí‚ú® In this starting guide, we'll unravel the simplicity and power behind these tools, making your social media experience a whole lot smoother. Let's dive in! üåäüöÄ\n\n\n# **What is a social media scheduling tool?**\n\n\n\n![Lev4ndbJM9vpqk-xcEcGscs7Lady0c4obhVo0RLqIhE=](https://app.affine.pro/api/workspaces/qf73AF6vzWphbTJdN7KiX/blobs/Lev4ndbJM9vpqk-xcEcGscs7Lady0c4obhVo0RLqIhE=)\n\n\nA social media scheduling tool is a software solution that empowers social marketers to craft content ahead of time and set it for automated publication at designated times.\n\n\nWhile most [social media](https://affine.pro/blog/how-to-introduce-new-business-social-media-strategic-steps-examples) platforms offer basic native scheduling and publishing options, third-party tools offer enhanced flexibility, functionality, and the capability to schedule content across multiple social media channels using a unified dashboard.\n\n\nMoreover, these tools not only streamline the scheduling process but also contribute to overall content creation [workflow efficiency](https://affine.pro/blog/10-best-flowchart-software-tools-2023-features-pricing), providing additional time and resources for social media managers to focus on other aspects of their responsibilities.\n\n\n# **Why should we use a social media scheduling tool?**\n\n\n\n![zhhaclU7p14rVe4xvXRsddOd9EWZ-RDSX1loJO6GVY0=](https://app.affine.pro/api/workspaces/qf73AF6vzWphbTJdN7KiX/blobs/zhhaclU7p14rVe4xvXRsddOd9EWZ-RDSX1loJO6GVY0=)\n\n\n1. **Efficient [Time Management](https://affine.pro/blog/best-time-management-tools-techniques-2023):** A social media scheduling tool allows you to plan and schedule posts in advance. This efficiency ensures that you spend less time on day-to-day posting, freeing up valuable time for other strategic tasks.\n\n\n1. **Consistent Posting [Schedule](https://affine.pro/blog/top-10-best-free-digital-planner-apps-2023):** Maintaining a consistent presence on social media is vital for audience engagement. Scheduling tools enable you to adhere to a regular posting schedule, keeping your audience engaged and anticipating your content.\n\n\n1. **Cross-Platform Coordination:** With users spread across various platforms, a scheduling tool enables you to coordinate and schedule posts across multiple social media channels simultaneously. This ensures a cohesive and [synchronized approach](https://affine.pro/blog/top-asynchronous-communication-tools-free) to content distribution.\n\n\n1. **Insights and Analytics:** Many scheduling tools come equipped with analytics features, providing insights into post performance. By analyzing data on engagement, reach, and audience behavior, you can refine your strategy for better results over time.\n\n\n# **10 social media scheduling tool (Free and Paid)**\n\n\n### 1. [AFFiNE](https://www.affine.pro)\n\n\n\n![g69qeyfWg_3aSDHG9JFKXRzHxpXg_Yt1zTLh9jOgBdk=](https://app.affine.pro/api/workspaces/qf73AF6vzWphbTJdN7KiX/blobs/g69qeyfWg_3aSDHG9JFKXRzHxpXg_Yt1zTLh9jOgBdk=)\n\n\nThe [Social Media](https://affine.pro/blog/how-to-introduce-new-business-social-media-strategic-steps-examples) scheduling tool [AFFiNE](https://www.affine.pro) is like your personal assistant for managing your social media game. It's a pre-designed framework that helps you plan out what to post, when, and where across your social platforms. This template simplifies the whole process, making it easy to stay organized, keep track of your content, and ensure that you're sharing the right stuff at the right times. It's your secret weapon for a more strategic and efficient social media presence.\n\n\n[>>> Get this template now](https://app.affine.pro)\n\n\n### 2. [Canva](https://www.canva.com/)\n\n\n\n![QtPb21z6IKj-dK-Xs7sw7dJP-OQai4-Gh4Nx6gFbBhQ=](https://app.affine.pro/api/workspaces/qf73AF6vzWphbTJdN7KiX/blobs/QtPb21z6IKj-dK-Xs7sw7dJP-OQai4-Gh4Nx6gFbBhQ=)\n\n\nYou already know Canva is the design-savvy social media manager‚Äôs best friend. But did you know it now includes a social media scheduler and [planner](https://affine.pro/blog/top-10-best-free-digital-planner-apps-2023)? With posting capabilities for Facebook, Instagram, Twitter, and Linkedin, Canva Pro lets you plan and schedule your content effortlessly. Plus, within the Canva Pro dashboard, you get a comprehensive view of your performance metrics ‚Äì track engagement, likes, clicks, impressions, and more. It's design and social media management, all in one place!\n\n\n### 3. [Tweetdeck](https://tweetdeck.twitter.com/)\n\n\n\n![KZLp53ZwUwlF1gQ4gbc9yzBtbq6sGb_WGQNmsc0gofU=](https://app.affine.pro/api/workspaces/qf73AF6vzWphbTJdN7KiX/blobs/KZLp53ZwUwlF1gQ4gbc9yzBtbq6sGb_WGQNmsc0gofU=)\n\n\nTweetDeck, a native scheduling tool, empowers you to effortlessly schedule content across multiple Twitter accounts. While its functionality is limited to [Twitter accounts](https://twitter.com/login) only (no other social platforms are supported), it excels in streamlining the scheduling process. Simply log in using your primary Twitter username and password, and seamlessly add any additional accounts you manage. With TweetDeck, managing and scheduling tweets for multiple accounts becomes a breeze.\n\n\n### 4. [ClickUp](https://clickup.com/)\n\n\n\n![V6bVon2OAI92bzsD8kivpb67f1Tm_ls5M395oRzry3k=](https://app.affine.pro/api/workspaces/qf73AF6vzWphbTJdN7KiX/blobs/V6bVon2OAI92bzsD8kivpb67f1Tm_ls5M395oRzry3k=)\n\n\nSince ClickUp offers a simple and user-friendly interface, it makes it easy to drag and drop files, add comments, and track the progress of your content. With the [ClickUp Social Media Posts Template](https://clickup.com/templates/social-media-t-182377084), you‚Äôll be able to plan and organize your social media posts and content, publish status, and more. Additionally, with this template, you can easily track the performance of your social media campaigns and identify areas that need improvement to keep you on top of your social media game and marketing campaigns.\n\n\n### 5. [Mailchimp](https://mailchimp.com/?currency=CAD)\n\n\n\n![mnRczkM982eBloiN1E-UbfpBh9_RtCqqs2ZhBd3sacI=](https://app.affine.pro/api/workspaces/qf73AF6vzWphbTJdN7KiX/blobs/mnRczkM982eBloiN1E-UbfpBh9_RtCqqs2ZhBd3sacI=)\n\n\nHold up, [Mailchimp](https://mailchimp.com/) isn't just about emails anymore! While it's a powerhouse for email campaigns, here's the scoop: Mailchimp has spread its wings to become an excellent tool for scheduling social media posts too. Yup, you heard it right! Seamlessly integrating with Twitter, [Facebook](https://www.facebook.com/), and Instagram, Mailchimp allows you to craft and schedule content for these platforms right from its user-friendly interface.\n\n\n### 6.[Hootsuite](https://influencermarketinghub.com/hootsuite/)\n\n\n\n![RFWVsss5beEl-O209uPYCvEBe-Lw56Cquuqi1mcf_Y8=](https://app.affine.pro/api/workspaces/qf73AF6vzWphbTJdN7KiX/blobs/RFWVsss5beEl-O209uPYCvEBe-Lw56Cquuqi1mcf_Y8=)\n\n\nHootsuite is your [one-stop-shop for all things scheduling](https://blog.hootsuite.com/social-media-marketing-tools/). Whether you're into auto-posting, planning in bulk, or seeking tailored suggestions based on your social media analytics, Hootsuite's got you covered. It's not just a scheduler; it's your personal assistant in optimizing posting times for the best results. Hootsuite: where scheduling meets sophistication! üï∞Ô∏èüöÄ\n\n\n### 7. [Adobe Express Content Scheduler (Previously ContentCal)](https://influencermarketinghub.com/contentcal/)\n\n\n\n![PmrMubMsRRPCb2yPByAoar0ETqtJXegERs0REtPsP1E=](https://app.affine.pro/api/workspaces/qf73AF6vzWphbTJdN7KiX/blobs/PmrMubMsRRPCb2yPByAoar0ETqtJXegERs0REtPsP1E=)\n\n\nAdobe Express Content Scheduler is a social media content planning and scheduling tool. It provides users with a centralized platform to plan, create, and schedule social media posts across various platforms. Features typically include a content calendar, [collaborative tools](https://affine.pro/blog/affine-080-launch-week-day5) for team coordination, and analytics to measure the performance of social media content.\n\n\n### 8.[CoSchedule](https://influencermarketinghub.com/coschedule/)\n\n\n\n![35IDRy8HZvO0hrfcbiNQ3-ujLSqQoEOy0US8tDgbymc=](https://app.affine.pro/api/workspaces/qf73AF6vzWphbTJdN7KiX/blobs/35IDRy8HZvO0hrfcbiNQ3-ujLSqQoEOy0US8tDgbymc=)\n\n\nCoSchedule places its primary focus on content marketing, making it an ideal choice for businesses heavily invested in blog content.\n\n\nSetting itself apart from other tools, CoSchedule generously provides three free content calendar templates. Beyond the standard content calendar, it extends its support with an [email marketing calendar template](https://coschedule.com/blog/annual-content-calendar-template), aiding in meticulous planning before each email campaign.\n\n\n### 9.[HubSpot](https://www.hubspot.com/)\n\n\n\n![cZz3RTBgqir-C3rt2zPXOCts_8zXERs0kSD-CZD-_bc=](https://app.affine.pro/api/workspaces/qf73AF6vzWphbTJdN7KiX/blobs/cZz3RTBgqir-C3rt2zPXOCts_8zXERs0kSD-CZD-_bc=)\n\n\nHubSpot stands out as an all-encompassing marketing platform, incorporating features like email marketing and CRM functionality, making it a comprehensive solution for businesses. As part of its offerings, HubSpot generously provides a free downloadable [social media content calendar template](https://offers.hubspot.com/startups/thank-you/startup-social-content-calendar?_ga=2.8150450.1850661801.1569879294-15826&hubs_offer=offers.hubspot.com%2Fstartups%2Fsocial-media-content-template-for-startups&hubs_post=blog.hubspot.com%2Fmarketing%2Fsocial-media-calendar-tools&submissionGuid=84c17d1e-ef28-4e74-b787-a6ff19329a0c) on its website.\n\n\nSmall Business Trends, an esteemed online publication dedicated to small business owners, generously shares a practical template designed specifically for small businesses. This [template](https://smallbiztrends.com/social-media-calendar-template-business) is crafted based on the same calendar format utilized internally by the publication.\n\n\n### 10.[Trello](https://trello.com/)\n\n\n\n![_8DibxM3YUm5heEyeqZ-jE2g-z7NJ9n9OeQm1lvBBoQ=](https://app.affine.pro/api/workspaces/qf73AF6vzWphbTJdN7KiX/blobs/_8DibxM3YUm5heEyeqZ-jE2g-z7NJ9n9OeQm1lvBBoQ=)\n\n\nTrello remains one of the most popular tools for [project management](https://affine.pro/blog/10-best-free-smart-sheet-alternatives-for-project-management-2023). It is especially great if you work as part of a bigger team as you can easily include due dates and add comments to ensure everyone in your marketing team is on the same page. Additionally, with the help of boards and cards, you can assign a task to a specific team member and define the steps needed for individual projects which can help you to organize and prioritize your posts.\n\n\n# **Best Social Media Scheduler Tool Recommendation**\n\n\n\n![rFblyTM87Ji6lT6fJskjQPcJ33A7sMeFTcWEGaTjxu8=](https://app.affine.pro/api/workspaces/qf73AF6vzWphbTJdN7KiX/blobs/rFblyTM87Ji6lT6fJskjQPcJ33A7sMeFTcWEGaTjxu8=)\n\n\n[AFFiNE](https://www.affine.pro)is a cutting-edge social media scheduler app that is designed to assist you in organizing, managing, and cooperating on tasks, projects, and information when trying to do them in real-time. What sets AFFiNE apart is that it is a free and [open-source](https://affine.pro/blog/tips-where-and-how-contribute-open-source-projects) program that employs offline technology to ensure that it is accessible to all users.\n\n\n**Key features:**\n\n\n* **[Diversified templates](https://affine.pro/blog/best-free-whiteboard-layout-ideas-organization):** At AFFiNE, we provide a variety of templates, including social media content calendar and SMART, to enhance the agility and efficiency of your workflow. Utilize our range of templates to streamline processes, improve collaboration, and achieve optimal results in your projects.\n\n\n\n![B4wYA5uuE5zOevsBVSjMP6G2fj3ji9rR_YmyvfoeEi0=](https://app.affine.pro/api/workspaces/qf73AF6vzWphbTJdN7KiX/blobs/B4wYA5uuE5zOevsBVSjMP6G2fj3ji9rR_YmyvfoeEi0=)\n\n\n* **[Collaborative Capabilities:](https://affine.pro/blog/affine-0-10-0-launch-week-day-5-5-stable-with-cloud-support-finally-available-to-every-pro-in-your-team)** For group work, the app should have collaborative features, making it easy to share and coordinate work with others in your group work. For more details, please go to latest launch week blog: [Introduction to AFFiNE's Cloud](https://affine.pro/blog/affine-0-10-0-launch-week-day-5-5-stable-with-cloud-support-finally-available-to-every-pro-in-your-team).\n\n\n  \n![71MN7zgKOg2C73idwSU66YEnVUK8x41Jqwwe2z9CiPU=](https://app.affine.pro/api/workspaces/qf73AF6vzWphbTJdN7KiX/blobs/71MN7zgKOg2C73idwSU66YEnVUK8x41Jqwwe2z9CiPU=)\n\n\n* **Write, [Draw](https://affine.pro/blog/best-free-digital-whiteboard-apps-2023), and [Plan](https://affine.pro/blog/best-project-planning-tools-software-for-teams-2023) All-in-One:** Enjoy your all-in-one KnowledgeOS solution for effortlessly writing, drawing, and planning on a hyper-fused platform. It supports [kanban](https://affine.pro/blog/affine-080-launch-week-day3), table, rich-text paragraphs as building blocks to form pages or whiteboards. It carries out integrated processing here in document editing, data processing, or brainstorming.\n\n\n\n![O88V12dZ7eALpdMD8-6eyyfRec5yZyWiQxCnvNEb3r0=](https://app.affine.pro/api/workspaces/qf73AF6vzWphbTJdN7KiX/blobs/O88V12dZ7eALpdMD8-6eyyfRec5yZyWiQxCnvNEb3r0=)\n\n\n* **[Offline Accessibility](https://affine.pro/blog/5-best-offline-alternatives-to-notion):** The best asynchronous communication app should allow users to access their essential details offline. This feature is particularly valuable when going outside with limited internet connectivity.\n\n\n\n![7tLzErsXRl3O-9-0m62ySSd00VYnYYtRKFaZUFit2Jg=](https://app.affine.pro/api/workspaces/qf73AF6vzWphbTJdN7KiX/blobs/7tLzErsXRl3O-9-0m62ySSd00VYnYYtRKFaZUFit2Jg=)\n\n\nCurrently, **AFFiNE** has released its [stable version](https://affine.pro/download), but we are continuing to build to a more feature-rich and stable build. **Come and join us on our journey over on our media platforms.**\n\n\n* Official Website: [https://affine.pro/](https://affine.pro/)\n\n\n* GitHub: [https://github.com/toeverything/AFFiNE](https://github.com/toeverything/AFFiNE)\n\n\n* Twitter: [https://twitter.com/AffineOfficial](https://twitter.com/AffineOfficial)\n\n\n* Community: [https://community.affine.pro/home](https://community.affine.pro/home)\n\n\n* Discord: [https://discord.gg/Arn7TqJBvG](https://discord.gg/Arn7TqJBvG)\n\n\n* Telegram: [https://t.me/affineworkos](https://t.me/affineworkos)\n\n\n\n\n\n\n\n\n\n\n\n",
  "publish": true
}