{
  "title": "10 Best Free Employee Performance Review Templates & Examples in 2024",
  "authors": [
    "Xuan Pang"
  ],
  "tags": [
    "Content"
  ],
  "description": "Discover the top 10 best free employee performance review templates and examples for 2024, along with useful tips to enhance your review process.",
  "created": 1690675200000,
  "updated": 1704153600000,
  "layout": "blog",
  "id": "BO5cRbqs34",
  "slug": "best-free-employee-performance-review-templates-examples-2023",
  "cover": "/blobs/7dkSdAWmRmWnj-RO9YsvDjIkR0nWxw-zSUsNT2_ABFE=",
  "md": "---\n\n\ntitle: \"10 Best Free Employee Performance Review Templates & Examples in 2024\"\n\n\nauthor: Xuan Pang\n\n\ntags: Content\n\n\nslug: best-free-employee-performance-review-templates-examples-2023\n\n\ndescription: Discover the top 10 best free employee performance review templates and examples for 2024, along with useful tips to enhance your review process.\n\n\ncreated: 2023-07-30\n\n\nupdated: 2024-01-02\n\n\nlayout: blog\n\n\npublish: true\n\n\n---\n\n\n**Are you struggling to streamline your employee performance evaluation process?**\n\n\n**Do you find it challenging to effectively assess your team's progress and provide valuable feedback?**\n\n\n**Worry no more!** We understand the importance of making the employee performance evaluation process seamless and insightful. That's why we've gathered the 10 best free employee performance review templates and examples for 2024 to simplify your journey towards better performance management. Let's get started!\n\n\n## **What is a Performance Review Template?**\n\n\n**A Performance Review Template** is a structured framework utilized in employee performance management to conduct thorough and objective evaluations. It acts as a guide for managers and HR professionals, outlining predetermined criteria and key performance indicators tailored to specific job roles. This allows for fair and consistent assessments of an employee's accomplishments, strengths, areas for improvement, and contributions to the organization.\n\n\n\n![7dkSdAWmRmWnj-RO9YsvDjIkR0nWxw-zSUsNT2_ABFE=](/blobs/7dkSdAWmRmWnj-RO9YsvDjIkR0nWxw-zSUsNT2_ABFE=)\n\n\n## **What makes a good employee performance review template?**\n\n\n\n![SS23pOcfiyhzrweGgXMJ6d_fWSqimm8Twbr7Wqjom14=](/blobs/SS23pOcfiyhzrweGgXMJ6d_fWSqimm8Twbr7Wqjom14=)\n\n\n1. Well-defined Criteria: The template should outline well-defined performance criteria relevant to the employee's role and responsibilities. This ensures that the evaluation is fair, consistent, and aligned with the organization's objectives.\n\n\n1. Balanced Assessment: A good template includes a balanced mix of quantitative and qualitative measures to assess both tangible results and behavioral competencies. This provides a comprehensive view of the employee's performance.\n\n\n1. Goal-oriented: The template should link the employee's performance to established goals and objectives, emphasizing progress and achievements toward these targets.\n\n\n1. Constructive Feedback: It should offer space for constructive feedback, allowing managers to provide specific comments on strengths, areas for improvement, and actionable recommendations for growth.\n\n\n## **10 Free Employee Performance Review Templates & Examples**\n\n\n### **Template 1: Simple performance review**\n\n\n\n![vh_QUP1nafCwTMmJIZZKyT6MIT6sOhAjT9yCXxU0nds=](/blobs/vh_QUP1nafCwTMmJIZZKyT6MIT6sOhAjT9yCXxU0nds=)\n\n\n**The simple Employee Performance Review Template** offers a streamlined approach for assessing an employee's progress and contributions. It focuses on performance goals, job responsibilities, strengths, and areas for improvement. It acknowledges achievements, encourages professional development, and includes self-assessment for a well-rounded evaluation.  [Get the template <<<](https://community.affine.pro/home)\n\n\n**Review frequency:** Biannually or quarterly\n\n\n### **Template 2: Monthly performance review**\n\n\n\n![-OtkwItDubVgTQh8o-Amdi_e7bty0094kKRgEQoHr00=](/blobs/-OtkwItDubVgTQh8o-Amdi_e7bty0094kKRgEQoHr00=)\n\n\n**The Monthly Employee Performance Review Template** offers a comprehensive evaluation of an employee's progress, goals, and competencies. Conducted on a monthly basis, this review emphasizes real-time feedback, strengths, areas for improvement, and accomplishments.\n\n\n**Review Frequency:** Monthly\n\n\n### **Template 3: Mid-year performance review**\n\n\n\n![Jv99MVv_gdOLtvT2fcTUleLkFQS7kQ9fb9wnfulmjGc=](/blobs/Jv99MVv_gdOLtvT2fcTUleLkFQS7kQ9fb9wnfulmjGc=)\n\n\n**The Mid-year Performance Review Template** offers a comprehensive evaluation of an employee's progress and contributions. Conducted at the midpoint of the year, this review emphasizes goal achievements, strengths, areas for growth, and noteworthy accomplishments.\n\n\n**Review Frequency:** Mid-year (Every six months)\n\n\n### **Template 4: Quarterly performance review**\n\n\n\n![lGa1AseKTs9wf3-3FiQwX0S3o1dlrEZxAZs4rKZ3L0w=](/blobs/lGa1AseKTs9wf3-3FiQwX0S3o1dlrEZxAZs4rKZ3L0w=)\n\n\n**The Quarterly Performance Review Template** provides a thorough assessment of an employee's achievements, objectives, and competencies. Conducted quarterly, this review enables a more comprehensive evaluation, emphasizing goal progress, strengths, areas for development, and notable contributions.\n\n\n**Review Frequency:** Quarterly\n\n\n### **Template 5: 30-60-90 performance review**\n\n\n\n![6YH-urQMRuIPPEQ8If84lE6Kx7q1aJ-Gxsk90gc7ZKw=](/blobs/6YH-urQMRuIPPEQ8If84lE6Kx7q1aJ-Gxsk90gc7ZKw=)\n\n\n**The 30-60-90 Performance Review Template** offers a structured assessment of an employee's progress during their first three months in a new role. Conducted at these specific intervals, the review gauges early achievements, learning curves, and adaptability.\n\n\n**Review Frequency:** 30 days, 60 days, and 90 days from the employee's start date.\n\n\n### **Template 6: Team performance review**\n\n\n\n![Om45N-PI1zTQBCwDjpNIwa_jr8MoOzSCwPkNgaVwQhc=](/blobs/Om45N-PI1zTQBCwDjpNIwa_jr8MoOzSCwPkNgaVwQhc=)\n\n\n**The Team Performance Review** evaluates the collective performance and collaboration within a team. This review assesses the team's achievements, communication, problem-solving, and overall synergy. It identifies areas of success and areas for improvement to enhance team dynamics, productivity, and effectiveness.  [Get the template <<<](https://community.affine.pro/home)\n\n\n**Review Frequency:** The Team Performance Review can be conducted regularly, such as quarterly or semi-annually, to monitor progress and adapt to changing team dynamics.\n\n\n### **Template 7: Goal setting review**\n\n\n\n![8pFUhLmWHJ8WKY5kqGJxOJ9F104aO7Y1NWLlBZQdleA=](/blobs/8pFUhLmWHJ8WKY5kqGJxOJ9F104aO7Y1NWLlBZQdleA=)\n\n\n**The Goal Setting Review** is a focused evaluation that assesses an employee's progress towards achieving their predefined objectives. This review emphasizes goal alignment, milestones, and the employee's efforts in reaching targets.\n\n\n**Review Frequency:** The Goal Setting Review is typically conducted at regular intervals, such as quarterly or annually, to track progress and align future objectives.\n\n\n### **Template 8: Performance improvement review**\n\n\n\n![7Mwe9t5TNccODslA-XRgvLrNgMx8hgJ_QEGFooroGKM=](/blobs/7Mwe9t5TNccODslA-XRgvLrNgMx8hgJ_QEGFooroGKM=)\n\n\n**The Performance Improvement Review** is a strategic evaluation that identifies areas requiring enhancement in an employee's performance. This review aims to address performance gaps, set clear improvement goals, and implement tailored action plans.\n\n\n**Review Frequency:** The Performance Improvement Review is initiated when performance concerns arise or as needed based on individual circumstances, ensuring timely support and progress monitoring.\n\n\n### **Template 9: Self evaluation review**\n\n\n\n![ZPi14O4JqiNaS9bNiGgyiQZPCp7CVOEsbKMoK7Ze0Cg=](/blobs/ZPi14O4JqiNaS9bNiGgyiQZPCp7CVOEsbKMoK7Ze0Cg=)\n\n\n**The Self-Evaluation Review** is a reflective process where employees assess their own performance and accomplishments. This review encourages employees to evaluate their strengths, areas for growth, and contributions to the team or organization.\n\n\n**Review Frequency:** The Self-Evaluation Review can be conducted periodically, aligned with regular performance review cycles, ensuring employees have opportunities to reflect and set goals for continuous improvement.\n\n\n### **Template 10: Year-end performance review**\n\n\n\n![xkoZfVhHAddGY-TlMUghp2Zm9o7RB4jbpxoNbtXZjAA=](/blobs/xkoZfVhHAddGY-TlMUghp2Zm9o7RB4jbpxoNbtXZjAA=)\n\n\n**The Year-End Performance Review** is a comprehensive assessment of an employee's achievements and growth throughout the year. This review examines goal attainment, competencies, strengths, and areas for development. It provides a holistic evaluation of the employee's contributions to the organization and offers valuable feedback to guide future performance.  [Get the template <<<](https://community.affine.pro/home)\n\n\n**Review Frequency:** The Year-End Performance Review is conducted annually, typically towards the end of the calendar year, to summarize the employee's progress and align objectives for the upcoming year.\n\n\nOut of the numerous employee performance review templates in common use, which one captures your preference? To cater to your specific requirements, allow me to introduce you to a highly recommended template creator: **AFFiNE**. With **AFFiNE**, you can easily tailor the template to suit your unique needs and streamline the review process effectivelyðŸ‘‡.\n\n\n## **Try AFFiNE**\n\n\n\n![oGr_xp3WYpqHMUc5_zIe6RiJH6UMR9iNRJ3p1Ha1g7s=](/blobs/oGr_xp3WYpqHMUc5_zIe6RiJH6UMR9iNRJ3p1Ha1g7s=)\n\n\n[AFFiNE](https://affine.pro/) is an innovative and comprehensive task management software designed to help you organize, manage, and collaborate on tasks, projects, and information. As a next-generation knowledge base, AFFiNE combines the best features of popular apps like Notion and Miro into one powerful, flexible, and user-friendly platform. It focuses on **data security, privacy, and collaboration**, making it the perfect choice for managing your daily plans, personal knowledge repository, and team projects.\n\n\n**Key features:**\n\n\n1. Local-first design: AFFiNE prioritizes data security and privacy, ensuring your data remains stored on your local device unless you actively delete it.\n\n\n1. **Advanced collaboration capabilities:** By using [AFFiNE Cloud](https://affine.pro/blog/affine-070-launch-week-day5), you can invite friends or colleagues to become collaborators in your workspace, engage in real-time multi-person editing, and share your workspaces with others.\n\n\n1. Open-source: As an open-source app, you can access AFFiNEâ€™s code, allowing for customization and the ability to deploy the server on your own computer or data centre. Here are some quick views of what you can do with AFFiNE core features\n\n\n1. **[Database](https://affine.pro/blog/affine-070-launch-week-day3):** Easily create, organize, and track your daily tasks like never before. Say goodbye to complex processes and welcome an unprecedented ease-of-use way.\n\n\n1. **Powerful [Edgeless Mode](https://affine.pro/blog/affine-070-launch-week-day4):** Easily switch between Page mode for structured document creation and Whiteboard mode for the freeform visual expression of creative ideas.\n\n\n\n![7ptz0KwOggxYeT_47h65KjMofta6igk_HoQZL1K-RyA=](/blobs/7ptz0KwOggxYeT_47h65KjMofta6igk_HoQZL1K-RyA=)\n\n\nAFFiNE has released its stable version, but we are continuing to build to a more feature-rich and stable build. Come and join us on our journey over on our media platforms.\n\n\n* Official Website: [https://affine.pro/](https://affine.pro/)\n\n\n* GitHub: [https://github.com/toeverything/AFFiNE](https://github.com/toeverything/AFFiNE)\n\n\n* Discord: [https://discord.gg/Arn7TqJBvG](https://discord.gg/Arn7TqJBvG)\n\n\n* Twitter: [https://twitter.com/AffineOfficial](https://twitter.com/AffineOfficial)\n\n\n",
  "publish": true
}