{
  "title": "Best Top 8 Microsoft Access Alternatives & Competitors of 2024",
  "authors": [
    "Yiyang Zhang",
    "Yuhang Zhao"
  ],
  "tags": [
    "Content"
  ],
  "description": "Discover the top 8 database management system options for 2024. Find alternatives to Microsoft Access and explore features, pricing, and more.",
  "created": 1708646400000,
  "updated": 1708646400000,
  "layout": "blog",
  "id": "Af1JdD-dwc8HamXhIAUiE",
  "slug": "best-top-8-microsoft-access-alternatives-competitors",
  "cover": "/blobs/j9hnmj4ikg-eX_8kW_ae_Nr0sSSLCgsMFQ25lE4cQS0=",
  "md": "---\n\n\ntitle: \"Best Top 8 Microsoft Access Alternatives & Competitors of 2024\"\n\n\nauthor: \"Yiyang Zhang, Yuhang Zhao\"\n\n\ntags: Content\n\n\nslug: best-top-8-microsoft-access-alternatives-competitors\n\n\ndescription: \"Discover the top 8 database management system options for 2024. Find alternatives to Microsoft Access and explore features, pricing, and more.\"\n\n\ncreated: 2024-02-23\n\n\nupdated: 2024-02-23\n\n\nlayout: blog\n\n\npublish: true\n\n\n---\n\n\n\n![j9hnmj4ikg-eX_8kW_ae_Nr0sSSLCgsMFQ25lE4cQS0=](/blobs/j9hnmj4ikg-eX_8kW_ae_Nr0sSSLCgsMFQ25lE4cQS0=)\n\n\nAre you in need of a reliable database management system? You're in luck! In today's fast-paced digital world, data is crucial, and having a strong and adaptable database tool is essential. While Microsoft Access has been a popular choice for many businesses, it does come with certain limitations.\n\n\nIf you're looking for alternatives to Microsoft Access, we've got you covered. Check out these 8 options that offer impressive features and capabilities to help you manage your data effectively. Take a closer look at these innovative alternatives that are poised to transform the way you manage your databases, whether you're an individual or part of a larger organization.\n\n\n\n\n\n### What is Microsoft Access?\n\n\n\n\n\nAs part of the Microsoft Office suite, Access is easily accessible for users already familiar with other Microsoft products like Excel and Word. What sets it apart is its user-friendly interface and impressive data storage capabilities, allowing users to create and manage databases without extensive programming knowledge. With Access, you can design tables, forms, queries, and reports to store and manipulate data in an organized manner.\n\n\n\n\n\n**Pros and Cons of Microsoft Access**\n\n\n\n![0dCl0Gh6U9szoEMs3Y27Ji___DX2AyPj6Enhq3GZOxE=](/blobs/0dCl0Gh6U9szoEMs3Y27Ji___DX2AyPj6Enhq3GZOxE=)\n\n\n* **Pros**\n\n\n  * **Easy to install, use, and integrate.** Microsoft Access can integrate with most Windows-based systems, providing users with a fully functional database after a simple installation.\n\n\n  * **Offer a large amount of storage capacity.** Multiple GBs of data can be stored using Microsoft Access. It can also be accessed by numerous users from a single Access application. Some users report having 10 users accessing an Access application simultaneously on a network.\n\n\n  * **Simple data importing.** The data you have collected can be imported into Microsoft Access in about the same amount of time it takes to install it. Access also provides a simple backup solution for your data.\n\n\n* **Cons**\n\n\n  * **Security concerns.** The best option for your database might not be Access if it requires extensive security protocols. Access can be used as a front-end for an SQL server to avoid this issue, but not every company needs that level of infrastructure and still creates sensitive data.\n\n\n  * **All data is saved into a single file.** The one-file format slows the performance of the program when files are closed to the maximum size that this database program supports. Reports can take minutes to generate and share. Queries and forms may even crash some computers.\n\n\n  * **Finite database system.** For larger data users, Microsoft Access has some limitations that other database programs may not have, simply because there is a file size limit.\n\n\n* **Pricing**\n\n\n  * Basic: $6.00 user/month\n\n\n  * Standard: $12.50 user/month\n\n\n  * Premium: $22.00 user/month\n\n\nTo overcome these limitations and find alternatives that better suit your needs, you should consider exploring other robust options available in the market today!\n\n\n\n\n\n### What should You Look for in Microsoft Access Alternatives?\n\n\n* **Compatibility.** Ensure that the alternative you choose can seamlessly integrate with your existing software and systems. This will save you time and effort in transferring data.\n\n\n* **Ease of use.** Look for an alternative that has a user-friendly interface and intuitive features. You want a solution that allows you to quickly navigate through databases and perform tasks efficiently.\n\n\n* **Scalability.** As your business grows, so will your data management needs. Make sure the alternative can handle increasing amounts of data without sacrificing performance or becoming overly complex.\n\n\n* **Data security.** It's important to select an alternative that provides robust security measures to protect sensitive information from unauthorized access or breaches.\n\n\n* **Cost-effectiveness.** Evaluate pricing plans, licensing options, and any additional fees associated with implementation or support.\n\n\nBy carefully evaluating these factors, you can find the best Microsoft Access alternative that meets your specific requirements while enhancing productivity and efficiency in managing your databases.\n\n\n### Best Top 8 Microsoft Access Alternatives of 2024\n\n\n#### 1. [AFFiNE](https://affine.pro/)\n\n\n\n![aBn3NI7QxiNtATK15n4ew0ICIfBen_dJ-i733stoOlU=](/blobs/aBn3NI7QxiNtATK15n4ew0ICIfBen_dJ-i733stoOlU=)\n\n\nAre you in need of an all-in-one solution that can replace Microsoft Access and is self-hosted? Consider using AFFiNE! AFFiNE is a fantastic all-in-one, self-hosted solution and a wonderful alternative to Microsoft Access. We prioritize your privacy and data ownership. With built-in networks and storage permission controls for plugins, you can trust that your data stays secure and under your control. The data modified by users on the whiteboard can be synchronized after conversion to docs, enabling freer editing and writing. What sets AFFiNE apart is that it is an open-source program that employs offline technology to ensure it is accessible to all users.\n\n\n**Key features:**\n\n\n* **Robust Database with Table & Kanban view:** With just one click, you can transform your text into structured Tables and Kanban view, organizing information for visual appeal. Say goodbye to the hassle of manually inputting your text, cell by cell, into the database.\n\n\n\n![1rUFKPyP7E0K9yOMSp5qGJ2JAxR5QJ40f7MffEbHLjo=](/blobs/1rUFKPyP7E0K9yOMSp5qGJ2JAxR5QJ40f7MffEbHLjo=)\n\n\n* **Advanced Collaboration Capability:** When you do need to [collaborate](https://affine.pro/blog/top-asynchronous-communication-tools-free-2024) with other contributors to discuss your event planning, AFFiNE makes getting feedback simple. Appealing collaboration capability provides visibility into assigned tasks, making tables easier to estimate, and ensuring your plans remain well-designed. You can invite team members or classmates to collaborate on your event planning together, making it perfect for group projects or study sessions.\n\n\n\n![O88V12dZ7eALpdMD8-6eyyfRec5yZyWiQxCnvNEb3r0=](/blobs/O88V12dZ7eALpdMD8-6eyyfRec5yZyWiQxCnvNEb3r0=)\n\n\n* **Privacy-focused and local-first:** AFFiNE is built with your privacy in mind and is one of our key concerns. We want you to keep control of your data, allowing you to store it as you like, where you like, while still being able to edit and view your data on-demand freely.\n\n\n\n![47nPJY8L3CPkCKWrS2joh98lB45q5sxPIB7bj5cDd34=](/blobs/47nPJY8L3CPkCKWrS2joh98lB45q5sxPIB7bj5cDd34=)\n\n\n#### 2. [Airtable](https://www.airtable.com/)\n\n\n\n![YRwapD4DDRLo2w-ZBbUZ7Yy1u0FFf3LfHiTtP3JvrYA=](/blobs/YRwapD4DDRLo2w-ZBbUZ7Yy1u0FFf3LfHiTtP3JvrYA=)\n\n\nWith its intuitive interface and powerful features, Airtable is a popular choice among users looking for a flexible alternative to Microsoft Access. The system uses a spreadsheet format to organize data. Related data can be linked together. It allows you to create custom databases, manage data with ease, and collaborate seamlessly with your team.\n\n\n**Key features:**\n\n\n* Low-code application development platform\n\n\n* Native AI components and dynamic AI functionality\n\n\n* Relational databases that sync in real-time with other systems\n\n\n**Pricing:**\n\n\n* Starting price: $12.00 per month\n\n\n* Free trial: Available\n\n\n* Free version: Available\n\n\n#### 3. [MariaDB](https://mariadb.org/)\n\n\n\n![kC5dxywOoKI5JJvf5vt78fXwtRmq0yr4lSEKXTHkrBc=](/blobs/kC5dxywOoKI5JJvf5vt78fXwtRmq0yr4lSEKXTHkrBc=)\n\n\nBy using MariaDB, businesses can focus on what matters most: building creative, customer-facing apps without having to worry about proprietary databases' costs, limitations, and complexity. With its pluggable, purpose-built storage engines, MariaDB accommodates workloads that typically require a variety of specialist databases.\n\n\n**Key features:**\n\n\n* Adaptable for a wide range of use cases\n\n\n* Supports PHP and has Galera cluster technology\n\n\n* Super-compatible with MySQL\n\n\n**Pricing:**\n\n\n* SkySQL customers are billed monthly\n\n\n* Database instances are billed by instance size for both vCPU and memory\n\n\n#### 4. [OpenOffice Base](https://www.openoffice.org/dba/)\n\n\n\n![3H_y2sy4bQVqMkCwsZ4M3FE24nOGci9BzY_18kTe3Z0=](/blobs/3H_y2sy4bQVqMkCwsZ4M3FE24nOGci9BzY_18kTe3Z0=)\n\n\nOpenOffice Base is an alternative to Microsoft Access that can be downloaded for multiple team members. It serves as a comprehensive desktop database management system and is not limited in its use. Additionally, it provides predefined table definitions for tracking a range of items including Assets, Customers, Sales Orders, and Invoices.\n\n\n**Key features:**\n\n\n* User interfaces work on all desktop operating systems\n\n\n* Recover lost data and create worry-free backups\n\n\n* Installation and support available for on-premise and SaaS users\n\n\n**Pricing:** Free\n\n\n#### 5. [MongoDB](https://www.mongodb.com/)\n\n\n\n![VWFSHyMWchfXq1NxFH6SD-4nczSjMv6zWkoq3A_aKm0=](/blobs/VWFSHyMWchfXq1NxFH6SD-4nczSjMv6zWkoq3A_aKm0=)\n\n\nMongoDB is an open-source NoSQL database management program that is very useful for working with large sets of distributed data. It provides organizations with a fast option for storing large volumes of data and offers ad-hoc queries, indexing, load balancing, aggregation, server-side JavaScript execution, and other features.\n\n\n**Key features:**\n\n\n* Real-time triggers for creating an event-driven data app\n\n\n* Rich and expressive query language\n\n\n* Integrated full-text search functionality\n\n\n**Pricing:**\n\n\n* Dedicated: from $57/month\n\n\n* Serverless: from $0.10/million reads\n\n\n#### 6. [MySQL](https://www.mysql.com/)\n\n\n\n![MyFT_YKdFrsidzOFYIt1rWeexUhvNBsBu485cstLRQo=](/blobs/MyFT_YKdFrsidzOFYIt1rWeexUhvNBsBu485cstLRQo=)\n\n\nMySQL is the world’s most popular open-source database, with DB-Engines ranking it second only to Oracle Database. It is a relational database management system, which stores data in separate tables rather than a single repository. This organization allows for greater speed optimization than other structures. Many of today's top applications run on MySQL, including Facebook, Airbnb, Shopify, and Booking.com.\n\n\n**Key features:**\n\n\n* High availability\n\n\n* Scalability and faster performance\n\n\n* Multiple sets of native, fully integrated replication technologies for high availability and disaster recovery\n\n\n**Pricing:**\n\n\n* Standard Edition: $2,000 per year\n\n\n* Enterprise Edition: $5,000 per year\n\n\n#### 7. [DBeaver](https://dbeaver.com/)\n\n\n\n![spAJRCvVQxTVss_p0KmShTf3z5BqWi-hKCGRpJeWQr4=](/blobs/spAJRCvVQxTVss_p0KmShTf3z5BqWi-hKCGRpJeWQr4=)\n\n\nDBeaver is a versatile tool designed to handle diverse data sources, providing both a free basic version and a paid version with advanced features. With the paid version, users can explore, process, and administrate various cloud, SQL, and NoSQL data sources. Featuring over 100 powerful tools, DBeaver streamlines work for both technical and non-technical users. Plus, its task manager automates daily tasks so you can focus on higher priorities.\n\n\n**Key features:**\n\n\n* Support for complex authorization mechanisms\n\n\n* Ready-to-go database toolset\n\n\n* Analyze, compare, visualize, and transfer data in any format and sources\n\n\n**Pricing:**\n\n\n* Cloudbeaver: $1,000 per year\n\n\n* Enterprise Edition: $250 per year\n\n\n* Team Edition: $1,600 per year\n\n\n#### 8. [PostgreSQL](https://www.postgresql.org/)\n\n\n\n![dmAlW9ZAjTzltlFl_v7iG7E-di4QdPbsaGrcZos8Po0=](/blobs/dmAlW9ZAjTzltlFl_v7iG7E-di4QdPbsaGrcZos8Po0=)\n\n\nPostgreSQL is a dependable, feature-rich, object-relational database system. It boasts an impressive 35 years of active development, making it deserving of its esteemed reputation for trustworthiness, robustness, and speed. If you're looking to learn more about how to install and use PostgreSQL, the main documentation is brimming with useful information.\n\n\n**Key features:**\n\n\n* Free and open-source\n\n\n* Support for international character sets, e.g. through ICU collations\n\n\n* Authentication: GSSAPI, SSPI, LDAP, SCRAM-SHA-256, Certificate, and more\n\n\n**Pricing:** Free\n\n\n### Improve Productivity with AFFiNE\n\n\n\n![uO1ZB4KWJaUGczcj2ij-OuUOEy0qu6eGa08hzMPp6yk=](/blobs/uO1ZB4KWJaUGczcj2ij-OuUOEy0qu6eGa08hzMPp6yk=)\n\n\nIn today's fast-paced business world, productivity and efficiency are crucial for success. Finding the right data management tool that can streamline processes is essential for businesses. There are several alternatives to Microsoft Access, each with unique strengths and advantages depending on specific needs. However, **AFFiNE** stands out as the best alternative due to its effective catering to all kinds of needs.\n\n\nGet your hands on **AFFiNE** today! The timing is opportune, and it's never too late to embark on this transformative journey. Commence improving your database management by using AFFiNE's user-friendly tool. Presently, AFFiNE has launched its [**Stable Version**](https://affine.pro/download), with ongoing efforts to develop a more comprehensive and dependable iteration. Join us on our voyage through our social media channels and be part of the experience. **Come and join us on our journey over on our media platforms.**\n\n\n* Official Website: [https://affine.pro/](https://affine.pro/)\n\n\n* GitHub: [https://github.com/toeverything/AFFiNE](https://github.com/toeverything/AFFiNE)\n\n\n* Discord: [https://discord.gg/Arn7TqJBvG](https://discord.gg/Arn7TqJBvG)\n\n\n* Twitter: [https://twitter.com/AffineOfficial](https://twitter.com/AffineOfficial)\n\n\n",
  "publish": true
}