{
  "title": "Best Free AI-powered PowerPoint Generator for Presentations",
  "authors": [
    "Yanxi Liu"
  ],
  "tags": [
    "Content"
  ],
  "description": "Explore the best free AI-powered powerpoint generator for presentations, revolutionizing your design process. Elevate your slides with cutting-edge technology and captivate your audience.",
  "created": 1711324800000,
  "updated": 1711324800000,
  "layout": "blog",
  "id": "IOBYpqiFEENnfHcx9mtbf",
  "slug": "best-free-AI-powered-PowerPoint-generator-for-presentations",
  "cover": "https://app.affine.pro/api/workspaces/qf73AF6vzWphbTJdN7KiX/blobs/NJL1vv7Wem9s4DDEzNUz5opxcNyyaBBLJ5PUSVZOhA4=.webp",
  "md": "---\n\ntitle: \"Best Free AI-powered PowerPoint Generator for Presentations\"\n\nauthor: \"Yanxi Liu\"\n\ntags: Content\n\nslug: best-free-AI-powered-PowerPoint-generator-for-presentations\n\ndescription: \"Explore the best free AI-powered powerpoint generator for presentations, revolutionizing your design process. Elevate your slides with cutting-edge technology and captivate your audience.\"\n\ncreated: 2024-03-25\n\nupdated: 2024-03-25\n\nlayout: blog\n\npublish: true\n\n---\n\n\n![NJL1vv7Wem9s4DDEzNUz5opxcNyyaBBLJ5PUSVZOhA4=](https://app.affine.pro/api/workspaces/qf73AF6vzWphbTJdN7KiX/blobs/NJL1vv7Wem9s4DDEzNUz5opxcNyyaBBLJ5PUSVZOhA4=)\n\nIn today's digital age, creating visually stunning and engaging PowerPoint presentations is essential for effectively conveying your message. With the advancement of artificial intelligence (AI) technology, the process of designing impactful slides has been revolutionized. In this article, we will explore the top 7 free AI tools that can help you elevate your presentations to the next level, making your content more compelling and memorable.\n\n# **What is an AI-powered PowerPoint Generator?**\n\n\n![BcShGCMhPJgl0TywFyzaljoceI5Q-ak10H7_rFTvMK4=](https://app.affine.pro/api/workspaces/qf73AF6vzWphbTJdN7KiX/blobs/BcShGCMhPJgl0TywFyzaljoceI5Q-ak10H7_rFTvMK4=)\n\nCrafting professional and visually captivating PowerPoint presentations can often consume a significant amount of time. Thankfully, [AI-powered](https://affine.pro/blog/gemini-vs-chatgpt-ai-tool-comparison) PowerPoint generators have streamlined this process, making it quicker and more efficient than ever before. These generators leverage sophisticated artificial intelligence algorithms to swiftly produce polished presentations, eliminating the need for extensive design skills.\n\nAI PowerPoint generators typically possess the capability to analyze input prompts, generate relevant content, recommend suitable layouts and designs, and offer customization features. Some even boast advanced functionalities like creating images and quizzes from text inputs and converting documents into presentations. By harnessing the power of AI PowerPoint generators, users can create impressive slides in a fraction of the time, enabling them to concentrate on delivering engaging and impactful messages to their audience.\n\n# **SixBenefits of Using an AI-Powered PowerPoint Generator:**\n\n\n![UGVhsabYTc9K_eerw_xB_qhZxu_TVr-N9m6RDXBJAaQ=](https://app.affine.pro/api/workspaces/qf73AF6vzWphbTJdN7KiX/blobs/UGVhsabYTc9K_eerw_xB_qhZxu_TVr-N9m6RDXBJAaQ=)\n\n1. **Automated Slide Creation:** The AI-powered PowerPoint Generator automates slide creation based on input text, effectively reducing the manual effort and time required for crafting each slide individually.\n1. **Tailored and Localized Presentations:** This tool enables tailored, localized, and interactive slide generation, ensuring that presentations are personalized to cater to specific audiences, thereby enhancing engagement and relevance.\n1. **Time-Saving Solution:** Compared to manual slide crafting, the AI-powered PowerPoint Generator offers a time-saving solution, allowing users to expedite the presentation creation process and allocate more time to [refining content](https://affine.pro/blog/gemini-vs-chatgpt-ai-tool-comparison) and delivery.\n1. **AI-Driven Design Suggestions:** [Leveraging AI technology](https://affine.pro/blog/gemini-vs-chatgpt-ai-tool-comparison), the generator offers intelligent design suggestions such as images, icons, and videos, enhancing the visual appeal and effectiveness of the slides.\n1. **Diverse Export Options:** Enjoy a wide range of export options including PPT, PDF, and video formats, ensuring flexibility in sharing and presenting content across various platforms and devices.\n1. **Creative Recommendations and Templates:** Access creative recommendations and a variety of ready-made templates for design inspiration, empowering users to craft visually appealing and engaging presentations with ease.\n# **Top Free AI Generator for PowerPoint Presentations:**\n\nAfter conducting a comprehensive survey of available AI PowerPoint generators, we have carefully selected what we consider to be the top 7 free AI PowerPoint generators. These tools are designed to assist you in creating stunning slides efficiently, significantly reducing the time required for slide design.\n\n## **1.** [AFFiNE](https://www.affine.pro)\n\n<div style=\"text-align:center;\">\n<iframe width=\"560\" height=\"315\" src=\"https://www.youtube.com/embed/WqOe9HgpsDY?si=PHGuSeRbOT9GxuPO\" title=\"YouTube video player\" frameborder=\"0\" allow=\"accelerometer; autoplay; clipboard-write; encrypted-media; gyroscope; picture-in-picture; web-share\" allowfullscreen></iframe>\n</div>\n\n\n<video muted autoplay loop preload=\"auto\" crossorigin=\"anonymous\" playsinline>\n            <source src=\"https://app.affine.pro/api/workspaces/qf73AF6vzWphbTJdN7KiX/blobs/gue2L42twEfrZkmPXe94nL7dpCCbsczlnKYEBgc4lGI=\" type=\"video/mp4\" />\n          </video>\n\n[AFFiNE](https://affine.pro) stands out as a state-of-the-art AI generator for PowerPoint presentations, meticulously crafted to employ AI to revolutionize your presentation creation process by simply inputting your content descriptions and witnessing the magic as visually stunning slides are generated effortlessly.\n\nExplore AFFiNE AI, your true multimodal AI lead, dedicated to turning \"all your ideas into reality.\"\n\n**Key Features of AFFiNE AI Generator:**\n\n* **Effortlessly Create Stunning Slides:** Instantly generate visually appealing slides that captivate your audience. As the video illustrates, with a simple prompt \"What is UI?\" you will get a clear understanding of this topic.\n* **Infuse Emotion and Impact:** Select from a variety of tones to add the perfect emotional touch and ensure your message resonates powerfully. AFFiNE offers you a different tone choice. By clicking the professional choice, your slides will quickly adapt to the formal setting, which helps to save time and increase your efficiency\n* **Personalize Your Style:** Easily customize layouts and templates to showcase your individuality and professionalism.\n\n\n\n![tmr36IY2c-xzBtEzp_94jSDwdf9OonPOVl8d4WgBFM0=](https://app.affine.pro/api/workspaces/qf73AF6vzWphbTJdN7KiX/blobs/tmr36IY2c-xzBtEzp_94jSDwdf9OonPOVl8d4WgBFM0=)\n\n\n\n## **2. [ChatGPT](https://chat.openai.com/)**\n\n\n![OoyX_gxYM0L19_7hiVebXZJvD_QAPZ23ETjyetXwntM=](https://app.affine.pro/api/workspaces/qf73AF6vzWphbTJdN7KiX/blobs/OoyX_gxYM0L19_7hiVebXZJvD_QAPZ23ETjyetXwntM=)\n\n**[ChatGPT](https://affine.pro/blog/gemini-vs-chatgpt-ai-tool-comparison)** is a versatile AI tool renowned for its conversational capabilities and content ideation support. Beyond its well-known functions, ChatGPT harbors hidden talents that surprise many users. This tool can craft audio tracks, design logos, and generate content by providing the right prompts.\n\nIts latest enhancement even allows users to create PowerPoint presentations effortlessly, supporting the generation of over 20 slides. Additionally, it can fetch information from various sources like web pages, Google Drive, and OneDrive, expanding its utility and convenience for users seeking comprehensive content creation solutions.\n\n**Key features:**\n\n**Exploration and Expansion of Ideas:** ChatGPT assists in brainstorming and expanding perspectives to ensure comprehensive information and diverse viewpoints in your presentations.\n\n**Consistent Presentation Tone and Quality:** ChatGPT maintains a uniform tone and quality throughout your presentation, enhancing the overall coherence and professionalism of the content.\n\n**Refined Language:** ChatGPT minimizes grammar and language errors, alleviating concerns about flaws and grammatical mistakes in your presentation.\n\n\n\n## **3. [Canva](https://www.canva.com/ai-image-generator/)**\n\n\n![KedsBABV7QgPYQTK4CRygToo2a2OIsxtTRwsDBQlyoA=](https://app.affine.pro/api/workspaces/qf73AF6vzWphbTJdN7KiX/blobs/KedsBABV7QgPYQTK4CRygToo2a2OIsxtTRwsDBQlyoA=)\n\n[Canva](https://www.canva.com/ai-image-generator/) is by far one of the most popular no-code graphic design platforms that also offers AI image generation capabilities. The AI text-to-image generator on Canva lets you create custom images with simple text prompts to add to your designs.\n\n**Key features:**\n\n* **Enchantment Editing:** Canva's tool, similar to \"inpainting,\" enhances images with AI, perfect for improving visuals in PowerPoint slides.\n* **Enhanced Enchantment Writing:** Canva's Magic Write tool now extends throughout the platform, offering versatile writing options that can elevate your PowerPoint content beyond basic copywriting.\n* **Beat Sync:** Canva's Beat Sync feature, unlike Microsoft's Clipchamp, syncs audio track beats with visual scene changes using AI, enhancing the audio-visual experience in your PowerPoint presentations.\n\n\n## **4. [Beautiful.ai](https://www.beautiful.ai/)**\n\n\n![yVCJWsQYnSE7GpJdH5Mrlu0KrQ0KlGJKz_wEcnvg_EM=](https://app.affine.pro/api/workspaces/qf73AF6vzWphbTJdN7KiX/blobs/yVCJWsQYnSE7GpJdH5Mrlu0KrQ0KlGJKz_wEcnvg_EM=)\n\n[Beautiful.ai](https://www.beautiful.ai/) is an AI presentation maker. The DesignerBot helps create presentation slides quickly and brainstorm ideas, while smart templates on the platform give content creators a headstart with their presentations. The adaptive designs automatically format the slides, so you donâ€™t have to worry about resizing images or text to create the perfect presentation.\n\n**Key features:**\n\n* **Hundreds of pre-built slides:** Start inspired with hundreds of customizable, beautifully designed smart slides in our slide gallery and save hours from having to start from scratch.\n* **Simple intuitive controls:** Start inspired with hundreds of customizable, beautifully designed smart slides in our slide gallery and save hours from having to start from scratch.\n* **Create new layouts in seconds:** Smart templates have built-in layout variations that you can toggle to quickly visualize your content in different ways.\n\n\n## **5. [AIContenfy](https://aicontentfy.com/)**\n\n\n![-LHXWshb6U7BR_r2-1haHr5mwQnhHDksG896WJzw6pc=](https://app.affine.pro/api/workspaces/qf73AF6vzWphbTJdN7KiX/blobs/-LHXWshb6U7BR_r2-1haHr5mwQnhHDksG896WJzw6pc=)\n\n[AIContenfy](https://aicontentfy.com/) uses advanced natural language processing (NLP) algorithms and machine learning (ML) models to generate content that is customized to a business's needs. The tool can create various types of content, including articles and blog posts. Users can specify their desired tone, style, and target audience, and the tool will generate content that matches these criteria.\n\n**Key features:**\n\n* **Efficient Scalability:** AIContenfy excels in using AI to generate content at scale, enabling businesses to produce large volumes quickly and allocate resources to other operational areas.\n* **Enhanced SEO Optimization:** AIContenfy enhances businesses' SEO efforts by generating content rich in relevant keywords and phrases, leading to improved visibility and higher rankings on search engine results pages (SERPs).\n\n\n## **6. [ClickUp](https://clickup.com/)**\n\n\n![dDF8MB-7gy-MvTHJQNlSpqbBtN0joNiIqUxvcP5KcCc=](https://app.affine.pro/api/workspaces/qf73AF6vzWphbTJdN7KiX/blobs/dDF8MB-7gy-MvTHJQNlSpqbBtN0joNiIqUxvcP5KcCc=)\n\nClickUp is an all-in-one [project management](https://affine.pro/blog/how-to-create-a-project-timeline-template-in-excel-step-by-step-guide) software that offers hundreds of customizable features to give individuals and teams the flexibility and tools they need to work smarter and boost productivity. ClickUp has launched an AI content assistant feature, ClickUp AI, a content ideation and creation tool in ClickUp Docs that helps with [generating ideas, copywriting, copyediting](https://clickup.com/blog/copywriting-tools/), summarizing long text writing content, and so much more.\n\n**Key features:**\n\n* **Content research and ideation**: Generate instant and high-quality content for PowerPoint ideas.\n* **Copy editing**: Get suggestions for writing improvements to simplify and improve slides.\n* **Content summarization**: Summarize key points from Docs and then transfer them into useful slides.\n\n\n## **7. [Slidebean](http://slidebean.com)**\n\n\n![MgHqyVEf0n52HbBnarfbDC64EAShoVW3lhL7O6G-7Ak=](https://app.affine.pro/api/workspaces/qf73AF6vzWphbTJdN7KiX/blobs/MgHqyVEf0n52HbBnarfbDC64EAShoVW3lhL7O6G-7Ak=)\n\nSlidebean is the ultimate presentation toolkit for aspiring entrepreneurs venturing into the world of business. This comprehensive platform is designed to ease the challenges of starting a new business by providing essential tools and resources to build, pitch, and grow a successful startup.\n\n**Key features:**\n\n* **AI-Powered Pitch Deck Creation:** Leverage Slidebean's AI capabilities to automatically generate compelling pitch decks, streamlining the process of creating professional presentations.\n* **AI-Enhanced Market Size Estimation:** Tap into Slidebean's AI features to enhance market size estimation, providing data-driven insights to strengthen the market analysis section of your presentation.\n* **AI-Optimized Go-to-Market Strategy:** Utilize Slidebean's AI capabilities to optimize your go-to-market strategy, ensuring that your presentation includes a well-defined plan for launching your product.\n# **Explore the Future Trends of AI-Powered Presentation Generator with AFFiNE**\n\nIn the rapidly evolving landscape of presentation creation, AI-powered tools like AFFiNE are paving the way for innovative advancements. By harnessing the capabilities of artificial intelligence, AFFiNE is revolutionizing the process of generating dynamic and engaging presentations. In addition, AFFiNE can assist businesses of all sizes in developing and implementing realistic and successful plans. From daily planning and task management to crafting strategic and tactical marketing plans, we've got you covered.\n\nAFFiNE has launched its [Stable Version](https://affine.pro/download), with ongoing efforts to develop a more comprehensive and dependable iteration. Join us on our voyage through our social media channels and be part of the experience. Come and join us on our journey over on our media platforms. ðŸš€\n\n* Official Website: [https://affine.pro/](https://affine.pro/)\n* GitHub: [https://github.com/toeverything/AFFiNE](https://github.com/toeverything/AFFiNE)\n* Discord: [https://discord.gg/Arn7TqJBvG](https://discord.gg/Arn7TqJBvG)\n* Twitter: [https://twitter.com/AffineOfficial](https://twitter.com/AffineOfficial)\n\n\n",
  "publish": true
}