{
  "title": "10 Best Project Planning Tools & Software for Teams in 2024",
  "authors": [
    "Yiyang Zhang"
  ],
  "tags": [
    "Content"
  ],
  "description": "Unleash the power of project planning bringing to teamwork. Explore the 10 best project planning tools for teams in 2024.",
  "created": 1695686400000,
  "updated": 1704153600000,
  "layout": "blog",
  "id": "DGFExQDbe-",
  "slug": "best-project-planning-tools-software-for-teams-2023",
  "cover": "/blobs/HvlUSsaWXw_zPh9Mn5YX_Kvy5XKqHcCHe3FCKtSpdzA=",
  "md": "---\n\n\ntitle: \"10 Best Project Planning Tools & Software for Teams in 2024\"\n\n\nauthor: \"Yiyang Zhang\"\n\n\ntags: Content\n\n\nslug: best-project-planning-tools-software-for-teams-2023\n\n\ndescription: \"Unleash the power of project planning bringing to teamwork. Explore the 10 best project planning tools for teams in 2024.\"\n\n\ncreated: 2023-09-26\n\n\nupdated: 2024-01-02\n\n\nlayout: blog\n\n\npublish: true\n\n\n---\n\n\nIn fast-paced businesses, proper project planning is essential for success. The right tool can help streamline workflow and enhance productivity. There are several tools available for various purposes, including tracking tasks, managing resources, budgeting, and communication. You can choose an option that matches your team's specific needs to ensure organization, efficiency, and focus toward achieving your objectives. However, it can be challenging to determine the most suitable tool for your team.\n\n\n\n![HvlUSsaWXw_zPh9Mn5YX_Kvy5XKqHcCHe3FCKtSpdzA=](/blobs/HvlUSsaWXw_zPh9Mn5YX_Kvy5XKqHcCHe3FCKtSpdzA=)\n\n\nBut fear not! In this article, we will explore the top 10 project planning tools of 2024 that will revolutionize how your team operates. These nifty software applications are designed to streamline your workflow, keep everyone on the same page, and ensure that projects are completed on time and within budget. Get ready to discover the tools that will take your project management skills to new heights!\n\n\n### What is a Project Planning Tool?\n\n\nA project planning tool is a helpful software application or platform that aids teams in planning, organizing, and executing their projects efficiently. It is a central hub where all project-related information can be stored, accessed, and updated in real-time. Essentially, it functions as a virtual assistant for project managers by providing them with the necessary tools to streamline their workflows. It offers a structured framework for planning projects from start to finish, breaking them down into smaller tasks, assigning responsibilities, setting timelines, and tracking progress.\n\n\nUtilizing a robust project management tool can significantly improve your team's efficiency by providing effective planning capabilities along with seamless collaboration options.\n\n\n### Why Does Your Team Need a Project Planning Tool?\n\n\nIn today's rapidly changing and busy business world, it is critical for teams to have effective project planning. Without a reliable method to plan, monitor, and cooperate on projects, teams can quickly become confused and disordered. This is where a project planning tool becomes essential.\n\n\n\n![bbw03uCPYHU7ieRd9_P27N4PMJEfGLGzmkkQYWw7m5I=](/blobs/bbw03uCPYHU7ieRd9_P27N4PMJEfGLGzmkkQYWw7m5I=)\n\n\n* Improved collaboration. Collaborating on the same platform facilitates information sharing, idea exchange, real-time feedback, and alignment towards common goals.\n\n\n* Enhances productivity. Automating repetitive tasks replaces time-consuming manual processes. Task assignment notifications and automatic progress updates are efficient features.\n\n\n* Offer valuable insights. Through analytics and reporting capabilities, teams can analyze data related to resource allocation, budgeting, and overall performance, making informed decisions based on reliable metrics.\n\n\n* Increased transparency.Â Team members can see each other's tasks, status updates, and dependencies, as well as how their work contributes to the bigger picture. This fosters accountability, reduces duplication of effort, and promotes collaboration across departments.\n\n\nSo whether you're managing small-scale projects or overseeing complex initiatives involving multiple stakeholders, implementing a reliable project management tool is essential for success!\n\n\n### 10 Best Project Planning Tools for Teams of 2024\n\n\nAs the year 2024 unfolds, it's crucial for teams to equip themselves with top-notch project planning tools that can streamline their workflow and enhance collaboration. So, without further ado, let's dive into the 10 best project management tools of 2024:\n\n\n1.**[AFFiNE](https://affine.pro/)**\n\n\n\n![QvFa219FBhpTBWWFw0drfyhfbQpokdINs_BiTrz5Opk=](/blobs/QvFa219FBhpTBWWFw0drfyhfbQpokdINs_BiTrz5Opk=)\n\n\nAFFiNE is a cutting-edge task management software that is designed to assist you in organizing, managing, and cooperating on tasks, projects, and information. What sets AFFiNE apart is that it is a free and open-source program that employs offline technology to ensure that it is accessible to all users. This makes it an invaluable resource for individuals who require a comprehensive task management solution for their daily needs.\n\n\n**Key features of AFFiNE:**\n\n\n* Properties Editing: To enhance your interaction, we've introduced a dedicated panel for Kanban editing. Here, you have the freedom to edit properties at your convenience, enriching your Kanban experience.\n\n\n\n![PrWKlqwLbz13lYnPPyIU4acy6ukqZ4X4ZFMVonMmSO8=](/blobs/PrWKlqwLbz13lYnPPyIU4acy6ukqZ4X4ZFMVonMmSO8=)\n\n\n* Unparalleled customization: Now, you can classify based on almost any property, allowing for personalized categorization that aligns perfectly with your needs.\n\n\n\n![UQ37RBZanYmZt_xalHX36RiT4YeUrGDNNQNtrNbC-zs=](/blobs/UQ37RBZanYmZt_xalHX36RiT4YeUrGDNNQNtrNbC-zs=)\n\n\n* Intuitive Drag-and-Drop Sorting: By simply dragging and dropping to the desired spot, you have the flexibility to move entire columns or individual Kanban cards to your preferred locations effortlessly.\n\n\n\n![zwXUytnIiLZIAPLE1ujUVUFmHqngYjhG1Y0eaIXSS4g=](/blobs/zwXUytnIiLZIAPLE1ujUVUFmHqngYjhG1Y0eaIXSS4g=)\n\n\n* AFFiNE Cloud: With AFFiNE Cloud, you can invite your family and friends to collaborate in real-time within a shared workspace. This feature makes your habit of tracking work smoother and more efficient.\n\n\n\n![7sC9sHff3sHGQBmTEKzUZGo-t0-4fs92M2IM3GSiPkQ=](/blobs/7sC9sHff3sHGQBmTEKzUZGo-t0-4fs92M2IM3GSiPkQ=)\n\n\n* Edgeless Mode: Our exciting Edgeless Mode, including a redesigned toolbar, eraser, connector, blockslicer, integrated canvas text and copy as PNG, etc. Get ready to unlock new levels of productivity and immerse yourself in a seamless and efficient workflow.\n\n\n\n![q1kRb852K7CyMTlg9CXig9gOklaMKSlob1bGxmyH11k=](/blobs/q1kRb852K7CyMTlg9CXig9gOklaMKSlob1bGxmyH11k=)\n\n\n2.**[Asana](https://asana.com/)**\n\n\n\n![SIevFflY9kgGpsQy9kzQsl5LOSMOkNpGbYUb1jPbZ5c=](/blobs/SIevFflY9kgGpsQy9kzQsl5LOSMOkNpGbYUb1jPbZ5c=)\n\n\nAsana is an effective tool for managing projects that can help teams stay organized, collaborate efficiently, and manage projects effectively. With its customizable views, automation capabilities, and integrations, it is a versatile and flexible solution that can adapt to the specific needs and workflows of different teams. Asana's user-friendly interface and extensive set of features make it easy to use, and its centralized platform for communication and file sharing can help teams stay aligned and work more efficiently.\n\n\nKey features:\n\n\n* Task Tracking and multiple templates\n\n\n* Real-time Collaboration\n\n\n* Commenting on Tasks\n\n\nPros of Asana\n\n\n* User-friendly interface that makes it easy to navigate and use\n\n\n* A centralized platform for team members to communicate\n\n\n* A range of customizable views, such as boards, calendars, and timelines\n\n\nCon of Asana\n\n\n* Steep learning curve\n\n\n* Limited time tracking\n\n\n* Limited reporting for teams who need more detailed insights into project progress and team performance\n\n\n3.**Monday.com**\n\n\n\n![T0_1Li-QsS-ed_cPlHXej_HKo_exw1oiWOb1nk_Fb7U=](/blobs/T0_1Li-QsS-ed_cPlHXej_HKo_exw1oiWOb1nk_Fb7U=)\n\n\nMonday.com, a task management tool that helps cross-functional teams align on their most important work, is another Kanban software app with Kanban board views. To enhance communication workflow, project managers can easily create project dashboards for real-time reporting. By customizing any workflow to meet your team's needs, Monday.com boosts alignment, efficiency, and productivity.\n\n\nKey features:\n\n\n* Multiple project view types, including timeline, Gantt chart, and Kanban board.\n\n\n* Highly customizable dashboard and templates.\n\n\n* Ability to import data from third-party apps like Microsoft Excel and Google Sheets.\n\n\nPros of Monday.com\n\n\n* Great tracking features\n\n\n* Powerful communication tool\n\n\n* Reliable project organization and management\n\n\nCons of Monday.com\n\n\n* Difficult to track time and expenses\n\n\n* Interface clutter\n\n\n* Integration problems\n\n\n4.**[Jira](https://affine.pro/blog/15-best-free-jira-alternatives-agile-project-management-2023)**\n\n\n\n![kfSZw4OlfIk6vm-OKU5x30Zyy5-hHxtiaEjbLpo92Fk=](/blobs/kfSZw4OlfIk6vm-OKU5x30Zyy5-hHxtiaEjbLpo92Fk=)\n\n\nJira is a project management software created by Atlassian that is widely used by teams to plan, track, and deliver projects efficiently in an agile environment. The software is highly popular among software development teams and includes a range of features specifically designed to support agile methodologies like Scrum and Kanban. Jira functions as a centralized platform for managing tasks, assigning them to team members, and monitoring their progress.\n\n\nKey features:\n\n\n* The software integrates with over 3,000 tools\n\n\n* Agile methodologies for planning, tracking, and managing projects and software development\n\n\n* Role assignments allow you to manage user access and permissions\n\n\nPros of Jira\n\n\n* Robust Agile Support\n\n\n* Extensive Customization Options\n\n\n* Issue Tracking and Management\n\n\nCons of Jira\n\n\n* Steep Learning Curve\n\n\n* High cost for smaller teams or organizations with limited budgets\n\n\n* Limited user interface flexibility\n\n\n5.**[Wrike](https://www.wrike.com/)**\n\n\n\n![wUsP9S-R0J3QsHfI2N9H9h4T5IO7BBKAurOwnfLIQ6A=](/blobs/wUsP9S-R0J3QsHfI2N9H9h4T5IO7BBKAurOwnfLIQ6A=)\n\n\nWrike is a comprehensive platform that covers all aspects of project planning, including task management, resource allocation, and time tracking. With Wrike, users can manage projects, organize work, enhance collaboration, and accelerate execution in all departments. Small agencies can benefit from Wrike's customizable workspace, which offers features, such as shared calendars, easy project scheduling, and collaboration tools.\n\n\nKey features:\n\n\n* Built-in tools to automate workflows\n\n\n* Pre-purposed spaces and templates\n\n\n* Real-time database replication\n\n\nPros of Wrike\n\n\n* Improved visibility\n\n\n* Easy-to-use task management\n\n\n* Impressive Gantt chart\n\n\nCons of Wrike\n\n\n* Lack of a note-taking tool\n\n\n* Delayed notifications from some integrations\n\n\n* Expensive for solo users or small teams\n\n\n6.**[Trello](https://affine.pro/blog/best-trello-alternatives-2023-project-management)**\n\n\n\n![EjrIU02UDwJSNmkl8KBCPulJhrgypmHPmdTVm4TsD2M=](/blobs/EjrIU02UDwJSNmkl8KBCPulJhrgypmHPmdTVm4TsD2M=)\n\n\nTrello, developed by Atlassian, serves as a project management solution built upon the principles of the Kanban framework. It excels in overseeing tasks through a user-friendly to-do list layout. Facilitating the exchange of boards and cards among individuals or groups, Trello comes with both a complimentary package and premium options. The upgraded versions provide enhanced automation, collaborative capabilities, and increased administrative authority.\n\n\nKey features:\n\n\n* Flexible card and board structure\n\n\n* Built-in automation features with Butler.\n\n\n* Wide variety of templates.\n\n\nPros of Trello\n\n\n* Superb notification system\n\n\n* User-friendly\n\n\n* Well-designed Kanban system\n\n\nCons of Trello\n\n\n* Limited advanced features\n\n\n* Scalability issues\n\n\n* Limited offline functionality\n\n\n7.**[Microsoft Project](https://www.microsoft.com/en-us/microsoft-365/project/project-management-software)**\n\n\n\n![rk_fBcpsfL1WeZknBaukVBouwfl4-7w5NqtOw-5GhUY=](/blobs/rk_fBcpsfL1WeZknBaukVBouwfl4-7w5NqtOw-5GhUY=)\n\n\nIn Microsoft Project, project managers and teams can utilize various views, but the platform lacks collaboration features. The software is commonly known by different names, including MS Project and its current official name, Project Professional. To access other Microsoft Project products, such as Project Online, Server, and for the Web, a subscription to Microsoft Project Plan is required. This service offers three pricing options with varying features.\n\n\nKey features:\n\n\n* Support Gantt charts and Kanban boards to plan work\n\n\n* A cost-effective communication solution with Microsoft Teams\n\n\n* Pre-built reports that can track progress, resources, programs, and portfolios\n\n\nPros of Microsoft Project\n\n\n* Integrates with the companyâs other products including Office 365, Skype, and Sharepoint\n\n\n* A similar interface to other MS products\n\n\n* Basic Templates\n\n\nCons of Microsoft Project\n\n\n* Steep learning curve\n\n\n* Not easily shareable\n\n\n* Great limitations to the cloud\n\n\n8.**[Miro](https://miro.com/)**\n\n\n\n![yqGbxR5Lpay-KancTPQDMXE8Kafc0wcJBADdMdtEJtI=](/blobs/yqGbxR5Lpay-KancTPQDMXE8Kafc0wcJBADdMdtEJtI=)\n\n\nMiro is an online workspace and collaborative platform that offers a collaborative whiteboard app for effortless teamwork. It has been a trusted tool in this space for years, with an increasing range of integrations and features that people love. Whether you're in a hybrid or remote team focused on UX design or sales departments that need visual task monitoring, Miro can meet your needs. With video chat and whiteboard capabilities, team meetings become less necessary.\n\n\nKey features:\n\n\n* Collaborative Whiteboarding\n\n\n* Agile Framework Support\n\n\n* Integration Ecosystem\n\n\nPros of Miro\n\n\n* Ease of use and implementation\n\n\n* Workflow visualization\n\n\n* Customizable templates\n\n\nCons of Miro\n\n\n* No way to save custom templates\n\n\n* Overwhelming functionality\n\n\n* Session expiration issues\n\n\n9.**[ClickUp](https://clickup.com/)**\n\n\n\n![b70Gt0FlogAH6EnUHu_95PmZiiCV6bdDl02r9OnNDl4=](/blobs/b70Gt0FlogAH6EnUHu_95PmZiiCV6bdDl02r9OnNDl4=)\n\n\n\nstreamline your work into one place with ClickUp â a free project management solution for teams. Whether you're new to project management apps or a seasoned user, ClickUp's customizable features can adapt to any team size. Plus, stay on top of your projects while on the go with the ClickUp mobile app.\n\n\nKey features:\n\n\n* Customization without code or add-ons.\n\n\n* Collaboration capabilities.\n\n\n* Real-time reporting.\n\n\nPros of ClickUp\n\n\n* Customizable workflows\n\n\n* Robust collaboration tools\n\n\n* Comprehensive reporting\n\n\nCons of ClickUp\n\n\n* Steep learning curve\n\n\n* Limited integrations\n\n\n* Limited mobile app functionality\n\n\n10.**[Smartsheet](https://affine.pro/blog/top-advanced-smartsheet-alternatives-project-management-2023)**\n\n\nSmartsheet is a widely used project management tool that labels itself as a \"work execution platform.\" It was first launched in 2006 and underwent a significant overhaul in 2010. The platform functions as an organized and adaptable solution for managing all tasks of a team. This online tool is most notable for its innovative use of project management spreadsheets.\n\n\nKey features:\n\n\n* User-friendly interface\n\n\n* The 10,000ft integration that you can use to align your projects with staffing needs\n\n\n* Custom Workflow Automation\n\n\nPros of Smartsheet\n\n\n* Easy to pick up\n\n\n* Does more than just project management\n\n\n* Real-time chat\n\n\nCons of Smartsheet\n\n\n* The complexity involved in setting up more complex workflows or automation\n\n\n* Limited integration options\n\n\n* Sluggish performance\n\n\nRemember that selecting the best project planning tool ultimately depends on your team's unique requirements and preferences.\n\n\n### Streamline Your Workflow with AFFiNE in 2024\n\n\nEach of these software tools offers a range of features to streamline your data entry process and effectively organize information. However, there is one standout option that goes above and beyond, providing comprehensive solutions for teams and businesses across various industries - **[AFFiNE.](https://affine.pro/)**\n\n\n\n![QvFa219FBhpTBWWFw0drfyhfbQpokdINs_BiTrz5Opk=](/blobs/QvFa219FBhpTBWWFw0drfyhfbQpokdINs_BiTrz5Opk=)\n\n\nAFFiNE is your all-in-one KnowledgeOS solution for effortless writing, drawing, and planning on a hyper-fused platform. You can build up your content like blocks and let your ideas run wild; you can visualize and draw with ease and creativity; you can also stay on top of your workload and achieve more in less time. AFFiNE is an exceptional project that elevates note-making to a whole new level. The best part? All of these remarkable features are available to you at absolutely no cost! Take advantage of this opportunity by signing up for AFFiNE today and optimizing your data entry processes in no time.\n\n\n* Official Website: [https://affine.pro/](https://affine.pro/)\n\n\n* GitHub: [https://github.com/toeverything/AFFiNE](https://github.com/toeverything/AFFiNE)\n\n\n* Discord: [https://discord.gg/Arn7TqJBvG](https://discord.gg/Arn7TqJBvG)\n\n\n* Twitter: [https://twitter.com/AffineOfficial](https://twitter.com/AffineOfficial)\n\n\n\n\n\n\n\n\n\n\n\n\n\n\n\n\n\n",
  "publish": true
}