{
  "title": "10 Best Work Schedule Apps in 2024 (Free & Paid) - In-Depth Review",
  "authors": [
    "Xuan Pang"
  ],
  "tags": [
    "Content"
  ],
  "description": "Discover the finest employee schedule apps for 2024, both free and paid, in our in-depth review. Find the perfect tool to manage your work routine efficiently.",
  "created": 1698192000000,
  "updated": 1704153600000,
  "layout": "blog",
  "id": "RHRxFy9uki",
  "slug": "best-work-schedule-apps-2023-review",
  "cover": "/blobs/6nA4XJPwYHvz1rDsnDisuxxmLbyaeqQA--Awz9_ShDo=",
  "md": "---\n\n\ntitle: \"10 Best Work Schedule Apps in 2024 (Free & Paid) - In-Depth Review\"\n\n\nauthor: Xuan Pang\n\n\ntags: Content\n\n\nslug: best-work-schedule-apps-2023-review\n\n\ndescription: \"Discover the finest employee schedule apps for 2024, both free and paid, in our in-depth review. Find the perfect tool to manage your work routine efficiently.\"\n\n\ncreated: 2023-10-25\n\n\nupdated: 2024-01-02\n\n\nlayout: blog\n\n\npublish: true\n\n\n---\n\n\n\n![6nA4XJPwYHvz1rDsnDisuxxmLbyaeqQA--Awz9_ShDo=](/blobs/6nA4XJPwYHvz1rDsnDisuxxmLbyaeqQA--Awz9_ShDo=)\n\n\nüöÄ Modern workplaces demand innovative productivity solutions, and scheduling apps are the answer. They streamline tasks, improve communication, and enhance coordination for teams. Our curated list of work schedule apps ensures you find the perfect fit for your team's workflow.\n\n\nüíº Explore our comprehensive roundup of the top 10 user-friendly work schedule apps. These powerful tools cater to all your team management needs, making scheduling a breeze and boosting overall efficiency.\n\n\n## **What Should You Look for in Work Schedule Apps?**\n\n\n\n![vyjPMpp9DYPLceSNDqGlqkEvIqGRYutG7PQjQVanpYs=](/blobs/vyjPMpp9DYPLceSNDqGlqkEvIqGRYutG7PQjQVanpYs=)\n\n\n1. üé® User-Friendly Interface: A work schedule app should be intuitive and easy to navigate. Avoid complex tools that can frustrate your team and hinder productivity.\n\n\n1. üì¢ Effective Communication Tools: Successful projects rely on seamless team collaboration. Prioritize apps that enable smooth interactions, including file sharing, commenting, and real-time updates among team members.\n\n\n1. üõ†Ô∏è Flexibility and Customization: Seek an app that adapts to your employee schedules and unique requirements, offering customization options to meet your specific needs.\n\n\n1. üîó Integration Capabilities: Opt for task scheduling software that effortlessly integrates with other essential tools, such as project management platforms, calendar applications, messaging apps, and other scheduling software your team relies on.\n\n\nBy carefully weighing these factors , you can make an informed decision and choose the best employee scheduling apps that align with your employee schedules üìÜ, enhancing team-wide productivity üíº, communication üì¢, and collaboration ü§ù.With that in mind, we would like to introduce the top 10 work schedule apps for you! üöÄ\n\n\n# The 10 Best Work Schedule Apps Available in 2024\n\n\n##### 1. **[AFFiNE](https://affine.pro/)**\n\n\n\n![m-dCyw47pgAR_dS7v2-wNm9fNsuClv1CdsRt9PuyBRk=](/blobs/m-dCyw47pgAR_dS7v2-wNm9fNsuClv1CdsRt9PuyBRk=)\n\n\nAFFiNE is a cutting-edge work shedule software that is designed to assist you in organizing, managing, and cooperating on tasks, projects, and information. What sets AFFiNE apart is that it is a free and open-source program that employs offline technology to ensure that it is accessible to all users. This makes it an invaluable resource for individuals who require a comprehensive time management solution for their daily needs.Key features:\n\n\n* **Write, Draw, and Plan All-in-One**: Enjoy your all-in-one KnowledgeOS solution for effortlessly writing, drawing, and planning on a hyper-fused platform. It supports kanban, table, rich-text paragraphs as building blocks to form pages or whiteboards. It carries out integrated processing here in document editing, data processing, or brainstorming.\n\n\n\n![crjX5_HRaAu3feQ3mQMTVmg-FqXutYjATZJpEZEMi98=](/blobs/crjX5_HRaAu3feQ3mQMTVmg-FqXutYjATZJpEZEMi98=)\n\n\n* **Reliable Offline Capability**: We prioritize your privacy and have made the decision to provide offline support for AFFiNE. With offline support, your work is saved on your device, allowing you to make uninterrupted progress even during internet disruptions. This feature enhances productivity and ensures high-quality decision-making.\n\n\n\n![b170NZ_-DTtnErSRI_iPhSOzNlf5B9Nt2716NlXYe6Y=](/blobs/b170NZ_-DTtnErSRI_iPhSOzNlf5B9Nt2716NlXYe6Y=)\n\n\n* **Privacy focussed:** AFFiNE is built with your privacy in mind and is one of our key concerns. We want you to keep control of your data, allowing you to store it as you like, where you like, while still being able to freely edit and view your data on-demand. With AFFiNE, you own your data, no matter what. With no sacrifice to collaborate and share, all your data is in your hand.\n\n\n\n![7tLzErsXRl3O-9-0m62ySSd00VYnYYtRKFaZUFit2Jg=](/blobs/7tLzErsXRl3O-9-0m62ySSd00VYnYYtRKFaZUFit2Jg=)\n\n\n##### 2. **[Google Calendar](https://calendar.google.com/)**\n\n\n\n![QtlgtphP39h6jevOUttDuLuYz5PRg4tJ3JzwUEIIKDc=](/blobs/QtlgtphP39h6jevOUttDuLuYz5PRg4tJ3JzwUEIIKDc=)\n\n\nGoogle Calendar is a widely recognized and trusted calendar app that serves as an excellent tool for employee scheduling. With its intuitive interface and seamless integration with other Google services, it offers a robust solution for businesses of all sizes.\n\n\n**Key Features:**\n\n\n* **User-Friendly Interface**: Google Calendar boasts an easy-to-navigate interface, allowing for effortless schedule creation and sharing among team members.\n\n\n* **Integration Capabilities**: Seamlessly integrates with other Google apps like Gmail and Google Meet, facilitating efficient communication and productivity.\n\n\n* **Mobile Accessibility**: Access your schedules on the go with the mobile app, ensuring that you and your team stay organized and connected, no matter where you are.\n\n\n\n\n\n##### 3. **[Humanity](https://www.humanity.com/app/)**\n\n\n\n![TpTCc07izEUxRCHQsIiqe7O73F3q8BetGEcIJJ_QH4g=](/blobs/TpTCc07izEUxRCHQsIiqe7O73F3q8BetGEcIJJ_QH4g=)\n\n\nHumanity is a comprehensive employee scheduling and workforce management solution designed to optimize labor costs and improve productivity. It offers a range of features to streamline scheduling processes for businesses in various industries.\n\n\n**Key Features:**\n\n\n* **Demand Forecasting**: Humanity uses AI-powered forecasting to predict staffing needs, helping you schedule the right number of employees at the right times to meet demand.\n\n\n* **Mobile Access**: Employees can access their schedules, request time off, and swap shifts through the mobile app, promoting convenience and real-time communication.\n\n\n* **Compliance Tracking**: Ensure compliance with labor laws and regulations by automating tracking of employee hours, breaks, and overtime.\n\n\n\n\n\n##### 4. **[Sling](https://getsling.com/)**\n\n\n\n![bWRZKH7js6snAcOhh2_zSPQpGZ-eKRpMET2nHDJpr7M=](/blobs/bWRZKH7js6snAcOhh2_zSPQpGZ-eKRpMET2nHDJpr7M=)\n\n\nSling is a versatile work scheduling and communication platform suitable for businesses ranging from small startups to large enterprises. It focuses on simplifying shift planning and fostering team collaboration.\n\n\n**Key Features:**\n\n\n* **Drag-and-Drop Scheduling**: Easily create and modify schedules with a user-friendly drag-and-drop interface, saving time and reducing errors.\n\n\n* **Labor Cost Control**: Monitor labor costs in real-time, allowing you to make data-driven decisions and stay within budget.\n\n\n* **Task Management**: Assign tasks to specific shifts, ensuring that employees know their responsibilities and enhancing productivity.\n\n\n\n\n\n##### 5. **[Workbook](https://www.worktime.com/)**\n\n\n\n![T6NLMYR46TVl-Q7qsahkU_tA36szGz6IMiv3cCYyUdk=](/blobs/T6NLMYR46TVl-Q7qsahkU_tA36szGz6IMiv3cCYyUdk=)\n\n\nWorkTime is a straightforward yet powerful employee time tracking and scheduling app designed for businesses seeking efficient workforce management.\n\n\n**Key Features:**\n\n\n* **Time Tracking**: Accurately record employee work hours, breaks, and overtime to maintain compliance and manage payroll effectively.\n\n\n* **Leave Management**: Streamline the process of requesting and approving time off, ensuring smooth scheduling even with staff vacations.\n\n\n* **Reporting and Analytics**: Access detailed reports and analytics to gain insights into employee productivity and identify areas for improvement.\n\n\n\n\n\n##### 6. **[Clickup](https://clickup.com/)**\n\n\n\n![1yKIgqBw9WXrac9_ECD5k7pvRoH2UdURoQx6KayezAU=](/blobs/1yKIgqBw9WXrac9_ECD5k7pvRoH2UdURoQx6KayezAU=)\n\n\nManage multiple workflows, collaborate more effectively, and streamline your work into one place with ClickUp ‚Äì a free project management solution for teams. Whether you're new to project management apps or a seasoned user, ClickUp's customizable features can adapt to any team size. Plus, stay on top of your projects while on the go with the ClickUp mobile app.\n\n\n**Key features:**\n\n\n* üîß **Customization without code or add-ons**: ClickUp offers a highly customizable workspace where you can tailor your tasks, workflows, and views to suit your specific needs.\n\n\n* ü§ù **Collaboration capabilities**: ClickUp excels in fostering collaboration among team members. It provides features like task assignments, commenting, and file sharing, ensuring that your team can work together seamlessly no matter where they are located. ü§óüë•\n\n\n* üìä **Real-time reporting**: With ClickUp, you can access real-time reporting and analytics that give you insights into your projects and team's performance. Monitor progress, track key metrics, and make data-driven decisions to optimize your workflow. üìàüìä\n\n\n\n\n\n##### 7. **[Deputy](https://www.deputy.com/)**\n\n\n\n![G6PFjcfSWDXSYXl0e3KE_p-DCwQFwsjzuEsTak0F_Qw=](/blobs/G6PFjcfSWDXSYXl0e3KE_p-DCwQFwsjzuEsTak0F_Qw=)\n\n\nDeputy is an all-in-one workforce management solution that simplifies scheduling, time tracking, and employee communication for businesses of all sizes.\n\n\n**Key Features:**\n\n\n1. **Auto-Scheduling**: Utilize Deputy's AI-driven auto-scheduling to optimize shifts based on employee availability and skillsets.\n\n\n1. **Real-Time Communication**: Foster collaboration with messaging and task assignment features, ensuring everyone stays informed and engaged.\n\n\n1. **Compliance**: Easily adhere to labor laws and regulations with automated compliance checks for hours worked, breaks, and overtime.\n\n\n\n\n\n##### 8. **[Shiftboard ScheduleFlex](https://www.shiftboard.com/log-in/)**\n\n\n\n![-sOJauYEPEJxLa0P5eIt7ZzeU46dW8uPR-zEB_71SFY=](/blobs/-sOJauYEPEJxLa0P5eIt7ZzeU46dW8uPR-zEB_71SFY=)\n\n\nShiftboard ScheduleFlex is a highly customizable workforce scheduling software designed to meet the unique needs of various industries, from healthcare to retail.\n\n\n**Key Features:**\n\n\n1. **Customizable Templates**: Create and manage schedules tailored to your industry and organization's specific requirements.\n\n\n1. **Shift Bidding**: Allow employees to bid on preferred shifts, promoting flexibility and employee satisfaction.\n\n\n1. **Notifications and Alerts**: Receive real-time notifications and alerts for scheduling conflicts, ensuring smooth operations and minimal disruptions.\n\n\n\n\n\n##### 9. **[Microsoft Project](https://www.microsoft.com/en-us/microsoft-365/project/project-management-software)**\n\n\n\n![rk_fBcpsfL1WeZknBaukVBouwfl4-7w5NqtOw-5GhUY=](/blobs/rk_fBcpsfL1WeZknBaukVBouwfl4-7w5NqtOw-5GhUY=)\n\n\nIn Microsoft Project, project managers and teams can utilize various views, but the platform lacks collaboration features. The software is commonly known by different names, including MS Project and its current official name, Project Professional. To access other Microsoft Project products, such as Project Online, Server, and for the Web, a subscription to Microsoft Project Plan is required. This service offers three pricing options with varying features.\n\n\n**Key features:**\n\n\n* üìä **Support Gantt charts and Kanban boards to plan work**: Microsoft Excel offers powerful tools for project management, including the ability to create Gantt charts and Kanban boards.  üìÖ‚úÖ\n\n\n* üí¨ **A cost-effective communication solution with Microsoft Teams**: Microsoft Excel seamlessly integrates with Microsoft Teams, providing a cost-effective and collaborative communication solution for teams and organizations.  üíºüë•\n\n\n* üìà **Pre-built reports that can track progress, resources, programs, and portfolios**: Excel includes a variety of pre-built templates and functions that enable users to create reports for tracking progress, managing resources, assessing program performance, and analyzing portfolios.  üìäüîç\n\n\n\n\n\n##### 10. **[Asana](https://asana.com/?noredirect)**\n\n\n\n![ydqTK-yAEcy3MQ_9m9YdOA1zo6fLg_rmzMQGo2Vh51E=](/blobs/ydqTK-yAEcy3MQ_9m9YdOA1zo6fLg_rmzMQGo2Vh51E=)\n\n\n**Key features:**\n\n\n* **Task Tracking** üìã: Asana allows users to create tasks, assign them to team members, and set due dates. This feature helps teams stay organized and ensures that everyone knows what needs to be done and when. üóìÔ∏è‚úÖ\n\n\n* **Real-time Collaboration** ü§ù: With Asana, team members can collaborate in real-time on tasks and projects. They can add comments, attachments, and updates to tasks, enabling seamless communication and fostering a collaborative work environment. üîÑüí¨\n\n\n* **Commenting on Tasks** üí¨: Asana provides a dedicated space for users to comment on tasks, facilitate discussions, provide feedback, and address any questions or concerns. This feature promotes clear and transparent communication among team members. üí¨üì£\n\n\n\n\n\n# Which work schedule app offers the best solution?\n\n\nWhile each of the work schedule apps discussed has its unique and appealing features, we encourage users to choose the most suitable option based on their specific needs and challenges. However, from a humble perspective, we still endorse AFFiNE as the top choice in this evaluation, providing a comprehensive and flexible solution for managing work schedules and tasks, catering to a wide range of user requirements.\n\n\nCurrently, AFFiNE has released its [**stable version**](https://affine.pro/download), but we are continuing to build to a more feature-rich and stable build. **Come and join us on our journey over on our media platforms.**\n\n\n* Official Website: [https://affine.pro/](https://affine.pro/)\n\n\n* GitHub: [https://github.com/toeverything/AFFiNE](https://github.com/toeverything/AFFiNE)\n\n\n* Discord: [https://discord.gg/Arn7TqJBvG](https://discord.gg/Arn7TqJBvG)\n\n\n* Twitter: [https://twitter.com/AffineOfficial](https://twitter.com/AffineOfficial)\n\n\n\n\n\n# Support Us: Become an Early Access Sponsor for AFFiNE Cloud\n\n\n\n![BXytVyyo5RfdYDrB3IVBUYtvCRKM7sTzEfSmba_L6Eo=](/blobs/BXytVyyo5RfdYDrB3IVBUYtvCRKM7sTzEfSmba_L6Eo=)\n\n\nJoin us as an early access sponsor for the AFFiNE Cloud, and unlock advanced collaboration capabilities while upholding the local-first nature of your data. As a token of our appreciation, you'll enjoy:\n\n\n* **Early Access:** Be among the first to experience AFFiNE Cloud's powerful features, including advanced permission settings and control. This exclusive opportunity allows you to shape the future of collaboration.\n\n\n* **One-year Free Pro Plan**: Enjoy a complimentary one-year subscription to the premium AFFiNE Pro Plan, which will fill you with advanced tools designed to enhance your productivity and creativity. This plan provides you with a comprehensive suite of resources to optimize your work.\n\n\n* **Lifetime 50% Discount on Pro Plan**: Benefit from a lasting 50% discount on the Pro Plan for as long as you continue to find value in your subscription. This ongoing discount ensures that you can always access AFFiNE Cloud's premium features at an affordable rate.\n\n\n* **Other details**:\n\n\n  * AFFiNE Cloud enhances collaboration without compromising your data's local-first\n\n\n  * The free plan will remain available and always an option, with ongoing improvements.\n\n\n  * More details: [https://affine.pro/blog/affine-cloud-early-access](https://affine.pro/blog/affine-cloud-early-access)\n\n\n  * AFFiNE Cloud enhances collaboration without compromising your data's local-first\n\n\n  * The free plan will remain available and always an option, with ongoing improvements.\n\n\n  * More details: [https://affine.pro/blog/affine-cloud-early-access](https://affine.pro/blog/affine-cloud-early-access)\n\n\n\n\n\n",
  "publish": true
}