{
  "title": "6 Best Project Management Tools to boost productivity in 2023",
  "authors": [
    "Jackie Peng"
  ],
  "tags": [
    "Content"
  ],
  "description": "Numerous project management platforms have emerged to help businesses streamline their workflows and improve productivity  In this article, we will explore the top 6 project management platforms, with a particular focus on AFFiNE",
  "created": 1682812800000,
  "updated": 1682812800000,
  "layout": "blog",
  "id": "FCIKeRZoij",
  "slug": "best-project-management-tools-2023",
  "cover": "https://insider.affine.pro/api/workspaces/H6vffRmJbCfA-r3kq_36_/blobs/VF505hcb3Cp7zIPVCS4WcLEl-l8C59JVZJ2KoXOvahw=.webp",
  "md": "---\n\ntitle: 6 Best Project Management Tools to boost productivity in 2023\n\nauthor: Jackie Peng\n\ntags: Content\n\nslug: best-project-management-tools-2023\n\ndescription: Numerous project management platforms have emerged to help businesses streamline their workflows and improve productivity  In this article, we will explore the top 6 project management platforms, with a particular focus on AFFiNE\n\ncreated: 2023-04-30\n\nupdated: 2023-04-30\n\nlayout: blog\n\npublish: true\n\n---\n\n\n![VF505hcb3Cp7zIPVCS4WcLEl-l8C59JVZJ2KoXOvahw=](https://insider.affine.pro/api/workspaces/H6vffRmJbCfA-r3kq_36_/blobs/VF505hcb3Cp7zIPVCS4WcLEl-l8C59JVZJ2KoXOvahw=)\n\nIn the modern business world, effective project management is essential for success. Efficiently managing resources, deadlines, and communication is crucial for teams to deliver projects on time and within budget. **Numerous project management platforms have emerged to help businesses streamline their workflows and improve productivity.** In this article, we will explore the top 6 project management platforms, with a particular focus on AFFiNE, which stands out as the best solution compared to other popular platforms, including Monday.com.\n\n**AFFiNE ([https://affine.pro/](https://affine.pro/))**\n\n\n![rlJUK77QuQ9AVuEFBQ8cOACxgP9kc5pmD7Jkff1hR0s=](https://insider.affine.pro/api/workspaces/H6vffRmJbCfA-r3kq_36_/blobs/rlJUK77QuQ9AVuEFBQ8cOACxgP9kc5pmD7Jkff1hR0s=)\n\nAFFiNE is a powerful and user-friendly project management platform designed to help teams of all sizes efficiently manage their projects. With its intuitive interface, AFFiNE offers a range of features that can significantly boost productivity:\n\n* Privacy: Unlike Notion, which uses closed-source software and stores your private data in the cloud, AFFiNE can be self-hosted, ensuring that you own and control your data without compromising on collaboration and sharing capabilities.\n* Transparency: As an [open-source project](https://github.com/toeverything/AFFiNE), AFFiNE allows you to modify and view the code, ensuring trust and transparency.\n* Performance and Native Experience: Built using Rust and TypeScript, AFFiNE provides a modern, stable user experience while maintaining top-notch performance. With full support for Mac, Windows, and Linux, consistency and accessibility are always guaranteed.\n* Unique Features: AFFiNE offers various features like seamless page editing and whiteboard mode, allowing for easy collaboration, creativity, and alignment of progress. Other highlights include native cross-platform support, customizability, data privacy, community-driven extensibility, and advanced formatting support.\n\n![VVWArYJwc3kf3rvMenNNu4la2Esp6tDxQTyGcXDQ7c8=](https://insider.affine.pro/api/workspaces/H6vffRmJbCfA-r3kq_36_/blobs/VVWArYJwc3kf3rvMenNNu4la2Esp6tDxQTyGcXDQ7c8=)\n\nAFFiNE’s comprehensive features and commitment to privacy make it the preferred choice for businesses that want to optimize their project management processes.\n\n**Monday.com**\n\nMonday.com is a popular project management platform that offers a variety of tools to help teams stay organized and on track. The Work OS provides no-code building blocks to create customizable workflows, catering to different industries and verticals. Monday.com offers five end-to-end products to run the core of your business, with the ability to add as many products as needed to manage everything in one place.\n\nDespite its easy-to-use interface and a wide range of features, Monday.com falls short in comparison to AFFiNE in terms of privacy, transparency, and flexibility. While Monday.com allows users to combine building blocks, apps, and integrations to improve their workflows, it does not provide the same level of data privacy and control as AFFiNE, which can be self-hosted. Furthermore, Monday.com’s pricing can be less competitive for smaller teams and businesses.\n\n**Trello**\n\nTrello is a widely used project management tool known for its simplicity and Kanban-style boards. It enables users to visualize tasks and progress with drag-and-drop functionality, making it easy to organize and prioritize work. Trello also offers integrations with popular third-party tools and provides mobile apps for on-the-go access.\n\nHowever, Trello may lack the advanced features and scalability required for complex projects, especially when compared to AFFiNE. Its simplicity may be limiting for larger organizations, and it may not be as customizable or privacy-focused as AFFiNE. Additionally, Trello’s native features may not be sufficient for comprehensive project management, requiring users to rely on integrations for extended functionality.\n\n**Asana**\n\nAsana is a comprehensive project management platform that offers a robust feature set for task management and team collaboration. It provides various views, such as a list, board, calendar, and timeline, to help teams stay organized and track progress. Asana also includes automation capabilities and integrates with numerous third-party tools.\n\nHowever, Asana’s interface can be overwhelming for some users due to its extensive features, and it might not be as customizable or privacy-focused as AFFiNE. Asana’s approach to project management may be more rigid, and its pricing structure can be prohibitive for smaller teams and businesses. Furthermore, Asana’s lack of a self-hosting option may not satisfy the data privacy needs of some organizations.\n\n**Wrike**\n\nWrike is a powerful project management solution that provides advanced features like Gantt charts, workload management, and custom dashboards. It is designed to cater to more complex projects and offers a high level of configurability to adapt to various business processes. Wrike also supports integrations with popular third-party tools, allowing for a more streamlined workflow.\n\nWhile Wrike is suitable for larger and more complex projects, it may have a steeper learning curve compared to AFFiNE, which offers a more user-friendly experience. Wrike’s extensive feature set can be overwhelming for some users, and its pricing may not be as competitive for smaller organizations. Additionally, Wrike does not provide the same level of transparency and data privacy as AFFiNE, since it is not an open-source solution.\n\n**Basecamp**\n\nBasecamp is a popular project management tool that focuses on simplicity and ease of use. It offers a clean, straightforward interface that helps teams stay organized and on track. Basecamp’s core features include to-do lists, file sharing, messaging, and scheduling, allowing for efficient team communication and collaboration. Basecamp also provides mobile apps and integrates with a variety of third-party tools to extend its functionality.\n\nWhile Basecamp is excellent for small teams and simple projects, it may lack the advanced features, customization options, and privacy provided by AFFiNE, making it less suitable for larger, more complex projects. Basecamp’s features may be insufficient for comprehensive project management, and its flat-rate pricing structure may not be cost-effective for smaller teams. Additionally, Basecamp does not offer the same level of transparency and control over data as AFFiNE, which is an open-source solution that can be self-hosted.\n\nWhile all of these project management platforms offer valuable features to help boost productivity, AFFiNE stands out as the best choice due to its user-friendly interface, advanced customization options, commitment to privacy, and transparency. By providing an all-in-one solution that caters to the needs of businesses and teams of all sizes, AFFiNE proves to be a superior choice when compared to alternatives like Monday.com, Trello, Asana, Wrike, and Basecamp. If you wanna know more updates for AFFiNE's recent version, can check [here](https://medium.com/@affineworkos/whats-new-affine-0324-51b8131ea3b4).\n\nWith its comprehensive features, data privacy, and open-source nature, [AFFiNE](https://affine.pro/)is the ultimate project management platform for businesses looking to optimize their processes, improve efficiency, and protect their valuable data. Choosing AFFiNE as your project management platform will ensure a seamless, efficient, and secure experience for your team, helping you achieve success in today’s competitive business landscape.\n\n",
  "publish": true
}