{
  "title": "The Best free AI image generators of 2024",
  "authors": [
    "Xuan Pang"
  ],
  "tags": [
    "Content"
  ],
  "description": "Explore the top AI image generators of 2024. Unlock powerful tools and resources to create stunning visuals effortlessly.",
  "created": 1715212800000,
  "updated": 1715212800000,
  "layout": "blog",
  "id": "5sjrvBg23nOiR1OcAjSJs",
  "slug": "best-ai-image-generator",
  "cover": "https://app.affine.pro/api/workspaces/qf73AF6vzWphbTJdN7KiX/blobs/Nyc-Dl_ViXTATglzo0mJg7UNxQei8nJnAttGejcQQ8A=.webp",
  "md": "---\ntitle: \"The Best free AI image generators of 2024\"\n\nauthor: \"Xuan Pang\"\n\ntags: Content\n\nslug: best-ai-image-generator\n\ndescription: \"Explore the top AI image generators of 2024. Unlock powerful tools and resources to create stunning visuals effortlessly.\"\n\ncreated: 2024-05-09\nupdated: 2024-05-09\n\nlayout: blog\n\npublish: true\n---\n\n\n![Nyc-Dl_ViXTATglzo0mJg7UNxQei8nJnAttGejcQQ8A=](https://app.affine.pro/api/workspaces/qf73AF6vzWphbTJdN7KiX/blobs/Nyc-Dl_ViXTATglzo0mJg7UNxQei8nJnAttGejcQQ8A=.webp)\n\nNot too long ago, if you needed an image, **what would you probably do?**\n\nFind an image creator, explain your ideas, and wait for them to painstakingly craft the image using professional tools？\n\nBut now, thanks to [artificial intelligence](https://en.wikipedia.org/wiki/Artificial_intelligence), the entire workflow has been revolutionized. With just a few clicks, you can input your text into an [AI image generator](https://affine.pro/blog/best-ai-image-generator) and watch as it brings your vision to life instantly.\n\n**It's truly remarkable, isn't it?**\n\nIn this blog, we delve deeper into this groundbreaking technology and present to you the six finest AI image generators of 2024.\n\n# **What is AI Image Generator and how it works?**\n\n\n![xnZSxpX-sj6caRWBSBjJvPJeCQm9jk_AvqisDh9m_b8=](https://app.affine.pro/api/workspaces/qf73AF6vzWphbTJdN7KiX/blobs/xnZSxpX-sj6caRWBSBjJvPJeCQm9jk_AvqisDh9m_b8=.webp)\n\nWhat exactly is an AI Image Generator, and how does it work? Let's break it down.\n\nAn AI Image Generator is a tool powered by [artificial intelligence (AI)](https://www.britannica.com/technology/artificial-intelligence) that transforms text descriptions into visual representations. It's like having a virtual artist at your fingertips, ready to bring your ideas to life in the form of images. But how does this magic happen?\n\nAt the heart of an AI Image Generator is a sophisticated [neural network](https://en.wikipedia.org/wiki/Neural_network_(machine_learning)), a computer system designed to mimic the way the human brain processes information. This neural network is trained on vast amounts of data, including images and corresponding text descriptions. Through this training process, the AI learns to understand the relationship between [words](https://affine.pro/blog/best-free-word-processor-software-2023-alternatives-microsoft) and images, enabling it to generate accurate visual interpretations based on textual input.\n\nWhen you input a description into an AI Image Generator, the neural network goes to work, breaking down the text into its constituent parts and analyzing the semantic meaning behind each word and phrase. It then uses this understanding to generate a [visual representation](https://affine.pro/blog/best-free-AI-powered-PowerPoint-generator-for-presentations) that best matches the input description.\n\nThe result? A seamless fusion of human creativity and machine intelligence, where ideas are transformed into visuals with unprecedented speed and accuracy. Whether you're a designer looking for inspiration, [a marketer seeking eye-catching visuals for your campaigns](https://affine.pro/blog/marketing-action-plan), or simply someone with a story to tell, AI Image Generators offer a powerful and accessible tool for unleashing your creativity and bringing your ideas to life.\n\nNow that you understand how AI Image Generators work, let's explore some of the best options available. These AI tools vary in features, ease of use, and customization options, so you can choose the one that best fits your needs and preferences.\n\n# **The Best AI Image Generators of 2024**\n\n## **1. [Dall-E 3](https://openai.com/dall-e-3)**\n\n\n![UzRPBBjA-eg-yuUuGA4aQP-TCPD0BnvwTqrK0xfaKFM=](https://app.affine.pro/api/workspaces/qf73AF6vzWphbTJdN7KiX/blobs/UzRPBBjA-eg-yuUuGA4aQP-TCPD0BnvwTqrK0xfaKFM=.webp)\n\n[Dall-E 3](https://openai.com/dall-e-3) represents the latest advancement in AI image generation, pushing the boundaries of creativity and machine learning. This cutting-edge technology allows users to convert textual prompts into detailed, high-quality images, showcasing an unprecedented level of artistic and [conceptual understanding](https://affine.pro/blog/concept-maps-definition-features-benefits-examples).\n\n**Key Features:**\n\n* **Enhanced Image Resolution and Quality:**\n\nDall-E 3 generates images with significantly improved resolution and detail compared to its predecessors. This ensures that the visuals are not only strikingly clear but also suitable for professional use, ranging from digital art to [marketing materials](https://affine.pro/blog/what-is-marketing-management-complete-guide).\n\n* **Advanced Understanding of Complex Prompts:**\n\nThis version exhibits a deeper comprehension of intricate and nuanced text prompts, enabling the creation of images that accurately reflect specific requests. Whether it's capturing the mood, style, or thematic elements, Dall-E 3 translates textual descriptions into visuals with remarkable precision.\n\n* **Greater Creative Flexibility:**\n\nDall-E 3 offers users an expansive canvas of creative possibilities. It supports a wider range of artistic styles, from photorealism to abstract art, and can generate unique compositions, characters, and scenarios, thereby broadening the horizon for creative expression and exploration.\n\n\n\n## **2. [AFFiNE](http://www.affine.pro)**\n\n<iframe\n  type=\"text/html\"\n  width=\"100%\"\n  height=\"410px\"\n  src=\"https://www.youtube.com/embed/l0N-6vTf9nY\"\n  frameborder=\"0\"\n  allow=\"accelerometer; autoplay; clipboard-write; encrypted-media; gyroscope; picture-in-picture; web-share\"\n  allowfullscreen>\n</iframe>\n\nAFFiNE stands out as a state-of-the-art AI image generator app, meticulously crafted to employ AI to streamline the [organization](https://affine.pro/blog/15-types-events-event-management-categories-examples), management, and collaboration on tasks, [projects](https://affine.pro/blog/best-project-planning-tools-software-for-teams-2023), and real-time information. Explore AFFiNE AI, your true multimodal AI copilot, dedicated to turning \"all your ideas into reality.\"\n\n**Key feature:**\n\n* **Image generation**\n\nAFFiNE's image generator is a leap forward in the realm of text-to-image technology, designed to grasp the intricacies and details of your ideas, translating them into images with remarkable accuracy. Unlike other systems that might miss the essence of your descriptions, AFFiNE excels in producing visuals that faithfully reflect the text you input. This advancement allows for the creation of AI art with ease. With our free AI image generator, crafting any content becomes as simple as pairing a picture with a phrase, enabling creativity anytime and anywhere.\n\n\n![tgtXQ3uc_-RwheuAjVPlVhbS9H6RKpZBm6tHzxhILB0=](https://app.affine.pro/api/workspaces/qf73AF6vzWphbTJdN7KiX/blobs/tgtXQ3uc_-RwheuAjVPlVhbS9H6RKpZBm6tHzxhILB0=.webp)\n\n* **[Write](https://affine.pro/blog/how-to-write-sop-step-by-step-guide-5-best-free-tools-templates) with You:** Leveraging AI technology, [AFFiNE AI](https://affine.pro/blog/affine-0-12-0-launch-week-day-3-early-access-affine-ai-self-host-upcoming-0-13-unveiled) provides intelligent assistance for every step of your writing process, from crafting sentences to entire articles. Whether you're creating content, professionally rewriting, adjusting tone, or correcting spelling and grammar, AFFiNE AI makes your text more vivid and accurate.\n\n\n![mKlGN6js3AWo1pfinLCif0zBWukbPACfy21MG0WhpJc=](https://app.affine.pro/api/workspaces/qf73AF6vzWphbTJdN7KiX/blobs/mKlGN6js3AWo1pfinLCif0zBWukbPACfy21MG0WhpJc=.webp)\n\n\n![ekvL6ejsmETWHisGAHkpeKTmQAxIop164xAVa5Fu6jg=](https://app.affine.pro/api/workspaces/qf73AF6vzWphbTJdN7KiX/blobs/ekvL6ejsmETWHisGAHkpeKTmQAxIop164xAVa5Fu6jg=.webp)\n\n* **[Draw](https://affine.pro/blog/top-8-figma-competitors-alternatives-design-prototyping) with You:** With the power of AI, AFFiNE AI can transform your outlines or ideas into eye-catching visual works. Whether it's creating presentations or building [mind maps](https://affine.pro/blog/top-5-mind-maps-examples-and-tools), AFFiNE AI helps you clearly express and share your creativity.\n\n\n![3ooSx7A8tzMOwyuanRmHAwtRsV-jEPnSPKiuRFvozZM=](https://app.affine.pro/api/workspaces/qf73AF6vzWphbTJdN7KiX/blobs/3ooSx7A8tzMOwyuanRmHAwtRsV-jEPnSPKiuRFvozZM=.webp)\n\n\n\n## **3. [Midjourney](https://www.midjourney.com/)**\n\n\n![0vt_3rg6_PpwNXlUXkso2oXO-_qbLilRD7_uXdV4tU4=](https://app.affine.pro/api/workspaces/qf73AF6vzWphbTJdN7KiX/blobs/0vt_3rg6_PpwNXlUXkso2oXO-_qbLilRD7_uXdV4tU4=.webp)\n\n[Midjourney](https://www.midjourney.com/) introduces itself as an innovative AI image generator that navigates the creative process, transforming textual descriptions into visually compelling images. It stands out by offering a unique blend of artistic freedom and AI precision, catering to both creative professionals and enthusiasts seeking to explore new visual frontiers.\n\n**Key Features:**\n\n* **Highly Detailed Imagery:**\n\nMidjourney excels in producing images with remarkable detail and depth, bringing text-based prompts to life with stunning clarity. This level of detail allows for the creation of images that can be used across a variety of contexts, from digital art exhibitions to [conceptual designs](https://affine.pro/blog/concept-maps-definition-features-benefits-examples), enhancing the visual storytelling experience.\n\n* **Adaptive Learning and Creativity:**\n\nThe platform is built on an adaptive learning model that continuously improves its understanding of textual inputs, enabling it to generate more accurate and creative interpretations over time.\n\n* **[Collaborative and Interactive Experience](https://affine.pro/blog/top-asynchronous-communication-tools-free):**\n\nMidjourney fosters a collaborative environment where users can interact with the AI, offering feedback that refines the image generation process.\n\n\n\n## **4. [Canva AI](https://www.canva.com/ai-image-generator/)**\n\n\n![yYPmeN2gxcGfN7-wPexTPao2_AgIt-YjXEPuCJqi9kI=](https://app.affine.pro/api/workspaces/qf73AF6vzWphbTJdN7KiX/blobs/yYPmeN2gxcGfN7-wPexTPao2_AgIt-YjXEPuCJqi9kI=.webp)\n\n[Canva AI](https://www.canva.com/ai-image-generator/) marks a significant leap forward in integrating artificial intelligence within graphic design tools, enhancing Canva's already robust platform. It's designed to streamline the design process, making it more intuitive and efficient for users to bring their creative visions to life. Whether for professional graphics, [marketing](https://affine.pro/blog/what-is-marketing-management-complete-guide) materials, or personal projects, Canva AI simplifies and enriches the design experience.\n\n**Key Features:**\n\n* **Intelligent Design Suggestions:**\n\nCanva AI revolutionizes the way users approach design by offering smart, AI-driven suggestions tailored to their project needs. From layout adjustments to color scheme recommendations, Canva AI analyzes the content and context of the design, providing actionable insights that enhance both aesthetics and functionality.\n\n* **Automated Content Generation:**\n\nWith Canva AI, users can leverage automatic text and graphic content generation. This feature not only saves time but also sparks creativity, allowing users to explore various design elements without manual input.\n\n\n\n## **5. [DeepAI](https://deepai.org/machine-learning-model/text2img)**\n\n\n![zd9r0-oBy3NQUoTuTyz3sKc22u_7JdOSXd1PvswW2Rs=](https://app.affine.pro/api/workspaces/qf73AF6vzWphbTJdN7KiX/blobs/zd9r0-oBy3NQUoTuTyz3sKc22u_7JdOSXd1PvswW2Rs=.webp)\n\n[DeepAI](https://deepai.org/machine-learning-model/text2img) stands at the forefront of AI innovation, providing a suite of advanced artificial intelligence tools designed to empower creators, developers, and researchers. This platform specializes in deep learning technologies, offering accessible solutions for a range of applications including image generation,[text analysis](https://aws.amazon.com/what-is/text-analysis/#:~:text=Text%20analysis%20is%20the%20process,written%20text%20for%20business%20insights.), and more.\n\n**Key Features:**\n\n* **Diverse AI Tools:**\n\nDeepAI offers a comprehensive array of tools that cater to various aspects of AI implementation, from image recognition and style transfer to text-to-image generation and [sentiment analysis](https://aws.amazon.com/what-is/sentiment-analysis/#:~:text=Sentiment%20analysis%20is%20the%20process,social%20media%20comments%2C%20and%20reviews.). This variety allows users to explore different dimensions of AI technology within a single platform.\n\n* **Open API for Integration:**\n\nA key feature of DeepAI is its open API, which allows developers to seamlessly integrate DeepAI's capabilities into their own applications or workflows. This flexibility makes it easier for businesses and creators to incorporate advanced AI functionalities into their projects without extensive AI expertise.\n\n\n\n## **6. [ClickUp](https://www.googleadservices.com/pagead/aclk?sa=L&ai=DChcSEwir5sn_gIqFAxUhCXsHHSQJABIYABABGgJ0bQ&ase=2&gclid=EAIaIQobChMIq-bJ_4CKhQMVIQl7Bx0kCQASEAAYASABEgKqdPD_BwE&ohost=www.google.com.hk&cid=CAASJeRoIYPsfCWhqfZSePyMfBG1F8qPduy9c_JWSmCt1_se1fUURz8&sig=AOD64_14e7HtEGv8RW_sjiokh3hDgdA1nw&q&nis=4&adurl&ved=2ahUKEwiezMT_gIqFAxW0mq8BHRZbDK8QqyQoAHoECAYQDA)**\n\n\n![exGjzFOxWc38bllU5Frx_ei15yA_69M8rMZY-K9zBcQ=](https://app.affine.pro/api/workspaces/qf73AF6vzWphbTJdN7KiX/blobs/exGjzFOxWc38bllU5Frx_ei15yA_69M8rMZY-K9zBcQ=.webp)\n\nClickUp is an all-in-one project management software that offers hundreds of customizable features to give individuals and teams the flexibility and tools they need to work smarter and boost productivity. ClickUp has launched an AI content assistant feature, ClickUp AI, a content ideation and creation tool in ClickUp Docs that help with [generating ideas, copywriting, copyediting](https://clickup.com/blog/copywriting-tools/), summarizing a long text to writing content, and so much more.\n\n**Key features:**\n\n* **Content Research and Ideation:** With this feature, users can generate instant and high-quality content ideas for various purposes such as blog posts, emails, advertising copy, and more.\n\n* **Copy Editing Assistance:**This functionality provides users with valuable suggestions to enhance the quality and clarity of their written content.\n\n\n\n## **7. PromeAI**\n\n\n![ZsLGHaAWkZGgbpyQYiMrL-TlJ22QsveHtnmvyOlU9po=](https://app.affine.pro/api/workspaces/qf73AF6vzWphbTJdN7KiX/blobs/ZsLGHaAWkZGgbpyQYiMrL-TlJ22QsveHtnmvyOlU9po=.webp)\n\n[PromeAI](https://www.promeai.pro/?vsource=affine) is a groundbreaking AI image generator that not only turns text prompts and image references into visually striking images but also offers thousands of selectable templates and other supportive features to produce more controllable and desired outcomes. It is the perfect choice for creative professionals and enthusiasts to explore new visual territories.\n\n**Key Features:**\n\n* **Sketch Rendering:** Transforms simple hand-drawn sketches into detailed and lifelike renderings, assisting designers and architects in visualizing concepts more swiftly. It offers a convenient way to convert initial ideas into detailed design plans.\n\n*  **Background Diffusion:** An intelligent feature that removes image backgrounds, creating images with transparent or different backgrounds to meet various design needs. It improves the efficiency and flexibility of image editing.\n\n*  **Outpainting:** Enables users to extend the boundaries of images, adding additional content. This is particularly useful when canvas expansion is needed without damaging the original image, providing photographers and digital artists with more creative space.\n\n In addition to simple Text to Image capabilities, PromeAI is an [AI toolkit](https://blog.promeai.pro/features/promeai-product-list/) that includes functions such as Photo to Sketch, Erase & Replace, Image Variation, AI Supermodel, Text Effects, AI Relight, Image Enhancer, AI Video Generator, AI Headshot, among others.\"\n\n\n\n# **Which is the best AI image generator?**\n\nIn conclusion, the evolution of AI image generators has transformed the [creative process](https://affine.pro/blog/top-8-proven-brainstorming-techniques-creativity), offering unprecedented ease and precision in transforming text into visuals. From DALL-E 3's enhanced resolution to AFFiNE's accuracy, Midjourney's detailed imagery, Canva AI's streamlined design process, DeepAI's versatile tools, and ClickUp AI's content creation features, each platform offers unique strengths catering to diverse creative needs. Together, these AI image generators represent the cutting edge of technology, empowering users to unleash their creativity and bring their ideas to life with remarkable speed and sophistication.\n\n**Stay tuned as AFFiNE unveils its upcoming AI functionality – for more details, click the [ProductHunt](https://www.producthunt.com/posts/affine-ai).**\n\nFollow our journey on our social media platforms and become a part of our growing community. Embark on this adventure with us through our media channels.\n\n* Official Website: [https://affine.pro/](https://affine.pro/)\n\n* GitHub: [https://github.com/toeverything/AFFiNE](https://github.com/toeverything/AFFiNE)\n\n* Twitter: [https://twitter.com/AffineOfficial](https://twitter.com/AffineOfficial)\n\n* Community: [https://community.affine.pro/home](https://community.affine.pro/home)\n\n* Discord: [https://discord.gg/Arn7TqJBvG](https://discord.gg/Arn7TqJBvG)\n\n* Telegram: [https://t.me/affineworkos](https://t.me/affineworkos)\n\n\n\n\n\n",
  "publish": true
}