{
  "title": "Streamline Your Workflow with 10 Best Free Task Management Software for 2024: A Comprehensive Guide",
  "authors": [
    "Xuan Pang"
  ],
  "tags": [
    "Content"
  ],
  "description": "Unlock the potential of task management software to enhance productivity and collaboration. Discover the benefits, recommendations, and top 10 tools for effective task management. Achieve your goals with ease.",
  "created": 1685664000000,
  "updated": 1704153600000,
  "layout": "blog",
  "id": "08tMn3twYy",
  "slug": "best-free-task-management-software-streamline-workflow",
  "cover": "/blobs/qz0YtXssD4q9aXy7noicOQUyrP1zSruk6Qp4_B5r_vA=",
  "md": "---\n\n\ntitle: \"Streamline Your Workflow with 10 Best Free Task Management Software for 2024: A Comprehensive Guide\"\n\n\nauthor: \"Xuan Pang\"\n\n\ntags: Content\n\n\nslug: best-free-task-management-software-streamline-workflow\n\n\ndescription: \"Unlock the potential of task management software to enhance productivity and collaboration. Discover the benefits, recommendations, and top 10 tools for effective task management. Achieve your goals with ease.\"\n\n\ncreated: 2023-06-02\n\n\nupdated: 2024-01-02\n\n\nlayout: blog\n\n\npublish: true\n\n\n---\n\n\n\n![qz0YtXssD4q9aXy7noicOQUyrP1zSruk6Qp4_B5r_vA=](/blobs/qz0YtXssD4q9aXy7noicOQUyrP1zSruk6Qp4_B5r_vA=)\n\n\nIn today's fast-paced digital age, staying organized and managing tasks effectively is essential for success. That's where task management software steps in, revolutionizing the way individuals and teams handle their workloads.\n\n\nIn this comprehensive guide, we'll explore the concept of task management software, uncover its remarkable benefits, and provide you with handpicked recommendations to help you find the perfect solution.\n\n\n**Get ready to take control of your tasks, increase productivity, and achieve your goals like never before!**\n\n\n## **What is task management software**\n\n\nTask management software, also known as online task managers or task management solutions, is a digital tool designed to help you keep track of your tasks, organize your workload, and maximize productivity.\n\n\nSay goodbye to the limitations of paper lists and hello to powerful project management tools, which empower individuals and teams to efficiently manage tasks throughout their entire lifecycle, from setting due dates to tracking progress on every task.\n\n\n## **The benefits of task management software**\n\n\n* **Efficient Task Organization:** No matter the size or complexity of your tasks, task management software allows you to efficiently organize them. Replace the chaos of scattered lists with simple, intuitive interfaces that enable you to create personalized to-do lists, prioritize tasks, and visualize project structures.\n\n\n* **Enhanced Productivity and Time Management:** With task management software, time becomes your ally. Set due dates, establish task priorities, and leverage built-in time management features to track your progress. Stay on top of your workload, meet deadlines, and gain insights into your time allocation for optimal efficiency.\n\n\n* **Seamless Collaboration and Team Management:** Task management software excels in fostering collaboration within teams. From managing a team to leveraging differences in work habits and perspectives, these tools facilitate constant monitoring of work progress. Boost transparency and information flow, utilize team members' skills, and provide objective feedback to ensure effective team management.\n\n\n* **Preventing Burnout and Ensuring Work Alignment:** The well-being of individuals and teams is crucial for sustained productivity. Task management software helps prevent burnout by encouraging breaks, delegating tasks, and promoting work alignment. By aligning work with team members' strengths and providing a transparent and collaborative environment, these tools create an atmosphere conducive to success.\n\n\n## **Recommendations of task management software:**\n\n\nSelecting the right task management software is essential for maximizing its benefits. Consider the size of your team and your specific project management needs. Look for software that offers a customizable environment, allowing you to adapt the tool to fit your workflow seamlessly. Additionally, prioritize features such as task priorities, dependencies, progress tracking, and collaboration capabilities to ensure efficient task management and effective team communication.\n\n\n## **Here we provide you with the 10 best task management softwares & tools:**\n\n\n### 1.AFFiNE\n\n\n\n![fIyVuLjii0wRnvllDsrLwy0gvuwQvXjuEhcgUz1Mvrg=](/blobs/fIyVuLjii0wRnvllDsrLwy0gvuwQvXjuEhcgUz1Mvrg=)\n\n\n[AFFiNE](http://affine.pro/) is an innovative and comprehensive task management software designed to help you organize, manage, and collaborate on tasks, projects, and information. As a next-generation knowledge base, AFFiNE combines the best features of popular apps like Notion and Miro into one powerful, flexible, and user-friendly platform. It focuses on data security, privacy, and collaboration, making it the perfect choice for managing your daily plans, personal knowledge repository, and team projects.\n\n\n\n\n\n**Key features:**\n\n\nLocal-first design: AFFiNE prioritizes data security and privacy, ensuring your data remains stored on your local device unless you actively delete it.\n\n\n1. Multiple workspaces: Create different workspaces to manage various types of data, like managing your daily tasks, personal knowledge repository, and team projects simultaneously.\n\n\n1. Pages within workspaces: Organize your tasks, notes, and ideas in different pages within each workspace, making it easy to navigate and find what you need.\n\n\n1. Powerful search functionality: Quickly locate the documents, tags, or actions you want with a modern search app that can handle multiple workspaces and pages.\n\n\n1. Advanced collaboration capabilities: Invite friends or colleagues to become collaborators in your workspace, engage in real-time multi-person editing, and share your workspaces with others.\n\n\n1. Time tracking and goal setting: Use AFFiNE’s built-in features to track your time spent on tasks and set goals to improve your productivity.\n\n\n1. Open-source: As an open-source app, you can access AFFiNE’s code, allowing for customization and the ability to deploy the server on your own computer or data center.\n\n\nHere are some quick view of what you can do with AFFiNE core features\n\n\n* Database\n\n\n  * Easily create, organize, and track your daily taskes like never before. Say goodbye to complex processes and welcome an unprecedented ease-of-use way\n\n\n  \n![s1-kYhapEsBPNhy4eDA2SnXKwB_ws6Ke7dGXUqpMjDo=](/blobs/s1-kYhapEsBPNhy4eDA2SnXKwB_ws6Ke7dGXUqpMjDo=)\n\n\n* Powerful Edgeless mode\n\n\n  * Visualize and connect your daily tasks smoothly with better cartoon-style shape, slick pen, and connectors. No constraints. Limited only by your imagination. Ohhh, by the way, images now are supported to upload!! We just make everything easy for you. Now you may enjoy your drawing time!\n\n\n\n![6ANoWk9Wn5mf2IsgS-yy-MRN-cf1iRf4VZfF9ihUAgs=](/blobs/6ANoWk9Wn5mf2IsgS-yy-MRN-cf1iRf4VZfF9ihUAgs=)\n\n\n* Notion/html/markdown import-supported\n\n\n  * Effortlessly import Notion, HTML, or Markdown content into AFFiNE with just a few simple clicks, preserving formatting, and structure, and saving time, enhancing user experience. Say goodbye to the complicated process of manually converting and adjusting content.\n\n\n  \n![Funez4FG6_YYPlgBYoKy3M7F2NJLCtwrE7NplHuuB4Q=](/blobs/Funez4FG6_YYPlgBYoKy3M7F2NJLCtwrE7NplHuuB4Q=)\n\n\n* Featuring an all-page UI update with filter options\n\n\n  * Users can now effortlessly access the all-page, which enables them to conveniently sort previous articles in ascending or descending order, or favourites with the filter function. Enjoy efficient organization, quick access to desired content, and a seamless browsing experience.\n\n\n  \n![1g2H5Hhy5gspGUGP2LnD5e2O2dyKzVpE-6rvabbR5oA=](/blobs/1g2H5Hhy5gspGUGP2LnD5e2O2dyKzVpE-6rvabbR5oA=)\n\n\nPricing: FREE\n\n\nLooking for more guidance? We prepared you with a well-written and clear article explaining specifically how to build the Agile Workflow in AFFiNE:\n\n\n**[Agile Workflow: What is it and how to build your own one](https://affine.pro/blog/agile-workflow-what-is-agile-workflow-how-to-build)**\n\n\nAFFiNE is a fantastic, completely FREE task management app that welcomes everyone to experience its powerful features, making it a delightful surprise for those seeking a comprehensive solution for their daily task management needs.\n\n\n* Come and check out our latest beta version, enjoy your creative moments.\n\n\n* For more things related to AFFiNE, come and check out our website: AFFiNE — All In One KnowledgeOS\n\n\n* Wanna try it online:[https://app.affine.pro/](https://app.affine.pro/)\n\n\n### 2.**Microsoft To Do**\n\n\n\n![bP2PdUs7qpoGM4gnXVqwlGH6QldbeqT0BFOkJT4ZT9g=](/blobs/bP2PdUs7qpoGM4gnXVqwlGH6QldbeqT0BFOkJT4ZT9g=)\n\n\nMicrosoft To Do is not a comprehensive project management software. It's not even a light collaboration software. Instead, this is a highly functional to-do list application that'll help anyone keep their personal projects and tasks on time and on target.\n\n\n**Key features:**\n\n\n1. Efficient Task Prioritization and Scheduling:Microsoft To Do excels in task prioritization and scheduling, allowing you to create main tasks and break them down into subtasks. This feature enables you to track the intricacies of your projects and ensures that no task gets overlooked. Stay organized and focused on your goals with the intuitive task management interface.\n\n\n1. Streamlined Document Storage:In addition to managing your tasks, Microsoft To Do provides a convenient file upload field within each task. This allows you to attach documents, images, and various file types directly to your tasks. Keep all relevant project files in one place for easy access and seamless collaboration.\n\n\n1. Seamless File Sharing: Collaboration is made effortless with Microsoft To Do's file sharing capabilities. Not only can you upload files to individual tasks, but you can also share tasks with other app users. This feature enables smooth communication and collaboration within your team, ensuring everyone has access to the necessary files and information.\n\n\n**Pricing:** FREE\n\n\n### 3.Notion\n\n\nWhen it comes to collaboration tools, Notion excels in three key aspects: simplicity, familiarity, and affordability. It offers a user-friendly and intuitive platform that won't break the bank, making it an excellent choice for teams seeking a straightforward solution for planning and executing small projects.\n\n\n\n![uKymDFm0uyo15M7Ef6UFgVMkAGYNIJGjLZg2s7fYjwA=](/blobs/uKymDFm0uyo15M7Ef6UFgVMkAGYNIJGjLZg2s7fYjwA=)\n\n\n**Key features:**\n\n\n1. Simplicity: Notion prides itself on its simplicity. The platform provides a clean and easy-to-navigate interface, ensuring that users can quickly get up to speed and start utilizing its features without a steep learning curve. From creating and organizing tasks to collaborating with team members, Notion keeps things streamlined and straightforward, allowing you to focus on the work at hand.\n\n\n1. Familiarity: Notion brings a sense of familiarity to its users, making it a comfortable choice for those who are accustomed to traditional productivity tools. With its familiar and recognizable interface, you'll feel right at home while using Notion. It incorporates elements from note-taking applications, task management tools, and project management software, giving you a sense of familiarity and ensuring a smooth transition to the platform.\n\n\n1. Affordability: One of the standout advantages of Notion is its affordability. Unlike many collaboration tools that come with hefty price tags, Notion offers competitive pricing plans that won't strain your budget. This makes it an attractive option for teams and individuals looking for a cost-effective solution without compromising on functionality or quality. With Notion, you can enjoy the benefits of a powerful collaboration tool without breaking the bank.\n\n\n**Pricing:** 0-$15 per user/ month\n\n\n### 4.ClickUp\n\n\n\n![zI5nBNDlxheO1dJ2peGN9qM8w5zjh512sR2yp14PHSI=](/blobs/zI5nBNDlxheO1dJ2peGN9qM8w5zjh512sR2yp14PHSI=)\n\n\nClickUp is an exceptional online task management tool designed to simplify the creation, management, and tracking of tasks. With its extensive range of features, ClickUp offers a comprehensive solution for teams of all sizes. However, for smaller teams, understanding and navigating some of the functionalities can be overwhelming and time-consuming. That said, the benefits and capabilities of ClickUp are well worth the effort.\n\n\n**Key Features:**\n\n\n1. Task Creation and Assignment:ClickUp empowers you to effortlessly create and assign tasks to multiple team members. By prioritizing tasks based on their importance, you ensure that your team knows which tasks to focus on first. This efficient system helps streamline workflows and boosts productivity.\n\n\n1. Effortless Task Updates:Updating task details, attaching files, and modifying formatting is made simple with ClickUp's intuitive interface. By using the /slash command, you can access a menu of shortcuts and helpful commands. This feature allows for swift task customization and seamless collaboration.\n\n\n1. Real-time Communication:ClickUp recognizes the importance of effective team communication. With their in-app chat functionality, you can easily add comments and tag team members, facilitating real-time discussions and updates. This fosters a collaborative environment where everyone stays informed and connected.\n\n\n**Pricing:** 0-$19 per user/ month\n\n\n### 5.Todoist\n\n\n\n![jkItU6yBVzZfdoezNEdBoMyRfaaMVMe6ZA4lroaFdFA=](/blobs/jkItU6yBVzZfdoezNEdBoMyRfaaMVMe6ZA4lroaFdFA=)\n\n\nTodoist is a leading task management application designed to help individuals and teams stay organized, productive, and in control of their tasks. With its user-friendly interface and robust features, Todoist simplifies task management, enabling you to focus on what matters most.\n\n\n**Key Features:**\n\n\n1. Smart Task Creation and Organization:Todoist offers a simple and intuitive task creation process. You can quickly add tasks, set due dates, assign labels and priorities, and even create subtasks to break down complex projects. With its drag-and-drop functionality, you can effortlessly organize tasks into projects and sections, ensuring a clear structure for your workflow.\n\n\n1. Collaborative Task Management:Todoist recognizes the power of teamwork. It enables seamless collaboration by allowing you to share tasks and projects with others, assign tasks to team members, and set project permissions. Real-time updates and notifications keep everyone on the same page, fostering effective communication and efficient task delegation.\n\n\n1. Productivity Boosting Features:Todoist is packed with features designed to enhance your productivity. With recurring tasks, you can automate the creation of repetitive tasks, saving time and effort. The ability to set reminders and deadlines ensures that you never miss an important task. Additionally, the \"Karma\" feature tracks your productivity trends, providing insights and motivation to accomplish your goals.\n\n\n**Pricing:** 0-$5 per user/ month\n\n\n### 6.Monday.com\n\n\n\n![EsSNz0RM0qL6lJz_g9UnbRktSaqI0DP1ZGdDKThUtxY=](/blobs/EsSNz0RM0qL6lJz_g9UnbRktSaqI0DP1ZGdDKThUtxY=)\n\n\nMonday.com is a versatile project management and team collaboration platform designed to streamline workflows and enhance productivity. With its intuitive interface and powerful features, Monday.com empowers teams to work more efficiently and effectively.\n\n\n**Key Features:**\n\n\n1. Customizable Workflows: Monday.com allows teams to create custom workflows that align with their specific processes and projects. With its visual board interface, you can design and adapt workflows to match your team's unique needs. Create different boards for various projects, departments, or processes, and customize them with columns, tags, and automations. From task management to project tracking, Monday.com provides the flexibility to build workflows that optimize your team's productivity.\n\n\n1. Collaborative Team Management: Efficient team collaboration is at the heart of Monday.com. The platform provides a centralized space for teams to collaborate, communicate, and track progress in real-time. Team members can easily assign tasks, set deadlines, and track progress within the platform. Communication is streamlined with the ability to leave comments, tag team members, and share files directly within tasks. With a clear overview of each team member's responsibilities and progress, Monday.com fosters transparency and accountability.\n\n\n1. Extensive Integrations and Automations: Monday.com seamlessly integrates with popular tools and platforms, allowing teams to connect their workflows and enhance productivity. Integration options include communication tools like Slack and Microsoft Teams, cloud storage platforms like Google Drive and Dropbox, and time-tracking applications like Toggl and Harvest. Furthermore, Monday.com offers a robust automation engine that enables teams to automate repetitive tasks and streamline workflows. Automations can be set up to trigger actions, send notifications, update statuses, and more, saving time and reducing manual work\n\n\n**Pricing:** 0-$16 per user/ month.\n\n\n### 7.Asana\n\n\n\n![RrARJD7YQgdMWhy2ka6NKS9nRMT10swnhZZeQYMgwks=](/blobs/RrARJD7YQgdMWhy2ka6NKS9nRMT10swnhZZeQYMgwks=)\n\n\nAsana is a powerful project management tool designed to help teams stay organized, collaborate effectively, and achieve their goals. With its intuitive interface and robust features, Asana simplifies task management, enabling teams to work seamlessly and efficiently.\n\n\n**Key Features:**\n\n\n1. Task and Project Management:Asana offers a comprehensive task and project management system that allows teams to create, assign, and track tasks with ease. You can break down complex projects into manageable tasks, set due dates, assign responsibilities to team members, and track progress visually. The ability to create subtasks, add attachments, and set dependencies ensures a clear and structured workflow.\n\n\n1. Team Collaboration and Communication:Asana fosters collaboration by providing various communication and collaboration features. Team members can share comments, tag colleagues, and have conversations within tasks, ensuring seamless communication and reducing the need for lengthy email chains. The activity feed keeps everyone updated on project changes and allows for real-time collaboration.\n\n\n1. Visualize and Track Progress:One of Asana's standout features is its visual representation of project progress. With customizable project boards, you can create Kanban-style workflows, visualize tasks in different stages, and easily track progress. This visual approach provides clarity and transparency, enabling teams to identify bottlenecks, adjust priorities, and ensure projects stay on track.\n\n\n**Pricing:** 0-$24.99 per user/ month\n\n\n### 8.Proofhub\n\n\n\n![xUJTfuPin2Wha2Kc9C5TAqi9ABomdhATJYsHQlrzvoU=](/blobs/xUJTfuPin2Wha2Kc9C5TAqi9ABomdhATJYsHQlrzvoU=)\n\n\nSimilar to other project management software, ProofHub assists teams in organizing and monitoring project progress while facilitating collaboration. What sets ProofHub apart as one of the premier project management applications is its inclusion of features specifically designed for discussing visual content. If your team frequently handles design projects, advertisements, or other visual materials, ProofHub should be your top choice among available options.\n\n\n**Key Features:**\n\n\n1. Custom workflows and kanban boards: ProofHub allows you to create custom workflows tailored to your team's specific needs. With kanban boards, you can visualize and manage tasks in a flexible and intuitive manner, enabling smooth workflow management.\n\n\n1. Gantt charts: Gantt charts provide a visual representation of project timelines, tasks, and dependencies. With ProofHub's Gantt charts, you can plan and schedule tasks, track progress, and ensure smooth project execution.\n\n\n1. Online proofing tool: If your team works extensively with visual materials, ProofHub's online proofing tool is a game-changer. It simplifies the review and approval process for designs, advertisements, and other visual assets, enabling seamless collaboration and efficient feedback exchange.\n\n\n**Price**: 0-$89 per user/ month\n\n\n### 9.TimeCamp\n\n\n\n![AQE2_tzEP5ZTdADOoyEvIvBdyRNPjb9r0pKt3HaO5_Q=](/blobs/AQE2_tzEP5ZTdADOoyEvIvBdyRNPjb9r0pKt3HaO5_Q=)\n\n\nTimeCamp is a highly recommended tool due to its user-friendly interface, cloud-based accessibility, and comprehensive reporting and time tracking features. Its ease of use and intuitive dashboard make it easy to manage activities, while its reporting capabilities give insight into team performance. Time tracking also allows users to see exactly how much time is allocated to each task or project, making it a great tool for managing time and projects efficiently.\n\n\n**Key features:**\n\n\n1. Accounting Integration: TimeCamp integrates seamlessly with popular accounting software, allowing you to streamline your financial processes. By integrating with accounting tools, you can effortlessly transfer time entries, project costs, and other relevant data for accurate invoicing, payroll, and financial reporting. This feature ensures that your time tracking data seamlessly integrates with your accounting workflow, saving you time and reducing the potential for errors.\n\n\n1. Activity Dashboard: TimeCamp's activity dashboard provides a comprehensive overview of your team's productivity and progress. It offers real-time insights into the tasks being worked on, the time spent, and the status of projects. With the activity dashboard, you can monitor productivity, identify bottlenecks, and make data-driven decisions to optimize your team's performance. This feature empowers you to stay informed about your team's activities and take proactive measures to improve efficiency and project outcomes.\n\n\n1. Alerts/Notifications: TimeCamp includes alerts and notifications to keep you informed and updated on important events and deadlines. You can set up customized alerts to receive notifications for approaching due dates, task assignments, project milestones, or any other events relevant to your workflow. These alerts ensure that you and your team never miss critical deadlines or important updates, helping you stay on track and complete projects efficiently.\n\n\n**Price**: 0-$9.99 per user/ month\n\n\n### 10.Trello\n\n\n\n![UQiv5NJEFSQx-P8yS34FSjyz5gJjYjlAzxW4axHhUBA=](/blobs/UQiv5NJEFSQx-P8yS34FSjyz5gJjYjlAzxW4axHhUBA=)\n\n\nTrello serves as a practical task management solution, enabling users to organize their work, collaborate effectively, and benefit from automation features. While it primarily utilizes Kanban boards for visualization, its ease of use and integration make it a valuable tool for individuals and teams alike.\n\n\n**Key Features:**\n\n\n1. Efficient task organization: Trello allows you to create task lists on customizable boards, enabling you to categorize and prioritize your tasks. You can also invite team members, fostering coordination and collaboration. Additionally, the platform allows you to attach files and add comments to tasks for enhanced communication.\n\n\n1. Automation capabilities: Trello offers a built-in automation feature that simplifies the execution of routine and recurring tasks. By automating certain actions and processes, you can streamline workflows and save time.\n\n\n1. Real-time synchronization: Trello ensures that your work is synchronized across all devices, allowing you to access and update your tasks in real-time. This feature facilitates seamless collaboration and keeps everyone on the same page, regardless of their location.\n\n\nPrice: 0-$17.5 per user/ month\n\n\n\n\n\n### Which Task Management Software/ Tools offers the best solution?\n\n\nWhile each of the daily task management software&tools discussed offers its own unique and appealing features, we encourage users to choose the ideal option based on their specific needs and pain points. However, with a humble perspective, we still propose that AFFiNE emerges as the ultimate winner in this evaluation, providing a comprehensive and versatile solution for managing daily tasks and goals, catering to a wide range of user requirements.\n\n\nAFFiNE is still in its beta, but we are continuing to build to a more feature-rich and stable build. Come and join us on our journey over on our media platforms.\n\n\n* Official Website: [https://affine.pro/](https://affine.pro/)\n\n\n* GitHub: [https://github.com/toeverything/AFFiNE](https://github.com/toeverything/AFFiNE)\n\n\n* Discord: [https://discord.gg/Arn7TqJBvG](https://discord.gg/Arn7TqJBvG)\n\n\n* Telegram: [https://t.me/affineworkos](https://t.me/affineworkos)\n\n\n\n\n\n",
  "publish": true
}