{
  "title": "The Best 5 AI Social Media Post Generators for Effortless Design in 2024",
  "authors": [
    "Yiyang Zhang"
  ],
  "tags": [
    "Content"
  ],
  "description": "Discover the best 5 AI social media post generators for 2024. Create captivating social media posts with powerful AI tools, perfect for business owners, influencers, and brands.",
  "created": 1718323200000,
  "updated": 1718323200000,
  "layout": "blog",
  "id": "d_6QZgG7GS9XrcHBzCbGe",
  "slug": "best-5-ai-social-media-post-generators-effortless-design",
  "cover": "/blobs/dCOY3PXr54vBb7YvmcK9SnGSIcTlKyguwW8PoHNKJx4=",
  "md": "---\n\n\ntitle: \"The Best 5 AI Social Media Post Generators for Effortless Design in 2024\"\n\n\nauthor: \"Yiyang Zhang\"\n\n\ntags: Content\n\n\nslug: best-5-ai-social-media-post-generators-effortless-design\n\n\ndescription: \"Discover the best 5 AI social media post generators for 2024. Create captivating social media posts with powerful AI tools, perfect for business owners, influencers, and brands.\"\n\n\ncreated: 2024-06-14\n\n\nupdated: 2024-06-14\n\n\nlayout: blog\n\n\npublish: true\n\n\n---\n\n\n\n![dCOY3PXr54vBb7YvmcK9SnGSIcTlKyguwW8PoHNKJx4=](/blobs/dCOY3PXr54vBb7YvmcK9SnGSIcTlKyguwW8PoHNKJx4=)\n\n\nLet's face it – crafting engaging social media posts can be a real challenge. As someone who's been there, staring at a blank screen with no idea where to start, I get it. Whether you're a small business owner, a budding influencer, or just trying to keep your brand on point, the struggle is real. But fear not! I've found a game-changing solution that's made my life a whole lot easier, and it might just be the answer you've been looking for too.\n\n\nImagine being able to generate captivating captions, design stunning visuals, and maintain a consistent online presence without breaking a sweat. That's exactly what I discovered when I stumbled upon [AI](https://affine.pro/blog/how-to-ask-ai-question-efficiently) social media post generators. These nifty tools have revolutionized the way I approach [content](https://affine.pro/blog/best-5-ai-content-detector-tool) creation, accelerating my workflow, boosting my productivity, and allowing me to focus on what I do best – connecting with my audience.\n\n\nSo if you're tired of feeling overwhelmed by the endless demands of social media, it might be time to give AI social media post generators a try. Trust me, you won't regret it.\n\n\n# **The Power of Social Media in Today’s World**\n\n\nIn today’s fast-paced digital era, [social media](https://affine.pro/blog/best-social-media-content-calendar-templates-smart-planning) has evolved far beyond a platform for casual interactions. It’s become a critical tool for businesses, influencers, and individuals aiming to make a significant impact. With billions of active users across platforms like Facebook, Instagram, Twitter, and LinkedIn, social media offers an unparalleled opportunity to reach a vast and diverse audience.\n\n\n### **Why Social Media Matters**\n\n\n\n![7_UrUQuWIqi9bpHX4x_SxvUM-zJAVQ44l1hN_CsJj7k=](/blobs/7_UrUQuWIqi9bpHX4x_SxvUM-zJAVQ44l1hN_CsJj7k=)\n\n\n1. **Brand Awareness and Recognition:** Social media is a powerful way to build and maintain brand identity. Consistent, high-quality posts help establish a brand’s voice and make it recognizable. Over time, this can lead to stronger brand loyalty and trust among your audience.\n\n\n1. **Traffic and Conversion:** Effective social media strategies can drive significant traffic to your website or online store. Compelling posts with clear calls-to-action encourage users to visit your site, increasing the chances of conversion and sales.\n\n\n1. **Market Insights:** [Social media](https://affine.pro/blog/10-best-b2b-social-media-marketing-strategies) platforms provide valuable analytics and insights. Monitoring engagement metrics and audience behaviour can help refine your marketing strategies and understand what resonates with your followers.\n\n\n1. **[Competitive](https://affine.pro/blog/top-10-free-competitive-analysis-templates-boost-your-business) Edge:** Staying active on social media keeps you in the loop with industry trends and [competitor](https://affine.pro/blog/top-10-zapier-alternatives-competitors) activities. It’s an essential tool for staying relevant and competitive in your market.\n\n\n\n\n\n# **How AI Can Revolutionize Your Social Media Strategy**\n\n\n\n![-_EE2bUkGFqFvJ1sykftLdmEw3eBtWXLCsYgCrqJnAE=](/blobs/-_EE2bUkGFqFvJ1sykftLdmEw3eBtWXLCsYgCrqJnAE=)\n\n\nDespite its benefits, maintaining an effective [social media](https://affine.pro/blog/how-to-create-social-media-content-calendar-free-templates) presence is no small feat. The need for constant, engaging, and visually appealing content can be overwhelming. Here’s why:\n\n\n* **Time-Consuming:** Crafting posts that are both creative and aligned with your brand’s voice requires significant time and effort.\n\n\n* **Creativity Block:** Coming up with fresh and engaging [ideas](https://affine.pro/blog/10-best-whiteboard-layout-ideas-boost-your-productivity) regularly can be challenging, especially when you’re juggling multiple responsibilities.\n\n\n* **Consistency:** To keep your audience engaged, you need to post consistently, which adds to the workload.\n\n\nThis is where [AI assistance](https://affine.pro/blog/10-best-free-ai-virtual-assistants-improve-productivity) comes into play. AI social media post generators are designed to alleviate these challenges by automating and enhancing various aspects of content creation. Here’s how AI can help:\n\n\n* **Efficiency:** [AI](https://affine.pro/blog/top-25-ai-art-prompts-ideas-spark-your-creativity) tools can quickly generate content ideas, captions, and even complete posts, saving you valuable time.\n\n\n* **Creativity Boost:** By analyzing trends and past [performance](https://affine.pro/blog/10-best-free-performance-review-templates-examples-2023), AI can suggest creative angles and ideas that you might not have considered.\n\n\n* **Consistency and Quality:** AI ensures that your posts maintain a consistent quality and tone, aligning with your brand’s voice.\n\n\n* **Data-Driven Insights:** AI can analyze engagement metrics and provide insights, helping you refine your content strategy for better results.\n\n\nIn essence, AI social media post generators bridge the gap between the high demands of effective social media [marketing](https://affine.pro/blog/10-creative-content-marketing-ideas-examples-inspire-you) and the limited resources many of us have. By integrating AI into your workflow, you can enhance your [productivity](https://affine.pro/blog/10-cool-apps-enhanced-productivity-simplified-living), creativity, and overall social media presence, ensuring you stay ahead in the digital game.\n\n\n# **Discover the Best 5 AI Social Media Post Generators for 2024**\n\n\n### **1. [Predis.ai](https://predis.ai/social-media-post-generator/)**\n\n\n\n![yhbV27fEaBnp9Fp_bzEQOd6ektiu93sqqNW-O_mr9FA=](/blobs/yhbV27fEaBnp9Fp_bzEQOd6ektiu93sqqNW-O_mr9FA=)\n\n\nPredis.ai is an AI-powered social media content creation tool designed to elevate your social media strategy effortlessly. Perfect for brands, influencers, and busy professionals, Predis.ai offers end-to-end social media [management](https://affine.pro/blog/11-types-events-management-different-specializations) that boosts your social media [activities](https://affine.pro/blog/top-55-team-building-activities-exercises-work) tenfold. From creating single-image posts to producing engaging Instagram reels, Predis.ai seamlessly transforms your text input into professional-grade content. This powerful tool also provides in-depth competitive analysis, ensuring you stay ahead of the curve. Whether you're a marketer or a small business owner, Predis.ai helps you grow your social media presence with ease and efficiency.\n\n\n**Key Features of Predis.ai:**\n\n\n* **AI-Powered Content Creation and Customization:** Generate social-ready posts from your ideas, and e-commerce products, or let Predis.ai come up with creative concepts for you. Choose from various post types, including single images, carousels, and reels, and customize them with your brand assets and colours using over 2000+ template options. Create stunning and personalized brand promotion creatives in seconds by providing a few text inputs about your brand.\n\n\n* **Advanced Scheduling and Publishing:** Use the built-in publisher to schedule and publish posts across multiple platforms like Instagram, Facebook, LinkedIn, Pinterest, Twitter, GMB, and TikTok. [Plan](https://affine.pro/blog/how-to-make-work-plan-step-by-step-guide) your social media calendar in advance and ensure you never miss out on trending topics or special days. Generate and schedule bulk content such as motivational posts for an entire week or month, streamlining your content management process.\n\n\n* **Competitive Analysis and Performance Tracking:** Get detailed competitive insights to understand what [works](https://affine.pro/blog/Best-10-discord-alternatives-for-work) for your competitors and refine your strategy accordingly. Track your social media performance and analytics directly within the platform to make data-driven decisions. Utilize AI-generated captions and hashtag recommendations to enhance your posts’ visibility and engagement.\n\n\n\n\n\n## **2. [AFFiNE](https://affine.pro)**\n\n\n<iframe\n  type=\"text/html\"\n  width=\"100%\"\n  height=\"410px\"\n  src=\"https://www.youtube.com/embed/l0N-6vTf9nY\"\n  frameborder=\"0\"\n  allow=\"accelerometer; autoplay; clipboard-write; encrypted-media; gyroscope; picture-in-picture; web-share\"\n  allowfullscreen>\n</iframe>\n\n\nAFFiNE AI is here to help. Explore AFFiNE AI, revolutionary AI assistance now available for subscription, designed to enhance writing, presentation, [planning](https://affine.pro/blog/best-8-free-event-planning-templates-checklists-customize), and more. As a true multimodal AI copilot, AFFiNE AI is dedicated to turning all your ideas into reality, ensuring that every aspect of your content creation process is seamless and efficient. Whether you are crafting a short social media post or a lengthy article, AFFiNE AI is your go-to tool for high-quality, professional results. Whether brainstorming ideas, crafting presentations, or sketching visuals, AFFiNE AI amplifies creativity and [upgrades workflow](https://affine.pro/blog/10-best-ai-productivity-tools-must-know-upgrade-workflow-improve-business) efficiency. It combines the functionalities of Notion AI, Miro AI, Figma AI, Canva AI, and Clickup AI into one comprehensive platform.\n\n\n**Key Features of AFFiNE AI for Social Media Post Creation:**\n\n\n* **Intelligent Writing Assistance:** AFFiNE AI leverages advanced AI technology to provide intelligent assistance throughout the writing process. From crafting compelling captions to creating entire posts, this tool enhances your text by adjusting tone, correcting spelling and grammar, and rewriting content to ensure your social media posts are engaging and polished.\n\n\n\n![30yc2m4m1w9DKyZJg7LRq7RE1PqxaobW-jAmTEqDvU0=](/blobs/30yc2m4m1w9DKyZJg7LRq7RE1PqxaobW-jAmTEqDvU0=)\n\n\n* **Visual Content Creation:** AFFiNE AI empowers users to transform their ideas into captivating visual content. With features that facilitate the creation of eye-catching images and infographics, AFFiNE AI helps you create visually stunning posts that capture your audience's attention and enhance your social media presence.\n\n\n\n![-wc4cu8RC2H2Onwpr0svFAQ4InRpbgXg8ZAwZ_fo8q0=](/blobs/-wc4cu8RC2H2Onwpr0svFAQ4InRpbgXg8ZAwZ_fo8q0=)\n\n\n* **Effortless Planning and Organization:** AFFiNE AI offers intelligent mind-mapping tools that simplify the planning and organization of your social media content. Its automatic sorting and tagging features enhance knowledge management, while the Inline AI assistant provides content summaries and suggestions for improvement. This ensures your social media strategy is well-structured and effective, making it easier to maintain a consistent posting schedule.\n\n\n\n![vAIjEsOgffF7f-qjhyQwXKECDRH79_vMqicaTWpMCR8=](/blobs/vAIjEsOgffF7f-qjhyQwXKECDRH79_vMqicaTWpMCR8=)\n\n\n\n\n\n### **3. [SocialBee](https://socialbee.com/ai-post-generator/)**\n\n\n\n![fI_kQBCeRkZEx04aSfDe7gvgzL3iV_E8FDAfmsUJvdc=](/blobs/fI_kQBCeRkZEx04aSfDe7gvgzL3iV_E8FDAfmsUJvdc=)\n\n\nSocialBee is an intuitive social media scheduling web and mobile app designed to streamline your social media management. While it focuses exclusively on scheduling, SocialBee offers a robust set of features to enhance your content publishing experience across multiple platforms. Its user interface, though simple, is highly functional, providing easy access to all essential tools via a top bar and a left-hand sidebar menu. SocialBee integrates with a wide range of social networks, including Facebook, Instagram, Twitter, LinkedIn, Pinterest, and Google Business, making it a versatile tool for managing your social media presence efficiently.\n\n\n**Key Features of SocialBee:**\n\n\n* **Comprehensive Scheduling and Content Management:** SocialBee allows you to schedule posts for various social media platforms using a single draft, with separate editors for each platform to optimize your content. The Content section lets you create and manage content categories, set up content sources, and use the Content Approval tool to streamline your workflow. Additionally, the Hashtag Collections section helps you easily insert commonly used hashtags into your posts.\n\n\n* **AI-Powered Social Media [Strategy](https://affine.pro/blog/how-to-build-go-to-market-strategy-free-templates) and Content Creation:** The AI-based Co-pilot feature generates a complete social media strategy and calendar for your brand. After answering a simple questionnaire about your brand, the Co-pilot provides tailored content suggestions and scheduling plans. This includes an AI caption generator, helping you craft engaging posts effortlessly.\n\n\n* **Advanced Integration and Analytics:** SocialBee integrates with numerous tools and services, including Canva, Unsplash, GIPHY, Quuu, URL shorteners, Pabbly, and Make. These integrations enhance your content creation and distribution capabilities. Furthermore, SocialBee offers detailed analytics and data for your audience, helping you track performance and refine your social media strategies.\n\n\n### **4. [Anyword](https://anyword.com/social-post-generator/)**\n\n\n\n![XMfOZPgg0uFRpMeWO0Nlx8IcgloAf8L2jwGL54PRzxQ=](/blobs/XMfOZPgg0uFRpMeWO0Nlx8IcgloAf8L2jwGL54PRzxQ=)\n\n\nAnyword is an exceptional AI-driven writing solution designed to cater to marketers and writers from various backgrounds. This fully web-based platform offers all the tools you need to enhance your [writing](https://affine.pro/blog/top-10-best-wordai-alternatives-competitors-ai-writing) skills and meet client requirements efficiently. As a cloud-based tool, Anyword enables users to create, test, and optimize [marketing](https://affine.pro/blog/how-to-write-marketing-action-plan-step-by-step-guide) copy with the help of artificial intelligence, leveraging natural language processing to generate compelling copy for websites, social media, emails, and ads. What sets Anyword apart is its ability to provide multiple options for each request, allowing for easy comparison and selection of the best content.\n\n\n**Key Features of Anyword:**\n\n\n* **Multiple Copy Options:** Anyword doesn't just generate a single solution. Instead, it provides multiple options for each request, making it easier to compare and choose the best content for your needs.\n\n\n* **Versatile Content Generation:** From Instagram captions and Twitter posts to LinkedIn updates and YouTube descriptions, Anyword excels at creating engaging content for a variety of platforms. This includes crafting AI-driven captions, engaging tweets with emojis and hashtags, professional LinkedIn posts, and captivating YouTube titles and descriptions.\n\n\n* **Customizable Settings:** Users can set tones, target audiences, and select advertising platforms like HubSpot, Google Ads, Meta Ads, and LinkedIn, from which Anyword will pull data to generate optimized content. This customization ensures that the generated content aligns perfectly with your specific [marketing](https://affine.pro/blog/the-7-key-stages-marketing-sales-pipeline-visual-guide) goals and audience preferences.\n\n\n### **5. [Buffer](https://buffer.com/ai-assistant/social-media-post-creator)**\n\n\n\n![0HjjIzcVn-swHc_iLmhobw5vF5cUw8FE8lbeXyodsaI=](/blobs/0HjjIzcVn-swHc_iLmhobw5vF5cUw8FE8lbeXyodsaI=)\n\n\nBuffer's AI assistant is a powerful tool designed to streamline and enhance your social media content creation. Whether you're looking to generate new posts, repurpose existing ones, or brainstorm fresh ideas, Buffer’s AI assistant is here to help you grow your follower base and supercharge your engagement. This innovative tool allows you to achieve significant audience growth and genuine boosts in engagement without the need for paid ads or time-consuming manual efforts.\n\n\n**Key Features of Buffer**\n\n\n* **Efficient Content Creation and Repurposing:** Buffer’s AI assistant can generate new posts for your schedule, rephrase existing posts to adjust their tone, rewrite LinkedIn posts into Twitter threads, and tweak last year’s best-performing posts to keep them relevant and engaging.\n\n\n* **Personalized and Consistent Branding:** The AI can create personalized posts tailored to different audiences to improve engagement across all channels. It allows you to set guidelines for the tone and style of your posts, ensuring a consistent brand voice throughout your content.\n\n\n* **Versatile and Multilingual Support:** Buffer's AI assistant can quickly generate posts in multiple languages, making it easier to reach a global audience. It can also respond to common customer inquiries or comments efficiently, and repurpose viral posts into multiple variants to maximize their reach across different platforms.\n\n\n\n\n\n# **Embrace the Future of Social Media Content Creation with AI Assistance**\n\n\nCreating effective social media content doesn’t have to be a daunting task. AI social media post generators can streamline your content creation process, saving you time and ensuring your posts stand out in the crowded digital landscape. Whether you’re a small business owner, a marketer, or an individual looking to boost your online presence, these AI tools can help you achieve your goals. Embrace the future of content creation and see how AI can transform your social media strategy in [2024](https://affine.pro/blog/10-free-project-communication-plan-templates-examples).\n\n\n**But don’t take our word for it. Try AFFiNE for yourself to see if we deserve this spot on the list. Come and join us on our journey over on our media platforms. 🚀**\n\n\n**Stay tuned as AFFiNE unveils its upcoming [AFFiNE AI](https://affine.pro/ai) – for more details, click the [ProductHunt](https://www.producthunt.com/posts/affine-ai).**\n\n\nFollow our journey on our social media platforms and become a part of our growing community. Embark on this adventure with us through our media channels.\n\n\n* Official Website: [https://affine.pro/](https://affine.pro/)\n\n\n* GitHub: [https://github.com/toeverything/AFFiNE](https://github.com/toeverything/AFFiNE)\n\n\n* Twitter: [https://twitter.com/AffineOfficial](https://twitter.com/AffineOfficial)\n\n\n* Community: [https://community.affine.pro/home](https://community.affine.pro/home)\n\n\n* Discord: [https://discord.gg/Arn7TqJBvG](https://discord.gg/Arn7TqJBvG)\n\n\n* Telegram: [https://t.me/affineworkos](https://t.me/affineworkos)\n\n\n",
  "publish": true
}