{
  "title": "10 Best Free Change Management Tools & Software for 2024",
  "authors": [
    "Xuan Pang"
  ],
  "tags": [
    "Content"
  ],
  "description": "Discover the top 10 free change management tools and software for 2024. Streamline your organizational transitions with these powerful and cost-effective solutions to ensure smooth change implementation.",
  "created": null,
  "updated": 1707091200000,
  "layout": "blog",
  "id": "V6PMZAJ_cbOchuMYDFgdV",
  "slug": "best-free-change-management-tools-software",
  "cover": "/blobs/AtWzMSbu689sz5oRiWhX_IaLkINdYeWId6eg0S0FEhk=",
  "md": "---\n\n\ntitle: \"10 Best Free Change Management Tools & Software for 2024\"\n\n\nauthor: \"Xuan Pang\"\n\n\ntags: Content\n\n\nslug: best-free-change-management-tools-software\n\n\ndescription: \"Discover the top 10 free change management tools and software for 2024. Streamline your organizational transitions with these powerful and cost-effective solutions to ensure smooth change implementation.\"\n\n\ncreated: 2024-0\n\n\nupdated: 2024-02-05\n\n\nlayout: blog\n\n\npublish: true\n\n\n---\n\n\n\n![AtWzMSbu689sz5oRiWhX_IaLkINdYeWId6eg0S0FEhk=](/blobs/AtWzMSbu689sz5oRiWhX_IaLkINdYeWId6eg0S0FEhk=)\n\n\nNavigating the sea of change management solutions can be **challenging** sometimes.\n\n\n**But fear not!**\n\n\nIf you're seeking a tool to seamlessly [plan](https://affine.pro/blog/14-best-free-content-planning-apps-price-features), implement, and track changes in your business processes, I've got you covered. Drawing from extensive experience with numerous change management software across [various businesses](https://affine.pro/blog/how-to-introduce-new-business-social-media-strategic-steps-examples), this post aims to simplify your decision-making process. Get ready for personalized insights and recommendations on the best change management tools to suit your needs.\n\n\n# **What Are Change Management Tools?**\n\n\n\n![bXC-K5Ge8z-32yLbSsPrBjBXpmP7h5KNs1ykrRhvzuY=](/blobs/bXC-K5Ge8z-32yLbSsPrBjBXpmP7h5KNs1ykrRhvzuY=)\n\n\nChange management tools are essential software solutions designed to [streamline the implementation](https://affine.pro/blog/everything-you-need-to-know-about-okr) and oversight of changes in business processes and systems. These tools play a pivotal role in structured planning, [risk assessment](https://affine.pro/blog/10-best-free-risk-assessment-templates-examples-2023), and change tracking, with a specific focus on the human dimension of transitions.\n\n\nA notable advantage of these tools lies in their contribution to employee satisfaction. By fostering clear communication and offering a transparent [roadmap](https://affine.pro/blog/5-best-free-tools-agile-roadmap-templates-2023) of the change process, these tools empower employees to better understand, adapt to, and embrace changes. This proactive strategy minimizes anxiety, fostering a more positive reception of organizational changes and cultivating a healthier and more productive work environment.\n\n\n# **Benefits of Change Management Tools**\n\n\nChange management tools offer a range of benefits to organizations undergoing transitions. Some key advantages include:\n\n\n\n![HkWF9UCl_EaOO0PmjosBRRT7zU6Nep59wlDAcQ-J4Rk=](/blobs/HkWF9UCl_EaOO0PmjosBRRT7zU6Nep59wlDAcQ-J4Rk=)\n\n\n1. **Structured Planning:** Change management tools provide a systematic framework for [planning](https://affine.pro/blog/best-5-free-digital-planner-apps-2023) and executing changes, ensuring a well-organized and strategic approach to the transition process.\n\n\n1. **Risk Assessment:** These tools enable organizations to identify and [assess potential risks](https://affine.pro/blog/10-best-free-risk-assessment-templates-examples-2023) associated with the proposed changes, allowing for proactive mitigation strategies to be implemented.\n\n\n1. **Change Tracking:** Change management tools facilitate the monitoring and [tracking of changes](https://affine.pro/blog/8-free-project-tracker-templates-work-management-2023) throughout their lifecycle, providing real-time insights into the progress and impact of the transition.\n\n\n1. **Human-Centric Approach:** Focusing on the human aspect of change, these tools emphasize [communication](https://affine.pro/blog/top-asynchronous-communication-tools-free-2024), engagement, and [collaboration](https://affine.pro/blog/top-collaboration-tools-for-teams-to-drive-success), fostering a supportive environment for individuals adapting to new processes.\n\n\n# **The 10 Best Change Management Tools**\n\n\nWhen choosing the right change [management](https://affine.pro/blog/15-types-events-event-management-categories-examples) solution for your business, careful consideration of various factors is crucial. By thoroughly assessing your specific needs and the scope of your business changes, you can align your selection with precision, ensuring a more effective and tailored implementation. üîÑüõ†Ô∏è\n\n\n**Here are the 10 best free change management tools:**\n\n\n### 1. [AFFiNE](https://www.affine.pro)\n\n\n\n![rFblyTM87Ji6lT6fJskjQPcJ33A7sMeFTcWEGaTjxu8=](/blobs/rFblyTM87Ji6lT6fJskjQPcJ33A7sMeFTcWEGaTjxu8=)\n\n\nAFFiNE stands out as a state-of-the-art change management app, meticulously crafted to streamline the [organization](https://affine.pro/blog/15-types-events-event-management-categories-examples), management, and collaboration on tasks, [projects](https://affine.pro/blog/best-project-planning-tools-software-for-teams-2023), and real-time information. What distinguishes AFFiNE is its unique offering as a free and [open-source](https://affine.pro/blog/five-best-open-source-miro-alternatives-2023) program, leveraging offline technology to ensure accessibility for all users.\n\n\nIn essence, AFFiNE revolutionizes change management by providing advanced functionalities while breaking barriers with its open-source nature, making it a versatile and inclusive tool for businesses and individuals alike. üí°üîÑ\n\n\n**Key features:**\n\n\n* **[Diversified templates](https://affine.pro/blog/best-free-whiteboard-layout-ideas-organization):** At AFFiNE, we provide a variety of templates, including calendar and [SMART](https://affine.pro/blog/marketing-action-plan), to enhance the agility and efficiency of your workflow. Utilize our range of templates to streamline processes, improve collaboration, and achieve optimal results in your projects.\n\n\n\n![B4wYA5uuE5zOevsBVSjMP6G2fj3ji9rR_YmyvfoeEi0=](/blobs/B4wYA5uuE5zOevsBVSjMP6G2fj3ji9rR_YmyvfoeEi0=)\n\n\n* **[Collaborative Capabilities:](https://affine.pro/blog/affine-0-10-0-launch-week-day-5-5-stable-with-cloud-support-finally-available-to-every-pro-in-your-team)** For group work, the app should have collaborative features, making it easy to share and coordinate work with others in your group work. For more details, please go to latest launch week blog: [Introduction to AFFiNE's Cloud](https://affine.pro/blog/affine-0-10-0-launch-week-day-5-5-stable-with-cloud-support-finally-available-to-every-pro-in-your-team).\n\n\n  \n![71MN7zgKOg2C73idwSU66YEnVUK8x41Jqwwe2z9CiPU=](/blobs/71MN7zgKOg2C73idwSU66YEnVUK8x41Jqwwe2z9CiPU=)\n\n\n* **Write, [Draw](https://affine.pro/blog/best-free-digital-whiteboard-apps-2023), and [Plan](https://affine.pro/blog/best-project-planning-tools-software-for-teams-2023) All-in-One:**Enjoy your all-in-one KnowledgeOS solution for effortlessly writing, drawing, and planning on a hyper-fused platform. It supports [kanban](https://affine.pro/blog/affine-080-launch-week-day3), table, rich-text paragraphs as building blocks to form pages or whiteboards. It carries out integrated processing here in document editing, data processing, or brainstorming.\n\n\n\n![O88V12dZ7eALpdMD8-6eyyfRec5yZyWiQxCnvNEb3r0=](/blobs/O88V12dZ7eALpdMD8-6eyyfRec5yZyWiQxCnvNEb3r0=)\n\n\n* **[Offline Accessibility](https://affine.pro/blog/5-best-offline-alternatives-to-notion):** The best change management app should allow users to access their essential details offline. This feature is particularly valuable when going outside with limited internet connectivity.\n\n\n\n![7tLzErsXRl3O-9-0m62ySSd00VYnYYtRKFaZUFit2Jg=](/blobs/7tLzErsXRl3O-9-0m62ySSd00VYnYYtRKFaZUFit2Jg=)\n\n\n### 2. [ClickUp](https://clickup.com/teams/project-management)\n\n\n\n![HcVM1hgC8fMN87xKat1kNT34fk9VtX1Wbv8etHICAtQ=](/blobs/HcVM1hgC8fMN87xKat1kNT34fk9VtX1Wbv8etHICAtQ=)\n\n\nClickUp is an all-in-one solution and project management tool that supports every aspect of your business, from [business management](https://clickup.com/teams/business-management) to change management and beyond. ClickUp can be a valuable asset in change management by providing a centralized platform for organizing and tracking all change-related tasks.\n\n\nWith its change management software‚Äîincluding user-friendly templates to help you plan, track, and roll out your project‚Äîmanaging change has never been easier.\n\n\n**Key features:**\n\n\n* Offers a [change management plan](https://clickup.com/templates/change-management-plan-t-44416772) with workflow time-tracking, statuses, and four different view types to help get you started with your change planning\n\n\n* Use [ClickUp Mind Maps](https://clickup.com/features/mind-maps) to facilitate clear visualization of how everything works together\n\n\n* Take your pick of 10 different [change management templates](https://clickup.com/blog/change-management-templates/), including checklists and Gantt charts for different use case scenarios, like IT service management (ITSM), SaaS projects, and work-from-home plans.\n\n\n### 3. [The Change Shop](https://www.thechangeshop.com/)\n\n\n\n![ehnWizueiKB6sYeD4F35dkoUOdxMFJCD6FhnvxxXxuU=](/blobs/ehnWizueiKB6sYeD4F35dkoUOdxMFJCD6FhnvxxXxuU=)\n\n\nThey say they‚Äôre ‚Äúthe most usable workplace change management platform on the planet.‚Äù This [change management software](https://www.thechangeshop.com/blogdetails/MjM=) consists of six different tools designed to gather feedback, gauge readiness for change, and then put the necessary actions in place.\n\n\n**Key features:**\n\n\n* The organization tool helps you gauge if your business is ready for the next change and reminds you of best practices for change management\n\n\n* The [team tool](https://affine.pro/blog/top-asynchronous-communication-tools-free-2024) facilitates cross-team feedback\n\n\n* The Change Simulator helps you run through different scenarios and assess possible risks\n\n\n### 4. [WalkMe](https://www.walkme.com/)\n\n\n\n![VOKbQtORH6tfwfZ7YtOXe2fgzhZNTk_iEHsIOKJIbHk=](/blobs/VOKbQtORH6tfwfZ7YtOXe2fgzhZNTk_iEHsIOKJIbHk=)\n\n\nWalkMe change management tools is designed to manage change for both your customers and your team, guiding users through business workflows. üëÄ\n\n\n**Key features:**\n\n\n* Makes onboarding easy with a self-paced onboarding list\n\n\n* It helps users reach their goals by encouraging desired behaviors, using insights into digital behavior and custom desktop notifications\n\n\n* Reduces customer and [employee](https://affine.pro/blog/best-free-employee-performance-review-templates-examples-2023) support tickets, improving customer satisfaction and saving your service desk hours of time\n\n\n### 5. Whatfix\n\n\n\n![x7By_8_3Ihb_PdcduY9zzGaTVX5M94NrlimFlv-vg-Q=](/blobs/x7By_8_3Ihb_PdcduY9zzGaTVX5M94NrlimFlv-vg-Q=)\n\n\n[Whatfix](https://whatfix.com/) is an interactive digital adoption platform that fills a significant gap in digital change management by offering employee onboarding support and ongoing [change management training](https://whatfix.com/blog/change-management-training/). Whatfix provides interactive walkthroughs and step-by-step guidance for users to navigate easily on any newly introduced software or application.\n\n\nThe contextual step-by-step training allows users to learn in the flow of work, which boosts productivity, ensures minimal downtime during the change, and helps employees up to speed as quickly as possible.\n\n\n**Key features:**\n\n\n* Easy to create interactive walkthroughs (no coding required)\n\n\n* Step-by-step guidance on the key processes\n\n\n* Self-serving contextual help & support with the application\n\n\n### 6. [BMC](https://www.bmc.com/)\n\n\n\n![j82uWHBPfEDbe5wnYfuYWocd7HOccYVG_gLp5XVuA70=](/blobs/j82uWHBPfEDbe5wnYfuYWocd7HOccYVG_gLp5XVuA70=)\n\n\nRemedy change management 9 is an innovative IT service management (ITSM) platform from [BMC Software](https://www.bmc.com/). The tool is ideal for IT departments that need to document and coordinate various change management process requests. It enables change managers to [review requests](https://affine.pro/blog/best-free-employee-performance-review-templates-examples-2023), create change plans, and monitor the change implementation progress. The tool also incorporates features to manage new releases, including deployment tracking and automatic notifications for stakeholders.\n\n\n**Key features:**\n\n\n* Virtual agents and live chat for quick resolution of issues\n\n\n* On-premise and cloud implementation\n\n\n* Mobile self-service application\n\n\n### 7. Freshservice\n\n\n\n![JbNcvJP4uv0QGzGOuDBtcPB8DqMlZRDI2Q18a3FzGV0=](/blobs/JbNcvJP4uv0QGzGOuDBtcPB8DqMlZRDI2Q18a3FzGV0=)\n\n\n[Freshservice](https://allsoftwaredeals.com/freshservice-review/) is an IT asset management system from Freshdesk. It helps businesses with reporting, asset management, release management, and change management. The biggest advantage of Freshservice is its ability to take care of multiple verticals and integrations with its parent desk platform, Freshdesk, and sales platform, Freshsales.\n\n\n**Key features:**\n\n\n* Plan, track, and roll back changes from one place\n\n\n* Analyze and mitigate risks before they become a chore\n\n\n* Easy to create and manage Change Advisory Board (CAB) meetings\n\n\n### 8. Gensuite\n\n\n\n![J2UmkPSMOup1LL9Uc_2jnbyUbXbjjBlAOxCUem-rsuA=](/blobs/J2UmkPSMOup1LL9Uc_2jnbyUbXbjjBlAOxCUem-rsuA=)\n\n\n[Gensuite](https://crozdesk.com/software/gensuite) aims to simplify the Management of Change (MOC) process by creating standardized processes for identifying and evaluating the need for change as well as the communication and implementation of change.\n\n\nGensuite is a self-configurable platform. It is designed to track and document potential risks caused by changes in operations, equipment, or personnel.\n\n\n**Key features:**\n\n\n* Action item tracking with real-time status/closure tracking\n\n\n* MOC Manager for ensuring a comprehensive review of compliance requirements\n\n\n* Mobile-friendly platform\n\n\n### 9. Viima\n\n\n\n![CzhGUBUI2i1TrSDqqCZ10ipaQNv_CfcqdkobParhh38=](/blobs/CzhGUBUI2i1TrSDqqCZ10ipaQNv_CfcqdkobParhh38=)\n\n\n[Viima](https://www.viima.com/) is ideal for businesses that want to gather customer feedback and take direct action.\n\n\nThe platform allows you to gather ideas from employees, customers, and stakeholders all in one place.\n\n\n**Key features:**\n\n\n* Idea challenges that encourage employees to come up with innovative solutions\n\n\n* Built-in discussions for team collaboration\n\n\n* Mobile-friendly platform\n\n\n### 10. OrgMapper Influence\n\n\n\n![mY9XdKw5D4zaqAKGC4sLQEkq7H-Jy0OGjbNJUKmEOH8=](/blobs/mY9XdKw5D4zaqAKGC4sLQEkq7H-Jy0OGjbNJUKmEOH8=)\n\n\n[OrgMapper‚Äôs Influence tool](https://orgmapper.com/) quickly identifies strong change agent candidates so that users can build an internal support system before initiating organizational transformations. Strength [mapping](https://affine.pro/blog/top-5-mind-maps-examples-and-tools) reports allow users to narrow in on how well information is communicated, received, and understood throughout the change process. Armed with these valuable insights, chosen change leaders can build trust within the company, improve their change strategies, and design processes for future initiatives.\n\n\n**Key features:**\n\n\n* Comprehensive communication diagnostics that identify effective and ineffective communication styles\n\n\n* Peer nomination tool that allows employees to elect their preferred change leaders\n\n\n* Drill-down functions within reports to identify strengths and weaknesses in change agents and initiatives\n\n\n# **Which option suits you the best?**\n\n\n\n\n\n<div style=\"text-align:center;\">\n\n\n<iframe width=\"560\" height=\"315\" src=\"https://www.youtube.com/embed/3cfeKOufZWU?si=IiXDIdwfnM2Z7KPL\" title=\"YouTube video player\" frameborder=\"0\" allow=\"accelerometer; autoplay; clipboard-write; encrypted-media; gyroscope; picture-in-picture; web-share\" allowfullscreen></iframe>\n\n\n</div>\n\n\n\n\n\nWe've compiled a list of the top 10 change management tools. Which one aligns most with your needs? Currently, **AFFiNE** has released its [stable version](https://affine.pro/download), but we are continuing to build to a more feature-rich and stable build. **Come and join us on our journey over on our media platforms. üöÄüîß**\n\n\n* Official Website: [https://affine.pro/](https://affine.pro/)\n\n\n* GitHub: [https://github.com/toeverything/AFFiNE](https://github.com/toeverything/AFFiNE)\n\n\n* Twitter: [https://twitter.com/AffineOfficial](https://twitter.com/AffineOfficial)\n\n\n* Community: [https://community.affine.pro/home](https://community.affine.pro/home)\n\n\n* Discord: [https://discord.gg/Arn7TqJBvG](https://discord.gg/Arn7TqJBvG)\n\n\n* Telegram: [https://t.me/affineworkos](https://t.me/affineworkos)\n\n\n\n\n\n\n\n\n\n\n\n",
  "publish": true
}