{
  "title": "5 Best Free Online Digital Whiteboard Apps for 2024 (Features, Price)",
  "authors": [
    "Jackie Peng"
  ],
  "tags": [
    "Content"
  ],
  "description": "In this article, weâ€™ll highlight the 5 best Online Digital Whiteboard Apps with features available today that help you draw, visualize your ideas and release your creativity.",
  "created": 1684972800000,
  "updated": 1709510400000,
  "layout": "blog",
  "id": "arOWnO30bw",
  "slug": "best-free-digital-whiteboard-apps-2023",
  "cover": "https://app.affine.pro/api/workspaces/qf73AF6vzWphbTJdN7KiX/blobs/mQcvL-ecSgOWv73kXnrbzV-Kp1LmoG5bWwEu4Iplgp0=.webp",
  "md": "---\n\ntitle: 5 Best Free Online Digital Whiteboard Apps for 2024 (Features, Price)\n\nauthor: Jackie Peng\n\ntags: Content\n\nslug: best-free-digital-whiteboard-apps-2023\n\ndescription: In this article, weâ€™ll highlight the 5 best Online Digital Whiteboard Apps with features available today that help you draw, visualize your ideas and release your creativity.\n\ncreated: 2023-05-25\n\nupdated: 2024-03-04\n\nlayout: blog\n\npublish: true\n\n---\n\n\n![mQcvL-ecSgOWv73kXnrbzV-Kp1LmoG5bWwEu4Iplgp0=](https://app.affine.pro/api/workspaces/qf73AF6vzWphbTJdN7KiX/blobs/mQcvL-ecSgOWv73kXnrbzV-Kp1LmoG5bWwEu4Iplgp0=.webp)\n\n**ðŸŽ‰AFFiNE is now on ProductHunt, support us and leave your feedback here: [https://www.producthunt.com/posts/affine-3](https://www.producthunt.com/posts/affine-3)**\n\n\n![uO1ZB4KWJaUGczcj2ij-OuUOEy0qu6eGa08hzMPp6yk=](https://app.affine.pro/api/workspaces/qf73AF6vzWphbTJdN7KiX/blobs/uO1ZB4KWJaUGczcj2ij-OuUOEy0qu6eGa08hzMPp6yk=.webp)\n\n## **Imagine this:**\n\nYou're using Office Word to organize your thoughts, but you find its limitations to be incredibly inconvenient. The inability to collaborate and visually present your ideas becomes a source of frustration. Suddenly, you reminisce about the old-school free online whiteboard you used in the past, covered in sticky notes and magnets, where you had the freedom to draw and describe freely.\n\nHowever, even though those online whiteboards offered more flexibility, they still couldn't meet your needs for collaboration and convenience. **The limited boundaries and the constant erasing of incorrect content made them unattractive and impractical.**\n\n**This is where modern whiteboard tools come into play**. There are now various digital whiteboards available in the market, but which one is the best? Which one is truly worth using?\n\nThis article will guide you through the selection process, helping you find the perfect free whiteboard app for your needs. Let's explore this new era of creative tools together, unleashing your imagination and enhancing your productivity. Whether you're a professional or a student, online whiteboards will become your indispensable partner, enabling you to achieve greater success in collaboration and creativity.\n\n\n![0jXF_VEfAYrwvX5LuqqDho-DzVGnJOl8v18pubAmJ8M=](https://app.affine.pro/api/workspaces/qf73AF6vzWphbTJdN7KiX/blobs/0jXF_VEfAYrwvX5LuqqDho-DzVGnJOl8v18pubAmJ8M=.webp)\n\n## Why an online whiteboard? What makes up a good whiteboard?\n\nWhen it comes to the whiteboard online, it is a versatile tool that has become an integral part of various professional settings, educational institutions, cutstomizable templates and creative environments. It is typically a smooth, erasable surface that allows users to write, draw, and visualize ideas using markers or pens.\n\nThe simplicity and flexibility of an online whiteboard tool make it a powerful medium for brainstorming, problem-solving, and collaborative work. Here are a few reasons why digitail whiteboards are so widely embraced:\n\n1. Visual Communication: Online Whiteboards enable visual communication by transforming abstract concepts into tangible representations. Whether it's sketching diagrams, illustrating workflows, adding sticky notes, or mapping out strategies, a web whiteboard provides a clear and easily understandable visual medium.\n\n1. Idea Generation and Exploration: The spaciousness of a whiteboard encourages free thinking and exploration of ideas. It serves as a canvas where concepts can be brainstormed, expanded upon, and refined in real-time, fostering creativity and innovation.\n\n1. Collaboration and Teamwork: Whiteboards are excellent tools for fostering visual collaboration within teams. They facilitate group discussions, allowing team members to contribute, build upon each other's ideas, and collectively solve problems. The interactive nature of whiteboards encourages active engagement and participation.\n\n\n![EUTv2qsJSDP0LIsD637glCGH-Z4gj0tEulSox1YqbPs=](https://app.affine.pro/api/workspaces/qf73AF6vzWphbTJdN7KiX/blobs/EUTv2qsJSDP0LIsD637glCGH-Z4gj0tEulSox1YqbPs=.webp)\n\nIn terms of what makes up a good whiteboard, we believe it incorporates those key elements:\n\n1. Intuitive User Interface: A clean and user-friendly interface makes it easy to navigate and use the app effectively.\n\n1. Versatile Drawing Tools: A variety of drawing tools, such as pens, markers, shapes, and colors, allow for creative expression and precise visualization.\n\n1. Collaboration Features: Real-time collaboration features enable multiple users to work together on the same whiteboard, fostering teamwork and idea sharing.\n\n1. File Integration and Sharing: The ability to import images, text boxes, documents, and other files enhances the visual representation of brainstorming ideas, and easy sharing promotes seamless collaboration.\n\n1. Save and Export Options: The capability to save and export whiteboard content in various formats, such as images or PDF files, enables easy sharing and future reference.\n\nThese elements combine to create a comprehensive and feature-rich whiteboard tool, enhancing collaboration, creativity, and productivity.\n\nFortunately, you're in good hands.\n\nAfter extensive research, testing, comparison, and review, we've compiled the ultimate list of the top digital whiteboard software with brainstorming sessions. We've carefully ranked these tools to provide you with a convenient reference, so you can unleash your brainstorming potential like a true professional.\n\n## 5 virtual whiteboard tools for enterprise customers\n\nWith a plethora of digital whiteboard options at your fingertips, it's important to note that they are not created equal. Take the time to read and evaluate each option carefully, considering your specific needs and requirements. By doing so, you'll ensure that you're choosing the perfect brainstorming session that aligns with your dreams and aspirations.\n\n### 1.AFFiNE\n\n<div style=\"text-align:center;\">\n<iframe width=\"560\" height=\"315\" src=\"https://www.youtube.com/embed/WqOe9HgpsDY?si=PHGuSeRbOT9GxuPO\" title=\"YouTube video player\" frameborder=\"0\" allow=\"accelerometer; autoplay; clipboard-write; encrypted-media; gyroscope; picture-in-picture; web-share\" allowfullscreen></iframe>\n</div>\n\n\n\n[AFFiNE's](https://affine.pro) Edgeless mode, functioning as a whiteboard, offers users a secure and private workspace where they have absolute control over their data. In addition, AFFiNE's Edgeless mode offers a series of features like shapes with the ability to edit its size, background, and boundary, pens with different colours, connectors to visualize and connect your ideas.\n\nOne of the standout features of AFFiNE is its ability to seamlessly switch between paper mode and whiteboard mode (Page and Edgeless), making it a versatile tool for brainstorming, planning, and collaboration. So it facilitates users to transition from linear thinking (Page mode) to visualizing thinking (Edgeless mode)\n\n\n![HkBTO2NEdl-0GjYHPEqMZmUU4osUFwpvZilD-ULJOTA=](https://app.affine.pro/api/workspaces/qf73AF6vzWphbTJdN7KiX/blobs/HkBTO2NEdl-0GjYHPEqMZmUU4osUFwpvZilD-ULJOTA=.webp)\n\nHere are some quick views of what AFFiNE can do:\n\n* **Powerful Edgeless mode**\n\n  * Visualize and connect your ideas smoothly with better cartoon-style shape, slick pen, and connectors. No constraints. Limited only by your imagination. Ohhh, by the way, images now are supported to upload!! We just make everything easy for you, now you may enjoy your drawing time!\n\n  \n![RsQ7YdkYKImZ_ZYQitBq1Dy1lOMF3u7GxOQJa-3kdgQ=](https://app.affine.pro/api/workspaces/qf73AF6vzWphbTJdN7KiX/blobs/RsQ7YdkYKImZ_ZYQitBq1Dy1lOMF3u7GxOQJa-3kdgQ=.webp)\n\n\n![4i275PaHrMezjwR4bD-I_LWJAdXbyKRtt6W0VgY1to4=](https://app.affine.pro/api/workspaces/qf73AF6vzWphbTJdN7KiX/blobs/4i275PaHrMezjwR4bD-I_LWJAdXbyKRtt6W0VgY1to4=.webp)\n\n* **Database (plus one, you can use it to do something more than just whiteboard)**\n\n  * Easily create, organize, and track your data like never before. Say goodbye to complex processes and welcome an unprecedented ease-of-use way\n\n\n![6JCzx9Qdi8YXiyRI60Nq0f_2ikAwXzKCEx8zQC0aEUU=](https://app.affine.pro/api/workspaces/qf73AF6vzWphbTJdN7KiX/blobs/6JCzx9Qdi8YXiyRI60Nq0f_2ikAwXzKCEx8zQC0aEUU=.webp)\n\n#### **AFFiNEâ€™s Price:**\n\nIn addition to those mentioned above, AFFiNE is a fantastic, completely free daily planner app that welcomes everyone to experience its powerful features, making it a delightful surprise for those seeking a comprehensive solution for their daily planning needs.\n\n* Come and check out our latest [beta version](https://affine.pro/blog/whats-new-affine-0518), enjoy your creative moments.\n\n* For more things related to AFFiNE, come and check out our website: [AFFiNE â€” All In One KnowledgeOS](http://affine.pro)\n\n* Wanna try it online:[https://app.affine.pro/](https://app.affine.pro/)\n\n### 2.Miro\n\n\n![llu6zIAk4JYPsTnzAm-kqxeZOEoTQLhmqQMTQCCAWEo=](https://app.affine.pro/api/workspaces/qf73AF6vzWphbTJdN7KiX/blobs/llu6zIAk4JYPsTnzAm-kqxeZOEoTQLhmqQMTQCCAWEo=.webp)\n\nMiro, a remarkable collaborative whiteboard software, embraces the philosophy that success thrives when we support and cheer for others. Let's face it: [Miro is undeniably cool](https://affine.pro/blog/five-best-open-source-miro-alternatives-2023)! This powerful platform is purpose-built for mind mapping and productive brainstorming sessions, making it a go-to choice for teams worldwide.\n\nDesigned to cater to diverse team dynamics, the Miro digital version offers an intuitive interface that unleashes the potential of visual idea presentation. With its expansive whiteboards, you can express your thoughts in a visual and engaging manner, facilitating asynchronous communication, hosting efficient meetings, and even co-creating organizational chartsâ€”all without the fear of running out of space.\n\n\n![h-qju2X61n5ofxeVHxgjnqlfmft_0T-lD9S1GYqayEc=](https://app.affine.pro/api/workspaces/qf73AF6vzWphbTJdN7KiX/blobs/h-qju2X61n5ofxeVHxgjnqlfmft_0T-lD9S1GYqayEc=.webp)\n\nMiro empowers teams of all sizes and backgrounds to collaborate seamlessly, fostering a creative and inclusive environment where ideas flow freely. Its robust features and user-friendly approach make it a trusted ally for enhancing productivity and driving innovation.\n\n**Pros of Miro:**\n\n1. Seamless Collaboration: Miro enables real-time collaboration, enhancing communication and productivity.\n\n1. Versatile Visual Tools: With a range of visual tools, Miro allows creative expression and engaging visual representations.\n\n1. Integrations and Customization: Miro integrates with third-party apps and offers customization options for tailored workflows.\n\n**Cons of Miro:**\n\n1. Learning Curve: Miro's extensive features may require time to explore and master.\n\n1. Limited Free Plan: Miro's free plan has limitations on the number of boards and users.\n\n1. Pricing: Miro's pricing can be relatively high for larger teams or organizations.\n\n#### **Miro offers various pricing plans to cater to different needs:**\n\n1. Free Planï¼ˆShared Whiteboard): Includes unlimited team members, three editable boards, core integrations, premade templates, and basic attention management.\n\n1. Team Plan ($8 per member, per month): Provides unlimited boards, unlimited visitors, custom templates, project management, and private boards.\n\n1. Business Plan ($16 per member, per month): Offers unlimited guests, smart diagramming, and single sign-on (SSO) integration.\n\n1. Enterprise Plan (contact for pricing): Designed for large organizations,it includes enterprise-grade security and compliance, data governance, centralized account management and insights, and premium support.\n\n### 3.Clickup\n\n\n![1pDTMzp5FAk-8z_NYpRaS7y2rVFBWSgVR-VEF2nH0N8=](https://app.affine.pro/api/workspaces/qf73AF6vzWphbTJdN7KiX/blobs/1pDTMzp5FAk-8z_NYpRaS7y2rVFBWSgVR-VEF2nH0N8=.webp)\n\nThe much-anticipated Whiteboards feature is now available. After being announced and released in beta in November 2021, it has quickly become a favorite among users. As the only collaborative whiteboard within ClickUp, it allows teams to seamlessly transform real-time ideas into actionable projects.\n\nThis highly requested feature has propelled ClickUp Whiteboards to the top spot on our list, winning the hearts of users with its powerful functionality and seamless integration with the ClickUp productivity platform.\n\n**Pros:**\n\n1. Seamless integration: ClickUp Whiteboards seamlessly integrates with the ClickUp productivity platform, allowing teams to effortlessly turn ideas into actionable projects.\n\n1. Real-time collaboration: The collaborative nature of ClickUp Whiteboards enables teams to work together in real-time, fostering creativity and productivity.\n\n1. Versatile and customizable: With a wide range of tools and options, ClickUp Whiteboards offer flexibility and customization to suit various brainstorming and planning needs.\n\n**Cons:**\n\n1. Limited functionality: While ClickUp Whiteboards provide essential collaborative features, they may lack the advanced functionalities found in dedicated whiteboard tools.\n\n1. Learning curve: Users unfamiliar with the ClickUp platform may require some time to learn and navigate the interface of ClickUp Whiteboards.\n\n1. Platform dependency: ClickUp Whiteboards are tightly integrated with the ClickUp productivity platform, which means users need to rely on ClickUp for accessing and utilizing their whiteboard content.\n\n#### **Clickup Price:**\n\n1. Free Forever: This plan offers a range of powerful Whiteboard features, unlimited tasks and members, 100MB of storage, and more.\n\n1. Unlimited ($5 per member, per month): With the Unlimited plan, you get unlimited storage, unlimited integrations, unlimited Dashboards, agile reporting, and more.\n\n1. Business ($12 per member, per month): The business plan includes features such as Google SSO, unlimited teams, custom exporting, advanced public sharing, and advanced automations.\n\n1. Business Plus ($19 per member, per month): The Business Plus plan offers additional features like subtasks in multiple lists, custom role creation, custom permissions, increased automations and API access, and more.\n\n1. Enterprise (contact sales for pricing): The Enterprise plan provides white labeling options, enterprise API access, guided onboarding, and a dedicated success manager.\n\n### 4.**Limnu**\n\n\n![4mqBaPnuZLlR_dM4CYqU3sqkMKtfycHDxz8c5JSB5d0=](https://app.affine.pro/api/workspaces/qf73AF6vzWphbTJdN7KiX/blobs/4mqBaPnuZLlR_dM4CYqU3sqkMKtfycHDxz8c5JSB5d0=.webp)\n\nLimnu is a versatile and collaborative white board software designed for real-time brainstorming and idea visualization. It offers an intuitive interface, allowing multiple team members to work together simultaneously. With a range of tools like sticky notes, drawing pens, and image uploads, Limnu empowers users to express their ideas creatively.\n\nThe platform is accessible via a mobile app, ensuring flexibility and convenience. You can customize your own whiteboard's appearance, manage collaboration controls, and upgrade to unlock additional features and integration capabilities. Limnu is an ideal solution for teams looking to enhance their collaborative and visual brainstorming process.\n\n**Pros:**\n\n1. Real-time Collaboration: Limnu allows team members to collaborate in real-time, enabling seamless communication and idea sharing. Multiple users can work on the whiteboard simultaneously, making it ideal for remote teams.\n\n1. Intuitive Interface: Limnu offers a simple and user-friendly interface, making it easy for both beginners and experienced users to navigate and utilize its features. The intuitive design enhances the overall user experience.\n\n1. Versatile Tools: Limnu provides a variety of tools, such as sticky notes, drawing pens, and image uploads, to enhance creativity and visual representation. Users can express their ideas effectively and customize the whiteboard to suit their needs.\n\n**Cons:**\n\n1. Limited Free Version: The free version of Limnu has limitations on the number of boards and the amount of storage available. Users with more extensive collaboration needs may need to upgrade to a paid plan.\n\n1. Mobile App Limitations: While Limnu offers a mobile app, it may not provide the same level of functionality as the desktop version. Some advanced features may be limited or not available on mobile devices.\n\n1. Integration Options: Limnu's integration options with other software and platforms may be more limited compared to some other whiteboard tools. Users who require extensive integration with other tools may need to consider this limitation.\n\n#### **Limnu price:**\n\n1. Team Plan: This plan is priced at $8 per user, per month when billed annually. It includes features such as unlimited boards, real-time collaboration, basic integrations, and access to the Limnu mobile app.\n\n1. Enterprise Plan: For larger organizations with advanced requirements, Limnu offers custom pricing for its Enterprise plan.\n\n### 5.Excalidraw\n\n\n![t44FSyhDzxxWxQ70J6u9Lv7x-81VI8jhG16yb7Qk_Cc=](https://app.affine.pro/api/workspaces/qf73AF6vzWphbTJdN7KiX/blobs/t44FSyhDzxxWxQ70J6u9Lv7x-81VI8jhG16yb7Qk_Cc=.webp)\n\nExcalidraw is an open-source, web-based virtual whiteboard that allows users to create diagrams, add sticky notes,mind maps, flowcharts, and other visual representations in a collaborative and interactive manner. It offers a simple and minimalist interface that resembles a traditional whiteboard, making it easy to use and navigate for both beginners and experienced users.\n\nExcalidrawâ€™s object library is relatively limited compared to Miroâ€™s extensive collection of templates, widgets, and integrations. Miro offers a wide range of pre-designed templates for different use cases, making it more suitable for specific industries or workflows.\n\nIn addition, it does not even offer note taking methods which may cause loads of inconveniences compared with other apps like AFFiNE, which not only offering the Edgeless mode(whiteboard), but also offering the smooth transition to page mode so users can write with the support of blockhubs.\n\nAFFiNE is still in beta, but we are continuing to build to a more feature-rich and stable build. Come and join us on our journey over on our media platforms\n\n#### **Excalidraw is an open source whiteboard, so it doesn't charge at all.**\n\n\n---\n\n### Which Digital whiteboard app offers the best solution?\n\nWhile each of the digital whiteboard apps discussed offers its own unique and appealing features, we encourage users to choose the ideal option based on their specific needs and pain points.\n\nHowever, with a humble perspective, we still propose that AFFiNE emerges as the ultimate winner in this evaluation, providing a comprehensive and versatile solution for drawing and visualizing ideas, daily tasks and goals, catering to a wide range of user requirements.\n\nAFFiNE is still in beta, but we are continuing to build to a more feature-rich and stable version. Come and join us on our journey over on our media platforms.\n\n* Official Website: [https://affine.pro/](https://affine.pro/)\n\n* GitHub: [https://github.com/toeverything/AFFiNE](https://github.com/toeverything/AFFiNE)\n\n* Discord: [https://discord.gg/Arn7TqJBvG](https://discord.gg/Arn7TqJBvG)\n\n* Telegram: [https://t.me/affineworkos](https://t.me/affineworkos)\n\n",
  "publish": true
}