{
  "title": "Best Social Media Content Calendar Templates for Smart Planning in 2024",
  "authors": [
    "Yiyang Zhang"
  ],
  "tags": [
    "Content"
  ],
  "description": "Unlock your creativity with a social content calendar in 2024. Use a social media content calendar template for advanced smart planning.",
  "created": 1710720000000,
  "updated": 1710720000000,
  "layout": "blog",
  "id": "Zl4RFsmP0qqGS2puRPxZV",
  "slug": "best-social-media-content-calendar-templates-smart-planning",
  "cover": "/blobs/Tp6jnmXbUrjtc7JUhW_S48_lteqXz1QFFtVL7L_gL7c=",
  "md": "---\n\n\ntitle: \"Best Social Media Content Calendar Templates for Smart Planning in 2024\"\n\n\nauthor: \"Yiyang Zhang\"\n\n\ntags: Content\n\n\nslug: best-social-media-content-calendar-templates-smart-planning\n\n\ndescription: \"Unlock your creativity with a social content calendar in 2024. Use a social media content calendar template for advanced smart planning.\"\n\n\ncreated: 2024-03-18\n\n\nupdated: 2024-03-18\n\n\nlayout: blog\n\n\npublish: true\n\n\n---\n\n\n\n![Tp6jnmXbUrjtc7JUhW_S48_lteqXz1QFFtVL7L_gL7c=](/blobs/Tp6jnmXbUrjtc7JUhW_S48_lteqXz1QFFtVL7L_gL7c=)\n\n\n**Are you tired of scrambling to come up with social media content on the fly?**\n\n\n**Do you struggle to keep track of what posts are going out when across all your platforms?**\n\n\nIt's time to take control of your [social media strategy](https://affine.pro/blog/10-best-b2b-social-media-marketing-strategies) with the help of a powerful tool: the social media content calendar. By utilizing these templates, you can streamline your workflow, plan, and ensure consistent messaging that resonates with your audience. Let's dive into how these templates can revolutionize your approach to [social media planning](https://affine.pro/blog/how-to-create-social-media-content-calendar-free-templates) in 2024.\n\n\n# **Why Do You Need a Social Media Content Calendar?**\n\n\nA social media content calendar transcends mere scheduling; it serves as a strategic cornerstone for enhancing your online presence. In today's [social media](https://affine.pro/blog/top-10-social-media-advertising-benefits-marketing-experts) landscape, where noise proliferates, a meticulously crafted content calendar is indispensable for cutting through the clutter and effectively engaging your audience. By mapping out your content in advance, you uphold consistency in messaging and branding across platforms, fostering trust and solidifying your digital identity. Furthermore, it shields you from last-minute scrambles and hasty posts, providing ample space for brainstorming and refining creative ideas. This strategic foresight enables seamless integration with marketing initiatives, product launches, and seasonal promotions. Embracing a social media content calendar equips you with organization, time efficiency, and the ability to catalyze audience engagement, amplifying your online impact significantly.\n\n\n# **How Does a Social Media Content Calendar Template Upgrade Your Workflow?**\n\n\n\n![Zw2hHFAr1eJaSmqZXhrhUt5fhJApzz72MnHTzPnD-xU=](/blobs/Zw2hHFAr1eJaSmqZXhrhUt5fhJApzz72MnHTzPnD-xU=)\n\n\nA social media content calendar template is like a roadmap for your online presence.\n\n\n* **Efficient Planning:** A social media content calendar template serves as a roadmap for your online presence, aiding in planning and organizing posts well in advance.\n\n\n* **Consistency:** It ensures consistency in messaging by scheduling posts and content ahead of time.\n\n\n* **Visual Organization:** The template allows easy visualization of content flow over time, whether it's for a month or a year.\n\n\n* **Big Picture Perspective:** Offers a structured framework to see the overall social media strategy at a glance, helping identify scheduling gaps or overlaps.\n\n\n* **Prevents Last-Minute Scrambling:** Centralizes content ideas and schedules, preventing the need for last-minute post creation.\n\n\n* **Enhanced Collaboration:** Facilitates seamless collaboration among team members by providing shared access to the calendar.\n\n\n* **Alignment Across Platforms:** Maintains alignment across various social media platforms, ensuring consistency in messaging and efforts.\n\n\n# **Best 10 Social Media Content Calendar Templates for Smart Planning**\n\n\nLooking for the best social media content calendar templates to streamline your planning process in 2024? Look no further! Here are 10 top-notch templates that will take your social media game to the next level.\n\n\n### 1. **[AFFiNE](https://app.affine.pro/) Social Media Content Calendar Template for Small Startups**\n\n\n\n![nE_TbRgNANNqObSyu-9cf9nR5mYkmTi2oh6cSQjpc9E=](/blobs/nE_TbRgNANNqObSyu-9cf9nR5mYkmTi2oh6cSQjpc9E=)\n\n\nThis AFFiNE's social media content calendar template for small startups aims for a needs strategic and engaging online presence, fostering brand awareness and audience interaction. Made up of a carefully curated schedule, this template provides a structured framework for planning and executing diverse content that aligns with your business goals. From showcasing your products or services to sharing behind-the-scenes glimpses and encouraging user participation, each week is thoughtfully crafted to keep your social media channels vibrant and connected with your target audience. Embrace this template as a roadmap to navigate the dynamic landscape of [social media ideas](https://affine.pro/blog/10-creative-content-marketing-ideas-examples-inspire-you), driving growth and building lasting connections for your startup.\n\n\n### 2. **[Smartsheet](https://www.smartsheet.com/content/content-calendar-template-examples) Social Media Content Calendar Template**\n\n\n\n![740hEIuaUxARNV3MqnUbd_p6TAnKjB1b9yKD1Vv4Ya8=](/blobs/740hEIuaUxARNV3MqnUbd_p6TAnKjB1b9yKD1Vv4Ya8=)\n\n\nThe Smartsheet customizable social media content calendar template is a tool that helps you [plan](https://affine.pro/blog/best-8-free-event-planning-templates-checklists-customize) and schedule your social media content across different platforms. It assists with generating ideas for posts, setting dates and times, crafting captions, and adding visuals. The template also enables you to monitor the performance of your social media content. Using this template has many advantages, including maintaining a consistent social media presence, saving time by pre-scheduling posts, and ensuring alignment with marketing goals.\n\n\n### 3. **[Notion](https://www.notion.so/templates/social-media-calendar) Social Media Calendar Template**\n\n\n\n![N_SMTshgyQQ0GDJCx72CV7gBrW-5yTLoOQJHKdua2Qo=](/blobs/N_SMTshgyQQ0GDJCx72CV7gBrW-5yTLoOQJHKdua2Qo=)\n\n\nThe Notion template offers a calendar view that helps users visualize timelines or a board view that provides a comprehensive platform usage overview. The template also allows users to view their deliverables on a calendar or timeline, and filter them by status, owner, and priority. With the Notion social media planner template, users can [streamline workflow](https://affine.pro/blog/best-free-social-media-scheduler-tools-to-empower-workflow), track planned and published posts, and monitor ad campaigns.\n\n\n### 4. **[Airtable](https://www.airtable.com/templates/social-media-calendar/expgEkxMmWRqpa43k) Social Media Calendar Template**\n\n\n\n![if-lNKVlmUHw3ufvBnt0O3W2Jh1OEkHmAjGK3K3XZFY=](/blobs/if-lNKVlmUHw3ufvBnt0O3W2Jh1OEkHmAjGK3K3XZFY=)\n\n\nThe Airtable social media calendar template provides a practical solution for organizing social media posts and important dates. This template allows users to plan their daily, weekly, and monthly posts through a user-friendly drag-and-drop system. The template offers a centralized location to manage social media strategy, including the ability to track events, [view timeline](https://affine.pro/blog/how-to-create-a-project-timeline-template-in-excel-step-by-step-guide), create post visuals, set deadlines, and schedule content.\n\n\n### 5. **[Miro](https://miro.com/templates/social-media-calendar/) Social Media Calendar 2024 Template**\n\n\n\n![Wc3GOR_CIvYht3DCqtxaMrGDOOZ2fhnCwQ10hX_1T00=](/blobs/Wc3GOR_CIvYht3DCqtxaMrGDOOZ2fhnCwQ10hX_1T00=)\n\n\nThe Miro social media calendar 2024 template offers a convenient solution for busy business owners and marketers who aim to plan fresh, relevant, and engaging content to captivate their audience. This template is instrumental in reducing overall business stress and enabling brands to thrive in the competitive world of social media. The template is designed to [schedule posts](https://affine.pro/blog/10-best-free-online-sticky-notes-free-software-tools) on various social media platforms, such as Twitter, LinkedIn, Instagram, and Facebook, enabling users to plan and strategize for the future effectively.\n\n\n### 6. **[Vertex42](https://www.vertex42.com/calendars/content-calendar.html) Content Marketing Calendar Template**\n\n\n\n![ZdJ9lnpK365-BG4R9E8vapL1jlaS3_COxw77F7ZTPYo=](/blobs/ZdJ9lnpK365-BG4R9E8vapL1jlaS3_COxw77F7ZTPYo=)\n\n\nThe Vertex42 content marketing calendar template is a crucial tool for anyone who regularly creates content for social media, ads, blogs, and other [marketing campaigns](https://affine.pro/blog/the-7-key-stages-marketing-sales-pipeline-visual-guide). With this free content calendar template, you can plan and track the progress of your tasks using a Gantt chart timeline and a monthly calendar. It is available in both Excel and Google Sheets.\n\n\n### 7. **[Jotform](https://www.jotform.com/table-templates/social-media-calendar) Social Media Calendar Template**\n\n\n\n![3zga86U8T9AQT87_SNohVsBJxEqpza_PODup2eTLEps=](/blobs/3zga86U8T9AQT87_SNohVsBJxEqpza_PODup2eTLEps=)\n\n\nThis Jotform template for social media calendar template allows you to sort each submission into a color-coordinated spreadsheet which can be viewed in either its default format or in a calendar format. This feature is perfect for easy sharing and discussion with your content team and can be viewed on any device. You can customize this Jotform free social media calendar template by using our Form Builder to add or modify form fields which will affect the columns in your [spreadsheet](https://affine.pro/blog/10-best-free-online-table-maker-tools-2023). You can also decide how to color-code various labels and even add tabs for upcoming launches, quirky holidays, and the latest online trends.\n\n\n### 8. **[Ayanza](https://ayanza.com/blog/content-calendar-templates) Social Media Content Template**\n\n\n\n![9DpncqmrQm1eLZ0MVJomNXoJx9KyrgBbhGPtUysPKDI=](/blobs/9DpncqmrQm1eLZ0MVJomNXoJx9KyrgBbhGPtUysPKDI=)\n\n\nAyanza's social media calendar template is an exceptional tool for organizing and planning your social media content. The template is incredibly user-friendly, allowing you to easily drag and drop files in seconds. The process tracking feature makes it easy to keep up with your content's progress, and the template provides you with continuous access to your content progress. You can use it to plan and schedule social media posts, check publishing dates and times, and [monitor their status](https://affine.pro/blog/8-free-project-tracker-templates-work-management-2023).\n\n\n### 9. **[Stackby](https://stackby.com/templates/content-marketing-management) Content Marketing Management Template**\n\n\n\n![gTHd7pUtVH8C44RQQJoU0eJjtqtZHgE_5E33MUOTy-U=](/blobs/gTHd7pUtVH8C44RQQJoU0eJjtqtZHgE_5E33MUOTy-U=)\n\n\nThis Stackby template provides a basic content calendar that can be customized to meet your specific needs. You can make use of various features to add content files and keep track of the status of your content. This template allows you to consolidate all your upcoming work in one spot, and modify the [template](https://affine.pro/blog/how-to-build-go-to-market-strategy-free-templates) to align with your workflows and targets. With this template, you can organize all your marketing activities in one place, whether it be social media posts, blogs, email marketing, audio-visual content, and more.\n\n\n### 10. **[Creately](https://creately.com/usage/social-media-content-calendar/) Social Media Content Template**\n\n\n\n![jGgsRbBCO_Gxwn6zifPkkz4aY532QCl4OeAicMYz_ro=](/blobs/jGgsRbBCO_Gxwn6zifPkkz4aY532QCl4OeAicMYz_ro=)\n\n\nThe Creately social media content template offers a simplified approach to social media planning. This allows users to focus on creating engaging content and promoting their brand effectively. The template has custom data fields and tags that help clarify content styles, posting channels, different campaigns, priorities, roles, deadlines, and more. Additionally, users can import all social media content design assets into the canvas to keep them organized in a single place.\n\n\nWith these diverse options at your disposal, there's no limit to what you can achieve in terms of smart planning and organization when it comes to managing your social media content effectively throughout the year ahead!\n\n\n# **Kick-off Your Social Media Content Tracking with Templates**\n\n\nIn this fast-paced digital world, staying organized and strategic is key to a successful social media presence. Utilizing social media content calendar templates can significantly enhance your planning process, streamline your workflow, and boost your overall efficiency. By incorporating these best 10 social media content calendar templates into your strategy for smart planning in 2024, you can take control of your content schedule, stay consistent with posting frequency and timing, align campaigns across platforms, track performance metrics effectively, and ultimately drive better results for your brand or business.\n\n\n<div style=\"text-align:center;\">\n<iframe width=\"560\" height=\"315\" src=\"https://www.youtube.com/embed/WqOe9HgpsDY?si=PHGuSeRbOT9GxuPO\" title=\"YouTube video player\" frameborder=\"0\" allow=\"accelerometer; autoplay; clipboard-write; encrypted-media; gyroscope; picture-in-picture; web-share\" allowfullscreen></iframe>\n</div>\n\n\n* **Template Gallery in AFFiNE:** There is a curated collection of powerful [whiteboard](https://affine.pro/blog/best-free-whiteboard-layout-ideas-organization) templates that strategic the robust Gantt chart to the insightful monthly calendar and the comprehensive SWOT for your business's needsCalendar, an array of additional templates awaits your exploration, promising to expand the horizons of your marketing and sales pipeline crafting and execution. These templates serve as your launchpad, enabling you to skip the groundwork and jump straight into action. Crafted for seamless collaboration, AFFiNE's templates provide structured canvases for various tasks, saving you valuable time and enhancing efficiency in project management, content creation, and [planning](https://affine.pro/blog/top-10-best-free-digital-planner-apps-2023).\n\n\n\n![OP3GdbE7dwmQKK2uKzBgJbhpVJxkLuDsVtomxcggvSQ=](/blobs/OP3GdbE7dwmQKK2uKzBgJbhpVJxkLuDsVtomxcggvSQ=)\n\n\n* **Tailored Planning Precision with AFFiNE's Database:** AFFiNE's database seamlessly integrates Kanban and Table views for dynamic planning. By smoothly transforming your blocks into a Kanban view, effortlessly classify based on properties such as date, progress, and link. This allows for intuitive drag-and-drop functionality, ensuring precise organization and alignment of your project execution. Switching to the Table view offers a comprehensive project overview, enhancing the efficiency of your narrative development. With intuitive controls, track deadlines and manage unscheduled tasks seamlessly.\n\n\n\n![bY0EkoVLJfBpOjymBoGUxE0LAiQuW1bNgYA-FU1OQlA=](/blobs/bY0EkoVLJfBpOjymBoGUxE0LAiQuW1bNgYA-FU1OQlA=)\n\n\n* **Advanced Collaboration Capability:** When you do need to [collaborate](https://affine.pro/blog/top-asynchronous-communication-tools-free-2024) with other contributors to discuss your social media content calendar, AFFiNE makes getting feedback simple. Appealing collaboration capability provides visibility into assigned tasks, making tables easier to estimate, and ensuring your content remains well-designed. You can invite team members or friends to collaborate on social media content calendars together, making it perfect for planning and scheduling.\n\n\n\n![O88V12dZ7eALpdMD8-6eyyfRec5yZyWiQxCnvNEb3r0=](/blobs/O88V12dZ7eALpdMD8-6eyyfRec5yZyWiQxCnvNEb3r0=)\n\n\n* **Collections and Tags:** Collections enable you to organize your content documents in two distinct ways. The introduction of these new filters significantly enhances the flexibility of the \"All Pages\" view, providing you with a more efficient and user-friendly document management experience. This makes document handling more intuitive and effective.\n\n\n<video muted autoplay loop preload=\"auto\" playsinline>\n  <source src=\"/blobs/dVhTzZQg1uzjSb8WeFA_y9dzxtKbBIHTnbqFEMwRLXg=\" type=\"video/mp4\" />\n</video>\n\n\n* **Show Your Social Media Content Calendar with AFFiNE's Single Page Sharing:** No more oversharing of your workspace; now, you can precisely control what's shared with just a few clicks. AFFiNE's single-page sharing makes social media content calendar improvement simple, offering a tailored approach to showing your calendar to your business partners.\n\n\n\n![VsmRQKKT_JWfocv6kdTdmSw3-22k1EUrdWeyjhL8xjQ=](/blobs/VsmRQKKT_JWfocv6kdTdmSw3-22k1EUrdWeyjhL8xjQ=)\n\n\nSo why wait? Start implementing these powerful tools today to revolutionize the way you plan and execute your social media content. Elevate your online presence by harnessing the full potential of these top-notch templates designed to optimize your scheduling efforts and maximize engagement with your target audience. Level up your social media game now!\n\n\nPresently, **AFFiNE** has launched its [**Stable Version**](https://affine.pro/download), with ongoing efforts to develop a more comprehensive and dependable iteration. Join us on our voyage through our social media channels and be part of the experience. **Come and join us on our journey over on our media platforms. 🚀**\n\n\n* Official Website: [https://affine.pro/](https://affine.pro/)\n\n\n* GitHub: [https://github.com/toeverything/AFFiNE](https://github.com/toeverything/AFFiNE)\n\n\n* Discord: [https://discord.gg/Arn7TqJBvG](https://discord.gg/Arn7TqJBvG)\n\n\n* Twitter: [https://twitter.com/AffineOfficial](https://twitter.com/AffineOfficial)\n\n\n\n\n\n",
  "publish": true
}