{
  "title": "How to Create an Action Plan (Free&Best Templates and Examples) - Step-by-Step Guide",
  "authors": [
    "Xuan Pang"
  ],
  "tags": [
    "Content"
  ],
  "description": "Learn how to create an effective action plan with our comprehensive guide. Access free templates and best examples to streamline your goal-setting and achievement. Get started on your path to success now.",
  "created": 1701043200000,
  "updated": 1701043200000,
  "layout": "blog",
  "id": "uAfBDr4hRELwMu8qYDFrB",
  "slug": "create-action-plan-templates-examples-step-by-step-guide",
  "cover": "https://insider.affine.pro/api/workspaces/qf73AF6vzWphbTJdN7KiX/blobs/XVkyx44qGNinvInkwEt5dRKdVMdTtFQ2_doX_cOUTk8=.webp",
  "md": "---\n\ntitle: \"How to Create an Action Plan (Free&Best Templates and Examples) - Step-by-Step Guide\"\n\nauthor: Xuan Pang\n\ntags: Content\n\nslug: create-action-plan-templates-examples-step-by-step-guide\n\ndescription: \"Learn how to create an effective action plan with our comprehensive guide. Access free templates and best examples to streamline your goal-setting and achievement. Get started on your path to success now.\"\n\ncreated: 2023-11-27\n\nupdated: 2023-11-27\n\nlayout: blog\n\npublish: true\n\n---\n\nAn action plan template offers a pre-designed structure for swiftly integrating essential elements, such as tasks, deadlines, and responsible parties, to realize your project objectives. It serves as a valuable tool for ensuring the consistency and effectiveness of your project action plans, ensuring clarity for all team members. üìãThis comprehensive guide will walk you through the process of crafting an action plan, providing step-by-step instructions and inspirational examples to guide your journey. üöÄ\n\n\n![XVkyx44qGNinvInkwEt5dRKdVMdTtFQ2_doX_cOUTk8=](https://insider.affine.pro/api/workspaces/qf73AF6vzWphbTJdN7KiX/blobs/XVkyx44qGNinvInkwEt5dRKdVMdTtFQ2_doX_cOUTk8=)\n\n### What is an Action Plan?\n\nAn action plan is your roadmap for achieving a specific goal. It's like a strategic blueprint that outlines the steps necessary to execute a project efficiently, whether it's for personal or professional endeavors. By breaking your goal into smaller, [manageable tasks](https://affine.pro/blog/best-free-task-management-software-streamline-workflow), an action plan keeps you organized and motivated, helping you track your progress along the way.\n\nThis vital component of the strategic planning process not only enhances project management but also fosters teamwork. It's not limited to organizations; individuals can use action plans to map out their personal goals effectively.\n\n**Key components of an action plan include:**\n\n1. **Clear Goal Definition:** A precise description of the goal you aim to achieve.\n1. **Task Breakdown**: The individual steps or tasks required to reach your goal.\n1. **Assigned Responsibility:** Identifying the individuals responsible for each task.\n1. **Timelines and Milestones**: Setting deadlines and important milestones for task completion.\n\n![BIgv66nuj0oSzLeILRF_gZqWlic4jtmYRNaPRI5xb28=](https://insider.affine.pro/api/workspaces/qf73AF6vzWphbTJdN7KiX/blobs/BIgv66nuj0oSzLeILRF_gZqWlic4jtmYRNaPRI5xb28=)\n\n### Why You Need an Action Plan?\n\n* **Provides Clear Direction**: An action plan serves as your compass, delineating precisely which steps to take and when to complete them. It offers a definitive roadmap, ensuring you always know what's next.\n* **Sustains Motivation**: When your goals are documented and broken into manageable steps, it fuels your motivation and commitment. You have a tangible plan to follow, driving your determination throughout the project.\n* **Enables Progress Tracking**: With an action plan in place, monitoring your advancement toward your goal becomes effortless. It provides a structured framework for measuring your success.\n* **Prioritizes Tasks Effectively**: By cataloging all necessary steps in your action plan, you gain the ability to prioritize tasks based on their effort and impact. This aids in efficient task management.\n### How to Write an Action Plan - Step-by-Step Guide\n\n\n![mBycxwqIbU-LEkFIgPwXSDB9Lw9Et_zDgcdMq2usGcE=](https://insider.affine.pro/api/workspaces/qf73AF6vzWphbTJdN7KiX/blobs/mBycxwqIbU-LEkFIgPwXSDB9Lw9Et_zDgcdMq2usGcE=)\n\n1. üå™Ô∏è **Task Brainstorming**: Begin by brainstorming and listing the specific tasks required to reach your goal. Start from project inception and work systematically to the finish line. Consider initial steps and subsequent tasks. Incorporate timelines and stakeholder considerations, allowing for iterations and reviews.\n1. ‚úÇÔ∏è **Task Refinement**: Refine your task list by examining its efficiency. Identify non-essential tasks and consider delegation or additional resources.\n1. üßê **SCHEMES Evaluation**: Employ the SCHEMES framework to ensure the completeness of your action plan. SCHEMES stands for Space, Cash, Helpers, Equipment, Materials, Expertise, and Systems, covering all necessary elements.\n1. üìä **Task Prioritization**: Organize tasks logically and prioritize them. Identify crucial tasks and those that must be completed first to enable others.\n1. ‚è∞ **Establish Deadlines and Milestones**: Set specific deadlines for each task and define key milestones to stay on track and committed to your goal.\n1. üèÜ **Goal-Centric Task Completion**: Keep your end goal in mind as you complete each task. Ensure your action plan aligns with your goal, contributing to your overall objective.\n1. üìà **Regular Progress Tracking**: Implement a systematic process to track your progress. Review your achievements and assess plan deviations at specific intervals.To complement your Action Plan, you can also utilize the Corrective Action Plan Template. This template enables you to map out risks and behaviors, aiding in making well-informed decisions throughout your project.\n### Action Plan Templates and Examples\n\n##### 1. Simple Action Plan\n\nThis template offers a concise and practical approach to achieving your goals, making the process more accessible and manageable. Whether it's for personal or professional use, this template serves as an excellent starting point for your action planning needs. [Get the template <<<](https://insider.affine.pro/)\n\n\n![CyvVUzYpg8htjVESRoF1kdq5dpNUnBBazD0kqPzVtPQ=](https://insider.affine.pro/api/workspaces/qf73AF6vzWphbTJdN7KiX/blobs/CyvVUzYpg8htjVESRoF1kdq5dpNUnBBazD0kqPzVtPQ=)\n\n##### 2. Business Action Plan\n\nWhether you're launching a startup or looking to grow your established enterprise, this template will assist you in charting a clear course towards your business objectives. [Get the template <<<](https://insider.affine.pro/)\n\n\n![9hoJdXcj6jZrtTaKRqGGUoY5skB_OBPmV-xHUonjECQ=](https://insider.affine.pro/api/workspaces/qf73AF6vzWphbTJdN7KiX/blobs/9hoJdXcj6jZrtTaKRqGGUoY5skB_OBPmV-xHUonjECQ=)\n\n##### 3. Study Action Plan\n\nThis Study Action Plan is designed to empower you with effective strategies for structured learning, ensuring that you make the most of your reading endeavors. With this plan, you'll set clear goals, develop a productive study routine, and maximize your understanding and retention of the material you read. [Get the template <<<](https://insider.affine.pro/)\n\n\n![yrzv43BxL3AFgWbwuif7Nu3GJJtMcFxtEPaHhRUfPHE=](https://insider.affine.pro/api/workspaces/qf73AF6vzWphbTJdN7KiX/blobs/yrzv43BxL3AFgWbwuif7Nu3GJJtMcFxtEPaHhRUfPHE=)\n\n\n\n##### 4. Strategic action plan\n\nWhether you're overseeing a team, managing multiple tasks, or leading a complex project, this plan template will equip you with the skills and tools necessary to navigate the complexities of project management, ensuring successful outcomes and efficient execution. [Get the template <<<](https://insider.affine.pro/)\n\n\n![FyJFrWp__giaLJriY9T-yVgL_xEVhJ5p6Gj4e2AACEE=](https://insider.affine.pro/api/workspaces/qf73AF6vzWphbTJdN7KiX/blobs/FyJFrWp__giaLJriY9T-yVgL_xEVhJ5p6Gj4e2AACEE=)\n\nIf you're seeking even more tailored solutions, consider leveraging AFFiNE, a versatile platform that allows you to customize action plans to precisely match your individual needs and preferences. With this flexibility, you can optimize your planning process and ensure your goals are met effectively and efficiently.\n\n### [AFFiNE](https://affine.pro/)\n\n\n![iAkxI4vjnArhF6y4orPOS0piuCYS-KQkmSdCyYVIsJQ=](https://insider.affine.pro/api/workspaces/qf73AF6vzWphbTJdN7KiX/blobs/iAkxI4vjnArhF6y4orPOS0piuCYS-KQkmSdCyYVIsJQ=)\n\nAFFiNE is a cutting-edge work shedule software that is designed to assist you in organizing, managing, and cooperating on tasks, projects, and information. What sets AFFiNE apart is that it is a free and open-source program that employs offline technology to ensure that it is accessible to all users. This makes it an invaluable resource for individuals who require a comprehensive time management solution for their daily needs.\n\n**Key features:**\n\n* **Write, Draw, and Plan All At Once**: Enjoy your all-in-one KnowledgeOS solution for effortlessly writing, drawing, and planning on a hyper-fused platform. It supports kanban, table, rich-text paragraphs as building blocks to form pages or whiteboards. It carries out integrated processing here in document editing, data processing, or brainstorming.\n\n![crjX5_HRaAu3feQ3mQMTVmg-FqXutYjATZJpEZEMi98=](https://insider.affine.pro/api/workspaces/qf73AF6vzWphbTJdN7KiX/blobs/crjX5_HRaAu3feQ3mQMTVmg-FqXutYjATZJpEZEMi98=)\n\n* **Reliable Offline Capability**: We prioritize your privacy and have made the decision to provide offline support for AFFiNE. With offline support, your work is saved on your device, allowing you to make uninterrupted progress even during internet disruptions. This feature enhances productivity and ensures high-quality decision-making.\n\n![b170NZ_-DTtnErSRI_iPhSOzNlf5B9Nt2716NlXYe6Y=](https://insider.affine.pro/api/workspaces/qf73AF6vzWphbTJdN7KiX/blobs/b170NZ_-DTtnErSRI_iPhSOzNlf5B9Nt2716NlXYe6Y=)\n\n* **Privacy focussed**: AFFiNE is built with your privacy in mind and is one of our key concerns. We want you to keep control of your data, allowing you to store it as you like, where you like, while still being able to freely edit and view your data on-demand. With AFFiNE, you own your data, no matter what. With no sacrifice to collaborate and share, all your data is in your hand.\n\n![7tLzErsXRl3O-9-0m62ySSd00VYnYYtRKFaZUFit2Jg=](https://insider.affine.pro/api/workspaces/qf73AF6vzWphbTJdN7KiX/blobs/7tLzErsXRl3O-9-0m62ySSd00VYnYYtRKFaZUFit2Jg=)\n\nCurrently, **AFFiNE** has released its stable version, but we are continuing to build to a more feature-rich and stable build. **Come and join us on our journey over on our media platforms.**\n\n* Official Website: [https://affine.pro/](https://affine.pro/)\n* GitHub: [https://github.com/toeverything/AFFiNE](https://github.com/toeverything/AFFiNE)\n* Discord: [https://discord.gg/Arn7TqJBvG](https://discord.gg/Arn7TqJBvG)\n* Twitter: [https://twitter.com/AffineOfficial](https://twitter.com/AffineOfficial)\n",
  "publish": true
}