{
  "title": "Everything you need to know about OKR",
  "authors": [
    "Christopher Smolak"
  ],
  "tags": [
    "Content"
  ],
  "description": "Discover everything you need to know about OKRs and how they can benefit your business. Learn how to set up and implement OKRs effectively and find out how you can utilise AFFiNE to help you achieve your goals with ease.",
  "created": 1681776000000,
  "updated": 1681862400000,
  "layout": "blog",
  "id": "TKVirwXjrJ",
  "slug": "everything-you-need-to-know-about-okr",
  "cover": "/blobs/b25dBfMkbaH0LGLhqpbpC1cLCjOyG3trP0kmccLJHI0=",
  "md": "---\n\n\ntitle: \"Everything you need to know about OKR\"\n\n\nauthor: Christopher Smolak\n\n\ntags: Content\n\n\nslug: everything-you-need-to-know-about-okr\n\n\ndescription: Discover everything you need to know about OKRs and how they can benefit your business. Learn how to set up and implement OKRs effectively and find out how you can utilise AFFiNE to help you achieve your goals with ease.\n\n\ncreated: 2023-04-18\n\n\nupdated: 2023-04-19\n\n\nlayout: blog\n\n\npublish: true\n\n\n---\n\n\n\n![b25dBfMkbaH0LGLhqpbpC1cLCjOyG3trP0kmccLJHI0=](/blobs/b25dBfMkbaH0LGLhqpbpC1cLCjOyG3trP0kmccLJHI0=)\n\n\n### **Introduction**\n\n\n\n![wOKYxf_Abdy4aooQbm9aiiOCxZ2mzhz3JY1kuKLCZLE=](/blobs/wOKYxf_Abdy4aooQbm9aiiOCxZ2mzhz3JY1kuKLCZLE=)\n\n\nOKR stands for Objectives and Key Results. It's a goal-setting framework that helps businesses align their goals with their strategy and measure progress towards achieving them. OKRs have become increasingly popular in recent years, with companies such as Google, LinkedIn, and Airbnb using them to drive their success.\n\n\nIf you're looking to implement OKRs in your business, you might be wondering where to start. That's where our Notion alternative comes in. Our product is designed to help businesses set up and track their OKRs in a simple and intuitive way.\n\n\nIn this article, we'll cover everything you need to know about OKRs, from what they are and how they differ from KPIs, to how to set them up effectively. We'll also show you how our product can help you achieve your goals with OKRs.\n\n\n### **What are OKRs?**\n\n\n\n![OayUDx3S8wG-FNMSk2cz8gZCvyIUa5oZlkUgzhDiX9Q=](/blobs/OayUDx3S8wG-FNMSk2cz8gZCvyIUa5oZlkUgzhDiX9Q=)\n\n\nOKRs are a goal-setting framework that helps businesses align their goals with their strategy and measure progress towards achieving them. The framework consists of two parts: objectives and key results.\n\n\nObjectives are the goals that you want to achieve. They should be specific, measurable, achievable, relevant, and time-bound (SMART). Objectives should also be ambitious and inspire your team to achieve great things.\n\n\nKey results are the specific, measurable outcomes that will help you achieve your objectives. They should be quantifiable and provide a clear indication of progress towards your objectives.\n\n\nOne of the key differences between OKRs and KPIs is that KPIs focus on measuring performance, while OKRs focus on achieving specific goals. KPIs are typically used to track ongoing performance metrics, such as revenue or customer satisfaction. OKRs, on the other hand, are used to set specific goals and measure progress towards achieving them.\n\n\nOKRs can be used by businesses of all sizes and types. For example, a sales team might use OKRs to increase their revenue by a certain percentage, while a marketing team might use them to increase their website traffic or social media engagement.\n\n\n### **How to set up OKRs?**\n\n\n\n![RY1DVsMxwXjfY0FclXyYKwXNs_Mj9lYTMW-8j1vSCIw=](/blobs/RY1DVsMxwXjfY0FclXyYKwXNs_Mj9lYTMW-8j1vSCIw=)\n\n\nSetting up OKRs involves several steps:\n\n\n1. **Define your overall business objectives:** Start by identifying your top-level business objectives. These should be aligned with your company's mission and vision.\n\n\n1. **Break down your objectives:** Once you have your overall business objectives in place, break them down into departmental or team objectives. These should be aligned with your overall business objectives.\n\n\n1. **Define your key results:** For each objective, identify the key results that will help you achieve it. These should be specific, measurable, and time-bound.\n\n\n1. **Assign ownership:** Assign an owner to each objective and key result. This person will be responsible for ensuring that the objective is achieved and the key results are met.\n\n\n1. **Monitor progress:** Regularly monitor progress towards achieving your objectives and key results. This will help you identify any issues or obstacles and make adjustments as needed.\n\n\nWhen setting up OKRs, it's important to keep them simple, focused, and aligned with your overall business strategy. Our Notion alternative can help you set up your OKRs quickly and easily, and monitor progress towards achieving them.\n\n\n### **How to implement OKRs?**\n\n\n\n![SrjDPeDPd1p1414MWce14uw5XL218BmFpV0gvIPErPA=](/blobs/SrjDPeDPd1p1414MWce14uw5XL218BmFpV0gvIPErPA=)\n\n\nImplementing OKRs effectively involves more than just setting them up. Here are some best practices to help you implement OKRs successfully:\n\n\n1. **Get buy-in from your team:** Ensure that everyone on your team understands the purpose of OKRs and how they will be used to achieve your business goals.\n\n\n1. **Set realistic objectives and key results:** Ensure that your objectives are challenging but achievable, and that your key results are specific and measurable.\n\n\n1. **Communicate progress regularly:** Regularly communicate progress towards achieving your objectives and key results to keep everyone on the same page.\n\n\n1. **Adjust as needed:** Be willing to adjust your OKRs as needed based on feedback and changes in your business environment.\n\n\nOur Notion alternative can help you implement OKRs effectively by providing a centralized platform for setting up and monitoring progress towards achieving your goals.\n\n\n### **Benefits of using OKRs**\n\n\n\n![9zWKelgb5USzgT9fVRIgnwQYcMa33DvPDKpeRzRaeO0=](/blobs/9zWKelgb5USzgT9fVRIgnwQYcMa33DvPDKpeRzRaeO0=)\n\n\nThere are many benefits to using OKRs in your business, including:\n\n\n1. **Improved focus:** OKRs help you focus on the most important goals for your business, ensuring that everyone is aligned and working towards achieving them.\n\n\n1. **Increased motivation:** By setting challenging but achievable goals, OKRs can increase motivation and engagement among your team.\n\n\n1. **Better alignment:** OKRs ensure that everyone in your business is aligned and working towards the same objectives, reducing the risk of silos or conflicting priorities.\n\n\n1. **Improved performance:** By setting specific and measurable objectives, OKRs can help improve performance and drive success in your business.\n\n\nMany successful businesses have implemented OKRs, including Google, LinkedIn, and Airbnb. By using AFFiNE as your next-gen knowledge base, you can achieve the same benefits and drive success in your own business.\n\n\n### **Conclusion**\n\n\n\n![o-YWJoGOgjWii1rU-4dDLPhm0KnruJMq2LsQQhTcfok=](/blobs/o-YWJoGOgjWii1rU-4dDLPhm0KnruJMq2LsQQhTcfok=)\n\n\nIn conclusion, implementing OKRs in your business can help you achieve your goals and drive success. By setting specific and measurable objectives and key results, you can improve focus, increase motivation, and improve performance across your business.\n\n\nOur Notion alternative can help you implement and monitor your OKRs in a simple and intuitive way. By providing a centralized platform for setting up and tracking progress towards achieving your goals, our product can help you achieve success with OKRs.\n\n\nDon't wait to start implementing OKRs in your business. With our Notion alternative, you can get started today and achieve your goals with ease.\n\n\n\n---\n\n\nAFFiNE is still in alpha, but we are continuing to build to a more feature-rich and stable build. Come and join us on our journey over on our media platforms. Making your OKR with the use of AFFiNE!!\n\n\n* Official Website: [https://affine.pro/](https://affine.pro/)\n\n\n* GitHub: [https://github.com/toeverything/AFFiNE](https://github.com/toeverything/AFFiNE)\n\n\n* Discord: [https://discord.gg/Arn7TqJBvG](https://discord.gg/Arn7TqJBvG)\n\n\n* Telegram: [https://t.me/affineworkos](https://t.me/affineworkos)\n\n\n\n\n\n",
  "publish": true
}