{
  "title": "Express Yourself with 6 Free and Customizable All About Me Templates: Canva Alternatives",
  "authors": [
    "Yanxi Liu"
  ],
  "tags": [
    "Content"
  ],
  "description": "Get ready to tap into your creative side in 2023 with 10 free and fully customizable templates. Unleash your self-expression and let your unique personality shine through.",
  "created": 1701043200000,
  "updated": 1701043200000,
  "layout": "blog",
  "id": "h2IKvsp46iN-UsTFY8y2r",
  "slug": "express-yourself-with-6-free-and-customizable-all-about-me- templates-canva-alternatives",
  "cover": "/blobs/u5SNrrMTHsCDOdpzyHhe3ewzvsULvCiXj3or-tJDcZs=",
  "md": "---\n\n\ntitle: \"Express Yourself with 6 Free and Customizable All About Me Templates: Canva Alternatives\"\n\n\nauthor: \"Yanxi Liu\"\n\n\ntags: Content\n\n\nslug: express-yourself-with-6-free-and-customizable-all-about-me- templates-canva-alternatives\n\n\ndescription: \"Get ready to tap into your creative side in 2023 with 10 free and fully customizable templates. Unleash your self-expression and let your unique personality shine through.\"\n\n\ncreated: 2023-11-27\n\n\nupdated: 2023-11-27\n\n\nlayout: blog\n\n\npublish: true\n\n\n---\n\n\n\n![u5SNrrMTHsCDOdpzyHhe3ewzvsULvCiXj3or-tJDcZs=](/blobs/u5SNrrMTHsCDOdpzyHhe3ewzvsULvCiXj3or-tJDcZs=)\n\n\nAre you excited for the beginning of the new semester, new workplace, or any meeting that requires you to introduce yourself? üåü\n\n\nüéí Whether you're a student, a teacher, or a new employee. These moments offer us the opportunity to connect with others, forge new friendships, and embark on exciting journeys together. To foster this connection, many schools and workplaces have embraced the practice of using All About Me worksheets. These [free and customizable templates](https://affine.pro/blog/11-free-customizable-weekly-schedule-planner-templates-2023) allow us to express ourselves and let others get to know us better.\n\n\nPlus, üìåthey can be shared on notice boards and group chats for everyone to seeüëÄ! This approach ensures that introductions become less formal and intimidating, creating aüåü warm and üòäinclusive environment for all individuals involved.\n\n\nRemember, these worksheets aren't just for the beginning of the year or a new endeavor; they can be used throughout the year, fostering continued connections and self-expression. üåà\n\n\nSo, get ready to let your true colors shine and introduce yourself as engagingly and authentically as possible!\n\n\n### How can you use this All About Me templates?\n\n\nIntroducing the Incredible All About Me Worksheet: A fun and interactive tool that allows students to express themselves in their own words. This engaging worksheet provides a space for them to share their name, age, birthday, interests, and hobbies. It even encourages their creativity with a self-portrait drawing section.\n\n\nNot only does the All About Me worksheet help teachers get to know their students better, but it also assists students in becoming comfortable with sharing personal information such as their name and birthdate. With captivating superhero-inspired designs, this resource is perfect for the beginning of the school year or as an individual introductory activity for new students, fostering a sense of comfort and belonging.\n\n\n### 6 All About Me Worksheets to boost your creativity in 2023\n\n\n##### 1. AFFiNE-Student Snapshot template\n\n\n\n![HKJJP0YPmd7XfbXTRxZsxkhvL4_beO9E-sMn2e9Vu4E=](/blobs/HKJJP0YPmd7XfbXTRxZsxkhvL4_beO9E-sMn2e9Vu4E=)\n\n\nAFFiNE-Student Snapshot: The perfect template for showcasing your academic achievements and goals in a concise and impressive format. Capture your scholarly journey and let your excellence speak for itself!\n\n\n##### 2. AFFiNE simple Q&A All About Me template\n\n\n\n![tGd6f0VWouhcIl49cgdrN1_ei7lL2gjhTEtDweG-hDQ=](/blobs/tGd6f0VWouhcIl49cgdrN1_ei7lL2gjhTEtDweG-hDQ=)\n\n\nThe AFFiNE Simple Q&A All About Me template is here to help you uncover and share the most intriguing aspects of your unique personality!\n\n\n##### 3. AFFiNE Lesson Targeted Template\n\n\n\n![RPxv-uABevoyJDxDLA8GoXe9dwh2xHsQr4EgdkDnLtA=](/blobs/RPxv-uABevoyJDxDLA8GoXe9dwh2xHsQr4EgdkDnLtA=)\n\n\nReady to level up your learning game? The AFFiNE Lesson Targeted Template is here to guide you every step of the way, helping you unlock your full potential and achieve academic greatness!\n\n\n##### 4. AFFiNE Personal Identity Template\n\n\n\n![fKTQJ-2Xj0yOv-neNIe40ZDaeI4aOWCfTHVCKHMk0p8=](/blobs/fKTQJ-2Xj0yOv-neNIe40ZDaeI4aOWCfTHVCKHMk0p8=)\n\n\nThe AFFiNE Personal Identity Template is an illuminating tool that guides you to embrace your true essence and celebrate your individuality. With this template, unleash the power of self-expression, unlocking the limitless potential that lies within you.\n\n\n##### 5. Me and my pet template\n\n\n\n![EhubixwIKwju-KbM2c-l1YIrc-HSRH0Lw8wC_RTdOp0=](/blobs/EhubixwIKwju-KbM2c-l1YIrc-HSRH0Lw8wC_RTdOp0=)\n\n\nThe \"Me and My Pet\" template is a delightful companion that captures the beautiful bond between you and your furry friend, celebrating the joy, laughter, and unconditional love they bring into your life.\n\n\n##### 6. Content Creator All About Me Template\n\n\n\n![7vDcpGIAI0EqVlGFmrmBXMVWV1VltpHnUSCp4AsdnWs=](/blobs/7vDcpGIAI0EqVlGFmrmBXMVWV1VltpHnUSCp4AsdnWs=)\n\n\nContent Creator All About Me template is captivating tempalte that allows you to showcase your unique personality, passions, and experiences, taking your audience on an engaging journey of self-expression and inspiration.\n\n\n### 6 Steps to creat ALL About Me in AFFiNE\n\n\n1. **Include your child to the maximum extent possible**. Self Advocacy and Self Determination begin here!\n\n\n1. **AFFiNE is better for pictures**. If you want to add pictures and graphics, I recommend AFFiNE. A basic account is free and you can use it for anything. I use it for Christmas cards and birthday party invitations.\n\n\n1. **Open that template and ‚Äúmake a copy.‚Äù** That way, if you go in too deep and make some formatting changes that you cannot correct, you have a clean copy.\n\n\n1. **Start editing**. If you look on the left, you‚Äôll have other template options. If you look on the upper left side, there is a spot to click ‚Äúundo.‚Äù That button is your friend.\n\n\n1. **Once you have it the way you want, you download it.** You have several options, including PNG and PDF format. PDF is what I recommend for printing.\n\n\n1. **Have fun!** Have fun with it. They have a zillion fonts and a zillion color choices.\n\n\n### Creatively making an ‚ÄúAll About Me sheet‚Äù using AFFiNE\n\n\nWhen it comes to selecting the best free All About Me template for your organization in 2023, it's important to have confidence in your decision by considering the unique needs of your team and the specific features offered by each tool. By incorporating a creative tool into your introduction, you can gain attention throughout your work-life and school journey and achieve your goals with ease. Look no further than AFFiNE, the top choice for efficient all-about-me template makers. Designed exclusively for project management and process improvement purposes, AFFiNE provides a comprehensive solution for organizations seeking to streamline their operations with confidence.\n\n\n\n![Yh4L5EZtXCl2bwf7YT0doIvwMJvA4KtCuOFtGwpbCVc=](/blobs/Yh4L5EZtXCl2bwf7YT0doIvwMJvA4KtCuOFtGwpbCVc=)\n\n\nSo why wait? Start exploring AFFiNE today and take your process mapping to new heights! The timing is opportune, and it's never too late to embark on this transformative journey. Commence improving your plans by using AFFiNE's user-friendly tool. Presently, AFFiNE has launched its [Stable Version](https://affine.pro/download), with ongoing efforts to develop a more comprehensive and dependable iteration. Join us on our voyage through our social media channels and be part of the experience. **Come and join us on our journey over on our media platforms.** üöÄ\n\n\n* Official Website: [https://affine.pro/](https://affine.pro/)\n\n\n* GitHub: [https://github.com/toeverything/AFFiNE](https://github.com/toeverything/AFFiNE)\n\n\n* Discord: [https://discord.gg/Arn7TqJBvG](https://discord.gg/Arn7TqJBvG)\n\n\n* Twitter: [https://twitter.com/AffineOfficial](https://twitter.com/AffineOfficial)\n\n\n",
  "publish": true
}