{
  "title": "Final Countdown: Your Last Opportunity to Join Our Early Access User Program!",
  "authors": [
    "AFFiNE"
  ],
  "tags": [
    "Content"
  ],
  "description": "Join us for the final countdown as we approach the last days of our Early Access User Program. Don't miss your chance to be part of this exclusive opportunity!",
  "created": 1698278400000,
  "updated": 1698278400000,
  "layout": "blog",
  "id": "EYC-e59gEH",
  "slug": "final-countdown-join-early-access",
  "cover": "/blobs/sZhjGEoVGq_G91bDGhPTGEaeZFi1lsTUGHlY-pBP2os=",
  "md": "---\n\n\ntitle: \"Final Countdown: Your Last Opportunity to Join Our Early Access User Program!\"\n\n\nauthor: AFFiNE\n\n\ntags: Content\n\n\nslug: final-countdown-join-early-access\n\n\ndescription: \"Join us for the final countdown as we approach the last days of our Early Access User Program. Don't miss your chance to be part of this exclusive opportunity!\"\n\n\ncreated: 2023-10-26\n\n\nupdated: 2023-10-26\n\n\nlayout: blog\n\n\npublish: true\n\n\n---\n\n\nWe have some exciting last chances to share with you: the countdown to the final days of our **Early Access User** Program has officially begun, and it will conclude on **November 9th**!\n\n\n\n\n\n**Support us: [https://community.affine.pro/c/insider-general/](https://community.affine.pro/c/insider-general/)**\n\n\n\n![sZhjGEoVGq_G91bDGhPTGEaeZFi1lsTUGHlY-pBP2os=](/blobs/sZhjGEoVGq_G91bDGhPTGEaeZFi1lsTUGHlY-pBP2os=)\n\n\n\n\n\n# **What benefits await early access sponsors?**\n\n\n### **1.Get a head start with Unlock the Boundless Potential of AFFiNE Cloud**\n\n\nDuring this period, you'll have an exclusive chance to explore AFFiNE Cloud and experience its groundbreaking features firsthand.\n\n\n* **Collaboration**: We have just rolled out an exciting new collaboration feature that empowers **multiple users to work together in real time**. With this feature, you can simultaneously edit, make modifications to task progress and deadlines, and collaborate on presentations, all within AFFiNE. And that's not all - there are even more remarkable features waiting for you to explore!\n\n\n  \n![O88V12dZ7eALpdMD8-6eyyfRec5yZyWiQxCnvNEb3r0=](/blobs/O88V12dZ7eALpdMD8-6eyyfRec5yZyWiQxCnvNEb3r0=)\n\n\n* **Multi-Endpoint Real-time Sync**: Stay synchronized across all your devices in real-time, no matter where you are. Even when offline, your changes will seamlessly sync once you're back online.\n\n\n\n![81XTQI-d-Le-DP8jZwI5uGem89KLPUKeYXmmGeRcHCE=](/blobs/81XTQI-d-Le-DP8jZwI5uGem89KLPUKeYXmmGeRcHCE=)\n\n\n* **Reliable Offline Capability**: Our Offline Support ensures uninterrupted work, even during internet disruptions.\n\n\n\n![re72pCW0_OP8yctTXT2gXUXC9J6wLqAh-bLN8IZNjCM=](/blobs/re72pCW0_OP8yctTXT2gXUXC9J6wLqAh-bLN8IZNjCM=)\n\n\n* **Unrivaled Privacy:** Your data's security is our top priority. AFFiNE Cloud meticulously encrypts and securely stores all your workspace information.\n\n\n\n![BMwhnBD8bfuBzKi2a16kVAnuilh8vwJFh1a4oEntMB8=](/blobs/BMwhnBD8bfuBzKi2a16kVAnuilh8vwJFh1a4oEntMB8=)\n\n\nMore details: [https://affine.pro/blog/what-is-new-affine-0922](https://affine.pro/blog/what-is-new-affine-0922)\n\n\n\n\n\n### **2.Recurring 50% Discount**\n\n\nYour commitment deserves appreciation. Benefit from a lasting 50% discount as long as you continue to find value in your subscription.\n\n\n\n\n\n### **3.One-Year Free Pro Plan**\n\n\nEnjoy a complimentary one-year premium AFFiNE Pro Plan subscription, packed with advanced tools to boost your productivity and creativity.\n\n\nHow to become our early access sponsor? To become an early access sponsor through [https://community.affine.pro/c/insider-general/](https://community.affine.pro/c/insider-general/).\n\n\n\n\n\n# Next Steps after being an early access sponsor\n\n\n1. Download the **0.9.0 Beta Version** from our website: [https://affine.pro/download](https://affine.pro/download)\n\n\n1. After becoming a sponsor, you will receive an email from the AFFiNE team confirming that your **email address has been added to the whitelist**. You can log in to AFFiNE with this email. Additionally, you have the option to sign in using your Google account.\n\n\n1. For more information, FAQ is here to help: [https://insider.affine.pro/share/af3478a2-9c9c-4d16-864d-bffa1eb10eb6/wJ-CCaV-D3](https://insider.affine.pro/share/af3478a2-9c9c-4d16-864d-bffa1eb10eb6/wJ-CCaV-D3)\n\n\n\n\n\nShould you encounter any difficulties, rest assured that our community is here to assist you at any time: [https://community.affine.pro/home](https://community.affine.pro/home).\n\n\n\n\n\nThank you once more for being an integral part of the AFFiNE community. Your trust means the world to us.\n\n\n",
  "publish": true
}