{
  "title": "10 Free AI Paragraph Generators for Writing in 2024",
  "authors": [
    "Xuan Pang"
  ],
  "tags": [
    "Content"
  ],
  "description": "Discover the top 10 free AI paragraph generators for 2024. Enhance your writing efficiency with these powerful tools, perfect for\n\nbloggers, marketers, and content creators.",
  "created": 1716336000000,
  "updated": 1716336000000,
  "layout": "blog",
  "id": "DMxAuImgGh8jfG1ixjI9m",
  "slug": "free-ai-paragraph-generators",
  "cover": "/blobs/AMB67EjAnMTQqhmEhBkz0e2HWrKsSg5YWIWto6ZNyko=",
  "md": "---\n\n\ntitle: \"10 Free AI Paragraph Generators for Writing in 2024\"\n\n\nauthor: \"Xuan Pang\"\n\n\ntags: Content\n\n\nslug: free-ai-paragraph-generators\n\n\ndescription: \"Discover the top 10 free AI paragraph generators for 2024. Enhance your writing efficiency with these powerful tools, perfect for\n\n\nbloggers, marketers, and content creators.\"\n\n\ncreated: 2024-05-22\n\n\nupdated: 2024-05-22\n\n\nlayout: blog\n\n\npublish: true\n\n\n---\n\n\n\n![AMB67EjAnMTQqhmEhBkz0e2HWrKsSg5YWIWto6ZNyko=](/blobs/AMB67EjAnMTQqhmEhBkz0e2HWrKsSg5YWIWto6ZNyko=)\n\n\nExperiencing writer’s block can happen to anyone, and sometimes a little extra help is needed to get words on the page. Regardless of your writing skills, using a paragraph generator can speed up your work and [boost productivity](https://affine.pro/blog/best-time-management-tools-techniques-2023). From crafting product descriptions to creating [social media posts](https://affine.pro/blog/best-free-social-media-scheduler-tools-to-empower-workflow), AI tools can provide an excellent starting point to overcome writer’s block.\n\n\nHowever, selecting the right paragraph generator is crucial for producing [high-quality content](https://affine.pro/blog/free-content-calendar-templates-social-media-blogs). Here are 10 paragraph generators to use in 2024, including their pros, cons, and the types of content they’re best suited for.\n\n\n# **What Should You Look for in AI Paragraph Generators?**\n\n\nAI writing tools are versatile and can be used for [brainstorming](https://affine.pro/blog/top-8-proven-brainstorming-techniques-creativity), cover letter writing, copywriting, [content marketing](https://affine.pro/blog/top-10-social-media-advertising-benefits-marketing-experts), and many other tasks to accelerate the writing process.\n\n\nBut how can you ensure that your text generator will produce unique, high-quality paragraphs? Here are three key factors to look for in a paragraph generator:\n\n\n\n![6KvQBq0CgcKsRCdIdan_YHtko99auMQRMc8NlA89Jn4=](/blobs/6KvQBq0CgcKsRCdIdan_YHtko99auMQRMc8NlA89Jn4=)\n\n\n* **Readability:** Does the paragraph generator create engaging paragraphs that are easy for people to read? If you’re using generated content for a blog or [social media post](https://affine.pro/blog/best-free-social-media-scheduler-tools-to-empower-workflow), then you’ll want text that matches your own writing style\n\n\n* **Reliability:** Does the paragraph writer create accurate, original content? Avoid [AI tools](https://clickup.com/blog/ai-tools/) that make up facts or paraphrase existing text too closely so you don’t run into issues with misinformation or plagiarism\n\n\n* **Price:** How much does it cost to use? Although there are free paragraph generators out there, some of the [best writing tools](https://clickup.com/blog/best-writing-tools/) charge a subscription fee. It may be worth investing in a more powerful tool for professional use cases\n\n\n# 1**0 Best and Free AI Paragraph Generators in 2024**\n\n\n## [**AFFiNE**](https://affine.pro)\n\n\n<div style=\"text-align:center;\">\n<iframe width=\"560\" height=\"315\" src=\"https://www.youtube.com/embed/WqOe9HgpsDY?si=PHGuSeRbOT9GxuPO\" title=\"YouTube video player\" frameborder=\"0\" allow=\"accelerometer; autoplay; clipboard-write; encrypted-media; gyroscope; picture-in-picture; web-share\" allowfullscreen></iframe>\n</div>\n\n\nAFFiNE stands out as a state-of-the-art AI paragraph generator, meticulously crafted to employ AI to streamline the [organization](https://affine.pro/blog/15-types-events-event-management-categories-examples), management, and collaboration on tasks, [projects](https://affine.pro/blog/best-project-planning-tools-software-for-teams-2023), and real-time information. What distinguishes AFFiNE is its unique offering as a free and [open-source](https://affine.pro/blog/five-best-open-source-miro-alternatives-2023) program, leveraging offline technology to ensure accessibility for all users.\n\n\nExplore [AFFiNE AI](https://affine.pro/blog/affine-0-12-0-launch-week-day-3-early-access-affine-ai-self-host-upcoming-0-13-unveiled), your true multimodal AI copilot, dedicated to turning \"all your ideas into reality.\"\n\n\n\n![w6sbhxbPgo7gWXvkKqnEfLFi-MQTKThYj7SweGMRkoo=](/blobs/w6sbhxbPgo7gWXvkKqnEfLFi-MQTKThYj7SweGMRkoo=)\n\n\n**Key features:**\n\n\n* **AI Writer:**Perfect writing effortlessly with AFFiNE AI's advanced AI Writer feature. Say goodbye to spelling and grammar errors, tone inconsistencies, and lengthy editing sessions. With AFFiNE AI, users can translate content, adjust length, improve clarity, generate action items, and create drafts, outlines, or [timelines](https://affine.pro/blog/how-to-create-timeline-template-google-docs-step-by-step-guide) with ease. Whether crafting social media posts or penning creative stories, AFFiNE AI empowers users to express themselves confidently and efficiently.\n\n\n  \n![SBMr8BT1bbb5eyroL-KdqZUjHinJL6qhXAimhvalkqg=](/blobs/SBMr8BT1bbb5eyroL-KdqZUjHinJL6qhXAimhvalkqg=)\n\n\n  * **Unlocking Writing Excellence with AFFiNE Inline AI Writing:** Have you ever wished for a writing partner who could magically transform your tone, making you sound more professional or conversational at the snap of your fingers? Enter AFFiNE Inline AI Writing! It helps refine your writing style and captivates your audience with the perfect tone.\n\n\n  * **Guardian for Spelling and Grammar:** Imagine having a trusty sidekick that swoops in to catch those pesky spelling and grammar errors before they ruin your masterpiece. That's exactly what [AFFiNE AI](https://affine.pro/blog/affine-0-12-0-launch-week-day-3-early-access-affine-ai-self-host-upcoming-0-13-unveiled) does! With its real-time corrections, you can bid farewell to embarrassing typos and grammar slip-ups, ensuring your content shines with flawless precision.\n\n\n  * **Tailoring Text Length to Perfection:** Need to trim down that lengthy paragraph or beef up your content with more detail? Look no further than AFFiNE AI! It lets you effortlessly adjust the length of your text, helping you strike the perfect balance between brevity and depth.\n\n\n## [**ChatGPT**](https://chat.openai.com/)\n\n\n\n![zYSd2IeeHmoPdKLe94wAiBjh8hYlS7cRPBnA1brZ3TA=](/blobs/zYSd2IeeHmoPdKLe94wAiBjh8hYlS7cRPBnA1brZ3TA=)\n\n\n**[ChatGPT](https://chat.openai.com/)** is one of the most popular **AI tools** around. You can use it to carry out entire conversations or put it to use as a content ideation tool. However, it also comes with many features that most users don’t know about. With the right prompts, it can compose audio tracks and generate logos.\n\n\n**Key features:**\n\n\n* **User-Friendly Interface:**Boasting a highly intuitive design, it's exceptionally easy to navigate and operate, ensuring a smooth and effortless user experience.\n\n\n* **Versatility:**Recognized as one of the most versatile AI tools available, it offers a wide range of functionalities and applications, catering to diverse needs and scenarios.\n\n\n* **Automation Capabilities:** A solid choice for automation, making it a reliable tool for streamlining tasks and processes, enhancing overall efficiency.\n\n\n## [**Bing AI (Microsoft Copilot)**](https://www.bing.com/search?q=Bing+AI&showconv=1&FORM=hpcodx)\n\n\n\n![TXUA5ebJi7ygRwJuQrmK5BCJrnH7Na85-TNaZ7kTraY=](/blobs/TXUA5ebJi7ygRwJuQrmK5BCJrnH7Na85-TNaZ7kTraY=)\n\n\nMicrosoft's close relationship with OpenAI was a positive step to [Bing Search](https://www.bing.com/search?q=Bing+AI&showconv=1&FORM=hpcodx): it can search the web and generate answers based on the results. It's also connected to DALL·E 3, so if you ask for images, you'll get four visual variations of your prompt. Microsoft is bringing all its AI features into a single name—[Microsoft Copilot](https://zapier.com/blog/microsoft-copilot/)—so look out for that rebranding across its product line.\n\n\n**Key features:**\n\n\n1. **Real-Time Collaboration**: Bing AI facilitates real-time collaboration by providing instant access to web search results and generating answers based on the information retrieved.\n\n\n1. **Contextual Awareness**: Bing AI demonstrates contextual awareness by understanding user queries and providing relevant and accurate responses tailored to the context of the search.\n\n\n1. **Multimodal Capabilities**: Bing AI offers multimodal capabilities through its integration with DALL·E 3, allowing users to request images and receive multiple visual variations of their prompts, enhancing the search experience.\n\n\n## [**Copy.ai**](https://clickup.com/blog/copy-ai-alternatives/)\n\n\n\n![U6pcxXFai-s1SuiGUgt6V6_8XgXUotAEtjJZty_XAmc=](/blobs/U6pcxXFai-s1SuiGUgt6V6_8XgXUotAEtjJZty_XAmc=)\n\n\n[Copy.ai](https://www.copy.ai/) is another [popular AI writing tool](https://clickup.com/blog/ai-writing-tools/) that helps you create content faster. What differentiates Copy.ai from some of the other AI writers is that it allows you to provide very clear context, like what are the main points you want to cover, what brand guidelines to follow, and so on.\n\n\n**Key features:**\n\n\n* **Data Collection:** Chat by Copy.ai offers real-time data collection capabilities, allowing users to gather information seamlessly through conversational interfaces.\n\n\n* **Content Editor:** With an in-line doc editor, users can effortlessly edit and refine AI-generated content to ensure clarity, coherence, and accuracy.\n\n\n* **Prompts:** Copy.ai provides pre-built prompts designed to facilitate the generation of high-quality outputs for various purposes, such as blogs or [AI generated bios](https://clickup.com/blog/bio-generators/), streamlining the content creation process.\n\n\n## [**ClickUp**](https://www.googleadservices.com/pagead/aclk?sa=L&ai=DChcSEwir5sn_gIqFAxUhCXsHHSQJABIYABABGgJ0bQ&ase=2&gclid=EAIaIQobChMIq-bJ_4CKhQMVIQl7Bx0kCQASEAAYASABEgKqdPD_BwE&ohost=www.google.com.hk&cid=CAASJeRoIYPsfCWhqfZSePyMfBG1F8qPduy9c_JWSmCt1_se1fUURz8&sig=AOD64_14e7HtEGv8RW_sjiokh3hDgdA1nw&q&nis=4&adurl&ved=2ahUKEwiezMT_gIqFAxW0mq8BHRZbDK8QqyQoAHoECAYQDA)\n\n\n\n![3cJxhPR6pMkzMA31yvsdxoKxC3HSKB_WIerVqQWSRb0=](/blobs/3cJxhPR6pMkzMA31yvsdxoKxC3HSKB_WIerVqQWSRb0=)\n\n\nClickUp is an all-in-one project management software that offers hundreds of customizable features to give individuals and teams the flexibility and tools they need to work smarter and boost productivity. ClickUp has launched an AI content assistant feature, ClickUp AI, a content ideation and creation tool in ClickUp Docs that help with [generating ideas, copywriting, copyediting](https://clickup.com/blog/copywriting-tools/), summarizing a long text to writing content, and so much more.\n\n\n**Key features:**\n\n\n* **Content Research and Ideation:** With this feature, users can generate instant and high-quality content ideas for various purposes such as blog posts, emails, advertising copy, and more.\n\n\n* **Copy Editing Assistance:**This functionality provides users with valuable suggestions to enhance the quality and clarity of their written content.\n\n\n## [**Narrato**](https://narrato.io/)\n\n\n\n![GSOYZf-LcT3jg-Vz5Elybux8SUOJ4bEsJDxn-J23008=](/blobs/GSOYZf-LcT3jg-Vz5Elybux8SUOJ4bEsJDxn-J23008=)\n\n\n[Narrato](https://narrato.io/) is an AI-powered content workspace that lets you manage your entire content creation process in one place. At the core of Narrato is the powerful [AI content creation and planning assistant](https://narrato.io/workspace/features/ai-writer-tool)that assists with AI content ideation ( topic /content ideas generator), AI content creation (for multiple use cases like blog posts, web and ad copy, emails, AI images and illustrations, video script outlines, product descriptions and many more), plus content planning and optimization.\n\n\n**Key features:**\n\n\n* **AI writing assistant with multiple use cases**: Helps generate content for blogs, emails, web copy, product descriptions, press releases, emails, video scripts, etc.\n\n\n* [**SEO content brief generator**](https://clickup.com/blog/seo-project-management/): Builds content briefs in under a minute, offering keyword suggestions, most often asked questions about topics, references, and content structuring suggestions\n\n\n## [**Outwrite**](https://www.outwrite.com/)\n\n\n\n![xqmtvvE7AsNj2QqjiZo7P8ATTI-DPVkYriO6Ho29bk8=](/blobs/xqmtvvE7AsNj2QqjiZo7P8ATTI-DPVkYriO6Ho29bk8=)\n\n\nWhile it’s not exactly a text-generating tool, but rather an [artificial intelligence-powered writing assistant](https://clickup.com/blog/writing-assistant-software/), Outwrite still makes a solid paid or free Speedwrite alternative for those interested in using machine learning to improve their writing.\n\n\n**Key features:**\n\n\n* **Support for English, French, and Spanish:** Outwrite offers multilingual support in English, French, and Spanish, catering to a diverse range of users worldwide.\n\n\n* **Readability and style insights and stats:** Users benefit from comprehensive readability and style insights and statistics, enhancing the quality and effectiveness of their writing.\n\n\n* **Paraphrasing tools available in this Speedwrite alternative:** With paraphrasing tools readily available, Outwrite stands out as a versatile alternative to Speedwrite, ensuring flexibility and creativity in content generation.\n\n\n## [**Anyword**](https://anyword.com/?fpr=roche93&gad_source=1&gclid=Cj0KCQjwztOwBhD7ARIsAPDKnkBoW1Hc_VA6uX7io-TZ-SNEPcQn8sto_WgAyNyv5CPA3fB7NNmjgzsaAveZEALw_wcB)\n\n\n\n![k9xHfMxUNVr83xAZDtpyegdSIFQdHngcPdEHZot7rEg=](/blobs/k9xHfMxUNVr83xAZDtpyegdSIFQdHngcPdEHZot7rEg=)\n\n\nAnyword is an AI essay rewriter software that integrates customer research using advanced algorithms to analyze preferences, feedback, and market data. Its advanced AI integration helps you create content that meets your audience’s needs and preferences.\n\n\n**Key features of Anyword:**\n\n\n* **Performance Prediction:** Predict the performance of your content with Anyword. Select only the high-performing variations before you go live. Get maximum engagement every time.\n\n\n* **Copy intelligence:** Instantly analyze every piece of content you've ever published, and uncover AI-Driven opportunities to improve performance and boost audience engagement on your website, ads, social, and email channels.\n\n\n* **Brand voice:** Manage your brand's messaging, tone, and target audience guidelines in one place. Ensure brand consistency in all content, no matter where it's created.\n\n\n## [**Zest**](https://www.zest.ai/)\n\n\n\n![e8tRMX8ZZyqAQTNM9euB31bQwG9srIR4C_mRF-I2spw=](/blobs/e8tRMX8ZZyqAQTNM9euB31bQwG9srIR4C_mRF-I2spw=)\n\n\n[Zest](https://www.zest.ai/) is a free Chrome plug-in designed specifically for content marketers. It helps content marketers create high-quality content by providing them with the best industry insights. The tool provides a feed of new marketing content to users based on the topics they have added to their preferences.\n\n\n**Key features:**\n\n\n* **Efficient Topic Search:** Zest enables users to swiftly search for specific topics, ensuring quick access to the information they need.\n\n\n* **User-Friendly Content Curation Dashboard:** With a purpose-designed, user-friendly dashboard, Zest empowers content marketers to effortlessly curate their own content, enhancing the efficiency of content curation processes.\n\n\n## [**AIContenfy**](https://aicontentfy.com/)\n\n\n\n![ZXBqu2_-9Wu2v39hMReSaIclKKmv86eJjiTgLOLetg8=](/blobs/ZXBqu2_-9Wu2v39hMReSaIclKKmv86eJjiTgLOLetg8=)\n\n\n[AIContenfy](https://aicontentfy.com/) uses advanced natural language processing (NLP) algorithms and machine learning (ML) models to generate content that is customized to a business's needs. The tool can create various types of content, including articles and blog posts. Users can specify their desired tone, style, and target audience, and the tool will generate content that matches these criteria.\n\n\n**Key features:**\n\n\n* **Efficient Scalability:** AIContenfy excels in generating content at scale, enabling businesses to produce large volumes quickly and allocate resources to other operational areas.\n\n\n* **Cost-Effective Content Creation:** The tool proves economical compared to hiring human writers, providing significant savings in content creation costs for businesses.\n\n\n* **Enhanced SEO Optimization:** AIContenfy enhances businesses' SEO efforts by generating content rich in relevant keywords and phrases, leading to improved visibility and higher rankings on search engine results pages (SERPs).\n\n\n# **Which option suits you the best?**\n\n\nAI paragraph generators are indispensable tools for writers, marketers, and content creators. These ten free AI tools, including AFFiNE, ChatGPT, Jasper, Copy.ai, ClickUp, Narrato, Lately, and Zest, offer unique features and benefits that can help overcome writer’s block, boost productivity, and generate high-quality content.\n\n\nWhen selecting a paragraph generator, consider factors such as readability, reliability, and price to ensure you choose the best tool for your needs. Embrace the power of AI to enhance your writing process and achieve your content creation goals more efficiently.\n\n\n**Stay tuned as AFFiNE unveils its upcoming AI functionality – for more details, click the [ProductHunt](https://www.producthunt.com/posts/affine-ai).**\n\n\nFollow our journey on our social media platforms and become a part of our growing community. Embark on this adventure with us through our media channels.\n\n\n* Official Website: [https://affine.pro/](https://affine.pro/)\n\n\n* GitHub: [https://github.com/toeverything/AFFiNE](https://github.com/toeverything/AFFiNE)\n\n\n* Discord: [https://discord.gg/Arn7TqJBvG](https://discord.gg/Arn7TqJBvG)\n\n\n* Twitter: [https://twitter.com/AffineOfficial](https://twitter.com/AffineOfficial)\n\n\n\n\n\n\n\n\n\n\n\n\n\n\n",
  "publish": true
}