{
  "title": "Top 8 Free Kanban Board Templates/Examples to Boost Work Efficiency [Including Excel, ClickUp and Teamhood]",
  "authors": [
    "Xuan Pang"
  ],
  "tags": [
    "Content"
  ],
  "description": "Enhance your workflow with our curated selection of top-notch, free Kanban board templates/examples. Streamline tasks and supercharge productivity effortlessly. Explore the ultimate tools for seamless project management and efficiency.",
  "created": 1706659200000,
  "updated": 1706659200000,
  "layout": "blog",
  "id": "ZBY5Ldw4xb3bdrPrPLUy9",
  "slug": "free-kanban-board-templates-examples-boost-work-efficiency",
  "cover": "/blobs/4-2phkUDrjjlqAsmjJPRtCHdlqqGa4aVje_Gd7T27aY=",
  "md": "---\n\n\ntitle: \"Top 8 Free Kanban Board Templates/Examples to Boost Work Efficiency [Including Excel, ClickUp and Teamhood]\"\n\n\nauthor: \"Xuan Pang\"\n\n\ntags: Content\n\n\nslug: free-kanban-board-templates-examples-boost-work-efficiency\n\n\ndescription: \"Enhance your workflow with our curated selection of top-notch, free Kanban board templates/examples. Streamline tasks and supercharge productivity effortlessly. Explore the ultimate tools for seamless project management and efficiency.\"\n\n\ncreated: 2024-01-31\n\n\nupdated: 2024-01-31\n\n\nlayout: blog\n\n\npublish: true\n---\n\n\n\n![4-2phkUDrjjlqAsmjJPRtCHdlqqGa4aVje_Gd7T27aY=](/blobs/4-2phkUDrjjlqAsmjJPRtCHdlqqGa4aVje_Gd7T27aY=)\n\n\n**Have you ever harnessed the power of Kanban to streamline your study and work processes?**\n\n\n**Have you faced challenges while utilizing this tool?**\n\n\n**Are you frustrated with the search for suitable Kanban templates and examples?**\n\n\n\n\n\nIn this article, let's delve into the capabilities of Kanban, a user-friendly methodology that effortlessly injects agility and simplicity into task management. Constructing a Kanban board with a dedicated template is a straightforward task, requiring just a few clicks.\n\n\nEmbark on a journey to discover the transformative influence of the Kanban board template. Join us as we explore how it can significantly elevate productivity and fine-tune your workflows.\n\n\n# What are Kanban board templates?\n\n\n\n![Frb1zKdyEKDVlzJDigGOBzPkVuluwIXsXDV4nEWcNjM=](/blobs/Frb1zKdyEKDVlzJDigGOBzPkVuluwIXsXDV4nEWcNjM=)\n\n\n[Kanban board](https://affine.pro/blog/10-top-best-free-kanban-board-software-apps-2023) templates are pre-designed frameworks that facilitate the implementation of the Kanban methodology for effective workflow management. These templates are structured visual boards that help individuals and teams organize tasks, track progress, and enhance collaboration in a streamlined manner.\n\n\nTypically, a Kanban board template consists of columns representing different stages of a process, such as \"To Do,\" \"In Progress,\" and \"Done.\" Tasks or cards are moved across these columns as they progress through the workflow. The visual nature of Kanban boards provides a clear and easily understandable overview of work status, making it easier for team members to coordinate efforts and prioritize tasks.\n\n\nThese templates can be customized to suit specific [workflows](https://affine.pro/blog/best-free-task-management-software-streamline-workflow) and preferences, allowing users to adapt them to their unique requirements. By leveraging Kanban board templates, individuals and teams can optimize their work processes, improve efficiency, and achieve better visibility into the status of ongoing tasks and projects.\n\n\n# Why use Kanban board templates?\n\n\n\n![u0RnmHWmXVAYElvyHdL2Kg-Mc6jtT9GBM4UUwVD3H6k=](/blobs/u0RnmHWmXVAYElvyHdL2Kg-Mc6jtT9GBM4UUwVD3H6k=)\n\n\n1. **Streamlined Workflow:** Kanban board templates provide a structured framework that simplifies the organization of tasks. The visual representation of work stages allows for a clear understanding of the workflow, making it easier to manage and track progress efficiently.\n\n\n1. **Time-Saving:** Utilizing Kanban board templates eliminates the need to create a board from scratch. With predefined layouts, columns, and categories, users can set up their Kanban board swiftly, saving valuable time that can be redirected towards actual task management and productivity.\n\n\n1. **Consistency and Standardization:** Kanban board templates offer a consistent structure for task management. This standardization ensures that team members follow a uniform approach to organizing and tracking tasks, promoting clarity, and reducing confusion within the team.\n\n\n1. **Enhanced Collaboration:** The visual nature of Kanban boards, especially when using templates, fosters better collaboration among team members. With a shared and easily comprehensible board, everyone gains a quick overview of ongoing tasks, making it simpler to coordinate efforts, share updates, and maintain alignment within the team.\n\n\n# What are some examples of Kanban board templates?\n\n\n### 1. Project-tracking Kanban by [AFFiNE](https://www.affine.pro)\n\n\n\n![dMEbtvsqnrhNNCHO7NEACnqKXDY_iICMXlKhR-MeK5w=](/blobs/dMEbtvsqnrhNNCHO7NEACnqKXDY_iICMXlKhR-MeK5w=)\n\n\nThe dynamic nature of project progress demands an agile methodology. The [Project-Tracking Kanban](https://affine.pro/blog/10-top-best-free-kanban-board-software-apps-2023) template is tailored for this, equally empowering **startup teams hungry for growth** and solo entrepreneurs navigating the waters of their business ventures. It's an agile coach for **developing teams** and a personal productivity booster for **freelancers**.\n\n\n[Get this template now >>>](https://app.affine.pro)\n\n\n### 2. Issue Tracker by [AFFiNE](https://www.affine.pro)\n\n\n\n![YoJuH0b3xcX1L-dC6byKrzev5rd8sANPYZj4Pr9ZgHw=](/blobs/YoJuH0b3xcX1L-dC6byKrzev5rd8sANPYZj4Pr9ZgHw=)\n\n\nAn [Issue Tracker](https://affine.pro/blog/8-free-project-tracker-templates-work-management-2023) Kanban board is a powerful tool used in project management to visualize and streamline the resolution of issues and tasks within a team. The board typically consists of columns representing different stages of the issue resolution process.\n\n\n### 3. Action Plan by [AFFiNE](https://www.affine.pro)\n\n\n\n![ghdg_sJ1z9goTs39rJ4sfDsiZK9zIEcx9iD3yjB06U0=](/blobs/ghdg_sJ1z9goTs39rJ4sfDsiZK9zIEcx9iD3yjB06U0=)\n\n\nAn [Action Plan](https://affine.pro/blog/marketing-action-plan) Kanban board is a valuable tool for managing and visualizing the progress of action items or tasks within a specific plan or project. It helps teams organize, prioritize, and track the status of various actions needed to achieve specific goals.\n\n\n### 4. Team Requests Kanban Board by [AFFiNE](https://www.affine.pro)\n\n\n\n![GoIuQUgI4KUvj5ITHmYPaIsQkw6aceam-Wm7MLDi4GY=](/blobs/GoIuQUgI4KUvj5ITHmYPaIsQkw6aceam-Wm7MLDi4GY=)\n\n\nA Team Requests Kanban board is a practical tool for managing and visualizing various requests made to a team, such as service requests, support tickets, or internal team requests. It helps in organizing, prioritizing, and tracking the status of requests to ensure timely and effective resolution.\n\n\n### 5. Kanban Roadmap Template by [ClickUp](https://clickup.com/)\n\n\n\n![Lxp5D_pb7x1B0VY3dyK3zLfaz2cVgGq9p8QBx3SskF4=](/blobs/Lxp5D_pb7x1B0VY3dyK3zLfaz2cVgGq9p8QBx3SskF4=)\n\n\nA Kanban Roadmap is a visualization that outlines the strategic plan and milestones for a project or team using Kanban principles. It provides a high-level overview of upcoming initiatives, key deliverables, and the anticipated timeline.\n\n\n###  **6.** Kanban Cumulative Flow Template for [Excel](https://www.microsoft.com/en-us/microsoft-365/excel)\n\n\n\n![WUj38GJfCFeZRgRoIOoh2crdWrjPHL1Srf-YOSOuCK0=](/blobs/WUj38GJfCFeZRgRoIOoh2crdWrjPHL1Srf-YOSOuCK0=)\n\n\nKanban Cumulative Flow is a visual representation that tracks the flow and status of work items over time within a Kanban system. It provides insights into the efficiency and bottlenecks of the workflow by displaying the cumulative number of tasks in different stages.\n\n\n### 7. Project Hub Kanban by [Notion](https://www.notion.so/product)\n\n\n\n![MNspddRetbllgD796EQVRTCPwTQzhQ5x-CI083Em-tI=](/blobs/MNspddRetbllgD796EQVRTCPwTQzhQ5x-CI083Em-tI=)\n\n\nA Project Hub Kanban is a centralized platform that utilizes Kanban principles to manage and visualize the progress of multiple projects within an organization. It serves as a command center where teams can track the status of various projects, allocate resources, and ensure efficient collaboration.\n\n\n### 8. Marketing and Sales Kanban by [Teamhood](https://teamhood.com/)\n\n\n\n![M0QHl2Q9_DsEJNs7SvpmBYVGFjy_jIG3ozz5aCVtFH8=](/blobs/M0QHl2Q9_DsEJNs7SvpmBYVGFjy_jIG3ozz5aCVtFH8=)\n\n\nA Marketing and Sales Kanban is a visual management tool that applies Kanban principles to streamline and optimize the workflow of marketing and sales teams. It helps teams coordinate efforts, visualize tasks, and enhance collaboration for effective lead generation and conversion.\n\n\n# Best Kanban App Recommendation: [AFFiNE](https://www.affine.pro)\n\n\n\n![rFblyTM87Ji6lT6fJskjQPcJ33A7sMeFTcWEGaTjxu8=](/blobs/rFblyTM87Ji6lT6fJskjQPcJ33A7sMeFTcWEGaTjxu8=)\n\n\n[AFFiNE](https://www.affine.pro)is a cutting-edge Kanban app that is designed to assist you in organizing, managing, and cooperating on tasks, projects, and information. What sets AFFiNE apart is that it is a free and [open-source](https://affine.pro/blog/tips-where-and-how-contribute-open-source-projects) program that employs offline technology to ensure that it is accessible to all users.\n\n\n\n\n\n<div style=\"text-align:center;\">\n\n\n<iframe width=\"560\" height=\"315\" src=\"https://www.youtube.com/embed/3cfeKOufZWU?si=IiXDIdwfnM2Z7KPL\" title=\"YouTube video player\" frameborder=\"0\" allow=\"accelerometer; autoplay; clipboard-write; encrypted-media; gyroscope; picture-in-picture; web-share\" allowfullscreen></iframe>\n\n\n</div>\n\n\n\n\n\n**Key features:**\n\n\n* **[Text-to-Kanban Conversion](https://affine.pro/blog/affine-080-launch-week-day3):** In the past, you were only able to convert blocks to table views. With our new Kanban feature, it's as simple as a single click to transform your blocks into a Kanban view. Now you can effortlessly start using AFFiNE as your ultimate to-do list manager.\n\n\n\n![wTNgyrpvo8nL6XojCwwuTwOz-z3_aeLNXj8ibcFxVYM=](/blobs/wTNgyrpvo8nL6XojCwwuTwOz-z3_aeLNXj8ibcFxVYM=)\n\n\n* **Unification of Kanban and Table Views:** Experience synchronization between Kanban and table views. Any changes made in the Kanban view will automatically reflect in the corresponding table view. Enjoy the convenience of two ways to manage your data seamlessly.\n\n\n\n![crjX5_HRaAu3feQ3mQMTVmg-FqXutYjATZJpEZEMi98=](/blobs/crjX5_HRaAu3feQ3mQMTVmg-FqXutYjATZJpEZEMi98=)\n\n\n* **[Collaborative Capabilities:](https://affine.pro/blog/affine-0-10-0-launch-week-day-5-5-stable-with-cloud-support-finally-available-to-every-pro-in-your-team)** For group work, the app should have collaborative features, making it easy to share and coordinate work with others in your group work. For more details, please go to latest launch week blog: [Introduction to AFFiNE's Cloud](https://affine.pro/blog/affine-0-10-0-launch-week-day-5-5-stable-with-cloud-support-finally-available-to-every-pro-in-your-team).\n\n\n  \n![71MN7zgKOg2C73idwSU66YEnVUK8x41Jqwwe2z9CiPU=](/blobs/71MN7zgKOg2C73idwSU66YEnVUK8x41Jqwwe2z9CiPU=)\n\n\n\n![knv3GLQpB1H8ce4w2ztMzCiGuUMPG0JRDZA49U3AgIw=](/blobs/knv3GLQpB1H8ce4w2ztMzCiGuUMPG0JRDZA49U3AgIw=)\n\n\n* **[Offline Accessibility](https://affine.pro/blog/5-best-offline-alternatives-to-notion):** The best kanban app should allow users to access their essential details offline. This feature is particularly valuable when going outside with limited internet connectivity.\n\n\n\n![7tLzErsXRl3O-9-0m62ySSd00VYnYYtRKFaZUFit2Jg=](/blobs/7tLzErsXRl3O-9-0m62ySSd00VYnYYtRKFaZUFit2Jg=)\n\n\nCurrently, **AFFiNE** has released its [stable version](https://affine.pro/download), but we are continuing to build to a more feature-rich and stable build. **Come and join us on our journey over on our media platforms.**\n\n\n* Official Website:[https://affine.pro/](https://affine.pro/)\n\n\n* GitHub:[https://github.com/toeverything/AFFiNE](https://github.com/toeverything/AFFiNE)\n\n\n* Twitter:[https://twitter.com/AffineOfficial](https://twitter.com/AffineOfficial)\n\n\n* Community：[https://community.affine.pro/home](https://community.affine.pro/home)\n\n\n* Discord:[https://discord.gg/Arn7TqJBvG](https://discord.gg/Arn7TqJBvG)\n\n\n* Telegram:[https://t.me/affineworkos](https://t.me/affineworkos)\n\n\n",
  "publish": true
}