{
  "title": "7 Free Lessons Learned Template for Project Management: Streamline Project Summaries and Reports",
  "authors": [
    "Yanxi Liu"
  ],
  "tags": [
    "Content"
  ],
  "description": "Maximize the effectiveness of your project management skills by using free lessons-learned templates.",
  "created": 1690156800000,
  "updated": 1690329600000,
  "layout": "blog",
  "id": "F3FRsZz8dK",
  "slug": "free-lessons-learned-templates-for-project-management",
  "cover": "/blobs/yzF-7gAV6GcMTHwXaQ6tUg5mU-UTZOhIxavD1WvmFk0=",
  "md": "---\n\n\ntitle: \"7 Free Lessons Learned Template for Project Management: Streamline Project Summaries and Reports\"\n\n\nauthor: \"Yanxi Liu\"\n\n\ntags: Content\n\n\nslug: free-lessons-learned-templates-for-project-management\n\n\ndescription: \"Maximize the effectiveness of your project management skills by using free lessons-learned templates.\"\n\n\ncreated: 2023-07-24\n\n\nupdated: 2023-07-26\n\n\nlayout: blog\n\n\npublish: true\n\n\n---\n\n\n\n![yzF-7gAV6GcMTHwXaQ6tUg5mU-UTZOhIxavD1WvmFk0=](/blobs/yzF-7gAV6GcMTHwXaQ6tUg5mU-UTZOhIxavD1WvmFk0=)\n\n\nHaving a well-defined lessons-learned plan is essential for companies to [effectively navigate](https://affine.pro/blog/top-5-google-docs-alternatives-pkm) the project evaluation process and provide guidance to their teams and stakeholders. Encompass project overview details, project-close acceptance, and official sign-off, the lesson-learned templates are ideal for project managers, product managers, project coordinators, moderators, project sponsors, and more.\n\n\nIn this article, we will spell out the benefits of using a lessons-learned template, explain what the lessons-learned process is, and shares the 7 Free Lessons-Learned Templates for [Project Management](https://affine.pro/blog/6-best-project-management-tools-boost-productivity-2023) interactive learned template to [streamline the workflow](https://affine.pro/blog/best-free-task-management-software-streamline-workflow).\n\n\n# What does Lessons Learned mean?\n\n\n\n![vlnUWG7jyUiuX9pblBpgv-Hx8c3AJuDpFxfSc4zvu94=](/blobs/vlnUWG7jyUiuX9pblBpgv-Hx8c3AJuDpFxfSc4zvu94=)\n\n\nLessons learned serve as a retrospective discussion that takes place after the completion of a project. Typically conducted as a meeting, it involves the project manager and key representatives from both the customer and contractor sides.\n\n\nAdditionally, if you have conducted lesson-learned projects with the entire project team, it will provide you with even more valuable insights. The template should be able to capture both quantitative and qualitative data and provide actionable recommendations for [road-mapping templates.](https://affine.pro/blog/5-best-free-tools-agile-roadmap-templates-2023)\n\n\n# Why Lessons Learned Templates are Essential for project management\n\n\nLessons learned are crucial because they provide valuable insights and enable continuous improvement. By analyzing past experiences, we can avoid making the same mistakes, seize opportunities, and enhance our workflow. They serve as a valuable source of knowledge, enabling informed decision-making and improving project outcomes. Sharing lessons learned fosters collaboration and a culture of learning, leading to innovation and success in future endeavors.Benefits of Using a Lessons Learned Template\n\n\n* Standardize: Utilizing a lessons-learned template enables the standardization of capturing and organizing insights, ensuring no valuable information is overlooked or lost.\n\n\n* Improve Efficiency: The template streamlines the process of documenting lessons learned, saving time and effort by providing predefined sections and prompts that guide the capturing of relevant details.\n\n\n* Preserve Knowledge: By systematically recording valuable insights, best practices, and solutions, making them easily accessible for future reference and learning.\n\n\n* Foster Continuous Improvement: Accepting a lessons-learned template, teams are encouraged to reflect on their experiences, identify areas for enhancement, and implement strategies to avoid similar pitfalls in future projects, fostering a culture of continuous improvement.\n\n\n# What are the lessons learned process?\n\n\n\n![8qvfqyS73-WM4H8L7pugRI3h5jDMiBcJEDz0wq7iJuo=](/blobs/8qvfqyS73-WM4H8L7pugRI3h5jDMiBcJEDz0wq7iJuo=)\n\n\n* Step 1: Identify Lessons Learned\n\n\n* Step 2: Document Lessons Learned\n\n\n* Step 3: Analyze lessons learned\n\n\n* Step 4: Store lessons learned\n\n\n* Step 5: Retrieve lessons learned\n\n\n# **7 Lessons-Learned Templates to Plan for Future Project Management Success**\n\n\nNow, let's start on a transformative journey towards project management excellence and unlock unparalleled productivity with the guidance of 7 meticulously crafted lessons-learned templates offered by **AFFiNE, Clickup, Monday, and Smartsheet**.\n\n\n## AFFiNE Project Management Lessons Learned Template\n\n\n\n![CtykHF8Xio87rLxtUUbqOvxlPaIQP8UHuj8DGs86MpE=](/blobs/CtykHF8Xio87rLxtUUbqOvxlPaIQP8UHuj8DGs86MpE=)\n\n\nAFFiNE Project Management Lessons Learned Template is tailored to suit your project's needs and acts as a versatile project evaluation tool. Within it, you'll discover sections dedicated to project overview planning, priorities, responsible people, and future post-project tasks to consider.\n\n\n## AFFiNE Project Lessons Learned Meeting Agenda Template\n\n\n\n![aZU1oM8Zlv_z8kBjaW7S2aU1RWOuVdZai8SynPtf3Ss=](/blobs/aZU1oM8Zlv_z8kBjaW7S2aU1RWOuVdZai8SynPtf3Ss=)\n\n\nMaintain momentum in your post-project analysis by utilizing this agenda template for project lessons learned meetings. This template provides dedicated sections for setting meeting objectives, [making clear timelines](https://affine.pro/blog/how-to-create-timeline-template-google-docs-step-by-step-guide), capturing team discussion notes, documenting action items for future projects, and wrapping up the session. Irrespective of your industry, this project lessons learned agenda template serves as an exceptional resource for conducting efficient and comprehensive meetings to analyze completed projects.\n\n\n## AFFiNE Project Lessons Learned Checklist Template\n\n\n\n![2AiT6J8BpfjQxxAsFMr-w0cQ3tfqg6vgVO-8ezLI8aU=](/blobs/2AiT6J8BpfjQxxAsFMr-w0cQ3tfqg6vgVO-8ezLI8aU=)\n\n\nThis checklist template facilitates successful post-project analysis. It guides you to schedule a meeting, gather feedback, discuss objectives, compare results, and assign actionable items for future improvement.\n\n\n### AFFiNE **Project Management Review Template**\n\n\n\n![6gnRNda5irAlEByHyz47umlbEiTmuaVT2Ds-1Z4qnlA=](/blobs/6gnRNda5irAlEByHyz47umlbEiTmuaVT2Ds-1Z4qnlA=)\n\n\nThe AFFiNE Project Management Review Template is a perfect template for determining whether a project is worth continuing or not.\n\n\nAdditionally, it offers insights into whether the project is producing the expected results for the organization and gives your business an excellent chance to get feedback on the course and success of a project.\n\n\n## **Project Retrospective Template by ClickUp**\n\n\n\n![3ANceCi8ysPQlzUlAqBYt0UTwaMLJMbqgOKsWDfs_vQ=](/blobs/3ANceCi8ysPQlzUlAqBYt0UTwaMLJMbqgOKsWDfs_vQ=)\n\n\nThe ClickUp Project Retrospective Template is a procedure for evaluating whether a project was a success or a failure and determining what can be done in the future to prevent losses. The benefits of using this template include identifying what went well, what could be improved, and ensuring that future projects are better managed.\n\n\n\n![XQj-ySoANRZFizsVo79AsuuqJzifMjvEfPitrt5_j8Y=](/blobs/XQj-ySoANRZFizsVo79AsuuqJzifMjvEfPitrt5_j8Y=)\n\n\nBy using a collect feedback template, you can create a custom-made, shareable form to solicit feedback from your team quickly. Simply send the link to your form, and voila! Each response will populate directly onto the respective board for you to analyze.\n\n\n## Project Lessons Learned Report Example by Smartsheet\n\n\n\n![NyXEyUvj7NhYrkmF1J0H718J0GD-jb86GDBzqBo-BmQ=](/blobs/NyXEyUvj7NhYrkmF1J0H718J0GD-jb86GDBzqBo-BmQ=)\n\n\n# Extend Your Project Management Expertise with AFFiNE\n\n\nIn this article, we have offered you the 7 free lessons-learned templates by [AFFiNE](https://affine.pro/), Clickup, Monday, and Smartsheet. We encourage users to choose the ideal option based on their needs and pain points. However, based on our evaluation, we still propose **AFFiNE as the optimal choice** for creating the lessons-learned templates. Not merely because it provides people with much more flexibility, collaboration, visual representation, customization, and reusability in creating lessons-learned templates but also for its uniqueness as a **free, open-source** tool that **prioritizes privacy**, making it accessible to anyone who wants to enhance their productivity and [better plan for their project](https://affine.pro/blog/free-event-planning-templates-for-professsional-2023).\n\n\n<div style=\"text-align:center;\">\n<iframe width=\"560\" height=\"315\" src=\"https://www.youtube.com/embed/WqOe9HgpsDY?si=PHGuSeRbOT9GxuPO\" title=\"YouTube video player\" frameborder=\"0\" allow=\"accelerometer; autoplay; clipboard-write; encrypted-media; gyroscope; picture-in-picture; web-share\" allowfullscreen></iframe>\n</div>\n\n\nFrom simple task management and project planning to complex resource and portfolio management, AFFiNE helps you improve collaboration and increase work velocity -- empowering you to get more done. More importantly, with AFFiNE, you will experience **writing, drawing, and planning** all at once. Capturing, managing, and reporting on work from anywhere and anytime helps your team be more effective and get more done.\n\n\nIf you want to find out more about AFFiNE, please refer to these links:\n\n\n* Official Website: [https://affine.pro/](https://affine.pro/)\n\n\n* GitHub: [https://github.com/toeverything/AFFiNE](https://github.com/toeverything/AFFiNE)\n\n\n* Discord: [https://discord.gg/Arn7TqJBvG](https://discord.gg/Arn7TqJBvG)\n\n\n* Twitter: [https://twitter.com/AffineOfficial](https://twitter.com/AffineOfficial)\n\n\n",
  "publish": true
}