{
  "title": "Top 10 Travel Itinerary Planner Templates in Google Docs, Word and Excel｜AFFiNE",
  "authors": [
    "Yiyang Zhang"
  ],
  "tags": [
    "Content"
  ],
  "description": "Unenvil the charm of travel itinerary template for your trip. Discover some free best templates to streamline your workflow and save time in 2024.",
  "created": 1693872000000,
  "updated": null,
  "layout": "blog",
  "id": "yLrXXM-HIk",
  "slug": "free-customized-travel-itinerary-planner-templates",
  "cover": "/blobs/16dUl3oXSx-beJUMvTp3Pdtn7wkDce86h75Ezo803CY=",
  "md": "---\n\n\ntitle: \"Top 10 Travel Itinerary Planner Templates in Google Docs, Word and Excel｜AFFiNE\"\n\n\nauthor: Yiyang Zhang\n\n\ntags: Content\n\n\nslug: free-customized-travel-itinerary-planner-templates\n\n\ndescription: \"Unenvil the charm of travel itinerary template for your trip. Discover some free best templates to streamline your workflow and save time in 2024.\"\n\n\ncreated: 2023-09-05\n\n\nupdated: 2024-0-05\n\n\nlayout: blog\n\n\npublish: true\n\n\n---\n\n\n\n![16dUl3oXSx-beJUMvTp3Pdtn7wkDce86h75Ezo803CY=](/blobs/16dUl3oXSx-beJUMvTp3Pdtn7wkDce86h75Ezo803CY=)\n\n\n\n\n\nPlanning a trip can be exciting, but it can also feel overwhelming. From deciding on the destination to booking accommodations and creating an itinerary, there are so many details to consider. That's where a travel itinerary planner comes in handy.\n\n\nA travel itinerary planner is like your personal assistant that helps you organize all the important information for your trip in one place. And the best part? We've got you covered with free travel itinerary templates in Google Docs, Word and Excel! So let's dive into what makes a powerful travel itinerary planner template and explore some of our top picks.\n\n\n## What is a Travel Itinerary Template?\n\n\nA travel itinerary template can help you organize all the details of your upcoming trip. It's like having a digital assistant who helps to make sure every aspect of your journey is well planned. Moreover, travel planners often turn to pre-made itinerary templates that give you everything you need for every type of trip.\n\n\nUsing a travel itinerary planner, you can easily enter all the details for each trip day. This includes the time and location of activities or attractions you want to see, as well as any reservations and tickets you may have. You will be able to see the day ahead clearly if you have everything organized in one place.\n\n\n## What should a Powerful Travel Itinerary Planner Template Include?\n\n\nWhether it's a family vacation or a business trip, a travel planning process should be comprehensive and oraganzied, helping you stay on top of all your travel arrangements. The itinerary should include flight information,accomodation details,transportation options,sightseeing options, and important contact information.\n\n\n\n\n\n\n![AnoMYc0Yig0G60XYlQsTNZdJs-7tvE87j1u6Ux8h-uc=](/blobs/AnoMYc0Yig0G60XYlQsTNZdJs-7tvE87j1u6Ux8h-uc=)\n\n\n* Flight details. These include the airline name, flight number, departure time, and arrival time. This will help you keep track of your schedule and ensure that you don't miss any flights.\n\n\n* Accommodation information. This can include the name and address of each hotel or car rental property you'll be staying at during your trip.\n\n\n* Transportation. Make sure your template includes a section where you can outline how you'll be getting around at each destination.\n\n\n* Sightseeing activities. Include space in your template to list down all the attractions and landmarks you want to visit at each location along with their opening hours and admission fees if applicable.\n\n\n* Emergency contact. This section is where you can jot down important phone numbers such as local emergency services or contacts for friends.\n\n\nBy incorporating these elements into your travel itinerary planner template, you'll have all the necessary information at hand for stress-free travels!\n\n\n## 10 Travel Itinerary Planner Templates\n\n\nPlanning a trip can be both exciting and overwhelming. It can be difficult to decide which destination to choose, which accommodations to book, and what activities to do. The itinerary templates provide a structure for organizing your travel details, ensuring that nothing is overlooked.\n\n\n### 1.**Basic Travel Itinerary Planner Template**\n\n\n\n![WhRQ8ZVb3IOgVKnZK2sjbgGHaO8ALtiS8eAVQb1bDeE=](/blobs/WhRQ8ZVb3IOgVKnZK2sjbgGHaO8ALtiS8eAVQb1bDeE=)\n\n\n\n![B7r199Cr2M5REq8pWoc_Nl_ca4xO2xNtH9IJgVsIYDI=](/blobs/B7r199Cr2M5REq8pWoc_Nl_ca4xO2xNtH9IJgVsIYDI=)\n\n\nUtilize AFFiNE free travel itinerary planner template to organize and plan your perfect vacation. Use AFFiNE template to keep track of your itinerary, travel planning, and trip budget all in one place. With this trip planning template, you can easily organize your travel details, flight times, airline information, and much more.\n\n\n### 2.**Business Travel Itinerary Planner Template**\n\n\n\n![Ap7SuE6saOpeoTwqz_w2Thl36iScTDSL_E-F_pUGy28=](/blobs/Ap7SuE6saOpeoTwqz_w2Thl36iScTDSL_E-F_pUGy28=)\n\n\nThese free itinerary templates will help you plan your travels and maximize your time and expenses. Feel free to modify the template to suit any type of business travel. It contains basic information about the destination, the date and time of arrival, the places to visit, the estimated cost and many more. This information can be changed or expanded if you wish.\n\n\n### 3.**Microsoft Excel Travel Expense Itinerary Planner Template**\n\n\n\n![JTfLFbR4poPV_G7TVzpKtx3Q-d2iS6PC2dBZALqeLEE=](/blobs/JTfLFbR4poPV_G7TVzpKtx3Q-d2iS6PC2dBZALqeLEE=)\n\n\nWith [Microsoft Excel](https://www.microsoft365.com/) travel itinerary planner template, you can track travel expenses for reimbursement or taxes. It totals spending by subcategories and grand total.\n\n\n### 4.**Google Sheets Travel  Itinerary  Template Free**\n\n\n\n![66rV2OKSwd0nZPWEcBE8Sw2rA0LqX4Uuqiw-xyvp_8E=](/blobs/66rV2OKSwd0nZPWEcBE8Sw2rA0LqX4Uuqiw-xyvp_8E=)\n\n\n[Google Sheets](https://workspace.google.com/products/sheets/) cute travel itinerary template is for people who once dreamed of travelling, beautiful and captivating the soul. This cute template will help you organize all the trip details in a fun and visually appealing way. You'll love how cute this template is and how easy to use it is!\n\n\n### 5.**ClickUp Business Travel Itinerary Planner Template**\n\n\n\n![GWGaasPdufLklJdUEBSI470gwsqPMhW4jM-foFORpsI=](/blobs/GWGaasPdufLklJdUEBSI470gwsqPMhW4jM-foFORpsI=)\n\n\nClickUp business travel itinerary template makes it easy to keep track of all your important travel information and work schedules. In an organized and easy-to-follow format, you can easily note your travel dates, hotel information, flight information, and other important information.\n\n\n### 6.**Canva Modern Travel Itinerary Planner Template**\n\n\n\n![y8qKWnkM_S3w3TDMMtebOlvUWLJO8yxZw7Fk7dK6g48=](/blobs/y8qKWnkM_S3w3TDMMtebOlvUWLJO8yxZw7Fk7dK6g48=)\n\n\nWith Canva's customized modern travel itinerary templates, you can keep track of your schedules, projects, or vacations. Using professionally designed templates, you can easily create schedules, timelines, and itineraries for business trips, travel, and other projects. Also, you can customize planners based on your needs by dragging and dropping graphic elements like logos, icons, stickers, and illustrations.\n\n\n### 7.**Via Travelers Printable Travel Planner Template**\n\n\n\n![QRDTLJbvQN9V8FGoavvcQGaI1Qs-H-tvJI1IMhx321w=](/blobs/QRDTLJbvQN9V8FGoavvcQGaI1Qs-H-tvJI1IMhx321w=)\n\n\nVia Travelers travel itinerary templates include everything you need to pack for your next trip, no matter where you are going. Via Travelers free printable vacation itinerary template is also easy to print and ready to go for your next trip. Of course, some people prefer to start from scratch and would rather make a list for themselves – we understand.\n\n\n### 8.**Jotform Business Travel Itinerary Planner Template**\n\n\n\n![nitCKPyI8yuyNKdhzJBnTBLiF7WX27lCSS1zfpbbHW8=](/blobs/nitCKPyI8yuyNKdhzJBnTBLiF7WX27lCSS1zfpbbHW8=)\n\n\nWith Jotform business itinerary template, you'll find flight, transportation, and lodging information, as well as scheduled activities. With Jotform's PDF Editor, you can reorganize the template, add form fields, schedule meetings, and even plan extra sightseeing time.\n\n\n### 9.**Notion Travel Itinerary Planner Template**\n\n\n\n![AiTSfLN32eytf0qLCag2IvMlYfMk-sUOXxzjGdUgW_4=](/blobs/AiTSfLN32eytf0qLCag2IvMlYfMk-sUOXxzjGdUgW_4=)\n\n\nIn Notion's travel itinerary planner template, you can organize all of the necessary details about your trip in one place, such as addresses, contact information, documents (like tickets attached as files), and notes. There are a variety of documents and information scattered across email, files, websites, and more when it comes to travel planning.\n\n\n### 10.**Onplanners Travel Itinerary Planner Template**\n\n\n\n![SAeXvn4fBd4_6ktDi1QlJAeX9e2NmhlLB3yWmX1y1UU=](/blobs/SAeXvn4fBd4_6ktDi1QlJAeX9e2NmhlLB3yWmX1y1UU=)\n\n\nOnplanners simple travel itinerary template makes your next travel preparation an absolute breeze, which helps you create the perfect itinerary. Make your travel experience smooth and enjoyable with this road trip itinerary template or business travel itinerary template.\n\n\n## Set about Planning Your Next Trip with AFFiNE\n\n\nNow that you have a clear understanding of what a travel itinerary planner is and what it should include, it's time to put your planning skills into action. And there's no better way to do that than by using the free customized travel itinerary planner templates provided by [**AFFiNE**](https://affine.pro/).\n\n\nRemember: A well-planned itinerary is not only essential for maximizing your time but also for reducing stress during your journey. With **AFFiNE** by your side, every step of the way will be smooth sailing!\n\n\n\n![o7LQRbUwYfnNmBFLgNwkmK0c5fcLOepmeRh7iN4Gcwk=](/blobs/o7LQRbUwYfnNmBFLgNwkmK0c5fcLOepmeRh7iN4Gcwk=)\n\n\nKey Features of AFFiNE's [**Kanban**](https://affine.pro/blog/affine-080-launch-week-day3):\n\n\n* **Text-to-Kanban Conversion**: With a single click, convert your blocks into a Kanban view in AFFiNE. Seamlessly transition to an intuitive task management layout, simplifying your to-do list management.\n\n\n\n![wTNgyrpvo8nL6XojCwwuTwOz-z3_aeLNXj8ibcFxVYM=](/blobs/wTNgyrpvo8nL6XojCwwuTwOz-z3_aeLNXj8ibcFxVYM=)\n\n\n* **Unification of Kanban and Table Views**: Enjoy synchronized updates between Kanban and table views. Modifications in the Kanban layout are automatically mirrored in the corresponding table view, offering dual data management options for seamless convenience.\n\n\n\n![crjX5_HRaAu3feQ3mQMTVmg-FqXutYjATZJpEZEMi98=](/blobs/crjX5_HRaAu3feQ3mQMTVmg-FqXutYjATZJpEZEMi98=)\n\n\n* **Intuitive Drag-and-Drop Sorting**: Require a change in sequence? It's effortless – just use drag-and-drop to place items where you want. Enjoy the freedom to move complete columns or individual Kanban cards effortlessly to your desired positions.\n\n\n\n![zwXUytnIiLZIAPLE1ujUVUFmHqngYjhG1Y0eaIXSS4g=](/blobs/zwXUytnIiLZIAPLE1ujUVUFmHqngYjhG1Y0eaIXSS4g=)\n\n\nSo why waste time trying to create a travel itinerary from scratch when AFFiNE can do it for you? Take advantage of their free customized templates today and start planning the trip of a lifetime! Don't let another opportunity slip away – set about planning your next trip with confidence using AFFINE's powerful yet easy-to-use travel itinerary planner templates. Happy travels!\n\n\n<div style=\"text-align:center;\">\n<iframe width=\"560\" height=\"315\" src=\"https://www.youtube.com/embed/WqOe9HgpsDY?si=PHGuSeRbOT9GxuPO\" title=\"YouTube video player\" frameborder=\"0\" allow=\"accelerometer; autoplay; clipboard-write; encrypted-media; gyroscope; picture-in-picture; web-share\" allowfullscreen></iframe>\n</div>\n\n\nCurrently, AFFiNE has released its stable version, but we are continuing to build to a more feature-rich and stable build. Come and join us on our journey over on our media platforms.\n\n\n* Official Website: [https://affine.pro/](https://affine.pro/)\n\n\n* GitHub: [https://github.com/toeverything/AFFiNE](https://github.com/toeverything/AFFiNE)\n\n\n* Discord: [https://discord.gg/Arn7TqJBvG](https://discord.gg/Arn7TqJBvG)\n\n\n* Twitter: [https://twitter.com/AffineOfficial](https://twitter.com/AffineOfficial)\n\n\n\n\n\n",
  "publish": true
}