{
  "title": "Top Free 8 Content Calendar Templates/Tools for Social Media & Blogs",
  "authors": [
    "Xuan Pang"
  ],
  "tags": [
    "Content"
  ],
  "description": "Discover the best free content calendar templates and tools for social media and blog planning. Streamline your content strategy with these top 8 templates/tools, ranging from ClickUp to AFFiNE, ensuring organized and effective content scheduling.",
  "created": 1707091200000,
  "updated": 1707091200000,
  "layout": "blog",
  "id": "M9n7kljLQwcHmcubmnQMX",
  "slug": "free-content-calendar-templates-social-media-blogs",
  "cover": "/blobs/JEmUd-oFfBFNWNPt3SONeNRClZ9WvZda_4BhyEhlJpM=",
  "md": "---\n\n\ntitle: \"Top Free 8 Content Calendar Templates/Tools for Social Media & Blogs\"\n\n\nauthor: \"Xuan Pang\"\n\n\ntags: Content\n\n\nslug: free-content-calendar-templates-social-media-blogs\n\n\ndescription: \"Discover the best free content calendar templates and tools for social media and blog planning. Streamline your content strategy with these top 8 templates/tools, ranging from ClickUp to AFFiNE, ensuring organized and effective content scheduling.\"\n\n\ncreated: 2024-02-05\n\n\nupdated: 2024-02-05\n\n\nlayout: blog\n\n\npublish: true\n\n\n---\n\n\n\n![JEmUd-oFfBFNWNPt3SONeNRClZ9WvZda_4BhyEhlJpM=](/blobs/JEmUd-oFfBFNWNPt3SONeNRClZ9WvZda_4BhyEhlJpM=)\n\n\nIn the dynamic realm of [digital marketing](https://affine.pro/blog/the-7-key-stages-marketing-sales-pipeline-visual-guide), effective content planning is the key to capturing audience attention and driving engagement. One invaluable tool in achieving this is the content calendar template.\n\n\nIn this guide, we'll delve into the significance of content calendar templates and explore the top 8 free templates/tools, including ClickUp, [AFFiNE](https://www.affine.pro) etc., to enhance your social media and blog planning.\n\n\n## **What is a Content Calendar Template?**\n\n\n\n![HSfq1-Z76WyAP_ca3_UNYn1ledk6ENRYpJ0gcoSBPB4=](/blobs/HSfq1-Z76WyAP_ca3_UNYn1ledk6ENRYpJ0gcoSBPB4=)\n\n\nA content calendar template is a strategic tool designed to bring order to the chaos of content creation and distribution. It serves as a [visual roadmap](https://affine.pro/blog/5-best-free-tools-agile-roadmap-templates-2023), providing a structured overview of when and where your content will be published. Think of it as a blueprint for your content strategy, ensuring that your efforts are cohesive, consistent, and aligned with your marketing objectives.\n\n\n## **Why Should You Use a Content Calendar?**\n\n\n\n![OvZ2zp4HxKd52MQnjJF_8wbmFvI4zRXbDpq4-aRMNqw=](/blobs/OvZ2zp4HxKd52MQnjJF_8wbmFvI4zRXbDpq4-aRMNqw=)\n\n\nExperienced marketers understand the importance of strategic posting over impulsive actions. While enhanced planning is a primary benefit, the advantages of a content calendar extend beyond mere planning.\n\n\n* **Improved [Organization](https://affine.pro/blog/navigating-organizational-strategies-a-path-to-project-success):** Employing a content calendar template reduces the chaos associated with last-minute content creation. Instead, it facilitates meticulous planning well in advance, allowing for heightened organization and increased productivity, even when planning several months ahead.\n\n\n* **Enhanced Customization:** A sound strategy involves tailoring posts for different platforms, steering away from generic messages. [Content calendar templates](https://affine.pro/blog/free-8-printable-customizable-monthly-calendar-templates-examples) simplify the process of planning specific posts for various social media platforms, fostering better customization and platform-specific engagement.\n\n\n* **Efficient Tracking:** Content calendars offer a comprehensive view of your posting history. This not only allows for easy tracking but also provides a quick overview of your content landscape. This clarity makes it significantly easier to assess and analyze your [marketing](https://affine.pro/blog/marketing-action-plan) efforts accurately.\n\n\n# **8 Free and Best Content Calendar Templates/Tools**\n\n\n#### 1. Social Media Content Calendar Template by [AFFiNE](https://www.affine.pro)\n\n\n\n![g69qeyfWg_3aSDHG9JFKXRzHxpXg_Yt1zTLh9jOgBdk=](/blobs/g69qeyfWg_3aSDHG9JFKXRzHxpXg_Yt1zTLh9jOgBdk=)\n\n\nThe [Social Media](https://affine.pro/blog/how-to-introduce-new-business-social-media-strategic-steps-examples) Content Calendar Template by [AFFiNE](https://www.affine.pro) is like your personal assistant for managing your social media game. It's a pre-designed framework that helps you plan out what to post, when, and where across your social platforms. This template simplifies the whole process, making it easy to stay organized, keep track of your content, and ensure that you're sharing the right stuff at the right times. It's your secret weapon for a more strategic and efficient social media presence.\n\n\n[>>> Get this template now](https://app.affine.pro)\n\n\n####  2. [Hootsuite](https://influencermarketinghub.com/hootsuite/)\n\n\n\n![RFWVsss5beEl-O209uPYCvEBe-Lw56Cquuqi1mcf_Y8=](/blobs/RFWVsss5beEl-O209uPYCvEBe-Lw56Cquuqi1mcf_Y8=)\n\n\nHootsuite stands out as a [top social media management tools](https://influencermarketinghub.com/free-social-media-management-tools/), boasting a range of powerful features. While it's versatile for overall social media management, it particularly excels in assisting with content-related tasks. Offering automated publishing, content management, keyword filtering, multi-account management, post scheduling, and collaborative capabilities, Hootsuite is an all-in-one solution.\n\n\n####  **3.** [Adobe Express Content Scheduler (Previously ContentCal)](https://influencermarketinghub.com/contentcal/)\n\n\n\n![PmrMubMsRRPCb2yPByAoar0ETqtJXegERs0REtPsP1E=](/blobs/PmrMubMsRRPCb2yPByAoar0ETqtJXegERs0REtPsP1E=)\n\n\nAdobe Express stands out as a social media management platform, putting a strong emphasis on content [templates](https://www.contentcal.com/blog/free-marketing-plan-template/). When it comes to content scheduling, its calendar feature shines, offering a spacious layout that presents posts in a large format. This design ensures easy reading of captions and clear viewing of images.\n\n\nThe use of color-coding adds another layer of organization, allowing you to categorize different types of posts. Moreover, the calendar provides two rows for additional labeling - one for specifying the campaign and the other for jotting down notes for various team members. Notably, for small teams, Adobe Express proves to be one of the most cost-effective tools in the realm of social media management.\n\n\n####  **4.** [CoSchedule](https://influencermarketinghub.com/coschedule/)\n\n\n\n![35IDRy8HZvO0hrfcbiNQ3-ujLSqQoEOy0US8tDgbymc=](/blobs/35IDRy8HZvO0hrfcbiNQ3-ujLSqQoEOy0US8tDgbymc=)\n\n\nCoSchedule places its primary focus on content marketing, making it an ideal choice for businesses heavily invested in blog content. It features an Editorial Calendar designed with small businesses in mind. While its Marketing Suite may be beyond the budget for smaller businesses, its core strength lies in catering to those with a significant emphasis on blog content.\n\n\nSetting itself apart from other tools, CoSchedule generously provides three free content calendar templates. Beyond the standard content calendar, it extends its support with an [email marketing calendar template](https://coschedule.com/blog/annual-content-calendar-template), aiding in meticulous planning before each email campaign.\n\n\n####  **5.** [HubSpot](https://www.hubspot.com/)\n\n\n\n![XJhAkN0O8eQxT_LJMCYKXkFQQMP3ny8bpZI2SCH8C80=](/blobs/XJhAkN0O8eQxT_LJMCYKXkFQQMP3ny8bpZI2SCH8C80=)\n\n\nHubSpot stands out as an all-encompassing marketing platform, incorporating features like email marketing and CRM functionality, making it a comprehensive solution for businesses. As part of its offerings, HubSpot generously provides a free downloadable [social media content calendar template](https://offers.hubspot.com/startups/thank-you/startup-social-content-calendar?_ga=2.8150450.1850661801.1569879294-15826&hubs_offer=offers.hubspot.com%2Fstartups%2Fsocial-media-content-template-for-startups&hubs_post=blog.hubspot.com%2Fmarketing%2Fsocial-media-calendar-tools&submissionGuid=84c17d1e-ef28-4e74-b787-a6ff19329a0c) on its website.\n\n\nThis template package is a robust tool, featuring a spreadsheet for scheduling, monthly planning, and specific sections for Twitter updates, Facebook updates, LinkedIn updates, Instagram updates, and Pinterest updates. The comprehensive nature of this template allows for meticulous planning across various social media platforms.\n\n\n#### 6. [Small Business Trends](https://smallbiztrends.com/social-media-calendar-template-business)\n\n\n\n![ufIbQZhOd151_LfspxuF9L2WXXWRTZPJz66LVZ6adrg=](/blobs/ufIbQZhOd151_LfspxuF9L2WXXWRTZPJz66LVZ6adrg=)\n\n\nSmall Business Trends, an esteemed online publication dedicated to small business owners, generously shares a practical template designed specifically for small businesses. This [template](https://smallbiztrends.com/social-media-calendar-template-business) is crafted based on the same calendar format utilized internally by the publication.\n\n\n####  **7.** [Trello](https://trello.com/)\n\n\n\n![_8DibxM3YUm5heEyeqZ-jE2g-z7NJ9n9OeQm1lvBBoQ=](/blobs/_8DibxM3YUm5heEyeqZ-jE2g-z7NJ9n9OeQm1lvBBoQ=)\n\n\nTrello remains one of the most popular tools for [project management](https://affine.pro/blog/10-best-free-smart-sheet-alternatives-for-project-management-2023). It is especially great if you work as part of a bigger team as you can easily include due dates and add comments to ensure everyone in your marketing team is on the same page. Additionally, with the help of boards and cards, you can assign a task to a specific team member and define the steps needed for individual projects which can help you to organize and prioritize your posts.\n\n\n#### 8. [ClickUp](https://clickup.com/)\n\n\n\n![V6bVon2OAI92bzsD8kivpb67f1Tm_ls5M395oRzry3k=](/blobs/V6bVon2OAI92bzsD8kivpb67f1Tm_ls5M395oRzry3k=)\n\n\nSince ClickUp offers a simple and user-friendly interface, it makes it easy to drag and drop files, add comments, and track the progress of your content. And with the [ClickUp Social Media Posts Template](https://clickup.com/templates/social-media-t-182377084), you’ll be able to plan and organize your social media posts and content, publish status, and more. Additionally, with this template, you can easily track the performance of your social media campaigns and identify areas that need improvement to keep you on top of your social media game and marketing campaigns.\n\n\n# **Best Social Media Content Calendar Tool Recommendation**\n\n\n\n![rFblyTM87Ji6lT6fJskjQPcJ33A7sMeFTcWEGaTjxu8=](/blobs/rFblyTM87Ji6lT6fJskjQPcJ33A7sMeFTcWEGaTjxu8=)\n\n\n[AFFiNE](https://www.affine.pro)is a cutting-edge social media content calendar app that is designed to assist you in organizing, managing, and cooperating on tasks, projects, and information when trying to do them in real-time. What sets AFFiNE apart is that it is a free and [open-source](https://affine.pro/blog/tips-where-and-how-contribute-open-source-projects) program that employs offline technology to ensure that it is accessible to all users.\n\n\n**Key features:**\n\n\n* **[Diversified templates](https://affine.pro/blog/best-free-whiteboard-layout-ideas-organization):** At AFFiNE, we provide a variety of templates, including social media content calendar and SMART, to enhance the agility and efficiency of your workflow. Utilize our range of templates to streamline processes, improve collaboration, and achieve optimal results in your projects.\n\n\n\n![B4wYA5uuE5zOevsBVSjMP6G2fj3ji9rR_YmyvfoeEi0=](/blobs/B4wYA5uuE5zOevsBVSjMP6G2fj3ji9rR_YmyvfoeEi0=)\n\n\n* **[Collaborative Capabilities:](https://affine.pro/blog/affine-0-10-0-launch-week-day-5-5-stable-with-cloud-support-finally-available-to-every-pro-in-your-team)** For group work, the app should have collaborative features, making it easy to share and coordinate work with others in your group work. For more details, please go to latest launch week blog: [Introduction to AFFiNE's Cloud](https://affine.pro/blog/affine-0-10-0-launch-week-day-5-5-stable-with-cloud-support-finally-available-to-every-pro-in-your-team).\n\n\n  \n![71MN7zgKOg2C73idwSU66YEnVUK8x41Jqwwe2z9CiPU=](/blobs/71MN7zgKOg2C73idwSU66YEnVUK8x41Jqwwe2z9CiPU=)\n\n\n* **Write, [Draw](https://affine.pro/blog/best-free-digital-whiteboard-apps-2023), and [Plan](https://affine.pro/blog/best-project-planning-tools-software-for-teams-2023) All-in-One:**Enjoy your all-in-one KnowledgeOS solution for effortlessly writing, drawing, and planning on a hyper-fused platform. It supports [kanban](https://affine.pro/blog/affine-080-launch-week-day3), table, rich-text paragraphs as building blocks to form pages or whiteboards. It carries out integrated processing here in document editing, data processing, or brainstorming.\n\n\n\n![O88V12dZ7eALpdMD8-6eyyfRec5yZyWiQxCnvNEb3r0=](/blobs/O88V12dZ7eALpdMD8-6eyyfRec5yZyWiQxCnvNEb3r0=)\n\n\n* **[Offline Accessibility](https://affine.pro/blog/5-best-offline-alternatives-to-notion):** The best asynchronous communication app should allow users to access their essential details offline. This feature is particularly valuable when going outside with limited internet connectivity.\n\n\n\n![7tLzErsXRl3O-9-0m62ySSd00VYnYYtRKFaZUFit2Jg=](/blobs/7tLzErsXRl3O-9-0m62ySSd00VYnYYtRKFaZUFit2Jg=)\n\n\nCurrently, **AFFiNE** has released its [stable version](https://affine.pro/download), but we are continuing to build to a more feature-rich and stable build. **Come and join us on our journey over on our media platforms.🚀**\n\n\n* Official Website: [https://affine.pro/](https://affine.pro/)\n\n\n* GitHub: [https://github.com/toeverything/AFFiNE](https://github.com/toeverything/AFFiNE)\n\n\n* Twitter: [https://twitter.com/AffineOfficial](https://twitter.com/AffineOfficial)\n\n\n* Community: [https://community.affine.pro/home](https://community.affine.pro/home)\n\n\n* Discord: [https://discord.gg/Arn7TqJBvG](https://discord.gg/Arn7TqJBvG)\n\n\n* Telegram: [https://t.me/affineworkos](https://t.me/affineworkos)\n\n\n\n\n\n\n\n\n\n\n\n",
  "publish": true
}