{
  "title": "Free Best 8 Storyboard Templates & Examples in 2024",
  "authors": [
    "Yiyang Zhang"
  ],
  "tags": [
    "Content"
  ],
  "description": "Explore the 8 free best storyboard templates for design and storytelling. Find the best templates for your needs.",
  "created": 1703721600000,
  "updated": 1704153600000,
  "layout": "blog",
  "id": "aY2pIsWLH5YQ9NZSRYogb",
  "slug": "free-best-8-storyboard-templates-examples",
  "cover": "/blobs/3ilMCuGpUk78UvnFW5GkFHizKtT8Lpk4S6OUqWzWt98=",
  "md": "---\n\n\ntitle: \"Free Best 8 Storyboard Templates & Examples in 2024\"\n\n\nauthor: \"Yiyang Zhang\"\n\n\ntags: Content\n\n\nslug: free-best-8-storyboard-templates-examples\n\n\ndescription: \"Explore the 8 free best storyboard templates for design and storytelling. Find the best templates for your needs.\"\n\n\ncreated: 2023-12-28\n\n\nupdated: 2024-01-02\n\n\nlayout: blog\n\n\npublish: true\n\n\n---\n\n\n\n\n\n\n![3ilMCuGpUk78UvnFW5GkFHizKtT8Lpk4S6OUqWzWt98=](/blobs/3ilMCuGpUk78UvnFW5GkFHizKtT8Lpk4S6OUqWzWt98=)\n\n\nLights, camera, action!\n\n\nIf you're a filmmaker or storyteller, then you know the importance of creating a compelling storyboard. A well-crafted storyboard can bring your ideas to life, helping you visualize each scene and communicate your vision effectively. But where do you start?\n\n\nDon't worry, we've got you covered! In this article, we'll introduce you to the best 8 storyboard templates in 2024 that will take your storyboard designs to new heights. Whether you're a seasoned professional or just starting on your creative journey, these templates are sure to ignite your imagination and help you create captivating stories. Let's dive into the world of storyboard templates!\n\n\n# What is a Storyboard Template?\n\n\nA storyboard template is a visual representation of a story or idea that helps filmmakers, animators, and other creatives plan out their projects. It typically consists of a series of illustrations that depict the scenes in a story, along with notes and dialogue to help guide the production process.Â Storyboard templates are essential tools for visualizing and [organizing ideas](https://affine.pro/blog/top-10-best-agile-project-scheduling-software-2023), as well as communicating them to other team members. They are also useful for creating a timeline and ensuring that all elements of a project are in sync.\n\n\nNow that we've laid the foundation with concept maps, let's explore what makes a good storyboard template!\n\n\n# What Should You Look for in a Good Storyboard Template?\n\n\nWhen it comes to creating a compelling storyboard, having the right template is crucial. But what exactly should you look for in a good storyboard template? Let's explore some key factors to consider.\n\n\n\n![9IIy6HXTboxrqmr53BEABgcFDXcm1TfyVGu-TcZ4L_A=](/blobs/9IIy6HXTboxrqmr53BEABgcFDXcm1TfyVGu-TcZ4L_A=)\n\n\n* **Simplicity.** A good storyboard template should have a clean and straightforward design that allows you to easily visualize your ideas without any distractions.\n\n\n* **Flexibility.** Look for templates that offer various layouts and formats so that you can choose the one that best suits your needs. Whether it's a traditional linear format or something more dynamic, having options will help bring your story to life.\n\n\n* **Organization.** A well-structured template should provide clear sections or frames where you can outline each scene or shot. This will ensure that your storyboard flows smoothly and keeps your narrative on track.\n\n\n* **Customization.** Look for templates that allow you to add notes, labels, or annotations alongside each frame. This way, you can provide additional context or instructions for yourself or collaborators.\n\n\n* **Compatibility.** Make sure the storyboard template you choose works seamlessly with popular software programs like AFFiNE so you can easily edit and share your work with others.\n\n\nBy keeping these factors in mind when selecting a storyboard template, you'll be well-equipped to create captivating visual narratives that effectively communicate your story idea!\n\n\n# Free Best 8 Storyboard Templates in 2024\n\n\nStoryboard templates are an essential tool for anyone involved in the creative process, whether it's designing a video game, crafting a film, or creating an advertisement. They provide a visual roadmap that helps to organize ideas and communicate them effectively to others.\n\n\n* **[AFFiNE](https://app.affine.pro/) Pet Adventure Collage Storyboard Template**\n\n\n\n![6me4DuAWZCTSJcbmoKTXYvI3R8aL1isdhUsxt6BafZ4=](/blobs/6me4DuAWZCTSJcbmoKTXYvI3R8aL1isdhUsxt6BafZ4=)\n\n\nThe AFFiNE pet adventure collage storyboard template is a heartwarming visual journey that invites viewers to experience a day filled with joy, playfulness, and moments of tranquility alongside your beloved pet. Through a series of carefully crafted frames, this storyboard captures the essence of your pet's daily routine, from the delightful morning rituals to the energetic playtime and the serene afternoon nap. You can easily modify the layout, add text or images, adjust colors and fonts - the possibilities are endless!\n\n\n* [AFFiNE](https://app.affine.pro/) **Sales Business Model Canvas Template**\n\n\n\n![jfcH83_0RIYgdvIqN-Iw1lh9A-gYOrU3OBSw0UyrRQw=](/blobs/jfcH83_0RIYgdvIqN-Iw1lh9A-gYOrU3OBSw0UyrRQw=)\n\n\nThis AFFiNE sales business model template is meticulously crafted for business operations teams seeking a comprehensive strategy in the field of sales. It delves into the establishment of robust partnerships, outlines pivotal sales activities, identifies essential resources and value propositions, underscores the significance of customer relationships, explores varied sales channels, and meticulously dissects the cost structure and revenue streams.\n\n\n* [Microsoft](https://affine.pro/blog/10-best-microsoft-sharepoint-alternatives-consider-2024-free-paid) **Horizontal Storyboard Template**\n\n\n\n![O95ByaUD2aDyDUgz4Lp75pPPWLazNWKhXWClx3E2KhM=](/blobs/O95ByaUD2aDyDUgz4Lp75pPPWLazNWKhXWClx3E2KhM=)\n\n\nThe Microsoft horizontal storyboard template makes stories together with your creative team with this storyboarding template for videos, movies, or animations. Block and track all your shots to bring your creative ideas to life. This is an accessible template.\n\n\n* **[ClickUp](https://affine.pro/blog/10-best-microsoft-sharepoint-alternatives-consider-2024-free-paid) Video Storyboard Template**\n\n\n  \n![E4ExvIWVOomOZXp-okKOQDd7-B3MVUVLYnmkQB_ov8Y=](/blobs/E4ExvIWVOomOZXp-okKOQDd7-B3MVUVLYnmkQB_ov8Y=)\n\n\nThe ClickUp video storyboard template is an essential tool for marketers and creators who are planning a video project. It helps you stay organized and keeps track of every task, ensuring that nothing falls behind [schedule](https://affine.pro/blog/top-10-best-free-digital-planner-apps-2023) or goes missing. With this template, you can easily view the big picture and quickly access the finer details whenever you need to.\n\n\n* [Template.net](https://affine.pro/blog/concept-maps-definition-features-benefits-examples) **Simple Storyboard Template**\n\n\n\n![fPBOmAp0jt8jVPmEKA-19gZS_k1k7B2iKu4aZ3E0dg8=](/blobs/fPBOmAp0jt8jVPmEKA-19gZS_k1k7B2iKu4aZ3E0dg8=)\n\n\nThe simple storyboard template from Template.net utilizes text and icon sequences to ensure a smooth flow of the story's depiction. You can download storyboard templates in Word format, which can serve as references for creating an effective storyboard.\n\n\n* [Mural](https://affine.pro/blog/10-best-microsoft-sharepoint-alternatives-consider-2024-free-paid) **Basic Storyboard Template**\n\n\n  \n![AWHpywppzYyB2WD42YF0PRBsMoouLYyk_J9Y-kpoIpM=](/blobs/AWHpywppzYyB2WD42YF0PRBsMoouLYyk_J9Y-kpoIpM=)\n\n\nThe Mural basic storyboard template is a useful tool for planning and conveying an idea. By incorporating both images and words, you can gain a better understanding of your [vision](https://affine.pro/blog/8-free-printable-vision-board-templates-examples-2023) and effectively communicate it to your team. This template enables you to plan out each frame of your scenario, providing clarity and insight to your team members.\n\n\n* **Miro Basic Storyboard Template**\n\n\n\n![li8fpf3JE65AZCW4XV-7e88SU10muJjwM6i0EB861yM=](/blobs/li8fpf3JE65AZCW4XV-7e88SU10muJjwM6i0EB861yM=)\n\n\nThe Miro basic storyboard template is a useful tool that can help you put yourself in the shoes of your customers or users. It allows you to understand their thought [process](https://affine.pro/blog/top-10-best-process-mapping-tools-software-2023-free-paid), emotions, and behavior, which can be helpful when you're looking to improve an existing process. The storyboard template is available to both free and paid Miro users, with access to advanced features only available on premium plans. However, basic functionality is available to all users.\n\n\n\n\n\n* [Studylib.net](https://affine.pro/blog/gemini-vs-chatgpt-ai-tool-comparison) **Word Storyboard Template**\n\n\n\n![I0r7nMxwcr1vb0nJ6i1LrFKY-MQTGFUJBQpzbJ6yNNU=](/blobs/I0r7nMxwcr1vb0nJ6i1LrFKY-MQTGFUJBQpzbJ6yNNU=)\n\n\nThe Studylib.net word storyboard template is designed in the form of a comic strip. In each block, you can either draw a picture or type/handwrite a description of the action. Along with the picture, write a line or two of [dialog](https://affine.pro/blog/10-best-free-online-table-maker-tools-2023) and summarize the action of the characters in your commercial with a script. This will help you create a clear and concise representation of your ideas.\n\n\n* **Design Your Storyboard in AFFiNE**\n\n\n\n![5VZZiy69UNGfpn8KOwMVuvVmBr6icqfRjmd42C36r9g=](/blobs/5VZZiy69UNGfpn8KOwMVuvVmBr6icqfRjmd42C36r9g=)\n\n\nWith these criteria in mind, you're equipped to create compelling storyboards. When it comes to designing your storyboard, there are many tools available, but one that stands out is **AFFiNE**.\n\n\n\n**AFFiNE** provides professionals with a unified platform that enables them to plan a knowledge base, collaborate with teammates, and develop content. This flexible tool empowers users to brainstorm, take notes, and set their goals while staying in sync and building content with blocks. The limitless workspace stimulates user-driven innovation. AFFiNE offers safe data storage, open-source benefits, and collaborative functionality. Users can visualize and connect information effortlessly, making memory enhancement an engaging and enjoyable experience.\n\n\n\n**Key features:**\n\n\n* **Template Gallery in AFFiNE:** There is a curated collection of powerful whiteboard templates in AFFiNE. From the robust Gantt chart to the insightful storyboard and the comprehensive monthly [calendar](https://affine.pro/blog/top-10-best-free-digital-planner-apps-2023), an array of additional templates awaits your exploration, promising to expand the horizons of your project planning and execution. These templates serve as your launchpad, enabling you to skip the groundwork and jump straight into action. Choose a storyboard template and start your storytelling journey!\n\n\n\n![OP3GdbE7dwmQKK2uKzBgJbhpVJxkLuDsVtomxcggvSQ=](/blobs/OP3GdbE7dwmQKK2uKzBgJbhpVJxkLuDsVtomxcggvSQ=)\n\n\n* **Unified Storyboarding with AFFiNE's Seamless Integration and Logical Connectivity:** Users can effortlessly incorporate edgeless mode elements into pages, enhancing creative workflows. Directly insert frames and groups onto the page in edgeless mode, streamlining the process. Notably, users can connect the logic of each part according to their pages' order, fostering a cohesive narrative structure. The auto-connect feature enhances logical organization, simplifying the creation of uncluttered storyboards with smooth and uninterrupted workflow transitions in edgeless page mode.\n\n\n\n\n\n\n![spfYo1qPD6HE9uAojVPEbfp0dFegMZwx1sGbGA-b_BU=](/blobs/spfYo1qPD6HE9uAojVPEbfp0dFegMZwx1sGbGA-b_BU=)\n\n\n\n\n\n* **Effortless Storyboarding with AFFiNE's Frame & Presentation:** In edgeless mode, create and frame content effortlessly, forming standout decks with ease. Just tap the presentation button to bring your ideas to life seamlessly. Our latest update optimizes frame visuals, eliminating borders for a sleek, uncluttered presentation. Enjoy distraction-free storyboarding with a polished and refined display, making your narratives shine with AFFiNE.\n\n\n  \n![D1vokyADp7N4VON0_1CFqaKVy_yEsJ5CU9AaJBh2l8c=](/blobs/D1vokyADp7N4VON0_1CFqaKVy_yEsJ5CU9AaJBh2l8c=)\n\n\n\nSo why settle for mediocre storyboard templates when you can use a tool like AFFiNE? Whether you're working on a film production or creating animations for marketing campaigns, using AFFiNE will undoubtedly elevate the quality of your visual storytelling. Presently, **AFFiNE** has launched its [Stable Version](https://affine.pro/download), with ongoing efforts to develop a more comprehensive and dependable iteration. Join us on our voyage through our social media channels and be part of the experience. **Come and join us on our journey over on our media platforms.** ð\n\n\n\n\n\n* Official Website: [https://affine.pro/](https://affine.pro/)\n\n\n* GitHub: [https://github.com/toeverything/AFFiNE](https://github.com/toeverything/AFFiNE)\n\n\n* Discord: [https://discord.gg/Arn7TqJBvG](https://discord.gg/Arn7TqJBvG)\n\n\n* Twitter: [https://twitter.com/AffineOfficial](https://twitter.com/AffineOfficial)\n\n\n",
  "publish": true
}