{
  "title": "8 Free Event Planning Templates: Streamline Your Event Organization with Professional Event Planner 2024(Examples)",
  "authors": [
    "Yanxi Liu"
  ],
  "tags": [
    "Content"
  ],
  "description": " Streamline your event planning process and devote your energy to crafting an exceptional experience. Explore a collection of 8 free event planning templates that will assist you in seamlessly managing your next event.",
  "created": 1689465600000,
  "updated": 1704153600000,
  "layout": "blog",
  "id": "COBg-7VMl2",
  "slug": "free-event-planning-templates-for-professsional-2023",
  "cover": "/blobs/4dTaOfmEGsGZ8q3Tzc-f64vbA99Z_3wVd288CC8Sk3s=",
  "md": "---\n\n\ntitle: \"8 Free Event Planning Templates: Streamline Your Event Organization with Professional Event Planner 2024(Examples)\"\n\n\nauthor: Yanxi Liu\n\n\ntags: Content\n\n\nslug: free-event-planning-templates-for-professsional-2023\n\n\ndescription: \" Streamline your event planning process and devote your energy to crafting an exceptional experience. Explore a collection of 8 free event planning templates that will assist you in seamlessly managing your next event.\"\n\n\ncreated: 2023-07-16\n\n\nupdated: 2024-01-02\n\n\nlayout: blog\n\n\npublish: true\n\n\n---\n\n\n\n![4dTaOfmEGsGZ8q3Tzc-f64vbA99Z_3wVd288CC8Sk3s=](/blobs/4dTaOfmEGsGZ8q3Tzc-f64vbA99Z_3wVd288CC8Sk3s=)\n\n\nAre you tired of feeling frustrated and overwhelmed with the time-consuming event-planning process? If you find yourself constantly struggling to manage your time efficiently, look no further. In this article, we would like to explain the importance of using event planning templates to [boost your productivity](https://affine.pro/blog/top-5-google-docs-alternatives-pkm) and also show you a straightforward way to [streamline](https://affine.pro/blog/best-free-task-management-software-streamline-workflow) an event with AFFiNE. In addition, we’ve sorted through all event planning templates to provide you with the 8 best, most comprehensive templates, so you can [effectively plan](https://affine.pro/blog/best-5-free-digital-planner-apps-2023) a 5-day learning, conference attendance checking, travel, or other milestone event.\n\n\nSay farewell to the stress and discover a better way to plan your events with our [time-saving](https://affine.pro/blog/top-5-free-practical-time-management-templates) event planning templates. Take charge of your schedule and create unforgettable experiences effortlessly.\n\n\n## What is an event planning template?\n\n\nAn event planning template is an efficient framework that details the steps you and your team need to consider taking to plan and execute a successful event.\n\n\nFree event planning template comes pre-populated with sections and custom fields that help you manage essential event details such as status, progress, and annotations. Plus, some event templates are customized and duplicatable. Thus, you can be sure you follow the same planning steps for similar events.\n\n\n## Why is Event Planning Important\n\n\nIt is not just a mere task; Event pLANNING holds immense significance in our lives. Whether it's a personal celebration or a professional gathering, effective event planning ensures seamless execution and unforgettable experiences. It allows us to allocate resources efficiently, manage time effectively, and create a well-structured framework for success. From coordinating logistics to curating engaging activities, event planning is pivotal in bringing people together, fostering connections, and leaving a lasting impact. Don't underestimate the power of meticulous event planning—it's the key to turning ordinary moments into extraordinary memories.\n\n\n**Other benefits of the event planning template include the following:**\n\n\n* Budget for your event\n\n\n* Visualize your event plan in a timeline.\n\n\n* Create an actionable event planning checklist to track event tasks for smoother planning.\n\n\n* Share status updates right from the project.\n\n\n* Use milestones to track planning progress.\n\n\n## How to Plan an Event in AFFiNE\n\n\n\n![4gLdMysqDNoRi3HudKjQKGU0X_D6JmcO2-N-NeJTDWI=](/blobs/4gLdMysqDNoRi3HudKjQKGU0X_D6JmcO2-N-NeJTDWI=)\n\n\nPlanning an event in AFFiNE is as easy as making breakfast. With just eight simple steps, you'll have all the tools and capabilities to organize and execute your event seamlessly. From the initial pre-planning phase to the day of the event, AFFiNE empowers you to stay organized and efficient. Say goodbye to the stress of juggling multiple tasks and budgets. Follow the straightforward event planning steps below and unlock the secret to saving time and resources while hosting a successful and memorable function. Let AFFiNE be your trusted companion on your event planning journey.\n\n\n## 8 Event Planning Templates For AFFiNE, ClickUp, Excel, Monday, and Smartsheet\n\n\n### **Event Brief Template by AFFiNE**\n\n\n\n![x1l2ROi0Vv5s1y6G2gN7Nk9gFs6spGEULICcWM28uwA=](/blobs/x1l2ROi0Vv5s1y6G2gN7Nk9gFs6spGEULICcWM28uwA=)\n\n\nThe template includes tasks for each event phase, from pre-planning to post-event evaluation. Each task and subtask is structured with assignees, due dates and estimated hours for effort tracking. The template ensures that each phase of the event is planned thoroughly, without missing key steps or communication points.\n\n\n### Event To-Do List Template by AFFiNE\n\n\n\n![yHsu919vxR0mdhj4WVUjNTd45dnJEacz9HYvrNVKGYs=](/blobs/yHsu919vxR0mdhj4WVUjNTd45dnJEacz9HYvrNVKGYs=)\n\n\nUse this to-do list template to plan, prioritize, and carry out all the necessary tasks for your event. You can track the progress of each item toward completion by choosing a predetermined due date. The template includes room for additional notes or links, which is particularly useful when searching for additional information.\n\n\n### Event Sign-Up Sheet Template by AFFiNE\n\n\n\n![L7_9RmqN9W1DJaGzAIPmyElXUoCVjyNO9gVvmp_B_VQ=](/blobs/L7_9RmqN9W1DJaGzAIPmyElXUoCVjyNO9gVvmp_B_VQ=)\n\n\nTo ensure that all attendees are present at a conference or training event, have them add their signatures to this sign-in sheet. At the top of the template, there is also a room for conferences to note down the details so that the sheet can tracked and filed easily. You can modify this basic form and use it to collect attendance details at any type of event.\n\n\n### Travel Planner Template by AFFiNE\n\n\n\n![JLJlVcjxXTw-gV8J-55LU5jpbFn7zXLufszIcgVWuAY=](/blobs/JLJlVcjxXTw-gV8J-55LU5jpbFn7zXLufszIcgVWuAY=)\n\n\nIntroducing the Travel Planner Template by AFFiNE: Your hassle-free solution for organizing your travel plans. With its user-friendly interface, this template simplifies the process of researching destinations, creating itineraries, and managing bookings. Stay organized and focused as you track flights, book accommodations, and prepare your packing checklist. Let AFFiNE be your trusted companion, ensuring a [creative](https://affine.pro/blog/top-5-mind-maps-examples-and-tools) travel planning experience and unforgettable adventures.\n\n\n\n![w4KE80iCKrrsiRqL7fJ0AQP_8rX2XsUumHom9EPbE1c=](/blobs/w4KE80iCKrrsiRqL7fJ0AQP_8rX2XsUumHom9EPbE1c=)\n\n\nThis Five-Day Event Schedule Template by AFFiNE is as helpful for the guests as it is for the event planner. Conferences and networking events are often several days long and can feature dozens of speakers, scheduled lunches, activities—and and minimal breaks.\n\n\nThis single spreadsheet can be kept in hand during the event and used by the event organizers to ensure each element is starting and ending as expected. And for guests, this template can be edited throughout the event or used ahead of time to plan each day around their most anticipated speakers or sessions.\n\n\n### **Event Marketing Template by ClickUp**\n\n\n\n![mXuEPyQoKvCf5RrNaGXeyEozlQqbDx0ZbypG8AuLZpU=](/blobs/mXuEPyQoKvCf5RrNaGXeyEozlQqbDx0ZbypG8AuLZpU=)\n\n\nThis template offers users a clear overview of your event’s goals and objectives, as well as an organized structure for tracking event details like target audience, event timeline, budget management, and more. You can assign tasks to specific team members and monitor progress in one easy-to-navigate interface.\n\n\n### **Event & Party Planner Template for Excel**\n\n\n\n![O7tGaS57CWtuo6HCbTzQyNzOI_vbRjLk4WA_xJINUF8=](/blobs/O7tGaS57CWtuo6HCbTzQyNzOI_vbRjLk4WA_xJINUF8=)\n\n\nIf you prefer to have all your event information neatly organized in a spreadsheet, Excel has the perfect solution for you. This template is designed specifically for small to mid-sized events. This comprehensive template was divided into sections, allowing you to easily input guest information, manage musical arrangements, track decorations, monitor supplies, jot down important notes, and much more. Moreover, each section includes relevant columns to indicate the completion status of items and provides a clear breakdown of your budget and expected costs. It's the ultimate tool to streamline your event planning process and ensure everything runs smoothly.\n\n\n###  **Cross-company event planning  for Monday**\n\n\n\n![__CPpN-m4MLJg6oEPPiAf1B6XjIv7BP4Pg-qbE55eAY=](/blobs/__CPpN-m4MLJg6oEPPiAf1B6XjIv7BP4Pg-qbE55eAY=)\n\n\nIf you are an HR department member wanting to create an internal event, here we go! Cross-company event planning template, which can not only **visualize your entire planning process but also centralize your event task force, as well as measure success. To illustrate, this template uses** statuses to track each step of your planning process visually. Assign tasks, oversee due dates, and stay on top of all your work at a glance. **Centralize your event task force,** Bring together all the stakeholders in your internal event by keeping everything on a unified board.\n\n\n### Calendar of Events Template by Smartsheet\n\n\n\n![oUtv5mUS3Y35tnRpTXNT6mnkiQyKcH_8q-bOX3qeDIg=](/blobs/oUtv5mUS3Y35tnRpTXNT6mnkiQyKcH_8q-bOX3qeDIg=)\n\n\nThis template is perfect for providing a calendar format with an adjacent column for listing events. The calendar displays all 12 months of the year on a single Excel sheet, making it easy to scan through months, plan ahead, and quickly view the events listed in the corresponding column.\n\n\n## Which App offers the best Event Planning Template?\n\n\nIn this article, we have offered you the top 8 free event planning templates by [AFFiNE](https://affine.pro/), Clickup, Excel, Monday, and Smartsheet. We encourage users to choose the ideal option based on their specific needs and pain points. However, based on our evaluation, we still propose AFFiNE as the optimal choice for creating the Event Planning Templates. Not merely because it provides people with much more flexibility, collaboration, visual representation, customization, and reusability in creating event planner, but also for its uniqueness as a free, open-source tool that prioritizes privacy, making it accessible to anyone who wants to enhance their productivity.\n\n\nIf you want find more about AFFiNE, please click on these links:\n\n\n* Official Website: [https://affine.pro/](https://affine.pro/)\n\n\n* GitHub: [https://github.com/toeverything/AFFiNE](https://github.com/toeverything/AFFiNE)\n\n\n* Discord: [https://discord.gg/Arn7TqJBvG](https://discord.gg/Arn7TqJBvG)\n\n\n* Twitter: [https://twitter.com/AffineOfficial](https://twitter.com/AffineOfficial)\n\n\n",
  "publish": true
}