{
  "title": "Free 8 Printable Customizable Monthly Calendar Templates & Examples in 2024",
  "authors": [
    "Yiyang Zhang"
  ],
  "tags": [
    "Content"
  ],
  "description": "Free printable calendar templates for your needs. Download your free customizable monthly calendars in AFFiNE to get you organized.",
  "created": 1673136000000,
  "updated": 1673136000000,
  "layout": "blog",
  "id": "PqEKAxYCMZPrmppFdr9js",
  "slug": "free-8-printable-customizable-monthly-calendar-templates-examples",
  "cover": "https://app.affine.pro/api/workspaces/qf73AF6vzWphbTJdN7KiX/blobs/aC8KhCgGW4ODJaGsAUiJACW_yhSvLzCUOC7N8PpZxhE=.webp",
  "md": "---\n\ntitle: \"Free 8 Printable Customizable Monthly Calendar Templates & Examples in 2024\"\n\nauthor: \"Yiyang Zhang\"\n\ntags: Content\n\nslug: free-8-printable-customizable-monthly-calendar-templates-examples\n\ndescription: \"Free printable calendar templates for your needs. Download your free customizable monthly calendars in AFFiNE to get you organized.\"\n\ncreated: 2023-01-08\n\nupdated: 2023-01-08\n\nlayout: blog\n\npublish: true\n\n---\n\n\n![aC8KhCgGW4ODJaGsAUiJACW_yhSvLzCUOC7N8PpZxhE=](https://app.affine.pro/api/workspaces/qf73AF6vzWphbTJdN7KiX/blobs/aC8KhCgGW4ODJaGsAUiJACW_yhSvLzCUOC7N8PpZxhE=.webp)\n\nWelcome to the year [2024](https://affine.pro/blog/top-10-best-time-management-software-tools-2023), where being organized and productive is crucial for success! As we start another year full of endless possibilities and opportunities, it's essential to have the right tools to handle our hectic schedules. And what could be a better tool than a monthly calendar template? Be it a student managing classes and extracurricular activities, a professional handling work deadlines and meetings, or anyone who wants to keep track of personal goals and appointments, a customizable monthly calendar can be your secret weapon.\n\nWith an abundance of options available, selecting the ideal monthly calendar template can be a challenge. But fret not, we are here to assist you! In this article, we will examine the characteristics of a good monthly calendar template and showcase the top 8 templates that will enable you to stay organized throughout the year 2024. So, let's delve into the world of efficient [planning](https://affine.pro/blog/15-best-free-daily-planner-apps-features-free) and discover the power of these printable templates!\n\n# What is a Monthly Calendar Template?\n\nA monthly calendar template is a pre-designed layout that allows you to plan and organize your activities monthly. It gives you a clear visual representation of the days, weeks, and months ahead, enabling you to have a comprehensive overview of your schedule. The best part about these templates is that they are highly flexible and can be personalized to meet your specific needs and preferences. With a monthly calendar template, you can easily add important events, appointments, deadlines, or any other relevant information. This can help you stay on top of your [schedule](https://affine.pro/blog/best-work-schedule-apps-2023-review) and ensure that you don't forget any important commitments. Using a printable monthly calendar template not only enhances your organizational skills but also provides a sense of structure and control over your daily life. By mapping out your responsibilities and commitments visually, you can prioritize your tasks more efficiently and make better use of your time.\n\n# What Should You Look for in a Good Monthly Calendar Template?\n\n\n![fghfebpSquVxrsVk9SaN6UwQrEZB6Nyzg_YYu0LB9y4=](https://app.affine.pro/api/workspaces/qf73AF6vzWphbTJdN7KiX/blobs/fghfebpSquVxrsVk9SaN6UwQrEZB6Nyzg_YYu0LB9y4=.webp)\n\nWhen it comes to choosing a good monthly calendar template, there are several key factors to consider.\n\n* **Functionality**. A well-designed template includes all necessary sections to efficiently organize your schedule and keep track of important dates.\n\n* **Customizable**. When looking for a template, choose one that you can customize based on your preferences and needs. This may include modifying colors, adding or deleting sections, or incorporating pictures or logos.\n\n* **Ease of use**. The template should be intuitive and user-friendly so that you can easily navigate through it without any confusion. Additionally, compatibility with different devices and software is essential in today's [digital](https://affine.pro/blog/top-10-best-free-digital-planner-apps-2023) age.\n\n* **Well-structured**. The layout of the template should be well-structured and visually appealing, making it easy on the eyes when referring to your calendar regularly.\n\n* **Accessibility**. Choose a monthly calendar template that can be easily printed out or shared digitally with others if needed.\n\nBy considering these factors when selecting a monthly calendar template, you'll ensure that it meets all your requirements and helps you stay organized throughout the year!\n\n# Free 8 Customizable Monthly Calendar Templates in 2024\n\nAre you ready to stay organized and make the most of your time in 2024? Look no further than these top 8 monthly calendar templates that will help you keep [track](https://affine.pro/blog/8-best-habit-tracker-apps-your-need-2023-features-price) of your appointments, deadlines, and important events. These customizable templates are not only visually appealing but also highly functional, allowing you to personalize them according to your needs.\n\n## 1. [AFFiNE](https://affine.pro/) Personal Daily Routine Monthly Calendar Template\n\n\n![0YdgTiaTcVH0k7XY1tYT_iwmUb1Fo-YGoq-xg92B7Ys=](https://app.affine.pro/api/workspaces/qf73AF6vzWphbTJdN7KiX/blobs/0YdgTiaTcVH0k7XY1tYT_iwmUb1Fo-YGoq-xg92B7Ys=.webp)\n\nThis AFFiNE personal [daily](https://affine.pro/blog/15-best-free-daily-planner-apps-features-free) routine monthly calendar captures a harmonious blend of work appointments, personal fitness goals, family events, and educational engagements, all color-coded for quick reference. It's a snapshot of a well-orchestrated week where every commitment, from morning meetings to weekend picnics, is visually mapped out for easy navigation.\n\n## 2. [AFFiNE](https://app.affine.pro) Health Monthly Calendar Planner Template\n\n\n![O28UvLX2GofDdY7BfdZWUd7GGZaqKOVDjKnrUNU3nEs=](https://app.affine.pro/api/workspaces/qf73AF6vzWphbTJdN7KiX/blobs/O28UvLX2GofDdY7BfdZWUd7GGZaqKOVDjKnrUNU3nEs=.webp)\n\nThis AFFiNE health monthly calendar planner template showcases a personalized approach to well-being. Seamlessly integrate health-focused activities into your daily routine, from workouts to self-care. Let's make each day an opportunity for a healthier and happier you! It offers a sleek and modern look while still offering plenty of room to jot down your health notes.\n\n## 3. [CalendarLabs](https://www.calendarlabs.com/printable-calendar) Printable Monthly Calendar Template\n\n\n![Ova1bCjIGgF2N8T-kfPkfMNLCjhQV2sX2t6C9Z1K_Q8=](https://app.affine.pro/api/workspaces/qf73AF6vzWphbTJdN7KiX/blobs/Ova1bCjIGgF2N8T-kfPkfMNLCjhQV2sX2t6C9Z1K_Q8=.webp)\n\nThis is a colorful and free monthly printable calendar for the year 2024, available on CalendarLabs. It includes US holidays and is designed in a landscape layout. You can customize this template according to your needs using our free Word calendar creation tool. Each month of the calendar features vibrant blooms that will inspire positivity as you carry out your day-to-day activities.\n\n## 4. [Smartsheet](https://affine.pro/blog/10-best-free-smart-sheet-alternatives-for-project-management-2023) Monthly Calendar Template\n\n\n![HjpmHOiCZYvoMzSz4I5mU65SfBd6H7q2MZO9qxqPAaM=](https://app.affine.pro/api/workspaces/qf73AF6vzWphbTJdN7KiX/blobs/HjpmHOiCZYvoMzSz4I5mU65SfBd6H7q2MZO9qxqPAaM=.webp)\n\nThe Smartsheet monthly calendar is designed in a landscape view. It displays the days of the week from Sunday through Saturday and provides enough space at the bottom of the template to add notes. This is a straightforward monthly calendar that can be used for planning any type of [schedule](https://affine.pro/blog/best-work-schedule-apps-2023-review).\n\n## 5. [CalendarsQuick](https://www.calendarsquick.com/printables/monthly-planner.html) Custom Monthly Calendar Template\n\n\n![QWBIumV_SsMpYsxv7IeVjLH2tnof95hMVe4YOmWL4n8=](https://app.affine.pro/api/workspaces/qf73AF6vzWphbTJdN7KiX/blobs/QWBIumV_SsMpYsxv7IeVjLH2tnof95hMVe4YOmWL4n8=.webp)\n\nWith this CalendarsQuick template, you can print monthly planner pages that come with a spacious layout, perfect for listing all of your important to-do items. Not only that, but you can also customize the planner pages to include your [schedule](https://affine.pro/blog/11-free-customizable-weekly-schedule-planner-templates-2023), upcoming events, and holidays, making it a comprehensive tool for staying organized.\n\n## 6. [Onplanners](https://onplanners.com/template/colorful-monthly-calendar) Printable Colorful Monthly Calendar Template\n\n\n![Oo7Am7qSfVRxJbJ7Ojh7pKdBhUuPiU00NR39pqiWAAI=](https://app.affine.pro/api/workspaces/qf73AF6vzWphbTJdN7KiX/blobs/Oo7Am7qSfVRxJbJ7Ojh7pKdBhUuPiU00NR39pqiWAAI=.webp)\n\nThis Onplanners printable colorful monthly calendar with colorful day sections helps you to keep track of daily activities. Inject some fun into your [scheduling](https://affine.pro/blog/top-10-best-free-digital-planner-apps-2023) with this vibrant template featuring bold colors and eye-catching patterns. It's an excellent choice for individuals who enjoy adding their personal touch to their calendars.\n\n## 7. [Cheqmark](https://cheqmark.io/monthly-calendar-template) Monthly Calendar Template\n\n\n![rDbr9pEejm7EBEFRTcMN8Xkt28kUaWg9uvtgQ9z0K0w=](https://app.affine.pro/api/workspaces/qf73AF6vzWphbTJdN7KiX/blobs/rDbr9pEejm7EBEFRTcMN8Xkt28kUaWg9uvtgQ9z0K0w=.webp)\n\nCheqmark's monthly calendar templates are designed to help you stay organized and manage your time effectively. With a clear and easy-to-use layout, our printable calendars are perfect for busy professionals, students, or anyone who needs to juggle multiple commitments and [events](https://affine.pro/blog/15-types-events-event-management-categories-examples).\n\n## 8. [Lucidchart](https://affine.pro/blog/10-best-free-online-table-maker-tools-2023) Monthly Calendar Template\n\n\n![7XUg3Y7iPWlzdZADBACMLdxnGDeV5l1BTyyG4UoJky0=](https://app.affine.pro/api/workspaces/qf73AF6vzWphbTJdN7KiX/blobs/7XUg3Y7iPWlzdZADBACMLdxnGDeV5l1BTyyG4UoJky0=.webp)\n\nThe Lucidchart monthly calendar template enables you to plan and monitor events efficiently. You can incorporate essential information into events using notes and have a comprehensive monthly overview. The template follows a Sunday through Saturday format, and there's space for additional notes at the bottom. It serves as a straightforward monthly calendar suitable for various [schedule planning](https://affine.pro/blog/top-10-best-agile-project-scheduling-software-2023) purposes.\n\n# Record Your Plans in AFFiNE\n\n\n![-_OPJAICQM-hdycw2wCuxDqMLnm_Gx64Yk2i_PX6Vjc=](https://app.affine.pro/api/workspaces/qf73AF6vzWphbTJdN7KiX/blobs/-_OPJAICQM-hdycw2wCuxDqMLnm_Gx64Yk2i_PX6Vjc=.webp)\n\nWith these free printable customizable monthly calendar templates, you have the perfect tools to keep your life organized in 2024. But why stop at just using a monthly calendar template? With **AFFiNE**, you can create personalized calendars, [track](https://affine.pro/blog/8-free-project-tracker-templates-work-management-2023) your progress on goals, collaborate with others, and so much more. Gone are the days of scribbling notes on paper or relying on memory alone. With AFFiNE's user-friendly interface and powerful features, staying organized has never been easier. So go ahead and give it a try â€“ start recording all of your plans in AFFiNE today!\n\nAFFiNE provides professionals with a unified platform that enables them to plan a knowledge base, collaborate with teammates, and develop content. This flexible tool empowers users to record knowledge, take notes, and set their goals while staying in sync and building content with blocks. The limitless workspace stimulates user-driven innovation. AFFiNE offers safe data storage, open-source benefits, and collaborative functionality. Users can visualize and connect information effortlessly, making monthly calendar recording an engaging and enjoyable experience.\n\n\n\n<div style=\"text-align:center;\">\n\n<iframe width=\"560\" height=\"315\" src=\"https://www.youtube.com/embed/3cfeKOufZWU?si=IiXDIdwfnM2Z7KPL\" title=\"YouTube video player\" frameborder=\"0\" allow=\"accelerometer; autoplay; clipboard-write; encrypted-media; gyroscope; picture-in-picture; web-share\" allowfullscreen></iframe>\n\n</div>\n\n\n\n**Key features:**\n\n* **Painting Your Month in AFFiNE**: AFFiNE's [monthly calendar](https://affine.pro/blog/free-event-planning-templates-for-professsional-2023) template turns scheduling from a chore into a delight, suited not just for the busy individual keeping track of life's essentials but also for teams synchronizing their collective deadlines. It's a favourite among administrative professionals, busy parents, and project coordinators alike. This template serves as your launchpad, enabling you to skip the groundwork and jump straight into action.\n\n<video muted autoplay loop preload=\"auto\" playsinline>\n  <source src=\"https://app.affine.pro/api/workspaces/qf73AF6vzWphbTJdN7KiX/blobs/k2lfWlONQHZrQpHF2i6Lm0B8ZSTvaYpNOSs9mLm2a5A=\" type=\"video/mp4\" />\n</video>\n\n* **Show Your Monthly Calendar with AFFiNE's Single Page Sharing**: No more oversharing of your workspace. With just a few clicks, you can control precisely what is shared. AFFiNE's single-page sharing feature simplifies monthly calendar improvement by allowing you to customize how you show your monthly calendar to your colleagues or family members.\n\n\n![VsmRQKKT_JWfocv6kdTdmSw3-22k1EUrdWeyjhL8xjQ=](https://app.affine.pro/api/workspaces/qf73AF6vzWphbTJdN7KiX/blobs/VsmRQKKT_JWfocv6kdTdmSw3-22k1EUrdWeyjhL8xjQ=.webp)\n\n* **Advanced Collaboration Capability**: When you do need to [collaborate](https://affine.pro/blog/top-asynchronous-communication-tools-free-2024) with other contributors to discuss your monthly calendar, AFFiNE makes getting feedback simple. Appealing collaboration capability provides visibility into assigned tasks, making tables easier to estimate, and ensuring your monthly calendar remains well-designed. You can invite team members or friends to collaborate on the monthly calendar together, making it perfect for the affairs schedule.\n\n\n![O88V12dZ7eALpdMD8-6eyyfRec5yZyWiQxCnvNEb3r0=](https://app.affine.pro/api/workspaces/qf73AF6vzWphbTJdN7KiX/blobs/O88V12dZ7eALpdMD8-6eyyfRec5yZyWiQxCnvNEb3r0=.webp)\n\nSo what are you waiting for? Start downloading those templates now and get ready to make this year your most productive yet! Happy planning! **AFFiNE** has launched its **[Stable Version](https://affine.pro/download)**, with ongoing efforts to develop a more comprehensive and dependable iteration. Join us on our voyage through our social media channels and be part of the experience. **Come and join us on our journey over on our media platforms. ðŸš€**\n\n* Official Website: [https://affine.pro/](https://affine.pro/)\n\n* GitHub: [https://github.com/toeverything/AFFiNE](https://github.com/toeverything/AFFiNE)\n\n* Discord: [https://discord.gg/Arn7TqJBvG](https://discord.gg/Arn7TqJBvG)\n\n* Twitter: [https://twitter.com/AffineOfficial](https://twitter.com/AffineOfficial)\n\n",
  "publish": true
}