{
  "title": "Gemini vs ChatGPT – Which AI Tool is the Best?",
  "authors": [
    "Xuan Pang"
  ],
  "tags": [
    "Content"
  ],
  "description": "Dive into an in-depth comparison of Gemini and ChatGPT in our latest article. Explore their basics, versions, and a detailed SWOT analysis to determine which AI tool reigns supreme. Join us in unraveling the strengths and weaknesses of these leading AI technologies.",
  "created": 1703462400000,
  "updated": 1703462400000,
  "layout": "blog",
  "id": "CHmhF3a0lSOsCioJ4Xn_Z",
  "slug": "gemini-vs-chatgpt-ai-tool-comparison",
  "cover": "https://insider.affine.pro/api/workspaces/qf73AF6vzWphbTJdN7KiX/blobs/rxFOvtW33OdWBKOUCNbIbnzIbx0twMPYerRi5c8VCmU=.webp",
  "md": "---\n\ntitle: \"Gemini vs ChatGPT – Which AI Tool is the Best?\"\n\nauthor: Xuan Pang\n\ntags: Content\n\nslug: gemini-vs-chatgpt-ai-tool-comparison\n\ndescription: \"Dive into an in-depth comparison of Gemini and ChatGPT in our latest article. Explore their basics, versions, and a detailed SWOT analysis to determine which AI tool reigns supreme. Join us in unraveling the strengths and weaknesses of these leading AI technologies.\"\n\ncreated: 2023-12-25\n\nupdated: 2023-12-25\n\nlayout: blog\n\npublish: true\n\n---\n\n\n![rxFOvtW33OdWBKOUCNbIbnzIbx0twMPYerRi5c8VCmU=](https://insider.affine.pro/api/workspaces/qf73AF6vzWphbTJdN7KiX/blobs/rxFOvtW33OdWBKOUCNbIbnzIbx0twMPYerRi5c8VCmU=)\n\nArtificial intelligence has been the stage for a riveting showdown between Google's Gemini AI and OpenAI's ChatGPT. ChatGPT has been in the limelight, but Gemini AI has been diligently enhancing its capabilities, poised for the perfect moment to reveal its strengths. Recently, Gemini made a significant impact with its impressive performance, challenging the established norms in the AI world. For the past year, Google has been a silent observer as ChatGPT captured global attention.\n\n\n\nNow, it's Google's moment to emerge as a formidable contender with the debut of Gemini, a revolutionary AI model. Google isn't just stepping into the AI fray; it's aiming to transform it. **We're about to explore the exciting battle between these AI giants: ChatGPT versus Gemini.**\n\n# \nWhat is ChatGPT?\n\n\n![KwXhAJmIzOic3tipdlXBal6WuTcEAS38fjeK1mJLfIM=](https://insider.affine.pro/api/workspaces/qf73AF6vzWphbTJdN7KiX/blobs/KwXhAJmIzOic3tipdlXBal6WuTcEAS38fjeK1mJLfIM=)\n\nChatGPT is an advanced language model developed by OpenAI, an AI research lab. It's part of the GPT (Generative Pre-trained Transformer) family of models, which have been at the forefront of natural language processing (NLP) technology. The history of ChatGPT began with the introduction of the original GPT model, followed by subsequent iterations like GPT-2 and GPT-3.\n\n* GPT-3.5: This version marked a significant milestone with its 175 billion machine-learning parameters, making it one of the most powerful language models at the time of its release. It set new standards in the AI field for its ability to generate human-like text, understand context, and even perform certain creative tasks.\n* ChatGPT-4: Based on the GPT-3.5 architecture, ChatGPT is specifically fine-tuned for conversational AI, enabling it to handle a wide range of dialogue-based tasks. Its achievements include passing various academic tests, writing and debugging computer code, composing creative content, and more, demonstrating its versatility and advanced understanding of language.\n\n\n# What is Gemini?\n\n\n![C60xGBEgQLMr7n-5J77syI7W2GbKyxLXVBGmQDdJH-4=](https://insider.affine.pro/api/workspaces/qf73AF6vzWphbTJdN7KiX/blobs/C60xGBEgQLMr7n-5J77syI7W2GbKyxLXVBGmQDdJH-4=)\n\nGemini is a cutting-edge AI model developed by Google, designed to compete in the rapidly evolving landscape of large language models. Unlike its predecessors from Google, such as BERT and T5, Gemini focuses not just on language processing but also on multimodal capabilities, integrating text with visual elements.\n\nGoogle's journey in AI language models started with BERT (Bidirectional Encoder Representations from Transformers), which significantly improved the understanding of the context in search queries. This was followed by models like T5 (Text-To-Text Transfer Transformer), which further enhanced Google's capabilities in natural language understanding and generation.\n\nRepresenting a leap forward, Gemini is Google's response to the increasing demand for sophisticated AI tools. Unlike earlier models that were primarily text-based, Gemini's multimodal approach allows it to understand and generate not only text but also visuals, offering a more comprehensive AI experience. Its achievements include improved accuracy in understanding complex queries and the potential for applications in a wider range of fields due to its multimodal nature.\n\n# Comparison between ChatGPT and Gemini - Swot analysis\n\n\n![VzAFV63Q1QvhAURW8jynQvh0N_6hksHVRXw1P2WvU-8=](https://insider.affine.pro/api/workspaces/qf73AF6vzWphbTJdN7KiX/blobs/VzAFV63Q1QvhAURW8jynQvh0N_6hksHVRXw1P2WvU-8=)\n\n## 1.Strengths\n\n**Google Gemini**\n\n* **Versatility in Multimodality:** Gemini's multimodal capabilities allow it to handle both text and visual inputs, paving the way for more dynamic and engaging user interactions.\n* **Enhanced Language Comprehension:** Thanks to its sophisticated algorithms, Gemini excels in understanding the subtleties of language, resulting in more precise and relevant answers.\n* **Energy and Computational Efficiency:** Gemini stands out for its lower computational demands than ChatGPT 4, making it more practical for real-world use and accessible to a wider audience.\n* **Commitment to Openness:** Google's dedication to an open-source model with Gemini encourages community-driven development and innovation in AI.\n**OpenAI ChatGPT**\n\n* **Widespread Use and User Base:** ChatGPT benefits from an extensive user community, expanding its reach across various applications.\n* **Expertise in Text Generation:** Renowned for its text generation capabilities, ChatGPT is a leader in creating high-quality, human-like text for various formats.\n* **Versatile and User-Friendly:** The model's adaptability allows it to cater to a variety of tasks and user preferences.\n* **Ongoing Evolution:** OpenAI's continuous investment in R&D ensures that ChatGPT is consistently evolving and improving.\n## 2.Weaknesses\n\n**Google Gemini**\n\n* **Developmental Phase**: As it's still in the developmental stage, Gemini lacks the depth of real-world data and experience found in ChatGPT 4, necessitating further refinement.\n* **Focus on Multimodal Use:** Gemini's emphasis on multimodal functionalities may not fully cater to users who need solely text-based solutions.\n* **Risk of Misuse:** Gemini's advanced capabilities, like any potent tool, carry the potential for unethical use, such as generating false information.\n**OpenAI ChatGPT**\n\n* **Constrained Multimodal Functionality**: Focusing mainly on text, ChatGPT might not match Gemini's versatility in handling multiple modes of input.\n* **Issues with Transparency**: OpenAI's proprietary approach with ChatGPT has raised concerns about biases and misuse, affecting user trust.\n**Greater Resource Requirements**: ChatGPT's higher resource consumption could limit its use for those with restricted computational power.\n\n# \nWhich AI Tool is the Best?\n\nDetermining which AI tool is superior depends largely on the specific needs and objectives of the user. For tasks heavily reliant on text generation and conversation, ChatGPT might be the preferred choice. Its ability to understand context and produce coherent, contextually appropriate responses is unmatched in text-based applications.\n\nConversely, for applications requiring a blend of visual and textual understanding, Gemini's multimodal approach offers a significant advantage. This makes it particularly useful in fields like content creation, where visual elements play a crucial role, or in tasks requiring the interpretation of both visual and textual data.\n\nIn conclusion, the \"best\" AI tool between Gemini and ChatGPT hinges on the context of use. Both tools have their unique strengths and ideal use cases. ChatGPT leads in text-based AI interactions, while Gemini opens new frontiers in multimodal AI applications. As the AI landscape continues to grow, the capabilities of these tools are expected to expand, further blurring the lines in this exciting technological race.\n\n# Meet AFFiNE - Empower AI Tools\n\n\n**Presently, a variety of software platforms have integrated the APIs of both ChatGPT and Gemini, including tools like AFFiNE.** This integration allows these platforms to leverage the advanced capabilities of these AI models, enhancing their own functionalities and offering users a more robust experience.\n\n[AFFiNE](https://affine.pro/) is a cutting-edge app that is designed to assist you in organizing, managing, and cooperating on tasks, projects, and information when trying to manage a project. What sets AFFiNE apart is that it is a free and [open-source](https://affine.pro/blog/tips-where-and-how-contribute-open-source-projects) program that employs offline technology to ensure that it is accessible to all users.\n\n\n![MvPuJwMVS0vN9b_4qmeq27HIggpf7g0QZuhvctyyqI8=](https://insider.affine.pro/api/workspaces/qf73AF6vzWphbTJdN7KiX/blobs/MvPuJwMVS0vN9b_4qmeq27HIggpf7g0QZuhvctyyqI8=)\n\n### Key features**:**\n\n* **Support of Third-Party Blocks - Unleash Possibilities**\nWe're thrilled to introduce the ability to seamlessly incorporate external blocks, such as bookmarks, into your projects in the future. You are allowed to elevate your designs with specialized features, from websites to presentations and explore a diverse range of options and expand your creative toolkit.\n\n\n![0hGbQTucXas4qOw0k332k4OrNGZdGkzyZ8WyQ3jipdM=](https://insider.affine.pro/api/workspaces/qf73AF6vzWphbTJdN7KiX/blobs/0hGbQTucXas4qOw0k332k4OrNGZdGkzyZ8WyQ3jipdM=)\n\n* **Built-in control of network&storage permissions of plugins - Empower Your Privacy**\nWe prioritize your privacy and data ownership. Any component that requires web access will be made as a plugin in AFFiNE, and we will make sure that you can have total control over their permissions on both local and remote storage. That's why we're excited to introduce our local-first approach, putting you in command of your information. With built-in networks and storage permission controls for plugins, you can trust that your data stays secure and under your control.\n\n\n![i67_fIXFLRo4UgGkvaWOQ7uxg_4s-zv6WOuchZZsjKE=](https://insider.affine.pro/api/workspaces/qf73AF6vzWphbTJdN7KiX/blobs/i67_fIXFLRo4UgGkvaWOQ7uxg_4s-zv6WOuchZZsjKE=)\n\n* **Write, Draw, and Plan All-in-One**\nEnjoy your all-in-one KnowledgeOS solution for effortlessly writing, drawing, and planning on a hyper-fused platform. It supports kanban, table, and rich-text paragraphs as building blocks to form pages or whiteboards. It carries out integrated processing here in document editing, data processing, or brainstorming.\n\n* **[Collaborative Capabilities](https://affine.pro/blog/affine-0-10-0-launch-week-day-5-5-stable-with-cloud-support-finally-available-to-every-pro-in-your-team):**\nFor group work, the app should have collaborative features, making it easy to share and coordinate projects with others in your group work.\n\n\n![71MN7zgKOg2C73idwSU66YEnVUK8x41Jqwwe2z9CiPU=](https://insider.affine.pro/api/workspaces/qf73AF6vzWphbTJdN7KiX/blobs/71MN7zgKOg2C73idwSU66YEnVUK8x41Jqwwe2z9CiPU=)\n\n* **[Offline Accessibility:](https://affine.pro/blog/5-best-offline-alternatives-to-notion)**\nThe best task management tool should allow users to access their essential details offline. This feature is particularly valuable when going outside with limited internet connectivity.\n\n\n![7tLzErsXRl3O-9-0m62ySSd00VYnYYtRKFaZUFit2Jg=](https://insider.affine.pro/api/workspaces/qf73AF6vzWphbTJdN7KiX/blobs/7tLzErsXRl3O-9-0m62ySSd00VYnYYtRKFaZUFit2Jg=)\n\nCurrently, AFFiNE has released its stable version, but we are continuing to build to a more feature-rich and stable build. Come and join us on our journey over on our media platforms.\n\n* Official Website: [https://affine.pro/](https://affine.pro/)\n* GitHub: [https://github.com/toeverything/AFFiNE](https://github.com/toeverything/AFFiNE)\n* Discord: [https://discord.gg/Arn7TqJBvG](https://discord.gg/Arn7TqJBvG)\n* Twitter: [https://twitter.com/AffineOfficial](https://twitter.com/AffineOfficial)\n\n\n\n\n",
  "publish": true
}