{
  "title": "Join Us to Learn How to Grow as a Student in the Open Source Community",
  "authors": [
    "Haoxin shang"
  ],
  "tags": [
    "Webinars"
  ],
  "description": "Wanna know more about how to grow as a student in the open source community, come and check this!",
  "created": 1683849600000,
  "updated": 1683849600000,
  "layout": "blog",
  "id": "ACTUFBz6BV",
  "slug": "grow-as-student-open-source-community",
  "cover": "/blobs/CmStT4cHv7CgxX4uXsCsEEv7ShMb109tnwg0ehsXHjw=",
  "md": "---\n\n\ntitle: \"Join Us to Learn How to Grow as a Student in the Open Source Community\"\n\n\nauthor: Haoxin shang\n\n\ntags: Webinars\n\n\nslug: grow-as-student-open-source-community\n\n\ndescription: Wanna know more about how to grow as a student in the open source community, come and check this!\n\n\ncreated: 2023-05-12\n\n\nupdated: 2023-05-12\n\n\nlayout: blog\n\n\npublish: True\n\n\n---\n\n\n\n![CmStT4cHv7CgxX4uXsCsEEv7ShMb109tnwg0ehsXHjw=](/blobs/CmStT4cHv7CgxX4uXsCsEEv7ShMb109tnwg0ehsXHjw=)\n\n\nAre you a **student** looking to grow professionally and personally? Do you have an interest in open-source technology? We are excited to announce our upcoming event \"How to grow as a student in the open source community\".If you happen to be busy as the product is held, you may wanna have a look of the [activity summary](https://affine.pro/blog/tips-where-and-how-contribute-open-source-projects)\n\n\n\n\n\nAre you a **student** looking to grow professionally and personally? Do you have an interest in open-source technology? We are excited to announce our upcoming event \"How to grow as a student in the open source community\".\n\n\n\n\n\n**Join us on 18th May 2023  at 10:30 pm UTC+8** for an interactive discussion with seasoned members of the open-source community as they share their experiences and provide tips on how to excel as a student in the field. We will be exploring real-world challenges that students commonly face and how to overcome them, including how to make meaningful contributions to open-source projects and networking with fellow students and professionals.\n\n\n\n\n\nBut it doesn't stop there! This event is just the beginning, as we plan to host a series of activities focused on developing the skills and experiences needed to succeed in the open-source community. We hope to build a community of like-minded students where we can learn from each other, share ideas, and collaborate on relevant projects.\n\n\n\n\n\nSo what are you waiting for? Register now and mark your calendars for this exciting event. Let's grow together as students in the open-source community!\n\n\n\n\n\n\n\n\n**Looking for Meeting detailsðŸ‘‡:**\n\n\nZOOMUrl:https://us06web.zoom.us/j/85133318805\n\n\nZoom number: 851 3331 8805\n\n\nDiscord groupï¼š[https://discord.gg/3P6E4JA6](https://discord.gg/3P6E4JA6)\n\n\n\n\n\n\n\n\n**Following our ChannelsðŸ‘‡:**\n\n\n* Official Website:Â [https://affine.pro/](https://affine.pro/)\n\n\n* GitHub:Â [https://github.com/toeverything/AFFiNE](https://github.com/toeverything/AFFiNE)\n\n\n* Discord:Â [https://discord.gg/Arn7TqJBvG](https://discord.gg/Arn7TqJBvG)\n\n\n* Telegram:Â [https://t.me/affineworkos](https://t.me/affineworkos)\n\n\n\n\n\n\n\n\n",
  "publish": true
}