{
  "title": "How to Write a Marketing Action Plan: Step-by-Step Guide",
  "authors": [
    "Yiyang Zhang"
  ],
  "tags": [
    "Content"
  ],
  "description": "Learn the art of crafting an action plan in marketing, delve into the intricacies of a sales plan of action, and discover how to write an action plan that transforms goals into reality.",
  "created": 1709510400000,
  "updated": 1709510400000,
  "layout": "blog",
  "id": "QomvdKZmiYzGgs6CVRXgs",
  "slug": "how-to-write-marketing-action-plan-step-by-step-guide",
  "cover": "/blobs/imUI0xra8s2vsWZTHCkPoG8L1oq3mS-cil8h9Vrjgvs=",
  "md": "---\n\n\ntitle: \"How to Write a Marketing Action Plan: Step-by-Step Guide\"\n\n\nauthor: \"Yiyang Zhang\"\n\n\ntags: Content\n\n\nslug: how-to-write-marketing-action-plan-step-by-step-guide\n\n\ndescription: \"Learn the art of crafting an action plan in marketing, delve into the intricacies of a sales plan of action, and discover how to write an action plan that transforms goals into reality.\"\n\n\ncreated: 2024-03-04\n\n\nupdated: 2024-03-04\n\n\nlayout: blog\n\n\npublish: true\n\n\n---\n\n\n\n![imUI0xra8s2vsWZTHCkPoG8L1oq3mS-cil8h9Vrjgvs=](/blobs/imUI0xra8s2vsWZTHCkPoG8L1oq3mS-cil8h9Vrjgvs=)\n\n\nHave you found yourself grappling with the complexities of creating a robust marketing action plan?\n\n\nDo you feel the pressing need for a strategic roadmap to guide your brand to success?\n\n\nEnvision the possibilities that a well-executed marketing action plan can unlock. In a market saturated with cutthroat competition, lacking a clear plan is akin to navigating without a compass, risking the loss of countless opportunities. Join us now as we unveil the mysteries of strategic action plan in marketing, painting a vibrant future for your brand through a meticulously crafted marketing action plan.\n\n\nLet's craft a marketing action plan that goes beyond conventional wisdom and charts a course for unparalleled success. Welcome to a world of marketing brilliance!\n\n\n### **What is an Action Plan?**\n\n\nBefore we dive into the specifics of crafting a marketing action plan, it's crucial to understand what exactly constitutes an action plan. In the realm of marketing, an action plan is a detailed roadmap that delineates the specific steps and initiatives needed to attain marketing goals. At its core, an [action plan](https://affine.pro/blog/marketing-action-plan) for marketing is a strategic tool designed to translate vision into reality. It provides a detailed framework for executing strategies and initiatives, fostering a clear understanding of who does what, when, and how. It's the architectural blueprint of success, breaking down lofty goals into manageable tasks and transforming ambiguity into a sequence of concrete actions. Whether in the broader context of organizational management or specifically within the realm of marketing, it is the compass that guides the journey, ensuring that every step is purposeful, calculated, and resolutely aligned with success.\n\n\n### **Preparation of a Marketing Plan**\n\n\nThe foundation of a successful marketing action plan lies in the meticulous preparation of a comprehensive marketing plan. Here are the key steps and considerations to guide you through the whole [process](https://affine.pro/blog/top-10-best-process-mapping-tools-software-2023-free-paid):\n\n\n\n![nmDt31S4kShkigKxluzj-OzuDP9Mq_l2jUQrZc-EVws=](/blobs/nmDt31S4kShkigKxluzj-OzuDP9Mq_l2jUQrZc-EVws=)\n\n\n###### **1. Market Research and Analysis:**\n\n\n* Conduct thorough market research to understand industry trends, consumer behavior, and your competitors.\n\n\n* Analyze market data to identify opportunities and potential challenges that may impact your marketing strategy.\n\n\n###### **2. Clarify Business Objectives:**\n\n\n* Clearly define your overall business objectives and how your marketing efforts align with these goals.\n\n\n* Ensure that your marketing objectives are specific, measurable, achievable, relevant, and time-bound (SMART).\n\n\n###### **3. Target Audience Identification:**\n\n\n* Define your target audience by considering demographics, psychographics, and behavioral factors.\n\n\n* Understand the needs and preferences of your audience to tailor your marketing strategies effectively.\n\n\n###### **4. Budget Allocation:**\n\n\n* Determine the budget allocated to your marketing activities.\n\n\n* Break down the budget by marketing channels, such as digital advertising, content creation, or events.\n\n\n###### **5. Create a Content Strategy:**\n\n\n* Develop a content plan that aligns with your marketing [goals](https://affine.pro/blog/10-best-free-risk-assessment-templates-examples-2023).\n\n\n* Identify the types of content that resonate with your audience and contribute to your overall strategy.\n\n\nBy meticulously addressing these aspects during the preparation phase, you set the stage for a well-informed and effective marketing action plan. This groundwork ensures that your subsequent steps are aligned with your business objectives and geared toward achieving measurable success.\n\n\n### **Crafting Your Marketing Action Plan â€“ A Decisive Step-by-Step Guide**\n\n\nNow that you've fortified the groundwork in the preparation phase, it's time to translate your strategic insights into a powerful marketing action plan. This step-by-step guide is not a mere checklist; it's a roadmap that propels your business toward success with assertive and decisive actions.\n\n\n\n![dEOINMz-8Kpl0E1pyC2bMZH8c-aniHrZkFbLGa15J0E=](/blobs/dEOINMz-8Kpl0E1pyC2bMZH8c-aniHrZkFbLGa15J0E=)\n\n\n**Step 1: Define Your Objectives with Precision**\n\n\n* Revisit and refine your marketing objectives, ensuring they align seamlessly with your clarified business goals.\n\n\n* Be unambiguous in articulating what success looks like, setting the stage for a focused and results-driven action plan.\n\n\n**Step 2: Gain Insights from [SWOT](https://affine.pro/blog/top-10-free-editable-swot-analysis-template-examples)**\n\n\n* Build your SWOT analysis first when you decide to write your actionable strategies. Leverage strengths, address weaknesses, seize opportunities, and mitigate threats.\n\n\n* Each strategy should be a calculated move, amplifying your strengths and strategically countering any challenges.\n\n\n\n![1FsNNXBPVnYwOYKAMp7epdZ2qtgYE7aflC3p7_J4eDg=](/blobs/1FsNNXBPVnYwOYKAMp7epdZ2qtgYE7aflC3p7_J4eDg=)\n\n\n**Step 3: Tailor Strategies to Your Target Audience**\n\n\n* Your target audience is not a static entity; it's a dynamic force that evolves. Tailor your strategies to stay connected with their evolving preferences and needs.\n\n\n* Ensure that every aspect of your action plan resonates with and engages your audience on a personal level.\n\n\n**Step 4: Strategic Budget Allocation**\n\n\n* Your budget is a powerful tool; wield it strategically across the chosen marketing channels. Ensure that each channel receives the financial backing required for maximum impact.\n\n\n* Be proactive in monitoring and adjusting your budget allocations based on the performance of each channel.\n\n\n* Want to allocate your strategic budget? Try AFFiNE's [data analysis template](https://app.affine.pro/)!\n\n\n\n![pxnpIayxZgLGgKytkX3D6lekBUvTwpFujsRIfxysg2E=](/blobs/pxnpIayxZgLGgKytkX3D6lekBUvTwpFujsRIfxysg2E=)\n\n\n**Step 5: Develop Tactical KPIs**\n\n\n* Your KPIs should be more than indicators; they should be drivers of success. Refine and develop KPIs that provide clear insights into the effectiveness of your action plan.\n\n\n* Establish a system for real-time monitoring and adjustments to keep your marketing efforts on a trajectory toward success.\n\n\n**Step 6: Implement the Marketing Mix Dynamically**\n\n\n* Your marketing mix is not a static formula; it's a dynamic force that evolves with market trends and consumer behaviors. Implement it strategically, allowing for agility and adaptability.\n\n\n* Each element of the marketing mix should contribute dynamically to the overarching strategy, creating a harmonious and impactful marketing approach.\n\n\n* Try using AFFiNE's [4P marketing matrix template](https://app.affine.pro/) to improve your workflow!\n\n\n\n![dh-HozHxfUr9FGRipYRxuEHTzg57mT0Is9VF4lytRGQ=](/blobs/dh-HozHxfUr9FGRipYRxuEHTzg57mT0Is9VF4lytRGQ=)\n\n\n**Step 7: Reinforce Your USP Throughout**\n\n\n* Your Unique Selling Proposition (USP) is not a one-time announcement; it's the heartbeat of your brand. Reinforce it consistently across all communication channels.\n\n\n* Ensure that every piece of content, every campaign, and every interaction echoes the distinctive qualities that set your brand apart.\n\n\n**Step 8: Content Strategy as a Narrative Force**\n\n\n* Your content strategy is not just a schedule; it's a narrative that unfolds over time. Implement it as a force that engages, captivates, and builds a lasting connection with your audience.\n\n\n* Dynamically adjust your content strategy based on the evolving needs and feedback of your audience.\n\n\n**Step 9: Channel Selection as a Strategic Deployment**\n\n\n* Your chosen [marketing channels](https://affine.pro/blog/how-to-introduce-new-business-social-media-strategic-steps-examples) are not random choices; they are strategic deployments. Monitor and optimize their performance based on real-time data and insights.\n\n\n* Be agile in adjusting your channel selection to align with the shifting landscape of consumer behavior and market dynamics.\n\n\nIn this decisive step-by-step guide, you're not just crafting a marketing action plan; you're orchestrating a symphony of strategic moves that will resonate across your industry. Every step is a deliberate and assertive action, ensuring that your marketing efforts are not just effective but transformative. Remember, the success of your marketing action plan lies in the decisiveness of your execution.\n\n\n### **Create a Winning Marketing Action Plan in AFFiNE**\n\n\nCrafting an effective action plan for marketing is a strategic process that involves meticulous planning and execution. By following the step-by-step guide outlined above, you can create a winning marketing action plan tailored to your business needs. Remember, the success of your marketing endeavors lies in the precision and relevance of your plan of action. Start creating your impactful marketing action plan today with [**AFFiNE**](https://affine.pro/).\n\n\n\n\n\n<div style=\"text-align:center;\">\n<iframe width=\"560\" height=\"315\" src=\"https://www.youtube.com/embed/WqOe9HgpsDY?si=PHGuSeRbOT9GxuPO\" title=\"YouTube video player\" frameborder=\"0\" allow=\"accelerometer; autoplay; clipboard-write; encrypted-media; gyroscope; picture-in-picture; web-share\" allowfullscreen></iframe>\n</div>\n\n\n\n\n\nAFFiNE provides professionals with a unified platform that enables them to plan a knowledge base, collaborate with teammates, and develop content. This flexible tool empowers users to brainstorm, take notes, and set their goals while staying in sync and building content with blocks. The limitless workspace stimulates user-driven innovation. AFFiNE offers safe data storage, open-source benefits, and collaborative functionality. Users can visualize and connect information effortlessly, making writing an action plan an engaging and enjoyable experience.\n\n\n**Key features:**\n\n\n* **Template Gallery in AFFiNE:** There is a curated collection of powerful [whiteboard](https://affine.pro/blog/best-free-whiteboard-layout-ideas-organization) templates in AFFiNE. From the robust 4P marketing matrix to the insightful flowchart and the comprehensive SWOT, an array of additional templates awaits your exploration, promising to expand the horizons of your project planning and execution. These templates serve as your launchpad, enabling you to skip the groundwork and jump straight into action. Crafted for seamless collaboration, AFFiNE's templates provide structured canvases for various tasks, saving you valuable time and enhancing efficiency in project management, content creation, and [planning](https://affine.pro/blog/top-8-concept-map-templates-examples).\n\n\n\n![OP3GdbE7dwmQKK2uKzBgJbhpVJxkLuDsVtomxcggvSQ=](/blobs/OP3GdbE7dwmQKK2uKzBgJbhpVJxkLuDsVtomxcggvSQ=)\n\n\n* **Advanced Collaboration Capability:** When you do need to [collaborate](https://affine.pro/blog/top-asynchronous-communication-tools-free-2024) with other contributors to discuss your action plan, AFFiNE makes getting feedback simple. Appealing collaboration capability provides visibility into assigned tasks, making tables easier to estimate, and ensuring your marketing action plan remains well-designed. You can invite team members or friends to collaborate on writing your action plan together, making it perfect for the task assignment.\n\n\n\n![O88V12dZ7eALpdMD8-6eyyfRec5yZyWiQxCnvNEb3r0=](/blobs/O88V12dZ7eALpdMD8-6eyyfRec5yZyWiQxCnvNEb3r0=)\n\n\n* **Orchestrate and Showcase Your Marketing Action Plan:** Are you ready to take your presentations to the next level? Look no further than AFFiNE's interactive presentation tool, designed to help you create compelling plans that will leave a lasting impact on your audience. Don't settle for mediocrity - let us help you transform your marketing vision into a powerful statement of [collaboration](https://affine.pro/blog/10-best-free-performance-review-templates-examples-2023) and innovation. With unparalleled ease and versatility, a smooth presentation will make your ideas shine. Trust us to help you showcase your ideas with confidence and assertiveness!\n\n\n\n![gQL0hfT2Z_6tFdy9lTIIoC_t6T8EQtsjVgw-1V-acU4=](/blobs/gQL0hfT2Z_6tFdy9lTIIoC_t6T8EQtsjVgw-1V-acU4=)\n\n\nUpgrade your marketing skills, embrace the power of AFFiNE, and witness the transformative impact on your marketing abilities. Now that you have learned how to write an action plan for marketing, it's time to implement your knowledge. And what better way to do that than with **AFFiNE**? Commence action plan in marketing by using AFFiNE's user-friendly tool. **AFFiNE** has launched its [**Stable Version**](https://affine.pro/download), with ongoing efforts to develop a more comprehensive and dependable iteration. Join us on our voyage through our social media channels and be part of the experience. **Come and join us on our journey over on our media platforms. ðŸš€**\n\n\n* Official Website: [https://affine.pro/](https://affine.pro/)\n\n\n* GitHub: [https://github.com/toeverything/AFFiNE](https://github.com/toeverything/AFFiNE)\n\n\n* Discord: [https://discord.gg/Arn7TqJBvG](https://discord.gg/Arn7TqJBvG)\n\n\n* Twitter: [https://twitter.com/AffineOfficial](https://twitter.com/AffineOfficial)\n\n\n",
  "publish": true
}