{
  "title": "How to Write a Statement of Work (SOW): Definition, Free Template and Example",
  "authors": [
    "Yiyang Zhang"
  ],
  "tags": [
    "Content"
  ],
  "description": "Learn how to write your own statement of work for personal and business development. Discover the 5 top free templates to streamline your workflow.",
  "created": 1692144000000,
  "updated": 1692144000000,
  "layout": "blog",
  "id": "wZXN5dU-Si",
  "slug": "how-to-write-sow-definition-free-template-example",
  "cover": "/blobs/fELRkbL1EbjyMgdfUTNpjEzFFTTGXkqF5hr7Ub-AfO4=",
  "md": "---\n\n\ntitle: \"How to Write a Statement of Work (SOW): Definition, Free Template and Example\"\n\n\nauthor: Yiyang Zhang\n\n\ntags: Content\n\n\nslug: how-to-write-sow-definition-free-template-example\n\n\ndescription: Learn how to write your own statement of work for personal and business development. Discover the 5 top free templates to streamline your workflow.\n\n\ncreated: 2023-08-16\n\n\nupdated: 2023-08-16\n\n\nlayout: blog\n\n\npublish: true\n\n\n---\n\n\nAre you tired of project misunderstandings and scope creep?\n\n\nDo you wish there was a way to clearly define the expectations, deliverables, and timelines for your work?\n\n\nDon't look any further!\n\n\nIn this article, we will unravel the secrets of creating an effective statement of work (SOW) that ensures smooth collaborations and successful outcomes. Whether you're a freelancer, contractor, or project manager, mastering the art of writing an SOW is essential. So grab your laptop and get ready to learn how to create a powerful SOW with the help of five incredible tools that will elevate your [project management](https://affine.pro/blog/free-lessons-learned-templates-for-project-management) game.\n\n\n### What is a Statement of Work (SOW)\n\n\nA statement of work (SOW) is a crucial document that outlines the **scope**, **objectives**, **deliverables**, and **[timeline](https://affine.pro/blog/how-to-create-timeline-template-google-docs-step-by-step-guide)** of a project. It serves as a formal agreement between two parties-usually a client and a service provider or contractor. Think of it as a [roadmap](https://affine.pro/blog/5-best-free-tools-agile-roadmap-templates-2023) that guides the entire project from start to finish.\n\n\n\n![fELRkbL1EbjyMgdfUTNpjEzFFTTGXkqF5hr7Ub-AfO4=](/blobs/fELRkbL1EbjyMgdfUTNpjEzFFTTGXkqF5hr7Ub-AfO4=)\n\n\nFor the team, no matter how complex or straightforward it is, a well-organized statement of work will aid in having everyone work towards the same outcome with a better understanding of their roles.\n\n\n### How to Write a Statement of Work: Step-by-Step Guide\n\n\nWhen it comes to writing a statement of work (SOW) there are a few key steps you should follow to ensure clarity and thoroughness. By using the right tools and techniques, you can create an effective SOW that clearly outlines project objectives, deliverables, [timelines](https://affine.pro/blog/how-to-create-timeline-template-google-docs-step-by-step-guide), and expectations.\n\n\n**Step1: Define the purpose/goals of the project**\n\n\n\n![8qacqoWH3shlRoszVO8cUFtn9Q5FO6AGaRVSGeTft_g=](/blobs/8qacqoWH3shlRoszVO8cUFtn9Q5FO6AGaRVSGeTft_g=)\n\n\nClearly state what needs to be accomplished and why it is important. This will provide a solid foundation for your SOW. An introduction provides a quick overview of the project's people, **goals**, and work. Just make a high-level summary to reference what the document is about.\n\n\n**Step2: Outline the specific tasks**\n\n\n\n![F7AhEpoRoWvJimiiRSMZCY2Mx1Ilg7CMXdXlSY79oqY=](/blobs/F7AhEpoRoWvJimiiRSMZCY2Mx1Ilg7CMXdXlSY79oqY=)\n\n\nTasks or activities that need to be completed within the project. Be as detailed as possible in describing each task so that there is no ambiguity. Don't be afraid to be as **specific** as possible in the task section, since this section defines the work you'll perform. Your scope of work is more important than you can imagine!\n\n\n**Step3: Add any dependencies or constraints**\n\n\n\n![g4z-M0I217lCQ07mOgT08WS1GmJ53lVdm-EcOzZLpfw=](/blobs/g4z-M0I217lCQ07mOgT08WS1GmJ53lVdm-EcOzZLpfw=)\n\n\n**Constraints** that may impact the project timeline or budget. It's essential to address these upfronts to avoid any surprises down the line. Provide a detailed breakdown of the client's budget for this project, along with your pricing per deliverable. Try to add the estimated costs and pricing terms to your SOW.\n\n\n**Step4: Establish clear milestones**\n\n\n\n![ht7FqdJbttO8dimtc4aGhUakjBait0Fdqv2EdrOB95E=](/blobs/ht7FqdJbttO8dimtc4aGhUakjBait0Fdqv2EdrOB95E=)\n\n\nClarify your deliverables and create **milestones** throughout the project timeline. This will help track progress and keep everyone on schedule. Here you can include any additional terms or requirements that do not fit in any other category, also your project schedule or weekly tracker.\n\n\nBy following these guidelines and using the right tools like AFFiNE excellent in SOWs writing, you can streamline your process and produce high-quality statements of work in no time!\n\n\n### 5 Free Templates that Complement Your Statement of Work\n\n\nIn addition to understanding the key components and guidelines for writing an effective statement of work, utilizing templates can streamline the process and ensure consistency. Here are five top free SOW templates that you to enhance your statement of work writing capability:\n\n\n**1.AFFiNE Comprehensive Statement of Work**\n\n\n\n![VljJMizxjo6eui-NVsMuNQ0qdCebq8pSliB-A3mYot0=](/blobs/VljJMizxjo6eui-NVsMuNQ0qdCebq8pSliB-A3mYot0=)\n\n\n**AFFiNE's comprehensive statement of work template** helps you clearly define the scope of your project, including deliverables, timelines, resources, and milestones. It provides a well-structured format to outline project objectives and expectations, ultimately [streamline your workflow](https://affine.pro/blog/top-free-workflow-temlplates-to-consider).\n\n\n**2.AFFiNE Scope Statement of Work Template**\n\n\n\n![Kd72WGrDllAOe_OSksA_k1NZEecn6XqvJ3bn-IcMNmE=](/blobs/Kd72WGrDllAOe_OSksA_k1NZEecn6XqvJ3bn-IcMNmE=)\n\n\nWith **AFFiNE's scope of work template**, you can launch successful client projects. This user-friendly template defines your commitments, helping you align with all stakeholders.\n\n\n**3.AFFiNE Operational Statement of Work Template**\n\n\n\n![MD9baXnFYp3L_jOeOdli0DyEv8DcAgNgAbuQ0CtqIjM=](/blobs/MD9baXnFYp3L_jOeOdli0DyEv8DcAgNgAbuQ0CtqIjM=)\n\n\n**AFFiNE operational statement of work template** is perfect for capturing essential information like project goals and objectives, the scope of services provided by the consultant/agency team structure, and payment terms if you're outsourcing consulting services or engaging with external consultants or agencies.\n\n\n**4.[ProjectManager](https://www.projectmanager.com/) Free Statement of Work for Word**\n\n\n\n![HUDsKa845zKWwW6cJ7xZNXctjCe_D05J-ciWCgQnBcQ=](/blobs/HUDsKa845zKWwW6cJ7xZNXctjCe_D05J-ciWCgQnBcQ=)\n\n\n**Project Manager statement of work for word** is available to any project leader in any business that can easily outline the details of a project and get everyone on the same page. In order to ensure that all parties are aware of what is needed to execute the project, an equipment list asks for essential information like project background.\n\n\n**5**.**[ClickUp](https://clickup.com/) Employment Agreement Template**\n\n\n\n![HWUGe4fjAYpDXUvPV4m1ItwphD28Tl4XIYN9UpsfPEw=](/blobs/HWUGe4fjAYpDXUvPV4m1ItwphD28Tl4XIYN9UpsfPEw=)\n\n\n**ClickUp Employment Agreement statement of work template** boasts spaces for inserting specific dates, parties involved, and company services, you can easily personalize each contract. The agreement outlines employee rights, roles, and responsibilities, as well as the company's obligations and assurances.\n\n\nIncorporating these templates into your workflow not only ensures accuracy, but also provides a consistent format across projects, resulting in better organization, fewer misunderstandings, and ultimately greater success.\n\n\n### Well begin with AFFiNE\n\n\nWhether you're embarking on a new project, hiring external vendors or consultants, to have an effective working relationship, it's crucial to create a well-defined statement of work. Put together your own statement of work today!\n\n\n\n![oGr_xp3WYpqHMUc5_zIe6RiJH6UMR9iNRJ3p1Ha1g7s=](/blobs/oGr_xp3WYpqHMUc5_zIe6RiJH6UMR9iNRJ3p1Ha1g7s=)\n\n\nBy using **[AFFiNE](https://affine.pro/)**, you can develop consistent project aspects, improve collaboration, and enhance speed with scalable options. You can improve visibility into varying priorities, hold your team and yourself accountable, streamline your workflow and eliminate gaps in your project.\n\n\n**Key features:**\n\n\n* **[Database](https://affine.pro/blog/affine-070-launch-week-day3):** Easily create, organize, and track your daily tasks like never before. Say goodbye to complex processes and welcome an unprecedented ease-of-use way.\n\n\n\n![wzNppJMgVjC8ThVR9TlhVkPu5OXTEsEsqnuv-Xmrr0g=](/blobs/wzNppJMgVjC8ThVR9TlhVkPu5OXTEsEsqnuv-Xmrr0g=)\n\n\n* **On-page function:** With the On-page function, you can easily hide specific notes on the Edgeless mode when switching to page mode with just a single click.\n\n\n\n![ZETGazT_BPkhNQd63eLKwKik3ebNScmlrNx6njd0aBo=](/blobs/ZETGazT_BPkhNQd63eLKwKik3ebNScmlrNx6njd0aBo=)\n\n\n* **Advanced collaboration capabilities:** By using AFFiNE Cloud, you can invite friends or colleagues to become collaborators in your workspace, engage in real-time multi-person editing, and share your workspaces with others.\n\n\n\n![p9ySusThmGhH7x0N2YHd1GUMekL_tCzsAloL7EMYtI4=](/blobs/p9ySusThmGhH7x0N2YHd1GUMekL_tCzsAloL7EMYtI4=)\n\n\nWith careful planning and utilizing appropriate tools, you can write an exceptional statement of work that serves as a roadmap towards successful project completion! AFFiNE is free to try! Currently, AFFiNE has released its [stable version](https://affine.pro/download), but we are continuing to build to a more feature-rich and stable build. **Come and join us on our journey over on our media platforms.**\n\n\n* Official Website: [https://affine.pro/](https://affine.pro/)\n\n\n* GitHub: [https://github.com/toeverything/AFFiNE](https://github.com/toeverything/AFFiNE)\n\n\n* Discord: [https://discord.gg/Arn7TqJBvG](https://discord.gg/Arn7TqJBvG)\n\n\n* Twitter: [https://twitter.com/AffineOfficial](https://twitter.com/AffineOfficial)\n\n\n",
  "publish": true
}