{
  "title": "How to Write Your Own Standard Operating Procedure (SOP): A Step-by-Step Guide with 5 Best Free Tools [Templates & Examples]",
  "authors": [
    "Xuan Pang"
  ],
  "tags": [
    "Content"
  ],
  "description": "Learn how to write your own SOP with our comprehensive step-by-step guide. Discover the 5 best free tools and templates to streamline your SOP creation process.",
  "created": 1687132800000,
  "updated": 1725235200000,
  "layout": "blog",
  "id": "HjkiLeslWH",
  "slug": "how-to-write-sop-step-by-step-guide-5-best-free-tools-templates",
  "cover": "/blobs/bacK8uqdPlrVCcS8HiIouvXU0teVM5IzzR139H2gwak=",
  "md": "---\n\n\ntitle: \"How to Write Your Own Standard Operating Procedure (SOP): A Step-by-Step Guide with 5 Best Free Tools [Templates & Examples]\"\n\n\nauthor: Xuan Pang\n\n\ntags: Content\n\n\nslug: how-to-write-sop-step-by-step-guide-5-best-free-tools-templates\n\n\ndescription: Learn how to write your own SOP with our comprehensive step-by-step guide. Discover the 5 best free tools and templates to streamline your SOP creation process.\n\n\ncreated: 2023-06-19\n\n\nupdated: 2024-09-02\n\n\nlayout: blog\n\n\npublish: true\n\n\n---\n\n\n\n![bacK8uqdPlrVCcS8HiIouvXU0teVM5IzzR139H2gwak=](/blobs/bacK8uqdPlrVCcS8HiIouvXU0teVM5IzzR139H2gwak=)\n\n\nAre you **facing** **challenges** in maintaining consistency and standardization in your business processes?\n\n\nDo you often encounter errors, delays, or misunderstandings due to **unclear instructions**?\n\n\nAre you **struggling to train** new employees efficiently and ensure they follow established protocols?\n\n\n**If so**, these can be effectively addressed by implementing SOP documents. SOPs help streamline operations, minimize errors, enhance productivity, improve training processes, and ensure compliance with industry standards.\n\n\nIn this article, we are going to guide you through the process of **writing your own SOPs** and empower you with the **5 best free softwares**, along with several **useful [SOP templates](https://affine.pro/templates/standard-operating-procedure-template) and examples** to simplify the SOP creation process and enhance your productivity.\n\n\n## **What is an SOP document?**\n\n\nAn SOP document, short for [Standard Operating Procedure](https://affine.pro/templates/standard-operating-procedure-template), is a detailed written guide that **outlines the step-by-step instructions to** **perform a specific task or process within an organization**. It serves as a reference tool for employees, ensuring consistency, efficiency, and adherence to established protocols. SOP documents provide clear instructions, rules, and guidelines to help employees carry out their duties effectively, maintain quality standards, and ensure compliance with industry regulations. By documenting best practices and standardizing procedures, SOPs contribute to improved productivity, streamlined operations, and enhanced overall performance.\n\n\n### **Benefits of SOP Documents:**\n\n\n\n![IQYfGTo5vU8QSAROHMl4sSjK8n_j9-PmHVtK3lzKhWk=](/blobs/IQYfGTo5vU8QSAROHMl4sSjK8n_j9-PmHVtK3lzKhWk=)\n\n\n1. Consistency and Standardization: SOPs ensure that tasks and processes are consistently performed according to established standards, reducing errors and promoting uniformity in operations.\n\n\n1. Increased Efficiency: SOPs provide clear instructions and guidelines, helping employees carry out their tasks more efficiently, reducing time wastage, and optimizing workflow.\n\n\n1. Training and Onboarding: SOPs serve as valuable training resources for new employees, enabling them to quickly grasp procedures and perform their roles effectively, ensuring a smooth onboarding process.\n\n\n1. Compliance and Risk Management: SOPs ensure compliance with industry regulations, safety standards, and legal requirements, minimizing risks, maintaining regulatory compliance, and mitigating liabilities.\n\n\n## [**SOP**](https://affine.pro/templates/standard-operating-procedure-template) **[Templates](https://affine.pro/templates/standard-operating-procedure-template) & Examples：**\n\n\n**1.Employee Onboarding:** A crucial SOP that outlines the process of welcoming and integrating new employees into the organization. It includes steps for paperwork completion, orientation sessions, and introductions to key team members, ensuring a smooth transition and alignment with company policies and culture.\n\n\n\n![lGy_yVJJxPQdhRtFJk9sKaCrRIDQLtwgSsWwnVkqsQ4=](/blobs/lGy_yVJJxPQdhRtFJk9sKaCrRIDQLtwgSsWwnVkqsQ4=)\n\n\n**2.Quality Control:** An essential SOP that defines the procedures and guidelines for conducting quality checks on products or services. It ensures consistency, adherence to quality standards, and the identification of any deviations or defects, helping maintain customer satisfaction and brand reputation.\n\n\n\n![E26Hs0Z8k9Y3FMZ5y9C45gPbmcm-ltOyKMeRtvf0BMo=](/blobs/E26Hs0Z8k9Y3FMZ5y9C45gPbmcm-ltOyKMeRtvf0BMo=)\n\n\n**3.Project Management:** A widely used SOP that encompasses the entire project lifecycle, from initiation to closure. It provides a structured approach to planning, executing, and monitoring projects, ensuring clear roles, responsibilities, and timelines, resulting in improved project outcomes and effective resource utilization.\n\n\n\n![Pt0eWCGvhbo4VO-r7zyHfU_lnGqd6y8C8XS6MobUhf4=](/blobs/Pt0eWCGvhbo4VO-r7zyHfU_lnGqd6y8C8XS6MobUhf4=)\n\n\n## **Steps for Writing an Effective SOP:**\n\n\n\n![90ky6yeSevNm_B4N2srqbcugNozxKD1B9dvLO838SiU=](/blobs/90ky6yeSevNm_B4N2srqbcugNozxKD1B9dvLO838SiU=)\n\n\n1. **Identify the Process**: Determine which process or task you want to document with an SOP. Clearly define the scope and objectives of the process.\n\n\n1. **Gather Information:** Collect all the relevant information about the process. This may include observing the process in action, interviewing subject matter experts, reviewing existing documentation, and analyzing data.\n\n\n1. **Define the Steps:** Break down the process into clear and logical steps. Start with the initial step and continue sequentially until the final step. Ensure that each step is specific, actionable, and easy to understand.\n\n\n1. **Document Procedures:** Write detailed instructions for each step of the process. Include the necessary information, such as tools, resources, inputs, outputs, and any safety or quality considerations. Use clear and concise language.\n\n\n1. **Review and Revise:** Share the draft SOP with relevant stakeholders, such as process owners, managers, and employees involved in the process. Gather feedback and make revisions as necessary to ensure accuracy and clarity.\n\n\n1. **Formatting and Standardization:** Format the SOP document in a consistent and user-friendly manner. Use headings, subheadings, numbering, and bullet points to organize the content. Ensure that the document follows the organization's SOP template and style guidelines.\n\n\n1. **Approval and Implementation:** Obtain approval from the appropriate authority or department responsible for SOPs. Communicate the finalized SOP to the relevant individuals or teams, and ensure that they understand and follow the documented procedures.\n\n\n1. **Periodic Review and Updates:** SOPs should be regularly reviewed and updated to reflect any changes in the process, technology, regulations, or best practices. Set a schedule for reviewing and updating SOPs to ensure their relevance and effectiveness.\n\n\nNow, are you ready to create your own SOP document? Look no further! We are going to introduce you to the 5 best free SOP tools that will revolutionize the way you develop and manage your standard operating procedures.\n\n\n## **SOP Software Recommendations:**\n\n\n### 1.AFFiNE\n\n\n\n![u1YZ5Hb-l-HTl5a0MY6D4KwbWFwKpNnz0rvyNrQ8_5Q=](/blobs/u1YZ5Hb-l-HTl5a0MY6D4KwbWFwKpNnz0rvyNrQ8_5Q=)\n\n\nAFFiNE is a next-gen knowledge base that brings planning, sorting, and creating all together in the [workspace](https://affine.pro/blog/best-5-google-workspace-alternatives-features-price). It offers a range of powerful features that enhance productivity, with its fantastic whiteboard being a standout feature.\n\n\nAFFiNE also provides [SOP Templates](https://affine.pro/templates/standard-operating-procedure-template) for users. At the template page, just click Use this template, you can start to build your own\n\n\n**Key features:**\n\n\n1. **Local first approach**: One of the key strengths of AFFiNE is its support for offline working. This means you can create and work on your SOPs at any time, even when you don't have an internet connection. This flexibility allows you to capture your ideas and thoughts whenever inspiration strikes, ensuring that no brilliant idea goes to waste. Additionally, AFFiNE prioritizes data security, keeping your information safe and private. You can download the stable version and give it a shot.\n\n\n1. **Free, Privacy First, and Open-Source**: AFFiNE is available as a free tool, making it accessible to anyone who wants to boost their productivity with SOPs. It prioritizes privacy, ensuring that your data remains secure and confidential. Furthermore, as an open-source platform, AFFiNE provides the advantage of customization. Users have the freedom to tailor the tool to their specific needs and preferences, enhancing the overall user experience. Try it online: AFFiNE：There can be more than Notion and Miro.\n\n\n1. Shifting between two modes: You start in the whiteboard, freely connecting and arranging your thoughts, creating a visual representation of your SOPs. However, as you delve deeper into a particular subtopic, you realize the need to capture more detailed information. This is where shifting to page mode becomes beneficial, which allows you edit the detailed information in a more linear manner by shifting to page mode. More surprisingly, AFFiNE can also allow you to insert Database into the SOPs! This versatility allows you to explore your ideas in both a high-level overview and granular detail, ensuring a comprehensive representation of your thoughts. (See examples below)\n\n\n\n![StWGRrwOLZfnC7iVQOo1x9rhsP34VGVw8ySYAmAVjMk=](/blobs/StWGRrwOLZfnC7iVQOo1x9rhsP34VGVw8ySYAmAVjMk=)\n\n\n\n![A5b_ca3uGBVXBfZipIXHXCgzDmMQkbpNvOgJrj66VeU=](/blobs/A5b_ca3uGBVXBfZipIXHXCgzDmMQkbpNvOgJrj66VeU=)\n\n\nFor more things related to AFFiNE, come and check out the website: [AFFiNE — All In One KnowledgeOS](http://affine.pro/)\n\n\n## 2.ClickUp\n\n\n\n![KBxqAeJudlIJDI3f-YPI5c4BT0LNz4aqy6_QF5LH7UE=](/blobs/KBxqAeJudlIJDI3f-YPI5c4BT0LNz4aqy6_QF5LH7UE=)\n\n\nClickUp is a powerful project management and collaboration tool that allows teams to streamline their workflows and stay organized. With ClickUp, teams can effectively manage their SOP development process and ensure smooth communication and collaboration.\n\n\nKey features:\n\n\n1. Task Management: ClickUp offers robust task management capabilities, allowing you to create, assign, and track tasks related to your SOPs. You can set due dates, add attachments, create checklists, and set dependencies to ensure smooth workflow management.\n\n\n1. Document Collaboration: With ClickUp, you can collaborate with team members in real-time on SOP documents. Multiple users can simultaneously edit and comment on the same document, fostering collaboration and ensuring everyone stays on the same page.\n\n\n1. Workflow Automation: ClickUp provides automation features to streamline your SOP processes. You can automate repetitive tasks, trigger actions based on specific events, and set up custom workflows to enhance efficiency and productivity.\n\n\n\n![DWWUsHnSouYmPIWsIVBrn4oPWcWgYapeSOk63JRGu8w=](/blobs/DWWUsHnSouYmPIWsIVBrn4oPWcWgYapeSOk63JRGu8w=)\n\n\n### 3.Microsoft Word:\n\n\n\n![RkDmolIfmPBWvKFe_347owh98CVolDe911ZBYPEQLrs=](/blobs/RkDmolIfmPBWvKFe_347owh98CVolDe911ZBYPEQLrs=)\n\n\nMicrosoft Word is a widely used word processing software that provides a comprehensive set of tools for creating and editing documents. It offers advanced formatting options, templates, and collaboration features that make it a popular choice for creating SOPs. With Microsoft Word, you can easily structure and format your SOPs and collaborate with team members on the same document.\n\n\nKey features:\n\n\n1. Formatting and Styling Options: Microsoft Word offers a wide range of formatting and styling options to create visually appealing SOPs. You can customize fonts, colors, headings, and apply styles to ensure consistency throughout the document.\n\n\n1. Template Library: Microsoft Word provides a rich collection of SOP templates that you can use as a starting point for creating your own. These templates offer predefined sections and formatting, making it easier to structure your SOPs.\n\n\n1. Track Changes and Comments: Collaborative editing in Microsoft Word allows users to track changes made to the document and add comments. This feature facilitates review processes, enabling team members to provide feedback and suggestions for improvement.\n\n\n\n![K_qoKMcHOh56YQsetDKatQbBjySnw9ZEYlLBkSm8llI=](/blobs/K_qoKMcHOh56YQsetDKatQbBjySnw9ZEYlLBkSm8llI=)\n\n\n#### 4.Nuclino\n\n\n\n![7O03YjymbALI8bur05QwQnQ1AfWMn5LnwtkzoGg0bZU=](/blobs/7O03YjymbALI8bur05QwQnQ1AfWMn5LnwtkzoGg0bZU=)\n\n\nKey features:\n\n\n1. Real-time Collaboration: Nuclino enables real-time collaboration, allowing multiple users to work on SOPs simultaneously. You can see changes in real-time and communicate with team members through comments and mentions, promoting effective collaboration.\n\n\n1. Document Organization: Nuclino provides a hierarchical organization structure for documents, allowing you to create folders, subfolders, and pages to categorize your SOPs. This makes it easier to navigate and find relevant documents as your SOP library grows.\n\n\n1. Rich Content Editor: The rich content editor in Nuclino allows you to add various elements to your SOPs, including text, images, videos, tables, and code snippets. This flexibility allows you to create comprehensive and visually appealing SOP documents.\n\n\n\n![5X9QeWRj1NO-8UtaL77xUP7Vw21qoD2jfa7XdggCA0w=](/blobs/5X9QeWRj1NO-8UtaL77xUP7Vw21qoD2jfa7XdggCA0w=)\n\n\n### 5.Google Docs\n\n\n\n![hvngN4W5AZB8RHHjWznuUJukK0NQgO4wlyyE_jhcWrE=](/blobs/hvngN4W5AZB8RHHjWznuUJukK0NQgO4wlyyE_jhcWrE=)\n\n\nKey features:\n\n\n1. Cloud-based Collaboration: Google Docs operates entirely in the cloud, enabling seamless collaboration among team members. Multiple users can edit a document simultaneously, and changes are automatically saved in real-time.\n\n\n1. Version History: Google Docs keeps track of version history, allowing you to review and restore previous versions of your SOPs. This feature provides an audit trail and allows you to revert back to earlier versions if needed.\n\n\n1. Integration with Google Workspace: Google Docs integrates with other Google Workspace applications, such as Google Drive, Google Sheets, and Google Slides. This integration facilitates easy access to related documents, data, and presentations for comprehensive SOP development.\n\n\n\n![bLOCfmkvG81LElHEaoyZhmipenDMjlMNG2v8vxbe7uw=](/blobs/bLOCfmkvG81LElHEaoyZhmipenDMjlMNG2v8vxbe7uw=)\n\n\nConclusionWriting effective SOPs is crucial for businesses to ensure standardized procedures, improved productivity, and consistent outcomes. By following the step-by-step guide provided in this article, you can confidently create SOPs tailored to your organization's needs.\n\n\nAdditionally, leveraging the right tools can greatly enhance your SOP development process. We have explored some of the best free tools available, including AFFiNE, ClickUp, Microsoft Word, Nuclino, and Google Docs. These tools offer a range of features to simplify the creation, collaboration, and management of SOPs.\n\n\nParticularly, AFFiNE has released its stable version, but we are continuing to build to a more feature-rich and stable build. Come and join us on our journey over on our media platforms.\n\n\n* Official Website: [https://affine.pro/](https://affine.pro/)\n\n\n* GitHub: [https://github.com/toeverything/AFFiNE](https://github.com/toeverything/AFFiNE)\n\n\n* Discord: [https://discord.gg/Arn7TqJBvG](https://discord.gg/Arn7TqJBvG)\n\n\n* Telegram: [https://t.me/affineworkos](https://t.me/affineworkos)\n\n\n",
  "publish": true
}