{
  "title": "How to Write the Best Agile Project Charter Template to Streamline Your Workflow in 2024",
  "authors": [
    "Yiyang Zhang"
  ],
  "tags": [
    "Content"
  ],
  "description": "Unevil the magic behind crafting a project charter that will streamline your workflow with AFFiNE.",
  "created": 1691366400000,
  "updated": 1704153600000,
  "layout": "blog",
  "id": "_rCNqH_79z",
  "slug": "how-to-write-best-agile-project-charter-template-streamline-your-workflow-2023",
  "cover": "/blobs/OxcYQh1RYsAsGMiLiE7qKcyKYpGhK0Yku_dl_F72OCw=",
  "md": "---\n\n\ntitle: \"How to Write the Best Agile Project Charter Template to Streamline Your Workflow in 2024\"\n\n\nauthor: Yiyang Zhang\n\n\ntags: Content\n\n\nslug: how-to-write-best-agile-project-charter-template-streamline-your-workflow-2023\n\n\ndescription: Unevil the magic behind crafting a project charter that will streamline your workflow with AFFiNE.\n\n\ncreated: 2023-08-07\n\n\nupdated: 2024-01-02\n\n\nlayout: blog\n\n\npublish: true\n\n\n---\n\n\n\n![OxcYQh1RYsAsGMiLiE7qKcyKYpGhK0Yku_dl_F72OCw=](/blobs/OxcYQh1RYsAsGMiLiE7qKcyKYpGhK0Yku_dl_F72OCw=)\n\n\nIn today's fast-paced business environment, teams are increasingly adopting agile methodologies to stay competitive and deliver projects more efficiently. And at the heart of every successful agile project lies where agile project charter templates come to your rescue! These ready-to-use templates not only save you time but also ensure that you include all the crucial elements required for [streamlined workflow](https://affine.pro/blog/best-free-task-management-software-streamline-workflow).\n\n\n\n![foR2FxhFJxPLs90vVe1wor3RTqyEUhObOAnaGwiAOlI=](/blobs/foR2FxhFJxPLs90vVe1wor3RTqyEUhObOAnaGwiAOlI=)\n\n\nLook no further! In this article, we will dive into the world of agile project charter templates and understand how AFFiNE helps your agenda to be easily well-organized. Get ready to explore how the agile project charter template can revolutionize your approach to managing projects in 2024.\n\n\n### What is a Project Charter?\n\n\nA project charter is a **must-have** document to set the cornerstone of any project. It should provide a succinct overview of objectives, scope and responsibilities to get the approval from key stakeholders. The charter will act as a **guide** throughout the whole project, helping teams clarify their goals and stay on track. This brief but powerful pitch is essential to ensure the success of your journey.\n\n\n### Elements to Include in a Project Charter\n\n\n When it comes to creating a project charter, there are several key elements that should be included to ensure its effectiveness in guiding your agile workflow. These elements serve as the building blocks for a successful project and help set clear expectations among team members and [boost their productivity](https://affine.pro/blog/top-5-google-docs-alternatives-pkm).\n\n\n\n![vdRRpUVQ_hakqV_9S9_t968gdFB_iPoOksYi-NanWMg=](/blobs/vdRRpUVQ_hakqV_9S9_t968gdFB_iPoOksYi-NanWMg=)\n\n\n1. **Project Description**: Begin by providing a concise overview of the project, including its purpose, objectives, and scope.\n\n\n1. **Stakeholders**: Identify all individuals or groups who have an interest in or will be affected by the project.\n\n\n1. **Deliverables**: Outline the specific outputs or products that will be produced as part of the project.\n\n\n1. **Timeline**: Provide a high-level timeline indicating major milestones and deadlines throughout the duration of the project, utimately enhance your time management.\n\n\n1. **Resources**: Identify the people, tools, equipment, and budget required to complete the project successfully.\n\n\n1. **Communication** **Plan**: Specify how information will flow within the team and with stakeholders throughout different stages of the project lifecycle.\n\n\n### Why Use an Agile Project Charter Template?\n\n\nAgile project management has gained popularity in recent years due to its flexibility and adaptability. While you may wonder why use a template for this purpose, there are several compelling reasons.\n\n\n\n![eVg_6hSPt9Yd4eK3rzlqqIfmgHTbucKto_AmsFcg1xM=](/blobs/eVg_6hSPt9Yd4eK3rzlqqIfmgHTbucKto_AmsFcg1xM=)\n\n\n* **Save time and effort**. Templates provide a pre-defined structure for documenting key information, such as project objectives, scope, stakeholders, and success criteria.\n\n\n* **Ensure consistency across projects**. Following a standardized format ensures that all necessary elements are included in the charter every time.\n\n\n* **A guide for creating comprehensive charters**. They prompt users to consider important aspects of the project upfront, such as risks and dependencies.\n\n\n* **Encourages collaboration within teams**. Provide a shared document that everyone can contribute to.\n\n\nIncorporating an agile project charter will set clear expectations from the beginning while aligning all stakeholders towards common goals. **So** **why wait**? Choose the best tool to help you create an agile project charter template today and [streamline](https://affine.pro/blog/free-event-planning-templates-for-professsional-2023) your workflow like never before!\n\n\n### How to Easily Write Your Own Project Charter Template with AFFiNE\n\n\nWhen it comes to writing a project charter, there are several key elements that you need to include in order to ensure its [effectiveness](https://affine.pro/blog/best-free-word-processor-software-2023-alternatives-microsoft).\n\n\n**Step 1: Clearly define the project's objectives and goals**\n\n\nThis will help set direction for the entire project and keep everyone focused on what needs to be achieved.\n\n\n\n![Ud2KDyUC35GkTL54e5V-xOp65yl-MIAk7EjMv2LOyss=](/blobs/Ud2KDyUC35GkTL54e5V-xOp65yl-MIAk7EjMv2LOyss=)\n\n\n**Step 2: Identify the stakeholders involved in the project**\n\n\nStakeholders can include team members, sponsors, or any other individuals who have an interest or influence over the project.\n\n\n\n![DMJkLkYYMce0S4L9oc9Qxetxj0U5AfP1LOzJUUFK6y8=](/blobs/DMJkLkYYMce0S4L9oc9Qxetxj0U5AfP1LOzJUUFK6y8=)\n\n\n**Step 3: Outlining the scope of work**\n\n\nThis includes defining what will be delivered as part of the project and what will not be included. It's important to establish clear boundaries from the start to avoid scope creep later on.\n\n\n\n![Q8nA7PGpoGuxnR_0uiEtWSx7bp4rcfxSXeDiclgVl1U=](/blobs/Q8nA7PGpoGuxnR_0uiEtWSx7bp4rcfxSXeDiclgVl1U=)\n\n\n**Step 4: Create a timeline with milestones and deadlines.**\n\n\nThis helps create accountability and allows for proper planning and resource allocation.\n\n\n\n![fREBSjXlnx7q_2SqPBVbqBOqiPL14SEllDq_dK-VW1A=](/blobs/fREBSjXlnx7q_2SqPBVbqBOqiPL14SEllDq_dK-VW1A=)\n\n\n**Step 5: Outline any risks or challenges**\n\n\nBy addressing potential obstacles proactively, you can develop contingency plans and mitigate risks as they arise.\n\n\n\n![Bt9Id2QGanGNA3gNNj8OdDz1QhHurf0JeIAEPtFF9DA=](/blobs/Bt9Id2QGanGNA3gNNj8OdDz1QhHurf0JeIAEPtFF9DA=)\n\n\nBy following these guidelines to create your own [template](https://affine.pro/blog/5-best-free-tools-agile-roadmap-templates-2023) easily and utilizing this agile project charter template as a starting point, you can streamline your workflow in 2024 and set yourself up for success!\n\n\nBut wait, not over yet. Want to see AFFiNE new features? They will be of great help to the writing of your project charter templates!\n\n\nAFFiNE's Brilliant Features:\n\n\n**1.Powerful Database:**\n\n\nWith just one click, you are able to transform your text into structured tables, organizing information for visual appeal. Say goodbye to the hassle of manually inputting your text, cell by cell, into the database.\n\n\n\n![wzNppJMgVjC8ThVR9TlhVkPu5OXTEsEsqnuv-Xmrr0g=](/blobs/wzNppJMgVjC8ThVR9TlhVkPu5OXTEsEsqnuv-Xmrr0g=)\n\n\n**2.On-page Function - Display or Hide your Note in Page Mode:**\n\n\n\n![ZETGazT_BPkhNQd63eLKwKik3ebNScmlrNx6njd0aBo=](/blobs/ZETGazT_BPkhNQd63eLKwKik3ebNScmlrNx6njd0aBo=)\n\n\n**3.Blockslicer - Divide and Organize Your Notes with Ease:**\n\n\nModularizing the content contributes to the clarity of structure. To provide you with enhanced customization options, AFFiNE has a pair of scissors that allows you to divide your project charter templates into as many pieces as you desire, opening up more possibilities for the layout of edgeless mode.\n\n\n\n![3TFGwfygZi1ykMGTGdJOvICIyYvtWg3FW-z7bKEVDhM=](/blobs/3TFGwfygZi1ykMGTGdJOvICIyYvtWg3FW-z7bKEVDhM=)\n\n\n**4.Real-time Collaboration:**\n\n\nWith AFFiNE Cloud, you can invite your team members to collaborate in real-time within a shared workspace. This feature tackles common challenges faced by teams, making your collaborative work smoother and more efficient. Communicate instantly, share ideas, and make decisions in real-time, fostering seamless discussions that boost productivity. Say goodbye to conflicts and delays as you work together on a single document simultaneously and say hello to [your streamlined workflow](https://affine.pro/blog/best-free-task-management-software-streamline-workflow).\n\n\n\n![p9ySusThmGhH7x0N2YHd1GUMekL_tCzsAloL7EMYtI4=](/blobs/p9ySusThmGhH7x0N2YHd1GUMekL_tCzsAloL7EMYtI4=)\n\n\n### Get started with AFFiNE\n\n\nWe have explored how to write agile project charter templates available to help you get started on your next venture. By following our guidelines throughout the process, you will be well-equipped to navigate any challenges that come along during your projects.\n\n\nSo don't delay! Start utilizing an agile project charter today, take control of your projects, and propel them towards success in 2024!\n\n\nWith its task, [workflow](https://affine.pro/blog/top-free-workflow-temlplates-to-consider), resource, time, and document management capabilities, AFFiNE is the perfect project charter management tool to create templates that boost your productivity. Currently, AFFiNE has released its stable version, but we are continuing to build to a more feature-rich and stable build. **Come and join us on our journey over on our media platforms.**\n\n\n* Official Website: [https://affine.pro/](https://affine.pro/)\n\n\n* GitHub: [https://github.com/toeverything/AFFiNE](https://github.com/toeverything/AFFiNE)\n\n\n* Discord: [https://discord.gg/Arn7TqJBvG](https://discord.gg/Arn7TqJBvG)\n\n\n* Twitter: [https://twitter.com/AffineOfficial](https://twitter.com/AffineOfficial)\n\n\n",
  "publish": true
}