{
  "title": "How To Create A Flowchart In Google Docs - Step By Step Guide",
  "authors": [
    "Xuan Pang"
  ],
  "tags": [
    "Content"
  ],
  "description": "Discover the power of flowchart creation in Google Docs with our step-by-step guide. Unlock even more possibilities with five incredible tools that enhance your flowcharting experience.",
  "created": 1686009600000,
  "updated": 1709510400000,
  "layout": "blog",
  "id": "ksKW58JHqj",
  "slug": "how-to-create-flowchart-google-docs-step-by-step-guide",
  "cover": "/blobs/DoR4DrY9J4smE1wQNcFKcWAvXLUIa-yR4z0N2kZDo0w=",
  "md": "---\n\n\ntitle: \"How To Create A Flowchart In Google Docs - Step By Step Guide\"\n\n\nauthor: Xuan Pang\n\n\ntags: Content\n\n\nslug: how-to-create-flowchart-google-docs-step-by-step-guide\n\n\ndescription: Discover the power of flowchart creation in Google Docs with our step-by-step guide. Unlock even more possibilities with five incredible tools that enhance your flowcharting experience.\n\n\ncreated: 2023-06-06\n\n\nupdated: 2024-03-04\n\n\nlayout: blog\n\n\npublish: true\n\n\n---\n\n\n\n![DoR4DrY9J4smE1wQNcFKcWAvXLUIa-yR4z0N2kZDo0w=](/blobs/DoR4DrY9J4smE1wQNcFKcWAvXLUIa-yR4z0N2kZDo0w=)\n\n\nFlowcharts have become indispensable tools for effectively communicating complex processes and streamlining workflows. And when it comes to creating flowcharts, Google Docs provides a user-friendly and collaborative platform that is accessible to everyone. In this step-by-step guide, we'll **take you on a journey through the world of flowchart creation in Google Docs**, demystifying the process and empowering you to create professional and visually appealing diagrams.\n\n\nBut wait, there's more! Alongside exploring Google Docs' built-in drawing tools, we'll **introduce you to five amazing tools** that can elevate your flowcharting game. These tools offer advanced features, customization options, and seamless integrations, enabling you to take your flowcharts to the next level of visual excellence.\n\n\n## **What is a Flowchart?**\n\n\nFlowcharts are **visual representations** that provide a graphical overview of processes, workflows, or systems. They use symbols and arrows to depict the sequence of steps and decision points involved in a particular process. Flowcharts offer a clear and concise way to communicate complex ideas, making them invaluable tools in various fields, from project management and software development to education and problem-solving.\n\n\n## **Benefits of Using Flowcharts**\n\n\n1. Enhanced Clarity and Understanding: Flowcharts break down complex processes into easily digestible steps, making it simpler for individuals to grasp the overall structure and flow of a system. By presenting information visually, flowcharts facilitate better comprehension and reduce confusion.\n\n\n1. Improved Communication and Collaboration: Flowcharts serve as a common language that bridges gaps in understanding among team members or stakeholders. They enable effective communication of ideas, processes, and requirements, fostering collaboration and alignment towards shared goals.\n\n\n1. Streamlined Workflows and Processes: Flowcharts help identify bottlenecks, inefficiencies, and redundancies within a workflow. By visualizing the entire process, you can analyze and optimize it for improved efficiency, resource allocation, and time management.\n\n\n1. Problem Solving and Decision Making: Flowcharts enable systematic problem-solving by breaking down complex issues into smaller, manageable components. They provide a framework for decision-making, allowing individuals or teams to evaluate different scenarios and determine the best course of action.\n\n\n**Common Flowchart Symbols:**\n\n\nFlowcharts utilize a set of standardized symbols to represent specific actions, decisions, and connections. Some of the commonly used symbols include:\n\n\n1. Start/End Symbol: Represented by a rounded rectangle, it denotes the beginning or end of a process or workflow.\n\n\n1. Process Symbol: Displayed as a rectangle, it signifies a specific action or task within the overall process.\n\n\n1. Decision Symbol: Shaped as a diamond, it represents a branching point where a decision needs to be made. The flowchart follows different paths based on the outcome of the decision.\n\n\n1. Connector Symbol: Shown as a small circle, it indicates the continuation of the flowchart on another page or section.\n\n\n1. Input/Output Symbol: Displayed as a parallelogram, it represents data or information entering or exiting the process.\n\n\n1. Looping Symbol: Depicted as a curved arrow or oval, it represents a loop or repetition within the flowchart.\n\n\n## **Flowchart Examples**\n\n\n**Flowchart Example 1: Order Processing**\n\n\nThis flowchart demonstrates the process of order processing in a company. It showcases the steps involved from receiving an order to delivering the product to the customer.\n\n\n\n![QdcgNOlAq02_buc8Oa_Xp8KVzJDsFT1mvbUfpSfy1i8=](/blobs/QdcgNOlAq02_buc8Oa_Xp8KVzJDsFT1mvbUfpSfy1i8=)\n\n\n**Flowchart Example 2: Decision Making**\n\n\nThis flowchart illustrates a decision-making process, where a series of choices leads to different outcomes. It shows how decisions are made based on specific conditions or criteria.\n\n\n\n![5g7v_LwYrJF0hQy1VgxVXKj9wyKbrJadnbqZm9le_tU=](/blobs/5g7v_LwYrJF0hQy1VgxVXKj9wyKbrJadnbqZm9le_tU=)\n\n\n**Flowchart Example 3: Software Development Lifecycle**\n\n\nThis flowchart represents the various stages involved in the software development lifecycle, including requirements gathering, design, coding, testing, and deployment. It showcases sequential steps and interactions between different teams or individuals.\n\n\n\n![g_C3O2zbYAQ6B5IJHYNqaaChAuGtBMZhUKo26a4A3lc=](/blobs/g_C3O2zbYAQ6B5IJHYNqaaChAuGtBMZhUKo26a4A3lc=)\n\n\n**Flowchart Example 4: Project Management**\n\n\nThis flowchart outlines the project management process, from project initiation to completion. It visualizes the key milestones, tasks, dependencies, and decision points throughout the project lifecycle.\n\n\n\n![GFwHp_qZwLnT5yAmDcB7D_U2P94glIb9XVDaE2hCuvc=](/blobs/GFwHp_qZwLnT5yAmDcB7D_U2P94glIb9XVDaE2hCuvc=)\n\n\n**Flowchart Example 5: Troubleshooting**\n\n\nThis flowchart demonstrates a troubleshooting process, where a series of questions and actions lead to identifying and resolving an issue. It provides a systematic approach to problem-solving and decision-making.\n\n\n\n![2AMu9jiHBStHL6oYzxMJ1Gkqkzdzk61fdvUyEna6xss=](/blobs/2AMu9jiHBStHL6oYzxMJ1Gkqkzdzk61fdvUyEna6xss=)\n\n\nThese examples showcase the versatility and applicability of flowcharts in various domains. They serve as visual representations that simplify complex processes and aid in understanding, communication, and decision-making.\n\n\n## **Step-by-Step Guide: Creating Flowcharts in Google Docs**\n\n\n### **Step 1. Choose A Google Document**\n\n\nYou can sign in and open a new Google Document through docs.google.com, click the \"Blank\" button on the left side. A blank Google Document will be opened.\n\n\n\n![QDmQkGNL3i8uo8GBphnJH8CfhpZ9P-BPk1l3OeRSKO8=](/blobs/QDmQkGNL3i8uo8GBphnJH8CfhpZ9P-BPk1l3OeRSKO8=)\n\n\n### **Step 2. Open Drawing Tool**\n\n\nClick the \"Insert\" option, find \"Drawing\", then click on \"+ New\". A window for the drawing will appear over the Google Document.\n\n\n\n![j3BCGY66U-6MLSX-H5Qsf9rIwBGgmWDqObwzaZj92S0=](/blobs/j3BCGY66U-6MLSX-H5Qsf9rIwBGgmWDqObwzaZj92S0=)\n\n\nAll basic elements are available in the Shape tool. The Shape tool's icon is a circle and square. Click on that, select shapes in flowchart; you can see all the options.\n\n\n\n![JnhoUtvqX79WPyBGXhI6YQDt85ranFEaZa7Who30eMQ=](/blobs/JnhoUtvqX79WPyBGXhI6YQDt85ranFEaZa7Who30eMQ=)\n\n\nIf you want to know the symbols' functions, point the mouse to one, and the text will appear.\n\n\n### **Step 3. Select Flowchart Shapes**\n\n\nSelect the shapes from the Shape menu bar. Begin with selecting the terminal symbol and continue with other shapes for other steps. Drag the shape you choose to the drawing canvas.\n\n\n\n![kjBaLCv5fye9A17c4F3cXf5M7NmT8uDFBjmp_hCvBwc=](/blobs/kjBaLCv5fye9A17c4F3cXf5M7NmT8uDFBjmp_hCvBwc=)\n\n\nYou can adjust the shape's size by pulling on any small square around the shape. Copy-paste the same symbol if needed.\n\n\nMake the shapes in flowchart with different colors by clicking on the Fill color icon and choosing the color from the chart.\n\n\n### **Step 4. Add Arrows**\n\n\nArrows help to connect patterns. Click on the Line tool and choose any arrows you want from the drop-down menu to add arrows.\n\n\n\n![h5tesN3Sfj3Qoh50783grv5ubS6JC3mKrqEl0aR2c68=](/blobs/h5tesN3Sfj3Qoh50783grv5ubS6JC3mKrqEl0aR2c68=)\n\n\n### **Step 5. Input Texts**\n\n\nFrom the drawing panel, click on the text icon, which is the letter T. You can now type the content into each shape.\n\n\nClick on the three dots on the toolbar; other options for formatting the text will come up, such as font, size, color, etc. Select the one you want. Copy-paste text will retain the format.\n\n\n### **Step 6. Save And Close**\n\n\nAfter finishing, press on the Save and Close button, it will be added to your Google Document. Double click on the flowchart; it will appear again for further edit or changes.\n\n\n**And there you have it! Your very own flowchart created in Google Docs!**\n\n\nBut thatâ€™s not all, here are two of its most challenging limitations:\n\n\n* **Inconvenient offline work**\n\n\n  * Google Docs provides convenient accessibility through a web browser, allowing users to work from anywhere with an internet connection. Moreover, Google offers Drive software for Chrome and a Drive desktop program, enabling offline access to Drive files, including Doc files. However, it's crucial to plan ahead and configure Drive for offline use, selecting the specific files you wish to access offline.\n\n\n  * Failure to do so may result in the inability to use Docs offline. It's important to note that while you can access and view previously created flowcharts offline, the creation of new flowcharts without an internet connection poses a limitation. Flowcharts in Google Docs rely on the save button, meaning that **creating flowcharts from scratch offline may present challenges without a Wi-Fi connection**.\n\n\n*  **Not designed for flowcharts**\n\n\n  * While Google Docs is primarily designed for creating and sharing documents like Microsoft Word, it does have the capability to display basic flowcharts. However, it lacks built-in flowchart templates and a simplified shapes tool, which **limits flowchart possibilities and user experience**.\n\n\n  * To create flowcharts in Google Docs, users often resort to copying and pasting shapes to replicate their work. This manual process can be **tedious and time-consuming**, especially for complex charts. Unfortunately, this workaround is not ideal and can hinder the efficiency and convenience of creating intricate flowcharts.\n\n\n## **Top 5 alternative flowcharts maker:**\n\n\nTo address the limitations mentioned above, we have curated a list of the five most popular tools, allowing you to overcome the challenges faced when creating flowcharts in Google Docs. These tools offer advanced features and functionalities that enhance the flowcharting experience and provide a seamless alternative to manual copying and pasting of shapes.\n\n\n### 1.AFFiNE\n\n\n<div style=\"text-align:center;\">\n<iframe width=\"560\" height=\"315\" src=\"https://www.youtube.com/embed/WqOe9HgpsDY?si=PHGuSeRbOT9GxuPO\" title=\"YouTube video player\" frameborder=\"0\" allow=\"accelerometer; autoplay; clipboard-write; encrypted-media; gyroscope; picture-in-picture; web-share\" allowfullscreen></iframe>\n</div>\n\n\n\n\n\nAFFiNE is a next-gen knowledge base that brings planning, sorting, and creating all together in the [workspace](https://affine.pro/blog/best-5-google-workspace-alternatives-features-price). It offers a range of powerful features that enhance productivity, with its fantastic whiteboard being a standout feature.\n\n\n**Key features:**\n\n\n* Local first approach: One of the key strengths of AFFiNE is its support for offline working. This means you can create and work on your workflows at any time, even when you don't have an internet connection. This flexibility allows you to capture your ideas and thoughts whenever inspiration strikes, ensuring that no brilliant idea goes to waste. Additionally, AFFiNE prioritizes data security, keeping your information safe and private. You can download the stable version and give it a shot.\n\n\n* Shifting between two modes: You start in the whiteboard, freely connecting and arranging your thoughts, creating a visual representation of your workflow. However, as you delve deeper into a particular subtopic, you realize the need to capture more detailed information. This is where shifting to page mode becomes beneficial, which allows you edit the detailed information in a more linear manner by shifting to page mode. More surprisingly, AFFiNE can also allow you to insert Database in the workflow! This versatility allows you to explore your ideas in both a high-level overview and granular detail, ensuring a comprehensive representation of your thoughts.\n\n\n\n![bL2PFYO49ml8N2s6USqX3kt1JAppxDjwGZg7XY-m9r8=](/blobs/bL2PFYO49ml8N2s6USqX3kt1JAppxDjwGZg7XY-m9r8=)\n\n\n\n![lKADFTxuW5zkjUSotpWx3pK1X97SvTkXLen0oPg3big=](/blobs/lKADFTxuW5zkjUSotpWx3pK1X97SvTkXLen0oPg3big=)\n\n\n* Free, Privacy First, and Open-Source: AFFiNE is available as a free tool, making it accessible to anyone who wants to boost their productivity with workflows. It prioritizes privacy, ensuring that your data remains secure and confidential. Furthermore, as an open-source platform, AFFiNE provides the advantage of customization. Users have the freedom to tailor the tool to their specific needs and preferences, enhancing the overall user experience. [Try it online](https://app.affine.pro/workspace/H6vffRmJbCfA-r3kq_36_/all).\n\n\n### 2.**ClickUp**\n\n\n\n![zI5nBNDlxheO1dJ2peGN9qM8w5zjh512sR2yp14PHSI=](/blobs/zI5nBNDlxheO1dJ2peGN9qM8w5zjh512sR2yp14PHSI=)\n\n\nClickUp is an all-in-one productivity platform that teams of all sizes and across industries rely on to **manage projects, create complex flowcharts, and optimize their processes with the entire team**. Whether youâ€™re a solopreneur or part of a large-scale enterprise team, ClickUp is flexible enough to align with any workflowâ€”no matter what project style you use.\n\n\n**Key features:**\n\n\n1. Task Creation and Assignment:ClickUp empowers you to effortlessly create and assign tasks to multiple team members. By prioritizing tasks based on their importance, you ensure that your team knows which tasks to focus on first. This efficient system helps streamline workflows and boosts productivity.\n\n\n1. Effortless Workflow Updates:Updating workflow details, attaching files, and modifying formatting is made simple with ClickUp's intuitive interface. By using the /slash command, you can access a menu of shortcuts and helpful commands. This feature allows for swift task customization and seamless collaboration.\n\n\n1. Real-time Communication:ClickUp recognizes the importance of effective team communication. With their in-app chat functionality, you can easily add comments and tag team members, facilitating real-time discussions and updates. This fosters a collaborative environment where everyone stays informed and connected.\n\n\n\n![xoYFjWsaKnTYPzVFO39u6JfEFE7OYG12vJB2LQ7hF2I=](/blobs/xoYFjWsaKnTYPzVFO39u6JfEFE7OYG12vJB2LQ7hF2I=)\n\n\n### 3.**Lucidchart**\n\n\n\n![0OjiTZWFV5ZmUnX9D2BjmA5dIWwKD05DnkzWu5Z_pu0=](/blobs/0OjiTZWFV5ZmUnX9D2BjmA5dIWwKD05DnkzWu5Z_pu0=)\n\n\nLucidchart is the intelligent diagramming application that empowers teams to clarify complexity, align their insights, and build the futureâ€”faster. With this intuitive, cloud-based solution, everyone can work visually and collaborate in real time while building flowcharts, mockups, UML diagrams, and more.\n\n\nKey features:\n\n\n1. Intelligent diagramming: In Google Drawings, every shape and line must be drawn individually, which takes more time and can leave your flowchart looking unpolished. The visual workspace was built for better diagrammingâ€”drag and drop shapes and use auto-prompts and guides to build faster and keep shapes aligned.\n\n\n1. 1,000+ templates: Google Drawings requires you to start from scratch. In Lucidchart, you can browse through a full template library, including flowcharts for various use cases. Lucidchart also contains extensive shape libraries, so you can create mind maps, Venn diagrams, UML diagrams, and other visuals beyond flowcharts.\n\n\n1. Ability to share outside of Google Docs: When you create a flowchart using Google Drawings, it stays in Google Docs. With Lucidchart, you'll create a document that you can share directly with collaborators or include within other popular apps, such as Slack, Confluence, Google Slides, and Google Sheets. Alternatively, if you already have data in Google product, such as Google Sheet, you can also create a flowchart directly in Google Sheets.\n\n\n### **Zen Flowchart**\n\n\n\n![AEgZD9RpIvuUGNKiUxqDfYFucx_333MA8zdWSo0Dd8A=](/blobs/AEgZD9RpIvuUGNKiUxqDfYFucx_333MA8zdWSo0Dd8A=)\n\n\nZen Flowchart is an online tool to create flowcharts as well as other graphic elements. It is marketed as the simplest online software to create flowcharts, organizational charts, process charts, sitemaps, and more. The minimal and intuitive user interface is easy to use. The free flowchart maker also has export and publish features, so you can share your work.\n\n\n**Key features:**\n\n\n1. Minimal and Intuitive Interface: The interface of Zen Flowchart is designed to be minimalistic and easy to navigate. You don't need extensive training or prior experience to start using the tool effectively. Its simplicity allows you to focus on the content and structure of your flowchart without any distractions.\n\n\n1. 1-Click Styling: Zen Flowchart simplifies the process of customizing the appearance of your flowchart. With just one click, you can apply different styles to shapes, including colors, text formatting, and line styles. This feature saves you time and effort in manually adjusting each element, giving your flowchart a polished and professional look.\n\n\n1. Drag and Drop Interface: Zen Flowchart offers a user-friendly drag and drop interface, allowing you to easily create flowcharts by selecting and placing shapes onto the canvas. This feature eliminates the need for manual drawing and makes the process intuitive and efficient.\n\n\n\n![s9KT6Gx4QIHIZESdmv6O4WkpVkBvBGmwaejCn8d4vmk=](/blobs/s9KT6Gx4QIHIZESdmv6O4WkpVkBvBGmwaejCn8d4vmk=)\n\n\n### 5.**Wondershare Mockitt**\n\n\nWondershare Mockitt is a reliable online prototyping tool used by UI/UX developers and beginners to make simple flowcharts and much more. The main benefit of this tool is that any user can create interactive prototyping without any experience. You can create a flowchart online without writing a single line of code.\n\n\n**Key features:**\n\n\n1. Interactive Prototyping: Wondershare Mockitt allows you to create interactive prototypes with ease. You can add interactive elements like buttons, links, and transitions to simulate the user experience and showcase the flow of your design.\n\n\n1. Collaboration and Teamwork: Wondershare Mockitt enables seamless collaboration and teamwork. Multiple team members can work together on the same project, making real-time edits, providing feedback, and leaving comments. This promotes efficient collaboration and ensures everyone is on the same page.\n\n\n1. Pre-designed Templates and Assets: The platform provides a vast collection of pre-designed templates and UI assets, including icons, buttons, forms, and more. These ready-to-use resources help you kickstart your design process and maintain consistency across your prototypes.\n\n\n\n![oE3mVxrKCiM6Xe8937WNf7XVCZ9ZOUeb0jmNEG3hXts=](/blobs/oE3mVxrKCiM6Xe8937WNf7XVCZ9ZOUeb0jmNEG3hXts=)\n\n\n**Conclusion**\n\n\nWhile Google Drawing is a viable option for creating flowcharts, it does have its limitations. Fortunately, there are alternative tools available that offer additional features and functionalities to enhance your flowcharting experience. By considering the tools mentioned above, such as AFFiNE, Lucidchart, and Zen Flowchart, etc. You can find the perfect fit for your flowcharting needs.\n\n\nAFFiNE has released its [stable version](https://affine.pro/blog/whats-new-affine-0601), but we are continuing to build to a more feature-rich and stable build. Come and join us on our journey over on our media platforms.\n\n\n* Official Website: [https://affine.pro/](https://affine.pro/)\n\n\n* GitHub: [https://github.com/toeverything/AFFiNE](https://github.com/toeverything/AFFiNE)\n\n\n* Discord: [https://discord.gg/Arn7TqJBvG](https://discord.gg/Arn7TqJBvG)\n\n\n* Telegram: [https://t.me/affineworkos](https://t.me/affineworkos)\n\n\n",
  "publish": true
}