{
  "title": "How to Introduce Your New Business on Social Media (Strategic Steps & Examples)",
  "authors": [
    "Yuhang Zhao"
  ],
  "tags": [
    "Content"
  ],
  "description": "Unlock the secrets to a successful new business introduction on social media with our comprehensive guide. Gain strategic insights, practical tips, real-life examples, and optimal solutions for crafting compelling promotional materials. Elevate your online presence and ensure a impactful launch for your venture.",
  "created": 1704326400000,
  "updated": 1704326400000,
  "layout": "blog",
  "id": "6M_PQYxv1TRiQBZ04o7V9",
  "slug": "how-to-introduce-new-business-social-media-strategic-steps-examples",
  "cover": "/blobs/nasHbgTdzcURACs81TYKwqzAMTyV2FWxqUXfIqre8Js=",
  "md": "---\n\n\ntitle: \"How to Introduce Your New Business on Social Media (Strategic Steps & Examples)\"\n\n\nauthor: \"Yuhang Zhao\"\n\n\ntags: Content\n\n\nslug: how-to-introduce-new-business-social-media-strategic-steps-examples\n\n\ndescription: \"Unlock the secrets to a successful new business introduction on social media with our comprehensive guide. Gain strategic insights, practical tips, real-life examples, and optimal solutions for crafting compelling promotional materials. Elevate your online presence and ensure a impactful launch for your venture.\"\n\n\ncreated: 2024-01-04\n\n\nupdated: 2024-01-04\n\n\nlayout: blog\n\n\npublish: true\n\n\n---\n\n\n\n\n\n\n![nasHbgTdzcURACs81TYKwqzAMTyV2FWxqUXfIqre8Js=](/blobs/nasHbgTdzcURACs81TYKwqzAMTyV2FWxqUXfIqre8Js=)\n\n\nAfter weeks, months, or even years of relentless dedication, have you reached the pivotal moment â€“ the launch of your new business? Are you excited to share this significant milestone with the world, especially within online communities? Consider this: with nearly 60% of people worldwide actively engaged in social media, spending an average of two and a half hours daily, can you afford to overlook this critical arena for business promotion? Whether initiating a startup, introducing a new product, or revealing a rebrand, isn't it evident that crafting an effective social media launch strategy is absolutely paramount?\n\n\nNow, take action! This article will guide you on how to strategically introduce your new business on social media, offering practical tips, examples, and the optimal solutions for creating compelling promotional materials.\n\n\n# Why You Need to Introduce Your New Business on Social Media?\n\n\n* **Enhanced Visibility:** Social media platforms provide a broad audience, increasing the exposure of your new business to potential customers.\n\n\n* **Brand Recognition:** An introduction on social media helps establish and reinforce your brand identity, contributing to better brand recall.\n\n\n* **Direct Engagement:** Social media facilitates direct interaction with your audience, creating a sense of community and fostering connections with potential customers.\n\n\n* **Market Insights**: Utilizing social media for business introductions allows for valuable market research through feedback and comments, aiding in refining your offerings.\n\n\n* **Cost-Effective Marketing**: Social media offers a cost-effective marketing solution, enabling startups to reach a wide audience without substantial financial investment.\n\n\n# How to Introduce Your New Business on Social Media: Strategic Steps\n\n\n### 1. Define Your Brand [Story](https://affine.pro/blog/free-best-8-storyboard-templates-examples):\n\n\nBegin your social media introduction with a compelling narrative that breathes life into your business. Clearly articulate who you are, the inspiration behind your venture, and what makes it stand out. This story serves as the cornerstone, connecting emotionally with your audience and setting the stage for your brand's identity.\n\n\n### 2. Choose the Right Platforms:\n\n\n\n![ZAPa_Dny9jw54utNuNkL7FdWLjIaZpY23SbzsCIgQJs=](/blobs/ZAPa_Dny9jw54utNuNkL7FdWLjIaZpY23SbzsCIgQJs=)\n\n\nSelecting the right social media platform for introducing your new business is essential as each platform caters to different demographics and content preferences. Here's a breakdown of key platforms and their suitability for various scenarios:\n\n\n**[Twitter](https://twitter.com/AFFiNEOfficial)**\n\n\n* **Scenario**: Effective for real-time updates, announcements, and engaging in conversations.\n\n\n* **Strengths**: Quick dissemination of information; excellent for trends and discussions.\n\n\n* **Features**: Short, concise tweets; retweets and likes drive visibility.\n\n\n* **Demographic**: Diverse user base; popular for news, trends, and customer service.\n\n\n\n![sci6KZVgYz0iVgfks5KO_L1xXpzMJZlnqUaqB017chE=](/blobs/sci6KZVgYz0iVgfks5KO_L1xXpzMJZlnqUaqB017chE=)\n\n\n**[TikTok](https://www.tiktok.com/@affineofficial?_t=8ikRzdOW4JK&_r=1)**\n\n\n* **Scenario**: Appropriate for businesses targeting a younger, more trend-oriented audience.\n\n\n* **Strengths**: Short-form video content; engages with trending challenges.\n\n\n* **Features:** Duets, challenges, and a creative community.\n\n\n* **Demographic**: Predominantly younger users; ideal for viral and entertaining content.\n\n\n\n![-tsbHyg2fox-4pQiUgXIyMfS53zzrlVq2KbfjG8ZogQ=](/blobs/-tsbHyg2fox-4pQiUgXIyMfS53zzrlVq2KbfjG8ZogQ=)\n\n\n\n\n\n**[Facebook](https://www.facebook.com/business/tools/facebook-pages/get-started)**\n\n\n\n![FyJ6QXI7wAQwbgjOlZnUiSKcXjPE8bM7Als6RDwUabw=](/blobs/FyJ6QXI7wAQwbgjOlZnUiSKcXjPE8bM7Als6RDwUabw=)\n\n\n* **Scenario**: Versatile for various business types; great for community building.\n\n\n* **Strengths**: Broad audience reach; supports diverse content types (text, images, videos).\n\n\n* **Features**: Business pages, groups, events, and advertising options.\n\n\n* **Demographic**: Widespread demographic, but especially popular among older age groups.\n\n\n\n\n\n**[LinkedIn](https://www.linkedin.com/company/toeverything/mycompany/)**\n\n\n\n![sRYb_FlshUxjHAsmud7weCHXobHu2vRcozMgk8QYwic=](/blobs/sRYb_FlshUxjHAsmud7weCHXobHu2vRcozMgk8QYwic=)\n\n\n* **Scenario**: Best suited for B2B businesses and professional services.\n\n\n* **Strengths**: Professional networking; effective for thought leadership and industry insights.\n\n\n* **Features**: Company pages, networking opportunities, and publishing articles.\n\n\n* **Demographic**: Business professionals, decision-makers, and job seekers.\n\n\n\n\n\n**[YouTube](https://www.youtube.com/@affinepro/videos)**\n\n\n\n![I_PK49hkBjHpPQql8vTFvbAFHhKcbyjG8yLB5I9quq0=](/blobs/I_PK49hkBjHpPQql8vTFvbAFHhKcbyjG8yLB5I9quq0=)\n\n\n* **Scenario**: Suited for businesses with in-depth or tutorial content.\n\n\n* **Strengths**: Video-centric; great for storytelling, tutorials, and product demonstrations.\n\n\n* **Features**: Channel subscriptions, video playlists, and advertising options.\n\n\n* **Demographic**: Diverse user base; caters well to educational and entertainment content.\n\n\n\n\n\n**[Instagram](https://www.instagram.com/)**\n\n\n* **Scenario:** Ideal for businesses with visually appealing products or services.\n\n\n* **Strengths**: Visual-centric platform; best for lifestyle, fashion, beauty, and creative industries.\n\n\n* **Features**: Emphasis on high-quality images and videos; Stories and IGTV for immersive content.\n\n\n* **Demographic**: Primarily younger audience; excellent for brand aesthetics and storytelling.\n\n\n\n![xdmGem8e2uztGLMdX1zIoWVNBEtXDjsc6czwCWD6flI=](/blobs/xdmGem8e2uztGLMdX1zIoWVNBEtXDjsc6czwCWD6flI=)\n\n\n\n\n\n**[Snapchat](https://www.snapchat.com/)**\n\n\n\n![TZ6Xxpqo30bFUZ1enqQRAPdvaqLNqyfA3CA9E6FO8qI=](/blobs/TZ6Xxpqo30bFUZ1enqQRAPdvaqLNqyfA3CA9E6FO8qI=)\n\n\n* **Scenario**: Effective for businesses targeting a younger, more tech-savvy audience.\n\n\n* **Strengths**: Short-lived content; emphasizes real-time sharing.\n\n\n* **Features**: Stories, filters, and geotags for interactive content.\n\n\n* **Demographic**: Youthful user base; suitable for creative and spontaneous promotions.\n\n\nDepending on your business type and target audience, a cross-platform strategy may be beneficial. For instance, using Instagram for visually engaging content, Facebook for community building, and LinkedIn for professional networking can create a comprehensive online presence catering to a diverse audience. Analyzing user behavior and preferences on each platform is crucial for an effective and tailored social media introduction strategy.\n\n\n\n\n\n### 3. Create Engaging [Visuals](https://affine.pro/blog/affine-0-10-0-launch-week-day-1-lightening-up-visual-experience):\n\n\nCraft visually appealing graphics and videos that embody your brand. Consistency in design, incorporating your logo and color scheme, fosters brand recognition across platforms. Visual content should not only capture attention but also convey your brand's personality and values.\n\n\n\n\n\n### 4. Craft a Catchy Announcement Post:\n\n\nCompose a concise and compelling announcement post that communicates the essence of your business. Clearly state the purpose, product or service offering, and the unique value proposition. Incorporate a call-to-action, encouraging followers to share, like, and visit your website for more information.\n\n\n### 5. Engage Your Audience:\n\n\nActively engage with your audience by responding promptly to comments and messages. Foster interaction through polls, questions, or challenges to build a sense of community around your brand. Meaningful engagement not only strengthens your online presence but also cultivates a loyal following.\n\n\n\n\n\n### 6. Leverage Influencers or Partnerships:\n\n\nCollaborate with influencers or establish partnerships within your industry to amplify your launch. Utilize their reach and credibility to broaden your audience and build trust. Featuring testimonials or endorsements further enhances your brand's credibility and authenticity.\n\n\n\n\n\n# [AFFiNE](https://affine.pro): Your Ultimate Partner in Introducing Your New Business\n\n\n\n\n\n<div style=\"text-align:center;\">\n\n\n<iframe width=\"560\" height=\"315\" src=\"https://www.youtube.com/embed/3cfeKOufZWU?si=IiXDIdwfnM2Z7KPL\" title=\"YouTube video player\" frameborder=\"0\" allow=\"accelerometer; autoplay; clipboard-write; encrypted-media; gyroscope; picture-in-picture; web-share\" allowfullscreen></iframe>\n\n\n</div>\n\n\n\n\n\nAFFiNE is a versatile editor that lets you write, [draw](https://affine.pro/blog/affine-0-10-0-launch-week-day-4-5-write-draw-plan-present-collaboratively-anywhere), plan, and present all in one place. Easily capture detailed information about your new business using the page mode, allowing for straightforward document editing. Efficiently organize your projects by using a [database](https://affine.pro/blog/affine-0-11-0-launch-day-3-beyond-text-color-history-table-of-content-possibilities) to keep track of deadlines, assign responsibilities, and effortlessly [manage project progress](https://affine.pro/blog/10-best-free-smart-sheet-alternatives-for-project-management-2023). Take advantage of AFFiNE's powerful whiteboard feature to brainstorm ideas with your team. Moreover, craft visually appealing posters about your business for seamless publication and display on different social media platforms. AFFiNE offers a user-friendly platform for comprehensive business management and seamless [team collaboration](https://affine.pro/blog/top-asynchronous-communication-tools-free-2024).\n\n\n### Craft Your Brand Narrative with AFFiNE's [Storyboard Template](https://affine.pro/blog/free-best-8-storyboard-templates-examples)\n\n\nAFFiNE's Storyboard template tackles the challenge of transforming complex ideas into compelling narratives. Tailored for directors, marketers, innovators, and creative thinkers, it provides a structured approach to visual storytelling. This tool ensures your [vision](https://affine.pro/blog/8-free-printable-vision-board-templates-examples-2023) gains clarity, resonating with precision and impact, perfectly aligning with your target demographic's needs.\n\n\n\n![PaLYChg2Tortp9Gu2H87xp8DhkELl7kC_aN-C8ac0AI=](/blobs/PaLYChg2Tortp9Gu2H87xp8DhkELl7kC_aN-C8ac0AI=)\n\n\n\n\n\n### Explore Edgeless Creativity with a Whiteboard\n\n\nUnlock the full spectrum of your creative potential through our dynamic whiteboard. Boasting essential features like a plethora of colors, [diverse font options](https://affine.pro/blog/docs-edgeless-stylized-embody-your-creativity-better-and-easier), shapes, and connectors, this powerful tool is designed to elevate your creative process. Seamlessly upload images in various formats and utilize the extensive collection of styles and templates to further amplify your creativity. Transform your ideas into compelling business posters with unparalleled ease and versatility!\n\n\n\n![cXPfaH7yGKuxN6x24MrIF_2SxJEMnAdSfT2q9HhQpD4=](/blobs/cXPfaH7yGKuxN6x24MrIF_2SxJEMnAdSfT2q9HhQpD4=)\n\n\n\n\n\n### Advanced Collaboration Capability\n\n\nWhen you do need to [collaborate](https://affine.pro/blog/top-asynchronous-communication-tools-free-2024) with other contributors to discuss your concept map, AFFiNE makes getting feedback simple. Appealing collaboration capability provides visibility into assigned tasks, making tables easier to estimate, and ensuring your concept map remains well-designed. You can invite team members or classmates to collaborate on [concept maps](https://affine.pro/blog/affine-0-11-0-launch-day-4-navigating-canvas-complexity-templates-clarity-free-online-whiteboard) together, making it perfect for group projects or study sessions.\n\n\n\n![O88V12dZ7eALpdMD8-6eyyfRec5yZyWiQxCnvNEb3r0=](/blobs/O88V12dZ7eALpdMD8-6eyyfRec5yZyWiQxCnvNEb3r0=)\n\n\nWith top-notch software like [AFFiNE](https://affine.pro) at your disposal along with its diverse range of templates and user-friendly features, creating concept maps has never been easier or more effective. Commence concept mapping by using AFFiNE's user-friendly tool. Presently, **AFFiNE** has launched its **[Stable Version](https://affine.pro/download)**, with ongoing efforts to develop a more comprehensive and dependable iteration. Join us on our voyage through our social media channels and be part of the experience. **Come and join us on our journey over on our media platforms. ðŸš€**\n\n\n* Official Website: [https://affine.pro/](https://affine.pro/)\n\n\n* GitHub: [https://github.com/toeverything/AFFiNE](https://github.com/toeverything/AFFiNE)\n\n\n* Discord: [https://discord.gg/Arn7TqJBvG](https://discord.gg/Arn7TqJBvG)\n\n\n* Twitter: [https://twitter.com/AffineOfficial](https://twitter.com/AffineOfficial)\n\n\n\n\n\n",
  "publish": true
}