{
  "title": "How to Build a Go-to-Market (GTM) Strategy (with Free Templates)",
  "authors": [
    "Yiyang Zhang"
  ],
  "tags": [
    "Content"
  ],
  "description": "A guide for building a successful go-to-market strategy for your needs. Use your free customizable go-to-market strategy templates in AFFiNE to get you organized.",
  "created": 1705017600000,
  "updated": 1705017600000,
  "layout": "blog",
  "id": "1IqQDqpR2Wz_61TTUQe7A",
  "slug": "how-to-build-go-to-market-strategy-free-templates",
  "cover": "/blobs/KB6VbE8F-vgrMJ8LGIUppaCnRNHguSI2AGWJizFR288=",
  "md": "---\n\n\ntitle: \"How to Build a Go-to-Market (GTM) Strategy (with Free Templates)\"\n\n\nauthor: \"Yiyang Zhang\"\n\n\ntags: Content\n\n\nslug: how-to-build-go-to-market-strategy-free-templates\n\n\ndescription: \"A guide for building a successful go-to-market strategy for your needs. Use your free customizable go-to-market strategy templates in AFFiNE to get you organized.\"\n\n\ncreated: 2024-01-12\n\n\nupdated: 2024-01-12\n\n\nlayout: blog\n\n\npublish: true\n\n\n---\n\n\n\n![KB6VbE8F-vgrMJ8LGIUppaCnRNHguSI2AGWJizFR288=](/blobs/KB6VbE8F-vgrMJ8LGIUppaCnRNHguSI2AGWJizFR288=)\n\n\nCrafting a successful go-to-market strategy is like charting a course for your business to [navigate](https://affine.pro/blog/navigating-organizational-strategies-a-path-to-project-success) the tumultuous waters of the market. It's your blueprint, your secret weapon that sets you apart from competitors and propels your brand forward. âœ¨\n\n\nBut what exactly is a go-to-market strategy? Why do you need one? Most importantly, how can you craft an effective one that guarantees success? ðŸ‘€\n\n\nIn this article, we'll delve into all these questions and more, providing you with a proven guide for creating a go-to-market strategy that will skyrocket your [business](https://affine.pro/blog/how-to-introduce-new-business-social-media-strategic-steps-examples) to new heights. Plus, we've got something special for you â€“ a free go-to-market strategy template to kickstart your journey towards triumph! So grab hold of the helm and let's set sail on our way to mastering the art of crafting an unbeatable go-to-market strategy! ðŸ™Œ\n\n\n# What is a Go-to-Market (GTM) Strategy?\n\n\n\n![6yusgCC2MiIKKIHWgVgyUFJWP18hJSmsJyzEcTQ29P8=](/blobs/6yusgCC2MiIKKIHWgVgyUFJWP18hJSmsJyzEcTQ29P8=)\n\n\nA go-to-market (GTM) strategy is a well-thought-out plan that explains how a company intends to introduce its products or services to the market and attract its target audience. It includes all the necessary steps, tactics, and [activities](https://affine.pro/blog/15-types-events-event-management-categories-examples) required to launch, promote, and sell offerings effectively in a competitive market. Essentially, a GTM strategy is about understanding customers' needs and creating value propositions that resonate with them. This involves identifying target market segments, analyzing their pain points and preferences, and developing tailored messaging that addresses their concerns directly.\n\n\nBut it doesn't stop there. An effective GTM strategy should take into account pricing strategies and positioning techniques that make your brand stand out from competitors while maximizing profitability. It aligns [marketing](https://affine.pro/blog/marketing-action-plan) efforts with sales goals to ensure seamless execution across all customer touchpoints. In simple terms, it's not just about launching products; it's about capturing markets in ways that maximize growth opportunities while building long-lasting relationships with satisfied customers.\n\n\n# Why Do You Need a Go-to-Market Strategy?\n\n\n\n![rXMcsVeu2f5tei3_ghh6jIEBxAHO74xEeykVGNM-NBM=](/blobs/rXMcsVeu2f5tei3_ghh6jIEBxAHO74xEeykVGNM-NBM=)\n\n\nWhy do you need a Go-to-Market Strategy? It's simple â€“ without one, your business is like a ship without a compass. A Go-to-Market (GTM) strategy provides direction and clarity on how to bring your product or service to market successfully.\n\n\n* **Help you understand your target audience better.** By conducting thorough market research, you can identify their needs, pain points, and preferences. Armed with this knowledge, you can tailor your messaging and positioning to resonate with your ideal customers.\n\n\n* **Enable you to differentiate yourself from competitors.** It helps define what sets your offering apart â€“ whether it's unique features, superior quality, or exceptional customer service. This differentiation allows you to stand out in the crowded marketplace and attract customers who value what you bring to the table.\n\n\n* **Ensure that all departments are aligned toward achieving common goals**. From sales and marketing to product development and customer support â€“ everyone understands their role in executing the overall strategy.\n\n\n* **Facilitate efficient resource allocation.** By understanding which channels yield the best results and where opportunities for growth lie, you can allocate your budget effectively for maximum ROI.\n\n\n* I**ncrease your chances of success.** By minimizing risks associated with launching new products or entering new markets blindly, a solid go-to-market strategy aligns your teams. With careful planning and testing at each stage of the process - from product development through distribution - potential pitfalls can be identified early on before they become costly mistakes.\n\n\nHaving an effective go-to-market strategy is crucial for any business looking to thrive in today's competitive landscape. It helps align teams internally while also providing clarity externally when communicating with customers.\n\n\n# How to Craft a Go-to-Market Strategy?\n\n\n\n![f0yQA5LbPuwcM8ZCNKuda62H-Jrj3ReZJA9VNgwlbDM=](/blobs/f0yQA5LbPuwcM8ZCNKuda62H-Jrj3ReZJA9VNgwlbDM=)\n\n\nCrafting a Go-to-Market (GTM) Strategy requires careful planning and execution. Here are some steps to guide you in creating an effective strategy [layout](https://affine.pro/blog/best-free-whiteboard-layout-ideas-organization).\n\n\n**Step1: Define Your Target Market**\n\n\nStart by identifying your ideal customers and understanding their needs, pain points, and preferences. Conduct market research to gather insights that will shape your GTM approach.\n\n\n**Step2: Set Clear Objectives**\n\n\nClearly define what you want to achieve with your GTM strategy. Whether it's increasing market share, driving product adoption, or expanding into new markets, having specific goals will help you stay focused and improve your time management.\n\n\n**Step3: Develop a Value Proposition**\n\n\nDetermine the unique value that your product or service offers to customers. This should be communicated clearly and effectively in all marketing efforts.\n\n\n**Step4: Identify Key Channels**\n\n\nAssess which channels are most effective for reaching your target audience â€“ whether it's social media platforms, online advertising, content marketing, or traditional methods like trade shows or print ads.\n\n\n**Step5: Build a Sales and Marketing Plan**\n\n\nOutline the tactics and activities needed to reach your target market through the identified channels. This may include creating compelling content, implementing lead-generation strategies, nurturing leads through email campaigns, etc.\n\n\n**Step6: Align Your Teams**\n\n\nEnsure that all departments within your organization are aligned toward executing the GTM strategy. This includes sales, marketing, product development, and customer support. This allows you to measure performance, determine areas of improvement, and make necessary adjustments along the way.\n\n\nRemember, the key is flexibility.Â Crafting a successful GTM strategy requires constant monitoring, evolving alongside changing market dynamics, and adapting accordingly. With these guidelines, you'll be well on your way toward developing an effective go-to-market plan for success!\n\n\n# Your Way to Success: Go-to-Market Strategy\n\n\nCrafting a strong go-to-market strategy is essential for successfully launching your product or service. By following the steps outlined above and utilizing the free template provided, you can create a comprehensive GTM strategy that will set you up for success. By investing time and effort into developing an effective go-to-market strategy using the tips provided in this article and the accompanying template, you are setting yourself up for success in today's competitive business landscape.\n\n\n\n\n\n<div style=\"text-align:center;\">\n\n\n<iframe width=\"560\" height=\"315\" src=\"https://www.youtube.com/embed/3cfeKOufZWU?si=IiXDIdwfnM2Z7KPL\" title=\"YouTube video player\" frameborder=\"0\" allow=\"accelerometer; autoplay; clipboard-write; encrypted-media; gyroscope; picture-in-picture; web-share\" allowfullscreen></iframe>\n\n\n</div>\n\n\n\n\n\nAFFiNE is a versatile editor that lets you write, [draw](https://affine.pro/blog/affine-0-10-0-launch-week-day-4-5-write-draw-plan-present-collaboratively-anywhere), plan, and present all in one place. Easily capture detailed information about your new business using the page mode, allowing for straightforward document editing. This flexible tool empowers users to brainstorm, take notes, and set goals while staying in sync and building content with blocks. The limitless workspace stimulates user-driven innovation. AFFiNE offers safe data storage, open-source benefits, and collaborative functionality. Users can visualize and connect information effortlessly, crafting GTM strategy as an engaging and enjoyable experience.\n\n\n### 1. **[AFFiNE](https://affine.pro/)**'s Go-to-Market Strategy Template for Operation Team:\n\n\n\n![apJC8oOrP8tgZHDJEUYQjX-2dlraIn9bamfVTW0n5Fs=](/blobs/apJC8oOrP8tgZHDJEUYQjX-2dlraIn9bamfVTW0n5Fs=)\n\n\nThe AFFiNE's GTM strategy template for the technical company's operation team is a comprehensive plan designed to elevate the market position and enhance operational efficiency. Made up of strategic initiatives spanning market analysis, target customer segmentation, impactful marketing and branding efforts, close collaboration with sales, and a strong focus on scalability and flexibility, this strategy aims to leverage the operation team's technical expertise to drive growth and establish a strong foothold in the dynamic technical industry.\n\n\n### 2. [AFFiNE](https://affine.pro/)'s SWOT Template for Go-to-Market Strategy Planning\n\n\n\n![C-u93_inuT4TSa8jKzIlecB4U20D56HrGGjYmrgvVFM=](/blobs/C-u93_inuT4TSa8jKzIlecB4U20D56HrGGjYmrgvVFM=)\n\n\nAFFiNE's SWOT template for Go-To-Market strategy planning, offering a systematic evaluation of internal strengths and weaknesses, along with external opportunities and threats. This precise template helps identify key factors influencing our business strategy. Assessing strengths like technical expertise and customer loyalty, it prompts strategic leveraging, while addressing weaknesses such as resource limitations. The template guides exploration of growth opportunities in new markets, technological advancements, and strategic partnerships. Simultaneously, it highlights potential threats, facilitating proactive risk mitigation. This dynamic tool is integral to informed decision-making, aiding in the formulation of a robust go-to-market strategy for sustained success.\n\n\n### 3. [AFFiNE](https://affine.pro/)'s 4P Marketing Matrix Template for Go-to-Market Strategy Planning\n\n\n\n![VRAGNqlQE5lvgrD7cQTReyDHnSf4cTQRhXO3h7_SoI4=](/blobs/VRAGNqlQE5lvgrD7cQTReyDHnSf4cTQRhXO3h7_SoI4=)\n\n\nThis AFFiNE's 4P marketing matrix template for the bread shop's go-to-market strategy aims to establish a strong market presence and drive customer engagement. Made up of four key components, the strategy focuses on Product excellence, ensuring a diverse and high-quality bread range with a unique branding identity. Pricing is set competitively, supported by discounts and bundles to enhance value perception. The Place aspect involves strategic store locations, online presence, and efficient distribution channels. Lastly, The Promotion utilizes social media, in-store events, collaborations, and loyalty programs to create brand awareness and foster customer loyalty. Together, these elements form a comprehensive GTM strategy, positioning the bread shop for success in a competitive market.\n\n\nBut wait! AFFiNE has **MORE** to discover:\n\n\n* **Template Gallery in AFFiNE**: There is a curated collection of powerful [whiteboard](https://affine.pro/blog/best-free-whiteboard-layout-ideas-organization) templates in AFFiNE. From the robust Gantt chart to the insightful 4P marketing matrix and the comprehensive SWOT, an array of additional templates awaits your exploration, promising to expand the horizons of your go-to-market strategy planning and execution. These templates serve as your launchpad, enabling you to skip the groundwork and jump straight into action. Crafted for seamless collaboration, AFFiNE's templates provide structured canvases for various tasks, saving you valuable time and enhancing efficiency in project management, content creation, and [planning](https://affine.pro/blog/top-8-concept-map-templates-examples).\n\n\n\n![OP3GdbE7dwmQKK2uKzBgJbhpVJxkLuDsVtomxcggvSQ=](/blobs/OP3GdbE7dwmQKK2uKzBgJbhpVJxkLuDsVtomxcggvSQ=)\n\n\n* **Explore Edgeless Creativity with a Whiteboard:** Unlock the full spectrum of your creative potential through our dynamic whiteboard. Boasting essential features like a plethora of colors, [diverse font options](https://affine.pro/blog/docs-edgeless-stylized-embody-your-creativity-better-and-easier), shapes, and connectors, this powerful tool is designed to elevate your creative process. Seamlessly upload images in various formats and utilize the extensive collection of styles and templates to further amplify your creativity. Transform your ideas into compelling business posters with unparalleled ease and versatility!\n\n\n\n![O88V12dZ7eALpdMD8-6eyyfRec5yZyWiQxCnvNEb3r0=](/blobs/O88V12dZ7eALpdMD8-6eyyfRec5yZyWiQxCnvNEb3r0=)\n\n\n* **Advanced Collaboration Capability**: When you do need to [collaborate](https://affine.pro/blog/top-asynchronous-communication-tools-free-2024) with other contributors to discuss your go-to-market template, AFFiNE makes getting feedback simple. Appealing collaboration capability provides visibility into assigned tasks, making tables easier to estimate, and ensuring your go-to-market strategy remains well-designed. You can invite team members or friends to collaborate on the go-to-market strategy together, making it perfect for the affairs schedule.\n\n\n\n![JEAWWEj9dlB-xw9bsZU-uxG8pxh2zBDMW6fkCKQ4N1A=](/blobs/JEAWWEj9dlB-xw9bsZU-uxG8pxh2zBDMW6fkCKQ4N1A=)\n\n\nSo what are you waiting for? It's time to put theory into action! Start crafting your winning go-to-market strategy today! Commence crafting your go-to-market strategy by using AFFiNE's templates. Presently, **AFFiNE** has launched its **[Stable Version](https://affine.pro/download)**, with ongoing efforts to develop a more comprehensive and dependable iteration. Join us on our voyage through our social media channels and be part of the experience. **Come and join us on our journey over on our media platforms.** ðŸš€\n\n\n* Official Website: [https://affine.pro/](https://affine.pro/)\n\n\n* GitHub: [https://github.com/toeverything/AFFiNE](https://github.com/toeverything/AFFiNE)\n\n\n* Discord: [https://discord.gg/Arn7TqJBvG](https://discord.gg/Arn7TqJBvG)\n\n\n* Twitter: [https://twitter.com/AffineOfficial](https://twitter.com/AffineOfficial)\n\n\n",
  "publish": true
}