{
  "title": null,
  "authors": [
    "Xuan Pang"
  ],
  "tags": [
    "Content"
  ],
  "description": "Learn the step-by-step process of mastering 8 top memorization techniques for improved memory retention. Enhance your learning and memory skills with these proven methods.",
  "created": 1696723200000,
  "updated": 1697068800000,
  "layout": "blog",
  "id": "BzZ45NDZs-",
  "slug": "how-to-memorize-things-fast-8-best-memorization-techniques-step-by-step-guide",
  "cover": "/blobs/P7BL5pdO1GIOwIGADMJhVWQ79vprlASfe49-0t0KtbU=",
  "md": "---\n\n\nTitle: \"How to Memorize Things Fast: 8 Best Memorization Techniques [Step-by-step Guide]\"\n\n\nauthor: Xuan Pang\n\n\ntags: Content\n\n\nslug: how-to-memorize-things-fast-8-best-memorization-techniques-step-by-step-guide\n\n\ndescription: Learn the step-by-step process of mastering 8 top memorization techniques for improved memory retention. Enhance your learning and memory skills with these proven methods.\n\n\ncreated: 2023-10-08\n\n\nupdated: 2023-10-12\n\n\nlayout: blog\n\n\npublish: true\n\n\n---\n\n\nAre you experiencing a gradual decline in your memorization abilities? 🤔Do you find it challenging to remember a plethora of information? 🧠Are you looking to enhance your memorization skills? 🚀You've come to the right place! Take a deep dive into this blog post to explore how these top 8 memorization techniques can benefit you and discover the specific tools at your disposal for enhancing your memory.How Does Memorization Work?\n\n\n\n![P7BL5pdO1GIOwIGADMJhVWQ79vprlASfe49-0t0KtbU=](/blobs/P7BL5pdO1GIOwIGADMJhVWQ79vprlASfe49-0t0KtbU=)\n\n\nMemorization operates through a dual-phase process: encoding and retrieval. 🧠 During the encoding phase, fresh information is transformed into lasting memories using diverse cognitive methods, including elaboration, association, and visualization. 🌟 These stored memories are subsequently retrieved through neural connections. 🔄\n\n\nStudies indicate that specific memorization techniques are superior for achieving long-term retention of information. 📚 Techniques such as spaced repetition and elaborative encoding have demonstrated their effectiveness in bolstering long-term memory. 📅 In contrast, methods like chunking and mnemonics tend to facilitate short-term recall by simplifying the material. 🧩\n\n\n\n\n\n### How to Memorize Anything in a 4-Step Approach\n\n\nIf you've ever thought, \"I'm not good at memorizing,\" rest assured that your brain is trainable. The memorization process consists of four stages: attention, encoding, storage, and retrieval, each with its own role:\n\n\n\n![c7ZgQKkRrAndvBPKYgDgN_cKADZ_4wRZ1GX8U8tsWHs=](/blobs/c7ZgQKkRrAndvBPKYgDgN_cKADZ_4wRZ1GX8U8tsWHs=)\n\n\n1. Attention: Imagine you're in a meeting, and a colleague presents a marketing idea. Information enters your brain through sensory receptors, but it lingers briefly as your brain filters and evaluates its importance. Only when you consciously engage with the information does it proceed to the next stage. 👀\n\n\n1. Encoding: Your colleague's pitch must have caught your attention because your brain is now encoding the information. During this stage, it's moved to either your short-term or working memory. Short-term memory retains information for seconds, while working memory can hold it for about 20 minutes. Useful for tasks like solving math problems but not ideal for recalling your colleague's pitch next Thursday. 🧠\n\n\n1. Storage: Transitioning information from short-term to long-term memory requires an active effort. Your brain won't make this decision for you; you'll need to memorize it using a technique that suits you (more on this shortly). 🗂️\n\n\n1. Retrieval: How you pay attention, encode, and store the information will influence your ability to retrieve it later. The longer the gap between storage and retrieval, the more crucial it becomes to revisit and review the information regularly to keep it fresh in your mind. 🔄\n\n\n\n\n\n### Top 10 Memorization Techniques You Can Use\n\n\nNot all memorization techniques are going to work well for everyone. But there are a number of methods to try! Check out our list of the 8 best memorization techniques to help you get better at recalling data.\n\n\n* Spaced repetition📆\n\n\nEmploy spaced repetition, a technique that involves revisiting information at progressively longer intervals. This method capitalizes on memory decay, a psychological phenomenon indicating that memories can fade over time.🧠\n\n\nTo counteract this fading effect, whether it pertains to short-term or long-term retention, regular practice in recalling or \"repeating\" what you've memorized is an effective antidote.🔄\n\n\n* Elaborative encoding🖌️\n\n\nElaborative coding, a mnemonic technique, simplifies memorization. One effective approach to tie new information to your existing mental framework is by visualizing it on a whiteboard.🤔\n\n\nTools like AFFiNE Whiteboards provide a structured platform for linking tasks and employing brainstorming techniques. You can effortlessly create and save workflow diagrams, using them as quick references when you need a memory refresh. This visual aid strengthens your grasp on the material by integrating it with your established knowledge base.📊\n\n\n* Chunking\n\n\nDivide extensive information into smaller, digestible segments. 📚This approach simplifies memorization, making it less daunting and allowing for quicker mastery of individual components.🧩\n\n\nResearch suggests that chunking lightens the load on your working memory when dealing with substantial amounts of data. 🧠By breaking down the information into manageable bits, you gradually construct a more extensive dataset that's not only easier to recall but also facilitates a coherent understanding of the material. 🧩To achieve this, AFFiNE offers Blockslicer tool for you to break your information into smaller pieces.🛠️\n\n\n\n![3TFGwfygZi1ykMGTGdJOvICIyYvtWg3FW-z7bKEVDhM=](/blobs/3TFGwfygZi1ykMGTGdJOvICIyYvtWg3FW-z7bKEVDhM=)\n\n\n* Mnemonics\n\n\nLeveraging mnemonic techniques, such as rhymes, acronyms, or vivid mental imagery, is known as mnemonics. This approach adds an enjoyable dimension to memorization. Research even suggests that consistent practice with spelling mnemonics can restructure your brain networks, leading to enhanced memory recall.🧩\n\n\nFor instance, a simple illustration of this technique involves singing your ABCs to music to make them more memorable. Perhaps your art teacher introduced you to \"Roy G Biv\" as a mnemonic aid to memorize the colors of the rainbow in their correct order: red, orange, yellow, green, blue, indigo, violet. Mnemonics breathe life into memorization, transforming it into an engaging and effective learning process.🌈\n\n\n* Active recall\n\n\nFrequent self-testing of the material you've acquired is a valuable memory-enhancing practice. The more you engage in this exercise, the more effortless it becomes to recall both recent and older information. As a student, active recall serves as a powerful study technique.🧑🎓\n\n\nActive recall entails compelling your brain to retrieve desired information unaided, without external prompts or cues. This method serves as an effective means of bolstering memory retention and strengthening your grasp on the material.🧠\n\n\n* Visualization\n\n\nAs previously discussed, harnessing the power of visuals is another potent method for memorization. When you form mental images of the material and link them to visual representations, this technique significantly enhances your ability to retain information. 🖼️\n\n\nEmploying software tools like AFFiNE Mind Maps 🌐 facilitates the visual aspect of this process. With AFFiNE Mind Maps, you can swiftly transform your plans, ideas, and workflows into captivating visual representations. This allows you to establish connections between your visualizations and provide context to aid in the memorization process, thus creating vivid visuals around the concepts you intend to remember. 🧠🎨\n\n\n* Association\n\n\nOrganizing similar information alongside other related content enhances memorization. 📚 Grouping together pieces of information that share commonalities, particularly when there's no specific sequential order required, simplifies the memorization process. 🧩\n\n\nThis approach proves especially beneficial when dealing with numbers or terms that share the same initial letter. 📝 Our brains naturally process this first letter and aid in forming associations among the information we're trying to remember. 🧠\n\n\n* Recitation\n\n\nRepeating the material you're learning aloud, even when you're alone, is a favored method for memory reinforcement. The human brain thrives on this practice! 🧑🎓Moreover, if you can engage in this technique with a study partner, it can be highly beneficial. 🤝 Similar to how you learn the lyrics to a new song by listening and singing along, recitation aids in memorizing information in the correct sequence. 🎶 You might even find yourself recalling that catchy jingle from a commercial right now as a testament to the power of repetition and recitation. 📺\n\n\n\n\n\n### The Best Memorization Tool to Improve Your Thoughts\n\n\n\n![_r7glaxwml0ziL2qZJjUVUHs_UYzXyiSJ8dVuBSjcyA=](/blobs/_r7glaxwml0ziL2qZJjUVUHs_UYzXyiSJ8dVuBSjcyA=)\n\n\nAFFiNE is an all-in-one app that provides a comprehensive suite of services including mind maps, whiteboard functionality, kanban boards, and more. This versatile tool is designed to facilitate effective memorization and cognitive improvement by offering a range of features that enhance your thinking processes. Whether you're organizing ideas, visualizing concepts, or structuring information, AFFiNE empowers you to optimize your thought processes and boost memory retention.\n\n\n#### 🚀 Here are some of the brilliant features that AFFiNE offers: 🌟\n\n\n* Simplified Flowcharts and Mind Maps - Lighten Your Workload\n\n\nWith a single click, this feature allows shapes to automatically extend from one another, saving you time and energy and making the process more convenient.\n\n\n\n![q1kRb852K7CyMTlg9CXig9gOklaMKSlob1bGxmyH11k=](/blobs/q1kRb852K7CyMTlg9CXig9gOklaMKSlob1bGxmyH11k=)\n\n\n* Tailor Your Workflow - Explore a Spectrum of Options\n\n\nTo elevate your flowchart experience, AFFiNE offers shape customization options, including colors and styles. Click to create a new shape, and watch it harmonize seamlessly with the previous one, giving you a cohesive toolkit to play with.\n\n\n\n![ndYv530Fmd8nIV8PHF_XOI1aj477zMkeAS-kuPxZRG8=](/blobs/ndYv530Fmd8nIV8PHF_XOI1aj477zMkeAS-kuPxZRG8=)\n\n\n* Tags - Enhance Content Organization and Discoverability\n\n\nToo many pages? By AFFiNE, you can tag your content with descriptive labels, making it easier to find and access  whenever you need it.\n\n\n\n![CgxJfxH0NgPs6vyUnGLDNyJXoZf9DNl8NYJwo5TZ25I=](/blobs/CgxJfxH0NgPs6vyUnGLDNyJXoZf9DNl8NYJwo5TZ25I=)\n\n\n\n\n\nCurrently, **AFFiNE** has released its stable version, but we are continuing to build to a more feature-rich and stable build. **Come and join us on our journey over on our media platforms.**\n\n\n* Official Website: [https://affine.pro/](https://affine.pro/)\n\n\n* GitHub: [https://github.com/toeverything/AFFiNE](https://github.com/toeverything/AFFiNE)\n\n\n* Discord: [https://discord.gg/Arn7TqJBvG](https://discord.gg/Arn7TqJBvG)\n\n\n* Twitter: [https://twitter.com/AffineOfficial](https://twitter.com/AffineOfficial)\n\n\n\n\n\n### Support Us: Become an Early Access Sponsor for AFFiNE Cloud\n\n\n\n![BXytVyyo5RfdYDrB3IVBUYtvCRKM7sTzEfSmba_L6Eo=](/blobs/BXytVyyo5RfdYDrB3IVBUYtvCRKM7sTzEfSmba_L6Eo=)\n\n\nJoin us as an early access sponsor for the AFFiNE Cloud, and unlock advanced collaboration capabilities while upholding the local-first nature of your data. As a token of our appreciation, you'll enjoy:\n\n\n* **Early Access:** Be among the first to experience AFFiNE Cloud's powerful features, including advanced permission settings and control. This exclusive opportunity allows you to shape the future of collaboration.\n\n\n* **One-year Free Pro Plan:** Enjoy a complimentary one-year subscription to the premium AFFiNE Pro Plan, which will fill you with advanced tools designed to enhance your productivity and creativity. This plan provides you with a comprehensive suite of resources to optimize your work.\n\n\n* **Lifetime 50% Discount on Pro Plan:** Benefit from a lasting 50% discount on the Pro Plan for as long as you continue to find value in your subscription. This ongoing discount ensures that you can always access AFFiNE Cloud's premium features at an affordable rate.\n\n\n* **Other details:**\n\n\n  * AFFiNE Cloud enhances collaboration without compromising your data's local-first\n\n\n  * The free plan will remain available and always an option, with ongoing improvements.\n\n\n  * More details: [https://affine.pro/blog/affine-cloud-early-access](https://affine.pro/blog/affine-cloud-early-access)\n\n\n",
  "publish": true
}