{
  "title": "How to Ask AI a Question More Efficiently",
  "authors": [
    "Yiyang Zhang"
  ],
  "tags": [
    "Content"
  ],
  "description": "Unlock the potential of AI by asking efficient questions to get accurate responses. Ask the right questions and get accurate responses every time.",
  "created": 1714089600000,
  "updated": 1722729600000,
  "layout": "blog",
  "id": "VfM6gf3RyNfAk6z0MrweS",
  "slug": "how-to-ask-ai-question-efficiently",
  "cover": "/blobs/OR4Vk9hpktqScCQWtJbn7AUV9jFvniBmsn1bOnUGbsc=",
  "md": "---\n\n\ntitle: \"How to Ask AI a Question More Efficiently\"\n\n\nauthor: \"Yiyang Zhang\"\n\n\ntags: Content\n\n\nslug: how-to-ask-ai-question-efficiently\n\n\ndescription: \"Unlock the potential of AI by asking efficient questions to get accurate responses. Ask the right questions and get accurate responses every time.\"\n\n\ncreated: 2024-04-26\n\n\nupdated: 2024-08-04\n\n\nlayout: blog\n\n\npublish: true\n\n\n---\n\n\n\n![OR4Vk9hpktqScCQWtJbn7AUV9jFvniBmsn1bOnUGbsc=](/blobs/OR4Vk9hpktqScCQWtJbn7AUV9jFvniBmsn1bOnUGbsc=)\n\n\n**Are you ready to unlock the full potential of AI with just a question?**\n\n\nIn this [digital](https://affine.pro/blog/top-10-best-free-digital-planner-apps-2023) era, Artificial Intelligence (AI) has transformed the way we interact with technology, making our lives more convenient and efficient. AI is present everywhere, from virtual assistants that anticipate our needs to search engines that provide instant answers.\n\n\nHowever, the key to harnessing its power lies in asking the right questions. To make the most of this incredible technology, it's crucial to know how to question AI effectively. In this article, we will explore the art of questioning AI and provide you with the tools to navigate the world of AI with confidence and precision. By doing so, you will be able to receive accurate and efficient responses every time.\n\n\n## **What is AI and Its Mechanics?**\n\n\nArtificial Intelligence (AI) is a field of computer science dedicated to creating systems capable of performing tasks that typically require human intelligence. These tasks include understanding natural language, recognizing patterns in data, making decisions, and solving problems.\n\n\n\n![mfAJ4kASjZrCRiYnuDfYyblgpm1xJnTWNfv_iTWWXN4=](/blobs/mfAJ4kASjZrCRiYnuDfYyblgpm1xJnTWNfv_iTWWXN4=)\n\n\n### **Core Concepts**\n\n\n* **Human-like Functions:** AI aims to replicate human cognitive abilities such as learning, reasoning, [problem-solving](https://affine.pro/blog/best-8-free-event-planning-templates-checklists-customize), perception, and language understanding.\n\n\n* **Data Processing:** AI systems rely on algorithms and models to process large datasets, identifying patterns and extracting valuable insights.\n\n\n* **Machine Learning:** Machine learning is a key aspect of AI, wherein algorithms learn from labeled data examples to improve performance over time.\n\n\n* **Neural Networks:** A fundamental element of AI,neural networks take their structure cues from the human brain. These networks consist of interconnected nodes organized in layers, capable of complex computations.\n\n\n### **Working Mechanisms**\n\n\n* **Training Process:** AI algorithms are trained using labeled data, adjusting their parameters to optimize performance without explicit programming.\n\n\n* **Deep Learning:** Neural networks employ deep learning techniques to autonomously discover intricate patterns in data, enabling tasks such as image recognition, natural language processing, math problem solving, and predictive analytics.\n\n\n* **Applications:** AI finds applications across various domains, including healthcare (diagnosis assistance), finance (fraud detection), and entertainment (recommendation systems).\n\n\n### **Techniques and Domains**\n\n\n* **Natural Language Processing (NLP):** AI processes and understands human language for tasks like sentiment [analysis](https://affine.pro/blog/top-10-free-competitive-analysis-templates-boost-your-business), chatbots, and language translation.\n\n\n* **Computer Vision:** AI systems analyze visual data for tasks like object detection, facial recognition, and autonomous vehicle navigation.\n\n\n* **Robotics:** AI plays a crucial role in developing intelligent robots capable of performing tasks in manufacturing, logistics, math, and healthcare.\n\n\n* **Expert Systems:** AI is used to create expert systems that replicate human expertise in specific domains, aiding decision-making and problem-solving in areas like medicine and finance.\n\n\nAI has already made significant impacts across industries, improving efficiency, and enabling new capabilities. The future of AI holds promise for further advancements, including enhanced automation, personalized experiences, and breakthroughs in areas like healthcare and climate science. As AI continues to evolve, its role in shaping the future of technology will only become more pronounced.\n\n\n### **Getting Started with AI Prompts**\n\n\n\n![eLTh_LzmtTMori6t63qUtA6jdSURQ7fEfk1n-o7cEYI=](/blobs/eLTh_LzmtTMori6t63qUtA6jdSURQ7fEfk1n-o7cEYI=)\n\n\nTo effectively communicate with AI technology, it is important to carefully construct your questions. AI prompts can serve as a valuable aid in structuring your queries in a way that the AI system can comprehend. Before asking your question, take a moment to consider its context and purpose. This can help ensure that your communication with the AI system is clear and concise.\n\n\nIt is also recommended to experiment with different prompt types, such as open-ended questions or specific inquiries, to determine which approach is most effective. Keep in mind that practice is key to mastering the use of AI prompts. By becoming more familiar with these tools and techniques, you will be better equipped to engage with AI technologies and obtain valuable insights and information.\n\n\n# **4 Typical Misunderstanding When Asking AI a Question**\n\n\nArtificial Intelligence (AI) has been a topic of interest for a while, but there are still some misconceptions about this technology.\n\n\n\n![ms5Mc-mWrUFGb92isCZo92_OiO0Yk5kWaLVfxYsySrM=](/blobs/ms5Mc-mWrUFGb92isCZo92_OiO0Yk5kWaLVfxYsySrM=)\n\n\n1. **Assuming AI's Omniscience:** One of the common ones is that AI possesses comprehensive knowledge and can answer any question. However, AI's knowledge is limited to its programming and training, which means that it can only provide responses based on the data it has been trained on. Therefore, it may not be able to provide accurate answers to vague or overly complex questions\n\n\n1. **Expecting Human-like Understanding:** Another common misunderstanding about AI is that it can understand context and nuances in the same way humans do. Although AI technology is advancing, it still struggles with interpreting subtle cues and complexities in language, emphasizing the importance of being clear and concise when asking questions. For example, sarcasm and irony can be difficult for AI to understand, and it may not be able to detect emotions or intentions behind a statement.\n\n\n1. **Uniformity of AI Platforms:** It is also important to note that different AI systems have varying capabilities and specialties. Some AI platforms may be better suited for certain types of queries than others, so it is important to choose the right tool for a specific task to get optimal results.\n\n\n1. **Overestimating AI's Abilities:** Lastly, there is a common misconception that AI can understand and interpret questions in the same way humans do. However, AI's ability to comprehend language and context is still limited, and it may not always provide the nuanced understanding that a human would. While AI can provide helpful insights and automate some tasks, it is not a substitute for human intelligence and intuition.\n\n\n.\n\n\n# **6 Easy Tips to Get Perfect Answers**\n\n\nWhen it comes to getting perfect answers from AI, there are some easy tips you can follow to improve your results.\n\n\n\n![wWlAE7jAbYtZQZF3JgcoMt4pZU-s2lT7KKeKY58RfKM=](/blobs/wWlAE7jAbYtZQZF3JgcoMt4pZU-s2lT7KKeKY58RfKM=)\n\n\n1. **Be Specific**: When formulating your query, it's essential to be as specific as possible. By narrowing down your question, you can receive more accurate and targeted responses from the AI.\n\n\n1. **Use Clear and Concise Language**: It's important to communicate your questions straightforwardly, avoiding jargon or complex terms. This approach ensures that the AI can provide precise and easily understandable answers.\n\n\n1. **Provide Context**: Offering a brief background or setting for your question can significantly aid the AI in better understanding your inquiry. Context helps the AI to provide more relevant and tailored responses.\n\n\n1. **Ask Follow-Up Questions**: After receiving an initial response, consider refining your inquiry based on the information provided. This approach can lead to more detailed and comprehensive answers from the AI.\n\n\n1. **Format Questions Effectively**: Organizing your queries using bullet points or numbered lists can help the AI interpret and process your questions more effectively, leading to clearer response and [enhanced productivity](https://affine.pro/blog/10-cool-apps-enhanced-productivity-simplified-living).\n\n\n1. **Be Patient and Open-Minded**: It's important to tackle the AI time to process information, as these systems are constantly learning and improving. Additionally, maintaining an open-minded approach can lead to more insightful and diverse responses from AI.\n\n\nBy following the tips and understanding common misunderstandings when interacting with AI, you can significantly improve the accuracy of your queries. Remember that practice makes perfect, so don't get discouraged if you don't get it right the first time.\n\n\n# **Mastering the Art of Asking Questions to AI**\n\n\nAs technological advancements continue to revolutionize the way we live, it is becoming increasingly evident that our interactions with artificial intelligence will only grow in importance. By becoming adept at asking questions in a more precise and meaningful manner, you can unlock the full potential of AI in assisting you with information retrieval, problem-solving, and decision-making.\n\n\nFrom chatbots to virtual assistants, AI-powered tools have the potential to make our lives easier and more efficient, but it is only by mastering the art of effective questioning that you can fully harness the power of this transformative technology. When embarking on your AI journey, consider using AFFiNE as your go-to AI partner. **[AFFiNE](https://affine.pro/)** can help you improve your writing, drawing, and presentation skills.\n\n\n\n![5VZZiy69UNGfpn8KOwMVuvVmBr6icqfRjmd42C36r9g=](/blobs/5VZZiy69UNGfpn8KOwMVuvVmBr6icqfRjmd42C36r9g=)\n\n\nAFFiNE AI is your AI partner that enhances your capabilities across various creative tasks. Whether you're brainstorming ideas, crafting compelling presentations, or sketching visuals, AFFiNE AI is there to streamline your workflow and amplify your creativity. Think of it as the fusion of Notion AI, Miro AI, Figma AI, Canva AI, and Clickup AI, all rolled into one comprehensive platform.\n\n\n**Key features of AFFiNE AI:**\n\n\n* **AI Chatbox:** Receive instant insights and support across your projects with AFFiNE AI's intuitive chatbox. Seamlessly integrated into your documents and whiteboards, it provides real-time assistance and acceleration. Whether you're brainstorming ideas or organizing tasks, simply ask a question and receive immediate responses. For example, jot down your daily task list on one page, then effortlessly inquire about your plans for the day on another using the chatbox.\n\n\n\n![TixIkRzZgGOIrsqcfRoj1ZrH4_tQmDu27NQGaKyOR7U=](/blobs/TixIkRzZgGOIrsqcfRoj1ZrH4_tQmDu27NQGaKyOR7U=)\n\n\n* **AI-Generated Visuals:** Elevate your presentations and content creation with AFFiNE AI's unparalleled visual capabilities. Craft polished, presentation-ready slides with just one click, eliminating the need for tedious manual design work. From drawing images for articles to creating [mind maps](https://affine.pro/blog/top-8-concept-map-templates-examples), flow charts, or professional slides, AFFiNE AI simplifies the process, allowing you to focus on content rather than formatting.\n\n\n\n![uLPLW1mOWz9QB-t3JOzIPWbHWNWTxiz9bLWL7xUXqWU=](/blobs/uLPLW1mOWz9QB-t3JOzIPWbHWNWTxiz9bLWL7xUXqWU=)\n\n\n* **AI Writer:** Perfect your writing effortlessly with AFFiNE AI's advanced AI Writer feature. Say goodbye to spelling and grammar errors, tone inconsistencies, and lengthy editing sessions. With AFFiNE AI, you can translate content, adjust the length, improve clarity, generate action items, and even create drafts, outlines, or timelines with ease. Whether it's crafting [social media posts](https://affine.pro/blog/how-to-create-social-media-content-calendar-free-templates) or penning [creative stories](https://affine.pro/blog/free-best-8-storyboard-templates-examples), AFFiNE AI empowers you to express yourself confidently and efficiently.\n\n\n\n![XhwBfbXzNmPOjL70F28JGgQizULkEy6j45lW63QPypE=](/blobs/XhwBfbXzNmPOjL70F28JGgQizULkEy6j45lW63QPypE=)\n\n\n* **Make it Real:** Turn your ideas into reality with AFFiNE AI's innovative \"Make it Real\" feature. From concept to completion, unleash your creativity and experimentation. Whether you're prototyping a working dial clock, developing a game like Snake or Pong, or tackling any other project, AFFiNE AI provides the tools and resources to bring your vision to life. Experience the thrill of innovation and exploration with AFFiNE AI's \"Make it Real\" feature.\n\n\n\n![gqD9utTt5E1cpxMgjZjnzUKZ9SPmLP7O29mQ_c2dCIk=](/blobs/gqD9utTt5E1cpxMgjZjnzUKZ9SPmLP7O29mQ_c2dCIk=)\n\n\nWith AFFiNE AI, the future of creativity is here. Experience the power of AI-driven innovation as you unlock new possibilities and achieve unparalleled efficiency in your creative endeavors. Say hello to a smarter, faster, free, and more inspiring way to write, draw, upload, solve and present with AFFiNE AI by your side.\n\n\nSo go ahead and put the above tips into practice. With a little bit of patience and some trial and error, you'll be well on your way to becoming an expert at asking AI questions efficiently. Happy questioning!\n\n\n**AFFiNE AI will be launched soon. Please stay tuned！**\n\n\n**Come and join us on our journey over on our media platforms.**\n\n\n* Official Website: [https://affine.pro/](https://affine.pro/)\n\n\n* GitHub: [https://github.com/toeverything/AFFiNE](https://github.com/toeverything/AFFiNE)\n\n\n* Discord: [https://discord.gg/Arn7TqJBvG](https://discord.gg/Arn7TqJBvG)\n\n\n* Twitter: [https://twitter.com/AffineOfficial](https://twitter.com/AffineOfficial)\n\n\n\n\n\n",
  "publish": true
}