{
  "title": "How to Create a Social Media Content Calendar (with Free Templates)",
  "authors": [
    "Yiyang Zhang"
  ],
  "tags": [
    "Content"
  ],
  "description": "Uncover the power of a social media content calendar that will boost your productivity. Discover the best free social media content template in AFFiNE.",
  "created": 1706486400000,
  "updated": 1706486400000,
  "layout": "blog",
  "id": "yOH3QvzYIqubvUgqesh11",
  "slug": "how-to-create-social-media-content-calendar-free-templates",
  "cover": "/blobs/1uLcH_1kfWIVW6QvSEtjectMCndQZwde3I72VLxg5xE=",
  "md": "---\n\n\ntitle: \"How to Create a Social Media Content Calendar (with Free Templates)\"\n\n\nauthor: \"Yiyang Zhang\"\n\n\ntags: Content\n\n\nslug: how-to-create-social-media-content-calendar-free-templates\n\n\ndescription: \"Uncover the power of a social media content calendar that will boost your productivity. Discover the best free social media content template in AFFiNE.\"\n\n\ncreated: 2024-01-29\n\n\nupdated: 2024-01-29\n\n\nlayout: blog\n\n\npublish: true\n\n\n---\n\n\n\n![1uLcH_1kfWIVW6QvSEtjectMCndQZwde3I72VLxg5xE=](/blobs/1uLcH_1kfWIVW6QvSEtjectMCndQZwde3I72VLxg5xE=)\n\n\nAre you struggling to keep up with your [social media](https://affine.pro/blog/how-to-introduce-new-business-social-media-strategic-steps-examples) content?\n\n\nDo you find yourself scrambling at the last minute to come up with posts that resonate with your audience?\n\n\nIf so, it's time to create a social media content calendar! This simple yet powerful tool can help you stay organized, save time, and ensure that your social media [strategy](https://affine.pro/blog/how-to-build-go-to-market-strategy-free-templates) is on point. In this article, we'll guide you step-by-step on how to create a social media content calendar that will take your online presence from good to great. Plus, we've got free templates for you to download and use right away! So let's dive in and get started on revolutionizing your social media game. Get ready to plan like a pro and watch those likes and follows skyrocket!\n\n\n\n\n\n# What is a Social Media Content Calendar\n\n\nA social media content calendar stands out as a vital strategic tool, streamlining the planning and organization of posts well in advance. Its significance lies in eradicating the need for last-minute scrambles and fostering a consistent and high-quality online presence across various platforms.\n\n\nThe time saved by eliminating the stress associated with impromptu content creation allows for a more deliberate and strategic approach to online engagement. This proactive [planning](https://affine.pro/blog/how-to-make-work-plan-step-by-step-guide) permits posts to seamlessly align with important business events or promotions, ensuring that no opportunities for audience engagement or sales are overlooked.\n\n\nIn essence, envision a social media content calendar as your organized playbook, meticulously guiding every move made across diverse platforms. Through this approach, creativity is maximized, and the overall impact of your social media efforts is heightened.\n\n\n# The Benefits of a Social Media Content Calendar for Your Business\n\n\nA well-thought-out social media content calendar is an invaluable tool for any business looking to establish their online presence effectively. Having a social media content calendar can bring numerous benefits to your business. From maintaining consistency and improving engagement to making data-driven decisions – the benefits are undeniable!\n\n\n\n![94OlgC0ugi96d08g_gMU1kY6HFGAYiweBQTFrJqIXsc=](/blobs/94OlgC0ugi96d08g_gMU1kY6HFGAYiweBQTFrJqIXsc=)\n\n\n* **Organization and Consistency:**\n\n\n  * Planning and scheduling content in advance for a steady stream of posts on various platforms.\n\n\n  * Ensuring organized and consistent social media postings.\n\n\n* **Improved Audience Engagement:**\n\n\n  * Strategic planning for different types of posts.\n\n\n  * Variety of content, such as informative articles, engaging videos, or interactive polls.\n\n\n* **Data-Driven Decision-Making:**\n\n\n  * Utilizing analytics tools to track post [performance](https://affine.pro/blog/10-best-free-performance-review-templates-examples-2023).\n\n\n  * Gaining valuable insights for continuous strategy refinement and optimization.\n\n\n* **Timely Integration of Promotions:**\n\n\n  * Avoiding the likelihood of missing important dates or events.\n\n\n  * Seamless integration of timely promotions or announcements into the overall marketing plan.\n\n\nSo take charge today by creating a tailored social media content calendar that suits the needs of both yourself as well as your audience.\n\n\n\n\n\n# How to Create a Social Media Content Calendar: Step-by-Step Guide\n\n\nCreating a social media content calendar is essential for any business looking to effectively plan and organize its online presence. With a step-by-step guide, you can easily create a content calendar that will streamline your social media strategy.\n\n\n\n![T4kR39OuSq0og7lJ1sce8kdnjv0PaN13SWDT-Opw2nU=](/blobs/T4kR39OuSq0og7lJ1sce8kdnjv0PaN13SWDT-Opw2nU=)\n\n\n**Step1: Define Your Goals**\n\n\nStart by identifying your objectives for using social media. Whether it’s increasing brand awareness, driving traffic to your website, or generating leads, knowing what you want to achieve will help shape your content calendar.\n\n\n**Step2: Research Your Audience**\n\n\nUnderstand who your target audience is and what kind of content they engage with the most on social media platforms. This will inform the types of posts you should include in your calendar.\n\n\n**Step3: Choose the Right Tools**\n\n\nThere are various tools available, such as Google Sheets, Trello, or dedicated social media management software that can help you create and manage your content calendar effectively.\n\n\n**Step4: Create a Content Schedule**\n\n\nDetermine how often you want to post on each platform and establish consistent posting times based on when your audience is most active [online](https://affine.pro/blog/10-best-free-online-table-maker-tools-2023).\n\n\n**Step5: Plan Diverse Content Types**\n\n\nInclude different types of posts such as videos, images, blog articles, infographics, etc., to keep things interesting for your followers.\n\n\n**Step6: Track Performance Metrics**\n\n\nMonitor key metrics like engagement rates, reach, and conversions regularly so that you can make data-driven decisions about future content creation strategies.\n\n\nBy following the steps outlined above, you’ll be well-equipped to create an effective social media content calendar that drives engagement and helps achieve business success!\n\n\n\n\n\n# Plan Your Content in AFFiNE\n\n\nCreating a social media content calendar is an essential step in streamlining your [marketing](https://affine.pro/blog/the-7-key-stages-marketing-sales-pipeline-visual-guide) efforts and maximizing your online presence. By utilizing a content calendar, you can efficiently organize and schedule your posts, ensuring that you consistently deliver valuable content to your audience.\n\n\n\n![-_OPJAICQM-hdycw2wCuxDqMLnm_Gx64Yk2i_PX6Vjc=](/blobs/-_OPJAICQM-hdycw2wCuxDqMLnm_Gx64Yk2i_PX6Vjc=)\n\n\n[AFFiNE](https://affine.pro/) is a versatile editor that lets you write, draw, plan, and present all in one place. Easily capture detailed information about your new business using the page mode, allowing for straightforward document editing. Efficiently organize your projects by using a database to keep track of deadlines, assign responsibilities, and effortlessly monitor project progress. Take advantage of AFFiNE's powerful whiteboard feature to brainstorm ideas with your team. Moreover, craft visually appealing posters about your business for seamless publication and display on different social media platforms. AFFiNE offers a user-friendly platform for comprehensive business management and seamless team collaboration.\n\n\n**[AFFiNE](https://app.affine.pro/) Social Media Content Calendar Template for Small Startups**\n\n\n\n![YAH4nc_w_DX_vxgekMsr3e4hzkyC5QjlVIBI2UfF0ZI=](/blobs/YAH4nc_w_DX_vxgekMsr3e4hzkyC5QjlVIBI2UfF0ZI=)\n\n\nThis AFFiNE's social media content calendar template for small startups aims for a needs strategic and engaging online presence, fostering brand awareness and audience interaction. Made up of a carefully curated schedule, this template provides a structured framework for planning and executing diverse content that aligns with your business goals. From showcasing your products or services to sharing behind-the-scenes glimpses and encouraging user participation, each week is thoughtfully crafted to keep your social media channels vibrant and connected with your target audience. Embrace this template as a roadmap to navigate the dynamic landscape of social media, driving growth and building lasting connections for your startup.\n\n\nAFFiNE has **More** to discover**:**\n\n\n* **Template Gallery in AFFiNE:** There is a curated collection of powerful [whiteboard](https://affine.pro/blog/best-free-whiteboard-layout-ideas-organization) templates that strategic the robust Gantt chart to the insightful monthly calendar and the comprehensive SWOT for your business's needsCalendar, an array of additional templates awaits your exploration, promising to expand the horizons of your marketing and sales pipeline crafting and execution. These templates serve as your launchpad, enabling you to skip the groundwork and jump straight into action. Crafted for seamless collaboration, AFFiNE's templates provide structured canvases for various tasks, saving you valuable time and enhancing efficiency in project management, content creation, and [planning](https://affine.pro/blog/top-10-best-free-digital-planner-apps-2023).\n\n\n\n![OP3GdbE7dwmQKK2uKzBgJbhpVJxkLuDsVtomxcggvSQ=](/blobs/OP3GdbE7dwmQKK2uKzBgJbhpVJxkLuDsVtomxcggvSQ=)\n\n\n* **Advanced Collaboration Capability:** When you do need to [collaborate](https://affine.pro/blog/top-asynchronous-communication-tools-free) with other contributors to discuss your social media content calendar, AFFiNE makes getting feedback simple. Appealing collaboration capability provides visibility into assigned tasks, making tables easier to estimate, and ensuring your marketing and sales pipeline remains well-designed. You can invite team members or friends to collaborate on social media content calendars together, making it perfect for planning and scheduling.\n\n\n\n![O88V12dZ7eALpdMD8-6eyyfRec5yZyWiQxCnvNEb3r0=](/blobs/O88V12dZ7eALpdMD8-6eyyfRec5yZyWiQxCnvNEb3r0=)\n\n\n* **Show Your Social Media Content Calendar with AFFiNE's Single Page Sharing:**No more oversharing of your workspace; now, you can precisely control what's shared with just a few clicks. AFFiNE's single-page sharing makes social media content calendar improvement simple, offering a tailored approach to showing your calendar to your business partners.\n\n\n\n![VsmRQKKT_JWfocv6kdTdmSw3-22k1EUrdWeyjhL8xjQ=](/blobs/VsmRQKKT_JWfocv6kdTdmSw3-22k1EUrdWeyjhL8xjQ=)\n\n\nUpgrade your social media content calendar, embrace the power of AFFiNE, and witness the transformative impact on your recording abilities. Now that you have learned about how to create a social media content calendar, it's time to put your knowledge into action. And what better way to do that than with **AFFiNE**? Commence crafting a social media content calendar by using AFFiNE's user-friendly tool. Presently, **AFFiNE** has launched its [**Stable Version**](https://affine.pro/download), with ongoing efforts to develop a more comprehensive and dependable iteration. Join us on our voyage through our social media channels and be part of the experience.**Come and join us on our journey over on our media platforms. 🚀**\n\n\n* Official Website:[https://affine.pro/](https://affine.pro/)\n\n\n* GitHub:[https://github.com/toeverything/AFFiNE](https://github.com/toeverything/AFFiNE)\n\n\n* Discord:[https://discord.gg/Arn7TqJBvG](https://discord.gg/Arn7TqJBvG)\n\n\n* Twitter:[https://twitter.com/AffineOfficial](https://twitter.com/AffineOfficial)\n\n\n",
  "publish": true
}