{
  "title": "Miro vs. Lucidchart Comparison: What’s Best to Illustrate Your Idea",
  "authors": [
    "Yanxi Liu"
  ],
  "tags": [
    "Content"
  ],
  "description": "Explore the features of Miro and Lucidchart to decide on the optimal solution for showcasing and refining your business ideas with precision and clarity.",
  "created": 1710115200000,
  "updated": 1710115200000,
  "layout": "blog",
  "id": "8Go72J9SY1V3EmB7Oa-Ns",
  "slug": "miro-vs-lucidchart-business-selecting-ideal-visualization-tool",
  "cover": "/blobs/wYmtsEJO_ogRpszeeZgjJ4WM-qYKdx3S2iPh8QqHU3c=",
  "md": "---\n\n\ntitle: \"Miro vs. Lucidchart Comparison: What’s Best to Illustrate Your Idea\"\n\n\nauthor: \"Yanxi Liu\"\n\n\ntags: Content\n\n\nslug: miro-vs-lucidchart-business-selecting-ideal-visualization-tool\n\n\ndescription: \"Explore the features of Miro and Lucidchart to decide on the optimal solution for showcasing and refining your business ideas with precision and clarity.\"\n\n\ncreated: 2024-03-11\n\n\nupdated: 2024-03-11\n\n\nlayout: blog\n\n\npublish: true\n\n\n---\n\n\n\n![wYmtsEJO_ogRpszeeZgjJ4WM-qYKdx3S2iPh8QqHU3c=](/blobs/wYmtsEJO_ogRpszeeZgjJ4WM-qYKdx3S2iPh8QqHU3c=)\n\n\nVisualizing ideas, tracking progress, and collaborating effectively are essential in business. With a range of diagramming and whiteboard tools available, choosing the right one is crucial. Miro and Lucidchart are top players in this space, offering unique benefits for teams of all sizes.\n\n\nIn this comparison, we'll explore the key features, pros, cons, pricing, and limitations of Miro and Lucidchart. Stay tuned for an alternative digital whiteboard solution that complements these tools!\n\n\n# **What is Miro**\n\n\n\n![uofJmg2kQvy725AwrSvf5R86Ln-MRkV-BO5FHHKPWHg=](/blobs/uofJmg2kQvy725AwrSvf5R86Ln-MRkV-BO5FHHKPWHg=)\n\n\nMiro is a versatile online collaborative whiteboard platform that a real time allows teams to work together visually, no matter where they are located. It's like having a digital canvas where team members can brainstorm, plan projects, create diagrams, and more in real time. Miro caters to a wide range of users, including remote teams, designers, project managers, educators, and anyone looking to streamline their visual collaboration efforts.\n\n\n## **Key features**\n\n\n* **Extensive library of templates:**\n\n\n  * Miro covers various use cases such as project planning, brainstorming, user story mapping, etc.\n\n\n  * These templates provide a starting point for users to kickstart their visual projects quickly and efficiently.\n\n\n* **Real-time collaboration capabilities:**\n\n\n  * It allows team members to work together simultaneously on the same board.\n\n\n  * Ideal for remote teams or distributed workforces.\n\n\n* **Integrations with popular tools:**\n\n\n  * Miro integrates with tools like Slack, Jira, Trello, and Google Drive.\n\n\n  * This integration capability enhances workflow efficiency by allowing users to [bring in content](https://affine.pro/blog/10-creative-content-marketing-ideas-examples-inspire-you) from other platforms directly into their Miro boards.\n\n\n## **User scenarios**\n\n\nMiro can be applied in many scenarios, like virtual meetings, design sprints, agile project management, remote workshops, and educational settings. Whether you need to [create flowcharts](https://affine.pro/blog/10-best-free-chore-chart-templates-kids-adults), mind maps, wireframes, or conduct user research sessions, Miro offers a flexible and collaborative platform to bring your ideas to life.\n\n\n## **Miro pricing**\n\n\nMiro provides several plans, including a free forever plan.\n\n\n* **Free**\n\n\n* **Starter:** $8 per member, per month, billed annually\n\n\n* **Business**:$16 per member, per month, billed annually\n\n\n* **Enterprise**: Custom pricing\n\n\n# **What is Lucidechart**\n\n\n\n![zi1-EZHO34yIj3PV0RKTNDNOdFpZCrWV3myJButsfUQ=](/blobs/zi1-EZHO34yIj3PV0RKTNDNOdFpZCrWV3myJButsfUQ=)\n\n\nLucidchart is a cloud-based diagramming and visual communication tool that empowers teams to create professional-looking diagrams and [flowcharts](https://affine.pro/blog/10-best-free-chore-chart-templates-kids-adults) easily. Designed for a wide range of users, including project managers, engineers, educators, and business professionals, Lucidchart offers a user-friendly interface for visualizing ideas and processes.\n\n\n## **Key features**\n\n\n* **Extensive shape libraries:** Lucidchart offers a vast library of shapes, icons, and templates tailored to different industries and diagramming needs, making it easy to create professional-looking diagrams.\n\n\n* **User-friendly interface:** Lucidchart provides an intuitive drag-and-drop interface that allows users to easily customize their diagrams without the need for advanced design skills, enhancing the overall user experience.\n\n\n* **Advanced formatting options:** Lucidchart provides a wide range of formatting options for flowcharts, including customizable shapes, colors, line styles, and text formatting. This allows users to create visually appealing and [easy-to-understand flowcharts](https://affine.pro/blog/10-best-free-chore-chart-templates-kids-adults).\n\n\n* **Auto-layout and alignment tools:** Lucidchart offers auto-layout and alignment tools that help users arrange and organize flowchart elements neatly and efficiently. This feature saves time and ensures that flowcharts are structured logically.\n\n\n## **User scenarios**\n\n\nLucidchart can be used in a variety of scenarios, including project planning, system design, process mapping, and educational presentations. Whether you need to create technical diagrams, flowcharts for business processes, or organizational charts, Lucidchart provides a versatile platform for visual communication and collaboration.\n\n\n## **Lucidchart pricing**\n\n\nLucidchart has a free version for new users and extends a free trial for each of its paid options.\n\n\n* **Free**\n\n\n* **Individual**: $7.95 per month\n\n\n* **Team**: $9.00 per user, per month\n\n\n* **Enterprise**: Pricing available on request\n\n\n# **Miro Vs. Lucidchart: Who Wins?**\n\n\n\n\n\n## **1. User experience and interface**\n\n\n\n![AehxcM2M8UW0nyN4QVlda7j7aai2-T_9J3p06Bqd1DQ=](/blobs/AehxcM2M8UW0nyN4QVlda7j7aai2-T_9J3p06Bqd1DQ=)\n\n\nCreated by [AFFiNE](http://affine.pro)\n\n\nIf you prefer a modern and intuitive interface with a focus on collaboration and brainstorming, Lucidchart would be a suitable choice despite [the potential clutter](https://affine.pro/blog/unlock-your-career-potential-10-professional-goals-to-take-your-success-to-the-next-level).\n\n\n**Slight preference: Lucidchart**\n\n\n\n\n\n## 2. **Diagramming**\n\n\n\n![DeFj--0NIx0MvwPv_C2PrO1YJ5PFs16SgvVU25Ih6i4=](/blobs/DeFj--0NIx0MvwPv_C2PrO1YJ5PFs16SgvVU25Ih6i4=)\n\n\n> Created by [AFFiNE](http://affine.pro)\n\n\nIf you require advanced diagramming features, extensive shape libraries, and professional formatting options, Lucidchart would be more appropriate.\n\n\n**Slight preference: Lucidchart**\n\n\n\n\n\n## 3. **Whiteboard Software**\n\n\n\n![M49Ri_rewaIa7HmipByBkUka-Vtdnd51GlFaHegoYtg=](/blobs/M49Ri_rewaIa7HmipByBkUka-Vtdnd51GlFaHegoYtg=)\n\n\n> Created by [AFFiNE](http://affine.pro)\n\n\nIf real-time collaboration and remote team functionality are crucial for your workflow, Miro's strong collaborative features make it a compelling option.\n\n\n**Slight preference: Miro**\n\n\n## **AFFiNE: The Best Alternative to Miro and Lucidchart**\n\n\nWhile Lucidchart and Miro have distinct features that have propelled them in the realm of whiteboarding, they cater to different needs, making a direct comparison challenging. So, if you're seeking a comprehensive whiteboard and diagramming software solution, the answer lies with AFFiNE.\n\n\n<div style=\"text-align:center;\">\n<iframe width=\"560\" height=\"315\" src=\"https://www.youtube.com/embed/WqOe9HgpsDY?si=PHGuSeRbOT9GxuPO\" title=\"YouTube video player\" frameborder=\"0\" allow=\"accelerometer; autoplay; clipboard-write; encrypted-media; gyroscope; picture-in-picture; web-share\" allowfullscreen></iframe>\n</div>\n\n\nAFFiNE serves as an all-encompassing productivity platform, enabling your team to craft and oversee virtual whiteboards, workflow diagrams, [and organizational charts](https://affine.pro/blog/10-best-free-chore-chart-templates-kids-adults). Businesses of all sizes and sectors trust AFFiNE for its extensive range of customizable features and its capacity to consolidate work from various applications into a unified collaborative workspace.\n\n\nLet's delve deeper into these main features.\n\n\n* **Diversified Templates:** There is a curated collection of powerful [whiteboard](https://affine.pro/blog/best-free-whiteboard-layout-ideas-organization) templates in AFFiNE, including a [social media content](https://affine.pro/blog/10-creative-content-marketing-ideas-examples-inspire-you) calendar and a comprehensive SWOT, to enhance the agility and efficiency of your workflow. Utilize our range of templates to streamline processes, improve collaboration, and achieve optimal results in your projects. AFFiNE provides a versatile editor that allows users to write, draw, plan, and present all in one place.\n\n\n\n![OP3GdbE7dwmQKK2uKzBgJbhpVJxkLuDsVtomxcggvSQ=](/blobs/OP3GdbE7dwmQKK2uKzBgJbhpVJxkLuDsVtomxcggvSQ=)\n\n\n* **Efficient Project Organization:** With AFFiNE's powerful database functionality, users can efficiently organize their [B2B social media marketing](https://affine.pro/blog/what-is-social-media-marketing-definition-benefits-and-examples) projects by keeping track of deadlines, assigning responsibilities, and monitoring project progress. This feature ensures that B2B marketers can stay on top of their [social media campaigns](https://affine.pro/blog/what-is-social-media-marketing-definition-benefits-and-examples) and ensure timely execution.\n\n\n\n![bY0EkoVLJfBpOjymBoGUxE0LAiQuW1bNgYA-FU1OQlA=](/blobs/bY0EkoVLJfBpOjymBoGUxE0LAiQuW1bNgYA-FU1OQlA=)\n\n\n* **Advanced Collaboration Capability:** AFFiNE enables B2B marketing teams to brainstorm ideas collaboratively. This feature facilitates ideation sessions for [social media content creation](https://affine.pro/blog/what-is-social-media-marketing-definition-benefits-and-examples), [strategy development](https://affine.pro/blog/strategic-planning-vs-tactical-planning-what-is-the-difference), and campaign planning, helping teams generate innovative and effective marketing initiatives.\n\n\n\n![O88V12dZ7eALpdMD8-6eyyfRec5yZyWiQxCnvNEb3r0=](/blobs/O88V12dZ7eALpdMD8-6eyyfRec5yZyWiQxCnvNEb3r0=)\n\n\nAFFiNE can assist businesses of all sizes in developing and implementing realistic and successful plans. From daily planning and task management to crafting strategic and tactical marketing plans, we've got you covered. AFFiNE has launched its [Stable Version](https://affine.pro/download), with ongoing efforts to develop a more comprehensive and dependable iteration. Join us on our voyage through our social media channels and be part of the experience. Come and join us on our journey over on our media platforms. 🚀\n\n\n* Official Website: [https://affine.pro/](https://affine.pro/)\n\n\n* GitHub: [https://github.com/toeverything/AFFiNE](https://github.com/toeverything/AFFiNE)\n\n\n* Discord: [https://discord.gg/Arn7TqJBvG](https://discord.gg/Arn7TqJBvG)\n\n\n* Twitter: [https://twitter.com/AffineOfficial](https://twitter.com/AffineOfficial)\n\n\n",
  "publish": true
}