{
  "title": "Navigating Organizational Strategies: A Path to Project Success (Definitions & Key Components)",
  "authors": [
    "Yanxi Liu"
  ],
  "tags": [
    "Content"
  ],
  "description": "Unveiling the Importance of Organizational Strategy in Driving Project Management Success",
  "created": 1699315200000,
  "updated": 1699315200000,
  "layout": "blog",
  "id": "ErkaCHdjk5oSDqGPRAzXW",
  "slug": "navigating-organizational-strategies-a-path-to-project-success",
  "cover": "/blobs/KIaznjYqEh1FN0JY5FFy_F0Sz9R3CXlQu6YegA68AuU=",
  "md": "---\n\n\ntitle: \"Navigating Organizational Strategies: A Path to Project Success (Definitions & Key Components)\"\n\n\nauthor: Yanxi Liu\n\n\ntags: Content\n\n\nslug: navigating-organizational-strategies-a-path-to-project-success\n\n\ndescription: \"Unveiling the Importance of Organizational Strategy in Driving Project Management Success\"\n\n\ncreated: 2023-11-07\n\n\nupdated: 2023-11-07\n\n\nlayout: blog\n\n\npublish: true\n\n\n---\n\n\n\n![KIaznjYqEh1FN0JY5FFy_F0Sz9R3CXlQu6YegA68AuU=](/blobs/KIaznjYqEh1FN0JY5FFy_F0Sz9R3CXlQu6YegA68AuU=)\n\n\nOrganizational strategy is a valuable tool that helps project managers effectively organize resources to support business activities. By using it properly, you can improve decision-making and guide team members towards a common goal. If you want to make your company operate [more efficiently](https://affine.pro/blog/free-event-planning-templates-for-professsional-2023), it's important to understand how to implement an organizational strategy. In this article, we will define what organizational strategy means, explain why it is important for your business, discuss the key elements involved, and provide a list of different types of strategies to consider.\n\n\n\n![_HCq02MVwlFO5V8_vpkjhnaissisnml-7NeP5a0CldM=](/blobs/_HCq02MVwlFO5V8_vpkjhnaissisnml-7NeP5a0CldM=)\n\n\nAn organizational strategy encompasses a comprehensive roadmap that delineates the allocation of a company's resources to drive business operations. Serving as a compass, it provides guidance on how a company can effectively attain its objectives. Employed by companies to facilitate the realization of their goals and guide strategic planning, organizational strategies often incorporate meticulous evaluations that outline the necessary achievements for the company.\n\n\n## **Why does your business need an organizational strategy?**\n\n\n* An organizational strategy provides a clear direction: It helps align business activities with long-term goals and objectives, ensuring that everyone in the organization is working towards a common purpose.\n\n\n* It enhances decision-making: With an organizational strategy in place, decision-making becomes more informed and strategic, as choices are evaluated based on their alignment with the overall strategy and its desired outcomes.\n\n\n* It improves operational efficiency: By implementing an organizational strategy, businesses can streamline processes, optimize resource allocation, and eliminate redundancies, leading to improved efficiency and productivity.\n\n\n## **Four Essential Elements of an Organizational Strategy**\n\n\nTo optimize the effectiveness of your organizational strategy, it is crucial to consider the fundamental aspects it should encompass and its intended objectives. A robust organizational strategy should possess the following characteristics:\n\n\n\n![C93HzA_cnpNeTtJ-Sx3P9GODAg4q8h2Df_aQcm1TAvE=](/blobs/C93HzA_cnpNeTtJ-Sx3P9GODAg4q8h2Df_aQcm1TAvE=)\n\n\n## Five tips to follow **when creating an organizational strategy for your company**\n\n\n1. Assess Your Current Position: Gain a comprehensive understanding of your company's current state by conducting internal and external audits. This involves examining your customers, the competitive landscape, and identifying any weaknesses or opportunities that exist.\n\n\n1. Define Your Core Values: Establish the values and principles that will shape your company's future. By setting a clear vision and goals, such as demonstrating audacity in serving your clients, you can prioritize activities that align with your overarching mission.\n\n\n1. Allocate Responsibility: Break down your organizational strategy into actionable steps and assign accountability for each task. Effectively communicate your priorities and objectives to your team, fostering an environment where questions are encouraged and concerns can be freely expressed.\n\n\n1. Cultivate Your Corporate Culture: [Consider the desired corporate culture](https://affine.pro/blog/free-lessons-learned-templates-for-project-management) that reflects your brand and attracts the right talent. For example, a technology company may strive for an innovative culture, seeking analytical and forward-thinking individuals to join their team.\n\n\n1. Continuously Review and Adapt: Regularly evaluate the effectiveness of your organizational strategy and make necessary adjustments. Conduct frequent meetings with your team to discuss goals and approaches, identifying areas of success and areas that can be improved to drive ongoing growth and success.\n\n\n## **Create your organizational strategy with AFFiNE**\n\n\n[AFFiNE](http://affine.pro) is the cutting-edge time management software you need, if you need assistance in planning, managing, and collaborating on tasks, projects, and information. AFFiNE is not just a project management tool, it's much more than that. What distinguishes AFFiNE is its open-source nature, which ensures that it's accessible to all users, even those who are not online. AFFiNE handles documentation, resource allocation, and kickoff meeting time tracking, making it an indispensable tool for anyone who needs a comprehensive time management solution for their daily tasks.\n\n\n\n![mwubU8HeVTL_8bCI-ze1CdIh5GVi1ANx91TiN1JVLP0=](/blobs/mwubU8HeVTL_8bCI-ze1CdIh5GVi1ANx91TiN1JVLP0=)\n\n\n**Crafting an effective organizational strategy requires dedication and effort. Fortunately, AFFiNE simplifies the process by offering the following benefits:**\n\n\n1. Centralized workspace: AFFiNE centralizes your work environment, reducing complexities and minimizing errors during the development of your organizational strategy. It provides virtual document storage and access control for relevant stakeholders, ensuring organizational efficiency and preventing information loss.\n\n\n1. Customizable database with comprehensive insights: Recognizing the uniqueness of each organizational strategy, AFFiNE allows you to [personalize your database](https://affine.pro/blog/9-top-examples-data-entry-software-programs-to-boost-your-productivity-2023) either in table view or Kanban view. Tailor it to display essential performance metrics and benchmarking data aligned with your company's goals and overall direction. This consolidated view provides a quick overview of critical information.\n\n\n\n![crjX5_HRaAu3feQ3mQMTVmg-FqXutYjATZJpEZEMi98=](/blobs/crjX5_HRaAu3feQ3mQMTVmg-FqXutYjATZJpEZEMi98=)\n\n\n1. Streamlined collaboration: AFFiNE facilitates seamless collaboration among your leadership team, regardless of their geographical location. This real-time collaboration empowers everyone to contribute and stay synchronized. You can also use colour-coded notes to prioritize tasks and ensure clarity.\n\n\n\n![CopPxqWP96ALR9HAdgfxP42pzMumI1ZElrkuAfXghWs=](/blobs/CopPxqWP96ALR9HAdgfxP42pzMumI1ZElrkuAfXghWs=)\n\n\nCurrently, AFFiNE has released its stable version, but we are continuing to build to a more feature-rich and stable build. Come and join us on our journey over on our media platforms.\n\n\n* Official Website: [https://affine.pro/](https://affine.pro/)\n\n\n* GitHub: [https://github.com/toeverything/AFFiNE](https://github.com/toeverything/AFFiNE)\n\n\n* Discord: [https://discord.gg/Arn7TqJBvG](https://discord.gg/Arn7TqJBvG)\n\n\n* Twitter: [https://twitter.com/AffineOfficial](https://twitter.com/AffineOfficial)\n\n\n",
  "publish": true
}