{
  "title": "Notion Alternatives to Revolutionise Your Personal Workflow",
  "authors": [
    "AFFiNE"
  ],
  "tags": [
    "Content"
  ],
  "description": "Notion alternatives can help revolutionise your personal workflow. As while Notion has undoubtedly changed the way we handle things like task management, data storage, and project management, it isn't the best option for everyone.",
  "created": 1692057600000,
  "updated": 1708905600000,
  "layout": "blog",
  "id": "LdHgo8FKUU",
  "slug": "notion-alternatives-to-revolutionise-your-personal-workflow",
  "cover": "/blobs/JqJzfWd8Ky8AAApXGXfyfSDdEmml1hXXlGSfIPU6h84=",
  "md": "---\n\n\ntitle: \"Notion Alternatives to Revolutionise Your Personal Workflow\"\n\n\nauthor: AFFiNE\n\n\ntags: Content\n\n\nslug: notion-alternatives-to-revolutionise-your-personal-workflow\n\n\ndescription: Notion alternatives can help revolutionise your personal workflow. As while Notion has undoubtedly changed the way we handle things like task management, data storage, and project management, it isn't the best option for everyone.\n\n\ncreated: 2023-08-15\n\n\nupdated: 2024-02-26\n\n\nlayout: blog\n\n\npublish: true\n\n\n---\n\n\n\n![JqJzfWd8Ky8AAApXGXfyfSDdEmml1hXXlGSfIPU6h84=](/blobs/JqJzfWd8Ky8AAApXGXfyfSDdEmml1hXXlGSfIPU6h84=)\n\n\n**ðŸŽ‰AFFiNE is now on ProductHunt, support us and leave your feedback here: [https://www.producthunt.com/posts/affine-3](https://www.producthunt.com/posts/affine-3)**\n\n\n\n![uO1ZB4KWJaUGczcj2ij-OuUOEy0qu6eGa08hzMPp6yk=](/blobs/uO1ZB4KWJaUGczcj2ij-OuUOEy0qu6eGa08hzMPp6yk=)\n\n\n\n\n\nNotion quickly becomes the subject of conversation when it comes to collaboration tools. While Notion has undoubtedly changed the way we handle things like task management, data storage, and project management, it isn't the best option for everyone.\n\n\nThe UI might be confusing to certain people. Some people aren't happy about having to pay for more features.\n\n\nIf that's the case, read on! We have compiled a selection of excellent alternatives to Notion that might help you improve your personal workflow.\n\n\nWhat's the big deal about Notion, anyway? It's not simply a tool, after all.\n\n\nIt's revolutionary for planning and executing individual projects and group efforts in tandem. Its modular structure, intuitive interface, and potent command set make for an unforgettable experience.\n\n\nBut, not even the best can do everything. Experienced users quickly discover the limitations of Notion's functionalities.\n\n\nIn search of a **Notion alternative for personal use**? How about [the best open-source alternatives to Notion](https://affine.pro/blog/best-open-source-notion-alternatives)?\n\n\nYou're in the right place. We dove in headfirst, testing a wide range of Notion alternatives suitable for users of varying experiences and aspirations.\n\n\nReady to revolutionise your workflow? Let's jump in.\n\n\n## **Understanding the Need for Notion Alternatives for Personal Use**\n\n\nNotion is an impressive tool. It definitely offers a new perspective on productivity and collaboration. However, it is important to note that this solution may not work for everyone.\n\n\nYou could be wondering, \"Why?\"\n\n\n**Here are a few reasons:**\n\n\n### Complexity in Usage\n\n\nFirst off, Notion's interface. Some users find it highly sophisticated. But for others, it's too complex. Navigating through the numerous features can be overwhelming. Especially if you're new to the realm of productivity apps.\n\n\n### Paywall Challenge\n\n\nSecondly, Notion's features. Notion offers a plethora of features. But here's the catch: some essential functionalities sit behind a paywall. Yes, that means paying extra. This barrier can deter users on a budget or those who are seeking a fully accessible tool.\n\n\n### Poor Mobile Interface\n\n\nNext, the mobile app for Notion lacks speed, multitasking, and user-friendliness making it a challenge for personal use.\n\n\n### Limited integration with Google Calendar\n\n\nEven though it markets itself as a tool for managing tasks, Notion has trouble integrating with Google Calendar. The only real use for it is seeing embedded calendars.\n\n\n### Challenges in Project and Deadline Tracking\n\n\nPersonal productivity management is made easier with Notion's streamlined interface. However, it isn't great at keeping tabs on when things need to be done and how far along they currently are. Due to its extensive feature set, it may be difficult to keep a streamlined process. Thus, it emphasises the significance of discovering **Notion alternatives for personal use**.\n\n\n## Notion Alternatives for Personal Use: In-depth Reviews and Recommendations\n\n\nAlthough Notion is highly regarded for its extensive customisation options and comprehensive range of features, it may not be suitable for every individual's specific requirements. For certain users, utilising dedicated task management tools or simpler note-taking applications could result in greater effectiveness.\n\n\nBelow,Â we will explore several viable **NotionÂ alternativesÂ available for personal use**.\n\n\n### 1.Â [AFFiNE](https://affine.pro/)\n\n\n\n![JqJzfWd8Ky8AAApXGXfyfSDdEmml1hXXlGSfIPU6h84=](/blobs/JqJzfWd8Ky8AAApXGXfyfSDdEmml1hXXlGSfIPU6h84=)\n\n\nWith AFFiNE, professionals have access to a unified platform for knowledge base planning, organisation, and content development. ThisÂ flexible tool allows users to write, sketch, and plan, all while staying in sync and constructing content with blocks. The limitless workspace allows for user-driven innovation. The benefits of AFFiNE include safe data storage, open-source benefits, and collaborative functionality. Those looking for a fresh take on knowledge management will find its comprehensive approach to be a compelling option.\n\n\nThe AFFiNE community edition is available for free, and it includes complete control, the ability to operate offline, peer-to-peer syncing between devices, and some cloud storage.\n\n\nRead more about why [AFFiNE is the ultimate Notion alternative](https://affine.pro/blog/affine-ultimate-notion-alternative).\n\n\n### 2.Â [Coda](https://coda.io/)\n\n\n\n![hubfb851fPShCfsQKRVpVYRkDhpUaR0VnJrh8ZKmytw=](/blobs/hubfb851fPShCfsQKRVpVYRkDhpUaR0VnJrh8ZKmytw=)\n\n\nWhen compared to Notion, Coda is a stronger option, especially when it comes to database management and the use of sophisticated formulae.\n\n\nCoda's strengths lie in its database capabilities and automation functions, whereas Notion's strengths lie in its document and wiki editing features. It has a handy form view for data entry and surveys, and its databases are adaptable enough to accommodate both internal and external algorithms.\n\n\nCoda is a great option if you require a powerful database and spreadsheet experience with the flexibility to put formulae wherever. In addition, Zapier integration makes it simple to automate crucial processes.\n\n\nThe basic version of Coda is free, while the Pro version costs $12 per document producer each month.\n\n\n### 3.Â [ClickUp](https://clickup.com/)\n\n\n\n![bhzsieziHqGzMbyhvNKoRnCGjTHvCyPZfle5eg3FSo8=](/blobs/bhzsieziHqGzMbyhvNKoRnCGjTHvCyPZfle5eg3FSo8=)\n\n\nClickUp is a powerful tool for managing projects, as it combines the functions of note-taking and scheduling. It's become well-liked since it solves several problems at once. ClickUp's advantages asÂ a **Notion alternative for personal use**Â because ofÂ itsÂ superior notebook with checklist and printing capabilities, real-time document editing and storage, and a color-coded approach for keeping track of chores and projects.\n\n\nÂ ClickUp is scalable for organisations of any size because of its flexible pricing model.\n\n\n### 4.Â [Joplin](https://joplinapp.org/)\n\n\n\n![L1P1F2FSX799_81HMDeR-VcxrpAcaR7kxd4kQzU2Myk=](/blobs/L1P1F2FSX799_81HMDeR-VcxrpAcaR7kxd4kQzU2Myk=)\n\n\nJoplin is another excellent Notion alternative for personal use for gathering information through notes and efficiently managing project-related tasks.\n\n\nEnd-to-end encryption is utilised to keep your data safe, and several plugins are available to make it easy to include in your regular enterprise software. The best part is that Joplin is freely available as open-source software.\n\n\n### 5.Â [Evernote](https://evernote.com/)\n\n\n\n![DzGCjuWaNKVy0V90VP9XCLWBopLd-bRCy9mIS8a472w=](/blobs/DzGCjuWaNKVy0V90VP9XCLWBopLd-bRCy9mIS8a472w=)\n\n\nWhen looking for a simple yet effective tool, Evernote is a great Notion alternative for personal useÂ due to its vast range of functions and user-friendliness. It's still one of the best note-taking applications available, with over 150 million users. You may use Evernote to keep track of ideas, projects, and thoughts, and its comprehensive search feature will help you to find anything you've written down or scanned.\n\n\nThe program has a user-friendly design and runs on several platforms, including Windows, macOS, Android, and iOS.\n\n\nPlans for groups of five or more people start at $14.99 per month.\n\n\n### 6.Â [Obsidian](https://obsidian.md/)\n\n\n\n![DzGCjuWaNKVy0V90VP9XCLWBopLd-bRCy9mIS8a472w=](/blobs/DzGCjuWaNKVy0V90VP9XCLWBopLd-bRCy9mIS8a472w=)\n\n\nObsidian is an easy-to-use knowledge management program that helps you keep track of your ideas and information. It employs the plain-text markdown format, making the writing and editing of notes easy and organised.\n\n\nObsidian's notable feature is its ability to create both one-way and two-way links between notes, allowing users to examine the relationships between their notes in a graph format and so get new insights, and spot previously unseen patterns.\n\n\nThere is a free and premium version of Obsidian, with the free version including all of the core functionality.\n\n\n## **Takeaway**\n\n\nIndividual preferences and needs may vary among users. While Notion remains a widely favored option among users, alternative platforms such as AFFiNE present distinct features and user experiences.\n\n\nExplore each **Notion alternative for personal use**, carefully evaluate the advantages and disadvantages of each option, and make a note of your specific requirements.\n\n\nNeedless to say, there is a tool available that will seamlessly align with your unique productivity style and specific requirements\n\n\n\n\n\n\n\n\n",
  "publish": true
}