{
  "title": "Why Notion's Lack of a Whiteboard Feature is Holding You Back",
  "authors": [
    "Christopher Smolak"
  ],
  "tags": [
    "Content"
  ],
  "description": "Notion is a highly popular productivity tool which can cover a wide range of use-cases. However, more users are looking for a Notion alternative as they find some features, such as a Notion whiteboard, are missing which may impact their efficiency and productivity.",
  "created": 1681430400000,
  "updated": 1681430400000,
  "layout": "blog",
  "id": "-KURhkZHNE",
  "slug": "notion-whiteboard-productivity-and-alternatives",
  "cover": "/blobs/zRlyHi2m-otkq4So8thXolbC_nzANivmSkHH6Hi57wg=",
  "md": "---\n\n\ntitle: \"Why Notion's Lack of a Whiteboard Feature is Holding You Back\"\n\n\nauthor: Christopher Smolak\n\n\ntags: Content\n\n\nslug: notion-whiteboard-productivity-and-alternatives\n\n\ndescription: Notion is a highly popular productivity tool which can cover a wide range of use-cases. However, more users are looking for a Notion alternative as they find some features, such as a Notion whiteboard, are missing which may impact their efficiency and productivity.\n\n\ncreated: 2023-04-14\n\n\nupdated: 2023-04-14\n\n\nlayout: blog\n\n\npublish: true\n\n\n---\n\n\n\n![zRlyHi2m-otkq4So8thXolbC_nzANivmSkHH6Hi57wg=](/blobs/zRlyHi2m-otkq4So8thXolbC_nzANivmSkHH6Hi57wg=)\n\n\n## Why worry about a lack of Notion Whiteboard?\n\n\nWhiteboards are an essential tool for brainstorming, planning, and visualising complex ideas. They provide a blank canvas for creativity and enable teams to collaborate more effectively. However, Notion, one of the most popular knowledge management tools on the market, lacks a native Notion whiteboard feature, making it difficult for users to fully harness the power of visual thinking. In this article, we'll explore the benefits of a whiteboard and why a missing Notion whiteboard feature may be holding you back. We'll also highlight the best choices for alternative tools to consider if you're looking for a more comprehensive whiteboard experience.\n\n\n\n![TJ9LwZMwfhUZZ0vE5U2aDVvlyh4lUtHTYqBxqIlPlaI=](/blobs/TJ9LwZMwfhUZZ0vE5U2aDVvlyh4lUtHTYqBxqIlPlaI=)\n\n\n## Notion - a not-so-all-in-one solution\n\n\nNotion is a popular all-in-one productivity tool that has gained a significant following since its launch. It offers a wide range of features, including task management, note-taking, database management, and more. Notion's popularity can be attributed to its intuitive interface, customisable templates, and collaborative features, making it a versatile tool for teams and individuals alike.\n\n\n\n![zRlyHi2m-otkq4So8thXolbC_nzANivmSkHH6Hi57wg=](/blobs/zRlyHi2m-otkq4So8thXolbC_nzANivmSkHH6Hi57wg=)\n\n\nWith such a large and active community, Notion has become a go-to tool for knowledge management, project management, and task tracking. The platform has inspired many to share their tips and tricks, create templates, and build integrations to extend its functionality. The Notion community continues to grow, with new users discovering the platform every day and contributing to its development.\n\n\n### Why look for a Notion alternative?\n\n\nHowever, while Notion is an excellent tool for many use cases, it does have its limitations. Is it still a truly all-in-one solution? One of the most significant limitations is its lack of a whiteboard feature. Without a Notion whiteboard, many users are looking for a Notion alternative. Whiteboards are an essential tool for brainstorming and visualising ideas, and their absence can be a deal-breaker for some users. Thankfully, there are alternatives available, including some new players that offer a native whiteboard experience with added features.\n\n\n## Why worry about the lack of Notion Whiteboard?\n\n\nThere are several advantages to having a whiteboard, especially when it comes to knowledge management. One of the key benefits is the ability to visualise ideas and concepts in a way that is easily understandable. With a whiteboard, you can draw diagrams, create mind maps, and organise your thoughts in a way that makes sense to you.\n\n\n\n![RpnKlyuLynIL9A13l-iri4idpsJpYTAHR2mxTUz_HU4=](/blobs/RpnKlyuLynIL9A13l-iri4idpsJpYTAHR2mxTUz_HU4=)\n\n\n### Advatnages of a whiteboard\n\n\nAnother advantage of having a whiteboard is the ability to collaborate with others. When working on a project with a team, having a whiteboard can facilitate brainstorming sessions and allow everyone to contribute their ideas. It can also help to keep everyone on the same page and ensure that everyone understands the project goals.\n\n\nWhiteboards can also be used as a tool for problem-solving. By mapping out a problem visually, it can be easier to identify the root cause and develop a solution. And because whiteboards are so flexible and adaptable, you can easily make changes and refine your approach as needed.\n\n\nOverall, whiteboards are a versatile and powerful tool for knowledge management, brainstorming, collaboration, and problem-solving. So without a Notion whiteboard how about considering a Notion alternative?\n\n\n## How about a Notion Alternative?\n\n\nWell, it depends what you are looking for. You may want to find a Notion alternative that can fully replace Notion and offer greater functionality. On the other hand, you might feel that a lack of a Notion whiteboard isn't necessarily a deal-breaker, but you'd still like to be able to use Notion and a whiteboard - even if through different apps.\n\n\n### AFFiNE - Notion Alternative - All-in-one knowledge base\n\n\n\n![XEdXX0Sqm-DLyddSHTnRb_2fQOP7k122zvF-zkHfNNY=](/blobs/XEdXX0Sqm-DLyddSHTnRb_2fQOP7k122zvF-zkHfNNY=)\n\n\nAFFiNE is a great choice if you are looking for a full all-in-one Notion alternative. No need to switch between apps for features as AFFiNE looks to encompass the features and functions of both Miro and Notion into a single app.\n\n\n### Miro - Notion Alternative Whiteboard Solution\n\n\n\n![Dkh-QhB2dG6TJRRdxafpdVZ8V692vssNiIdyI2zKlNA=](/blobs/Dkh-QhB2dG6TJRRdxafpdVZ8V692vssNiIdyI2zKlNA=)\n\n\nMiro is an online whiteboard and can fulfill the role of a Notion whiteboard. You can create your online whiteboard within the app and then embed your whiteboard into your Notion. Allowing you to hack together your own Notion whiteboard.\n\n\n## Conclusion\n\n\nSo whether you want to empower your notes, doodle around your knowledge base or just have a visual collaboration workspace, there are lots of solutions you might consider. Even though there might not be a Notion whiteboard on the way, you can find Notion alternatives that help you fulfill your requirements and aid you in your planning, organisation and knowledge management.\n\n\n",
  "publish": true
}