{
  "title": "The Power of Collaboration: Why Teams Need to Work Together to Achieve Success",
  "authors": [
    "AFFiNE"
  ],
  "tags": [
    "Content"
  ],
  "description": "Collaboration is a vital feature to have in your work apps. They help teams to work together, allowing them to truly realise their unified potential.",
  "created": 1684972800000,
  "updated": 1684972800000,
  "layout": "blog",
  "id": "7kpB905rsb",
  "slug": "power-of-collaboration-why-teams-need-to-work-together-for-success",
  "cover": "/blobs/A6-QDSJDZLz0TuxO3gVv9-qoEs0hX3YA21-E0sW05Go=",
  "md": "---\n\n\ntitle: \"The Power of Collaboration: Why Teams Need to Work Together to Achieve Success\"\n\n\nauthor: AFFiNE\n\n\ntags: Content\n\n\nslug: power-of-collaboration-why-teams-need-to-work-together-for-success\n\n\ndescription: Collaboration is a vital feature to have in your work apps. They help teams to work together, allowing them to truly realise their unified potential.\n\n\ncreated: 2023-05-25\n\n\nupdated: 2023-05-25\n\n\nlayout: blog\n\n\npublish: true\n\n\n---\n\n\n\n![A6-QDSJDZLz0TuxO3gVv9-qoEs0hX3YA21-E0sW05Go=](/blobs/A6-QDSJDZLz0TuxO3gVv9-qoEs0hX3YA21-E0sW05Go=)\n\n\nIn today's fast-paced world, collaboration has emerged as a key driver of success for teams and organisations. By working together, teams can draw on each other's strengths and expertise to solve complex problems, develop innovative solutions, and achieve their goals. However, collaboration is not always easy, and teams can sometimes encounter barriers that prevent them from working effectively together. In this blog post, we will explore the power of collaboration, why it is so important for teams to work together, and how teams can overcome common barriers to collaboration.\n\n\n\n![yGQP4YfPMzfLEWgMTRKjFJ6teg7xg8Ukt1YXzGjLnNo=](/blobs/yGQP4YfPMzfLEWgMTRKjFJ6teg7xg8Ukt1YXzGjLnNo=)\n\n\n## The Benefits of Collaboration\n\n\nCollaboration can yield many benefits for teams and organisations. When teams work together, they can:\n\n\n* Draw on each other's strengths and expertise to solve complex problems.\n\n\n* Develop innovative solutions that they may not have been able to achieve individually.\n\n\n* Increase productivity and efficiency by sharing resources and workloads.\n\n\n* Improve communication and enhance their understanding of each other's needs and perspectives.\n\n\n* Enhance creativity and foster a culture of innovation.\n\n\n\n\n\n\n![tAcmiZs09eFYHdaw8VNALfStQFUKl0Qa_FuIubi6XbE=](/blobs/tAcmiZs09eFYHdaw8VNALfStQFUKl0Qa_FuIubi6XbE=)\n\n\n## The Barriers to Collaboration\n\n\nDespite the many benefits of collaboration, teams can encounter barriers that prevent them from working effectively together. Some common barriers to collaboration include:\n\n\n* Lack of trust: Without trust, team members may be hesitant to share their ideas or take risks.\n\n\n* Poor communication: When team members don't communicate effectively, misunderstandings and conflicts can arise.\n\n\n* Different perspectives: Team members may have different goals, values, or viewpoints that can lead to disagreements and conflicts.\n\n\n* Lack of clarity: If team members are not clear on their roles, responsibilities, or goals, it can be difficult to work together effectively.\n\n\n\n![hEX2ZZUNRGM9ATBc8VMPjDFT7u9dvEDFbwd6erlkqP4=](/blobs/hEX2ZZUNRGM9ATBc8VMPjDFT7u9dvEDFbwd6erlkqP4=)\n\n\n## Strategies for Overcoming Barriers to Collaboration\n\n\nTo overcome barriers to collaboration, teams can employ a number of strategies, such as:\n\n\n* Building trust through open communication, transparency, and active listening.\n\n\n* Establishing clear roles, responsibilities, and goals to ensure that everyone is aligned and working towards the same objectives.\n\n\n* Encouraging a culture of respect and inclusivity, where everyone's ideas and contributions are valued.\n\n\n* Emphasising the importance of teamwork and encouraging team members to work together towards shared objectives.\n\n\n\n![U9LRfeNUGIUo0gbQMXRi_iFCuM4gn-B4FlSPiVmCzPs=](/blobs/U9LRfeNUGIUo0gbQMXRi_iFCuM4gn-B4FlSPiVmCzPs=)\n\n\n## Tools for Successful Collaboration\n\n\nIn addition to strategies for overcoming barriers to collaboration, there are also many tools and technologies that teams can use to enhance their collaboration, such as:\n\n\n* Online collaboration tools, such as shared documents, project management software, and video conferencing platforms.\n\n\n* Communication tools, like group chat or instant messaging apps, that allow team members to stay connected and share information in real-time.\n\n\n* Collaboration workshops and training programs that help team members develop the skills and knowledge they need to work effectively together.\n\n\n## Conclusion\n\n\nCollaboration is essential to the success of modern teams and organisations. By working together, teams can achieve more than they could individually, drawing on each other's strengths and expertise to solve complex problems, develop innovative solutions, and achieve their goals. To overcome the barriers to collaboration, teams must build trust, communicate effectively, cultivate a culture of respect and inclusivity, and use tools and technologies that enhance their collaboration. By doing so, teams can reach new heights of success and achieve their goals with greater ease and efficiency. So why not check out some of the [top collaboration tools for team success](https://affine.pro/blog/top-collaboration-tools-for-teams-to-drive-success).\n\n\n",
  "publish": true
}