{
  "title": "How to Write a Product Marketing Plan: A Step by Step Guide [With Example + Best App Recommendation]",
  "authors": [
    "Xuan Pang"
  ],
  "tags": [
    "Content"
  ],
  "description": "Learn how to write a comprehensive product marketing plan with our step-by-step guide. Includes a detailed example and the best app recommendation to streamline your planning process.",
  "created": 1718323200000,
  "updated": 1718323200000,
  "layout": "blog",
  "id": "ajMLGZb_g6fNpQcXXfKgh",
  "slug": "product-marketing-plan-guide",
  "cover": "/blobs/8QTaTeZpL4xaaamJ_bneWZdJaRIobgD5zVhWfRzvSfI=",
  "md": "---\n\n\ntitle: \"How to Write a Product Marketing Plan: A Step by Step Guide [With Example + Best App Recommendation]\"\n\n\nauthor: \"Xuan Pang\"\n\n\ntags: Content\n\n\nslug: product-marketing-plan-guide\n\n\ndescription: \"Learn how to write a comprehensive product marketing plan with our step-by-step guide. Includes a detailed example and the best app recommendation to streamline your planning process.\"\n\n\ncreated: 2024-06-14\n\n\nupdated: 2024-06-14\n\n\nlayout: blog\n\n\npublish: true\n\n\n---\n\n\n\n![8QTaTeZpL4xaaamJ_bneWZdJaRIobgD5zVhWfRzvSfI=](/blobs/8QTaTeZpL4xaaamJ_bneWZdJaRIobgD5zVhWfRzvSfI=)\n\n\nThanks to modern technology, marketing offers more diverse opportunities than ever before. Multichannel marketing is now the norm, providing businesses with numerous ways to reach consumers. However, this also adds complexity. Staying on top of diverse marketing platforms and maximizing their potential to extend reach and boost engagement is an immense task.\n\n\nTo stay organized, a comprehensive, [streamlined marketing plan](https://affine.pro/blog/what-is-marketing-management-complete-guide) is essential. This document provides a guiding vision for your marketing goals, enabling your team to [collaborate effectively](https://affine.pro/blog/team-building-activities-for-collaboration-success) and implement a coherent strategy. Essentially, it serves as a [road map](https://affine.pro/blog/5-best-free-tools-agile-roadmap-templates-2023) for how you will communicate about your product or service to consumers.\n\n\nCreating a marketing plan now helps avoid bottlenecks later and ensures an efficient path to market. A well-prepared [marketing plan](https://affine.pro/blog/crafting-an-effective-one-page-marketing-plan-a-step-by-step-guide) can generate buzz about a product even before itâ€™s available to consumers.\n\n\nThis step-by-step guide provides practical tips for writing a marketing plan tailored to your unique business goals, whether you aim to diversify your customer base or ramp up revenue.\n\n\n\n\n\n# **What is a Marketing Plan?**\n\n\n\n![ftump0fnNMLFIBX6R7-T_5qQZF5gPXFA_pn0RSf_X1o=](/blobs/ftump0fnNMLFIBX6R7-T_5qQZF5gPXFA_pn0RSf_X1o=)\n\n\nA marketing plan is a roadmap that outlines and defines a company's marketing goals, strategies, and [implementation process](https://affine.pro/blog/the-7-key-stages-marketing-sales-pipeline-visual-guide). A successful marketing plan helps companies conceptualize marketing strategies using available data and research beforehand to streamline the implementation process and produce the best possible outcome. In summary, a marketing plan outlines a company's objectives, [strategies](https://affine.pro/blog/10-best-b2b-social-media-marketing-strategies), and desired results.\n\n\n\n\n\n# **Marketing Plan Preparation Step by Step**\n\n\nTaking the time to prepare your marketing campaigns thoroughly is crucial. Companies that experience the most success with their marketing plans put careful thought, research, and consideration into the final document. To create a strong marketing plan, follow these preparation steps:\n\n\n#### **1. Know Your Competition**\n\n\nCompetitor research helps companies understand how their competitors are currently achieving success, where their vulnerabilities lie, and how they can successfully compete with existing products and services. Competitor research also prevents companies from creating products or services too similar to existing ones or overpricing them. Activities for conducting competitor research include reading competitor newsletters, following them on [social media](https://affine.pro/blog/top-10-social-media-advertising-benefits-marketing-experts), and examining their website content.\n\n\n#### **2. Run a SWOT Analysis**\n\n\nA [SWOT analysis](https://affine.pro/blog/top-10-free-editable-swot-analysis-template-examples) helps companies decide how to maximize opportunities and minimize threats by understanding their strengths and weaknesses. It aids in developing goals and objectives that align with the company's mission. A SWOT analysis evaluates a company's strengths, weaknesses, opportunities, and threats.\n\n\n* **_Example by [AFFiNE](https://affine.pro/):_**\n\n\n\n![e19GKElEUueKZmqKdr3J2s28IX59apl-2P_aodnr-4I=](/blobs/e19GKElEUueKZmqKdr3J2s28IX59apl-2P_aodnr-4I=)\n\n\n#### **3. Develop [Buyer Personas](https://blog.hubspot.com/marketing/buyer-persona-research)**\n\n\nA buyer persona details the specific qualities and traits of the customer most interested in buying a company's product or service. This qualitative data explains why they would purchase a product or use a service by creating a comprehensive bio of the market segment. Creating buyer personas allows the company to target people who are most likely to buy from them, optimizing resource allocation.\n\n\n* **_Example by [AFFiNE](https://affine.pro/):_**\n\n\n\n![Dh4S_wmXXswfd4OzZB56RgarXGj8FrnFdj2cdsYWOOs=](/blobs/Dh4S_wmXXswfd4OzZB56RgarXGj8FrnFdj2cdsYWOOs=)\n\n\n#### **4. Set Budget Parameters**\n\n\nBusinesses need to understand how to allocate funds for particular strategies to get the best [return on investment (ROI)](https://www.investopedia.com/terms/r/returnoninvestment.asp#:~:text=Return%20on%20investment%20(ROI)%20is%20calculated%20by%20dividing%20the%20profit,when%20expressed%20as%20a%20percentage.). Budgets set boundaries for marketing spending, determining which marketing channels can be implemented.\n\n\n#### **5. Establish KPIs and Goals**\n\n\n[Key performance indicators (KPIs)](https://www.qlik.com/us/kpi) and goals ensure that marketing campaigns meet the company's expectations. KPIs provide the data needed to make necessary changes after a campaign has launched. Establishing these early on is crucial for launching successful [marketing campaigns](https://affine.pro/blog/marketing-action-plan) that help companies achieve their desired outcomes.\n\n\n#### **6. Create an Outline**\n\n\nWhile marketing plans vary from organization to organization, a basic outline helps conceptualize a marketing plan. Elements of a marketing plan outline should include business information, competition, strengths and weaknesses, target buyers, [buying cycle patterns](https://www.indeed.com/career-advice/career-development/buying-cycles), [unique selling proposition (USP)](https://www.shopify.com/blog/unique-selling-proposition), brand, website, marketing channels, [SEO](https://searchengineland.com/guide/what-is-seo), KPIs, and strategies.\n\n\n# **How to Write a Marketing Plan**\n\n\nWith a better understanding of the prerequisite research required to draft a marketing plan, it's time to use this planning and research to draft a comprehensive marketing plan. Follow these steps to draft an effective marketing plan for your organization:\n\n\n#### **1. Identify the [Company's Mission](https://www.bain.com/insights/management-tools-mission-and-vision-statements/)**\n\n\nThe company's mission is the foundation for all branding and marketing. This mission statement and the company's values impact internal processes, consumer perception, and the company's direction as it scales and develops.\n\n\n#### **2. Address the Competition**\n\n\nMarketing plans should [address the competition](https://affine.pro/blog/top-10-free-competitive-analysis-templates-boost-your-business) and how the company distinguishes itself from existing brands to fill a specific need in the industry. Understanding both direct and indirect competition is crucial for positioning your product or service effectively.\n\n\n* **_Example by [AFFiNE](https://affine.pro/):_**\n\n\n\n![dVBjmd99Z0qlPZ5-Q0qkDYUen56hZoe2707-IWE6sJs=](/blobs/dVBjmd99Z0qlPZ5-Q0qkDYUen56hZoe2707-IWE6sJs=)\n\n\n#### **3. Determine Strengths and Weaknesses**\n\n\nUsing a SWOT analysis, companies can understand where they have an advantage and which areas need improvement. This comprehensive analysis addresses strengths, weaknesses, opportunities, and threats, providing a clear picture of the company's market position.\n\n\n* _**Get more SWOT templates >>** [SWOT templates by AFFiNE](https://affine.pro/blog/top-10-free-editable-swot-analysis-template-examples)_\n\n\n#### **4. Describe the Target Buyers**\n\n\nCreating a buyer persona helps companies understand who they are targeting in their marketing strategy. Describing these individuals helps determine the best marketing channels for reaching them and tailoring the marketing message to their needs and preferences.\n\n\n#### **5. Identify the Unique Selling Proposition (USP)**\n\n\nUse market research to understand the ideal customer's preferences and detail precisely how the company fulfills a need that other competitors don't. Highlighting what makes the product or service unique helps differentiate the company in the market.\n\n\n* **_Example by [AFFiNE](https://affine.pro/):_**\n\n\n\n![MgOQEA0U493p_ncek8F1le3L8wx_2pct2jMPKR0Wt-4=](/blobs/MgOQEA0U493p_ncek8F1le3L8wx_2pct2jMPKR0Wt-4=)\n\n\n#### **6. Determine Marketing Channels and Best Practices**\n\n\nBased on the research, determine which [marketing channels](https://affine.pro/blog/10-best-b2b-social-media-marketing-strategies) are most effective and establish best practices for each. This ensures that marketing efforts are targeted and efficient, using strategies that resonate with the target audience.\n\n\n#### **7. Track Measurements Through KPIs**\n\n\nEstablish KPIs to measure the success of your [marketing plan](https://affine.pro/blog/crafting-an-effective-one-page-marketing-plan-a-step-by-step-guide). These metrics help track the effectiveness of various elements of marketing campaigns, allowing for data-driven adjustments to improve performance.\n\n\n#### **8. Develop Marketing Strategies**\n\n\nDefine detailed [marketing strategies](https://affine.pro/blog/top-10-social-media-advertising-benefits-marketing-experts) to help marketers execute plans effectively. These strategies should be flexible, allowing for adjustments based on ongoing data analysis and market feedback.\n\n\nBy following these steps, you can create a detailed and effective marketing plan that aligns with your business goals and maximizes your marketing efforts.\n\n\n\n\n\n## **Discover [AFFiNE AI](https://affine.pro/blog/affine-0-12-0-launch-week-day-3-early-access-affine-ai-self-host-upcoming-0-13-unveiled) : Your Ultimate Marketing Plan Tool**\n\n\n<iframe\n  type=\"text/html\"\n  width=\"100%\"\n  height=\"410px\"\n  src=\"https://www.youtube.com/embed/l0N-6vTf9nY\"\n  frameborder=\"0\"\n  allow=\"accelerometer; autoplay; clipboard-write; encrypted-media; gyroscope; picture-in-picture; web-share\"\n  allowfullscreen>\n</iframe>\n\n\nAFFiNE stands out as a state-of-the-art marketing plan tool, meticulously crafted to employ AI to streamline the [organization](https://affine.pro/blog/15-types-events-event-management-categories-examples), management, and collaboration on tasks, [projects](https://affine.pro/blog/best-project-planning-tools-software-for-teams-2023), and real-time information. What distinguishes AFFiNE is its unique offering as a free and [open-source](https://affine.pro/blog/five-best-open-source-miro-alternatives-2023) program, leveraging offline technology to ensure accessibility for all users.\n\n\nExplore [AFFiNE AI](https://affine.pro/blog/affine-0-12-0-launch-week-day-3-early-access-affine-ai-self-host-upcoming-0-13-unveiled), your true multimodal AI copilot, dedicated to turning \"all your market ideas into reality.\"\n\n\n\n![w6sbhxbPgo7gWXvkKqnEfLFi-MQTKThYj7SweGMRkoo=](/blobs/w6sbhxbPgo7gWXvkKqnEfLFi-MQTKThYj7SweGMRkoo=)\n\n\n**Key features:**\n\n\n* **[Write](https://affine.pro/blog/how-to-write-sop-step-by-step-guide-5-best-free-tools-templates) with You:** Leveraging AI technology, [AFFiNE AI](https://affine.pro/blog/affine-0-12-0-launch-week-day-3-early-access-affine-ai-self-host-upcoming-0-13-unveiled) provides intelligent assistance for every step of your writing process, from crafting sentences to entire articles. Whether you're creating content, professionally rewriting, adjusting tone, or correcting spelling and grammar, AFFiNE AI makes your text more vivid and accurate.\n\n\n\n![SBMr8BT1bbb5eyroL-KdqZUjHinJL6qhXAimhvalkqg=](/blobs/SBMr8BT1bbb5eyroL-KdqZUjHinJL6qhXAimhvalkqg=)\n\n\n* **[Draw](https://affine.pro/blog/top-8-figma-competitors-alternatives-design-prototyping) with You:** With the power of AI, AFFiNE AI can transform your outlines or ideas into eye-catching visual works. Whether it's creating presentations or building [mind maps](https://affine.pro/blog/top-5-mind-maps-examples-and-tools), AFFiNE AI helps you clearly express and share your creativity.\n\n\n\n![hqMbV7LGTsX2HQL8cyTXUj5t1e3IWfR4VQVSXHwZtv0=](/blobs/hqMbV7LGTsX2HQL8cyTXUj5t1e3IWfR4VQVSXHwZtv0=)\n\n\n* **Present with You:** AFFiNE's AI-powered PowerPoint generator allows you to craft polished and presentation-ready slides with just one click. By inputting your content descriptions, AFFiNE effortlessly generates visually stunning slides that captivate your audience. This feature enables you to create professional presentations quickly and efficiently, making the process seamless and visually appealing.\n\n\n\n![2H7E70tsUay2apiS8wHOjr7afyRDCJJLyMBGYR-utMc=](/blobs/2H7E70tsUay2apiS8wHOjr7afyRDCJJLyMBGYR-utMc=)\n\n\n**Come and join us on our journey over on our media platforms. ðŸš€ðŸ”§**\n\n\n* Official Website: [https://affine.pro/](https://affine.pro/)\n\n\n* GitHub: [https://github.com/toeverything/AFFiNE](https://github.com/toeverything/AFFiNE)\n\n\n* Twitter: [https://twitter.com/AffineOfficial](https://twitter.com/AffineOfficial)\n\n\n* Community: [https://community.affine.pro/home](https://community.affine.pro/home)\n\n\n* Discord: [https://discord.gg/Arn7TqJBvG](https://discord.gg/Arn7TqJBvG)\n\n\n* Telegram: [https://t.me/affineworkos](https://t.me/affineworkos)\n\n\n\n\n\n",
  "publish": true
}