{
  "title": "The 7 Best Open-Source Clickup Alternatives in 2024",
  "authors": [
    "Jackie Peng"
  ],
  "tags": [
    "Content"
  ],
  "description": "ClickUp is a cloud-based project management and collaboration tool - this article introduces some of the best open-source alternatives you might like to try.",
  "created": 1679616000000,
  "updated": 1704153600000,
  "layout": "blog",
  "id": "z24QFEMV4H",
  "slug": "seven-best-open-source-clickup-alternatives-2023",
  "cover": "/blobs/_0TwsTSk9qz1doKEl9YTDMiwSuZS4cpQGCaaKS7BySg=",
  "md": "---\n\n\ntitle: \"The 7 Best Open-Source Clickup Alternatives in 2024\"\n\n\nauthor: Jackie Peng\n\n\ntags: Content\n\n\nslug: seven-best-open-source-clickup-alternatives-2023\n\n\ndescription: \"ClickUp is a cloud-based project management and collaboration tool - this article introduces some of the best open-source alternatives you might like to try.\"\n\n\ncreated: 2023-03-24\n\n\nupdated: 2024-01-02\n\n\nlayout: blog\n\n\npublish: true\n\n\n---\n\n\n\n![_0TwsTSk9qz1doKEl9YTDMiwSuZS4cpQGCaaKS7BySg=](/blobs/_0TwsTSk9qz1doKEl9YTDMiwSuZS4cpQGCaaKS7BySg=)\n\n\nClickUp, a renowned project management tool, has gained popularity among users. However, it may not cater to everyone's specific needs. Fear not, as we present you with a selection of the most captivating open-source alternatives to ClickUp for 2023. These exceptional alternatives have been carefully curated and are listed below in no particular order. Let's explore the seven finest open-source alternatives that are sure to captivate your interest and meet your project management requirements.\n\n\n\n---\n\n\n## 1) AFFiNE\n\n\nAFFiNE emerges as a standout open source productivity tool tailored for both individuals and teams who value data privacy and security as paramount. With a seamless transition between Edgeless mode and paper mode, AFFiNE offers users unparalleled versatility while maintaining complete control over their data. What sets AFFiNE apart is its unwavering commitment to a \"Local First\" approach, enabling uninterrupted accessibility even in the absence of an internet connection. Alongside its robust offline support, AFFiNE presents innovative features like the exclusive \"Local First\" Workspace, empowering users with a dedicated space for efficient collaboration. The user-friendly Block Hub further enhances productivity with its intuitive drag-and-drop functionality. By placing data privacy at the forefront, providing comprehensive offline capabilities, and delivering user-friendly features, AFFiNE rapidly gains traction as the premier alternative to ClickUp, captivating the attention of individuals and teams seeking a secure and versatile project management solution.\n\n\n**Pros:**\n\n\n* AFFiNE offers a local-first approach, meaning you have complete control over your data while still having a seamless experience.\n\n\n* Database\n\n\n  * Easily create, organize, and track your daily note like never before. Say goodbye to complex processes and welcome an unprecedented ease-of-use way\n\n\n\n![s1-kYhapEsBPNhy4eDA2SnXKwB_ws6Ke7dGXUqpMjDo=](/blobs/s1-kYhapEsBPNhy4eDA2SnXKwB_ws6Ke7dGXUqpMjDo=)\n\n\n* Powerful Edgeless mode\n\n\n  * Visualize and connect your daily ideas smoothly with better cartoon-style shape, slick pen, and connectors. No constraints. Limited only by your imagination. Ohhh, by the way, images now are supported to upload!! We just make everything easy for you, now you may enjoy your drawing time!\n\n\n  \n![6ANoWk9Wn5mf2IsgS-yy-MRN-cf1iRf4VZfF9ihUAgs=](/blobs/6ANoWk9Wn5mf2IsgS-yy-MRN-cf1iRf4VZfF9ihUAgs=)\n\n\n* Notion/html/markdown import-supported\n\n\n  * Effortlessly import Notion, HTML, or Markdown content into AFFiNE with just a few simple clicks, preserving formatting, and structure, and saving time, enhancing user experience. Say goodbye to the complicated process of manually converting and adjusting content.\n\n\n\n\n\n  \n![Funez4FG6_YYPlgBYoKy3M7F2NJLCtwrE7NplHuuB4Q=](/blobs/Funez4FG6_YYPlgBYoKy3M7F2NJLCtwrE7NplHuuB4Q=)\n\n\n* Featuring an all-page UI update with filter options\n\n\n  * Users can now effortlessly access the all-page, which enables them to conveniently sort previous articles in ascending or descending order, or favourites with the filter function. Enjoy efficient organization, quick access to desired content, and a seamless browsing experience.\n\n\n\n![1g2H5Hhy5gspGUGP2LnD5e2O2dyKzVpE-6rvabbR5oA=](/blobs/1g2H5Hhy5gspGUGP2LnD5e2O2dyKzVpE-6rvabbR5oA=)\n\n\n**Cons:**\n\n\n* AFFiNE may not have as many features or integrations as some other productivity tools.\n\n\n* Some users may prefer a cloud-first approach instead of the local-first approach offered by AFFiNE.\n\n\nIf you wanna know more about what you can do with the use of AFFiNE, can read:\n\n\n* Come and check with our latest [beta version](https://affine.pro/blog/whats-new-affine-0518), enjoy your creative moments.\n\n\n* [5 Best Free Daily Planner Apps for 2023 (Features, Price) | AFFiNE — All In One KnowledgeOS](https://affine.pro/blog/5-best-free-daily-planner-apps-for-2023)\n\n\n* For more things related to AFFiNE, Come and check out our website: [AFFiNE — All In One KnowledgeOS](https://affine.pro/)\n\n\n* Wanna try it online: [https://app.affine.pro/](https://app.affine.pro/)\n\n\n## 2) Joplin\n\n\n\n![UHk83BGY0kkQ9okPlPxtw9gXzlBsSAdSdhZn6FNqXDs=](/blobs/UHk83BGY0kkQ9okPlPxtw9gXzlBsSAdSdhZn6FNqXDs=)\n\n\nJoplin, a remarkable free and open-source note-taking and to-do application, effortlessly syncs across all your devices, ensuring seamless access to your content wherever you go. With support for Markdown formatting and the ability to attach files, Joplin provides a versatile platform for capturing and organizing your thoughts. Its robust search function enables quick and efficient retrieval of information, allowing you to stay productive and organized. What sets Joplin apart is its commitment to security, offering end-to-end encryption to safeguard your data. However, its standout feature lies in its ability to import notes from Evernote, making the transition to Joplin smooth and hassle-free. With Joplin, you can enjoy a feature-rich and privacy-conscious note-taking and to-do app that seamlessly integrates into your workflow, making it a top choice for individuals seeking a powerful and secure note-taking solution\n\n\n**Pros:**\n\n\n* Supports Markdown formatting and file attachments\n\n\n* Offers end-to-end encryption\n\n\n* Can import notes from Evernote\n\n\n\n\n\n**Cons:**\n\n\n* Interface may not be as user-friendly as some other note-taking apps\n\n\n* Limited collaboration features\n\n\nWith Joplin, you can enjoy the benefits of Markdown formatting and file attachments, ensure the security of your data through end-to-end encryption, and easily migrate your notes from Evernote. It's a comprehensive and secure note-taking solution that caters to your productivity needs.\n\n\n## 3) Standard Notes\n\n\n\n![8uAuR74rRoQGuM2KNwCwgKF-r9Chvfj0vnCrU7esySE=](/blobs/8uAuR74rRoQGuM2KNwCwgKF-r9Chvfj0vnCrU7esySE=)\n\n\nStandard Notes is an exceptional open-source note-taking app that prioritizes your privacy and security. With a minimalist interface, it provides a streamlined user experience while offering a robust set of features. Standard Notes supports Markdown, enabling you to create well-structured and formatted notes effortlessly. The app also allows you to attach files to your notes, ensuring all relevant information is in one place. Organization is made easy with the option to add tags to your notes, enabling efficient categorization and retrieval. However, the standout feature of Standard Notes lies in its encryption capability, providing a high level of security to keep your notes safe from unauthorized access. With Standard Notes, you can enjoy a powerful and privacy-focused note-taking experience that ensures the confidentiality of your information.\n\n\n**Pros:**\n\n\n* Offers end-to-end encryption\n\n\n* Supports Markdown formatting and file attachments\n\n\n* Tags for better organization\n\n\n\n\n\n**Cons:**\n\n\n* No collaboration features\n\n\n* Limited customization options\n\n\n## 4) Turtl\n\n\n\n![Xw2LsU-PFl9eCkrykYxIpdn2MOZ9fOVS_7lSkwl7SSk=](/blobs/Xw2LsU-PFl9eCkrykYxIpdn2MOZ9fOVS_7lSkwl7SSk=)\n\n\nTurtl is a remarkable note-taking app that places a strong emphasis on privacy and security. It provides a secure platform for storing and sharing notes, bookmarks, and even passwords. With Turtl, you can take advantage of Markdown formatting to create well-structured notes, while also incorporating images to enhance your content. The app offers a robust search function, allowing you to quickly find specific information within your notes. Turtl's commitment to security is evident through its implementation of end-to-end encryption, ensuring that your data remains protected from unauthorized access. Moreover, Turtl's ability to sync seamlessly across all your devices ensures that your information is always accessible whenever and wherever you need it. With Turtl, you can enjoy a privacy-focused note-taking experience with comprehensive features that prioritize security and convenience.\n\n\n**Pros:**\n\n\n* Offers end-to-end encryption\n\n\n* Syncs across all your devices\n\n\n* Supports Markdown formatting and images\n\n\n\n\n\n**Cons:**\n\n\n* No collaboration features\n\n\n* Limited customization options\n\n\n## 5) Trilium Notes\n\n\n\n![qFgGoqv8VLzKNgy43ULOqXYD17LGvgpNYpenadt4qG4=](/blobs/qFgGoqv8VLzKNgy43ULOqXYD17LGvgpNYpenadt4qG4=)\n\n\nTrilium Notes is an exceptional open-source note-taking app designed to enhance your organizational capabilities. With Trilium, you can effortlessly arrange your notes in a hierarchical tree structure, enabling a systematic approach to managing your information. The app supports Markdown formatting, allowing you to create visually appealing and structured notes. Additionally, Trilium enables file attachments, ensuring all relevant resources are easily accessible within your notes. The powerful search function empowers you to swiftly locate specific information across your notes. Trilium prioritizes the security of your data by offering end-to-end encryption, safeguarding your notes from unauthorized access. However, the standout feature of Trilium lies in its ability to link notes to each other, creating a network of interconnected ideas and facilitating seamless navigation between related content. With Trilium Notes, you can experience an open-source note-taking solution that provides advanced organization, security, and the unique ability to establish meaningful connections between your notes.\n\n\n**Pros:**\n\n\n* Offers end-to-end encryption\n\n\n* Supports Markdown formatting and file attachments\n\n\n* Ability to link notes to each other\n\n\n\n\n\n**Cons:**\n\n\n* Interface may not be as user-friendly as some other note-taking apps\n\n\n* Limited collaboration features\n\n\n## 6) Laverna\n\n\n\n![8lFtc-xV00fo_t2fUVvTVyUORkYTu9xOcb5XWoa0eUU=](/blobs/8lFtc-xV00fo_t2fUVvTVyUORkYTu9xOcb5XWoa0eUU=)\n\n\nLaverna is an impressive open-source note-taking app that excels in simplicity and privacy. With a user-friendly interface, Laverna provides a seamless note-taking experience. It supports Markdown formatting, allowing you to create structured and visually appealing notes effortlessly. The app also enables file attachments, ensuring you can easily incorporate relevant resources into your notes. Laverna's robust search function enables quick retrieval of specific information within your notes, enhancing productivity. In terms of security, Laverna offers end-to-end encryption, ensuring the confidentiality of your data. However, its standout feature lies in its ability to synchronize your notes across all your devices, allowing you to access and update your information seamlessly, regardless of the device you're using. With Laverna, you can enjoy a simple yet powerful note-taking solution that prioritizes your privacy while offering convenience through seamless synchronization.\n\n\n**Pros:**\n\n\n* Offers end-to-end encryption\n\n\n* Syncs across all your devices\n\n\n* Supports Markdown formatting and file attachments\n\n\n\n\n\n**Cons:**\n\n\n* No collaboration features\n\n\n* Limited customization options\n\n\n## 7) QOwnNotes\n\n\n\n![qTcjteljpeiewU8bSd4lHMNMa5AZf4QxFan0kCHs3YI=](/blobs/qTcjteljpeiewU8bSd4lHMNMa5AZf4QxFan0kCHs3YI=)\n\n\nQOwnNotes is an open-source note-taking app that allows you to create and manage notes in a plain-text format. It supports Markdown formatting, file attachments, and has a powerful search function. QOwnNotes also offers end-to-end encryption for added security. Its killer feature is its ability to sync your notes with your ownCloud or Nextcloud account.\n\n\n**Pros:**\n\n\n* Offers end-to-end encryption\n\n\n* Syncs with ownCloud or Nextcloud\n\n\n* Supports Markdown formatting and file attachments\n\n\n\n\n\n**Cons:**\n\n\n* Interface may not be as user-friendly as some other note-taking apps\n\n\n* Limited collaboration features\n\n\n\n---\n\n\nAFFiNE is still in beta, but we are continuing to build to a more feature-rich and stable build. Come and join us on our journey over on our media platforms.\n\n\n* Official Website: [https://affine.pro/](https://affine.pro/)\n\n\n* GitHub: [https://github.com/toeverything/AFFiNE](https://github.com/toeverything/AFFiNE)\n\n\n* Discord: [https://discord.gg/Arn7TqJBvG](https://discord.gg/Arn7TqJBvG)\n\n\n* Telegram: [https://t.me/affineworkos](https://t.me/affineworkos)\n\n\n",
  "publish": true
}