{
  "title": "Strategic Planning vs Tactical Planning: Whatâ€™s the Difference?",
  "authors": [
    "Yanxi Liu"
  ],
  "tags": [
    "Content"
  ],
  "description": "Delve into the captivating world of strategic planning versus tactical execution and unearth the secrets that drive businesses forward. Learn how long-term vision combines with agile maneuvers to navigate the ever-changing landscape of company success.",
  "created": 1707091200000,
  "updated": 1707091200000,
  "layout": "blog",
  "id": "l1br0g2BE-2ugOf6BwiNj",
  "slug": "strategic-planning-vs-tactical-planning-what-is-the-difference",
  "cover": "/blobs/d8Nnvq7lXeWK-UkWwt4jyg9QAYtdVY1UhF9wrolla5s=",
  "md": "---\n\n\ntitle: \"Strategic Planning vs Tactical Planning: Whatâ€™s the Difference?\"\n\n\nauthor: \"Yanxi Liu\"\n\n\ntags: Content\n\n\nslug: strategic-planning-vs-tactical-planning-what-is-the-difference\n\n\ndescription: \"Delve into the captivating world of strategic planning versus tactical execution and unearth the secrets that drive businesses forward. Learn how long-term vision combines with agile maneuvers to navigate the ever-changing landscape of company success.\"\n\n\ncreated: 2024-02-05\n\n\nupdated: 2024-02-05\n\n\nlayout: blog\n\n\npublish: true\n\n\n---\n\n\n\n![d8Nnvq7lXeWK-UkWwt4jyg9QAYtdVY1UhF9wrolla5s=](/blobs/d8Nnvq7lXeWK-UkWwt4jyg9QAYtdVY1UhF9wrolla5s=)\n\n\nWhen it comes to accomplishing your goals, whether it's developing a new product, hiring new employees, or rebranding your company, meticulous planning is essential. Strategic and tactical planning are two approaches that can help you achieve success. While strategic planning involves long-term, high-level decision-making, tactical planning focuses on the practical steps needed to implement your strategy effectively.\n\n\nIn this article, we will delve deeper into the following topics:\n\n\n* Distinguishing the difference between strategy and tactical\n\n\n* Understanding the concept of strategic planning and the advantages it offers\n\n\n* Exploring the significance of tactical planning and its key benefits\n\n\n* The role of project management software in effectively managing strategy and tactics\n\n\n## **The Difference Between Strategic Planning  and Tactic Planning**\n\n\nIn essence, strategic planning and tactic planning possess distinct roles within an organization. Strategic planning sets the overarching direction and destination, while tactic planning define the concrete actions that facilitate reaching that destination. Without a doubt, both strategic planning and tactic planning are vital, and the success of an organization hinges on their harmonious integration.\n\n\nAs the renowned scholar Sun Tzu stated in his influential work, \"The Art of War\":\n\n\n\"Strategy without tactics is the slowest route to victory. Tactics without strategy is the noise before defeat.\"\n\n\n\n![SvIK0cURmojpUhyVzOM-Zzk8VDQdTyDxD0KlE8L0hsg=](/blobs/SvIK0cURmojpUhyVzOM-Zzk8VDQdTyDxD0KlE8L0hsg=)\n\n\n**\"Strategy and Tactics: Key Distinctions\" Created by AFFiNE**\n\n\nNow, let's delve deeper into the meaning of each concept.\n\n\n## **What is Strategic Planning?**\n\n\nStrategy planning involves determining the overall direction and goals for an organization. It's like charting a course on a map, identifying where you want to go and how you'll get there. [Strategy sets the big picture](https://affine.pro/blog/navigating-organizational-strategies-a-path-to-project-success) and provides guiding principles.\n\n\n### Benefits of Strategic Planning\n\n\n1. **Clear Direction:**Strategy planning provides a clear and defined direction for the organization, guiding decision-making and resource allocation.\n\n\n1. **Alignment:**It ensures alignment between various departments and stakeholders, fostering a unified and coordinated approach towards common goals.\n\n\n1. **Competitive Advantage:**A well-designed strategy gives organizations a competitive edge by identifying unique market opportunities and differentiating factors.\n\n\n## **What is Tactical Planning?**\n\n\nTactic planning focuses on the specific actions and steps to implement the strategy. It's like planning the individual moves on that map to reach your destination. Tactics are the practical and concrete actions that support the strategy and help achieve the desired outcomes.\n\n\n### Benefits of Tactic Planning\n\n\n1. **Execution Efficiency:** Tactic planning ensures efficient execution of the strategy by providing detailed action steps and timelines.\n\n\n1. **Focus and Prioritization:** It helps identify and [prioritize the most critical tasks](https://affine.pro/blog/best-free-task-management-software-streamline-workflow) and initiatives to achieve strategic goals.\n\n\n1. **Coordination and Collaboration:** Tactic planning [facilitates coordination and collaboration](https://affine.pro/blog/top-asynchronous-communication-tools-free-2024) among different teams and departments involved in executing the strategy.\n\n\n### What Makes A Good Strategic Planning\n\n\n1. **Clear Action Steps**: A good tactic planning process outlines clear and specific action steps required to achieve the desired outcomes.\n\n\n1. **Measurable Targets**: It establishes measurable targets and milestones to [track progress](https://affine.pro/blog/10-top-best-free-kanban-board-software-apps-2023) and ensure accountability.\n\n\n1. **Roles and Responsibilities**: Good tactic planning clearly defines roles and responsibilities to ensure everyone knows their tasks and collaborates effectively.\n\n\n1. **Timelines and Deadlines**: Tactic planning includes realistic timelines and deadlines for various activities, allowing for effective [time management.](https://affine.pro/blog/best-time-management-tools-techniques-create)\n\n\n1. **Monitoring and Adjustments**: It involves continuous monitoring of progress, allowing for adjustments and course corrections as needed to achieve the desired results.\n\n\n## **Manage Strategy and Tactics Using Project Management Software**\n\n\nSuccessful business starts with organized planning. If you're looking for a way to keep your business goals organized, consider using project management software ---AFFiNE. Project management software like AFFiNE can help connect your day-to-day tactics to long-term strategy and finally contribute to your company's success.\n\n\nHere are the key features of AFFiNE:\n\n\n* **Rich Template Gallery:** AFFiNE offers a rich template gallery, providing a wide range of templates to help people manage tasks, stay focused, and improve their efficiency. Many of these tools are geared towards scheduling reminders and mind mapping, allowing users to use AFFiNE to assist them in enhancing their productivity.\n\n\n\n![jjB7kqXvP0yEK84H4crT5VV3sVZXar6GvT5CQ1faGvs=](/blobs/jjB7kqXvP0yEK84H4crT5VV3sVZXar6GvT5CQ1faGvs=)\n\n\n[AFFiNE Project Planning Template](https://app.affine.pro)\n\n\n\n![szqAEHcp8xW5WCdIZM833AaUTbgbRhAN2vpl6fmHw1E=](/blobs/szqAEHcp8xW5WCdIZM833AaUTbgbRhAN2vpl6fmHw1E=)\n\n\n[AFFiNE Gantt Chart Template](https://app.affine.pro)\n\n\n* **Write, [Draw](https://affine.pro/blog/best-free-digital-whiteboard-apps-2023), and [Plan](https://affine.pro/blog/best-project-planning-tools-software-for-teams-2023) All-in-One:** Enjoy your all-in-one KnowledgeOS solution for effortlessly writing, drawing, and planning on a hyper-fused platform. It supports [kanban](https://affine.pro/blog/affine-080-launch-week-day3), table, and rich-text paragraphs as building blocks to form pages or whiteboards. It carries out integrated processing here in document editing, data processing, or brainstorming.\n\n\n\n![O88V12dZ7eALpdMD8-6eyyfRec5yZyWiQxCnvNEb3r0=](/blobs/O88V12dZ7eALpdMD8-6eyyfRec5yZyWiQxCnvNEb3r0=)\n\n\n* **[Collaborative Capabilities:](https://affine.pro/blog/affine-0-10-0-launch-week-day-5-5-stable-with-cloud-support-finally-available-to-every-pro-in-your-team)** For group work, the app should have collaborative features, making it easy to share and coordinate projects with others in your group work.\n\n\n  \n![71MN7zgKOg2C73idwSU66YEnVUK8x41Jqwwe2z9CiPU=](/blobs/71MN7zgKOg2C73idwSU66YEnVUK8x41Jqwwe2z9CiPU=)\n\n\n**AFFiNE** is capable of assisting businesses of all sizes in the development and implementation of realistic and successful plans. From daily planning and task management to crafting strategic and tactical marketing plans, we've got you covered. Presently, AFFiNE has launched its [Stable Version](https://affine.pro/download), with ongoing efforts to develop a more comprehensive and dependable iteration. Join us on our voyage through our social media channels and be part of the experience. **Come and join us on our journey over on our media platforms.** ðŸš€\n\n\n* Official Website: [https://affine.pro/](https://affine.pro/)\n\n\n* GitHub: [https://github.com/toeverything/AFFiNE](https://github.com/toeverything/AFFiNE)\n\n\n* Discord: [https://discord.gg/Arn7TqJBvG](https://discord.gg/Arn7TqJBvG)\n\n\n* Twitter: [https://twitter.com/AffineOfficial](https://twitter.com/AffineOfficial)\n\n\n\n\n\n\n\n\n\n\n\n\n\n\n",
  "publish": true
}