{
  "title": "The 7 Key Stages of Marketing and Sales Pipeline: A Visual Guide",
  "authors": [
    "Yiyang Zhang"
  ],
  "tags": [
    "Content"
  ],
  "description": "Upgrade your business by understanding the marketing and sales pipeline stages. Gain valuable insights with a visual guide.",
  "created": 1705536000000,
  "updated": 1705536000000,
  "layout": "blog",
  "id": "8qOgCVO2hmFF1tg4PRIxD",
  "slug": "the-7-key-stages-marketing-sales-pipeline-visual-guide",
  "cover": "/blobs/TKqBNGpGiuQUAKSLZuUZikR7wcrrGch9DIIbaN-O6MY=",
  "md": "---\n\n\ntitle: \"The 7 Key Stages of Marketing and Sales Pipeline: A Visual Guide\"\n\n\nauthor: \"Yiyang Zhang\"\n\n\ntags: Content\n\n\nslug: the-7-key-stages-marketing-sales-pipeline-visual-guide\n\n\ndescription: \"Upgrade your business by understanding the marketing and sales pipeline stages. Gain valuable insights with a visual guide.\"\n\n\ncreated: 2024-01-18\n\n\nupdated: 2024-01-18\n\n\nlayout: blog\n\n\npublish: true\n\n\n---\n\n\n\n![TKqBNGpGiuQUAKSLZuUZikR7wcrrGch9DIIbaN-O6MY=](/blobs/TKqBNGpGiuQUAKSLZuUZikR7wcrrGch9DIIbaN-O6MY=)\n\n\nReady to supercharge your business growth? Ever wondered what sets thriving companies apart in today's cutthroat [business](https://affine.pro/blog/how-to-introduce-new-business-social-media-strategic-steps-examples) landscape?\n\n\nIt all boils down to one secret weapon – a finely tuned-marketing and sales pipeline! In the competitive realm we navigate, having more than just a roadmap is crucial; it's about having a dynamic lifeline that seamlessly guides your potential customers from their first interaction to the ultimate deal closure.\n\n\nWhat makes a remarkable marketing and sales pipeline, and how can it be the game-changer your business needs? Buckle up as we take you on a journey through the essential stages of this powerhouse [strategy](https://affine.pro/blog/how-to-build-go-to-market-strategy-free-templates). This isn't your typical business article; this is a visual roadmap designed to propel your business to new heights. Your journey to business evolution starts right here.\n\n\n# What is a Marketing and Sales Pipeline?\n\n\n\n![_Pdsz4EqQVr0BVePnXVWe-zcTDmoUEAdyYjMLKw7-u0=](/blobs/_Pdsz4EqQVr0BVePnXVWe-zcTDmoUEAdyYjMLKw7-u0=)\n\n\nA marketing and sales pipeline is a strategic framework that visually maps the entire journey from prospect awareness to paying customers. It serves as a roadmap, guiding sales and [marketing](https://affine.pro/blog/marketing-action-plan) teams through stages like attracting, nurturing, and converting leads. This framework enhances communication between teams, ensuring a seamless transition of leads. The pipeline's advantage lies in providing visibility into the customer journey, enabling proactive optimization at each stage. Ultimately, it empowers businesses to track progress, engage personally, and boost conversions for sustained success.\n\n\n# Key Benefits of an Optimized Marketing and Sales Pipeline\n\n\nAn optimized marketing and sales pipeline can bring a multitude of benefits to your business. It helps streamline the entire process from lead generation to closing a sale. By having clearly defined stages in your pipeline, you can track and manage each prospect's progress effortlessly.\n\n\n\n![Y_XOB1UzaLLDHjwks8QQ6t6bA_ieBuOpgdAhRb88e9I=](/blobs/Y_XOB1UzaLLDHjwks8QQ6t6bA_ieBuOpgdAhRb88e9I=)\n\n\n* **Better monitoring and reporting of key metrics.** You will have access to real-time data on conversion rates, customer acquisition costs, and overall sales [performance](https://affine.pro/blog/10-best-free-performance-review-templates-examples-2023). This information is invaluable when making strategic decisions or adjusting your marketing tactics.\n\n\n* **Effective lead nurturing.** With a well-structured system in place, you can ensure that no potential customers slip through the cracks. Through targeted communication at each stage of the pipeline, you can build relationships with prospects and guide them toward making a purchase decision.\n\n\n* **Improved collaboration between teams.**When everyone has visibility into the pipeline stages and where each [process](https://affine.pro/blog/top-10-best-process-mapping-tools-software-2023-free-paid) stands within it, they can work together seamlessly toward achieving sales goals.\n\n\n* **Enhanced customer experience.** By providing personalized interactions based on their specific needs at every step of their journey, an efficient marketing and sales pipeline contributes to increased revenue growth for your business by accelerating the conversion process from leads to closed deals efficiently.\n\n\n# Marketing and Sales Pipeline Key Stages Explained\n\n\n\n![zkqkYHWN31y5zSglxT-GZqbLrmekxotiyNAEXg-n1Hw=](/blobs/zkqkYHWN31y5zSglxT-GZqbLrmekxotiyNAEXg-n1Hw=)\n\n\n**Stage 1: Prospecting**\n\n\nThis is the first stage of the marketing and sales pipeline, where potential leads are identified and qualified. It involves researching target markets, identifying ideal customer profiles, and reaching out to [prospects](https://affine.pro/blog/best-free-whiteboard-layout-ideas-organization) through various channels.\n\n\n**Stage 2: Lead Generation**\n\n\nOnce prospects are identified, the focus shifts to generating leads. This can be done through tactics such as content marketing, advertising campaigns, social media engagement, SEO optimization, and more.\n\n\n**Stage 3: Lead Qualification**\n\n\nNot all leads are created equal. In this stage, marketers evaluate each lead based on predetermined criteria to determine their level of interest and buying readiness. This helps prioritize efforts toward high-quality leads that have a higher chance of conversion.\n\n\n**Stage 4: Sales Funnel Entry**\n\n\nAt this point in the pipeline, qualified leads enter the sales funnel for further nurturing by the sales team. The goal is to develop relationships with prospects by providing relevant information and addressing their pain points.\n\n\n**Stage 5: Conversion**\n\n\nThe conversion stage marks when a prospect becomes a paying customer or client. It involves closing deals through effective sales strategies like [personalized proposals](https://affine.pro/blog/10-best-free-online-sticky-notes-free-software-tools) or demonstrations that highlight how your product or service meets their specific needs.\n\n\n**Stage6: Customer Retention**\n\n\nAfter successfully converting a lead into a customer, it's vital to focus on retention strategies that keep them engaged and satisfied with your offering(s). This may include ongoing communication via newsletters or exclusive offers tailored specifically for existing customers.\n\n\n**Stage 7: Business Growth & Referrals**\n\n\nThe final stage emphasizes leveraging happy customers as brand ambassadors who refer new customers to your business organically through word-of-mouth recommendations or online reviews - contributing to further growth opportunities!\n\n\n\nUnderstanding these key stages allows businesses to optimize their marketing and sales pipelines efficiently while ensuring efficient lead management from initial contact until post-sale support – resulting in increased revenue generation!\n\n\n\n\n\n# Develop Your Marketing and Sales Pipeline in AFFiNE\n\n\nNow that you have a clear understanding of the key stages involved in a marketing and sales pipeline, it's time to put this knowledge into action. And what better way to do so than by utilizing a powerful tool like **AFFiNE**?With top-notch software like [**AFFiNE**](https://affine.pro/) at your disposal along with its intuitive interface and robust features, you can streamline your processes, improve efficiency, and drive more revenue.\n\n\n\n![5VZZiy69UNGfpn8KOwMVuvVmBr6icqfRjmd42C36r9g=](/blobs/5VZZiy69UNGfpn8KOwMVuvVmBr6icqfRjmd42C36r9g=)\n\n\nAFFiNE provides professionals with a unified platform that enables them to plan a knowledge base, collaborate with teammates, and develop [content](https://affine.pro/blog/10-best-free-storyboard-creator-software). This flexible tool empowers users to brainstorm, take notes, and set their goals while staying in sync and building content with blocks. The limitless workspace stimulates user-driven innovation. AFFiNE offers safe data storage, open-source benefits, and collaborative functionality. By leveraging these features offered by AFFINE effectively, you can optimize your marketing and sales pipeline and enhance customer engagement.\n\n\n### 1. [AFFiNE](https://app.affine.pro/)'s Marketing and Sales Pipeline Optimization Gantt Chart Template\n\n\n\n![dhGG4P50WFfUxp8gDyXqxKmFydth2vcPwQUoKdenC-4=](/blobs/dhGG4P50WFfUxp8gDyXqxKmFydth2vcPwQUoKdenC-4=)\n\n\nThe AFFiNE marketing and sales pipeline optimization Gantt chart template is designed to streamline and enhance your organization's marketing and sales processes. This visual tool ensures synchronized efforts among key teams—Marketing, Sales, Design, and Operations—throughout the pipeline journey. With detailed timelines, team responsibilities, and joint activities, this template facilitates seamless collaboration. Track progress, identify bottlenecks, and make informed decisions for successful outcomes. Use AFFiNE's template to boost efficiency, align teams, and optimize your marketing and sales pipeline with precision.\n\n\n### 2. [AFFiNE](https://app.affine.pro/)'s Sales Pipeline Report Template\n\n\n\n![0kUhZ_vhggRUzf5frvpfm9Cp0aNte1he6cPrVSJLNKY=](/blobs/0kUhZ_vhggRUzf5frvpfm9Cp0aNte1he6cPrVSJLNKY=)\n\n\nThis AFFiNE sales pipeline report template is designed to help you monitor your company's product revenue systematically. By simply inputting the names of your products, their respective costs per unit, and the total units sold, you can get a comprehensive sales report and orchestrate your sales data visually through the line chart, bubble chart, and bar chart. Leverage this data to assess profitability, allowing you to make informed adjustments in your marketing plans to your costs and markup percentages as needed following up.\n\n\n### 3. [AFFiNE](https://app.affine.pro/)'s Marketing and Sales Pipeline Presentation Template\n\n\n\n![AqiEuzmk2pY-kd896WyZdh7RPZ8_mEiV7JNFYz2-vpM=](/blobs/AqiEuzmk2pY-kd896WyZdh7RPZ8_mEiV7JNFYz2-vpM=)\n\n\nThis AFFiNE marketing and sales pipeline presentation template is designed for [efficient tracking](https://affine.pro/blog/top-10-best-agile-project-scheduling-software-2023) of leads, finances, and actions crucial to your quarterly sales objectives. This comprehensive template features columns under the Finance section where you can input deal size, probability of closure, and weighted forecast. In the Action section, monitor the deal status and closing dates. Share these insights with your sales team for informed lead prioritization based on probability percentages.\n\n\nBut wait! AFFiNE has **MORE** to discover:\n\n\n* **Template Gallery in AFFiNE:** There is a curated collection of powerful [whiteboard](https://affine.pro/blog/best-free-whiteboard-layout-ideas-organization) templates in AFFiNE. From the robust Gantt chart to the insightful 4P marketing matrix and the comprehensive SWOT, an array of additional templates awaits your exploration, promising to expand the horizons of your marketing and sales pipeline crafting and execution. These templates serve as your launchpad, enabling you to skip the groundwork and jump straight into action. Crafted for seamless collaboration, AFFiNE's templates provide structured canvases for various tasks, saving you valuable time and enhancing efficiency in project management, content creation, and [planning](https://affine.pro/blog/top-10-best-free-digital-planner-apps-2023).\n\n\n\n![OP3GdbE7dwmQKK2uKzBgJbhpVJxkLuDsVtomxcggvSQ=](/blobs/OP3GdbE7dwmQKK2uKzBgJbhpVJxkLuDsVtomxcggvSQ=)\n\n\n* **Explore Edgeless Creativity with a Whiteboard:** Unlock the full spectrum of your creative potential through our dynamic whiteboard. Boasting essential features like a plethora of colors, [diverse font options](https://affine.pro/blog/docs-edgeless-stylized-embody-your-creativity-better-and-easier), shapes, and connectors, this powerful tool is designed to elevate your creative process. Seamlessly upload images in various formats and utilize the extensive collection of styles and templates to further amplify your creativity. Transform your ideas into compelling business posters with unparalleled ease and versatility!\n\n\n\n![cXPfaH7yGKuxN6x24MrIF_2SxJEMnAdSfT2q9HhQpD4=](/blobs/cXPfaH7yGKuxN6x24MrIF_2SxJEMnAdSfT2q9HhQpD4=)\n\n\n* **Advanced Collaboration Capability:** When you do need to [collaborate](https://affine.pro/blog/top-asynchronous-communication-tools-free-2024) with other contributors to discuss your marketing and sales pipeline, AFFiNE makes getting feedback simple. Appealing collaboration capability provides visibility into assigned tasks, making tables easier to estimate, and ensuring your marketing and sales pipeline remains well-designed. You can invite team members or friends to collaborate on the marketing pipeline together, making it perfect for business scheduling.\n\n\n\n![O88V12dZ7eALpdMD8-6eyyfRec5yZyWiQxCnvNEb3r0=](/blobs/O88V12dZ7eALpdMD8-6eyyfRec5yZyWiQxCnvNEb3r0=)\n\n\n* **Orchestrate and Showcase Your Marketing and Sales Pipeline:** Are you ready to take your presentations to the next level? Look no further than AFFiNE's interactive presentation tool, designed to help you create a compelling marketing and sales pipeline that will leave a lasting impact on your audience. Don't settle for mediocrity - let us help you transform your marketing vision into a powerful statement of collaboration and innovation. Share and review your marketing pipeline with your team to provide a snapshot of the company’s financial health.\n\n\n\n![gQL0hfT2Z_6tFdy9lTIIoC_t6T8EQtsjVgw-1V-acU4=](/blobs/gQL0hfT2Z_6tFdy9lTIIoC_t6T8EQtsjVgw-1V-acU4=)\n\n\nUpgrade your business, embrace the power of AFFiNE, and witness the transformative impact on your marketing abilities. Now that you have learned how to develop your marketing and sales pipeline, it's time to implement your knowledge. And what better way to do that than with **AFFiNE**? Commence your design by using AFFiNE's user-friendly tool. Presently, **AFFiNE** has launched its [Stable Version](https://affine.pro/download), with ongoing efforts to develop a more comprehensive and dependable iteration. Join us on our voyage through our social media channels and be part of the experience. **Come and join us on our journey over on our media platforms. 🚀**\n\n\n* Official Website:[https://affine.pro/](https://affine.pro/)\n\n\n* GitHub:[https://github.com/toeverything/AFFiNE](https://github.com/toeverything/AFFiNE)\n\n\n* Discord:[https://discord.gg/Arn7TqJBvG](https://discord.gg/Arn7TqJBvG)\n\n\n* Twitter:[https://twitter.com/AffineOfficial](https://twitter.com/AffineOfficial)\n\n\n",
  "publish": true
}