{
  "title": "Enhance your Writing: Top 10 WordAI Alternative AI-generating and Rewriting Tools",
  "authors": [
    "Yanxi Liu"
  ],
  "tags": [
    "Content"
  ],
  "description": "Elevate Your Content Creation: Discover 10 WordAI Alternatives for AI-based Writing and Rewriting. Unlock New Levels of Creativity and Efficiency in Your Writing Process with These Innovative Tools.",
  "created": 1713916800000,
  "updated": 1713916800000,
  "layout": "blog",
  "id": "dH4EEBACLNIOhhR5Z6TpG",
  "slug": "top-10-wordai-alternative-ai-generating-and-rewriting-tool",
  "cover": "/blobs/W0YuM3QoROPmP27kCN-nZg2S31nyuvrGdFO_cSrk3f8=",
  "md": "---\n\n\ntitle: \"Enhance your Writing: Top 10 WordAI Alternative AI-generating and Rewriting Tools\"\n\n\nauthor: \"Yanxi Liu\"\n\n\ntags: Content\n\n\nslug: top-10-wordai-alternative-ai-generating-and-rewriting-tool\n\n\ndescription: \"Elevate Your Content Creation: Discover 10 WordAI Alternatives for AI-based Writing and Rewriting. Unlock New Levels of Creativity and Efficiency in Your Writing Process with These Innovative Tools.\"\n\n\ncreated: 2024-04-24\n\n\nupdated: 2024-04-24\n\n\nlayout: blog\n\n\npublish: true\n\n\n---\n\n\n\n![W0YuM3QoROPmP27kCN-nZg2S31nyuvrGdFO_cSrk3f8=](/blobs/W0YuM3QoROPmP27kCN-nZg2S31nyuvrGdFO_cSrk3f8=)\n\n\nAs we step into 2024, the advancements in AI technology, exemplified by OpenAI's ChatGPT, have been nothing short of remarkable. It's undeniable that AI tools not only enhance writing efficiency but also inject a sense of joy and fulfillment into our work endeavors. [Harvard Business Review](https://hbr.org/2023/06/boost-your-productivity-with-generative-ai) once indicated that AI software can automate manual and repetitive writing tasks, freeing up human resources for more complex and creative work.\n\n\nHowever, some content marketers doubt these tools, saying they churn out repetitive, low-quality, and redundant content. WordAI is great for rephrasing content, but are there better and cheaper options out there? In this article, you will explore the Top 10 Word AI alternatives for AI generating and rewriting tools and find the most suitable tool for [boosting your writing efficiency](https://affine.pro/blog/quillbot-alternatives-ai-writing) and bringing your performance to the next level.\n\n\n# **What is WordAI?**\n\n\nWordAi is a cutting-edge AI-powered text rewriter that transforms existing content into unique, high-quality versions. It employs advanced machine learning models to understand the context and meaning behind the text, ensuring that the rewritten content is original and maintains the original message. WordAi is designed to improve content quality while saving time and resources, making it an invaluable tool for content creators, marketers, and SEO specialists.\n\n\n**Key features of WordAI**\n\n\n1. **Natural Language Processing Capabilities:** WordAi goes beyond simple word swaps, using NLP to understand and recreate content with original meaning intact, ensuring high-quality and human-readable output.\n\n\n1. **Bulk Rewrite Function:** Effortlessly rewrite multiple articles at once, saving time and improving workflow efficiency, thanks to WordAi's bulk rewrite feature and API support.\n\n\n1. **Ability to Bypass AI Detectors:** WordAi cleverly avoids detection as AI-generated content, aiding in SEO by maintaining originality and readability and boosting site visibility and trust with readers.\n\n\n# **What Should You Look For in WordAI Alternatives?**\n\n\nA highly efficient generative [AI writing assistant](https://affine.pro) leverages extensive language models and is adept at self-supervision with minimal intervention. When considering top alternatives to WordAI, keep the following factors in mind:\n\n\n1. **Built on Extensive Language Models:** Effective generative AI tools rely on vast collections of structured words within an autonomous system. Opt for a tool that utilizes a large language model (LLM) to produce engaging and varied content.\n\n\n1. **Emphasis on Prompt Flexibility:** Assess how your prompts influence and shape the styles, tones, and overall quality of the generated content.\n\n\n1. **User-Friendly Interface:** AI tools should prioritize user-friendliness. Any delays, downtimes during content creation, or sluggish responses to prompts could indicate an unreliable alternative to WordAI.\n\n\n1. **Cost-Effectiveness:** Given the nascent stage of the generative AI trend, the pricing of content creation tools should remain reasonable to ensure accessibility.\n\n\n# **Top 10 WordAI Alternative AI-generating and Rewriting Tools to Leverage your Productivity**\n\n\n## **1. [AFFiNE AI](https://affine.pro)**\n\n\nGain immediate insights, refine your content effortlessly, and stimulate creativity with dynamic mind maps and polished presentation slides. AFFiNE AI empowers you to envision grander [ideas](https://affine.pro/blog/10-best-whiteboard-layout-ideas-boost-your-productivity), enhance productivity, and streamline your workflow, ultimately saving valuable time on every endeavor.\n\n\n\n![XhwBfbXzNmPOjL70F28JGgQizULkEy6j45lW63QPypE=](/blobs/XhwBfbXzNmPOjL70F28JGgQizULkEy6j45lW63QPypE=)\n\n\n<video muted autoplay loop preload=\"auto\" playsinline>\n  <source src=\"/blobs/DqPULcqb7FjaGpuBQY8YqRryU3jCKwsTZ9gR4MeHh8Q=\" type=\"video/mp4\" />\n</video>\n\n\n**Key features of AFFiNE:**\n\n\n* **Unlocking Writing Excellence with AFFiNE Inline AI Writing**\n\n\nHave you ever wished for a writing partner who could magically transform your tone, making you sound more professional or conversational at the snap of your fingers? Enter [AFFiNE Inline AI Writing](https://affine.pro/blog/quillbot-alternatives-ai-writing)! This innovative tool is your secret weapon for refining your writing style and captivating your audience with the perfect tone.\n\n\n* **Guardian for Spelling and Grammar**\n\n\nImagine having a trusty sidekick that swoops in to catch those pesky spelling and grammar errors before they ruin your masterpiece. That's exactly what AFFiNE does! With its real-time corrections, you can bid farewell to embarrassing typos and grammar slip-ups, ensuring your content shines with flawless precision.\n\n\n* **Tailoring Text Length to Perfection**\n\n\nNeed to trim down that lengthy paragraph or beef up your content with more detail? Look no further than AFFiNE! This versatile tool lets you effortlessly adjust the length of your text, helping you strike the perfect balance between brevity and depth. Say goodbye to text that's too short or too long—AFFiNE has got you covered!\n\n\n## **2. [SudoWrite](https://www.sudowrite.com/)**\n\n\n\n![7r7xwkvcP-LvkQFYJAJyo3hPdyo1tDHc2anrOiygQq4=](/blobs/7r7xwkvcP-LvkQFYJAJyo3hPdyo1tDHc2anrOiygQq4=)\n\n\nSudoWrite is an AI-powered writing tool designed to assist in generating outlines and initial drafts, effectively combating writer's block. It utilizes OpenAI's natural language model to facilitate content creation, particularly in the realm of fiction and creative writing.\n\n\nSpecifically, Sudowrite is the best tool for fiction writers. Features like Rewrite, Describe, Brainstorm, Canvas, and Character Generator help you beat writer's block and finish stories faster. Less restrictive than ChatGPT and Claude, it writes human-like stories, matches your style, and gives AI feedback.\n\n\n**Key Features of SudoWrite:**\n\n\n* Ideal for idea generation, outlining, content expansion, and overcoming writer's block.\n\n\n* **Brainstorm section:** Sudowrite gave me several brainstorming options like characters, descriptions, objects, places, and world-building.\n\n\n* **Canvas your storyboard:** Sudowrite’s Canvas feature enables you to organize your thoughts, characters, and story points. One standout feature is its ability to visualize characters. For example, it is an antagonist in one of the people's stories as a guy with a blue hat and a pointed, evil chin.\n\n\n* Expanding Plots, Write & Rewrite Features.\n\n\n## **3. [Copy.ai](https://copy.ai/)**\n\n\n\n![JJjhmnSUU2BQlpu63Q3u-NPVtffY3orS4LSTlnMPT7Q=](/blobs/JJjhmnSUU2BQlpu63Q3u-NPVtffY3orS4LSTlnMPT7Q=)\n\n\nCopy.ai is an AI copywriting tool powered by GPT-4, specializing in generating high-quality content for diverse purposes. It offers a user-friendly interface, an extensive template library, and features for crafting engaging content, email copy, and social media captions.\n\n\n**Key Features of Copy.ai:**\n\n\n* Infobase feature for saving and reusing crucial information.\n\n\n* **Variety of tones:** When writing an academic essay, you try to find out a professional tone. However, when you are writing to your friend you try to sound personal and intimate, so you might need the natural sound. In copy ai, you will experience a variety of tone changes, and with a simple click, you may change your passage from passive voice to active voice, a tone changer.\n\n\n* **First Draft Wizard:** This is the unique feature of copy ai, which literally writes the blog for you and writes a good one.\n\n\n## **4. [Jasper](https://www.jasper.ai/)**\n\n\n\n![WjIKkt_4ERWZJcrISHw7Dh8cOxmf0_miEGFl9b6gnnE=](/blobs/WjIKkt_4ERWZJcrISHw7Dh8cOxmf0_miEGFl9b6gnnE=)\n\n\n[Jasper](https://www.jasper.ai/) is a popular [AI content generator](https://clickup.com/blog/ai-content-generator/) for businesses that lets you create a variety of content for marketing. Though it primarily focuses on generating blog content, Jasper also lets you create social media posts, articles, emails, ads, and more.\n\n\n**Key features of Jasper:**\n\n\n* Interactive AI chatbot to quickly generate content.\n\n\n* Generates long content like blog posts, emails, reports, and stories.\n\n\n* **Interactive AI chatbot:** This feature enables users to communicate whenever and wherever they want. The AI chatbot will respond quickly and assist you with tasks, do research quickly, and answer questions all through a human-like conversation.\n\n\n* **[Generates art](https://clickup.com/blog/ai-art-generators/):** This unique feature helps users to generate amazing art and images in seconds for ads, thumbnails, illustrations, and more in high resolution without a watermark.\n\n\n## **5. [SurferSEO](https://surferseo.com/)**\n\n\n\n![Qfh5sfqFr4SJXigbgpmVkqaldwEoO3tDPtKDTmqupNY=](/blobs/Qfh5sfqFr4SJXigbgpmVkqaldwEoO3tDPtKDTmqupNY=)\n\n\nSurferSEO is a cloud-based tool primarily focused on optimizing content for search engines, featuring a generative AI tool called 'Surfer AI.' This AI tool crafts human-like blog posts while optimizing target keywords, enhancing content quality without compromising search engine optimization. Surfer will give you an SEO workflow to boost organic traffic, increase visibility and improve your rank in search results.\n\n\n**Key Features of SurferSEO:**\n\n\n* **Streamlined SEO workflow:** The search console integration with content planner has helped users automate crucial steps in the article optimization process.\n\n\n* **Generate articles and traffic:** Surfer AI doesn't just generate articles, it generates traffic. Streamline your content creation process with Surfer AI and let it do the researching, writing, and optimizing for you. You just review the final product and publish with confidence.\n\n\n* **Strong Integration:** Surfer cooperates with other content writing tools like Jasper for improved content editing processes.\n\n\n## **6. [Hypotenuse](https://www.hypotenuse.ai/?via=username&gad_source=1&gclid=Cj0KCQjwztOwBhD7ARIsAPDKnkB8RdEGJSaaTOzwxgVv7vG7VKkowpaetAqcwDaTC4EEaI1kaAZK4iYaAjQMEALw_wcB)**\n\n\n\n![ukW86Sya3l2jpGOcuRV8HxqtQ6Rk4r5shzZpzfunkJI=](/blobs/ukW86Sya3l2jpGOcuRV8HxqtQ6Rk4r5shzZpzfunkJI=)\n\n\nHypotenuse AI is an AI writing assistant leveraging GPT-4 to produce detailed posts and copy drafts in multiple languages. It enables streamlined content creation from idea generation to the final product, with features like fact-checking, source discovery, and content score assessment. From first draft to final edits, HyperWrite delivers high-quality writing in less time. Instantly tap into a wealth of knowledge with real-time information and citations.\n\n\n**Key Features of Hypotenus:**\n\n\n* **Powerful writing in seconds:** Hundreds of AI tools give you the power to create, edit, and polish text in seconds. Improve your own content or create original high-quality writing to fit your unique style and goals.\n\n\n* **Academic research and writing:** Fact-checking capabilities, source discovery, and content scoring for improved quality.\n\n\n## **7. [HyperWrite AI](https://www.google.com.hk/url?sa=t&rct=j&q=&esrc=s&source=web&cd=&ved=2ahUKEwiGm56_lbWFAxX1rokEHaPzBDUQFnoECAoQAQ&url=https%3A%2F%2Fhyperwriteai.com%2F&usg=AOvVaw2SBbeIhvdMW-W_YEW8WZbz&opi=89978449)**\n\n\n\n![gv3GyyUHc1LIHfBUTLiFLREaO5eA8LUoEoY4qUYOhdg=](/blobs/gv3GyyUHc1LIHfBUTLiFLREaO5eA8LUoEoY4qUYOhdg=)\n\n\nHyperWrite is an AI writing assistant designed to help users craft individualized and consistent content. It acts as a personal assistant for managing lengthy emails efficiently, providing features like in-line autocomplete, word alternatives, and predictive text suggestions.\n\n\n**Key Features of HyperWrite AI:**\n\n\n* **Plagiarism Checking:** Google disfavors duplicate content. Your brand image too. Our AI creates unique content and allows plagiarism checks so no one gets penalized.\n\n\n* **Factual Research:** News turns old in months, even weeks. Our AI scours the web for up-to-date information and injects relevance into your content. Access to synonyms and word alternatives for improved language choices.\n\n\n* **Follows SEO best practices:** Research SERP/PAA results, analyze competitors and take into account primary keywords automatically in SEO mode.\n\n\n## **8. [ClickUp](https://clickup.com/)**\n\n\n\n![dDF8MB-7gy-MvTHJQNlSpqbBtN0joNiIqUxvcP5KcCc=](/blobs/dDF8MB-7gy-MvTHJQNlSpqbBtN0joNiIqUxvcP5KcCc=)\n\n\nClickUp is a work management app with built-in document [collaboration](https://www.pcmag.com/picks/the-best-online-collaboration-software). Since it natively combines tasks and documents, each task can be assigned a document from which project tasks can be tracked. While it has other collaboration features like chat and whiteboards, this integration between task management and document collaboration is its main selling point.  ClickUp has launched an AI content assistant feature, ClickUp AI, a content ideation and creation tool in ClickUp Docs that help with generating ideas, summarizing a long text writing content, and so much more.\n\n\n**Key features of ClickUp:**\n\n\n* **Copy editing**: Get suggestions for writing improvements to simplify and improve your content.\n\n\n* **Quick text generation:** ClickUp AI successfully generated blog articles and outlines, as well as an action item based on the text of one of the articles.\n\n\n* **Multiple Collaboration Tools:** ClickUp includes a collaborative document tool that lets you create and share documents with your entire team. Multiple team members can work on the document at the same time. While collaborative editing is a great way to create and organize all kinds of documents, ClickUp isn't a replacement for [Google Docs](https://www.pcmag.com/reviews/google-docs-sheets-and-slides) or [Google Workspace](https://www.pcmag.com/reviews/google-workspace), which excels in extensibility and document sharing.\n\n\n* **Intuitive interface and UX:** ClickUp has several ways to view your tasks. Including kanban, to do list, board view, and Gantt chart.\n\n\n## **9. [Narrato](https://narrato.io/)**\n\n\n\n![xgobqjmQjTOwD7T-61vRRI1MgNxw5u66ZpwO_5jq6Lg=](/blobs/xgobqjmQjTOwD7T-61vRRI1MgNxw5u66ZpwO_5jq6Lg=)\n\n\n[Narrato](https://narrato.io/) is an AI-powered content workspace that lets you manage your entire content creation process in one place. At the core of Narrato is the powerful AI generation that assists with AI content ideation ( topic /content ideas generator), AI content creation (for multiple use cases like blog posts, web and ad copy, emails, [AI images and illustrations](https://affine.pro/blog/best-ai-image-generator), video script outlines, product descriptions and many more), plus content planning and optimization.\n\n\n**Key features of Narrato:**\n\n\n* **AI writing assistant with multiple use cases**: Helps generate content for blogs, emails, web copy, product descriptions, press releases, emails, video scripts, etc.\n\n\n* **SEO brief generator:** Builds content briefs in under a minute, offering keyword suggestions, most often asked questions about topics, references, and content structuring suggestions.\n\n\n* **AI topic generator**: For brainstorming and ideation.\n\n\n## **10. [Anyword](https://anyword.com/?fpr=roche93&gad_source=1&gclid=Cj0KCQjwztOwBhD7ARIsAPDKnkBoW1Hc_VA6uX7io-TZ-SNEPcQn8sto_WgAyNyv5CPA3fB7NNmjgzsaAveZEALw_wcB)**\n\n\n\n![UqMiGKkjgQ85_Bl1zmJc7f16JSC9zcqrULCowvOFO3Y=](/blobs/UqMiGKkjgQ85_Bl1zmJc7f16JSC9zcqrULCowvOFO3Y=)\n\n\n\n\n\nAnyword is an AI essay rewriter software that integrates customer research using advanced algorithms to analyze preferences, feedback, and market data. Its advanced AI integration helps you create content that meets your audience’s needs and preferences.\n\n\n**Key features of Anyword:**\n\n\n* **Performance Prediction:** Predict the performance of your content with Anyword. Select only the high-performing variations before you go live. Get maximum engagement every time.\n\n\n* **Copy intelligence:** Instantly analyze every piece of content you've ever published, and uncover AI-Driven opportunities to improve performance and boost audience engagement on your website, ads, social, and email channels.\n\n\n* **Brand voice:** Manage your brand's messaging, tone, and target audience guidelines in one place. Ensure brand consistency in all content, no matter where it's created.\n\n\n# **Best WordAI Alternative AI-generating and Rewriting Tool**\n\n\nIn today's digital era, harnessing the power of artificial intelligence has become increasingly popular for various tasks, including article writing. In this article, we have provided you with the 10 best WordAI alternative AI-generating and rewriting tools. After comparing and analyzing, we think AFFiNE is worth a try. Using AFFiNE can maximize your investment in a content rewriting tool.\n\n\n<div style=\"text-align:center;\">\n<iframe width=\"560\" height=\"315\" src=\"https://www.youtube.com/embed/WqOe9HgpsDY?si=PHGuSeRbOT9GxuPO\" title=\"YouTube video player\" frameborder=\"0\" allow=\"accelerometer; autoplay; clipboard-write; encrypted-media; gyroscope; picture-in-picture; web-share\" allowfullscreen></iframe>\n</div>\n\n\nFollow our journey on our social media platforms and become a part of our growing community. Embark on this adventure with us through our media channels🚀\n\n\n* Official Website: [https://affine.pro/](https://affine.pro/)\n\n\n* GitHub: [https://github.com/toeverything/AFFiNE](https://github.com/toeverything/AFFiNE)\n\n\n* Twitter: [https://twitter.com/AffineOfficial](https://twitter.com/AffineOfficial)\n\n\n* Community: [https://community.affine.pro/home](https://community.affine.pro/home)\n\n\n* Discord: [https://discord.gg/Arn7TqJBvG](https://discord.gg/Arn7TqJBvG)\n\n\n* Telegram: [https://t.me/affineworkos](https://t.me/affineworkos)\n\n\n",
  "publish": true
}