{
  "title": "Top 5 Free Workflow Templates You Should Consider to Improve Your Productivity",
  "authors": [
    "Yanxi Liu"
  ],
  "tags": [
    "Content"
  ],
  "description": "From project management to content creation, Workflow templates offer customizable, pre-designed workflows that can help you get more done in less time. Check out the Top 5 free Workflow Templates and start improving your productivity today!",
  "created": 1686009600000,
  "updated": 1686528000000,
  "layout": "blog",
  "id": "bnIMDNRA-5",
  "slug": "top-free-workflow-temlplates-to-consider",
  "cover": "/blobs/pgDezSJIFkKGUeMWz-9j3sWSMJQ7IbgTpEROgexdeqQ=",
  "md": "---\n\n\ntitle: \"Top 5 Free Workflow Templates You Should Consider to Improve Your Productivity\"\n\n\nauthor: \"Yanxi Liu\"\n\n\ntags: Content\n\n\nslug: top-free-workflow-temlplates-to-consider\n\n\ndescription: \"From project management to content creation, Workflow templates offer customizable, pre-designed workflows that can help you get more done in less time. Check out the Top 5 free Workflow Templates and start improving your productivity today!\"\n\n\ncreated: 2023-06-06\n\n\nupdated: 2023-06-12\n\n\nlayout: blog\n\n\npublish: true\n\n\n---\n\n\n\n![pgDezSJIFkKGUeMWz-9j3sWSMJQ7IbgTpEROgexdeqQ=](/blobs/pgDezSJIFkKGUeMWz-9j3sWSMJQ7IbgTpEROgexdeqQ=)\n\n\nDo you ever feel like you're drowning in a sea of tasks, emails, and meetings, with no clear way to stay afloat? It's a common problem in today's fast-paced work environment, but luckily, there's a solution: workflow templates.\n\n\nAfter doing massive research, we finally compiled a list of the top 5 most popular workflow templates to help take your team's [productivity](https://affine.pro/blog/how-to-increase-productivity-in-the-workplace) to the next level. These templates have been handpicked based on user feedback and are guaranteed to save you time, reduce errors, and improve collaboration.\n\n\nSo, whether you're a small business owner trying to stay organized, a marketer looking to streamline your campaigns, or a project manager trying to keep your team on track, these templates will make your life easier. So, let's dive in and see how these templates can help you achieve your goals!\n\n\n\n![B0sdEAYXsMDUwpZNawvBzw1jZZ4fS3uRoE-3yPTg6sM=](/blobs/B0sdEAYXsMDUwpZNawvBzw1jZZ4fS3uRoE-3yPTg6sM=)\n\n\n## What is workflow template?\n\n\nA workflow template is a pre-designed set of steps or actions that can be used to automate a specific process or task. It can be thought of as a blueprint for a workflow, outlining the sequence of tasks, the roles and responsibilities of team members, and the tools and resources required to complete the process. Workflow templates can be customized to fit the specific needs of an organization or individual and can be used to streamline and optimize business processes, increase efficiency, and reduce errors.\n\n\n## The **benefits of using workflow templates**\n\n\n1. Streamline processes: Workflow charts can help identify inefficiencies and bottlenecks in a process, allowing you to streamline it and remove unnecessary steps. This can save time and resources, and make the process more efficient overall.\n\n\n1. Increase productivity: By providing a clear visual representation of a process, workflow charts can help employees understand their role in the process and what needs to be done. This can help them stay focused on their tasks and avoid confusion or mistakes, leading to increased productivity.\n\n\n1. Ensure consistency: Workflow charts can help ensure that tasks are completed consistently and to a high standard. By providing a clear outline of the steps involved in a process, workflow charts can help employees understand what is expected of them and how to complete tasks correctly. This can lead to better quality work and fewer errors or inconsistencies.\n\n\n##  Workflow template examples\n\n\n1.Project management: This type of workflow template can manage projects from start to finish, defining the tasks that need to be completed, who is responsible for each task, and the order in which tasks should be completed\n\n\n\n![7sbuZsC2AceSgz6tFIvNo_B5RGUyPqXewxyckUk79W0=](/blobs/7sbuZsC2AceSgz6tFIvNo_B5RGUyPqXewxyckUk79W0=)\n\n\n2.Customer service: Workflows can be used to manage customer service requests, ensuring that each request is assigned to the appropriate team member and that the request is handled in a timely and efficient manner.\n\n\n\n![EIJ_9xeXbKTOEP4luQtWhQu6_O45sLBP-4vS5-6_WBw=](/blobs/EIJ_9xeXbKTOEP4luQtWhQu6_O45sLBP-4vS5-6_WBw=)\n\n\n3.Human resources: It can be used to manage HR processes such as onboarding new employees, performance reviews, and offboarding employees.\n\n\n\n![ZUGVJwQFcRB-nrJHh-AE1fBDPYlS0Be3X6k5x49hVoI=](/blobs/ZUGVJwQFcRB-nrJHh-AE1fBDPYlS0Be3X6k5x49hVoI=)\n\n\n4.Marketing: Workflow will help executives manage marketing campaigns, defining the tasks that need to be completed, who is responsible for each task, and the order in which tasks should be completed.\n\n\n\n![lI5I91EfXgHNSqoXqOh8Y3NlzOXs8_TjBJayUhjd8H4=](/blobs/lI5I91EfXgHNSqoXqOh8Y3NlzOXs8_TjBJayUhjd8H4=)\n\n\n5.Sales: Workflows can be used to manage the sales process, from lead generation to closing deals, ensuring that each step is completed in a consistent and efficient manner.\n\n\n\n![LQp3v1w3pNCJoZxyhypbed3APKzCUMQ1yyXKy9KXyQ4=](/blobs/LQp3v1w3pNCJoZxyhypbed3APKzCUMQ1yyXKy9KXyQ4=)\n\n\n## Top 5 Free **Workflow Templates in AFFiNE, Asana, Click up, Canva,** Microsoft\n\n\n### 1.AFFiFE\n\n\n\n![u1YZ5Hb-l-HTl5a0MY6D4KwbWFwKpNnz0rvyNrQ8_5Q=](/blobs/u1YZ5Hb-l-HTl5a0MY6D4KwbWFwKpNnz0rvyNrQ8_5Q=)\n\n\nAFFiNE is a Next-Gen knowledge base that integrates planning, organizing, and creating within a single workspace. Its impressive range of powerful functionalities significantly boosts productivity, with its exceptional whiteboard being a standout highlight.\n\n\n[AFFiNE's](https://affine.pro/) Edgeless mode, functioning as a whiteboard, offers users a secure and private workspace where they have absolute control over their data. In addition, AFFiNE's Edgeless mode provides a series of features like shapes with a way to edit their size, background, and boundary, pens with different colors, and connectors to visualize and connect your ideas.\n\n\n### Customize your Workflow templates with AFFiNE.\n\n\nAFFiNE Whiteboards can be an excellent tool for creating workflow templates as they allow for visual brainstorming and collaboration.\n\n\n\n![OFXFVC6gcNvVctMmsGEAuP5h8w4w2dF1G7G_csjv1Gg=](/blobs/OFXFVC6gcNvVctMmsGEAuP5h8w4w2dF1G7G_csjv1Gg=)\n\n\nHere are some features that make whiteboards an effective tool for creating workflow templates:\n\n\n1. Flexibility: With a whiteboard, you have the flexibility to create any workflow template you need, whether it's a simple checklist or a complex process flowchart.\n\n\n1. Collaboration: Whiteboards allow for real-time collaboration, so you can work with your team to create and refine the workflow template together.\n\n\n1. Visual representation: Whiteboards visually represent the workflow template, making it easier to understand and follow.\n\n\n1. Customization: Whiteboards allow you to easily customize the workflow template to fit your specific needs and requirements.\n\n\n1. Reusability: Once you've created a workflow template on a whiteboard, you can easily take a picture of it or transfer it to a digital format for future use.\n\n\n\n![XtCKPEyB_IPSkxdi7sLSkuxnUXR46u7_51MXdNZ6IWo=](/blobs/XtCKPEyB_IPSkxdi7sLSkuxnUXR46u7_51MXdNZ6IWo=)\n\n\nLooking for more guidance? We prepared you with a well-written and clear article explaining specifically how to build the Agile Workflow in AFFiNE:\n\n\n**[Agile Workflow: What is it and how to build your own one](https://affine.pro/blog/agile-workflow-what-is-agile-workflow-how-to-build)**\n\n\nSeeking for how to streamline your workflow:\n\n\n[Streamline Your Workflow with 10 Best Free Task Management Software for 2023](https://affine.pro/blog/best-free-task-management-software-streamline-workflow)\n\n\n**Free, Privacy First, and Open-Source:** AFFiNE is a free, open-source tool that prioritizes privacy, making it accessible to anyone who wants to enhance their productivity with workflows. Its commitment to privacy ensures that your data remains secure and confidential at all times. Being an open-source platform, AFFiNE offers the added advantage of customization, empowering users to tailor the tool to their specific needs and preferences, thereby improving the overall user experience. [Give it a try online today.](https://app.affine.pro/workspace/1M06WT8J9M/all)\n\n\nFor more things related to AFFiNE, come and check out the website: [AFFiNE â€” All In One KnowledgeOS](http://affine.pro/).\n\n\n### 2.Asana\n\n\nAdvantage: Asana's workflow templates can save time on repetitive tasks, increase team productivity, and simplify project management. Asana's templates are highly customizable and can be used for a variety of projects, from simple to complex.\n\n\nDisadvantage: It can be overwhelming for some users, especially those who are new to project management software.\n\n\n\n![uKRuYPda_MvZVo_nayanIw-MQu2c4SR0hNmS4YItrfs=](/blobs/uKRuYPda_MvZVo_nayanIw-MQu2c4SR0hNmS4YItrfs=)\n\n\n### 3.ClickUp\n\n\nAdvantage: ClickUp's workflow templates enable users to automate tasks, streamline workflows, and increase team collaboration. ClickUp's templates are highly customizable and can be used for a variety of projects, from simple to complex.\n\n\nDisadvantage: It's hard to navigate for some users, especially those who are new to project management software.\n\n\n\n![c-qxGZ93PXT-wblb7fGoBE9KVcnFaDP1KrmN0P7Hd2I=](/blobs/c-qxGZ93PXT-wblb7fGoBE9KVcnFaDP1KrmN0P7Hd2I=)\n\n\n### 4.Canva\n\n\nAdvantage: Canva's workflow templates allow users to create professional-looking designs quickly without the need for graphic design skills. Canva's templates are highly customizable and can be used for a variety of design projects, from social media graphics to presentations.\n\n\nDisadvantage: It may not be suitable for more complex design projects that require advanced features and functionality.\n\n\n\n![-UiDUzy93VenBAqNuxtYV7Te7tQorS5w7I-X-9G-4Cc=](/blobs/-UiDUzy93VenBAqNuxtYV7Te7tQorS5w7I-X-9G-4Cc=)\n\n\n### 5.Microsoft:\n\n\nAdvantage: Microsoft's workflow templates can help users streamline business processes, increase productivity, and improve collaboration. Microsoft's templates are highly customizable and can be used for a variety of business processes, from HR to finance.\n\n\nDisadvantage: It can be expensive, especially for small businesses or individuals who do not need all of the features and functionality offered by the software.\n\n\n\n\n\n## Which App offers the best workflow template?\n\n\n\n\n\n<div style=\"text-align:center;\">\n\n\n<iframe width=\"560\" height=\"315\" src=\"https://www.youtube.com/embed/3cfeKOufZWU?si=IiXDIdwfnM2Z7KPL\" title=\"YouTube video player\" frameborder=\"0\" allow=\"accelerometer; autoplay; clipboard-write; encrypted-media; gyroscope; picture-in-picture; web-share\" allowfullscreen></iframe>\n\n\n</div>\n\n\n\n\n\nHere we recommend five apps and introduce their unique and appealing features in the workflow template. We encourage users to choose the ideal option based on their specific needs and pain points. However, based on our evaluation, we still propose AFFiNE as the optimal choice for creating the Workflow Templates. Not merely because it provides people with much more flexibility, collaboration, visual representation, customization, and reusability in creating workflow templates, but also for its uniqueness as a free, open-source tool that prioritizes privacy, making it accessible to anyone who wants to enhance their productivity with workflows.\n\n\nIf you want more information, please click on these links:\n\n\n* Official Website: [https://affine.pro/](https://affine.pro/)\n\n\n* GitHub: [https://github.com/toeverything/AFFiNE](https://github.com/toeverything/AFFiNE)\n\n\n* Discord: [https://discord.gg/Arn7TqJBvG](https://discord.gg/Arn7TqJBvG)\n\n\n* Telegram: [https://t.me/affineworkos](https://t.me/affineworkos)\n\n\n",
  "publish": true
}