{
  "title": "Top 10 Smartsheet Alternatives & Competitors for Advanced Project Management in 2024",
  "authors": [
    "Yiyang Zhang"
  ],
  "tags": [
    "Content"
  ],
  "description": "Explore 10 best Smartsheet alternatives and competitors for advanced project management in 2024. Compare their pros and cons, features and prices to find the best solution for your team.",
  "created": 1690416000000,
  "updated": 1703721600000,
  "layout": "blog",
  "id": "gysf1tNVHF",
  "slug": "top-advanced-smartsheet-alternatives-project-management-2023",
  "cover": "/blobs/ocmVt3pG9eunR-j_zIPYnae5xrhByZZ50Rxk8P6PCRI=",
  "md": "---\n\n\ntitle: \"Top 10 Smartsheet Alternatives & Competitors for Advanced Project Management in 2024\"\n\n\nauthor: \"Yiyang Zhang\"\n\n\ntags: Content\n\n\nslug: top-advanced-smartsheet-alternatives-project-management-2023\n\n\ndescription: \"Explore 10 best Smartsheet alternatives and competitors for advanced project management in 2024. Compare their pros and cons, features and prices to find the best solution for your team.\"\n\n\ncreated: 2023-07-27\n\n\nupdated: 2023-12-28\n\n\nlayout: blog\n\n\npublish: true\n\n\n---\n\n\n\n![ocmVt3pG9eunR-j_zIPYnae5xrhByZZ50Rxk8P6PCRI=](/blobs/ocmVt3pG9eunR-j_zIPYnae5xrhByZZ50Rxk8P6PCRI=)\n\n\nDo you find it demanding to use the same intricate [project management tool](https://affine.pro/blog/15-best-free-jira-alternatives-agile-project-management-2023)?\n\n\nAre you looking for a **fresh and efficient** alternative to Smartsheet?\n\n\nAre you ready to take your project management skills to the next level in 2024?\n\n\n**Look no further!** In this article, we have curated a list of 10 sensational Smartsheet alternatives that not only offer advanced features but also provide flexible pricing options. Whether you're a seasoned professional seeking advanced features or a budding [event planner](https://affine.pro/blog/free-event-planning-templates-for-professsional-2023) looking for user-friendly options that revolutionize the way you handle projects, we've got the perfect alternatives to Smartsheet that [boost your productivity](https://affine.pro/blog/top-5-google-docs-alternatives-pkm) and [streamline your workflow](https://affine.pro/blog/best-free-task-management-software-streamline-workflow).\n\n\n### What is Smartsheet?\n\n\n\n![BvwynyiGMgn6HfWf2qC7X5TOE-1CNUicwj0hbjIbnjs=](/blobs/BvwynyiGMgn6HfWf2qC7X5TOE-1CNUicwj0hbjIbnjs=)\n\n\nSmartsheet is a popular project management tool that describes itself as a “work execution platform.” Introduced in 2006, with a major redesign in 2010, the platform serves as a single systematic and flexible solution for all the task management needs of a team. This web-based application is best known for its unique use of project management spreadsheets.\n\n\nHowever, working through cells and columns to manage complex projects that require collaboration may prove inconvenient and ineffective. While Smartsheet has been a popular choice for many teams, it's always good to explore other options and see what else is out there.\n\n\n### Pros and Cons of Smartsheet\n\n\nSmartsheet's user interface is relatively straightforward and it won't take long to get the hang of it, especially for those with experience in Microsoft Excel. The design is clear and sleek though some may find it plain. Nevertheless, this ensures that you won't be hindered from concentrating on what matters most - getting the job done!\n\n\n\n![0n1dmCWCN7kdmAcJcVNRnRWXX7wBx63dKUaMaD2sv3Q=](/blobs/0n1dmCWCN7kdmAcJcVNRnRWXX7wBx63dKUaMaD2sv3Q=)\n\n\n**Pros** **of** **Smartsheet**\n\n\n* Easy to pick up\n\n\n* Does more than just project management\n\n\n* Time tracking\n\n\n* Real-time chat\n\n\n**Cons of Smartsheet**\n\n\n* Complexity involved in setting up more complex workflows or automation\n\n\n* Limited integration options\n\n\n* Expense\n\n\n* Sluggish performance\n\n\n* Inadequate reporting\n\n\n* Limited data security\n\n\nWhile there are both pros and cons associated with using Smartsheet as a project management solution; ultimately whether it's suitable for your organization will depend on your specific requirements and preferences.\n\n\n### 2024 Top 10 Smartsheet Alternatives You Have to Try\n\n\n**1.AFFiNE**\n\n\n\n![-PwbThCJ3pspZq8JN1zBZlFs-zLYIcBSrD-kfWw7CKg=](/blobs/-PwbThCJ3pspZq8JN1zBZlFs-zLYIcBSrD-kfWw7CKg=)\n\n\n[AFFiNE](https://affine.pro/) is an innovative and comprehensive task management software designed to help you organize, manage, and collaborate on tasks, projects, and information, as well as [streamline your workflow](https://affine.pro/blog/best-free-task-management-software-streamline-workflow). As a next-generation knowledge base, AFFiNE combines the best features of popular apps like Smartsheet and Miro into one powerful, [time-saving](https://affine.pro/blog/top-5-free-practical-time-management-templates), and user-friendly platform. It focuses on data security, privacy, and collaboration, making it the perfect choice for managing your daily plans, personal knowledge repository, and team projects.\n\n\nKey features:\n\n\n* Local-first design: AFFiNE prioritizes data security and privacy, ensuring your data remains stored on your local device unless you actively delete it.\n\n\n  * Powerful search functionality: Quickly locate the documents, tags, or actions you want with a modern search app that can handle multiple workspaces and pages.\n\n\n  * Time tracking and goal setting: Use AFFiNE’s built-in features to track your time spent on tasks and set goals to improve your productivity.\n\n\n  * Open-source: As an open-source app, you can access AFFiNE’s code, allowing for customization and the ability to deploy the server on your own computer or data center. Here are some quick views of what you can do with AFFiNE's core features\n\n\n* Shifting between two modes: You start on the whiteboard, freely connecting and arranging your thoughts, creating a visual representation of your workflow-Best for roadmap creation!\n\n\n  * Powerful edgeless mode: Easily create, organize, and track your daily tasks like never before. Say goodbye to complex processes and welcome an unprecedented ease-of-use way.\n\n\n  * Multiple tools: Visualize and connect your daily tasks smoothly with a better cartoon-style shape, slick pen, and connectors. No constraints. Limited only by your imagination.\n\n\n  \n![UtWiPpyoCYEH-hdrAfL1Gcz8n2Lh25RiPZKY7CxTulY=](/blobs/UtWiPpyoCYEH-hdrAfL1Gcz8n2Lh25RiPZKY7CxTulY=)\n\n\n  Price: Free\n\n\n  AFFiNE is a fantastic, completely FREE task management app that welcomes everyone to experience its powerful features, making it a delightful surprise for those seeking a comprehensive solution for their daily task management needs.\n\n\n  * Come and check out our latest beta version, and enjoy your creative moments.\n\n\n  * For more things related to AFFiNE, come and check out our website: AFFiNE — All In One KnowledgeOS\n\n\n  * Wanna try it online:[https://app.affine.pro/](https://app.affine.pro/)\n\n\n**2.Clickup**\n\n\n\n![zI5nBNDlxheO1dJ2peGN9qM8w5zjh512sR2yp14PHSI=](/blobs/zI5nBNDlxheO1dJ2peGN9qM8w5zjh512sR2yp14PHSI=)\n\n\nClickUp is a versatile project management tool that offers a wide range of features to help teams stay organized and collaborate effectively. With its user-friendly interface and customizable workflow options, ClickUp has become a popular alternative to Smartsheet. ClickUp helps teams of all sizes and across industries manage projects, create complex roadmap templates, and optimize processes.\n\n\n**Key features:**\n\n\n1. Task Creation and Assignment\n\n\n1. Effortless Workflow Updates\n\n\n1. Real-time Communication\n\n\n**Pros and Cons:**\n\n\n\n![f6vUW-Gy0rLcmQwiU3RbJJzP-mo6gW4KA0Go_GE0xRo=](/blobs/f6vUW-Gy0rLcmQwiU3RbJJzP-mo6gW4KA0Go_GE0xRo=)\n\n\n**Price:**\n\n\n* **Starting from**: $9.00/month\n\n\n* **Pricing model**: Free, Subscription\n\n\n* **Free Trial**: Available\n\n\n**3.Monday**\n\n\n\n![2rtTUikP6JpyA0JIUzgPszfk55U-qY93Kw-ACopShIA=](/blobs/2rtTUikP6JpyA0JIUzgPszfk55U-qY93Kw-ACopShIA=)\n\n\nMonday.com provides you with all of the no-code building blocks so you can shape your workflows, your way. With Monday.com, you can run every aspect of your work by layering industry-specific products on top of the Work OS. Combine building blocks, like apps and integrations, to customize anything you need to improve the way your business runs.\n\n\nKey features:\n\n\n1. Intuitive Project Management\n\n\n1. Workflow Automation\n\n\n1. Extensive Integrations\n\n\nPros and Cons\n\n\n\n![jm1P6NBKVnsgWseDCHdQrM0jaYId1yZ_XOFpcKE28rU=](/blobs/jm1P6NBKVnsgWseDCHdQrM0jaYId1yZ_XOFpcKE28rU=)\n\n\n**Price:**\n\n\n  **Free** **forever plan:** Up to 2 seats, after which pricing scales based on the number of seats, as well as functionality needed.\n\n\n  **Paid plans:** Start at $10/seat/month, billed monthly, for the **Basic** **plan** and include a minimum of 3 seats.\n\n\n**4.miro**\n\n\n\n![lRVBlgYnIvnM_4E9Z6mOB-A3SfE1FDgn3v-bo8kP6a0=](/blobs/lRVBlgYnIvnM_4E9Z6mOB-A3SfE1FDgn3v-bo8kP6a0=)\n\n\nMiro is a versatile and collaborative tool that brings visual collaboration to the forefront of project management. With its intuitive interface and extensive range of features, Miro empowers teams to brainstorm, plan, organize, and execute projects seamlessly.\n\n\n**Key features:**\n\n\n1. Collaborative Whiteboarding\n\n\n1. Agile Framework Support\n\n\n1. Integration Ecosystem\n\n\nPros and Cons\n\n\n\n![a12ozJcH9QmDWwQu3MeM2fmJOnFzPFxUdA06Of0kfiQ=](/blobs/a12ozJcH9QmDWwQu3MeM2fmJOnFzPFxUdA06Of0kfiQ=)\n\n\n**Price:**\n\n\n  **Free Plan:** Includes unlimited team members, three editable boards, core integrations, premade templates, and basic attention management.\n\n\n  **Team Plan:** ($8 per member, per month): Provides unlimited boards, unlimited visitors, custom templates, project management, and private boards.\n\n\n**5.Wrike**\n\n\n\n![G56ysFw4j5ZvOAJ3TOCUbtkLU_mOzvSxEq7i3hrPoBM=](/blobs/G56ysFw4j5ZvOAJ3TOCUbtkLU_mOzvSxEq7i3hrPoBM=)\n\n\nWrike is a powerful project management solution that provides advanced features like Gantt charts, workload management, and custom dashboards. It is designed to cater to more complex projects and offers a high level of configuration to adapt to various business processes. Wrike also supports integrations with popular third-party tools, allowing for a more streamlined workflow.\n\n\nKey features:\n\n\n1. Customizable Dashboards\n\n\n1. Workload Charts for Resource Management\n\n\n1. Time Tracking Support\n\n\n**Pros and Cons**\n\n\n\n![iT7up0KFr_5oBbgzXGcN3XwNGF2BMoCNwEP5T6WEUdE=](/blobs/iT7up0KFr_5oBbgzXGcN3XwNGF2BMoCNwEP5T6WEUdE=)\n\n\n**Price:** Wrike has a free plan for startups and as your team grows, they have plans starting at $9.80/user/month.\n\n\n**6.ProofHub**\n\n\n\n![KZvK-A6k0m6uNzX5vjxUhc6g_QorgamY289ckrV0JiY=](/blobs/KZvK-A6k0m6uNzX5vjxUhc6g_QorgamY289ckrV0JiY=)\n\n\nProofHub is a powerful project management software that offers advanced features to streamline your workflow and improve collaboration. With its user-friendly interface, you can easily manage tasks, deadlines, and resources in one centralized platform.\n\n\n**Key features:**\n\n\n1. To-Do Lists\n\n\n1. Custom Workflows and Kanban Boards\n\n\n1. Gantt Charts\n\n\n**Pro and Cons**\n\n\n\n![SzUFyCQWgDvV6w2c7KvCuQzN9jju0KfztCL1B0bcbGg=](/blobs/SzUFyCQWgDvV6w2c7KvCuQzN9jju0KfztCL1B0bcbGg=)\n\n\n**Price:**\n\n\n* **Starting from:** $99.00/month\n\n\n* **Pricing model:** Free, Subscription\n\n\n* **Free Trial:** Available | (No Credit Card required)\n\n\n**7.Trello**\n\n\n\n![3GQ4Shj-IUKIt1-NmJDgotKC5hYTlKzCrinq-mK2pP0=](/blobs/3GQ4Shj-IUKIt1-NmJDgotKC5hYTlKzCrinq-mK2pP0=)\n\n\nBecause of its focus on project management, Trello is also among the finest communication tools for distributed teams. You can see the large picture of all your projects at once thanks to the Kanban view it employs. If you open the card for a certain project, you can see where it stands. By creating a board for each undertaking, you will be able to do more than ever before.\n\n\n**Key features:**\n\n\n1. Set Reminders\n\n\n1. Kanban Board View\n\n\n1. Assign Tasks\n\n\n**Pros and Cons**\n\n\n\n![uDvX4y_d49GXFGfAe792YlI3UXpEWGao9Y1E3CitCBA=](/blobs/uDvX4y_d49GXFGfAe792YlI3UXpEWGao9Y1E3CitCBA=)\n\n\n**Price:** Trello has a free version\n\n\n* **Standard:** $5.00 per user per month\n\n\n* **Premium:** $10 per user per month\n\n\n* **Enterprise:** Pricing starts at $17.50 per user per month (starting for 250 users, billed annually)\n\n\n**8.Asana**\n\n\n\n![HRbrlhClEuzFi8I2d4n11IcxbqWywgymcUtDbmOiNXs=](/blobs/HRbrlhClEuzFi8I2d4n11IcxbqWywgymcUtDbmOiNXs=)\n\n\nAsana is a comprehensive project management platform that offers a robust feature set for task management and team collaboration. It provides various views, such as a list, board, calendar, and timeline, to help teams stay organized and track progress. Asana also includes automation capabilities and integrates with numerous third-party tools.\n\n\nKey features:\n\n\n* Kanban board for easy workflow management\n\n\n* File sharing and task comments for better team collaboration\n\n\n* Advanced task management features with subtasks and checklists\n\n\n* Powerful project overviews for better resource management\n\n\nPros and Cons\n\n\n\n![qkQVil9boL5V4Eo1cWSLbwEB3l0_TaCRUddiaGhsnqo=](/blobs/qkQVil9boL5V4Eo1cWSLbwEB3l0_TaCRUddiaGhsnqo=)\n\n\n**Price:**\n\n\n* **Basic**: **FreePremium:** $10.99 per user, per month (billed annually) or $13.49 per user, per month (billed monthly)\n\n\n* **Business**: $24.99 per user, per month (billed annually) or $30.49 per user, per month (billed monthly)\n\n\n* **Enterprise**: Contact Asana for pricing information.\n\n\n**9.Scoro**\n\n\n\n![w7LkPWOvoceML08pJqWyaeStk1q-Om9vCwXmDwPuiBA=](/blobs/w7LkPWOvoceML08pJqWyaeStk1q-Om9vCwXmDwPuiBA=)\n\n\nYour team can scale faster using Scoro's work management software by accessing crucial project data. In addition to automating billing and resource usage, Scoro has an inbuilt CRM to simplify billing and revenue forecasting. Of the Smartsheet alternatives on this list, Scoro has the best inbuilt CRM.\n\n\nKey features:\n\n\n* A collaborative platform for projects of all kinds\n\n\n* Drag and drop planner, Kanban task boards to plan tasks\n\n\n* A real-time Gantt chart to track dependencies, tasks, and progress\n\n\n* Automation of routine tasks with automatic notifications and deadline reminders\n\n\n* In-built CRM\n\n\n**Pros and Cons**\n\n\n\n![7RpiLVI0ZLt8PeWvH9N1u1HESf9esgKV-8-s0Yl6XU8=](/blobs/7RpiLVI0ZLt8PeWvH9N1u1HESf9esgKV-8-s0Yl6XU8=)\n\n\n**Price:**\n\n\n* 14-day **free trial**, no credit card required.\n\n\n* **Essential:** $26 per user, per month.\n\n\n* **Standard:** $37 per user, per month\n\n\n* **Pro:** $63 per user, per month.\n\n\n* **Ultimate:** Contact Scoro for pricing.\n\n\n**10.Workzone**\n\n\n\n![cXBvpf8jTJNy0fGKQZJ1SRcQ8VERfUtOuJN1L6Q6Lpo=](/blobs/cXBvpf8jTJNy0fGKQZJ1SRcQ8VERfUtOuJN1L6Q6Lpo=)\n\n\nHaving been around since 2000, Workzone is a great Smartsheet alternative thanks to its simple project management capabilities. With its user-friendly interface, Workzone makes it easy for teams of all sizes to stay organized and on track.\n\n\nKey features:\n\n\n* Simple process management capabilities\n\n\n* User-friendly UI\n\n\n* Good collaboration features\n\n\n* Powerful reporting\n\n\nPros and Cons:\n\n\n\n![v0F9RHUgEmPNHN87UPORDBSkMCvI-txvD4HYlriRmiI=](/blobs/v0F9RHUgEmPNHN87UPORDBSkMCvI-txvD4HYlriRmiI=)\n\n\n**Price:** 14-day free trial with no credit card needed and has three different account types\n\n\n### Which Smartsheet Alternative offers the best solution?\n\n\nWhile each of the wonderful Smartsheet alternative discussed offers its own unique and appealing features, we encourage users to choose the ideal option based on their specific needs and pain points. However, with a humble perspective, we still propose that AFFiNE emerges as the ultimate winner in this evaluation, providing a comprehensive and versatile solution for managing daily tasks and goals, catering to a wide range of user requirements. AFFiNE is still in its beta, but we are continuing to build to a more feature-rich and stable build. Come and join us on our journey over on our media platforms.\n\n\n* Official Website: [https://affine.pro/](https://affine.pro/)\n\n\n* GitHub: [https://github.com/toeverything/AFFiNE](https://github.com/toeverything/AFFiNE)\n\n\n* Discord: [https://discord.gg/Arn7TqJBvG](https://discord.gg/Arn7TqJBvG)\n\n\n* Twitter: [https://twitter.com/AffineOfficial](https://twitter.com/AffineOfficial)\n\n\n",
  "publish": true
}