{
  "title": "Top 10 Best Process Mapping Tools and Software of 2024 (Free & Paid)",
  "authors": [
    "Yiyang Zhang"
  ],
  "tags": [
    "Content"
  ],
  "description": "Unravel the charm of the process mapping tool for your needs. Discover the 10 best process mapping software to improve your schedules in 2024.",
  "created": 1700438400000,
  "updated": 1704153600000,
  "layout": "blog",
  "id": "a8bDBZ5sW_bPR1yat8j1Z",
  "slug": "top-10-best-process-mapping-tools-software-2023-free-paid",
  "cover": "/blobs/_R6mEZz4N4Cn1zPy3HdNi5QMYhlJT-g4x-HxUE4M7z8=",
  "md": "---\n\n\ntitle: \"Top 10 Best Process Mapping Tools and Software of 2024 (Free & Paid)\"\n\n\nauthor: \"Yiyang Zhang\"\n\n\ntags: Content\n\n\nslug: top-10-best-process-mapping-tools-software-2023-free-paid\n\n\ndescription: \"Unravel the charm of the process mapping tool for your needs. Discover the 10 best process mapping software to improve your schedules in 2024.\"\n\n\ncreated: 2023-11-20\n\n\nupdated: 2024-01-02\n\n\nlayout: blog\n\n\npublish: true\n\n\n---\n\n\nWelcome to the world of process mapping tools! As a project manager or team leader, you face many challenges in keeping track of all the moving pieces and ensuring that everything is on schedule. But fear not! Process mapping tools are here to help you visualize the process of your project and identify any potential issues.\n\n\n\n![_R6mEZz4N4Cn1zPy3HdNi5QMYhlJT-g4x-HxUE4M7z8=](/blobs/_R6mEZz4N4Cn1zPy3HdNi5QMYhlJT-g4x-HxUE4M7z8=)\n\n\nIn a sea of process mapping tools, it can be difficult to find the one that suits your needs. But fear not! We have researched and compiled a list of the top 10 best process mapping tools of 2023. Whether you're a project manager striving to optimize productivity or an entrepreneur seeking efficient workflow management solutions, we've got you covered.\n\n\n### What is a Process Mapping tool?\n\n\nA process mapping tool is software that helps track and visualize a project's different stages, tasks, timelines, and dependencies. It ensures everyone on the team is on the same page and provides transparency by displaying task statuses, completed milestones, bottlenecks, and potential roadblocks.\n\n\nProcess mapping tools enhance collaboration among team members, improve project management efficiency, and help achieve success quickly.\n\n\n### What Should a Process Mapping Tool Includes?\n\n\nA process mapping tool is a valuable asset for any organization looking to streamline its operations and improve efficiency. But what exactly should a process mapping tool include? Let's take a closer look.\n\n\n\n![dW9gHCNsSUdX4tAzBeP_ils1EU06gMnuFC3CETBNZ8U=](/blobs/dW9gHCNsSUdX4tAzBeP_ils1EU06gMnuFC3CETBNZ8U=)\n\n\n* Intuitive and user-friendly interface. It should be easy to navigate, with clear instructions on how to create, edit, and visualize the various steps of a process.\n\n\n* Customization functionality. Different businesses require customizable processes, allowing for added fields, labels, and map design.\n\n\n* Collaboration features. The ability for multiple team members to work on a map simultaneously can greatly enhance productivity and foster better communication within an organization.\n\n\n* Integration capabilities. A good process mapping tool should seamlessly integrate with other software systems that your business relies on, such as project management tools or CRM platforms.\n\n\n* Robust reporting capabilities. Being able to generate detailed analytics and metrics from your process maps can help identify bottlenecks or areas that need improvement.\n\n\n* Ongoing support and updates. Look for providers that offer responsive customer service channels as well as regular updates that address bugs or introduce new features based on user feedback.\n\n\nThese are just some of the key factors you should consider when looking for a great process mapping tool. Now, let's take a look at the top 10 best process mapping tools of 2023, in no particular order.\n\n\n### The Top 10 Best Process Mapping Tools of 2024\n\n\nWith so many remarkable options at our fingertips, we are presented with an incredible opportunity to choose the best tool that fits our unique needs. To help guide you in this exciting journey, we have compiled a list of the top 10 process mapping tools that are making a significant impact in the industry this year. Let's embrace this innovation and unlock our full potential!\n\n\n#### 1[. AFFiNE](https://affine.pro/)\n\n\n\n![BNqVFhgqbeQ6Viue2ItV2cqLVLNz9XT6h4YNQ8rk9qY=](/blobs/BNqVFhgqbeQ6Viue2ItV2cqLVLNz9XT6h4YNQ8rk9qY=)\n\n\nWith AFFiNE, professionals have access to a unified platform for knowledge base planning, process mapping, and content development. This flexible tool allows users to create their flowcharts as well as set up their goals, all while staying in sync and constructing content with blocks. The limitless workspace allows for user-driven innovation. The benefits of AFFiNE include safe data storage, open-source benefits, and collaborative functionality. With our simple and intuitive platform, you can effortlessly design professional-looking flowcharts and mind maps. Impress your colleagues and clients with visually stunning and easy-to-understand diagrams. Start creating today and take your presentations to the next level.\n\n\n**Key features:**\n\n\n* **Process Mapping in Edgeless Mode**: In our edgeless mode, mindmaps and flowchart creation can be a piece of cake. In AFFiNE, scaling and mapping are seamlessly synchronized. In edgeless page mode, understanding block relationships is effortless, and with seamless block-to-block transitions, your process mapping remains smooth.\n\n\n\n![knv3GLQpB1H8ce4w2ztMzCiGuUMPG0JRDZA49U3AgIw=](/blobs/knv3GLQpB1H8ce4w2ztMzCiGuUMPG0JRDZA49U3AgIw=)\n\n\n* **Effortless Group Nesting**: Multiple smaller groups can be merged into a larger group, to move both individual elements and smaller groups within the composition. Also, the ungrouping function provides the versatility to disband an entire group or selectively release individual elements from within a group, enabling you to master your process mapping.\n\n\n\n![ygPZvKWsqd_M4sewePxSaOrtkVsxvXSvqnUlcloABZY=](/blobs/ygPZvKWsqd_M4sewePxSaOrtkVsxvXSvqnUlcloABZY=)\n\n\n* **Advanced Collaboration Capability**: When you do need to collaborate with other contributors to discuss your process, AFFiNE makes getting feedback simple. Appealing collaboration capability provides visibility into assigned tasks, making tables easier to estimate, and ensuring your project remains well-designed. Stay at the forefront of your projects, meticulously track your progress, and seamlessly sync with your team to enhance productivity and expedite outcomes.\n\n\n\n![O88V12dZ7eALpdMD8-6eyyfRec5yZyWiQxCnvNEb3r0=](/blobs/O88V12dZ7eALpdMD8-6eyyfRec5yZyWiQxCnvNEb3r0=)\n\n\n#### 2. [Microsoft Visio](https://affine.pro/blog/best-free-word-processor-software-2023-alternatives-microsoft)\n\n\n\n![E4qFsgAf1UELGp5BEZAox9B0Dhu_fZk3YQ96EQEB1Q8=](/blobs/E4qFsgAf1UELGp5BEZAox9B0Dhu_fZk3YQ96EQEB1Q8=)\n\n\n\n\n\nMicrosoft Visio is an excellent software for creating flow charts on Windows. It has three products: Visio Online, Visio Standard, and Visio Professional. With Microsoft Visio, you can quickly and easily create flow charts, organizational charts, network diagrams, floor plans, engineering designs, etc. It even includes templates to help you get started. You can also customize shapes and add your own text labels or images to make the perfect diagram.\n\n\n**Key features:**\n\n\n* Provide modern shapes and templates.\n\n\n* Allow collaboration with the team.\n\n\n* Visio online will help you to work from anywhere.\n\n\n**Pros of Microsoft Visio**\n\n\n* Powerful & easy to use\n\n\n* Huge library of templates and objects\n\n\n* A wide array of export formats\n\n\n**Cons of Microsoft Visio**\n\n\n* Confusing purchasing process.\n\n\n* Limited collaboration capabilities.\n\n\n* Clunky and cluttered.\n\n\n#### 3. [Canva](https://www.canva.com/pro/)\n\n\n\n![u2KwzK0mJFBO5_SefQ3YTCY47qHExf7_QuRiY6Fyv9s=](/blobs/u2KwzK0mJFBO5_SefQ3YTCY47qHExf7_QuRiY6Fyv9s=)\n\n\nCanva is an online tool for graphic designing that can be used for layout designing, sharing, presentations, and printing business cards, logos, and flowcharts. It is available on Android devices, tablets, iPhones, and iPads. Canvaâ€™s intuitive drag-and-drop editor makes creating beautiful designs from templates quick and easy. Plus, its large library of illustrations and icons makes customizing your design easy.\n\n\n**Key features:**\n\n\n* It has more than 50000 templates.\n\n\n* You can create different types of graphs and charts.\n\n\n* It has features for photo editing.\n\n\n**Pros of Canva**\n\n\n* Ideal for various visual project\n\n\n* Lots of well-designed templates\n\n\n**Cons of Canva**\n\n\n* Not as intuitive as other purpose-built flowchart makers\n\n\n* Slow to load and difficult to keep organizedPricing: $12.99/month per user for pro plan; $14.99/ month per user for team plan\n\n\n#### 4. [Creatly](https://creately.com/)\n\n\n\n![pjSCg9_WhN-7OZblPHyLl_P6gEJ4dXbCccQbOj-jg_c=](/blobs/pjSCg9_WhN-7OZblPHyLl_P6gEJ4dXbCccQbOj-jg_c=)\n\n\n\n\n\nCreately is a data-connected visual workspace where you can plan and brainstorm new projects. The software is built to help you make flowcharts quickly and easily. To begin with, they have an extensive library of templates ranging across industries and topics, so it is simple to find an example that fits your needs.\n\n\n**Key features:**\n\n\n* Huge library of shapes. Also, allow choose the shape from Icon Finder or Google.\n\n\n* Automatically pick the right connector.\n\n\n* Create complex shapes from the written text.\n\n\n**Pros of Creatly**\n\n\n* Support real-time collaboration.\n\n\n* Offer Web and desktop apps.\n\n\n**Cons of Creatly**\n\n\n* Limited template selection.\n\n\n* Canceling or changing an account requires an email to the company.\n\n\n**Pricing**: $5 per month for individuals; Team plans are based on the team size (5 users: $25/month, 10 Users: $45/month, and 25 Users: $75/month)\n\n\n#### 5. **[Cacoo](https://nulab.com/cacoo/)**\n\n\n\n![m9vYBTj8s0HM9IlXSoBzoOAvmEnUDTEq12Uatz-e3KY=](/blobs/m9vYBTj8s0HM9IlXSoBzoOAvmEnUDTEq12Uatz-e3KY=)\n\n\nCacoo is an online diagramming tool that allows you to collaborate on wireframes, flowcharts, and more. With easy sharing links and embed links, you can edit, track changes, and collaborate on flowcharts you designed and updated. With Cacoo, you can organize team assets, save work directly, monitor project status with activity notifications, and more.\n\n\n**Key features:**\n\n\n* Multiple people can edit diagrams at the same time.\n\n\n* Support chat, comment, or video chat inside the tool.\n\n\n* It has hundreds of templates to get you started.\n\n\n**Pros of Cacoo**\n\n\n* Smart and modern charts\n\n\n* A wide range of cloud services\n\n\n* Team management keeps charts organized at the team level\n\n\n**Cons of Cacoo**\n\n\n* Learning curve\n\n\n* Not enough integrations\n\n\n**Pricing**: $6 per user per month\n\n\n#### 6. [MindMeister](https://www.mindmeister.com/)\n\n\n\n![6mRarQP_bAYAPOzIO14gbeXIJFK7kRFhTJyKyjaG2UQ=](/blobs/6mRarQP_bAYAPOzIO14gbeXIJFK7kRFhTJyKyjaG2UQ=)\n\n\n\n\n\nMindMeister simplifies the process of designing impressive mindmaps. As a Trusted Cloud certified service and fully compliant with EU-GDPR regulations, MindMeister guarantees security and privacy. It seamlessly integrates into the Meister Suite, ensuring smooth workflow management from start to finish. \n**Key features:**\n\n\n* Embrace the essentials of process mapping.\n\n\n* Advanced visual mode.\n\n\n* Integrations and embeds function.\n\n\n**Pros of MindMeister**\n\n\n* Add notes, links, icons, images, or videos to mind maps\n\n\n* Integrate mind maps into project management with MeisterTask\n\n\n**Cons of MindMeister**\n\n\n* The Free plan has limited features\n\n\n* Canâ€™t create free-flowing maps\n\n\n**Pricing**: A free basic plan is available; Paid plans start at $2.49/user per month.\n\n\n#### 7. [SmartDraw](https://www.smartdraw.com/)\n\n\n\n![ketDWKTPYe3ASxOAV0IZ1bqKkS7AmUnuKuWjIqIAT7s=](/blobs/ketDWKTPYe3ASxOAV0IZ1bqKkS7AmUnuKuWjIqIAT7s=)\n\n\n\n\n\nSmartDraw is a powerful flowchart software tool for businesses that need to make a lot of visual assets. Aside from flowcharts and schematics, SmartDraw has powerful customization and collaboration options, so drafting these designs is a breeze. SmartDraw stands out for its vast selection of pre-made templates and automated diagramming capabilities. It also supports cloud storage and has robust sharing options.\n\n\n**Key features:**\n\n\n* Huge selection of templates and objects\n\n\n* Helpful Smart Panel feature\n\n\n* Create diagrams straight from data with built-in extensions\n\n\n**Pros of SmartDraw**\n\n\n* Good integration options\n\n\n* Easy to use\n\n\n* The powerful engine allows for professional charts and diagrams\n\n\n**Cons of SmartDraw**\n\n\n* Weak collaboration features.\n\n\n* Expensive.\n\n\n* Can't export to Visio format.\n\n\n**Pricing**: $9.95/month after a free trial\n\n\n#### 8. [Draw.io](https://www.drawio.com/)\n\n\n\n![yFweQQEmqC_LKCvZMMS873C5tDv7mSkJTxCdCMRk7vE=](/blobs/yFweQQEmqC_LKCvZMMS873C5tDv7mSkJTxCdCMRk7vE=)\n\n\n\n\n\nDraw.io can be used instantly to build charts since it's online (though it can be used offline as well). With drag-and-drop functionality, a library of shapes, plenty of templates, importing/exporting a variety of formats, and more, it's easy to get started and start creating at any time.\n\n\n**Key features:**\n\n\n* Intuitive interface with drag-and-drop functionality.\n\n\n* Allows track and restore changes.\n\n\n* Support various formats for import and export.\n\n\n**Pros of Draw.io**\n\n\n* No login is required, free\n\n\n* Speed & simple\n\n\n* Excellent real-time collaboration support is included when connected to a Google account\n\n\n**Cons of Draw.io**\n\n\n* Collection of templates and unimpressive shapes.\n\n\n* Less professional\n\n\n* Importing from other file types was unsuccessful in testing.\n\n\n**Pricing**: Free\n\n\n#### 9. [Gliffy](https://www.gliffy.com/)\n\n\n\n![MX3r0f8CK6D8teLMqrzHIN8hznvtyO-qwNENL-0qK44=](/blobs/MX3r0f8CK6D8teLMqrzHIN8hznvtyO-qwNENL-0qK44=)\n\n\nGliffy is a great choice for teams in need of a reliable and integrated diagramming tool on Confluence. With its intuitive user interface, plenty of ready-to-use components, and automatic updating of diagrams, there's no need to worry about having an outdated image - you'll always have the latest version. As if that weren't enough, Gliffy has Cloud Fortified certification, over 18 million users, and a long pedigree within Atlassian's products.\n\n\n**Key features:**\n\n\n* Links and syncs diagrams\n\n\n* Real-Time collaboration in Confluence cloud\n\n\n* Advanced security and access management features\n\n\n**Pros of Gliffy**\n\n\n* Simple and easy to use\n\n\n* Wide range of shapes, symbols, and templates designed for flowchart\n\n\n* Support collaboration\n\n\n**Cons of Gliffy**\n\n\n* Occasional lags and errors when you work with a large diagram\n\n\n* No option to export selected areas directly as PNG or JPEG\n\n\n**Pricing**: Professional (1-9 users): $10/month per user; Professional (0-50 users): $8/month per user\n\n\n#### 10. [Miro](https://miro.com/)\n\n\n\n![yqGbxR5Lpay-KancTPQDMXE8Kafc0wcJBADdMdtEJtI=](/blobs/yqGbxR5Lpay-KancTPQDMXE8Kafc0wcJBADdMdtEJtI=)\n\n\nMiro embraces more than 1,000 templates, including mind maps, Kanban boards, Gantt charts, product wireframes, research boards, and flowcharts. Miro provides an online collaborative platform where teams can brainstorm ideas, map workflows, and design prototypes all in one place.Â This versatile tool combines whiteboarding, collaboration, and project management functionalities, taking visual communication to new heights.\n\n\n**Key features:**\n\n\n* Provide real-time collaborative drawing\n\n\n* Built-in comments, video, chat, and seamless communication\n\n\n* Unlimited team workspaces with granular permissions, privacy & sharing controls\n\n\n**Pros of Miro**\n\n\n* Easy to build smart-looking flowcharts and mind maps\n\n\n* Simple to collaborate with teammates\n\n\n* Intuitive UI\n\n\n**Cons of Miro**\n\n\n* Hard to import or export content from time to time\n\n\n* Difficult to navigate large accountsPricing: $8/month per user for starter; $16/month per user for business\n\n\n### Efficient Process Mapping in AFFiNE\n\n\nWhen it comes to selecting the best process mapping tool for your organization in 2023, it's important to have confidence in your decision by considering the unique needs of your team and the specific features offered by each tool. By incorporating an effective process mapping tool into your workflow management strategy, you can drive efficiency gains throughout your organization and achieve your goals with ease. Look no further than AFFiNE, the top choice for efficient process mapping. Designed exclusively for project management and process improvement purposes, AFFiNE provides a comprehensive solution for organizations seeking to streamline their operations with confidence.\n\n\n\n![Yh4L5EZtXCl2bwf7YT0doIvwMJvA4KtCuOFtGwpbCVc=](/blobs/Yh4L5EZtXCl2bwf7YT0doIvwMJvA4KtCuOFtGwpbCVc=)\n\n\nSo why wait? Start exploring AFFiNE today and take your process mapping to new heights! The timing is opportune, and it's never too late to embark on this transformative journey. Commence improving your plans by using AFFiNE's user-friendly tool. Presently, AFFiNE has launched its **[Stable Version](https://affine.pro/download)**, with ongoing efforts to develop a more comprehensive and dependable iteration. Join us on our voyage through our social media channels and be part of the experience. **Come and join us on our journey over on our media platforms.** ðŸš€\n\n\n* Official Website: [https://affine.pro/](https://affine.pro/)\n\n\n* GitHub: [https://github.com/toeverything/AFFiNE](https://github.com/toeverything/AFFiNE)\n\n\n* Discord: [https://discord.gg/Arn7TqJBvG](https://discord.gg/Arn7TqJBvG)\n\n\n* Twitter: [https://twitter.com/AffineOfficial](https://twitter.com/AffineOfficial)\n\n\n",
  "publish": true
}