{
  "title": "Top 8 SMART Goals for Students in 2024 [With Templates/Examples]",
  "authors": [
    "Xuan Pang"
  ],
  "tags": [
    "Content"
  ],
  "description": "“Unlock academic success with our top 8 SMART goals for students in 2024! Discover the various templates/examples to help students thrive. Elevate your educational journey with strategic, measurable, achievable, relevant, and time-bound objectives tailored for success.”",
  "created": 1708300800000,
  "updated": 1708300800000,
  "layout": "blog",
  "id": "mjNFzSspx4jTR4k-qmVAe",
  "slug": "top-8-smart-goals-for-students-templates-examples",
  "cover": "/blobs/02nxgv5boA8uxrPwdQJOX-J44lhj3pkRYnQc_dFZ1pI=",
  "md": "---\n\n\ntitle: \"Top 8 SMART Goals for Students in 2024 [With Templates/Examples]\"\n\n\nauthor: \"Xuan Pang\"\n\n\ntags: Content\n\n\nslug: top-8-smart-goals-for-students-templates-examples\n\n\ndescription: “Unlock academic success with our top 8 SMART goals for students in 2024! Discover the various templates/examples to help students thrive. Elevate your educational journey with strategic, measurable, achievable, relevant, and time-bound objectives tailored for success.”\n\n\ncreated: 2024-02-19\n\n\nupdated: 2024-02-19\n\n\nlayout: blog\n\n\npublish: true\n\n\n---\n\n\n\n![02nxgv5boA8uxrPwdQJOX-J44lhj3pkRYnQc_dFZ1pI=](/blobs/02nxgv5boA8uxrPwdQJOX-J44lhj3pkRYnQc_dFZ1pI=)\n\n\nReady to turn your student journey into a [success](https://affine.pro/blog/navigating-organizational-strategies-a-path-to-project-success) story?\n\n\nWe've got your back! Our guide to the top 8 [SMART goals](https://affine.pro/blog/write-smart-goals-step-by-step-guide-definition-templates) for students is here to make your academic journey a breeze. We break it down with easy-to-follow examples and templates, helping you set goals that are clear, doable, and will lead to success.\n\n\nWhether it's acing exams, boosting study habits, or mastering time management, we've got goals that work for you. Let's make this year your best one yet!\n\n\n# What does the SMART acronym stand for?\n\n\n\n![JVtn75zAUIoOpOuHlVyax0B0CNzsLXCmDFmrMEiYyRI=](/blobs/JVtn75zAUIoOpOuHlVyax0B0CNzsLXCmDFmrMEiYyRI=)\n\n\n[SMART goals](https://affine.pro/blog/write-smart-goals-step-by-step-guide-definition-templates) are a framework used to set and achieve objectives in a structured and effective manner. The acronym SMART stands for Specific, Measurable, Achievable, Relevant, and Time-bound. Here's a breakdown of each component:\n\n\n1. **Specific:** Goals should be clear, well-defined, and specific. Clearly state what you want to accomplish, avoiding vague or ambiguous language. A specific goal answers the questions: What, Why, and How.\n\n\n1. **Measurable:** Goals should be quantifiable, allowing you to [track progress](https://affine.pro/blog/8-free-project-tracker-templates-work-management-2023) and determine when you've achieved success. Include measurable indicators or criteria that demonstrate progress and completion.\n\n\n1. **Achievable:** Goals should be realistic and attainable. While it's essential to aim high, [setting goals](https://affine.pro/blog/write-smart-goals-step-by-step-guide-definition-templates) that are too far beyond your current capabilities may lead to frustration. Ensure that the goal is challenging but within reach.\n\n\n1. **Relevant:** Goals should be relevant and aligned with your overall objectives or the larger mission. Ensure that pursuing the goal contributes meaningfully to your broader aspirations or the organization's mission.\n\n\n1. **Time-bound:** Goals should have a specific [timeframe](https://affine.pro/blog/how-to-create-a-project-timeline-template-in-excel-step-by-step-guide) or deadline. This adds a sense of urgency and helps in [managing time](https://affine.pro/blog/best-time-management-tools-techniques-create) effectively. It also provides a timeline for tracking progress and evaluating success.\n\n\n# What is a good [goal](https://en.wikipedia.org/wiki/Goal_setting) for a student?\n\n\nSetting a goal for academic success is pivotal in a student's journey. Consider a goal like **achieving an 'A' grade in all science subjects by the end of the semester**.\n\n\n\n![KN6UEtZYu-dFO2AvSiP6rnXO2B-RYlLCfHZ5f4k4QBQ=](/blobs/KN6UEtZYu-dFO2AvSiP6rnXO2B-RYlLCfHZ5f4k4QBQ=)\n\n\n**Specific:** This specific objective provides a clear target, ensuring the student knows exactly what they aim to accomplish.\n\n\n**Measurable:** The measurability of this goal is evident through the grades attained in science subjects, providing a tangible way to [track progress](https://affine.pro/blog/8-free-project-tracker-templates-work-management-2023).\n\n\n**Achievable:** By setting an achievable target, the goal encourages the student to strive for excellence without overwhelming them.\n\n\n**Relevant:** Additionally, the relevance of the goal is crucial, aligning with the student's academic pursuits and contributing to their overall [learning objectives](https://affine.pro/blog/best-free-okr-templates-2023).\n\n\n**Time-bound:** Lastly, the time-bound nature of this goal, set to be accomplished by the semester's end, adds a sense of urgency and helps in structuring focused efforts towards success.\n\n\n# **Why is Setting Collegiate Goals Important?**\n\n\n\n![COOWh-H3Lkv9lrcrondmdfCQ170U0ahj6qNpNc7HIgA=](/blobs/COOWh-H3Lkv9lrcrondmdfCQ170U0ahj6qNpNc7HIgA=)\n\n\n1. **Motivation and Focus:** Setting collegiate goals provides students with a clear sense of purpose and direction. Defined [objectives](https://affine.pro/blog/best-free-okr-templates-2023) act as motivators, helping students stay focused on their studies and extracurricular activities amid various distractions.\n\n\n1. **Time Management Skills:** The process of [setting and pursuing goals](https://affine.pro/blog/write-smart-goals-step-by-step-guide-definition-templates) encourages effective time management. College life often involves juggling multiple responsibilities, and goal-setting helps students prioritize tasks, allocate time wisely, and maintain a balance between academics and other pursuits.\n\n\n1. **Personal Development:** Collegiate goals extend beyond academic achievements, fostering[personal growth and development](https://www.berkeleywellbeing.com/self-growth.html). Whether it's gaining leadership experience, honing interpersonal skills, or exploring new interests, setting goals encourages students to engage in activities that contribute to their overall well-roundedness.\n\n\n# **What are 8 example SMART goals for students?**\n\n\n## 1. Get An A In My Next Essay by [AFFiNE](https://www.affine.pro)\n\n\n\n![2peo2ptqviJUETLaZceYFDfDA2vrQlSWcIaI77hVLdc=](/blobs/2peo2ptqviJUETLaZceYFDfDA2vrQlSWcIaI77hVLdc=)\n\n\nBy setting this time-based goal, you create a focused timeframe to channel your efforts, apply constructive feedback, and ensure you make the necessary improvements to secure the desired outcome.\n\n\n[>>> Get this template now](https://app.affine.pro)\n\n\n## 2. Improve My Research Skills by [AFFiNE](https://www.affine.pro)\n\n\n\n![jEjfomfcHSHakePQ3uw-MCB6Sz5gfh-lSgxFGnw8aYQ=](/blobs/jEjfomfcHSHakePQ3uw-MCB6Sz5gfh-lSgxFGnw8aYQ=)\n\n\nThis goal is not only relevant to your current course but also holds broader significance, as improving your research skills will contribute to better grades across all your classes in the future. Set within a time-based framework, the end-of-semester feedback serves as the targeted endpoint for achieving this objective.\n\n\n[>>> Get this template now](https://app.affine.pro)\n\n\n## 3. Type 60 Words Per Minute by [AFFiNE](https://www.affine.pro)\n\n\n\n![_0tnaVG-nhStMYBS_qK0RxY8fjBf45HFDDGZvp-8ikU=](/blobs/_0tnaVG-nhStMYBS_qK0RxY8fjBf45HFDDGZvp-8ikU=)\n\n\nEmbracing a time-based approach, you aim to reach a typing speed of 55 words per minute within one month and further accelerate to 60 words per minute within two months. This goal is tailored to enhance your practical skills and efficiency as a student within a clear, measurable timeframe.\n\n\n[>>> Get this template now](https://app.affine.pro)\n\n\n## 4. Study 5 Days A Week For 5 Weeks by [AFFiNE](https://www.affine.pro)\n\n\n\n![5uFAg0L0cae0iA2WCvd5vL293MhPAX-y-kW72MXvbLU=](/blobs/5uFAg0L0cae0iA2WCvd5vL293MhPAX-y-kW72MXvbLU=)\n\n\nThis goal is time-based, with the target of completing the 25 hours of focused study within a 5-week timeframe. It provides a structured and measurable approach to enhancing your understanding and performance in the math class through consistent and dedicated study sessions.\n\n\n[>>> Get this template now](https://app.affine.pro)\n\n\n## 5. Start planning career goals by [ClickUp](http://www.clickup.com)\n\n\n\n![XVGw2kHJn6NkQGUROobp_rLb1EumAenzm7y9LyZxwVs=](/blobs/XVGw2kHJn6NkQGUROobp_rLb1EumAenzm7y9LyZxwVs=)\n\n\nYou can use the [**Career Path Template by ClickUp**](https://clickup.com/templates/career-path-t-194505180) to create career plans and pathways that seamlessly integrate your personal career aspirations with organizational objectives—all while demonstrating opportunities for employee growth and learning.\n\n\n## 6. Block out time for studying each day by [ClickUp](http://www.clickup.com)\n\n\n\n![TOYtLaiqAXCkbDccOcbmKHnaLZPt_ML-rqViwKIyc-A=](/blobs/TOYtLaiqAXCkbDccOcbmKHnaLZPt_ML-rqViwKIyc-A=)\n\n\nYou can also use this [**Class Schedule and Time Study Template by ClickUp**](https://clickup.com/templates/class-schedule-and-time-study-t-222052271) to give you a framework to start with. It’s free to download and comes with a Start Here Doc to guide you as you create your class schedule and study time calendar.\n\n\n## 7. Practice soft and hard skills by [ClickUp](http://www.clickup.com)\n\n\n\n![X2-2LqbP__szSkKYdlC4GXYc0C76TVgLc7TXxOkubok=](/blobs/X2-2LqbP__szSkKYdlC4GXYc0C76TVgLc7TXxOkubok=)\n\n\nIt’s important to work on both soft and hard skills because they are both essential to having a successful career. Soft skills are necessary for interacting with others and forming relationships, while hard skills give you knowledge and proficiency in a specific area. Together, they can be powerful tools to help you reach your [short and long-term goals](https://clickup.com/blog/short-term-vs-long-term-goals/).\n\n\n## 7. Complete My Assigned Book For Class by HelpfulProfessor.com\n\n\n\n![yv6MPcCsfkBWBHZEV7ufZI6yNhQPHOgqWLGRlDZ0zRk=](/blobs/yv6MPcCsfkBWBHZEV7ufZI6yNhQPHOgqWLGRlDZ0zRk=)\n\n\nThis SMART goal is structured to guide your progress effectively, allowing you to stay on track and meet your reading objective in a timely manner.\n\n\n# Best SMART Tool Recommendation: [AFFiNE](https://www.affine.pro)\n\n\n\n\n\n<div style=\"text-align:center;\">\n\n\n<iframe width=\"560\" height=\"315\" src=\"https://www.youtube.com/embed/3cfeKOufZWU?si=IiXDIdwfnM2Z7KPL\" title=\"YouTube video player\" frameborder=\"0\" allow=\"accelerometer; autoplay; clipboard-write; encrypted-media; gyroscope; picture-in-picture; web-share\" allowfullscreen></iframe>\n\n\n</div>\n\n\n\n\n\n[AFFiNE](https://www.affine.pro)is a cutting-edge SMART app that is designed to assist you in organizing, managing, and cooperating on tasks, projects, and information. What sets AFFiNE apart is that it is a free and [open-source](https://affine.pro/blog/tips-where-and-how-contribute-open-source-projects) program that employs offline technology to ensure that it is accessible to all users.\n\n\n**Key features:**\n\n\n* **[Diversified templates](https://affine.pro/blog/best-free-whiteboard-layout-ideas-organization):** At AFFiNE, we provide a variety of templates, including Kanban and SMART, to enhance the agility and efficiency of your workflow. Utilize our range of templates to streamline processes, improve collaboration, and achieve optimal results in your projects.\n\n\n\n![B4wYA5uuE5zOevsBVSjMP6G2fj3ji9rR_YmyvfoeEi0=](/blobs/B4wYA5uuE5zOevsBVSjMP6G2fj3ji9rR_YmyvfoeEi0=)\n\n\n* **[Collaborative Capabilities:](https://affine.pro/blog/affine-0-10-0-launch-week-day-5-5-stable-with-cloud-support-finally-available-to-every-pro-in-your-team)** For group work, the app should have collaborative features, making it easy to share and coordinate work with others in your group work. For more details, please go to latest launch week blog: [Introduction to AFFiNE's Cloud](https://affine.pro/blog/affine-0-10-0-launch-week-day-5-5-stable-with-cloud-support-finally-available-to-every-pro-in-your-team).\n\n\n  \n![71MN7zgKOg2C73idwSU66YEnVUK8x41Jqwwe2z9CiPU=](/blobs/71MN7zgKOg2C73idwSU66YEnVUK8x41Jqwwe2z9CiPU=)\n\n\n* **Write, [Draw](https://affine.pro/blog/best-free-digital-whiteboard-apps-2023), and [Plan](https://affine.pro/blog/best-project-planning-tools-software-for-teams-2023) All-in-One:** Enjoy your all-in-one KnowledgeOS solution for effortlessly writing, drawing, and planning on a hyper-fused platform. It supports [kanban](https://affine.pro/blog/affine-080-launch-week-day3), table, rich-text paragraphs as building blocks to form pages or whiteboards. It carries out integrated processing here in document editing, data processing, or brainstorming.\n\n\n\n![O88V12dZ7eALpdMD8-6eyyfRec5yZyWiQxCnvNEb3r0=](/blobs/O88V12dZ7eALpdMD8-6eyyfRec5yZyWiQxCnvNEb3r0=)\n\n\n* **[Offline Accessibility](https://affine.pro/blog/5-best-offline-alternatives-to-notion):** The best SMART app should allow users to access their essential details offline. This feature is particularly valuable when going outside with limited internet connectivity.\n\n\n\n![7tLzErsXRl3O-9-0m62ySSd00VYnYYtRKFaZUFit2Jg=](/blobs/7tLzErsXRl3O-9-0m62ySSd00VYnYYtRKFaZUFit2Jg=)\n\n\nCurrently, **AFFiNE** has released its [stable version](https://affine.pro/download), but we are continuing to build to a more feature-rich and stable build. **Come and join us on our journey over on our media platforms.**\n\n\n* Official Website:[https://affine.pro/](https://affine.pro/)\n\n\n* GitHub:[https://github.com/toeverything/AFFiNE](https://github.com/toeverything/AFFiNE)\n\n\n* Twitter:[https://twitter.com/AffineOfficial](https://twitter.com/AffineOfficial)\n\n\n* Community：[https://community.affine.pro/home](https://community.affine.pro/home)\n\n\n* Discord:[https://discord.gg/Arn7TqJBvG](https://discord.gg/Arn7TqJBvG)\n\n\n* Telegram:[https://t.me/affineworkos](https://t.me/affineworkos)\n\n\n\n\n\n\n\n\n\n\n\n",
  "publish": true
}