{
  "title": "Top Collaboration Tools for Teams to Drive Success In 2024",
  "authors": [
    "Christopher Smolak"
  ],
  "tags": [
    "Content"
  ],
  "description": "Find out which collaboration tools will be trending and how you can drive your team toward success in 2024.",
  "created": 1684972800000,
  "updated": 1704153600000,
  "layout": "blog",
  "id": "AfApZIkqg3",
  "slug": "top-collaboration-tools-for-teams-to-drive-success",
  "cover": "/blobs/qHGMuvvZya-_u6TJbApfPPfC__YIDiW6TQAAVGj73q0=",
  "md": "---\n\n\ntitle: \"Top Collaboration Tools for Teams to Drive Success In 2024\"\n\n\nauthor: Christopher Smolak\n\n\ntags: Content\n\n\nslug: top-collaboration-tools-for-teams-to-drive-success\n\n\ndescription: \"Find out which collaboration tools will be trending and how you can drive your team toward success in 2024.\"\n\n\ncreated: 2023-05-25\n\n\nupdated: 2024-01-02\n\n\nlayout: blog\n\n\npublish: true\n\n\n---\n\n\n\n![qHGMuvvZya-_u6TJbApfPPfC__YIDiW6TQAAVGj73q0=](/blobs/qHGMuvvZya-_u6TJbApfPPfC__YIDiW6TQAAVGj73q0=)\n\n\nThe modern workplace is more diverse than ever, and that's a good thing. As technology advances, more and more workers are opting to do their jobs remotely, where they can still be easily reached by their teams and take advantage of a more versatile schedule.\n\n\nAlthough working from home offers many advantages, it also has its fair share of difficulties. The inability to see or hear your team members in real-time might make it tough to communicate effectively, but there are tools available to assist alleviate this problem.\n\n\nThere is a wide variety of options when it comes to the kinds of collaboration tools that may be used by teams.\n\n\nTeam collaboration tools are software programs designed to help teams work together effectively by sharing and organising information across multiple locations.\n\n\nThese resources, which range from instant messaging programs to video conferences, will allow you and your team to get more done in less time. But how can you know which to pick? What considerations should you make when choosing the best option?\n\n\nWe have researched for you and have come up with a list of some of the best collaborative tools available. But first, let’s take into account several factors, an organisation should consider when choosing a collaborative tool.\n\n\n## **How to Pick the Most Effective Team Collaboration Tools?**\n\n\nYou can select the best team collaboration tool that enables your team to work together seamlessly and drives success by giving careful consideration to these factors:\n\n\n### **Find out what your teammates need**\n\n\nIt's important to take into account the requirements of your team as a whole while selecting collaboration tools. Spend some time thinking about how your team may improve its ability to work together. Identify collaboration challenges and determine key features required.\n\n\n### **Consider adaptability and usability**\n\n\nThe accessibility and familiarity of online collaboration tools are crucial factors. Try to find user-friendly interfaces and easy interaction with your current processes.\n\n\n### **Evaluate communication features**\n\n\nThe key to any productive team effort is clear and constant communication. Select programs that allow for real-time communication by text, video, and push alerts.\n\n\n### **Evaluate your organisation's capacity for teamwork and file sharing.**\n\n\nDocuments should be easily shared among team members, and real-time collaboration on files should be possible with the help of collaboration tools. Look for tools that enable simultaneous collaboration, versioning, and document management.\n\n\n### **Take privacy and data protection into account**\n\n\nTools that can encrypt data, restrict who may access it, and ensure compliance should be given top priority. It's important to think about the tool's data backup and recovery features in case of data loss.\n\n\n### **The Quality of Customer Service and Training**\n\n\nLook for helpful customer service and a wide variety of training materials. Strong customer support, including quick answers to inquiries and troubleshooting, is invaluable when using new technology.\n\n\n## **The 7 Best Remote Team Collaboration Tools for 2024**\n\n\nThe best remote team collaboration tools make it easy to communicate, share files and data, and stay organised.\n\n\nWhen you're working with a remote team, collaboration tools are essential for staying connected, communicating efficiently, and getting things done.\n\n\nYou need a tool that allows you to easily set up group chats, share files, and assign tasks. You also need one that's intuitive and user-friendly so that everyone can use it without any training or onboarding.\n\n\nHere are the best remote team collaboration tools for 2024:\n\n\n### 1. [**AFFiNE**](https://affine.pro/)\n\n\n\n![DZKeuyjuicljvTbq5cTrYJ-jEaJo_luezGEYYNl9DDo=](/blobs/DZKeuyjuicljvTbq5cTrYJ-jEaJo_luezGEYYNl9DDo=)\n\n\nAFFiNE is a comprehensive collaboration tool that deserves the top spot on the list. It's an all-in-one solution since it has all the tools your team needs to work together efficiently.\n\n\nAFFiNE's ability to switch from paper mode to whiteboard mode is a major selling point that makes it a fantastic tool for collaborative brainstorming, planning, and communication. Users may personalise their workplace by changing the interface's color scheme, typeface, and icon settings.\n\n\nAFFiNE's accessibility and low price tag are two of the reasons why so many businesses find it enticing to use.\n\n\n### 2. [**Slack**](https://slack.com/)\n\n\n\n![CrJuCJm8u4cbBOjceLsn-CqcUs223c9uqK0eMlfqFdo=](/blobs/CrJuCJm8u4cbBOjceLsn-CqcUs223c9uqK0eMlfqFdo=)\n\n\nSlack is the dominant force in the enterprise collaboration space. It's a chat tool that allows workers to communicate and collaborate in real-time. Slack users may split the service into \"channels\" that correlate to certain projects, departments, or teams to improve communication and guarantee that everyone is on the same page.\n\n\nSlack allows users to have voice and video interactions, in addition to text and picture chat, file sharing, and integration with services like Google Drive, Trello, and Asana.\n\n\n### 3. [**Trello**](https://trello.com/)\n\n\n\n![nhSnqfEYW0FL44zJu0e5B4oZHFc6zFoXtuEKoQVDJnw=](/blobs/nhSnqfEYW0FL44zJu0e5B4oZHFc6zFoXtuEKoQVDJnw=)\n\n\nBecause of its focus on project management, Trello is also among the finest communication tools for distributed teams. You can see the large picture of all your projects at once thanks to the Kanban view it employs. If you open the card for a certain project, you can see where it stands. By creating a board for each undertaking, you will be able to do more than ever before.\n\n\n### 4. [**Wimi**](https://www.wimi-teamwork.com/)\n\n\n\n\n\n\n![NzYL3Sr7Gk3Fus2I-1AgO0-oe_o8XR6zidDa8AHxWy8=](/blobs/NzYL3Sr7Gk3Fus2I-1AgO0-oe_o8XR6zidDa8AHxWy8=)\n\n\nWimi is a suite of applications that helps you keep track of your teams, projects, and communications so you never miss a beat. Workspaces let you see the big picture, while communities simplify collaboration inside your company.\n\n\nBy using the chat feature and channels, you may lessen email clutter and deliver clearer information to your audience. Wimi allows users to generate Gantt charts and tasks, as well as edit, distribute, and save documents for use in project management.\n\n\nWith features like screen sharing and audio/video conferencing, the platform is suitable for conducting business meetings online.\n\n\n### 5. **[Asana](https://asana.com/campaign/pm-in/think?utm_campaign=&utm_source=&utm_medium=&gclid=Cj0KCQjwmZejBhC_ARIsAGhCqnflj2OklLWZVsycqeHHoQSn1dKaRX3ai5fc3gxkhotz8cv9Vp9OXw0aAobwEALw_wcB&gclsrc=aw.ds)**\n\n\n\n\n\n\n![JqbkLr3I0Dq_bL8ovZWUNYzCftbDbl4LgzluA7_EyFY=](/blobs/JqbkLr3I0Dq_bL8ovZWUNYzCftbDbl4LgzluA7_EyFY=)\n\n\nAsana is a powerful platform for teamwork that streamlines project management and boosts output. It gives project managers an intuitive interface for streamlining the management of team projects, procedures, and tasks.\n\n\nAsana's user interface (UI) and user experience (UX) are top-notch, making for a simple and aesthetically pleasing platform. Its intuitive layout increases the tool's usage and adoption by making it simple for team members to learn and use.\n\n\n### 6. [**Basecamp**](https://basecamp.com/)\n[](https://basecamp.com/)\n\n\n\n![HYUAIzd_neR8_5iyCaovIacgUTYAwQKPVIjplZMP-CA=](/blobs/HYUAIzd_neR8_5iyCaovIacgUTYAwQKPVIjplZMP-CA=)\n\n\nBasecamp is an online collaboration platform that provides all the features necessary for a team to perform effectively in one place.\n\n\nBy centralising these formerly separate functions, this collaboration software improves cooperation and productivity.\n\n\n### 7. [**Monday.com**](https://monday.com/)\n\n\n\n\n\n\n![BV4Ow8_kBcejTjbxQ3mwdmzC9vKUinfomEieqPRwV44=](/blobs/BV4Ow8_kBcejTjbxQ3mwdmzC9vKUinfomEieqPRwV44=)\n\n\nMonday.com is a versatile platform for team collaboration that facilitates the simplification of processes and the enhancement of output. Monday.com provides a visually beautiful and intuitive interface that is also very adaptable and simple to use for the management of activities, projects, and procedures.\n\n\nMonday.com's adaptability to different teams' demands is one of its most notable qualities. To facilitate effective task management and project organisation, users can make boards and processes that are unique to their needs. The visual design of the platform helps teams see the big picture in terms of project timelines, milestones, and dependencies.\n\n\n## Conclusion\n\n\nInvesting in the proper collaboration solutions is becoming increasingly important as teams embrace the future of work and deal with the difficulties of working remotely together. With the correct resources, teams may overcome obstacles, close gaps, and realise their full potential in 2024 and beyond.\n\n\nWhen used correctly, collaborative technologies may dramatically improve team coordination, administration, and output.\n\n\nWhile there are many options for collaboration software, AFFiNE is among the best. AFFiNE provides a complete solution for distributed teams thanks to its intuitive UI, extensive note-taking capabilities, task management features, and in-built communication facilities.\n\n\n\n\n\n\n\n\n  \n\n\n",
  "publish": true
}