{
  "title": "Top 12 One-Pager Examples and How to Create Your Own",
  "authors": [
    "Yiyang Zhang"
  ],
  "tags": [
    "Content"
  ],
  "description": "Unlock your creativity by using a well-crafted one-pager template for advanced smart planning; Learn how to create your own amazing one-pager. ",
  "created": 1716336000000,
  "updated": 1716336000000,
  "layout": "blog",
  "id": "4dw0yp6uQbTx96Hz3kBf_",
  "slug": "top-12-one-pager-examples-how-to-create-your-own",
  "cover": "/blobs/Ka2wUN7VZA0BuKL8ZfefB97EanZ1FvypcMUI2M23kRg=",
  "md": "---\n\n\ntitle: \"Top 12 One-Pager Examples and How to Create Your Own\"\n\n\nauthor: \"Yiyang Zhang\"\n\n\ntags: Content\n\n\nslug: top-12-one-pager-examples-how-to-create-your-own\n\n\ndescription: \"Unlock your creativity by using a well-crafted one-pager template for advanced smart planning; Learn how to create your own amazing one-pager. \"\n\n\ncreated: 2024-05-22\n\n\nupdated: 2024-05-22\n\n\nlayout: blog\n\n\npublish: true\n\n\n---\n\n\n\n![Ka2wUN7VZA0BuKL8ZfefB97EanZ1FvypcMUI2M23kRg=](/blobs/Ka2wUN7VZA0BuKL8ZfefB97EanZ1FvypcMUI2M23kRg=)\n\n\nCreating a compelling one-pager can be a daunting task. We understand the challenges you face: finding the perfect corporate one pager template, designing an eye-catching layout, and ensuring all essential information fits seamlessly on a single page. A well-crafted one-pager can be a powerful tool for your [business](https://affine.pro/blog/top-10-free-competitive-analysis-templates-boost-your-business), project, or marketing and sales teams, but where do you start?\n\n\nIn this article, we’ll explore 12 outstanding one-pager examples and provide you with actionable tips on how to create your own.\n\n\n\n\n\n# What is a One-Pager?\n\n\n\n![gFortJ1egJOgE-NokHBSy37in6s7MWMxC4zwotbRozs=](/blobs/gFortJ1egJOgE-NokHBSy37in6s7MWMxC4zwotbRozs=)\n\n\nA one-pager is a single-page document that succinctly presents a clear and compelling overview of a business, product,project, or idea. It is often used for pitches, marketing, or informational purposes, designed to grab attention and convey key messages quickly.  A one-pager is a one-page document that clearly and visually lays out all the key details you need to know about a product, service, project, or concept.\n\n\nWith a combination of text, visuals, and design elements, one-pagers grab the reader's attention and provide a comprehensive overview in an easily digestible format. One-pagers can be for either internal or external use. For example, you may share an internal training one-pager with your employees or a startup one-pager with potential investors.\n\n\n**Key Elements of an Effective One-Pager:**\n\n\n* **Headline:**Grab attention with a strong, clear headline.\n\n\n* **Introduction:**Briefly describe what the one-pager is about.\n\n\n* **Visuals:**Use images, icons, and graphics to enhance understanding.\n\n\n* **Body:**Include essential information like benefits, features, or data points.\n\n\n* **Call to Action (CTA):** Guide your audience to the next steps.\n\n\n\n\n\n## **Why Use a One-Pager?**\n\n\nProject one-pager is a powerful tools that offer several distinct advantages for [businesses](https://affine.pro/blog/10-best-b2b-social-media-marketing-strategies), marketers, and individuals. Here’s why incorporating one-pagers into your communication strategy is beneficial:\n\n\n\n![0dc0wi-wnvbotZfNKA6QNsT4dqCCHPS4pKNltlUE5HQ=](/blobs/0dc0wi-wnvbotZfNKA6QNsT4dqCCHPS4pKNltlUE5HQ=)\n\n\n* **Clarity and Focus:** A well-designed one-pager forces you to clarify your thoughts and hone in on what truly matters. It requires you to distil your message to its essence, which helps in presenting a clear and focused narrative. This clarity is especially important in settings like pitches, where you have limited time to make an impression.\n\n\n* **Visual Impact:** One-pagers leverage the power of visuals to enhance understanding and retention. By incorporating images, icons, charts, and other graphical elements, you can make your [content](https://affine.pro/blog/best-5-ai-content-detector-tool) more engaging and easier to comprehend. Visuals help break up text, highlight important information, and make your document more appealing to the eye.\n\n\n* **Versatility:** One-pagers are incredibly versatile and can be used in a variety of contexts. Whether you need to present a business proposal, summarize a marketing campaign, provide an event overview, or share a product’s key features, a one-pager can be tailored to fit any purpose. This flexibility makes it a valuable tool in your communication arsenal.\n\n\n* **Memorability:** A succinct and visually appealing one-pager is more likely to be remembered than a lengthy document. By condensing your message into a compelling, single-page format, you increase the chances that your audience will recall the key points. This is particularly advantageous in competitive scenarios, such as investor pitches or job applications, where standing out is crucial.\n\n\n* **Ease of Distribution:** One-pagers are easy to distribute both digitally and physically. They can be shared via email, printed for handouts, or included as part of a presentation. This ease of distribution ensures that your message can reach a wider audience quickly and [efficiently](https://affine.pro/blog/how-to-ask-ai-question-efficiently).\n\n\n* **Guidance and Engagement:** A one-pager provides a direct and focused way to guide your audience towards a specific action. Whether it’s contacting you for more information, visiting your website, signing up for a newsletter, or making a purchase, a well-crafted one-pager includes a clear and compelling call to action that drives engagement and conversion.\n\n\nBy leveraging these advantages, one-pagers become indispensable tools for effective communication. They help you deliver your message with clarity, impact, and professionalism, ensuring that your audience receives and retains the essential information you want to convey.\n\n\n\n\n\n## Top 12 One-Pager Examples in 2024\n\n\n### **[Canva](https://www.canva.com/templates/s/one-page/) One-Pager Example**\n\n\n\n![XUlQmwQR4z2bet80I0uKjyDS7hkMhc4g5Tl6dk2w7fI=](/blobs/XUlQmwQR4z2bet80I0uKjyDS7hkMhc4g5Tl6dk2w7fI=)\n\n\nThe Canva general one-pager example can be used for various purposes to present information in a concise manner. It offers a structured layout for outlining key elements of a detailed plan, including important information, next steps, and more. You can customize the sections to align with your personal goals, [risk analysis](https://affine.pro/blog/10-best-free-risk-assessment-templates-examples-2023), and financial projections.\n\n\n\n\n\n### **[Visme](https://visme.co/blog/one-pager-template/) Tech Company One-Pager Example**\n\n\n\n![4jHUL3oV-dzGUFppAphRfOYU4qCcnyMmEdl9NubTXdU=](/blobs/4jHUL3oV-dzGUFppAphRfOYU4qCcnyMmEdl9NubTXdU=)\n\n\nThis one-page business template from Visme, a modern tech company, prioritizes simplicity and clarity. It's designed to help you create an impressive presentation of your business information, offerings, and more.\n\n\nThe template includes pre-formatted sections for you to fill in with details about your company, services, features, statistics, feedback, and much more. Use this one-pager to showcase your company's expertise and attract potential clients, helping you secure high-paying jobs.\n\n\n\n\n\n### **Marketing Project Brief Template**\n\n\n\n![AvnyDN36E1_HSfA2lx4zSn-c46MQUdFqkEA97qPeIZk=](/blobs/AvnyDN36E1_HSfA2lx4zSn-c46MQUdFqkEA97qPeIZk=)\n\n\nThe marketing project brief template by ClickUp serves as a one-page document to outline essential information for a successful marketing project. It is used to communicate project goals, objectives, and target audience details, as well as also to track tasks and subtasks.\n\n\nThis versatile blueprint includes custom fields for departments, deliverables, target market, and supplementary documentation, allowing for easy modification to fit specific needs.\n\n\n\n\n\n### **[Content Camel](https://www.contentcamel.io/one-pager-examples/#saas-one-pager) Equipment One-Pager Example**\n\n\n\n![Pt54EbPJZnwY0K4nvTsDxVfMseJEHcZtFanuMEWluy0=](/blobs/Pt54EbPJZnwY0K4nvTsDxVfMseJEHcZtFanuMEWluy0=)\n\n\nContent camel created a one pager that lists all the features and advantages of the equipement. Equipment one-pagers are an excellent way to promote your equipment, attract potential customers, boost sales, and scale your business. This will help potential customers understand what makes your equipment stand out from the competition.\n\n\nAdditionally, this Content Camel equipment one-pager includes high-resolution images of the equipment, giving customers a better [idea](https://affine.pro/blog/10-creative-content-marketing-ideas-examples-inspire-you) of what the equipment looks like and how it works.\n\n\n\n\n\n### **[Storydoc](https://www.storydoc.com/blog/one-pager-examples) Business Plan One-Pager Example**\n\n\n\n![XHa9R43tKv84sy7TwNXd6KBGganH3EY-VNXOLahT3BU=](/blobs/XHa9R43tKv84sy7TwNXd6KBGganH3EY-VNXOLahT3BU=)\n\n\nFor Saas Startups, Storydoc's one-page busienss plan is a good fit. It effectively outlines the problem, solution, market analysis, and future objectives. The design is clean and professional, which appeals to investors and stakeholders(key team members). It's a great example of clear structure and concise presentation of key information.\n\n\n\n\n\n### **[Venngage](https://venngage.com/blog/one-pager/) Training and Development One-Pager Example**\n\n\n\n![OqV2r9k_vin7acx47xQ8v4xNLaCWnpQW97v0tWq3WlM=](/blobs/OqV2r9k_vin7acx47xQ8v4xNLaCWnpQW97v0tWq3WlM=)\n\n\nThe Venngage training and development one-pager was initially fashioned to monitor equipment, but it can be readily customized to ensure compliance with other protocols, particularly those recently instituted.\n\n\nResearch has underscored the efficacy of transcribing information onto paper or a tablet in improving information retention. Therefore, it is advisable for your training and development of one-pagers to be amenable to printing.\n\n\n\n\n\n### **[Slideteam](https://www.slideteam.net/blog/top-50-company-one-pagers) Company Services Portfolio One-Pager Example**\n\n\n\n![wc6QdAvN7bSvceGzKHZMxijeDx89BiaXRkh2BlzPMDw=](/blobs/wc6QdAvN7bSvceGzKHZMxijeDx89BiaXRkh2BlzPMDw=)\n\n\nMedia and production companies can use this Slideteam single-company services portfolio one-pager to enhance customer engagement and promote their services. It serves as a powerful brochure and flyer that can be distributed to capture the attention of the target audience.\n\n\n\n\n\n### **[Bit.ai](https://blog.bit.ai/one-pager/) Company One-Pager Template**\n\n\n\n![-lcA1K85OBK8huOX075JDNRYFfS0q00NvYoTl3C-cS0=](/blobs/-lcA1K85OBK8huOX075JDNRYFfS0q00NvYoTl3C-cS0=)\n\n\nYou can create a straightforward yet effective layout for all your one-pager using the bit.ai one pager template. This free template enables you to craft a professional business overview that can be used to pitch partnerships.\n\n\nYou can showcase your assets and explain the reasons why you and your team are a worthwhile investment. The one-pager contains all the necessary elements to develop a compelling business proposal, impress your clients, and secure important partnerships.\n\n\n\n\n\n### **[Zapier](https://zapier.com/blog/one-pager-examples/) B2B One-Pager Example**\n\n\n\n![0AG-eCQ3AeXZetUO7ecyPWGBesVPN0Uysoz3ne13KcM=](/blobs/0AG-eCQ3AeXZetUO7ecyPWGBesVPN0Uysoz3ne13KcM=)\n\n\nDecision-makers at businesses are busy, and a one-pager can cut through the noise to clearly communicate what your company does and why it's valuable. Leave the jargon at home and weave these elements into your one-pager: use cases, customer testimonials, and value propositions. This Zapier B2B one-pager template can fully meet your needs.\n\n\n\n\n\n### **Monday.com's Business Plan One-Pager Template**\n\n\n\n![vnj2fV6GGGVavFUXh_JU9CfLObFI8f5l7HiMSJt7rNU=](/blobs/vnj2fV6GGGVavFUXh_JU9CfLObFI8f5l7HiMSJt7rNU=)\n\n\nMonday.com has developed a one-page business plan template to assist you in creating an effective one-page business plan that will keep your goals and targets at the forefront as your business grows.\n\n\nThe template includes a digital visualization of your entire business strategy in one place, allowing for easy sharing and updates. It also offers extensive customization options to align the plan with your company's branding, and the ability to add visuals such as tables, images, and videos relevant to your business plan.\n\n\n\n\n\n### **[Smartsheet](https://medium.com/@affineworkos/top-10-smartsheet-alternatives-competitors-for-advanced-project-management-in-2023-ffae8049422e) One-Page Business Plan Template**\n\n\n\n![_Y_wOhzSZzFRtAWm9SKL2U2G66TNfJEqfXrTAcZc0MA=](/blobs/_Y_wOhzSZzFRtAWm9SKL2U2G66TNfJEqfXrTAcZc0MA=)\n\n\nThis Smartsheet business plan template is specifically designed for service-based businesses. The one-page plan includes sections to outline essential information about your strategy, such as the services you provide, the customer problem you solve, your mission and [vision](https://affine.pro/blog/8-free-printable-vision-board-templates-examples-2023) statements, your target audience, staffing needs, key objectives, and more.\n\n\nAdditionally, the core value features a timeline at the bottom for you to note important milestones.\n\n\n\n\n\n### **[AFFiNE](https://affine.pro/ai) Product Launch One-Pager Template**\n\n\n\n![c89URu0R5P_rt99wTvcXbdqy8EjS2_YyOknjSmQvYBw=](/blobs/c89URu0R5P_rt99wTvcXbdqy8EjS2_YyOknjSmQvYBw=)\n\n\nThis AFFiNE product one-pager template contains a comprehensive overview of the essential elements required for a successful product launch.\n\n\nMade up of sections detailing the product overview, launch date, target audience, key features and benefits, market analysis, marketing and sales strategy, pricing and packaging, success metrics, team and roles, and contact information. It aims to provide a clear and concise snapshot of the product and its launch plan, ensuring all stakeholders are aligned and informed.\n\n\n\n\n\n## How to Create Your Own One-Pager?\n\n\nCreating a one-pager for the first time can seem overwhelming, but with the right steps, you can create a professional and effective document. Follow these detailed steps to make your own business one-pager:\n\n\n\n![e4E87Hicb6UKV5BHep5UEhG02b5uaV3iqU0BL76CMzE=](/blobs/e4E87Hicb6UKV5BHep5UEhG02b5uaV3iqU0BL76CMzE=)\n\n\n#### Step 1: Define Your Purpose\n\n\nBefore you start designing, it’s essential to understand the main goal of your one-pager. Ask yourself:\n\n\n* What is the primary message you want to convey?\n\n\n* Who is your target audience?\n\n\n* What action do you want your audience to take after reading?\n\n\nFor a business one-pager, your purpose might be to present a business overview, highlight key products or services, or outline a business proposal to potential investors.\n\n\n#### Step 2: Identify pain points\n\n\nList all the essential points that need to be included in your one-pager. Focus on the most critical details that your audience needs to know. Here’s a basic structure to guide you:\n\n\n* **Headline:** A strong, clear headline that grabs attention. For example, \"Innovative Solutions for Modern Businesses.\"\n\n\n* **Introduction:**A brief overview of your business, its mission, and vision.\n\n\n* **Main Content:**\n\n\n  * Business Overview: What your business does, its unique value proposition, and its market position.\n\n\n  * Products/Services: Key features and benefits of your offerings.\n\n\n  * Achievements: Notable milestones, client success stories, or testimonials.\n\n\n  * Market Data: Relevant statistics that highlight your market presence and potential.\n\n\n* **Visuals:**Images, icons, or charts that support and enhance the text.\n\n\n* **Call to Action (CTA):**A clear instruction on what you want the reader to do next, such as \"Contact us for a consultation,\" \"Visit our website,\" or \"[Schedule](https://affine.pro/blog/top-10-best-agile-project-scheduling-software-2023) a demo.\"\n\n\n#### Step 3: Choose a Template\n\n\nUsing a template can simplify the design process and ensure a professional look. You can find many online resources offering the best one-pager templates. Look for one that suits your content and the style you want to convey. Ensure the template is easy to edit and flexible enough to accommodate your information.\n\n\n#### Step 4: Design Your Layout\n\n\nNow it’s time to start designing. Here’s how to create a clean and engaging layout:\n\n\n* **Keep it Simple:**Avoid clutter and stick to the essentials. Use whitespace to make the document easy to read.\n\n\n* **Use Visuals:** Incorporate high-quality images, icons, and charts. Visuals should support the text, not distract from it.\n\n\n* **Highlight Key Points:** Use headings, bullet points, and bold text to emphasize important information. Make it easy for readers to scan and find the key points.\n\n\n* **Consistent Fonts and Colors:**Stick to a few fonts and colours that align with your brand or the theme of your one-pager. Consistency in design elements helps maintain a professional appearance.\n\n\n#### Step 5: Craft a Compelling CTA\n\n\nYour one-pager should conclude with a clear and compelling call to action. This is a crucial element, as it guides your audience on what to do next. Depending on your purpose, a CTA could be:\n\n\n* \"Contact us for more information\"\n\n\n* \"Visit our website\"\n\n\n* \"Sign up for our newsletter\"\n\n\n* \"Purchase now\"\n\n\nMake sure the CTA stands out and is easy to follow.\n\n\n#### Step 6: Review and Revise\n\n\nBefore finalizing your one-pager, review it thoroughly:\n\n\n* **Proofread:** Check for spelling and grammar errors.\n\n\n* **Consistency:** Ensure fonts, colours, and spacing are consistent throughout the document.\n\n\n* **Clarity:** Make sure the information is clear and easy to understand. Ask someone else to review it and provide feedback.\n\n\n* **Accuracy:** Verify that all data and information are accurate and up-to-date.\n\n\nMake necessary adjustments to improve the clarity, accuracy, and visual appeal of your one-pager.\n\n\nCreating an effective one-pager requires a blend of clarity, conciseness, and [creativity](https://affine.pro/blog/top-25-ai-art-prompts-ideas-spark-your-creativity). By examining these top 12 examples and following our step-by-step guide, you can design a one-pager that effectively communicates your message and captivates your audience.\n\n\nWhether you’re presenting a new business idea, promoting an event, or showcasing a product, a well-designed one-pager can make a significant impact.\n\n\n## Are you ready to create your own one-pager?\n\n\nChoosing the right tools can make the process much easier. **AFFiNE AI** revolutionizes content creation by offering immediate insights, effortless content refinement, and [enhanced](https://affine.pro/blog/10-cool-apps-enhanced-productivity-simplified-living) creativity through dynamic [mind-maps](https://affine.pro/blog/ai-mind-map-generator) and polished presentation slides. With AFFiNE AI, you can envision grand ideas, boost [productivity](https://affine.pro/blog/10-best-ai-productivity-tools-must-know-upgrade-workflow-improve-business), and streamline your workflow, saving valuable time on every endeavor.\n\n\n\n![Sab_tUv3fcYGlVQIWFH6TdP3mNigknFl083G8kzONZo=](/blobs/Sab_tUv3fcYGlVQIWFH6TdP3mNigknFl083G8kzONZo=)\n\n\nWhether [brainstorming](https://affine.pro/blog/best-free-brainstorming-templates-techniques-guide) ideas, crafting presentations, or sketching visuals, AFFiNE AI amplifies creativity and upgrades workflow efficiency. It combines the functionalities of Notion AI, Miro AI, Figma AI, Canva AI, and Clickup AI into one comprehensive platform.\n\n\n**Best Features of AFFiNE AI:**\n\n\n* **[AI-Generated Visuals](https://affine.pro/blog/10-best-free-ai-virtual-assistants-improve-productivity):** Elevate presentations and content creation with AFFiNE AI's unparalleled visual capabilities. Craft polished, presentation-ready slides with just one click, eliminating tedious manual design work. From drawing images for articles to creating mind maps, flow charts, or professional slides, AFFiNE AI simplifies the process, allowing users to focus on content rather than formatting.\n\n\n\n![hqMbV7LGTsX2HQL8cyTXUj5t1e3IWfR4VQVSXHwZtv0=](/blobs/hqMbV7LGTsX2HQL8cyTXUj5t1e3IWfR4VQVSXHwZtv0=)\n\n\n* AI Writer: Perfect [writing](https://affine.pro/blog/top-10-best-wordai-alternatives-competitors-ai-writing) effortlessly with AFFiNE AI's advanced AI Writer feature. Say goodbye to spelling and grammar errors, tone inconsistencies, and lengthy editing sessions. With AFFiNE AI, users can translate content, adjust length, improve clarity, generate action items, and create drafts, outlines, or timelines with ease. Whether crafting [social media](https://affine.pro/blog/best-social-media-content-calendar-templates-smart-planning) posts or penning creative stories, AFFiNE AI empowers users to express themselves confidently and efficiently.\n\n\n\n![SBMr8BT1bbb5eyroL-KdqZUjHinJL6qhXAimhvalkqg=](/blobs/SBMr8BT1bbb5eyroL-KdqZUjHinJL6qhXAimhvalkqg=)\n\n\nWhether you're brainstorming ideas, crafting presentations, or sketching visuals, AFFiNE AI amplifies your creativity and upgrades workflow efficiency. Start using AFFiNE AI today to create marketing one-pager and elevate your content creation process. For more tips and resources, visit [our blog](https://affine.pro/blog?tag=Release+Note) or [contact us](https://community.affine.pro/home) for personalized assistance.\n\n\n**Come and join us on our journey over on our media platforms. 🚀**\n\n\n* Official Website:[https://affine.pro/](https://affine.pro/)\n\n\n* GitHub:[https://github.com/toeverything/AFFiNE](https://github.com/toeverything/AFFiNE)\n\n\n* Discord:[https://discord.gg/Arn7TqJBvG](https://discord.gg/Arn7TqJBvG)\n\n\n* Twitter:[https://twitter.com/AffineOfficial](https://twitter.com/AffineOfficial)\n\n\n",
  "publish": true
}