{
  "title": "Mastering Time Management: Exploring the Top 5 Free Time-Blocking Templates (with Practical Illustrations)",
  "authors": [
    "Yanxi Liu"
  ],
  "tags": [
    "Content"
  ],
  "description": "As the deadline approaches, you may find yourself in a state of panic, unsure of where to begin or how to prioritize your work.No worries, in this article, you will explore a helpful tool: Time-Blocking Templates, which can unlock your time's potential, optimize your productivity, and streamline your workflow!",
  "created": 1688860800000,
  "updated": 1688947200000,
  "layout": "blog",
  "id": "nGzajt-7wE",
  "slug": "top-5-free-practical-time-management-templates",
  "cover": "/blobs/ipuD42rXzrZ3sjZ-APn7iw3VzPZlI_gHSXaQxhCL_n4=",
  "md": "---\n\n\ntitle: \"Mastering Time Management: Exploring the Top 5 Free Time-Blocking Templates (with Practical Illustrations)\"\n\n\nauthor: \"Yanxi Liu\"\n\n\ntags: Content\n\n\nslug: top-5-free-practical-time-management-templates\n\n\ndescription: \"As the deadline approaches, you may find yourself in a state of panic, unsure of where to begin or how to prioritize your work.No worries, in this article, you will explore a helpful tool: Time-Blocking Templates, which can unlock your time's potential, optimize your productivity, and streamline your workflow!\"\n\n\ncreated: 2023-07-09\n\n\nupdated: 2023-07-10\n\n\nlayout: blog\n\n\npublish: true\n\n\n---\n\n\n\n![ipuD42rXzrZ3sjZ-APn7iw3VzPZlI_gHSXaQxhCL_n4=](/blobs/ipuD42rXzrZ3sjZ-APn7iw3VzPZlI_gHSXaQxhCL_n4=)\n\n\nIn the realm of valuable resources, time reigns supreme. Why not seize each moment and ensure it is time well spent? If you find yourself in need of a strategic approach to [time management](https://affine.pro/blog/best-project-management-tools-2024), look no further.\n\n\nIrrespective of your busy schedule, embracing **time-blocking templates** is paramount in organizing your precious hours. Not only will you have the opportunity to prioritize your tasks, but you will also efficiently [streamline your workflow](https://affine.pro/blog/best-free-task-management-software-streamline-workflow).\n\n\nBy adopting this method, you guarantee that all necessary tasks are attended to while avoiding the oversight of vital commitments. Missing deadlines, squandering precious time, and lacking motivation can be detrimental to your ultimate goals. However, with the implementation of time management strategies, these challenges are significantly alleviated.\n\n\n\n![2FxFOgjU1RXTpSFEaUVqqwT8VznJQhJ5_Qh1qAjUHWQ=](/blobs/2FxFOgjU1RXTpSFEaUVqqwT8VznJQhJ5_Qh1qAjUHWQ=)\n\n\n## What is Time-Blocking Template\n\n\nTime blocking, also known as time chunking, is an effective method for maximizing productivity. By dividing the workweek into manageable time slots, you can allocate dedicated moments for checking emails, working on projects, taking rejuvenating breaks, or even engaging in invigorating exercises.\n\n\nWhile some individuals take it to the extreme of micro-scheduling, accounting for every single activity, the essence of time blocking lies in dedicating substantial chunks of time to focus on important tasks. Embrace this technique by carving out dedicated blocks on your daily calendar, allowing you to make significant progress and achieve your goals.\n\n\nWith the implementation of time blocks, you can not only ensure the completion of important tasks but also prioritize invaluable moments for rest and self-care.\n\n\n## The Benefits of Utilizing Time-Blocking Templates\n\n\n1. [Enhanced Productivity](https://affine.pro/blog/how-to-increase-productivity-in-the-workplace):  Time-blocking templates provide a structured framework that optimizes workflow, allowing for increased focus and efficiency in completing tasks.\n\n\n1. Improved Time Management: By allocating specific time slots for each task, time-blocking templates help individuals prioritize and allocate their time effectively.\n\n\n1. Reduced Procrastination: The visual representation of tasks in time-blocking templates serves as a motivator, discouraging procrastination and encouraging task completion within designated time slots.\n\n\n1. Increased Focus: Utilizing time-blocking templates promotes deep work and concentration on a single task at a time, enhancing overall focus and eliminating distractions.\n\n\n1. Enhanced Work-Life Balance: Time-blocking templates ensure that individuals allocate dedicated time for personal activities, leading to a healthier work-life balance and reduced burnout.\n\n\n1. Stress Reduction: With a proactive approach to time management, time-blocking templates alleviate the stress associated with last-minute deadlines and provide a sense of control over daily activities.\n\n\n## Highlight the Time-Blocking Templates with AFFiNE\n\n\n### Daily Time-Blocking Template\n\n\n\n![GGFgOp1uSOt4BooowNl1AkPxVpoigOaRW6L2oqmQLcw=](/blobs/GGFgOp1uSOt4BooowNl1AkPxVpoigOaRW6L2oqmQLcw=)\n\n\nThe utilization of daily time-blocking templates involves segmenting your day into specific hours comprising relatively equal time blocks. These blocks serve as a convenient framework for swiftly assigning tasks that you aim to accomplish. Depending on your requirements, you have the flexibility to organize your daily time-blocking template in intervals of 15 minutes, 30 minutes, 1 hour, or any other time increment that best suits your needs.\n\n\n### Weekly Time-Blocking Template\n\n\n\n![OLG5Z8DK7jdzI5j3N3N5HbjgaG1ai7eNQ70Pissa-pc=](/blobs/OLG5Z8DK7jdzI5j3N3N5HbjgaG1ai7eNQ70Pissa-pc=)\n\n\nYou can navigate to the Weekly view in the previously mentioned AFFiNE Time-Blocking Template to visualize a specific date range within a week and effectively arrange your tasks in alignment with your priority.\n\n\nThrough this comprehensive weekly planner, you will gain a broader outlook that allows you to establish weekly objectives and seamlessly coordinate your workload with personal obligations. And for added personalization, you can draw some simple shapes to customize your templates and tailor the template to suit your specific needs.\n\n\n### Monthly Time-Blocking Template\n\n\n\n![cM4DSF3Jov5LEs3becSqPruM7iFp7WXZvM2lBHT5de8=](/blobs/cM4DSF3Jov5LEs3becSqPruM7iFp7WXZvM2lBHT5de8=)\n\n\nAh, at last, embark on a month-long plan. Should you desire to tailor the monthly templates for effective time management, it is imperative to establish precise goals and objectives. This pivotal aspect serves as a wellspring of inspiration and drive, propelling you toward the attainment of distinct targets. Thoroughly outlining and organizing your monthly time management skills is extremely important to minimize the chances of making mistakes.\n\n\nPicture this: immersing yourself in a thrilling fitness challenge that pushes your limits or delving into the captivating world of a new language. With meticulously crafted monthly time-blocking templates, you'll not only feel organized but also empowered to conquer your goals. Envision the exhilaration of effortlessly engaging in a basic conversation in a foreign tongue, unlocking a whole new realm of cultural connections by the end of the month.\n\n\n### Top 5 Free Time-Blocking Template Creators: App Recommendations\n\n\nNow, let's shift our focus to the Top 5 Free Time-Blocking Template creators, which will undoubtedly elevate your productivity to new heights.\n\n\n## AFFiNE\n\n\n\n![trxUaOoYJL-sVlD3MY2wpTLjGkrDG8eceP01NiYhhu0=](/blobs/trxUaOoYJL-sVlD3MY2wpTLjGkrDG8eceP01NiYhhu0=)\n\n\n[AFFiNE](https://affine.pro/) is a **tech-leading and innovative task management software** designed to help you organize, manage, and collaborate on tasks, projects, and information. Notably, it stands out as a completely free and open-source solution, utilizing offline technology to ensure accessibility for all users. This makes it a precious discovery for individuals seeking a **comprehensive task management solution** for their daily needs. Additionally, both startups and large corporations can leverage its user-friendly interface to manage group tasks with clarity and efficiency.\n\n\n\n![2QobwT80sgovvXtT6_fiHCnhWNyxP_jyl5m6hxejf2c=](/blobs/2QobwT80sgovvXtT6_fiHCnhWNyxP_jyl5m6hxejf2c=)\n\n\nKey Features:\n\n\n1.Customize your Time-Blocking Templates\n\n\nIn AFFiNE, we support the function for shifting between two modes. In whiteboard mode, you can freely connect and arrange your thoughts, visually representing your time-blocking templates. However, if you want to delve deeper into a particular subtopic, you may realize the need to capture more detailed information. This is where shifting to page mode becomes beneficial, allowing you to edit detailed information more linearly. What's even more surprising is that AFFiNE also enables you to insert a database into the whiteboard! This versatility will enable you to explore your ideas with both a high-level overview and granular detail, ensuring a comprehensive representation of your thoughts.\n\n\n2.Track your goal\n\n\nWith AFFiNE, users can set goals, track their progress, and measure outcomes with ease. This feature allows individuals to have a clear understanding of their objectives and enables teams to work towards shared goals effectively.\n\n\n3.Collaborate with your team members.\n\n\nCollaboration is key when it comes to refining your time-blocking templates, and AFFiNE whiteboards provide the perfect platform for real-time collaboration. Imagine effortlessly connecting with your team, regardless of their physical location, to create and refine your time-blocking templates together. With the simplicity of whiteboards, you also can quickly brainstorm ideas, visualize your schedules, and make adjustments in real time. It's as simple as gathering around a virtual whiteboard, where everyone can contribute their insights and expertise, ensuring that your time-blocking templates are comprehensive and optimized for success. This seamless collaboration process fosters teamwork, enhances creativity, and ultimately leads to well-structured schedules that align with your team's goals.\n\n\n\n![zKgRE1UFALuNFzHlddbBBn35CGdFves4lW75Om3XuBs=](/blobs/zKgRE1UFALuNFzHlddbBBn35CGdFves4lW75Om3XuBs=)\n\n\nIn the future, we will supply some advanced features and **AFFiNE Cloud** uses where you can simply store your data without any data concerns. For more things related to AFFiNE, feel free to check out the Official website:[https://app.affine.pro/](https://app.affine.pro/)\n\n\n### asana\n\n\n\n![7naayNh94IT17_9SllsHoa4EWkp62SBOJpIqq04xrvw=](/blobs/7naayNh94IT17_9SllsHoa4EWkp62SBOJpIqq04xrvw=)\n\n\n[asana](https://asana.com/)  offers task management, project tracking, collaboration tools, customizable templates, timeline view, integrations with popular apps, and mobile accessibility.Key Features:\n\n\n* Timeline View: Asana's timeline view provides a visual representation of project schedules, dependencies, and milestones. This helps users plan and manage their time effectively, ensuring tasks are completed on schedule.\n\n\n* Integrations: Asana integrates with popular apps such as Google Drive, Slack, and Microsoft Teams, allowing users to streamline their workflows and access all necessary tools in one place.\n\n\n### ClickUp\n\n\n\n![sJOVL4vTNWO7lPJKvK6RUvZfe_UGUOZGZaI3d8g3iqk=](/blobs/sJOVL4vTNWO7lPJKvK6RUvZfe_UGUOZGZaI3d8g3iqk=)\n\n\n[ClickUp](https://clickup.com/) provides task management, project management, time tracking, collaboration features, customizable workflows, goal tracking, reporting, integrations, and mobile apps.Key Features:\n\n\n* Task and Project Management: ClickUp provides comprehensive task and project management features, including task assignment, progress tracking, subtasks, and dependencies. This enables users to stay organized, prioritize tasks, and manage their time effectively.\n\n\n* Integrations: ClickUp integrates with various tools and apps, such as Google Calendar, Slack, and Trello, allowing users to centralize their workflows and access information seamlessly.\n\n\n### Clokify\n\n\n\n![i3J2rGr8Yr0ryjzRqhpJHtcMmmq8TIdp6LLhTrMJnbM=](/blobs/i3J2rGr8Yr0ryjzRqhpJHtcMmmq8TIdp6LLhTrMJnbM=)\n\n\n[Clockify](https://clockify.me/) is primarily a time tracking tool offering features like time tracking, timesheet management, project tracking, reporting, and integrations.Key Features:\n\n\n* Time Tracking: Clockify allows users to track time spent on tasks and projects. This helps individuals understand how they allocate their time, identify time-wasting activities, and make adjustments to improve productivity.\n\n\n* Timesheet Management: Clockify offers timesheet management features, enabling users to log hours, categorize activities, and generate accurate reports. This helps individuals and teams track their time more efficiently and ensure accurate billing or project costing.\n\n\n### Smartsheet\n\n\n\n![wy2eHYgyjim1TiwM15vklTAlPpavApHzmG9MI-Mb7AE=](/blobs/wy2eHYgyjim1TiwM15vklTAlPpavApHzmG9MI-Mb7AE=)\n\n\nSmartSheet offers project management, task tracking, collaboration tools, customizable templates, Gantt charts, reporting, integrations, and mobile accessibility.Key Features:\n\n\n* Gantt Charts: SmartSheet's Gantt chart view provides a visual representation of project timelines, dependencies, and milestones. This helps users plan and schedule tasks effectively, ensuring efficient time allocation.\n\n\n* Reporting: SmartSheet offers reporting and analytics features, providing insights into project progress, resource allocation, and team performance. This data helps users identify areas for improvement and optimize their time management strategies.\n\n\n## Conclusion: Select a Time-Blocking apps that align with your personal habits.\n\n\nCreating effective Time-Blocking Templates is essential not only for individuals to manage time properly but also to provide groups with a clear view to check the tasks, which can boost productivity and achieve consistent outcomes. This article provides the Top 5 Time-Blcoking Templates applications to assist you in creating customized Time-Blocking Templates that align with your specific requirements.\n\n\nFurthermore, incorporating the right tools into your learning process can significantly [streamline your workflow](https://affine.pro/blog/top-free-workflow-temlplates-to-consider). We have carefully examined several top-notch free tools, such as AFFiNE, asana, ClickUp, Clockify, and Smartsheet. These tools offer a wide array of features that simplify the creation, collaboration, and management of Time-Blocking Templates.\n\n\nIn particular, AFFiNE is about to launch its beta version and continues to enhance its capabilities with additional features and stability. We invite you to join us on our journey through our various media platforms to stay updated and actively participate in shaping the future of AFFiNE.\n\n\n* Official Website: [https://affine.pro/](https://affine.pro/)\n\n\n* GitHub: [https://github.com/toeverything/AFFiNE](https://github.com/toeverything/AFFiNE)\n\n\n* Discord: [https://discord.gg/Arn7TqJBvG](https://discord.gg/Arn7TqJBvG)\n\n\n* Twitter: [https://twitter.com/AffineOfficial](https://twitter.com/AffineOfficial)\n\n\n",
  "publish": true
}