{
  "title": "Top 25 AI Art Prompts Ideas to Spark Your Creativity",
  "authors": [
    "Yiyang Zhang"
  ],
  "tags": [
    "Content"
  ],
  "description": "Ignite your creativity with our 25 AI art prompts ideas with diverse themes, leveraging AI algorithms to push artistic boundaries. Discover how AI assistants can generate visually captivating artwork, providing fresh perspectives.",
  "created": 1710720000000,
  "updated": 1713916800000,
  "layout": "blog",
  "id": "XrcpmGgWT1fWxJsn0BXt5",
  "slug": "top-25-ai-art-prompts-ideas-spark-your-creativity",
  "cover": "/blobs/_-MBIRm9m157WV4mVNemKwi9lmdIztZghu7DgkwiUVM=",
  "md": "---\n\n\ntitle: \"Top 25 AI Art Prompts Ideas to Spark Your Creativity\"\n\n\nauthor: \"Yiyang Zhang\"\n\n\ntags: Content\n\n\nslug: top-25-ai-art-prompts-ideas-spark-your-creativity\n\n\ndescription: \"Ignite your creativity with our 25 AI art prompts ideas with diverse themes, leveraging AI algorithms to push artistic boundaries. Discover how AI assistants can generate visually captivating artwork, providing fresh perspectives.\"\n\n\ncreated: 2024-03-18\n\n\nupdated: 2024-04-24\n\n\nlayout: blog\n\n\npublish: true\n\n\n---\n\n\n\n![_-MBIRm9m157WV4mVNemKwi9lmdIztZghu7DgkwiUVM=](/blobs/_-MBIRm9m157WV4mVNemKwi9lmdIztZghu7DgkwiUVM=)\n\n\nStep into the dynamic realm where artistry meets innovation, weaving a tapestry of boundless[creative possibilities](https://affine.pro/blog/10-best-free-storyboard-creator-software)powered by artificial intelligence. Join a global community of artists and designers, spanning all skill levels, as they harness the transformative potential of AI art prompts to push the boundaries of visual expression. ðŸŽ‡\n\n\nAs the momentum of AI-generated art continues to swell worldwide, now is the prime moment to embark on this exhilarating journey of exploration. With leading platforms like OpenArt, Midjourney, Stable Diffusion, and Canva leading the charge, individuals can readily immerse themselves in artistic discovery, achieving extraordinary results in record time compared to traditional methods. âœ¨\n\n\nAt the heart of unlocking the true potential of AI-driven creativity lies the mastery of crafting the perfect AI prompt. Whether you're an established creative seeking fresh inspiration or an aspiring artist eager to dive into the realm of AI-generated art, this article serves as your guiding light, illuminating the path toward unparalleled artistic innovation. Venture forth and unleash your imagination like never before! ðŸš€\n\n\n# **What is AI Art?**\n\n\n\n![UDtnpWgQRsd8rk9c3TOy9FZrlOXPFS43ifraXbxycxU=](/blobs/UDtnpWgQRsd8rk9c3TOy9FZrlOXPFS43ifraXbxycxU=)\n\n\nAI art represents a groundbreaking amalgamation of technology and artistic expression, leveraging algorithms to transcend conventional boundaries. Diverging from traditional methodologies, AI delves into data patterns to craft visually captivating masterpieces, serving as [a digital collaborator](https://affine.pro/blog/top-10-best-free-digital-planner-apps-2023) that enriches the creative process with fresh perspectives and concepts.\n\n\nThrough the power of machine learning, AI not only replicates human artistic styles but also pioneers entirely novel approaches, opening doors to boundless experimentation and ingenuity within the realm of art. Collaborating with AI enables artists to delve into unexplored themes, hues, and compositions, fostering a realm of creative exploration previously untapped.\n\n\nThe allure of AI art lies in its capacity to astonish and provoke, constantly challenging preconceived notions. Embracing this fusion of human ingenuity and technological prowess liberates artists from conventional constraints, propelling them toward uncharted realms of creative discovery and innovation.\n\n\n# **How to Write AI Art Prompts that Meet Your Needs**\n\n\nCrafting AI art prompts requires a thoughtful and [strategic approach](https://affine.pro/blog/10-best-b2b-social-media-marketing-strategies). A haphazard approach might not yield the desired results.\n\n\n\n![Ws_54ZLzjc64IBV036CY5qw3kvHJSmbxl5NECQRx7uY=](/blobs/Ws_54ZLzjc64IBV036CY5qw3kvHJSmbxl5NECQRx7uY=)\n\n\n* **Define the style or theme you wish to explore clearly:**\n\n\nClearly defining the style or theme you want to explore helps provide a clear direction for your AI-generated artwork. Whether it's abstract, realistic, futuristic, or dreamlike, having a defined starting point is crucial for the [creative process](https://affine.pro/blog/top-10-best-process-mapping-tools-software-2023-free-paid).\n\n\n* **Consider the emotions or concepts you aim to convey:**\n\n\nIdentifying the emotions or concepts you want your AI-generated artwork to evoke guides the development of your prompt. Whether it's joy, melancholy, wonder, or a blend of emotions, having a clear intention behind your art enhances its impact.\n\n\n* **Experiment with different input parameters and settings on your AI platform:**\n\n\nThis point encourages experimentation with various input parameters and settings on your AI platform to observe their effects on the generated output. Exploring different options can lead to discovering new possibilities and refining your artistic vision.\n\n\n* **Embrace playful exploration and push boundaries for artistic breakthroughs:**\n\n\nEncouraging artists to adopt a playful mindset and push the boundaries of traditional art-making processes. Being open to unexpected results can lead to creative breakthroughs and innovative artistic expressions.\n\n\n* **Recognize AI as a tool to amplify creativity, not restrict it:**\n\n\nAcknowledging that AI is a tool meant to enhance artistic creativity rather than limit it. It implies that artists should view AI as a partner in their creative process, leveraging its capabilities to expand their artistic horizons.\n\n\n* **Stay open-minded and receptive to new possibilities in crafting prompts tailored to your artistic vision:**\n\n\nEncouraging artists to remain open-minded and receptive to new ideas and possibilities. It suggests that flexibility and adaptability are essential when crafting prompts to ensure they align with the artist's unique artistic vision and goals.\n\n\n# **Top 25 Prompt Ideas for AI Art to Spark Your Creativity**\n\n\nAre you ready to ignite your creativity with AI art? Look no further as we unveil the top 25 prompt ideas that will unleash your artistic potential.\n\n\n### **Nature:**\n\n\n\n![8z7qXjLC1msHrT4Cq07-QZU3LqdlAyJpZDNqxXIZorc=](/blobs/8z7qXjLC1msHrT4Cq07-QZU3LqdlAyJpZDNqxXIZorc=)\n\n\n* Venture into a realm where imagination knows no bounds, and nature's sovereignty reigns supreme. Picture a landscape straight out of a dream, where towering mountains meet the sky, lush forests whisper secrets of ancient wisdom, and crystalline waters mirror the dance of celestial bodies. Let your mind wander through this fantastical realm, blending elements of fantasy and reality into a breathtaking panorama that invites exploration and wonder.\n\n\n* Embark on a visual odyssey through the ever-changing tapestry of the seasons, where each transition becomes a canvas for nature's boundless creativity. From the fiery hues of autumn's embrace to the delicate blossoms of spring's awakening, capture the essence of transformation in a mesmerizing abstract composition that speaks to the soul. Let colors mingle, shapes shift, and textures weave tales of renewal and growth, inviting viewers to immerse themselves in the beauty of nature's cyclical dance.\n\n\n* Prepare to be transported to a world of wonder and enchantment as you delve into the surreal beauty of natural phenomena like the Northern Lights. Picture ribbons of light dancing across the night sky, painting a mesmerizing tableau of shimmering colors that defy explanation. Infuse your artwork with the magic and mystique of this celestial spectacle, inviting viewers to lose themselves in the awe-inspiring beauty of the universe.\n\n\n* Take a closer look at the intricate patterns and textures found in the delicate embrace of a single plant or flower. Explore the graceful curves of a petal, the intricate veins of a leaf, and the subtle interplay of light and shadow that brings each natural wonder to life. Through the lens of artistic expression, reimagine these botanical treasures in a mesmerizing composition that celebrates the beauty and complexity of the natural world.\n\n\n* Experience the timeless allure of a picturesque sunrise or sunset, where the sky becomes a canvas for nature's most breathtaking performance. Picture hues of gold and crimson painting the horizon, casting a warm glow over land and sea as the world awakens or bids farewell to another day. Capture the tranquility and serenity of this daily spectacle in an evocative interpretation that invites viewers to pause, reflect, and find solace in the beauty of nature's eternal embrace.\n\n\n### **Technology:**\n\n\n\n![F2_m7QQAYtjZCZyl-sEpBf3f6uDkU8kb4HfiMc4Lqbw=](/blobs/F2_m7QQAYtjZCZyl-sEpBf3f6uDkU8kb4HfiMc4Lqbw=)\n\n\n* Dive into a mesmerizing depiction of a future where the fusion of humanity and technology blurs the lines of existence. Picture bustling cityscapes where humans and machines coexist seamlessly, intertwining in a dance of innovation and progress. Delve into the intricate details of this technologically advanced world, where cyborgs roam alongside humans, and artificial intelligence permeates every aspect of society. Let your imagination run wild as you envision the possibilities of this futuristic realm, where the boundaries between man and machine dissolve, giving rise to a new era of evolution and exploration.\n\n\n* Embark on a visual journey into the realm of data visualization, where complex datasets are transformed into captivating works of art that challenge perceptions and ignite curiosity. Picture intricate patterns and designs emerging from the depths of raw data, weaving a tapestry of information that transcends mere numbers and statistics. Explore the beauty of mathematics and the power of visualization as you delve into the depths of this mesmerizing landscape, where every pixel tells a story and every line holds a secret waiting to be uncovered.\n\n\n* Transport yourself to the metropolises of tomorrow as you explore the concept of AI-generated architecture. Picture towering skyscrapers reaching toward the heavens, their sleek and futuristic designs defying the limits of imagination. Wander through bustling city streets lined with buildings that seem to pulse with energy, their structures shaped by the algorithms of artificial intelligence. Marvel at the wonders of this technologically advanced world, where innovation knows no bounds and the possibilities are endless.\n\n\n* Reimagine the iconic symbols and inventions that have shaped our technological landscape, infusing them with new meaning and symbolism to provoke thought and reflection. Explore the depths of human ingenuity as you reinterpret familiar motifs through the lens of artificial intelligence, breathing new life into age-old concepts and sparking fresh perspectives. Delve into the intersection of past, present, and future as you ponder the implications of these reimagined symbols, and discover the hidden truths that lie beneath their surface.\n\n\n* Journey into the abstract realms of the digital landscape, where connectivity, virtuality, and the ever-expanding reach of technology converge in a mesmerizing dance of light and shadow. Picture vast networks of data stretching across cyberspace, their tendrils weaving a tapestry of information that spans the globe. Explore the depths of this digital realm as you ponder the nature of connectivity and the impact of technology on our lives. Allow your imagination to soar as you navigate this surreal landscape, where reality blurs with virtuality, and the boundaries between the physical and digital worlds dissolve into nothingness.\n\n\n### **Fantasy:**\n\n\n\n![RH-WQRV7d8JXR_WTcMgvAAcf2CKEvYNhAXOnWdlR2IM=](/blobs/RH-WQRV7d8JXR_WTcMgvAAcf2CKEvYNhAXOnWdlR2IM=)\n\n\n* Craft a character straight from the depths of ancient lore and myth, drawing inspiration from the rich tapestry of fantastical creatures that have captured human imagination for centuries. Merge elements of fantasy and folklore to breathe life into a mesmerizing entity unlike any seen before, weaving together intricate details and evocative imagery to create a truly captivating persona that transcends the boundaries of reality.\n\n\n* Transport yourself to a world beyond the realm of possibility, where fantastical landscapes stretch out in all directions, teeming with creatures born from the depths of your imagination. Dive into the uncharted territories of adventure and discovery as you traverse this wondrous realm, encountering marvels beyond comprehension and unlocking the secrets of the unknown with every step.\n\n\n* Embark on a journey through the annals of history and folklore, where timeless tales and legends are reborn through the transformative power of AI. Reimagine classic fairy tales with a fresh perspective, infusing them with visually stunning interpretations that breathe new life into age-old stories, inviting viewers to rediscover the magic and wonder of these timeless narratives.\n\n\n* Delve into the enigmatic realm of dreams and delve into the surreal landscapes of the subconscious mind. Through the lens of AI-generated art, capture the ethereal beauty and otherworldly imagery that defines the mysterious world of dreams, where reality bends and twists into fantastical shapes, inviting viewers to lose themselves in a mesmerizing dreamscape unlike any other.\n\n\n* Cast your gaze towards the stars and venture into the uncharted depths of the cosmos, where science fiction and imagination collide to create breathtaking vistas of futuristic cities, alien worlds, and interstellar journeys beyond the confines of our wildest dreams. Let your imagination soar as you envision a future filled with wonder and possibility, exploring the boundless realms of imagination through the lens of AI-generated art.\n\n\n### **Abstract:**\n\n\n\n![WciPFYoooQlriHq2mdkyz7jsU5BVbESnS2_kAV0WIQE=](/blobs/WciPFYoooQlriHq2mdkyz7jsU5BVbESnS2_kAV0WIQE=)\n\n\n* Dive into the intricate dance between chaos and order through a mesmerizing abstract artwork. With a palette rich in hues and textures, craft a canvas where vibrant bursts of color mingle with serene expanses, symbolizing the delicate equilibrium of the universe. Let the interplay of shapes and forms narrate a story of harmony amidst turmoil, inviting viewers to ponder the delicate balance that underpins existence.\n\n\n* Embark on a visual symphony inspired by the ethereal melodies of music. Harness the power of AI to translate the rhythmic cadence of soundwaves into a captivating composition that pulses with life. Watch as vibrant hues ebb and flow, weaving intricate patterns that mirror the ebbs and flows of a musical score. Each brushstroke becomes a note, each color a melody, as the canvas comes alive with the harmony of sight and sound.\n\n\n* Delve into the depths of duality with an evocative artwork that juxtaposes opposing forces in a mesmerizing display. Through the lens of AI, create a visual tapestry where light and dark, motion and stillness, collide and coalesce in a captivating dance. Let contrasting elements converge in a symphony of contradictions, inviting viewers to contemplate the delicate interplay between opposing forces in the fabric of existence.\n\n\n* Explore the boundless realm of human emotion through the lens of AI, as feelings such as love, fear, joy, and sorrow find expression in abstract form. With a deft touch, translate the nuances of human experience into a kaleidoscope of colors and shapes that resonate with raw emotional intensity. Each brushstroke becomes a conduit for the soul, as the canvas becomes a mirror reflecting the depth and breadth of human feeling.\n\n\n* Embark on a journey through the mesmerizing realm of geometry and symmetry, guided by the hand of AI. Delve into the infinite possibilities of shape and form, as repetition, reflection, and distortion converge to create breathtaking patterns and designs. Watch as symmetry unfolds in kaleidoscopic splendor, drawing viewers into a hypnotic dance of lines and angles that transcends the boundaries of perception.\n\n\n### **Surrealism:**\n\n\n\n![T_2GUzLAoXM__SeYgk0naN-SICgPr__6jU9C0fb647w=](/blobs/T_2GUzLAoXM__SeYgk0naN-SICgPr__6jU9C0fb647w=)\n\n\n* Immerse yourself in the mystical allure of nature as you conjure a surreal interpretation of a familiar landscape or scene. Through the masterful strokes of artistry, warp reality into a dreamlike tableau that beckons viewers to explore its enigmatic depths. Challenge perceptions and ignite curiosity as you blend the familiar with the extraordinary, inviting onlookers to lose themselves in the boundless expanse of imagination.\n\n\n* Transcend the confines of reality and delve into the realm of the fantastical with an artwork that blurs the boundaries between the tangible and the imagined. Infuse elements of everyday life with a touch of magic and whimsy, weaving a tapestry of wonder and intrigue that captivates the senses. Let your creativity soar as you craft a mesmerizing composition that transports viewers to a realm where the ordinary meets the extraordinary, leaving them spellbound by its ethereal beauty.\n\n\n* Harness the transformative power of imagination to explore the concept of metamorphosis in all its wondrous glory. From fantastical creatures undergoing mystical changes to shape-shifting landscapes that defy logic, let your imagination run wild as you depict the awe-inspiring process of transformation. Challenge conventional notions of reality as you weave a narrative of metamorphosis that transcends the bounds of logic and reason, leaving viewers mesmerized by the sheer wonder of the unknown.\n\n\n* Peel back the layers of consciousness and embark on a journey of introspection with a surrealistic self-portrait brought to life. Explore the depths of identity and the subconscious mind as you unveil hidden layers of meaning and symbolism within the confines of your own visage. Through the lens of artistry, they delve into the enigmatic realms of the psyche, allowing viewers to glimpse the innermost workings of the human soul with each brushstroke.\n\n\n* Surrender to the whims of the subconscious mind as you craft an otherworldly scene inspired by the ethereal realm of dreams and memories. With creativity as your guide, traverse the surreal landscapes of the mind, where reality intertwines with fantasy in a mesmerizing dance of light and shadow. Let your imagination roam free as you conjure captivating imagery that transcends the boundaries of the conscious world, inviting viewers to lose themselves in the boundless expanse of the subconscious.\n\n\n# Introducing AFFiNE AI: Your All-in-One Creative Partner\n\n\nWelcome to the future of creativity and productivity. Meet AFFiNE AI, your ultimate companion in writing, drawing, and presenting. Designed to empower individuals and teams alike, AFFiNE AI revolutionizes the way you think, create, and collaborate.\n\n\nAFFiNE AI is your AI partner that enhances your capabilities across various creative tasks. Whether you're brainstorming ideas, crafting compelling presentations, or sketching visuals, AFFiNE AI is there to streamline your workflow and amplify your creativity. Think of it as the fusion of Notion AI, Miro AI, Figma AI, Canva AI, and Clickup AI, all rolled into one comprehensive platform.\n\n\n**Key features of AFFiNE AI:**\n\n\n* **AI Chatbox:** Receive instant insights and support across your projects with AFFiNE AI's intuitive chatbox. Seamlessly integrated into your documents and whiteboards, it provides real-time assistance and acceleration. Whether you're brainstorming ideas or organizing tasks, simply ask a question and receive immediate responses. For example, jot down your daily task list on one page, then effortlessly inquire about your plans for the day on another using the chatbox.\n\n\n\n![TixIkRzZgGOIrsqcfRoj1ZrH4_tQmDu27NQGaKyOR7U=](/blobs/TixIkRzZgGOIrsqcfRoj1ZrH4_tQmDu27NQGaKyOR7U=)\n\n\n* **AI-Generated Visuals:** Elevate your presentations and content creation with AFFiNE AI's unparalleled visual capabilities. Craft polished, presentation-ready slides with just one click, eliminating the need for tedious manual design work. From drawing images for articles to creating mind maps, flow charts, or professional slides, AFFiNE AI simplifies the process, allowing you to focus on content rather than formatting.\n\n\n\n![uLPLW1mOWz9QB-t3JOzIPWbHWNWTxiz9bLWL7xUXqWU=](/blobs/uLPLW1mOWz9QB-t3JOzIPWbHWNWTxiz9bLWL7xUXqWU=)\n\n\n* **AI Writer:** Perfect your writing effortlessly with AFFiNE AI's advanced AI Writer feature. Say goodbye to spelling and grammar errors, tone inconsistencies, and lengthy editing sessions. With AFFiNE AI, you can translate content, adjust the length, improve clarity, generate action items, and even create drafts, outlines, or timelines with ease. Whether it's crafting social media posts or penning creative stories, AFFiNE AI empowers you to express yourself confidently and efficiently.\n\n\n\n![XhwBfbXzNmPOjL70F28JGgQizULkEy6j45lW63QPypE=](/blobs/XhwBfbXzNmPOjL70F28JGgQizULkEy6j45lW63QPypE=)\n\n\n* **Make it Real:** Turn your ideas into reality with AFFiNE AI's innovative \"Make it Real\" feature. From concept to completion, unleash your creativity and experimentation. Whether you're prototyping a working dial clock, developing a game like Snake or Pong, or tackling any other project, AFFiNE AI provides the tools and resources to bring your vision to life. Experience the thrill of innovation and exploration with AFFiNE AI's \"Make it Real\" feature.\n\n\n\n![gqD9utTt5E1cpxMgjZjnzUKZ9SPmLP7O29mQ_c2dCIk=](/blobs/gqD9utTt5E1cpxMgjZjnzUKZ9SPmLP7O29mQ_c2dCIk=)\n\n\nWith AFFiNE AI, the future of creativity is here. Experience the power of AI-driven innovation as you unlock new possibilities and achieve unparalleled efficiency in your creative endeavors. Say hello to a smarter, faster, and more inspiring way to write, draw, and present with AFFiNE AI by your side.\n\n\nPresently,**AFFiNE**has launched its [**Stable Version**](https://affine.pro/download), with ongoing efforts to develop a more comprehensive and dependable iteration. Join us on our voyage through our social media channels and be part of the experience.**Come and join us on our journey over on our media platforms. ðŸš€**\n\n\n* Official Website: [https://affine.pro/](https://affine.pro/)\n\n\n* GitHub: [https://github.com/toeverything/AFFiNE](https://github.com/toeverything/AFFiNE)\n\n\n* Discord: [https://discord.gg/Arn7TqJBvG](https://discord.gg/Arn7TqJBvG)\n\n\n* Twitter: [https://twitter.com/AffineOfficial](https://twitter.com/AffineOfficial)\n\n\n\n\n\n\n\n\n\n![_reyORSsX6spFepsR4rdNnGQtQ8POiy1d_ILdHMjn24=](/blobs/_reyORSsX6spFepsR4rdNnGQtQ8POiy1d_ILdHMjn24=)\n\n\n",
  "publish": true
}