{
  "title": "Top 10 Free Editable SWOT Analysis Templates and Examples in 2024",
  "authors": [
    "Yiyang Zhang"
  ],
  "tags": [
    "Content"
  ],
  "description": "Discover the top 10 free SWOT Analysis Templates for 2024. Prioritize your SWOT analysis with AFFiNE in all respects.",
  "created": 1697414400000,
  "updated": 1706486400000,
  "layout": "blog",
  "id": "bknaJdF7hc",
  "slug": "top-10-free-editable-swot-analysis-template-examples",
  "cover": "/blobs/7goP7IOsolokeKaWQvG1i5S-hze8PkjljXiwy5Exrhs=",
  "md": "---\n\n\ntitle: \"Top 10 Free Editable SWOT Analysis Templates and Examples in 2024\"\n\n\nauthor: \"Yiyang Zhang\"\n\n\ntags: Content\n\n\nslug: top-10-free-editable-swot-analysis-template-examples\n\n\ndescription: \"Discover the top 10 free SWOT Analysis Templates for 2024. Prioritize your SWOT analysis with AFFiNE in all respects.\"\n\n\ncreated: 2023-10-16\n\n\nupdated: 2024-01-29\n\n\nlayout: blog\n\n\npublish: true\n\n\n---\n\n\n\n![7goP7IOsolokeKaWQvG1i5S-hze8PkjljXiwy5Exrhs=](/blobs/7goP7IOsolokeKaWQvG1i5S-hze8PkjljXiwy5Exrhs=)\n\n\nImagine a tool that simplifies decision-making, uncovers opportunities, and helps you navigate challenges effortlessly. That's the magic of SWOT Analysis, a strategic gem for personal and professional growth. Whether you're a seasoned business professional or just starting on your entrepreneurial journey, understanding your strengths, weaknesses, opportunities, and threats is crucial for making informed decisions and improve [project planning](https://affine.pro/blog/best-project-planning-tools-software-for-teams-2023). But where do you begin?\n\n\n# What is SWOT Analysis?\n\n\nTo evaluate their strategic planning and competitive position, individuals, businesses, or organizations may use a method called SWOT analysis. This structured approach examines both internal and external factors that affect current and future business prospects, providing a factual and data-driven perspective on an entity's strengths and weaknesses. By identifying areas for improvement and advantage, SWOT analysis helps entities make informed decisions. SWOT stands for strengths, weaknesses, opportunities, and threats, allowing systematic assessment of various aspects that impact success.\n\n\n# Why You Should Use SWOT Analysis to Improve Your Work?\n\n\n\n![92xt9suYEFxUZ9B6Rm2TsDlfu9jG1vABqd39243nGHM=](/blobs/92xt9suYEFxUZ9B6Rm2TsDlfu9jG1vABqd39243nGHM=)\n\n\nSWOT analysis is a valuable tool for prioritizing work and tasks because it provides a structured and systematic way to assess the internal and external factors that can impact your projects or goals. Here are some key reasons why using SWOT analysis can help prioritize work effectively:\n\n\n* Data-Driven Decision-Making: SWOT analysis encourages a data-driven approach. It prompts you to gather facts and evidence to support your assessments. This ensures that decisions are based on concrete information rather than assumptions or intuition.\n\n\n* Alignment with Objectives: When prioritizing work, it's essential to align your efforts with your broader objectives and goals. SWOT analysis helps you evaluate how each task or project relates to your strategic objectives, making it easier to prioritize based on their relevance to your mission.\n\n\n* Resource Allocation: SWOT analysis helps you allocate resources more effectively. By focusing on your strengths and opportunities, you can allocate resources to areas where they are likely to have the most significant impact.\n\n\n* Flexibility and Adaptability: SWOT analysis is not a one-time process. It can be used regularly to reassess priorities as circumstances change. This adaptability ensures that your work remains aligned with the evolving needs and challenges of your organization or project.\n\n\n# What does a Comprehensive SWOT Analysis Template Include?\n\n\n\n![xtZVgHMTsk5IahKwb_l8VyNl-oN7jhBo2qCC6xclSEw=](/blobs/xtZVgHMTsk5IahKwb_l8VyNl-oN7jhBo2qCC6xclSEw=)\n\n\nA comprehensive SWOT analysis template should include all the necessary components to ensure a thorough evaluation of your business or project. It should have a clear and concise description of your company's strengths.\n\n\n* **Strengths (Internal Factors):**\n\n\n  * List the internal factors that give your organization an advantage.\n\n\n  * These can include resources, skills, expertise, and assets that set you apart.\n\n\n* **Weaknesses (Internal Factors):**\n\n\n  * Identify the internal factors that put your organization at a disadvantage.\n\n\n  * Consider areas where improvement is needed, such as resource limitations or skill gaps.\n\n\n* **Opportunities (External Factors):**\n\n\n  * Highlight external factors that could positively impact your organization.\n\n\n  * Identify market trends, emerging opportunities, or industry developments.\n\n\n* **Threats (External Factors):**\n\n\n  * List external factors that pose potential challenges or risks.\n\n\n  * Consider market competition, economic conditions, or regulatory changes.\n\n\n# Top 10 Free Editable SWOT Analysis Templates and Examples\n\n\nHaving the right SWOT analysis template is crucial. Fortunately, there are many free and editable options to help you begin your strategic analysis.\n\n\n### 1. AFFiNE SWOT Analysis Chart Template\n\n\n\n![C-u93_inuT4TSa8jKzIlecB4U20D56HrGGjYmrgvVFM=](/blobs/C-u93_inuT4TSa8jKzIlecB4U20D56HrGGjYmrgvVFM=)\n\n\nAFFiNE SWOT analysis template allows you to easily create a comprehensive chart that visually depicts the strengths, weaknesses, opportunities, and threats of your project or business. The customizable icons and shapes on this template allow for quick and easy preparation of presentations.\n\n\n### 2. [Hubspot](https://blog.hubspot.com/marketing/swot-analysis) SWOT Analysis Chart Template\n\n\n\n![ub5T2pegvtGG7zKxgtph1t4x7Io1v8acXG2TKIBkoi4=](/blobs/ub5T2pegvtGG7zKxgtph1t4x7Io1v8acXG2TKIBkoi4=)\n\n\nAFFiNE personal development SWOT analysis template offers an eye-catching design that will help you find your current position and future development If personal growth matters to you currently. By tracking your learnings and resources in one place, you'll make SWOT analysis the go-to tool for strategic planning.\n\n\n### 3. [Google Docs](https://www.google.com/docs/about/) Flat SWOT Analysis Template\n\n\n\n![iRsqeTe2w77lHFg8ybiqEbLDTsAMNHlx4ug5PYy7NiY=](/blobs/iRsqeTe2w77lHFg8ybiqEbLDTsAMNHlx4ug5PYy7NiY=)\n\n\nGoogle Docs flat SWOT analysis template allows small businesses, individuals, and large companies to determine their value in a particular ecosystem and identify ways to increase value.\n\n\n### 4. [Google Docs](https://www.google.com/docs/about/) Simple SWOT Analysis Template\n\n\n\n![fxJ6HkbgT3liEBoQeHFOsc1n6ts5guREcjUEvJ_D4P8=](/blobs/fxJ6HkbgT3liEBoQeHFOsc1n6ts5guREcjUEvJ_D4P8=)\n\n\nGoogle Docs flat SWOT analysis template allows small businesses, individuals, and large companies to determine their value in a particular ecosystem and identify ways to increase value.\n\n\n### 5. [Excel](https://www.microsoft.com/en-us/microsoft-365/excel) SWOT Analysis Template\n\n\n\n![gYkmQLQOo8xMVbLO-qAqxcUZu5aCLJb6A-6cmvNViEg=](/blobs/gYkmQLQOo8xMVbLO-qAqxcUZu5aCLJb6A-6cmvNViEg=)\n\n\nExcel SWOT analysis template facilitates you to evaluate your company's strengths, weaknesses, opportunities, and threats. In place of the SWOT matrix, it's a simple spreadsheet with columns to compare three competitors.\n\n\n### 6. [Excel](https://www.microsoft.com/en-us/microsoft-365/excel) Business Plan SWOT Analysis Template\n\n\n\n![HEFFa5mDmHYBv038x4CvOhYef7UlUbHjZQbV0CEbHdg=](/blobs/HEFFa5mDmHYBv038x4CvOhYef7UlUbHjZQbV0CEbHdg=)\n\n\nExcel business plan SWOT analysis template can help you identify your business plan's strengths and weaknesses, as well as analyze and plan your upcoming business objective, allowing you to determine how you can add value to your business to meet market expectations.\n\n\n### 7. [PowerPoint](https://www.microsoft.com/en-us/microsoft-365/powerpoint) Flat SWOT Analysis Template\n\n\n\n![j2l_5fpd9VOSNctrF8Ix1hrSO5o-YG0DG8Aw_bJ7lFA=](/blobs/j2l_5fpd9VOSNctrF8Ix1hrSO5o-YG0DG8Aw_bJ7lFA=)\n\n\nPowerPoint flat SWOT analysis template enjoys a flat design and a ball that divides the categories into four sections is easy to use and eye-catching. You can also change the colour, add desired effects to the image, and reuse the slides for another presentation.\n\n\n### 8. [PowerPoint](https://www.microsoft.com/en-us/microsoft-365/powerpoint) Business SWOT Analysis Template\n\n\n\n![FEglar0mnZ33cQ93tio7BJV5g43etSPaq5lY6BZIsYg=](/blobs/FEglar0mnZ33cQ93tio7BJV5g43etSPaq5lY6BZIsYg=)\n\n\n### 9. [ClickUp](https://clickup.com/) Whiteboard SWOT Analysis Template\n\n\n\n![5ZMW_AJIOz6ji8AL54nE5Xm6vOEwZD4dc5gc-yaB7XY=](/blobs/5ZMW_AJIOz6ji8AL54nE5Xm6vOEwZD4dc5gc-yaB7XY=)\n\n\nClickUp whiteboard SWOT analysis template will let you focus on the right activities by keeping your ideas and solutions within reach while keeping important information within reach to revisit later.\n\n\n### 10. [Visme](https://www.visme.co/) Personal SWOT Analysis Template\n\n\n\n![RpshxGeWQRSEG939JN1-n7xb9qfoSxEYlu0JZ4v2MxQ=](/blobs/RpshxGeWQRSEG939JN1-n7xb9qfoSxEYlu0JZ4v2MxQ=)\n\n\nVisme personal SWOT analysis template allows you to tap into your full potential and increase your chances of achieving success on a personal level. Additionally, it helps identify any potential challenges before they escalate into major issues.\n\n\nNow armed with this knowledge and resources at your fingertips, go ahead and conduct a thorough SWOT analysis to propel your business toward growth and success!\n\n\n# Improve Your Agile SWOT Analysis by AFFiNE\n\n\nRemember, a well-executed SWOT analysis can be a game-changer for your business. It helps uncover hidden opportunities while addressing potential challenges head-on. So don't hesitate to leverage these free templates or explore the most recommended tool - **AFFiNE** for even greater success! It is crucial to have effective tools for [planning](https://affine.pro/blog/free-event-planning-templates-for-professsional-2023), automating, [managing](https://affine.pro/blog/15-best-free-jira-alternatives-agile-project-management-2023), and reporting on your business or project plan after your SWOT analysis has been completed.\n\n\n\n\n\n<div style=\"text-align:center;\">\n\n\n<iframe width=\"560\" height=\"315\" src=\"https://www.youtube.com/embed/3cfeKOufZWU?si=IiXDIdwfnM2Z7KPL\" title=\"YouTube video player\" frameborder=\"0\" allow=\"accelerometer; autoplay; clipboard-write; encrypted-media; gyroscope; picture-in-picture; web-share\" allowfullscreen></iframe>\n\n\n</div>\n\n\n\n\n\nGet your hands on **AFFiNE** today! The timing is opportune, and it's never too late to embark on this transformative journey. Commence improving your SWOT analysis by using AFFiNE's user-friendly tool. Presently, AFFiNE has launched its **[Stable Version](https://affine.pro/download)**, with ongoing efforts to develop a more comprehensive and dependable iteration. Join us on our voyage through our social media channels and be part of the experience. **Come and join us on our journey over on our media platforms.**\n\n\n* Official Website: [https://affine.pro/](https://affine.pro/)\n\n\n* GitHub: [https://github.com/toeverything/AFFiNE](https://github.com/toeverything/AFFiNE)\n\n\n* Discord: [https://discord.gg/Arn7TqJBvG](https://discord.gg/Arn7TqJBvG)\n\n\n* Twitter: [https://twitter.com/AffineOfficial](https://twitter.com/AffineOfficial)\n\n\n",
  "publish": true
}