{
  "title": "Top 8 Microsoft Visio Alternatives & Competitors of 2024",
  "authors": [
    "Yiyang Zhang"
  ],
  "tags": [
    "Content"
  ],
  "description": "Discover the top 8 diagramming software options for 2024. Find alternatives to Microsoft Visio and explore features, pricing, and more.",
  "created": 1695254400000,
  "updated": 1706572800000,
  "layout": "blog",
  "id": "z3nwYhJsAc",
  "slug": "top-8-microsoft-visio-alternatives-competitors-2023",
  "cover": "/blobs/HK4noT2qDR1U6-B2l3RdaaWZClmc9wk5QmFkul6Yp_k=",
  "md": "---\n\n\ntitle: \"Top 8 Microsoft Visio Alternatives & Competitors of 2024\"\n\n\nauthor: \"Yiyang Zhang\"\n\n\ntags: Content\n\n\nslug: top-8-microsoft-visio-alternatives-competitors-2023\n\n\ndescription: \"Discover the top 8 diagramming software options for 2024. Find alternatives to Microsoft Visio and explore features, pricing, and more.\"\n\n\ncreated: 2023-09-21\n\n\nupdated: 2024-01-30\n\n\nlayout: blog\n\n\npublish: true\n\n\n---\n\n\n\n![HK4noT2qDR1U6-B2l3RdaaWZClmc9wk5QmFkul6Yp_k=](/blobs/HK4noT2qDR1U6-B2l3RdaaWZClmc9wk5QmFkul6Yp_k=)\n\n\nBeing productive is crucial in today's constantly advancing technological world. Professionals in various industries have preferred Microsoft Visio as their tool of choice for visualizing and organizing complex information. However, with changing demands and advancements in technology, it's important to explore alternative options that can provide similar functionality while catering to your specific needs with unique features.\n\n\nGet ready to discover the tools that will take your diagram-creating skills to new heights! In this article, we will explore the top eight alternatives to Microsoft Visio that can revolutionize the way you create diagrams in 2024. Whether you're an expert in business or a creative thinker, there are numerous options available that can enhance your [productivity](https://affine.pro/blog/best-time-management-tools-techniques-create). So, are you ready to embrace innovation and discover new possibilities to elevate your efficiency?\n\n\n# What is Microsoft Visio?\n\n\nMicrosoft Visio is a powerful diagramming and vector graphics tool that allows users to create professional-level visuals for various purposes. It provides a wide range of [templates](https://affine.pro/blog/how-to-build-go-to-market-strategy-free-templates), shapes, and tools that make it easy to design flowcharts, organizational charts, network diagrams, floor plans, and more. With its intuitive interface and extensive features, Microsoft Visio has become the go-to software for businesses and individuals alike. However, it's challenging enough to set up that it's best suited for bigger [businesses](https://affine.pro/blog/how-to-introduce-new-business-social-media-strategic-steps-examples) with the IT resources to handle the process.\n\n\n### Pros and Cons of Microsoft Visio\n\n\n\n![-oRSqB5AojmZOtsTEsCLr0G-zs26T10w_UVWNzqN7Is=](/blobs/-oRSqB5AojmZOtsTEsCLr0G-zs26T10w_UVWNzqN7Is=)\n\n\n* **Pros**\n\n\n  * **Versatility**. Whether you need to map out complex processes or simply visualize ideas in a clear and concise manner, Visio offers the flexibility to meet your specific needs. Its drag-and-drop functionality makes it incredibly user-friendly.\n\n\n  * **Integration with other Microsoft Office applications**. This seamless integration enables users to easily import data from these programs into their diagrams or export their diagrams for use in other documents.\n\n\n  * Collaboration capabilities. Through cloud-based storage solutions like OneDrive, multiple team members can work on the same diagram simultaneously, making collaboration efficient and reducing version control issues.\n\n\n* **Cons**\n\n\n  * **Confusing purchasing process**. Microsoft Visio price plans might be a little bit complex since it provides several different plans, and you can also get the program from Office 365.\n\n\n  * **Not available on Mac, Linux, or as a web app**. Lagging may occur when building diagrams in the web app.\n\n\n* **Pricing**: Online Plan 1 ($5 per user per month) & Online Plan2 ($14.96 per user per month)\n\n\n# What should You Look for in Microsoft Visio Alternatives?\n\n\n\n![IBcTdFAqNbJ2GXdR0z2W35aNZl2L2We_EGKKJRJU-YU=](/blobs/IBcTdFAqNbJ2GXdR0z2W35aNZl2L2We_EGKKJRJU-YU=)\n\n\n* **Compatibility.** Make sure the [alternative software](https://affine.pro/blog/10-best-microsoft-sharepoint-alternatives-consider-2024-free-paid) you choose can seamlessly integrate with your existing tools and systems.\n\n\n* **Ease of use.** The whole point of using an alternative is to [simplify your workflow](https://affine.pro/blog/top-10-visual-note-taking-apps-revolutionize-workflow-linked-notes-mindmaps), so it's essential that the software offers an intuitive interface and user-friendly features.\n\n\n* **Collaboration capabilities.** Look for alternatives that allow multiple users to work on diagrams simultaneously and provide easy sharing options.\n\n\n* **Customizability**. You may have specific diagramming needs or industry requirements, so finding a solution that allows customization will greatly benefit you.\n\n\n* **Cost-effectiveness.** Compare pricing plans and evaluate which option offers the best value for money without compromising functionality.\n\n\nBy carefully assessing these factors when exploring Microsoft Visio alternatives, you'll be able to find a suitable solution that meets all your diagramming needs while boosting collaboration and efficiency in your workflow.\n\n\n# Best 8 Microsoft Visio Alternatives for 2024\n\n\nLooking for the best Microsoft Visio alternatives to boost your productivity in 2024? Look no further! We've compiled a list of the top 8 alternatives that will help you create stunning diagrams, flowcharts, and organizational charts with ease.\n\n\n### 1. [AFFiNE](https://affine.pro/)\n\n\n\n\n\n<div style=\"text-align:center;\">\n\n\n<iframe width=\"560\" height=\"315\" src=\"https://www.youtube.com/embed/3cfeKOufZWU?si=IiXDIdwfnM2Z7KPL\" title=\"YouTube video player\" frameborder=\"0\" allow=\"accelerometer; autoplay; clipboard-write; encrypted-media; gyroscope; picture-in-picture; web-share\" allowfullscreen></iframe>\n\n\n</div>\n\n\n\n\n\nAFFiNE is a versatile editor that lets you write, [draw](https://affine.pro/blog/affine-0-10-0-launch-week-day-4-5-write-draw-plan-present-collaboratively-anywhere), plan and present all in one place. Easily capture detailed information about your new business using the page mode, allowing for straightforward document editing. This flexible tool empowers users to brainstorm, take notes, and set goals while staying in sync and building content with blocks. The limitless workspace stimulates user-driven innovation. AFFiNE offers safe data storage, open-source benefits, and collaborative functionality. Users can visualize and connect information effortlessly, crafting plans as an engaging and enjoyable experience.\n\n\n**Key features:**\n\n\n* **Template Gallery in AFFiNE:** There is a curated collection of powerful [whiteboard](https://affine.pro/blog/best-free-whiteboard-layout-ideas-organization) templates in AFFiNE. From the robust Gantt chart to the insightful Kanban board and the comprehensive concept map, an array of additional templates awaits your exploration, promising to expand the horizons of your go-to-market strategy planning and execution. These templates serve as your launchpad, enabling you to skip the groundwork and jump straight into action. Crafted for seamless collaboration, AFFiNE's templates provide structured canvases for various tasks, saving you valuable time and enhancing efficiency in project management, content creation, and [planning](https://affine.pro/blog/top-8-concept-map-templates-examples).\n\n\n\n![OP3GdbE7dwmQKK2uKzBgJbhpVJxkLuDsVtomxcggvSQ=](/blobs/OP3GdbE7dwmQKK2uKzBgJbhpVJxkLuDsVtomxcggvSQ=)\n\n\n* **Explore Edgeless Creativity with a Whiteboard:** Unlock the full spectrum of your creative potential through our dynamic whiteboard. Boasting essential features like a plethora of colors, [diverse font options](https://affine.pro/blog/docs-edgeless-stylized-embody-your-creativity-better-and-easier), shapes, and connectors, this powerful tool is designed to elevate your creative process. Seamlessly upload images in various formats and utilize the extensive collection of styles and templates to further amplify your creativity. Transform your ideas into compelling business posters with unparalleled ease and versatility!\n\n\n\n![cXPfaH7yGKuxN6x24MrIF_2SxJEMnAdSfT2q9HhQpD4=](/blobs/cXPfaH7yGKuxN6x24MrIF_2SxJEMnAdSfT2q9HhQpD4=)\n\n\n* **Advanced Collaboration Capability:** When you do need to [collaborate](https://affine.pro/blog/top-asynchronous-communication-tools-free-2024) with other contributors to discuss your table of content or charts, AFFiNE makes getting feedback simple. Appealing collaboration capability provides visibility into assigned tasks, making tables easier to estimate, and ensuring your charts remain well-designed. You can invite team members or friends to collaborate on the content together, making it perfect for the affairs schedule.\n\n\n\n![O88V12dZ7eALpdMD8-6eyyfRec5yZyWiQxCnvNEb3r0=](/blobs/O88V12dZ7eALpdMD8-6eyyfRec5yZyWiQxCnvNEb3r0=)\n\n\n### 2. [Lucidchart](https://www.lucidchart.com/pages/)\n\n\n\n![2OcBEcPtKFwIN0zpps1Da1Tdj5eYu38C4RfnhzfIno4=](/blobs/2OcBEcPtKFwIN0zpps1Da1Tdj5eYu38C4RfnhzfIno4=)\n\n\nLucidchart is an intelligent diagramming application that empowers teams to clarify complexity, align their insights, and build the futureâ€”faster. With its intuitive interface and extensive template library, Lucidchart is a popular choice among professionals. It offers collaboration features and seamless integration with other tools like Google Drive.\n\n\nKey features:\n\n\n* Intelligent diagramming\n\n\n* 1,000+ templates\n\n\n* Ability to share outside of Google Docs\n\n\nPros of Lucidchart\n\n\n* Intuitive user interface\n\n\n* Smooth performance on all tested platforms\n\n\n* Adequate shapes and templates\n\n\nCons of Lucidchart\n\n\n* No desktop apps\n\n\n* Quite limiting free account\n\n\n* Mobile apps don't have an offline mode\n\n\nPricing: $4.95 per month for basic plan; $9.95 per month for pro plan\n\n\n### 3. [SmartDraw](https://www.smartdraw.com/)\n\n\n\n![ketDWKTPYe3ASxOAV0IZ1bqKkS7AmUnuKuWjIqIAT7s=](/blobs/ketDWKTPYe3ASxOAV0IZ1bqKkS7AmUnuKuWjIqIAT7s=)\n\n\nSmartDraw is a powerful flowchart software tool for businesses that need to make a lot of visual assets. Aside from flowcharts and schematics, SmartDraw has powerful customization and collaboration options, so drafting these designs is a breeze. SmartDraw stands out for its vast selection of pre-made templates and automated diagramming capabilities. It also supports cloud storage and has robust sharing options.\n\n\n**Key features:**\n\n\n* Huge selection of templates and objects\n\n\n* Helpful Smart Panel feature\n\n\n* Create diagrams straight from data with built-in extensions\n\n\n**Pros of SmartDraw**\n\n\n* Good integration options\n\n\n* Easy to use\n\n\n* The powerful engine allows for professional charts and diagrams\n\n\n**Cons of SmartDraw**\n\n\n* Weak collaboration features.\n\n\n* Expensive.\n\n\n* Can't export to Visio format.\n\n\nPricing: $9.95/month after a free trial\n\n\n### 4. [Draw.io](https://www.drawio.com/)\n\n\n\n![yFweQQEmqC_LKCvZMMS873C5tDv7mSkJTxCdCMRk7vE=](/blobs/yFweQQEmqC_LKCvZMMS873C5tDv7mSkJTxCdCMRk7vE=)\n\n\nDraw.io can be used instantly to build charts since it's online (though it can be used offline as well). With drag-and-drop functionality, a library of shapes, plenty of templates, importing/exporting a variety of formats, and more, it's easy to get started and start creating at any time.\n\n\n**Key features:**\n\n\n* Intuitive interface with drag-and-drop functionality.\n\n\n* Allows track and restore changes.\n\n\n* Support various formats for import and export.\n\n\nPros of Draw.io\n\n\n* No login is required, free\n\n\n* Speed & simple\n\n\n* Excellent real-time collaboration support is included when connected to a Google account\n\n\nCons of Draw.io\n\n\n* Collection of templates and unimpressive shapes.\n\n\n* Less professional\n\n\n* Importing from other file types was unsuccessful in testing.\n\n\nPricing: Free\n\n\n### 5. [Cacoo](https://nulab.com/cacoo/)\n\n\n\n![m9vYBTj8s0HM9IlXSoBzoOAvmEnUDTEq12Uatz-e3KY=](/blobs/m9vYBTj8s0HM9IlXSoBzoOAvmEnUDTEq12Uatz-e3KY=)\n\n\nCacoo is an online diagramming tool that allows you to collaborate on wireframes, flowcharts, and more. With easy sharing links and embed links, you can edit, track changes, and collaborate on flowcharts you designed and updated. With Cacoo, you can organize team assets, save work directly, monitor project status with activity notifications, and more.\n\n\nKey features:\n\n\n* Multiple people can edit diagrams at the same time.\n\n\n* Support chat, comment, or video chat inside the tool.\n\n\n* It has hundreds of templates to get you started.\n\n\nPros of Cacoo\n\n\n* Smart and modern charts\n\n\n* A wide range of cloud services\n\n\n* Team management keeps charts organized at the team level\n\n\nCons of Cacoo\n\n\n* Learning curve\n\n\n* Not enough integrations\n\n\nPricing: $6 per user per month\n\n\n### 6. [Creately](https://creately.com/)\n\n\n\n![pjSCg9_WhN-7OZblPHyLl_P6gEJ4dXbCccQbOj-jg_c=](/blobs/pjSCg9_WhN-7OZblPHyLl_P6gEJ4dXbCccQbOj-jg_c=)\n\n\nCreately is a data-connected visual workspace where you can plan and brainstorm new projects. The software is built to help you make flowcharts quickly and easily. Creately boasts an extensive library of shapes, icons, and templates that cater to various industries' needs. Its advanced diagramming features make it suitable for both professionals and students alike.\n\n\nKey features:\n\n\n* Huge library of shapes. Allow choose the shape from Icon Finder or Google.\n\n\n* Automatically pick the right connector.\n\n\n* Create complex shapes from the written text.\n\n\nPros of Creatly\n\n\n* Support real-time collaboration.\n\n\n* Offer Web and desktop apps.\n\n\nCons of Creatly\n\n\n* Limited template selection.\n\n\n* Canceling or changing an account requires an email to the company.\n\n\nPricing: $5 per month for individual; Team plans are based on the team size\n\n\n### 7. [Gliffy](https://www.gliffy.com/)\n\n\n\n![MX3r0f8CK6D8teLMqrzHIN8hznvtyO-qwNENL-0qK44=](/blobs/MX3r0f8CK6D8teLMqrzHIN8hznvtyO-qwNENL-0qK44=)\n\n\nGliffy is a great choice for teams in need of a reliable and integrated diagramming tool on Confluence. With its intuitive user interface, plenty of ready-to-use components, and automatic updating of diagrams, there's no need to worry about having an outdated image - you'll always have the latest version. As if that weren't enough, Gliffy has Cloud Fortified certification, over 18 million users, and a long pedigree within Atlassian's products.\n\n\nKey features:\n\n\n* Links and syncs diagrams\n\n\n* Real-Time collaboration in Confluence cloud\n\n\n* Advanced security and access management features\n\n\nPros of Gliffy\n\n\n* Simple and easy to use\n\n\n* Wide range of shapes, symbols, and templates designed for flowchart\n\n\n* Support collaboration\n\n\nCons of Gliffy\n\n\n* Occasional lags and errors when you work with a large diagram\n\n\n* No option to export selected areas directly as PNG or JPEG\n\n\nPricing: Professional (1-9 users): $10/month per user; Professional (0-50 users): $8/month per user\n\n\n### 8. [Miro](https://miro.com/)\n\n\n\n![yqGbxR5Lpay-KancTPQDMXE8Kafc0wcJBADdMdtEJtI=](/blobs/yqGbxR5Lpay-KancTPQDMXE8Kafc0wcJBADdMdtEJtI=)\n\n\nMiro embraces more than 1,000 templates, including mind maps, Kanban boards, Gantt charts, product wireframes, research boards, and flowcharts. Miro provides an online collaborative platform where teams can brainstorm ideas, map workflows, and design prototypes all in one place.Â This versatile tool combines whiteboarding, collaboration, and project management functionalities, taking visual communication to new heights.\n\n\nKey features:\n\n\n* Provide real-time collaborative drawing\n\n\n* Built-in comments, video, chat, and seamless communication\n\n\n* Unlimited team workspaces with granular permissions, privacy & sharing controls\n\n\nPros of Miro\n\n\n* Easy to build smart-looking flowcharts and mind maps\n\n\n* Simple to collaborate with teammates\n\n\n* Intuitive UI\n\n\nCons of Miro\n\n\n* Hard to import or export content from time to time\n\n\n* Difficult to navigate large accounts\n\n\nPricing: $8/month per user for starter; $16/month per user for business\n\n\n### Unravel Your Productivity with Microsoft Visio Alternative\n\n\nSo why limit yourself to just one option when there are so many incredible Microsoft Visio alternatives available? Unleash your creativity and enhance your productivity by exploring new possibilities beyond traditional boundaries. With the right alternative at hand-**AFFiNE**- you'll discover new levels of efficiency and excellence in your work.\n\n\n\n![nG1zIBSH0S-8U7e52_D9rWQS2HZasYlld44LSON-T7g=](/blobs/nG1zIBSH0S-8U7e52_D9rWQS2HZasYlld44LSON-T7g=)\n\n\nGet your hands on **AFFiNE** today! The timing is opportune, and it's never too late to embark on this transformative journey. Commence creating your charts and mindmaps in project management using AFFiNE's user-friendly tool. Presently, AFFiNE has launched its [**Stable Version**](https://affine.pro/download), with ongoing efforts to develop a more comprehensive and dependable iteration. Join us on our voyage through our social media channels and be part of the experience. **Come and join us on our journey over on our media platforms.**\n\n\n* Official Website:[https://affine.pro/](https://affine.pro/)\n\n\n* GitHub:[https://github.com/toeverything/AFFiNE](https://github.com/toeverything/AFFiNE)\n\n\n* Discord:[https://discord.gg/Arn7TqJBvG](https://discord.gg/Arn7TqJBvG)\n\n\n* Twitter:[https://twitter.com/AffineOfficial](https://twitter.com/AffineOfficial)\n\n\n",
  "publish": true
}