{
  "title": "8 Top Asynchronous Communication Tools for Teams in 2024 (Free & Paid)",
  "authors": [
    "Xuan Pang"
  ],
  "tags": [
    "Content"
  ],
  "description": "Discover the best asynchronous communication tools for teams in 2024. Explore our curated list of top 8 free and paid tools designed to enhance remote collaboration, increase productivity, and streamline workflows for teams of all sizes. Perfect for businesses adapting to modern work environments.",
  "created": 1701648000000,
  "updated": 1704153600000,
  "layout": "blog",
  "id": "dGi6nmgG7dOzNRJ8_Acqy",
  "slug": "top-asynchronous-communication-tools-free",
  "cover": "/blobs/IDgosPheJB73rMmf9TlK-l7FVZsuqTWGAD56pVYrua0=",
  "md": "--- \ntitle: \"8 Top Asynchronous Communication Tools for Teams in 2024 (Free & Paid)\"\n\n\nauthor: \"Xuan Pang\"\n\n\ntags: Content\n\n\nslug: top-asynchronous-communication-tools-free\n\n\ndescription: \"Discover the best asynchronous communication tools for teams in 2024. Explore our curated list of top 8 free and paid tools designed to enhance remote collaboration, increase productivity, and streamline workflows for teams of all sizes. Perfect for businesses adapting to modern work environments.\"\n\n\ncreated: 2023-12-04\n\n\nupdated: 2024-01-02\n\n\nlayout: blog\n\n\npublish: true\n\n\n---\n\n\n\n![IDgosPheJB73rMmf9TlK-l7FVZsuqTWGAD56pVYrua0=](/blobs/IDgosPheJB73rMmf9TlK-l7FVZsuqTWGAD56pVYrua0=)\n\n\n\nIn today's dynamic business landscape, staying abreast of endless emails, meetings, and calls is a formidable challenge. Asynchronous communication tools emerge as a beacon of efficiency, allowing team members to interact at their convenience, rather than synchronously. This shift is vital in a world where teams are often spread across various time zones and remote work is on the rise.\n\n\nThis article delves into the top 8 asynchronous communication tools for 2024, offering a mix of free and paid options to suit diverse team needs.\n\n\n## **What is Asynchronous Communication?**\n\n\n\n![IDgosPheJB73rMmf9TlK-l7FVZsuqTWGAD56pVYrua0=](/blobs/IDgosPheJB73rMmf9TlK-l7FVZsuqTWGAD56pVYrua0=)\n\n\nAsynchronous communication refers to the exchange of information where an immediate response is not expected. Unlike synchronous communication, where participants interact in real-time (like in meetings or phone calls), asynchronous communication allows individuals to send and receive messages at their convenience. This approach is particularly useful in remote work environments or when team members are spread across different time zones. It enables flexibility, reduces pressure for immediate responses, and often leads to more thoughtful and considered communication.\n\n\n## **Benefits of Asynchronous Communication?**\n\n\nThe benefits of asynchronous communication are numerous, especially in today's diverse and often remote work environments. Key advantages include:\n\n\n\n![1qseuxfEs3nM414TOLcK29sI57u5P-Dma7VmGGW_JbA=](/blobs/1qseuxfEs3nM414TOLcK29sI57u5P-Dma7VmGGW_JbA=)\n\n\n1. **Flexibility**: Asynchronous communication allows team members to respond at their convenience, accommodating different schedules and time zones. This flexibility is crucial in global teams, where members may be working across vastly different local times, ensuring everyone can contribute without the strain of synchronizing schedules.\n\n\n1. **Increased Productivity**: By reducing interruptions, asynchronous communication allows for more focused work periods. Team members can concentrate on complex tasks without the disruption of frequent meetings or instant responses, leading to higher quality work and efficiency.\n\n\n1. **Better Work-Life Balance**: Offering employees control over their work schedule leads to reduced stress and a healthier work-life balance. This approach respects personal time and commitments, allowing employees to integrate work more seamlessly into their lives rather than structuring life around a rigid work schedule.\n\n\n1. **Enhanced Thoughtfulness**: Encourages more considered and well-crafted responses. Unlike real-time conversations that might require immediate but less thoughtful reactions, asynchronous communication gives individuals time to reflect, research, and articulate their thoughts more clearly.\n\n\n## **Best Asynchronous Communication Apps Recommendations**\n\n\n### [AFFiNE](https://www.affine.pro)\n\n\n\n![MvPuJwMVS0vN9b_4qmeq27HIggpf7g0QZuhvctyyqI8=](/blobs/MvPuJwMVS0vN9b_4qmeq27HIggpf7g0QZuhvctyyqI8=)\n\n\n[AFFiNE](https://www.affine.pro)is a cutting-edge asynchronous communication app that is designed to assist you in organizing, managing, and cooperating on tasks, projects, and information when trying to do them in real-time. What sets AFFiNE apart is that it is a free and [open-source](https://affine.pro/blog/tips-where-and-how-contribute-open-source-projects) program that employs offline technology to ensure that it is accessible to all users.\n\n\n**Key features:**\n\n\n* **[Collaborative Capabilities](https://affine.pro/blog/affine-0-10-0-launch-week-day-5-5-stable-with-cloud-support-finally-available-to-every-pro-in-your-team)**: For group work, the app should have collaborative features, making it easy to share and coordinate work with others in your group work. For more details, please go to latest launch week blog: [Introduction to AFFiNE's Cloud](https://affine.pro/blog/affine-0-10-0-launch-week-day-5-5-stable-with-cloud-support-finally-available-to-every-pro-in-your-team).\n\n\n  \n![71MN7zgKOg2C73idwSU66YEnVUK8x41Jqwwe2z9CiPU=](/blobs/71MN7zgKOg2C73idwSU66YEnVUK8x41Jqwwe2z9CiPU=)\n\n\n* **Write, [Draw](https://affine.pro/blog/best-free-digital-whiteboard-apps-2023), and [Plan](https://affine.pro/blog/best-project-planning-tools-software-for-teams-2023) All-in-One**: Enjoy your all-in-one KnowledgeOS solution for effortlessly writing, drawing, and planning on a hyper-fused platform. It supports [kanban](https://affine.pro/blog/affine-080-launch-week-day3), table, rich-text paragraphs as building blocks to form pages or whiteboards. It carries out integrated processing here in document editing, data processing, or brainstorming.\n\n\n\n![knv3GLQpB1H8ce4w2ztMzCiGuUMPG0JRDZA49U3AgIw=](/blobs/knv3GLQpB1H8ce4w2ztMzCiGuUMPG0JRDZA49U3AgIw=)\n\n\n* **[Offline Accessibility](https://affine.pro/blog/5-best-offline-alternatives-to-notion)**: The best asynchronous communication app should allow users to access their essential details offline. This feature is particularly valuable when going outside with limited internet connectivity.\n\n\n\n![7tLzErsXRl3O-9-0m62ySSd00VYnYYtRKFaZUFit2Jg=](/blobs/7tLzErsXRl3O-9-0m62ySSd00VYnYYtRKFaZUFit2Jg=)\n\n\n### 2. Google Docs\n\n\n\n![Ft5SARUYEeuBMbiiJB2phtnOakzn6ZcoF_-1s7FFD4E=](/blobs/Ft5SARUYEeuBMbiiJB2phtnOakzn6ZcoF_-1s7FFD4E=)\n\n\n[Google Docs](https://www.google.com/intl/en-GB/docs/about/) is a user-friendly online word processor designed to simplify the creation and editing of professional documents. With its real-time collaboration tools, Google Docs enables seamless teamwork, allowing multiple users to collaborate on a single project simultaneously. This ensures that everyone involved stays up-to-date with the document's progress, fostering efficient collaboration and communication.\n\n\n**Key features:**\n\n\n* **Smart Compose**: Smart Compose is an intelligent feature that helps you write faster and with fewer errors. It uses artificial intelligence to suggest relevant words and phrases as you type, reducing the need for manual input and enhancing your writing efficiency. Smart Compose can save time and improve the overall accuracy of your documents.\n\n\n* **Integration with Third-Party Applications**: Google Docs integrates seamlessly with a variety of third-party applications, including project management tools. This integration allows you to bring project management functionalities directly into your document workflow, streamlining collaboration and enhancing productivity.\n\n\n* **Comment Replies from Gmail**: With Google Docs, you can receive comment notifications and reply to them directly from your Gmail inbox. This integration between Google Docs and Gmail makes it convenient to stay updated on document discussions and respond to comments promptly.\n\n\n### 3. ClickUp\n\n\n\n![qdxDNAbanG7w6sS8rmFy9x7e52COcTZr10oDewDLpOg=](/blobs/qdxDNAbanG7w6sS8rmFy9x7e52COcTZr10oDewDLpOg=)\n\n\n**Key features:**\n\n\n* Streamline the ideation to execution process: Simplify your workflow by consolidating all relevant information on a single page, creating proof of concepts, receiving feedback, and generating tasks using ClickUp Whiteboards. Follow this ClickUp Whiteboards guide to begin optimizing your workflow.\n\n\n* Effortlessly track project progress: Enhance your agile software development and monitor project advancement with ease using ClickUp's robust Gantt chart view or customizable work views. Assigned comments serve as a simple yet effective communication tool, ensuring smooth workflow progression without any delays.\n\n\n* Enhance communication and project visibility: Foster effective communication and improve project visibility for all team members. Build a custom Dashboard with real-time reporting, utilizing widgets like agile burndown charts and pie charts to gain a high-level overview of your Workspace. Alternatively, leverage ClickUp Docs to publish release notes and share significant updates with your entire organization.Price: ClickUp offers a feature-rich free plan that is available forever. For additional capabilities, their Unlimited plan is priced at $5 per month per user.\n\n\n### 4. Asana\n\n\n\n![ydqTK-yAEcy3MQ_9m9YdOA1zo6fLg_rmzMQGo2Vh51E=](/blobs/ydqTK-yAEcy3MQ_9m9YdOA1zo6fLg_rmzMQGo2Vh51E=)\n\n\n**Key features:**\n\n\n* Task Tracking: Asana allows users to create tasks, assign them to team members, and set due dates. This feature helps teams stay organized and ensures that everyone knows what needs to be done and when.\n\n\n* Real-time Collaboration: With Asana, team members can collaborate in real-time on tasks and projects. They can add comments, attachments, and updates to tasks, enabling seamless communication and fostering a collaborative work environment.\n\n\n* Commenting on Tasks: Asana provides a dedicated space for users to comment on tasks, facilitate discussions, providing feedback, and addressing any questions or concerns. This feature promotes clear and transparent communication among team members.\n\n\n**Price:** Asana offers a free plan for basic project management needs. Their paid plans start from $10.99/user per month, providing additional features and capabilities.\n\n\n### 5. Miro\n\n\n\n![mjm8K6XuY-jJV6XcgjoXXJMvd2b1cKhCL-25ZalaM8Q=](/blobs/mjm8K6XuY-jJV6XcgjoXXJMvd2b1cKhCL-25ZalaM8Q=)\n\n\nMiro is an online workspace and collaborative platform that offers a collaborative whiteboard app for effortless teamwork. It has been a trusted tool in this space for years, with an increasing range of integrations and features that people love. Whether you're in a hybrid or remote team focused on UX design or sales departments that need visual task monitoring, Miro can meet your needs. With video chat and whiteboard capabilities, team meetings become less necessary.\n\n\n**Key features:**\n\n\n* Collaborative Whiteboarding: Miro provides a digital canvas where teams can collaborate in real-time, just like a physical whiteboard. Multiple users can brainstorm, draw diagrams, create flowcharts, and work together seamlessly, regardless of their physical location. 🤝🎨\n\n\n* Agile Framework Support: Miro is designed to support agile methodologies and frameworks. Teams can use it for sprint planning, retrospectives, and visualizing agile processes like Scrum or Kanban. It offers templates and features tailored to agile workflows, making it a valuable tool for Agile teams. 🏁🏋️♂️\n\n\n* Integration Ecosystem: Miro boasts a robust integration ecosystem that allows you to connect it with a wide range of other tools and platforms. Whether it's integrating with project management software, productivity apps, or cloud storage solutions, Miro ensures that it fits seamlessly into your existing workflow.\n\n\n### 6. Monday.com\n\n\n\n![wykgqQp_M4er492onizMjlV0_C0tCqVXjQuUgJ9pBXg=](/blobs/wykgqQp_M4er492onizMjlV0_C0tCqVXjQuUgJ9pBXg=)\n\n\n**Key features:**\n\n\n* Intuitive Project Management: Monday.com provides an intuitive and visual platform for managing projects. Teams can create customizable boards, track tasks, and collaborate seamlessly, promoting transparency and productivity.\n\n\n* Workflow Automation: Monday.com offers powerful automation capabilities to streamline repetitive tasks and workflows. Users can automate notifications, assignments, and updates, saving time and reducing manual effort.\n\n\n* Extensive Integrations: Monday.com integrates seamlessly with various popular tools and platforms, such as Slack, Google Drive, and Trello. This allows teams to centralize information, enhance collaboration, and optimize their workflow by connecting their favorite tools.\n\n\n**Price**: Monday.com has a free plan for up to 2 users with some feature limitations. Basic plans start at $8/user/month. Get a 14-day free trial.\n\n\n### 7. [Framer](https://www.framer.com/)\n\n\n\n![-zxFwsDRetTBKh6pIOHBzeegN0TQTHTGRHAd_uUOkEE=](/blobs/-zxFwsDRetTBKh6pIOHBzeegN0TQTHTGRHAd_uUOkEE=)\n\n\nFramer is a versatile tool tailored for crafting interactive prototypes of websites and apps, setting itself apart from traditional design software by seamlessly blending design and coding. It empowers designers to create custom designs using JavaScript and React.\n\n\n**Key Features:**\n\n\n* Robust Hosting: Framer employs secure servers backed by stringent physical and network security protocols, ensuring your data's integrity through continuous monitoring.\n\n\n* Access Control: You have complete control over project access and editing permissions in Framer. Choose from private, selective sharing, or public visibility to safeguard your work.\n\n\n* Dynamic Data Visualizations: Framer's capabilities extend to designing dynamic data visualizations, including a wide range of charts, graphs, and maps. For example, you can use Framer to create interactive data visualizations to showcase survey results effectively.\n\n\n\n\n\n### 8. Canva\n\n\n\n![iphpVio1U2b-I46PvwRwB2RoOp1ZhwG6xb5MqEZNGw4=](/blobs/iphpVio1U2b-I46PvwRwB2RoOp1ZhwG6xb5MqEZNGw4=)\n\n\nCanva is a versatile graphic design platform that empowers users to create a wide range of visual content, from social media graphics and marketing materials to presentations and travel plans. With its user-friendly interface and extensive library of design elements, Canva is an excellent tool for crafting visually appealing and informative travel plans.\n\n\n**Key features:**\n\n\n1. Customizable Templates: Canva offers a vast collection of professionally designed templates for various purposes, including travel planning. Users can choose from a selection of travel-themed templates, such as travel itineraries, destination guides, or packing checklists.\n\n\n1. Drag-and-Drop Interface: Canva's intuitive drag-and-drop interface simplifies the travel planning process. Travelers can easily add, resize, and rearrange elements on their canvas.\n\n\n1. Rich Media Library: Canva provides access to an extensive library of design assets, including high-quality images, icons, and illustrations.\n\n\n\n\n\nAsynchronous communication tools are not just about bringing efficiency to the workplace; they are reshaping how we conceptualize teamwork and project management in a digitally connected world. By choosing the right tools, teams can enhance their collaboration experience, leading to greater innovation and productivity.\n\n\nCurrently, **AFFiNE** has released its [stable version](https://affine.pro/download), but we are continuing to build to a more feature-rich and stable build. **Come and join us on our journey over on our media platforms.**\n\n\n* Official Website: [https://affine.pro/](https://affine.pro/)\n\n\n* GitHub: [https://github.com/toeverything/AFFiNE](https://github.com/toeverything/AFFiNE)\n\n\n* Discord: [https://discord.gg/Arn7TqJBvG](https://discord.gg/Arn7TqJBvG)\n\n\n* Twitter: [https://twitter.com/AffineOfficial](https://twitter.com/AffineOfficial)\n\n\n\n\n\n**More details of AFFiNE's latest updates:**\n\n\nDay 1: [https://affine.pro/blog/affine-0-10-0-launch-week-day-1-lightening-up-visual-experience](https://affine.pro/blog/affine-0-10-0-launch-week-day-1-lightening-up-visual-experience)\n\n\nDay 2: [https://affine.pro/blog/affine-0-10-0-launch-week-day-2-5-filter-find-collect-control-what-are-important](https://affine.pro/blog/affine-0-10-0-launch-week-day-2-5-filter-find-collect-control-what-are-important)\n\n\nDay 3: [https://affine.pro/blog/affine-0-10-0-launch-week-day-3-5-make-your-mind-flow-form-doc-to-slides](https://affine.pro/blog/affine-0-10-0-launch-week-day-3-5-make-your-mind-flow-form-doc-to-slides)\n\n\nDay 4: [https://affine.pro/blog/affine-0-10-0-launch-week-day-4-5-write-draw-plan-present-collaboratively-anywhere](https://affine.pro/blog/affine-0-10-0-launch-week-day-4-5-write-draw-plan-present-collaboratively-anywhere)\n\n\nDay 5: [https://affine.pro/blog/affine-0-10-0-launch-week-day-5-5-stable-with-cloud-support-finally-available-to-every-pro-in-your-team](https://affine.pro/blog/affine-0-10-0-launch-week-day-5-5-stable-with-cloud-support-finally-available-to-every-pro-in-your-team)\n\n\n",
  "publish": true
}