{
  "title": "Top 5 Team Building Activities & Exercises for Work in 2024",
  "authors": [
    "Yiyang Zhang"
  ],
  "tags": [
    "Content"
  ],
  "description": "Discover the top 5 team-building activities and exercises for work in 2024 and unlock the full potential of your team!",
  "created": 1714348800000,
  "updated": 1714348800000,
  "layout": "blog",
  "id": "vYGxU5ovhr__YVpL7goLd",
  "slug": "top-5-team-building-activities-exercises-work",
  "cover": "https://app.affine.pro/api/workspaces/qf73AF6vzWphbTJdN7KiX/blobs/Id9AEHmAs2qifXsoxGdmx5f3NXW--Jo3YH5pJVmMHO8=.webp",
  "md": "---\n\ntitle: \"Top 5 Team Building Activities & Exercises for Work in 2024\"\n\nauthor: \"Yiyang Zhang\"\n\ntags: Content\n\nslug: top-5-team-building-activities-exercises-work\n\ndescription: \"Discover the top 5 team-building activities and exercises for work in 2024 and unlock the full potential of your team!\"\n\ncreated: 2024-04-29\n\nupdated: 2024-04-29\n\nlayout: blog\n\npublish: true\n\n---\n\n\n![Id9AEHmAs2qifXsoxGdmx5f3NXW--Jo3YH5pJVmMHO8=](https://app.affine.pro/api/workspaces/qf73AF6vzWphbTJdN7KiX/blobs/Id9AEHmAs2qifXsoxGdmx5f3NXW--Jo3YH5pJVmMHO8=.webp)\n\nHey there, team leaders and managers! Are you excited to make 2024 an amazing year for your team? To ensure long-term success, itâ€™s important to have a team of employees who feel connected, recognized, and valued. And what better way to achieve this than with fun team-building activities? These activities are essential for fostering effective connections and collaboration among your team members. Although it may be challenging to implement them, thoughtfully created team-building activities can break down barriers among employees, creating a fun and safe environment while driving [productivity](https://affine.pro/blog/10-cool-apps-enhanced-productivity-simplified-living) to boost your business's bottom line.\n\nIn this article, we explore the significance of team-building activities and present the top 5 engaging options suitable for businesses of all shapes and sizes - whether your team operates remotely or in person. With these invaluable opportunities to fortify team connections, your team can thrive and achieve great things together!\n\n\n\n# **Benefits of Team Building Activities for Work**\n\n\n![V-MKvgf1rwKex7EtWx0qSMWalhMq6zrGPzgcuJ07Huc=](https://app.affine.pro/api/workspaces/qf73AF6vzWphbTJdN7KiX/blobs/V-MKvgf1rwKex7EtWx0qSMWalhMq6zrGPzgcuJ07Huc=.webp)\n\n* **Breaks down barriers and builds trust:** Team building activities facilitate trust among team members by breaking down barriers that may exist.\n\n* **Enhanced [communication](https://affine.pro/blog/10-free-project-communication-plan-templates-examples):** Engagement in these activities leads to improved communication, which in turn fosters better collaboration on projects.\n\n* **Boosts morale and motivation:** Participation in team building exercises contributes to a positive work environment by boosting employee morale and motivation.\n\n* **Showcases strengths and talents:** Individuals have the opportunity to showcase their strengths and talents beyond their usual roles, leading to a better understanding of each team member's abilities.\n\n* **Fosters creativity and innovation:** Team building promotes [creativity](https://affine.pro/blog/top-25-ai-art-prompts-ideas-spark-your-creativity) and innovation by encouraging out-of-the-box thinking and problem-solving strategies.\n\n* **Long-term benefits:** Investing time in team-building activities yields long-term benefits for both employees and the organization as a whole, contributing to increased engagement and enhanced teamwork.\n\n\n\n# **How to Make Team Building Activities More Engaging?**\n\nLooking to ramp up the engagement level of your team-building activities? Here are some fresh ideas to make them more exciting and memorable.\n\n\n![bDtgnuruXX0fPTLaPJKh_Mi6wiFU1TxTZbI_LRGYmLo=](https://app.affine.pro/api/workspaces/qf73AF6vzWphbTJdN7KiX/blobs/bDtgnuruXX0fPTLaPJKh_Mi6wiFU1TxTZbI_LRGYmLo=.webp)\n\n* **Get creative with themes:** Set fun themes like a movie night or a tropical paradise escape to add intrigue.\n\n* **Incorporate friendly competition:** Split the team into groups and introduce challenges to encourage healthy competition.\n\n* **Think outside the box:** Try unconventional activities such as escape rooms, outdoor scavenger hunts, or virtual reality experiences for a unique twist.\n\n* **Mix up the teams:** Shuffle team members around to encourage interaction with different colleagues and foster new connections.\n\n* **Encourage participation through incentives:** Offer rewards or recognition for active participation to motivate employees to engage fully in the activities.\n\nBy implementing these strategies, you can take your team-building activities to the next level and create lasting bonds among your coworkers.\n\n\n\n# **Top 5 Team Building Activities & Exercises for Work in 2024**\n\n\n![ilUsoRq2ssxudMLtg7haTSERpgTVWAgkWhLHmhvWlDU=](https://app.affine.pro/api/workspaces/qf73AF6vzWphbTJdN7KiX/blobs/ilUsoRq2ssxudMLtg7haTSERpgTVWAgkWhLHmhvWlDU=.webp)\n\nLooking for new team-building activities to boost morale and collaboration in your workplace? Here are 5 exciting ideas to try out with your team in 2024:\n\n## **1. Communication and Collaboration**\n\n\n![Hjw8G0E7VyJjdH3wKiqV1lNYZn_vIo0buFnXQu_caR4=](https://app.affine.pro/api/workspaces/qf73AF6vzWphbTJdN7KiX/blobs/Hjw8G0E7VyJjdH3wKiqV1lNYZn_vIo0buFnXQu_caR4=.webp)\n\n* **Team-building Workshops:** Team-building workshops are inclusive sessions designed for all team members, often led by a professional trainer or seasoned team leader. The duration of these workshops can **span from a half-day to several days**, depending on the complexity of topics explored and workshop goals. These sessions delve into communication, collaboration, conflict resolution, and team dynamics. Engaging activities such as interactive discussions, role-playing scenarios, group exercises, and skill-building sessions are customized to meet the team's unique requirements, fostering a cohesive and productive work environment.\n\n* **Peer Coaching Sessions:** In peer coaching sessions, team members are paired to provide each other with coaching and feedback, aiming to foster continuous learning and development within the team. These sessions typically **last between 30 minutes to an hour** and take place one-on-one in a relaxed and private setting, allowing for focused interaction. Participants dedicate specific time slots, and the timing can be flexible to accommodate everyone's schedules. During the sessions, participants rotate roles, taking turns coaching and receiving feedback on predetermined skills, projects, or areas for improvement.This structured approach encourages collaborative growth and strengthens bonds within the team.\n\n<video muted autoplay loop preload=\"auto\" playsinline>\n  <source src=\"https://app.affine.pro/api/workspaces/qf73AF6vzWphbTJdN7KiX/blobs/Z2sqs40kcx1HxuMDWnrIM1z3sZXgVHm05NNnUdpl0zM=\" type=\"video/mp4\" />\n</video>\n\n* **Team Building Book Club:** The [team-building](https://affine.pro/blog/team-building-activities-for-collaboration-success) book club is an engaging activity that fosters collaboration and personal development within a team. Participants commit to reading assigned chapters or books on topics such as teamwork, leadership, or personal growth within a specified timeframe. Meetings are typically held regularly, such as **once a month or once every few weeks**. During these gatherings, team members convene to discuss key concepts, share insights, and reflect on how to apply the book's principles to enhance team collaboration and communication. Facilitation may be provided by a designated leader or rotate among members, ensuring diverse perspectives and active participation. This interactive and educational activity strengthens bonds among team members while promoting continuous learning and improvement.\n\n* **Appreciation Circles:** Engaging in Appreciation Circles offers a structured avenue for team members to express gratitude and acknowledge each other's contributions and qualities. This activity is versatile, fitting into regular team meetings or designated appreciation sessions. Typically spanning **15 to 30 minutes per session**, the duration varies based on team size and the depth of appreciation conveyed. Participants form a circle and take turns sincerely expressing appreciation or gratitude towards a fellow team member. Through this interactive exchange, Appreciation Circles cultivate a positive team ethos, elevate team spirit, and fortify interpersonal bonds among members.\n\n* **Weekly Team Updates:** The weekly team updates serve as a pivotal activity in fostering cohesion and progress among team members. These updates entail regular meetings where team members provide comprehensive updates on their respective projects and tasks. Whether conducted face-to-face or virtually, the timing of these updates remains consistent, usually occurring **every Monday morning or Friday afternoon**. During these sessions, each team member shares their progress, highlights challenges encountered, and celebrates achievements since the previous meeting. This structured approach not only promotes transparency and collaboration but also ensures accountability among team members. Additionally, these updates offer a platform for offering support, exchanging feedback, and extending assistance to colleagues as needed, further reinforcing teamwork and collective success.\n\n\n![gfz-NlTNLNXClUnG-tAShA57LxbuvaFb0OegHCLXwgY=](https://app.affine.pro/api/workspaces/qf73AF6vzWphbTJdN7KiX/blobs/gfz-NlTNLNXClUnG-tAShA57LxbuvaFb0OegHCLXwgY=.webp)\n\n* **Telephone Game:** The telephone game, a timeless team-building activity, underscores the significance of precise communication among team members. Engaging all participants, this activity typically spans **15-30 minutes** and requires no special toolsâ€”just the team gathered in a circle. It commences with one member whispering a message or phrase to the person beside them. Subsequently, each person whispers the message to the next, continuing until it reaches the last individual. Finally, the last person vocalizes what they heard, often revealing significant discrepancies from the original message due to inevitable miscommunication. Through this exercise, participants grasp the importance of clear, concise communication and are prompted to hone their listening skills and verify information.\n\n* **Group Problem Solving:** Group problem-solving activities encompass a range of collaborative challenges designed to foster teamwork and critical thinking. Participants engage in tackling various scenarios, such as logic puzzles, brainteasers, or real-life work-related situations, pooling their diverse perspectives and problem-solving skills. These activities can span from **brief, 15-minute challenges to more extensive hour-long sessions**, depending on the complexity of the problem and desired outcomes. Tools like [whiteboards](https://affine.pro/blog/10-best-whiteboard-layout-ideas-boost-your-productivity), flip charts, or digital platforms may be utilized to aid communication and idea generation. Ultimately, the aim is to enhance team cohesion and effectiveness by encouraging communication, creativity, and collective problem-solving.\n\n\n![a6qbOhG-Gt1lT_OMUMqd-weEwAa2y0tyfcb22HFwXRQ=](https://app.affine.pro/api/workspaces/qf73AF6vzWphbTJdN7KiX/blobs/a6qbOhG-Gt1lT_OMUMqd-weEwAa2y0tyfcb22HFwXRQ=.webp)\n\n* **Collaborative Document Creation:** In collaborative document creation, a select team of individuals collaborates to craft a document or proposal. Usually, this involves a smaller group of team members closely tied to the project. Employing platforms such as Google Docs or Microsoft Word Online, participants work together in real-time to [brainstorm](https://affine.pro/blog/best-free-brainstorming-templates-techniques-guide), refine content, and collectively shape the document. The duration of this activity varies depending on project complexity and urgency, often **spanning multiple sessions or days** to ensure meticulous review and revision.\n\n* **Round-Robin Storytelling:** Round-Robin storytelling stands as an engaging team-building endeavor where all members collaborate in weaving a narrative tapestry. Positioned in a circle, each participant sequentially contributes to the unfolding story. Commencing with an initial sentence or paragraph, one member kickstarts the tale, then seamlessly passes the narrative baton to the next person. This iterative process ensues until the story gracefully concludes. Through this activity, individuals cultivate active listening, spur creativity, and hone improvisational prowess. The duration of Round-Robin [Storytelling](https://affine.pro/blog/10-best-free-storyboard-creator-software) flexes, typically **spanning 15 to 30 minutes**, contingent upon participant count and story length.\n\n* **Peer-to-Peer Feedback Session:** In peer-to-peer feedback sessions, team members engage in structured exchanges of constructive criticism and praise. This activity typically involves pairs or small groups, allowing participants to provide insights on [performance](https://affine.pro/blog/10-best-free-performance-review-templates-examples-2023), behavior, or project outcomes. These sessions typically **run for 30 to 60 minutes**, providing ample time for in-depth discussions. Participants utilize various tools such as feedback forms or digital platforms to facilitate the process. During the session, individuals offer feedback, emphasizing both strengths and areas for enhancement, fostering active listening and appreciation of received feedback. Peer-to-peer feedback sessions cultivate a culture of continual growth, fostering accountability and solidarity within the team.\n\n\n\n## **2. Trust Building**\n\n\n![Ku8UNsLKMAswRe7gOrW3mcF_KVlF4ROpQychExNum2I=](https://app.affine.pro/api/workspaces/qf73AF6vzWphbTJdN7KiX/blobs/Ku8UNsLKMAswRe7gOrW3mcF_KVlF4ROpQychExNum2I=.webp)\n\n* **Trust-building Retreats:** Immersive trust-building retreats are meticulously crafted experiences aimed at nurturing trust, teamwork, and interpersonal bonds within teams. These retreats unfold over **a weekend or span several days**, often nestled in secluded locations far from the usual workplace hustle. Participants engage in a diverse array of activities ranging from outdoor expeditions and team-oriented challenges to structured discussions and introspective exercises. Through these varied encounters, individuals are encouraged to venture beyond their comfort zones, fostering mutual reliance and strengthening connections. Ultimately, the retreats aim to cultivate a nurturing environment where team members forge enduring bonds and deepen their interpersonal rapport.\n\n* **Leadership Shadowing:** In the leadership shadowing activity, team members are paired with leaders within the organization to observe and learn from their daily routines, decision-making methods, and leadership styles. Lasting for **a specified period**, participants immerse themselves in the roles of their assigned leaders, gaining firsthand experience and insights into leadership dynamics. This immersive approach fosters trust and mutual understanding between team members and leaders, cultivating a culture of appreciation and collaboration throughout the organization. This activity typically involves regular meetings, observation sessions, and potentially the use of reflection tools or journals to enhance the learning experience.\n\n\n![H1EL1TZ116cbyyIDzA5DIrFHpw2bdn9VcDxv36mQ_-s=](https://app.affine.pro/api/workspaces/qf73AF6vzWphbTJdN7KiX/blobs/H1EL1TZ116cbyyIDzA5DIrFHpw2bdn9VcDxv36mQ_-s=.webp)\n\n* **Personal Sharing Circles:** Personal sharing circles provide a structured space for team members to share personal stories, experiences, and challenges in a supportive and non-judgmental environment. These circles are typically facilitated by a trained moderator and may follow a specific format, such as guided prompts or open discussions. The goal is to foster empathy, understanding, and trust among team members by encouraging authentic and vulnerable sharing.\n\n* **Mentorship Programs:** Personal sharing circles offer a structured platform for team members to openly share personal narratives, experiences, and obstacles in a supportive, non-judgmental setting. Facilitated by a trained moderator, these sessions often adhere to a predefined structure, utilizing guided prompts or open discussions. Participants engage in authentic and vulnerable exchanges, fostering empathy, understanding, and trust within the team. These circles typically **last for around an hour** and involve all team members, providing a valuable opportunity for connection and cohesion.\n\n* **Volunteer Together:** Engaging in team-building through volunteering entails joining hands in community service or philanthropic endeavors. This could span various activities, such as lending a hand at a nearby charity, engaging in fundraising [events](https://affine.pro/blog/11-types-events-management-different-specializations), or spearheading service projects within the community. Participants commit a certain duration, typically **ranging from a few hours to a full day**, depending on the nature of the activity. Tools and materials required might include cleaning supplies, food items for distribution, or promotional materials for fundraising events. The collaborative effort towards a shared goal fosters trust, enhances team cohesion, and allows individuals to derive fulfillment from contributing to the welfare of others.\n\n\n![L8FvXQbrZg4cp5RLsLQ37E1o6U_2z3WnGKbOuuKlfP8=](https://app.affine.pro/api/workspaces/qf73AF6vzWphbTJdN7KiX/blobs/L8FvXQbrZg4cp5RLsLQ37E1o6U_2z3WnGKbOuuKlfP8=.webp)\n\n* **Human Chain:** The human chain activity is a collaborative team-building exercise where participants form a physical chain by linking arms or holding hands. This activity typically lasts **around 20-30 minutes** and is ideal for groups of 8-20 people. Participants are usually provided with objects such as balls, ropes, or even blindfolds, which they must pass along the chain without dropping. Effective coordination, clear communication, and trust among team members are crucial for the successful transfer of objects. Through this interactive exercise, participants learn the significance of teamwork and collaboration in achieving common goals. Overall, human chain activity offers an enjoyable and impactful way to reinforce these essential principles.\n\n* **Personal Story Sharing:** During personal [story sharing](https://affine.pro/blog/free-best-8-storyboard-templates-examples) sessions, team members come together to share significant experiences from their lives. These sessions, typically **lasting 60-90 minutes**, are structured around specific themes like overcoming challenges, personal achievements, or pivotal life [event](https://affine.pro/blog/best-8-free-event-planning-templates-checklists-customize)s. Participants may use tools like visual aids or prompts to enhance their storytelling. Through this activity, team members foster deeper connections, cultivate empathy, and gain a richer understanding of each other's backgrounds and viewpoints.\n\n\n![52GHH-kQn2HoFr5iEP67GTUENfzaR0XcKxIAQfaTcck=](https://app.affine.pro/api/workspaces/qf73AF6vzWphbTJdN7KiX/blobs/52GHH-kQn2HoFr5iEP67GTUENfzaR0XcKxIAQfaTcck=.webp)\n\n* **Vulnerability Sessions:** During the vulnerability sessions, team members gather in a safe and nurturing environment to engage in open discussions about their vulnerabilities, fears, and insecurities. Led by a skilled facilitator or coach, these sessions typically **last between one to two hours**, accommodating all team members. Utilizing tools such as guided prompts, reflective exercises, and active listening techniques, participants are encouraged to share their authentic feelings and experiences without fear of judgment. Through embracing vulnerability, team members cultivate trust, deepen relationships, and cultivate a culture of openness and acceptance within the team.\n\n* **Blind Drawing:** Blind drawing is an engaging team-building exercise that fosters trust and communication skills among participants. In this activity, one team member verbally describes an [image](https://affine.pro/blog/best-ai-image-generator) to another team member, who attempts to draw it without seeing the image. The participants can be positioned back-to-back or separated by a barrier to ensure the drawer cannot see the image. This activity typically **lasts around 20-30 minutes**, allowing each pair to take turns describing and drawing. Basic drawing materials such as paper and pencils are needed, and optionally, a timer can be used to add a sense of urgency. Effective communication, active listening, and trust are essential for success, as the drawer must rely solely on their partner's instructions to create an accurate representation of the image.\n\n* **Trust Circle:** The trust circle activity fosters trust and cohesion within teams through a simple yet powerful exercise. Participants form a circle, facing inward, and take turns falling backward into the waiting arms of their colleagues. This demonstration of vulnerability and reliance builds a profound sense of trust and confidence among team members. Emphasizing the importance of trust in teamwork, this activity cultivates interpersonal bonds and reinforces mutual support. It typically **lasts for about 30 minutes to an hour**, providing ample time for each member to participate and experience the trust-building process firsthand.\n\n  \n![FYGhBseAEogYJqLnp-sfm8Dbl3UKeGPNCoUnYU-RmOc=](https://app.affine.pro/api/workspaces/qf73AF6vzWphbTJdN7KiX/blobs/FYGhBseAEogYJqLnp-sfm8Dbl3UKeGPNCoUnYU-RmOc=.webp)\n\n## \n\n## **3. Problem Solving and Decision Making**\n\n\n![459OyFSWtzyNqNroHLuRo1_dUapSIlI22WR7RfWU4ag=](https://app.affine.pro/api/workspaces/qf73AF6vzWphbTJdN7KiX/blobs/459OyFSWtzyNqNroHLuRo1_dUapSIlI22WR7RfWU4ag=.webp)\n\n* **Root Cause [Analysis](https://affine.pro/blog/top-10-free-competitive-analysis-templates-boost-your-business) Workshops:** Root cause analysis workshops offer teams a structured approach to identify and tackle underlying issues within the organization. Led by an experienced facilitator in root cause analysis techniques, team members collaborate across departments to dissect data, scrutinize processes, and uncover the root causes of challenges. These workshops, **spanning from half-day to full-day sessions**, afford teams the necessary time for comprehensive analysis and robust discussion. Through this methodical exploration, teams gain insights into systemic issues and develop targeted strategies for improvement, fostering a culture of continuous learning and problem-solving within the organization.\n\n\n![ZnwpFo6M_O-slERUV2M5BUqf6mK9tRT21bF0urPNQ8w=](https://app.affine.pro/api/workspaces/qf73AF6vzWphbTJdN7KiX/blobs/ZnwpFo6M_O-slERUV2M5BUqf6mK9tRT21bF0urPNQ8w=.webp)\n\n* **Innovation Hackathons:** Innovation hackathons represent dynamic collaborative events, uniting cross-functional teams to tackle specific challenges or seize opportunities. These sessions engage developers, designers, marketers, and project managers, guided by innovation experts. The duration of hackathons varies, **spanning from a single day to multiple days**, aligning with challenge complexity and desired outcomes.\n\n* **Simulation Exercises:** Simulation exercises mirror real-world scenarios or crises, engaging teams to craft effective response plans. Led by experienced facilitators, team members from relevant departments immerse themselves in these exercises, testing problem-solving and decision-making skills. These sessions can **extend from a few hours to a full day**, enabling thorough exploration under simulated pressure.\n\n* **Ideation Challenges:** Ideation challenges foster creativity and collaboration among diverse team members, sparking innovative solutions. Teams brainstorm ideas collectively, prioritizing quantity and originality. Depending on challenge scope, these sessions unfold in **a single session spanning hours or over multiple sessions across days or weeks**.\n\n\n![vvHNNU_yvifubBkrXzWHVFaVU7W0oP539CUWFxUMOKM=](https://app.affine.pro/api/workspaces/qf73AF6vzWphbTJdN7KiX/blobs/vvHNNU_yvifubBkrXzWHVFaVU7W0oP539CUWFxUMOKM=.webp)\n\n* **Problem-solving Workshops:** Problem-solving workshops hone team members' critical thinking and decision-making abilities through interactive exercises and discussions. Led by skilled facilitators, these workshops **range from half-day sessions to multi-day deep dives**, allowing comprehensive exploration and practice of problem-solving methodologies.\n\n* **Decision-making Scenarios:** Decision-making scenarios immerse teams in real-life situations, necessitating complex decision-making processes. Team members deliberate options, weighing pros and cons to reach consensus. These scenarios, tackled in sessions **spanning hours or multiple sessions**, involve decision-makers or experts, facilitating thorough [analysis](https://affine.pro/blog/8-best-free-fishbone-diagram-templates-examples-analysis) and discussion.\n\n* **SWOT Analysis Workshop:** During SWOT analysis workshops, teams delve into identifying their strengths, weaknesses, opportunities, and threats. Guided by a skilled facilitator, team members contribute insights on internal and external factors impacting the organization. These workshops **span from half-day to full-day sessions**, enabling a thorough examination and the formulation of strategic priorities based on the SWOT analysis.\n\n\n![jUNxXK7xFFkcMFMiq4a5MJkCMlqMbTRuDD4lWbKWe1U=](https://app.affine.pro/api/workspaces/qf73AF6vzWphbTJdN7KiX/blobs/jUNxXK7xFFkcMFMiq4a5MJkCMlqMbTRuDD4lWbKWe1U=.webp)\n\n* **Critical Thinking Exercises:** Engaging in critical thinking exercises prompts teams to dissect information, assess arguments, and reach informed conclusions. These exercises encompass logic puzzles, case studies, or hypothetical scenarios demanding meticulous analysis and logical deduction. Led by a critical thinking expert, sessions can be condensed into **a few hours or extended over multiple sessions** for a deeper exploration of intricate subjects.\n\n\n![5PKXq9IDC9oJZdCiuTvPSzJq_Mya8h3y8NZjiP2enhg=](https://app.affine.pro/api/workspaces/qf73AF6vzWphbTJdN7KiX/blobs/5PKXq9IDC9oJZdCiuTvPSzJq_Mya8h3y8NZjiP2enhg=.webp)\n\n* **Decision-making Simulations:** Decision-making simulations replicate real-world scenarios within a low-risk setting. Teams scrutinize data, evaluate alternatives, and make decisions grounded in their analysis. Participation necessitates individuals with decision-making authority or pertinent expertise. Sessions can be condensed into **a few hours or prolonged over multiple sessions** to facilitate a comprehensive exploration of decision-making dynamics.\n\n* **Case Study Analysis:** Case study analysis entails teams dissecting real-life cases relevant to their industry or domain. Guided by a facilitator, team members dissect facts, pinpoint key issues, and devise recommendations or solutions. The duration of analysis sessions **varies from a few hours to a full day**, contingent on the complexity of the case and the requisite depth of analysis, fostering extensive examination and discourse among team members.\n\n\n\n## **4. Creativity and Innovation**\n\n\n![DJmzcUSVW6kDJ3uLjvaU17eL0oN01uRM_gaBJ2yBQzI=](https://app.affine.pro/api/workspaces/qf73AF6vzWphbTJdN7KiX/blobs/DJmzcUSVW6kDJ3uLjvaU17eL0oN01uRM_gaBJ2yBQzI=.webp)\n\n* **Creative Retreats:** Creative retreats allocate dedicated time and space for teams to cultivate innovative ideas and solutions. These retreats encompass brainstorming sessions, design thinking workshops, and collaborative endeavors to nurture creativity and innovation. Attendees typically comprise individuals from diverse backgrounds, such as creatives, strategists, and problem-solvers. The duration of a creative retreat **spans from a single day to multiple days**, contingent on the retreat's scope and desired outcomes.\n\n* **Design Sprint Workshops:** In design sprint workshops, teams tackle specific challenges through rapid ideation, prototyping, and testing, guided by a facilitator well-versed in design thinking. These sessions **span three to five days**, fostering iterative cycles of idea generation and prototype development. Participants, including designers, developers, marketers, and stakeholders, collaborate closely to create and refine prototypes while soliciting feedback from relevant parties.\n\n\n![lehxebGudc9O7mCc6YYD9eo1YNSUcg_oPUfTxWDkYxs=](https://app.affine.pro/api/workspaces/qf73AF6vzWphbTJdN7KiX/blobs/lehxebGudc9O7mCc6YYD9eo1YNSUcg_oPUfTxWDkYxs=.webp)\n\n* **Innovation Labs:** Innovation labs offer teams dedicated spaces and resources to experiment with new technologies and methodologies. Acting as creative hubs, these labs facilitate the exploration of innovative ideas and the development of prototypes. Teams comprising researchers, developers, designers, and project managers engage in ongoing experimentation and collaboration within these labs, dedicating **regular time** to exploration and iteration.\n\n* **Idea Incubators:** Idea incubators are platforms or forums where team members can pitch and develop innovative ideas collaboratively. These incubators provide a structured framework for idea generation, validation, and refinement, fostering a culture of innovation within the organization. Personnel involved may include idea champions, facilitators, and cross-functional teams tasked with developing and implementing promising ideas. The timing for an idea incubator can vary, with projects progressing through different stages of development over weeks or months.\n\n\n![YEf8O9x6ibPcycWZh7M1pEmOVGgPqTutm0DgNZI6X70=](https://app.affine.pro/api/workspaces/qf73AF6vzWphbTJdN7KiX/blobs/YEf8O9x6ibPcycWZh7M1pEmOVGgPqTutm0DgNZI6X70=.webp)\n\n* **Creative Challenges:** Creative challenges present teams with open-ended prompts, pushing them to explore unconventional solutions and approaches. Participants, drawn from diverse backgrounds such as design, engineering, [marketing](https://affine.pro/blog/10-creative-content-marketing-ideas-examples-inspire-you), and innovation, engage in sessions ranging from single, intensive sessions to ongoing challenges conducted **over weeks or months**. These challenges stimulate creativity, foster experimentation, and encourage teams to stretch beyond their usual boundaries.\n\n* **Lego Serious Play:** Lego Serious Play employs Lego bricks to facilitate creative problem-solving and thinking. In facilitated workshops, team members build models representing their ideas and challenges, using metaphorical thinking and visual expression. Guided by trained facilitators, participants engage in storytelling and discussion, with workshops typically **spanning from half-day sessions to full-day events**, allowing for iterative exploration and dialogue.\n\n\n![p2ecrVaPIBZw8YjsZZ-iraBUvx4-S7w4P0u8G4JdHSY=](https://app.affine.pro/api/workspaces/qf73AF6vzWphbTJdN7KiX/blobs/p2ecrVaPIBZw8YjsZZ-iraBUvx4-S7w4P0u8G4JdHSY=.webp)\n\n* **Improv Games:** Improv games promote spontaneity, creativity, and teamwork through interactive activities like storytelling and role-playing. These exercises, led by trained facilitators or improv coaches, create a playful and collaborative atmosphere. Participants engage in activities like \"Yes, And\" to build upon ideas and \"Scene Building\" to collectively craft fictional scenarios. Timing for improv sessions varies, from short icebreaker activities to longer workshops **lasting several hours**, accommodating different levels of engagement and participation.\n\n* **Reverse Brainstorming:** Reverse brainstorming is a collaborative technique where teams delve into unconventional thinking by generating ideas to sabotage a project or worsen a problem. This brainstorming process is then reversed, turning these negative concepts into innovative solutions. Participants include team members open to unconventional approaches and facilitators guiding the session. The duration of a reverse brainstorming session varies, **from a single intensive session spanning a few hours to ongoing sessions spread over several days**.\n\n\n![5jb-55p1urq8nRhohcSw0AxRcPFPyxk3E3qDWHG2aLs=](https://app.affine.pro/api/workspaces/qf73AF6vzWphbTJdN7KiX/blobs/5jb-55p1urq8nRhohcSw0AxRcPFPyxk3E3qDWHG2aLs=.webp)\n\n* **Picture Pieces:** Picture Pieces is a team-building activity that fosters collaboration and problem-solving skills. Teams collaborate to reconstruct an image using scattered pieces, with each member receiving a piece without knowledge of the complete picture. This necessitates effective communication and teamwork to assemble the puzzle. Personnel involved are collaborative team members and a facilitating overseer. The activity typically **lasts one to two hours** within a single session.\n\n* **Design Thinking Workshops:** Design thinking workshops are structured sessions that guide teams through the design thinking process to solve complex problems and drive innovation. Led by trained facilitators, teams engage in activities such as empathy mapping, ideation, prototyping, and user testing. These workshops require cross-functional teams with diverse perspectives and skills. The timing for a design thinking workshop can vary, with sessions **ranging from a half-day to multiple days**, depending on the complexity of the challenge and desired outcomes.\n\n\n\n## **5. Fun and Icebreakers**\n\n\n![-iXZLeKmGBkghPhuCpny1ohJkW-Ufj5GtupraS0bWmY=](https://app.affine.pro/api/workspaces/qf73AF6vzWphbTJdN7KiX/blobs/-iXZLeKmGBkghPhuCpny1ohJkW-Ufj5GtupraS0bWmY=.webp)\n\n* **Virtual Team Building Games:** Virtual team-building games, like online escape rooms and trivia, are tailored for remote teams, enhancing interaction in a digital environment. These activities demand effective collaboration and communication through digital platforms, involving team members with access to online gaming tools. Timing varies depending on the chosen game, typically **spanning from 30 minutes to 2 hours**.\n\n* **Office Charades:** Office Charades is a timeless team-building game that requires minimal setup and personnel involvement. Team members act out workplace-related terms or scenarios silently, while others guess the answer. The game is ideal for short breaks or standalone activities, **lasting approximately 20-30 minutes**, with teams taking turns in acting and guessing.\n\n\n![97JWUtnbVUbYK8vIziuDw6qBCacX54WHjaX11W9k8bU=](https://app.affine.pro/api/workspaces/qf73AF6vzWphbTJdN7KiX/blobs/97JWUtnbVUbYK8vIziuDw6qBCacX54WHjaX11W9k8bU=.webp)\n\n* **Office Scavenger Hunt:** Office scavenger hunts entail teams searching for specified items or completing tasks around the office within a designated timeframe. This activity encourages teamwork and problem-solving skills. A facilitator organizes the hunt, and team members participate in locating items or solving clues. The duration typically **ranges from 30 minutes to 1 hour**, depending on the complexity of the hunt.\n\n* **Karaoke Night:** Karaoke night is a fun and lighthearted activity where team members gather to sing their favorite songs. It provides an opportunity for team bonding and laughter in a relaxed environment. Personnel involved include team members willing to participate and a designated karaoke machine or online karaoke platform. Timing can vary depending on the number of participants and song selections, typically **lasting 1-2 hours**.\n\n\n![xVwJq-o0FqcPLDmCrpKGUSVJSjYyOK2twMtzC9SJUJM=](https://app.affine.pro/api/workspaces/qf73AF6vzWphbTJdN7KiX/blobs/xVwJq-o0FqcPLDmCrpKGUSVJSjYyOK2twMtzC9SJUJM=.webp)\n\n* **Board Game Tournament:** Hosting a board game tournament is a great way to foster friendly competition and teamwork. Teams compete against each other in games like Monopoly, Scrabble, or Settlers of Catan, with the winners advancing to the next round. Personnel required include team members willing to participate and a selection of board games. The timing can vary depending on the number of games and participants, **lasting 2-3 hours or longe**r for multi-round tournaments.\n\n* **Team Movie Night:** Team movie night involves screening a movie together as a team, followed by a discussion about its themes or lessons. It provides an opportunity for team members to relax and bond over shared cinematic experiences. Personnel involved include team members willing to attend and a projector or screen to display the movie. Timing typically **ranges from 1.5 to 3 hours**, depending on the length of the movie and the duration of the discussion.\n\n\n![xcg3KqfnY0RvFdLpAvhW1EIfW2jB2ImaBGLzveohEas=](https://app.affine.pro/api/workspaces/qf73AF6vzWphbTJdN7KiX/blobs/xcg3KqfnY0RvFdLpAvhW1EIfW2jB2ImaBGLzveohEas=.webp)\n\n* **Themed Dress-up Days:** Themed dress-up days encourage team members to dress according to a chosen theme, such as \"superhero day\" or \"80s day.\" It fosters creativity and camaraderie as team members showcase their costumes and participate in themed activities or competitions. Personnel involved include team members willing to dress up and a facilitator to coordinate the event. The timing can vary, typically **lasting a full workday or a few hours** for shorter events.\n\n* **Cooking or Baking Competitions:** Cooking or baking competitions challenge teams to prepare dishes or treats within a specified time frame, using predetermined ingredients or themes. Teams collaborate to [plan](https://affine.pro/blog/how-to-make-work-plan-step-by-step-guide) and execute their recipes, showcasing their culinary skills and creativity. Personnel involved include team members interested in cooking or baking and access to a kitchen or cooking facilities. The timing can vary depending on the complexity of the dishes, typically **lasting 1-2 hours** for shorter competitions.\n\n\n![rR-F9eAcl4rn7v8CrkU8Cf-uaKxduFe-kFQLGceENOQ=](https://app.affine.pro/api/workspaces/qf73AF6vzWphbTJdN7KiX/blobs/rR-F9eAcl4rn7v8CrkU8Cf-uaKxduFe-kFQLGceENOQ=.webp)\n\n* **Personality Quizzes:** Personality quizzes are a fun and interactive way for team members to learn more about themselves and each other. Quizzes can be designed to explore personality traits, strengths, or communication styles, sparking conversations and insights among team members. Personnel involved include team members willing to participate and a facilitator to administer the quiz. The timing can vary, typically **lasting 30 minutes to 1 hour**.\n\n* **Outdoor Adventure Day:** An outdoor adventure day involves planning outdoor activities such as hiking, picnicking, or team sports to promote bonding and relaxation. Teams participate in outdoor challenges or games, fostering teamwork and camaraderie in a natural setting. Personnel involved include team members willing to participate and access to outdoor recreation areas or facilities. The timing can vary depending on the chosen activities, typically **lasting a half-day or full day**.\n\n\n![LjOj9QmXs5tuNAUk8lQ8FhMJIHKcLX7x5ovNY2Viiyk=](https://app.affine.pro/api/workspaces/qf73AF6vzWphbTJdN7KiX/blobs/LjOj9QmXs5tuNAUk8lQ8FhMJIHKcLX7x5ovNY2Viiyk=.webp)\n\n\n\n# **Use Event Management Tool to Record Your Team Building Activities**\n\nBy using an event [management](https://affine.pro/blog/8-free-project-tracker-templates-work-management-2023) tool to record your team-building activities, you can track progress, measure success, and ensure that future events are even more engaging and effective. With the right tools in place, you can streamline the planning process, automate reminders and notifications, and easily access data for analysis. We recommend **[AFFiNE](https://affine.pro/)** as your go-to event management tool to record your team-building activities.\n\n\n![5VZZiy69UNGfpn8KOwMVuvVmBr6icqfRjmd42C36r9g=](https://app.affine.pro/api/workspaces/qf73AF6vzWphbTJdN7KiX/blobs/5VZZiy69UNGfpn8KOwMVuvVmBr6icqfRjmd42C36r9g=.webp)\n\n<div style=\"text-align:center;\">\n<iframe width=\"560\" height=\"315\" src=\"https://www.youtube.com/embed/WqOe9HgpsDY?si=PHGuSeRbOT9GxuPO\" title=\"YouTube video player\" frameborder=\"0\" allow=\"accelerometer; autoplay; clipboard-write; encrypted-media; gyroscope; picture-in-picture; web-share\" allowfullscreen></iframe>\n</div>\n\nAFFiNE provides professionals with a unified platform that enables them to plan a knowledge base, collaborate with teammates, and develop content. This flexible tool empowers users to brainstorm, [take notes](https://affine.pro/blog/10-best-free-online-sticky-notes-free-software-tools), and set their goals while staying in sync and building content with blocks. The limitless workspace stimulates user-driven innovation. AFFiNE offers safe data storage, open-source benefits, and collaborative functionality. Users can visualize and connect information effortlessly, making team activity an engaging and enjoyable experience.\n\n**Key features:**\n\n* **Template Gallery in AFFiNE:** There is a curated collection of powerful [whiteboard](https://affine.pro/blog/best-free-whiteboard-layout-ideas-organization) templates in AFFiNE. From the robust Gantt charts to the insightful Kanban board and the comprehensive project management charts, an array of additional templates awaits your exploration, promising to expand the horizons of your recording of team-building activities. These templates serve as your launchpad, enabling you to skip the groundwork and jump straight into action. Crafted for seamless collaboration, AFFiNE's templates provide structured canvases for various tasks, saving you valuable time and enhancing efficiency in project management, content creation, and [planning](https://affine.pro/blog/top-10-best-free-digital-planner-apps-2023).\n\n\n![OP3GdbE7dwmQKK2uKzBgJbhpVJxkLuDsVtomxcggvSQ=](https://app.affine.pro/api/workspaces/qf73AF6vzWphbTJdN7KiX/blobs/OP3GdbE7dwmQKK2uKzBgJbhpVJxkLuDsVtomxcggvSQ=.webp)\n\n* **Tailored Precision with AFFiNE's Database:** AFFiNE's database seamlessly integrates Kanban and Table views for dynamic content creation. By smoothly transforming your blocks into a Kanban view, effortlessly classify based on properties such as date, progress, and link. This allows for intuitive drag-and-drop functionality, ensuring precise organization and alignment of your project execution. Switching to the Table view offers a comprehensive project overview, enhancing the efficiency of your narrative development. With intuitive controls, track deadlines and manage unscheduled tasks seamlessly.\n\n\n![bY0EkoVLJfBpOjymBoGUxE0LAiQuW1bNgYA-FU1OQlA=](https://app.affine.pro/api/workspaces/qf73AF6vzWphbTJdN7KiX/blobs/bY0EkoVLJfBpOjymBoGUxE0LAiQuW1bNgYA-FU1OQlA=.webp)\n\n* **Collaborative Editing:** Foster collaboration among team members by using AFFiNE's collaborative editing tools, and foster collaboration among team members. Multiple team members can work on any content simultaneously, ensuring a seamless and efficient content creation [process](https://affine.pro/blog/top-10-best-process-mapping-tools-software-2023-free-paid). Share files, exchange ideas, and provide feedback in real-time through AFFiNE. With AFFiNE, everyone can contribute to the same set of notes in real-time.\n\n\n![O88V12dZ7eALpdMD8-6eyyfRec5yZyWiQxCnvNEb3r0=](https://app.affine.pro/api/workspaces/qf73AF6vzWphbTJdN7KiX/blobs/O88V12dZ7eALpdMD8-6eyyfRec5yZyWiQxCnvNEb3r0=.webp)\n\nTeam building activities are not just a one-time thing; they should be part of your company culture to foster better communication, collaboration, and morale among employees. So why not start implementing these activities today? Your team will thank you for it!\n\nJoin us on our voyage through our [social media](https://affine.pro/blog/best-social-media-content-calendar-templates-smart-planning) channels and be part of the experience. **Come and join us on our journey over on our media platforms. ðŸš€**\n\n* Official Website: [https://affine.pro/](https://affine.pro/)\n\n* GitHub: [https://github.com/toeverything/AFFiNE](https://github.com/toeverything/AFFiNE)\n\n* Discord: [https://discord.gg/Arn7TqJBvG](https://discord.gg/Arn7TqJBvG)\n\n* Twitter: [https://twitter.com/AffineOfficial](https://twitter.com/AffineOfficial)\n\n",
  "publish": true
}