{
  "title": "Top 8 Proven Brainstorming Techniques for Creativity in 2024",
  "authors": [
    "Xuan Pang"
  ],
  "tags": [
    "Content"
  ],
  "description": "Unleash your team's creative potential with the top 8 proven brainstorming techniques for 2023. Discover innovative methods to spark ideas and drive your projects to success. ",
  "created": 1705881600000,
  "updated": 1705881600000,
  "layout": "blog",
  "id": "NkHMLig6sLOciWUBegh_k",
  "slug": "top-8-proven-brainstorming-techniques-creativity",
  "cover": "/blobs/V-Ur_qgyHYrtMZG4MdrHcuy1zupB0xp29rBURTWIt8Q=",
  "md": "---\n\n\ntitle: \"Top 8 Proven Brainstorming Techniques for Creativity in 2024\"\n\n\nauthor: \"Xuan Pang\"\n\n\ntags: Content\n\n\nslug: top-8-proven-brainstorming-techniques-creativity\n\n\ndescription: \"Unleash your team's creative potential with the top 8 proven brainstorming techniques for 2023. Discover innovative methods to spark ideas and drive your projects to success. \"\n\n\ncreated: 2024-01-22\n\n\nupdated: 2024-01-22\n\n\nlayout: blog\n\n\npublish: true\n\n\n---\n\n\nAs we move further into the decade, the creative landscape continues to evolve, bringing new challenges and opportunities. One constant, however, is the need for effective brainstorming techniques to unlock the creative potential within teams. In 2023, these top 8 proven [brainstorming techniques](https://affine.pro/blog/top-5-mind-maps-examples-and-tools) are invaluable tools for fostering creativity and innovation in any project.\n\n\n# What Are Brainstorming Techniques?\n\n\n\n![V-Ur_qgyHYrtMZG4MdrHcuy1zupB0xp29rBURTWIt8Q=](/blobs/V-Ur_qgyHYrtMZG4MdrHcuy1zupB0xp29rBURTWIt8Q=)\n\n\nBrainstorming techniques are structured methods used to generate ideas and solve problems collectively. These techniques encourage free thinking and collaboration, allowing team members to build on each other's ideas and come up with innovative solutions. From mind maps to role-playing, each technique offers a unique approach to harnessing the groupâ€™s creative energy.\n\n\n# Analytic Brainstorming Techniques\n\n\n### 1. [Mind Mapping](https://affine.pro/blog/top-5-mind-maps-examples-and-tools)\n\n\nThis technique involves creating a visual diagram that represents ideas, words, tasks, or other items linked to and arranged around a central concept. By forming these connections, mind mapping helps in visualizing and structuring thoughts, making it easier to analyze and generate new ideas.\n\n\n\n![pMYKE2ArvTLwAZSFkOkL3WDSK5-AFH7-7AVf56gaqHM=](/blobs/pMYKE2ArvTLwAZSFkOkL3WDSK5-AFH7-7AVf56gaqHM=)\n\n\n### 2. Gap Filling, a.k.a. Gap Analysis\n\n\nGap analysis is a method of assessing the difference between the current situation and the desired goals. It's a powerful tool for identifying what needs to be done to move a project forward and can stimulate creative solutions to bridge these gaps.\n\n\n\n![AX3kt0y6zcI38Xz472GB8QNDsab7chefaq1U2YhVJhU=](/blobs/AX3kt0y6zcI38Xz472GB8QNDsab7chefaq1U2YhVJhU=)\n\n\n### 3. Starbursting\n\n\nStarbursting encourages teams to generate questions about the product, service, or issue at hand. By brainstorming questions rather than answers, you can gain a more comprehensive understanding of the challenge and think of more creative solutions.\n\n\n\n![mdsN0Zl2z4N8P4szkC9ooFfdssaGTWrdXSJMryOhpHY=](/blobs/mdsN0Zl2z4N8P4szkC9ooFfdssaGTWrdXSJMryOhpHY=)\n\n\n### 4. The Five Whys, a.k.a. Why Analysis\n\n\nThis technique involves asking 'why' repeatedly to uncover the root cause of a problem. It can lead to deeper insights and foster innovative thinking as teams delve into the underlying issues.\n\n\n\n![A4p0iTWszCQjrBxFR8UX4oGmYNymuV-4hu0KlSbdfkw=](/blobs/A4p0iTWszCQjrBxFR8UX4oGmYNymuV-4hu0KlSbdfkw=)\n\n\n### 5. [SWOT](https://affine.pro/blog/top-10-free-editable-swot-analysis-template-examples) Analysis\n\n\n[SWOT](https://affine.pro/blog/top-10-free-editable-swot-analysis-template-examples) stands for Strengths, Weaknesses, Opportunities, and Threats. This classic business tool can also be used creatively to analyze these four aspects of a project and generate strategic ideas.\n\n\n\n![YrWaKrPZ1SxuzKUbMcyv0bxMkPkI49ZDULdKiOE1YwY=](/blobs/YrWaKrPZ1SxuzKUbMcyv0bxMkPkI49ZDULdKiOE1YwY=)\n\n\n### 6. How Now Wow\n\n\nThis matrix separates ideas into three categories: 'How' (basic but practical), 'Now' (innovative and feasible), and 'Wow' (groundbreaking but may require more development). It helps in categorizing and prioritizing ideas during a brainstorming session.\n\n\n\n![VK3XHHQkQG7edeLXJugKOm1pqib6pul4UZNMm2ZX9Gs=](/blobs/VK3XHHQkQG7edeLXJugKOm1pqib6pul4UZNMm2ZX9Gs=)\n\n\n### 7. Drivers Analysis\n\n\nThis technique looks at the drivers or factors that can influence a project or problem. Understanding these drivers can lead to more targeted and creative solutions.\n\n\n\n![BGX5M63DR3xVfYkpSwuD7_KNWSa3EOds8OHnA8w941w=](/blobs/BGX5M63DR3xVfYkpSwuD7_KNWSa3EOds8OHnA8w941w=)\n\n\n### 8. Role Storming\n\n\nRole storming involves putting oneself in someone else's shoes to view problems and generate solutions from a different perspective. This can lead to unexpected and creative ideas.\n\n\n\n![XNBgwjRe4T3O-Op7Cc7m_NXeNHBOM39wnEPXre2q4Yk=](/blobs/XNBgwjRe4T3O-Op7Cc7m_NXeNHBOM39wnEPXre2q4Yk=)\n\n\n# Brainstorming App Recommendation: [AFFiNE](https://www.affine.pro)\n\n\n\n![MvPuJwMVS0vN9b_4qmeq27HIggpf7g0QZuhvctyyqI8=](/blobs/MvPuJwMVS0vN9b_4qmeq27HIggpf7g0QZuhvctyyqI8=)\n\n\n[AFFiNE](https://www.affine.pro)is a cutting-edge brainstorming app that is designed to assist you in organizing, managing, and cooperating on tasks, projects, and information. What sets AFFiNE apart is that it is a free and [open-source](https://affine.pro/blog/tips-where-and-how-contribute-open-source-projects) program that employs offline technology to ensure that it is accessible to all users.\n\n\n**Key features:**\n\n\n**Write, [Draw](https://affine.pro/blog/best-free-digital-whiteboard-apps-2023), and [Plan](https://affine.pro/blog/best-project-planning-tools-software-for-teams-2023) All-in-One:** Enjoy your all-in-one KnowledgeOS solution for effortlessly writing, drawing, and planning on a hyper-fused platform. It supports [kanban](https://affine.pro/blog/affine-080-launch-week-day3), table, rich-text paragraphs as building blocks to form pages or whiteboards. It carries out integrated processing here in document editing, data processing, or brainstorming.\n\n\n\n![knv3GLQpB1H8ce4w2ztMzCiGuUMPG0JRDZA49U3AgIw=](/blobs/knv3GLQpB1H8ce4w2ztMzCiGuUMPG0JRDZA49U3AgIw=)\n\n\n* **[Collaborative Capabilities:](https://affine.pro/blog/affine-0-10-0-launch-week-day-5-5-stable-with-cloud-support-finally-available-to-every-pro-in-your-team)** For group brainstorming activities, the app should have collaborative features, making it easy to share and coordinate plans with others in your group work.\n\n\n  \n![71MN7zgKOg2C73idwSU66YEnVUK8x41Jqwwe2z9CiPU=](/blobs/71MN7zgKOg2C73idwSU66YEnVUK8x41Jqwwe2z9CiPU=)\n\n\n* **[Offline Accessibility](https://affine.pro/blog/5-best-offline-alternatives-to-notion):** The best brainstorm app should allow users to access their essential details offline. This feature is particularly valuable when going outside with limited internet connectivity.\n\n\n\n![7tLzErsXRl3O-9-0m62ySSd00VYnYYtRKFaZUFit2Jg=](/blobs/7tLzErsXRl3O-9-0m62ySSd00VYnYYtRKFaZUFit2Jg=)\n\n\n* **[Diversified concept map templates](https://community.affine.pro/c/general-discussion/new-templates-available-soon):** In [AFFiNE's latest release,](https://affine.pro/download) we've curated a collection of the most requested **templates, including the Gantt chart, Project Tracking Kanban,** [Monthly Calendar,](https://affine.pro/blog/free-8-printable-customizable-monthly-calendar-templates-examples)[Flowchart,](https://affine.pro/blog/10-best-flowchart-software-tools-2023-features-pricing) **and many more**. ðŸ“š\n\n\n\n![1nvHLDrs6zKHIM0DM34-5hSkFoUoH0cbLalP9U4IFpI=](/blobs/1nvHLDrs6zKHIM0DM34-5hSkFoUoH0cbLalP9U4IFpI=)\n\n\n\n![j0AoRF89FrSgYH_W5dmxX-9Oc2BfViH9mYtx7mGBrwo=](/blobs/j0AoRF89FrSgYH_W5dmxX-9Oc2BfViH9mYtx7mGBrwo=)\n\n\n\n![cmTZE7pwWJIcxP27crejYJ-9la1PAm2MC3tJI7nMYNc=](/blobs/cmTZE7pwWJIcxP27crejYJ-9la1PAm2MC3tJI7nMYNc=)\n\n\n\n![BkvlFOsBSvT-sSopHFEl25bQ4jpgn_zabU3CCFfOFvQ=](/blobs/BkvlFOsBSvT-sSopHFEl25bQ4jpgn_zabU3CCFfOFvQ=)\n\n\nCurrently, **AFFiNE** has released its [stable version](https://affine.pro/download), but we are continuing to build to a more feature-rich and stable build. **Come and join us on our journey over on our media platforms.**\n\n\n* Official Website:[https://affine.pro/](https://affine.pro/)\n\n\n* GitHub:[https://github.com/toeverything/AFFiNE](https://github.com/toeverything/AFFiNE)\n\n\n* Discord:[https://discord.gg/Arn7TqJBvG](https://discord.gg/Arn7TqJBvG)\n\n\n* Twitter:[https://twitter.com/AffineOfficial](https://twitter.com/AffineOfficial)\n\n\n\n\n\n",
  "publish": true
}