{
  "title": "Top 10 Best WordAi Alternatives & Competitors for AI Writing in 2024",
  "authors": [
    "Yiyang Zhang"
  ],
  "tags": [
    "Content"
  ],
  "description": "Check out these top 10 alternatives and competitors to WordAi for 2024. They're all fantastic options that can help you create some amazing content.",
  "created": 1713484800000,
  "updated": 1713484800000,
  "layout": "blog",
  "id": "x2ArbfSpDHKLPtepF_CoB",
  "slug": "top-10-best-wordai-alternatives-competitors-ai-writing",
  "cover": "/blobs/O1nIzdAXdcY0hq3GHx3qwUxH0sKk-1jwwf81_QzEibA=",
  "md": "---\n\n\ntitle: \"Top 10 Best WordAi Alternatives & Competitors for AI Writing in 2024\"\n\n\nauthor: \"Yiyang Zhang\"\n\n\ntags: Content\n\n\nslug: top-10-best-wordai-alternatives-competitors-ai-writing\n\n\ndescription: \"Check out these top 10 alternatives and competitors to WordAi for 2024. They're all fantastic options that can help you create some amazing content.\"\n\n\ncreated: 2024-04-19\n\n\nupdated: 2024-04-19\n\n\nlayout: blog\n\n\npublish: true\n\n\n---\n\n\n\n![O1nIzdAXdcY0hq3GHx3qwUxH0sKk-1jwwf81_QzEibA=](/blobs/O1nIzdAXdcY0hq3GHx3qwUxH0sKk-1jwwf81_QzEibA=)\n\n\nIn the fast-paced realm of content creation, finding the right tools to elevate your writing prowess is paramount. WordAi, renowned for its utilization of cutting-edge AI technology, has long been a go-to solution for crafting impeccable content with unparalleled ease. However, even the most sophisticated tools may leave users seeking more robust alternatives to meet their evolving needs.\n\n\nWhile WordAi excels in producing polished text that seamlessly blends with human-written content, some users may encounter limitations in its functionality. Perhaps the need for more diverse output styles or finer control over tone and structure arises, prompting exploration beyond the confines of WordAi.\n\n\nAs we venture into 2024, the quest for the perfect [AI writing tools](https://affine.pro/blog/10-best-free-ai-virtual-assistants-improve-productivity) companion intensifies. Whether you're a seasoned blogger, a savvy content marketer, or a discerning business owner, the search for the ideal tool to bolster your content creation endeavors continues. Join us on a journey through the realm of AI-powered writing as we explore a curated selection of WordAi alternatives poised to redefine your approach to content generation, fostering innovation and efficiency along the way.\n\n\n# **What is WordAi?**\n\n\n\n![4uYrf7ODNxMrL0bhDuCZA6IhSw_DafZURIBdG4FLFF4=](/blobs/4uYrf7ODNxMrL0bhDuCZA6IhSw_DafZURIBdG4FLFF4=)\n\n\nWordAi, a cutting-edge writing tool, employs AI to streamline [content creation](https://affine.pro/blog/top-20-free-ai-content-creation-tools). Using advanced algorithms and natural language processing, it crafts top-quality, human-like text, including articles, blog posts, and product descriptions, in mere clicks. Notably, its AI-generated content seamlessly passes as human-written across AI detectors, enhancing content output.\n\n\nHow does WordAI function? It leverages sophisticated machine learning models for rewriting that mimics human content. Just input your content, click 'rewrite,' and within seconds, WordAI generates a polished piece. By utilizing WordAI, you save time while maintaining high-quality outputs.\n\n\nWordAI ensures grammatical accuracy and fluent readability by analyzing sentence and paragraph structures. Moreover, it offers customizable tone and style settings for tailored outputs. Whether scaling content production or refining writing quality, WordAI provides a hassle-free solution.\n\n\n**WordAI's key features:**\n\n\n* **Article Rewrite Feature:** WordAI specializes in rewriting articles, prioritizing this service over content generation.\n\n\n* **Content Authenticity:** Includes a dedicated section to prevent AI-generated content detection within spun articles.\n\n\n* **Bulk Upload and Rewrite:** Allows users to quickly upload saved articles in bulk for efficient rewriting, ensuring the output meets plagiarism standards such as Copyscape.\n\n\n**WordAi's limitations:**\n\n\n* **Expenses for Small Organizations and Individual Users:** Might find it expensive to use.\n\n\n* **Potential SEO Penalties:** Problematic for users needing original content and desire to avoid SEO penalties for duplicated content.\n\n\n* **Lack of Uniqueness:** Content produced by the tool is not always unique.\n\n\n* **Limited Features:** Extra features are not readily available. Users need to contact customer service to request them.\n\n\n# **A Good WordAI Alternative should Include**\n\n\nWhen looking for a good WordAI alternative, there are key features to consider.\n\n\n\n![SuFpSjAhh7VWGtdYZRgZPNJFoifcgRfF7axRGY3zyP0=](/blobs/SuFpSjAhh7VWGtdYZRgZPNJFoifcgRfF7axRGY3zyP0=)\n\n\n* **Advanced Natural Language Processing:** Ensure the tool offers advanced NLP for high-quality content generation.\n\n\n* **User-Friendly Interface:** Look for an easy-to-use interface suitable for all skill levels.\n\n\n* **Customization Options:** Tailor content with options for tone, style, and word count adjustments.\n\n\n* **Integration with Popular Tools:** Seamless integration with other [platforms](https://affine.pro/blog/how-to-create-social-media-content-calendar-free-templates) streamlines workflow.\n\n\n* **Affordability:** Pricing should be reasonable to make the tool accessible.\n\n\n* **Responsive Support and Updates:** Reliable customer support and regular updates ensure a smooth user experience.\n\n\n# **Top 10 Best WordAI Alternatives & Competitors to Try in 2024**\n\n\nSearching for the best WordAI alternatives and competitors to level up your AI writing game in 2024? Look no further! Here are the top 10 options that you should consider trying out this year.\n\n\n## **1. [Notion AI](https://www.notion.so/product/ai)**\n\n\n\n![aF1DFvPEtv0hX5DHz8C2F5tqs3DDFdEdjbbuS8vyQBk=](/blobs/aF1DFvPEtv0hX5DHz8C2F5tqs3DDFdEdjbbuS8vyQBk=)\n\n\nNotion AI is a set of useful AI tools available within Notion's collaborative workspace platform. These tools offer a range of capabilities such as summarizing long texts, generating outlines for blog posts and emails, and turning meeting notes into actionable items. Notion is a versatile productivity tool that is excellent at handling multiple tasks, including project management, documenting product information, and jotting down thoughts.\n\n\n**Key features:**\n\n\n* **Translate documents:** Offer a convenient solution by effortlessly converting words into various languages.\n\n\n* **Summarize documents:** Allow for the automatic generation of concise summaries from text.\n\n\n* **Check for grammar and spelling:** Help you identify and correct any grammar errors in your writing, ensuring that your content is polished and error-free.\n\n\n## **2. [ClickUp AI](https://clickup.com/)**\n\n\n\n![SEdVRIQxgc1bgilFrclOWNrHJ9O3sEMEf1TBxlXxRlo=](/blobs/SEdVRIQxgc1bgilFrclOWNrHJ9O3sEMEf1TBxlXxRlo=)\n\n\nClickUp is a comprehensive project management software that provides numerous customizable features to empower individuals and teams to work more efficiently and increase productivity. Recently, ClickUp has introduced ClickUp AI - an AI-powered content assistant feature. It is a content ideation and creation tool integrated into ClickUp Docs. ClickUp AI helps with [generating ideas](https://affine.pro/blog/best-free-brainstorming-templates-techniques-guide), copywriting, copyediting, summarizing lengthy text, and much more.\n\n\n**Key features:**\n\n\n* **Content research and ideation**: Produce high-quality content instantly for various purposes such as blog posts, emails, advertising copy, and more.\n\n\n* **Copy editing**: Get suggestions for writing improvements to simplify and improve your content.\n\n\n* **Content summarization**: Summarize key points from Docs, tasks, and comments.\n\n\n## **3. [Anyword](https://anyword.com/)**\n\n\n\n![bvIyNrTk-SC9S-9of_i2uKSpYOymIs4qExA3jgra7d8=](/blobs/bvIyNrTk-SC9S-9of_i2uKSpYOymIs4qExA3jgra7d8=)\n\n\nAnyword is software that employs advanced algorithms to analyze customer research, preferences, feedback, and market data, to facilitate the creation of content that satisfies the audience's needs. The software integrates cutting-edge AI technology, such as natural language processing and data-driven algorithms, to generate text that is pertinent to the intended audience, detect duplicate content, and create media materials. Furthermore, Anyword serves as an efficient automatic article spinner and paraphrasing tool, making it one of the top essay rewriter software available on the internet.\n\n\n**Key features:**\n\n\n* **Original content suggestions:** Allow users to create multiple text variations from their previous documents, which can boost customer engagement.\n\n\n* **Plagiarism and content checker:** By generating new data, this feature checks that to increase their conversion rate and that itâ€™s plagiarism-free.\n\n\n* **Blog Project feature:** Help creators turn their content into blog posts by inputting keywords or introductory paragraphs.\n\n\n## **4. [Jasper](https://www.jasper.ai/)**\n\n\n\n![WjIKkt_4ERWZJcrISHw7Dh8cOxmf0_miEGFl9b6gnnE=](/blobs/WjIKkt_4ERWZJcrISHw7Dh8cOxmf0_miEGFl9b6gnnE=)\n\n\nJasper is a popular AI-powered content generator for businesses that helps you create various types of content for marketing purposes. It primarily focuses on generating blog content, but also allows you to create social media posts, articles, emails, ads, and more. Jasper is an AI-based content platform that assists creators and companies of all types to expand their creative potential. Currently, over 105,000 active customers are using Jasper to overcome writer's block, repurpose their content, create original art, and adjust their writing for language and tone.\n\n\n**Key features:**\n\n\n* **Boss Mode**: Generates long content like blog posts, emails, reports, and stories\n\n\n* **Jasper Chat**: Interactive AI chatbot to quickly generate content\n\n\n* **AI Art**: Generates art for thumbnails, illustrations, ads, etc.\n\n\n## **5. [Copy.ai](https://clickup.com/blog/copy-ai-alternatives/)**\n\n\n\n![Z_Nj1J0hTchLCHpMrQDCzlGlIxDoL40fToSp7BUfMqw=](/blobs/Z_Nj1J0hTchLCHpMrQDCzlGlIxDoL40fToSp7BUfMqw=)\n\n\nCopy.ai is a widely recognized AI writing tool that enables users to produce content expeditiously. What distinguishes Copy.ai from other AI writers is its ability to provide precise context, such as the fundamental points to be covered and the brand guidelines to be followed. Moreover, Copy.ai offers an Infobase feature that allows users to conserve crucial information while generating ideas and copy. The Infobase function extracts this data from the content while generating or spinning it based on user commands.\n\n\n**Key features:**\n\n\n* **Data collection**: Real-time data collection with Chat\n\n\n* **Content editor**: Automatically correct your spelling and grammar errors while proofreading\n\n\n* **Prompts**: Pre-built prompts can help in generating quality outputs for tasks such as writing blogs or creating AI-generated bios\n\n\n## **6. [AIContenfy](https://aicontentfy.com/)**\n\n\n\n![-LHXWshb6U7BR_r2-1haHr5mwQnhHDksG896WJzw6pc=](/blobs/-LHXWshb6U7BR_r2-1haHr5mwQnhHDksG896WJzw6pc=)\n\n\nAIContenfy is a sophisticated tool that uses state-of-the-art natural language processing (NLP) algorithms and machine learning (ML) models to produce tailored content for businesses. This tool can generate diverse types of content, such as articles and blog posts, and enables users to define the tone, style, and target audience they desire. The tool will then create content that meets these requirements.\n\n\n**Key features:**\n\n\n* **Efficient Scalability:** AIContenfy is excellent at generating content at scale, allowing businesses to quickly produce large volumes and allocate resources to other operational areas.\n\n\n* **Cost-Effective Content Creation:** Cost-effective compared to hiring human writers, resulting in significant savings in content creation costs for businesses.\n\n\n* **Enhanced SEO Optimization:** AIContenfy generates content rich in relevant keywords, improving visibility and rankings on SERPs for businesses' SEO efforts.\n\n\n## **7. [HIX.AI](https://hix.ai/)**\n\n\n\n![nOUa0c17viqUT3NDvjEcjD-IY4WJgoXrZheruCgAg5g=](/blobs/nOUa0c17viqUT3NDvjEcjD-IY4WJgoXrZheruCgAg5g=)\n\n\nHIX.AI is an exceptional all-in-one AI writing assistant that offers over 120 specialized text-generation tools. These tools can cater to a wide range of content creation requirements in more than 50 languages, including writing [social media posts](https://affine.pro/blog/how-to-create-social-media-content-calendar-free-templates), and emails, and generating blog post ideas. Additionally, HIX.AI features a long-form article writer who can proficiently create SEO-friendly, up-to-date, and fact-based content.\n\n\n**Key features:**\n\n\n* **ChatGPT-like chatbot:** Chatbot with web access that summarizes webpages, YouTube videos, and PDF files.\n\n\n* **An AI text editor:** Offer 3 unique modes for an immersive AI writing experience as well as a grammar checker and a plagiarism checker.\n\n\n* **Grammar checker:** Identify and correct grammar errors in your writing, ensuring polished content.\n\n\n## 8. **[Copymate](https://copymate.app/)**\n\n\n\n![3rZlgp3SNKuK9GVebC6jse0-1pGWOmuTcBWf0Vghd9g=](/blobs/3rZlgp3SNKuK9GVebC6jse0-1pGWOmuTcBWf0Vghd9g=)\n\n\nCopymate is an AI-powered SEO content generator that enables users to produce high-quality, SEO-optimized articles in a matter of minutes, without any additional effort. It boasts a range of features, including bulk article generation, WordPress integration, multilingual content creation, and support for the GPT-4 language model. The professional community has reviewed Copymate positively, with a trust score of 4.8. Copymate offers several pricing plans, including a free plan, and has helped [businesses](https://affine.pro/blog/top-10-free-competitive-analysis-templates-boost-your-business) increase their organic traffic by up to 10,000%, while simultaneously cutting content marketing costs by up to 98%.\n\n\n**Key features:**\n\n\n* **Multilingual:** Create content in multiple languages without language knowledge.\n\n\n* **SEO Optimized:** Generates content that is optimized for search engines.\n\n\n* **Multisite Management:** Manage content for an unlimited number of websites.\n\n\n## **9. [Rytr](https://rytr.me/)**\n\n\n\n![IrlBZ0WJYRjmvL5A2NuqwEKYrfLBadjxND3CaMfrHe0=](/blobs/IrlBZ0WJYRjmvL5A2NuqwEKYrfLBadjxND3CaMfrHe0=)\n\n\nRytr is an exceptional AI-powered writing tool that provides excellent value for its cost. It offers the most generous free plan available and paid options at reasonable rates, making it an affordable and high-quality solution. Rytr is specifically designed to create high-quality content with ease, making it ideal for website copy, marketing materials, and blog posts. This online platform [streamlines the writing process](https://affine.pro/blog/top-10-best-process-mapping-tools-software-2023-free-paid), providing features like SEO meta descriptions, blog outlines, and social media ad copy with just one click. Rytr AI assists millions of users, including copywriters, marketers, and entrepreneurs, in crafting top-notch content.\n\n\n**Key features:**\n\n\n* **Document management:** Within this dashboard, you can neatly categorize your ongoing projects into folders and documents.\n\n\n* **AI writer:** Rytr supports over 30 languages, from English and Spanish to Chinese, Arabic, and more.\n\n\n* **Multiple user cases:** Rytr supports 40+ use cases across diverse industries.\n\n\n## **[10. AFFiNE](https://affine.pro/)**\n\n\n\n![5VZZiy69UNGfpn8KOwMVuvVmBr6icqfRjmd42C36r9g=](/blobs/5VZZiy69UNGfpn8KOwMVuvVmBr6icqfRjmd42C36r9g=)\n\n\nAFFiNE is a versatile editor that lets you write, draw, plan, and present all in one place. It offers a page mode for straightforward document editing, a database to organize projects, a [whiteboard](https://affine.pro/blog/10-best-whiteboard-layout-ideas-boost-your-productivity) feature to brainstorm ideas and advanced AI writing capabilities. Meet AFFiNE AI, your ultimate companion for writing, drawing, and presenting. With AFFiNE AI, you get an AI partner that enhances your capabilities across various creative tasks, streamlines your workflow, and amplifies your creativity. It's like having Notion AI, Miro AI, Figma AI, Canva AI, and Clickup AI all rolled into one comprehensive platform.\n\n\n**Key features of AFFiNE AI:**\n\n\n* **AI Chatbox:** Receive instant insights and support across your projects with AFFiNE AI's intuitive chatbox. Seamlessly integrated into your documents and whiteboards, it provides real-time assistance and acceleration. Whether you're brainstorming ideas or organizing tasks, simply ask a question and receive [immediate responses](https://affine.pro/blog/10-free-project-communication-plan-templates-examples). For example, jot down your daily task list on one page, then effortlessly inquire about your plans for the day on another using the chatbox.\n\n\n\n![TixIkRzZgGOIrsqcfRoj1ZrH4_tQmDu27NQGaKyOR7U=](/blobs/TixIkRzZgGOIrsqcfRoj1ZrH4_tQmDu27NQGaKyOR7U=)\n\n\n* **AI-Generated Visuals:** Elevate your presentations and content creation with AFFiNE AI's unparalleled visual capabilities. Craft polished, presentation-ready slides with just one click, eliminating the need for tedious manual design work. From drawing images for articles to creating mind maps, flow charts, or professional slides, AFFiNE AI simplifies the process, allowing you to focus on content rather than formatting.\n\n\n\n![uLPLW1mOWz9QB-t3JOzIPWbHWNWTxiz9bLWL7xUXqWU=](/blobs/uLPLW1mOWz9QB-t3JOzIPWbHWNWTxiz9bLWL7xUXqWU=)\n\n\n* **AI Writer:** Perfect your writing effortlessly with AFFiNE AI's advanced AI Writer feature. Say goodbye to spelling and grammar errors, tone inconsistencies, and lengthy editing sessions. With AFFiNE AI, you can translate content, adjust the length, improve clarity, generate action items, and even create drafts, outlines, or timelines with ease. Whether it's crafting social media posts or penning creative stories, AFFiNE AI empowers you to express yourself confidently and efficiently.\n\n\n\n![XhwBfbXzNmPOjL70F28JGgQizULkEy6j45lW63QPypE=](/blobs/XhwBfbXzNmPOjL70F28JGgQizULkEy6j45lW63QPypE=)\n\n\n* **Make it Real:** Turn your ideas into reality with AFFiNE AI's innovative \"Make it Real\" feature. From concept to completion, unleash your creativity and experimentation. Whether you're prototyping a working dial clock, developing a game like Snake or Pong, or tackling any other project, AFFiNE AI provides the tools and resources to bring your vision to life. Experience the thrill of innovation and exploration with AFFiNE AI's \"Make it Real\" feature.\n\n\n\n![gqD9utTt5E1cpxMgjZjnzUKZ9SPmLP7O29mQ_c2dCIk=](/blobs/gqD9utTt5E1cpxMgjZjnzUKZ9SPmLP7O29mQ_c2dCIk=)\n\n\nWith AFFiNE AI, the future of creativity is here. Experience the power of AI-driven innovation as you unlock new possibilities and achieve unparalleled efficiency in your creative endeavors. Say hello to a smarter, faster, and more inspiring way to write, draw, and present with AFFiNE AI by your side.\n\n\n# **Pick the Best WordAI Alternative for Your Needs**\n\n\nIn the realm of AI writing tools, having a range of options is invaluable. As we navigate through 2024, the landscape of WordAI alternatives has flourished, offering users a diverse array of solutions tailored to their unique needs. From adaptable content generation to advanced language processing capabilities, there's a plethora of alternatives and competitors worth exploring. Each platform brings its own set of strengths and features, catering to different preferences and requirements.\n\n\nHowever, for those seeking a comprehensive AI writing solution that seamlessly combines cutting-edge technology with a user-friendly interface and robust support, AFFiNE emerges as a standout choice. With its powerful algorithms, customizable settings, and seamless integration options, AFFiNE empowers users to efficiently and effectively create high-quality content.\n\n\nPresently,**AFFiNE** has launched its [**Stable Version**](https://affine.pro/download), with ongoing efforts to develop a more comprehensive and dependable iteration. Join us on our voyage through our social media channels and be part of the experience. **Come and join us on our journey over on our media platforms. ðŸš€**\n\n\n* Official Website: [https://affine.pro/](https://affine.pro/)\n\n\n* GitHub: [https://github.com/toeverything/AFFiNE](https://github.com/toeverything/AFFiNE)\n\n\n* Discord: [https://discord.gg/Arn7TqJBvG](https://discord.gg/Arn7TqJBvG)\n\n\n* Twitter: [https://twitter.com/AffineOfficial](https://twitter.com/AffineOfficial)\n\n\n\n\n\n",
  "publish": true
}