{
  "title": "Top 10 Notion Alternatives for your own and your team (free and paid competitors)",
  "authors": [
    "AFFiNE"
  ],
  "tags": [
    "Content"
  ],
  "description": "Notion is a popular note-taking and collaboration tool that has gained a lot of attention in recent years. However, it's not the only option out there.",
  "created": 1679443200000,
  "updated": 1679443200000,
  "layout": "blog",
  "id": "BLVBW5vhN-",
  "slug": "top-ten-notion-alternatives-for-you-and-your-team-free-and-paid",
  "cover": null,
  "md": "---\n\ntitle: Top 10 Notion Alternatives for your own and your team (free and paid competitors)\n\nauthor: AFFiNE\n\ntags: Content\n\nslug: top-ten-notion-alternatives-for-you-and-your-team-free-and-paid\n\ndescription: Notion is a popular note-taking and collaboration tool that has gained a lot of attention in recent years. However, it's not the only option out there.\n\ncreated: 2023-03-22\n\nupdated: 2023-03-22\n\nlayout: blog\n\npublish: false\n\n---\n\n# Top 10 Notion Alternatives for You and Your Team\n\nNotion is a popular all-in-one workspace that offers a wide range of tools for managing projects, taking notes, and collaborating with teams. However, if you're looking for an alternative to Notion, there are many great options available. In this article, we'll take a look at the top 10 Notion alternatives for you and your team.\n\n## 1. AFFiNE\n\nAFFiNE is a next-generation knowledge base that serves as an open source, privacy-focused, local-first alternative to Notion. With AFFiNE, you can create workspaces and docs in plain text, Markdown, and blocks, including text, headings, images, databases, to-do lists, and numbered lists. AFFiNE offers seamless switching between Paper and Edgeless modes, empowering your workspace with powerful benefits such as online synchronization, multiplayer collaboration, and the ability to share your workspaces online with others. AFFiNE's flexibility and customizability make it a great choice for teams looking to streamline their workflow and collaboration.\n\n## 2. ClickUp\n\nClickUp is a project management and productivity tool that offers a wide range of features, including task management, time tracking, and project analytics. ClickUp's interface is user-friendly, and it offers a customizable dashboard and a wide range of integrations. ClickUp also offers automation features and templates, making it easy to set up your workflow and collaborate with your team.\n\n## 3. Trello\n\nTrello is a popular project management tool that offers a simple and intuitive interface. With Trello, you can create boards, lists, and cards to manage your projects and tasks. Trello also offers a wide range of integrations and a mobile app, making it easy to collaborate with your team on the go.\n\n## 4. Airtable\n\nAirtable is a powerful spreadsheet and database tool that offers a flexible and customizable interface. With Airtable, you can create tables, views, and fields to manage your data and collaborate with your team. Airtable also offers a wide range of integrations and templates, making it easy to get started.\n\n## 5. Google Workspace\n\nGoogle Workspace (formerly G Suite) is a suite of productivity tools that includes Google Docs, Google Sheets, and Google Slides. With Google Workspace, you can create and collaborate on documents, spreadsheets, and presentations in real-time. Google Workspace also offers email, calendar, and other productivity tools.\n\n## 6. Quip\n\nQuip is a collaborative productivity tool that offers a mix of document editing and messaging features. With Quip, you can create and edit documents, spreadsheets, and presentations in real-time, and you can also chat and collaborate with your team. Quip also offers a mobile app and integrations with other productivity tools.\n\n## 7. Zoho\n\nZoho is a suite of productivity and business tools that includes Zoho Writer, Zoho Sheet, and Zoho Show. With Zoho, you can create and collaborate on documents, spreadsheets, and presentations in real-time. Zoho also offers email, calendar, and other productivity tools, making it a great choice for businesses.\n\n## 8. Coda\n\nCoda is a powerful all-in-one workspace that offers a mix of document editing and database features. With Coda, you can create and edit documents, spreadsheets, and presentations, and you can also create custom apps and workflows. Coda also offers a wide range of integrations and templates.\n\n## 9. Notability\n\nNotability is a powerful note-taking app that offers a wide range of features, including handwriting recognition, audio recording, and PDF annotation. With Notability, you can take notes, draw sketches, and annotate PDFs on your mobile device or computer. Notability also offers a wide range of customization options, including different paper types and colors, making it easy to personalize your notes. With iCloud syncing, you can access your notes from any device, and you can also share your notes with others.\n\n## 10. Bear\n\nBear is a popular note-taking app that offers a clean and minimalist interface. With Bear, you can create and organize notes in a variety of formats, including plain text, Markdown, and rich text. Bear also offers a wide range of customization options and a mobile app, making it easy to take notes on the go.\n\n## Conclusion\n\nIn conclusion, there are many great alternatives to Notion available, ranging from powerful project management tools like ClickUp and Trello, to flexible database tools like Airtable and Coda, to powerful note-taking apps like Notability and Bear. Whether you're looking for a free or paid option, there's a Notion alternative out there that can help you and your team stay organized, productive, and collaborative. So why not give one of these top 10 Notion alternatives a try? You might just find a new favorite tool to help you achieve your goals.\n\n",
  "publish": false
}