{
  "title": "Unlock Your Career Potential: 10 Professional Goals to Take Your Success to the Next Level ",
  "authors": [
    "Yanxi Liu"
  ],
  "tags": [
    "Content"
  ],
  "description": null,
  "created": 1708300800000,
  "updated": 1708300800000,
  "layout": "blog",
  "id": "83EHEFdWbxJDfZ10xGuoy",
  "slug": "unlock-your-career-potential-10-professional-goals-to-take-your-success-to-the-next-level",
  "cover": "https://insider.affine.pro/api/workspaces/qf73AF6vzWphbTJdN7KiX/blobs/BcaUf7GSsG0tqd0h7WNFa1gK0PdDCdx0TbFeBo4bsSc=.webp",
  "md": "---\n\ntitle: \"Unlock Your Career Potential: 10 Professional Goals to Take Your Success to the Next Level \"\n\nauthor: \"Yanxi Liu\"\n\ntags: Content\n\nslug: unlock-your-career-potential-10-professional-goals-to-take-your-success-to-the-next-level\n\nDescription: \"Discover 10 professional goals that can elevate your career and bring you closer to achieving your desired success.\"\n\ncreated: 2024-02-19\n\nupdated: 2024-02-19\n\nlayout: blog\n\npublish: true\n\n---\n\n\n![BcaUf7GSsG0tqd0h7WNFa1gK0PdDCdx0TbFeBo4bsSc=](https://insider.affine.pro/api/workspaces/qf73AF6vzWphbTJdN7KiX/blobs/BcaUf7GSsG0tqd0h7WNFa1gK0PdDCdx0TbFeBo4bsSc=)\n\nSetting professional goals is crucial for career advancement, job satisfaction, skill enhancement, and salary growth. Whether it's small, incremental improvements in your current role or ambitious long-term plans for career transitions, there are numerous examples of professional goals that apply to any industry. By understanding these examples, you can set smarter goals that align with your aspirations and achieve them within your desired timeframe.\n\nIn this article, we'll explore the significance of professional goals and provide 10 practical examples to inspire your own career development.\n\n# What makes an effective professional goal?\n\nProfessional goals are objectives that you set for yourself to propel your career forward. They encompass a wide range of actions and aspirations aimed at enhancing your professional growth and success. These goals can include acquiring new skills, expanding your professional network, seeking career advancement opportunities, improving job satisfaction, and achieving personal fulfillment in your work.\n\nAn [effective](https://affine.pro/blog/crafting-an-effective-one-page-marketing-plan-a-step-by-step-guide) professional goal incorporates the [SMART](https://affine.pro/blog/write-smart-goals-step-by-step-guide-definition-templates) framework, which stands for Specific, Measurable, Achievable, Relevant, and Time-bound.\n\n# Why are professional development goals important?\n\n1. **Clarity and Focus:** Setting professional goals provides clarity and focus by defining what you want to achieve in your career. It helps you identify your priorities, align your efforts, and concentrate on activities that contribute to your desired outcomes. Having a clear direction allows you to make informed decisions and avoid distractions.\n1. **Motivation and Drive:** Professional goals serve as a source of motivation and drive. When you have clear objectives, you are more likely to feel inspired and committed to taking action. Goals provide a sense of purpose and a [roadmap](https://affine.pro/blog/5-best-free-tools-agile-roadmap-templates-2023) for progress, keeping you motivated during challenging times and helping you stay on track towards achieving your desired outcomes.\n1. **Personal and Professional Growth:** Setting and working towards professional goals promotes personal and professional growth. It pushes you out of your comfort zone, encourages continuous learning and development, and allows you to acquire new skills and knowledge. As you achieve your goals, you gain confidence, expand your capabilities, and open doors to new opportunities for advancement and success.\n# How to set professional goals that you can achieve\n\n\n![2qQd-IhmN6yV2lOQFq_EGqsME9RbJMtsrQcEg1-CKpY=](https://insider.affine.pro/api/workspaces/qf73AF6vzWphbTJdN7KiX/blobs/2qQd-IhmN6yV2lOQFq_EGqsME9RbJMtsrQcEg1-CKpY=)\n\n1. **Self-Reflection and Assessment:** Begin by reflecting on your values, interests, strengths, and areas for improvement. Assess your current skills, knowledge, and experience.\n1. **Define Specific and Measurable Goals:**Make your goals specific and measurable. Instead of setting a vague goal like \"[improve communication skills](https://affine.pro/blog/top-asynchronous-communication-tools-free-2024),\" specify it as \"attend a communication skills workshop and deliver a presentation to a large audience within six months.\" This clarity will make your goals more tangible and make it easier to track progress.\n1. **Break Down Goals into Actionable Steps:** Divide your goals into smaller, actionable steps. Break down each goal into manageable tasks or milestones.\n1. **Set Realistic and Time-Bound Deadlines:** Ensure that your goals are realistic and achievable within a given timeframe. Consider your current commitments, resources, and limitations.\n1. **Seek Support and Accountability:**Share your goals with a mentor, coach, or trusted colleague who can provide guidance and support.\n1. **Regularly Review and Adjust:** Periodically review your goals and assess your progress. Celebrate achievements and identify areas where adjustments may be needed. Be flexible and willing to adapt your goals as circumstances change or new opportunities arise.\n# Exploring 10 Examples of Professional Goals for Students, Project Managers, and Software Engineer\n\n## Professional Goals for Students:\n\n* **Obtain an internship in a reputable company to gain practical experience in your field of study.**\nThis goal focuses on securing an internship opportunity that allows students to apply their theoretical knowledge in a real-world setting.\n\nAn internship provides students with hands-on experience, exposure to industry practices, and an opportunity to build professional networks. By obtaining an internship in a reputable company, students can gain practical skills, learn from experienced professionals, and enhance their employability.\n\n* **Improve your communication and presentation skills by actively participating in public speaking events or joining a debate club.**\nThis goal emphasizes the development of effective communication and presentation skills, which are essential for success in various professional settings. [Effective](https://affine.pro/blog/crafting-an-effective-one-page-marketing-plan-a-step-by-step-guide) communication and presentation skills are crucial in conveying ideas, collaborating with others, and influencing stakeholders. By actively participating in public speaking events or joining a debate club, students can enhance their confidence, articulation, and ability to express themselves clearly and persuasively.\n\n* **Achieve a high GPA and academic excellence by dedicating sufficient time to studying and seeking help when needed.**\nThis goal focuses on academic success and emphasizes the importance of dedicating time and effort to studies. A high GPA and academic excellence demonstrate a student's dedication, discipline, and mastery of the subject matter.\n\n* **Develop strong networking skills by actively participating in industry events and building connections with professionals in my field.**\nThis goal focuses on the development of networking skills, which are crucial for career growth and opportunities. Building a strong professional network can open doors to internships, job opportunities, and mentorship. Developing networking skills involves [effective](https://affine.pro/blog/crafting-an-effective-one-page-marketing-plan-a-step-by-step-guide) communication, active listening, and maintaining professional relationships, which can greatly benefit students in their future careers.\n\n## Professional Goals for Project Managers:\n\n* **Successfully complete a project within the allocated budget and timeline, ensuring client satisfaction.**\nThis goal centers around [project management skills](https://affine.pro/blog/how-to-create-a-project-timeline-template-in-excel-step-by-step-guide), with a focus on delivering projects on time, within budget, and meeting client expectations. As a project manager, successfully completing projects within the allocated resources demonstrates effective planning, coordination, and execution. It involves managing stakeholders, allocating resources efficiently, mitigating risks, and [maintaining clear communication](https://affine.pro/blog/top-asynchronous-communication-tools-free-2024) with the team and clients to ensure project success and client satisfaction.\n\n* **Enhance leadership skills by attending management training programs and taking on more responsibility in project planning and execution.**\nThis goal emphasizes the development of leadership skills and taking on additional responsibilities in [project management](https://affine.pro/blog/how-to-create-a-project-timeline-template-in-excel-step-by-step-guide). Leadership skills are essential for project managers to inspire and guide their teams towards achieving project goals. By attending management training programs, project managers can enhance their leadership competencies, learn new techniques, and stay updated with industry best practices.\n\n* **Improve team collaboration and communication by implementing effective project management tools and methodologies.**\nThis goal focuses on enhancing collaboration and communication within project teams through the implementation of [efficient project management tools](https://affine.pro/blog/10-best-airtable-alternatives-to-manage-your-project-free-paid) and methodologies. Effective team collaboration and communication are crucial for project success.\n\n## Professional Goals for Software Engineers:\n\n* **Enhance programming skills by learning a new programming language or mastering a specific technology stack.**\nThis goal emphasizes the continuous improvement of programming skills and staying updated with emerging technologies.\n\n* **Contribute to open-source projects to expand my knowledge and gain recognition within the software development community.**\nThis goal focuses on actively participating in [open-source projects](http://affine.pro) to broaden knowledge and establish a reputation within the software development community. [Open-source projects](http://affine.pro) provide opportunities for software engineers to collaborate with others, contribute code, and gain exposure to different software development practices.\n\n* **Improve software testing and quality assurance skills by implementing automated testing frameworks and following industry best practices.**\nThis goal emphasizes the importance of software testing and quality assurance and aims to enhance these skills through the implementation of automated testing frameworks and adherence to industry best practices.\n\n# **Begin Your Professional Goal Setting Journey with AFFiNE**\n\nCareer success starts with organized and effective planning. If you're looking for a way to keep your professional goals organized, consider using project management software ---AFFiNE. Powerful software like AFFiNE can help connect your day-to-day [scheduling](https://affine.pro/blog/top-10-best-agile-project-scheduling-software-2023) to long-term career success.\n\n\n\n<div style=\"text-align:center;\">\n\n<iframe width=\"560\" height=\"315\" src=\"https://www.youtube.com/embed/3cfeKOufZWU?si=IiXDIdwfnM2Z7KPL\" title=\"YouTube video player\" frameborder=\"0\" allow=\"accelerometer; autoplay; clipboard-write; encrypted-media; gyroscope; picture-in-picture; web-share\" allowfullscreen></iframe>\n\n</div>\n\n\n\n**Here are the key features of AFFiNE**\n\n* **Rich Template Gallery:** AFFiNE offers a rich template gallery, providing a wide range of templates to help people manage tasks, stay focused, and improve their efficiency. Many of these tools are geared towards scheduling reminders and [mind mapping](https://affine.pro/blog/top-5-mind-maps-examples-and-tools), allowing users to use AFFiNE to assist them in enhancing their productivity.\n\n![jjB7kqXvP0yEK84H4crT5VV3sVZXar6GvT5CQ1faGvs=](https://insider.affine.pro/api/workspaces/qf73AF6vzWphbTJdN7KiX/blobs/jjB7kqXvP0yEK84H4crT5VV3sVZXar6GvT5CQ1faGvs=)\n\n[AFFiNE Project Planning Template](http://affine.pro)\n\n\n![szqAEHcp8xW5WCdIZM833AaUTbgbRhAN2vpl6fmHw1E=](https://insider.affine.pro/api/workspaces/qf73AF6vzWphbTJdN7KiX/blobs/szqAEHcp8xW5WCdIZM833AaUTbgbRhAN2vpl6fmHw1E=)\n\n[AFFiNE Gantt Chart Template](http://affine.pro)\n\n* **Write, [Draw](https://affine.pro/blog/best-free-digital-whiteboard-apps-2023), and [Plan](https://affine.pro/blog/best-project-planning-tools-software-for-teams-2023) All-in-One:** Enjoy your all-in-one KnowledgeOS solution for effortlessly writing, drawing, and planning on a hyper-fused platform. It supports [kanban](https://affine.pro/blog/affine-080-launch-week-day3), table, and rich-text paragraphs as building blocks to form pages or whiteboards. It carries out integrated processing here in document editing, data processing, or brainstorming.\n\n![O88V12dZ7eALpdMD8-6eyyfRec5yZyWiQxCnvNEb3r0=](https://insider.affine.pro/api/workspaces/qf73AF6vzWphbTJdN7KiX/blobs/O88V12dZ7eALpdMD8-6eyyfRec5yZyWiQxCnvNEb3r0=)\n\n* **[Collaborative Capabilities:](https://affine.pro/blog/affine-0-10-0-launch-week-day-5-5-stable-with-cloud-support-finally-available-to-every-pro-in-your-team) The app should have collaborative features for group work, making it easy to share and coordinate projects with others**.\n  \n![71MN7zgKOg2C73idwSU66YEnVUK8x41Jqwwe2z9CiPU=](https://insider.affine.pro/api/workspaces/qf73AF6vzWphbTJdN7KiX/blobs/71MN7zgKOg2C73idwSU66YEnVUK8x41Jqwwe2z9CiPU=)\n\nAFFiNE is your comprehensive solution for all your professional needs, providing a range of tools and features to support you in goal-setting and project management. Whether you're an individual striving for personal growth or part of a team working towards a common objective, AFFiNE offers the resources and support you need to succeed. Currently, AFFiNE has launched its [Stable Version](https://affine.pro/download), with ongoing efforts to develop a more comprehensive and dependable iteration. Join us on our voyage through our social media channels and be part of the experience. Come and join us on our journey over on our media platforms. ðŸš€\n\n* Official Website:[https://affine.pro/](https://affine.pro/)\n* GitHub:[https://github.com/toeverything/AFFiNE](https://github.com/toeverything/AFFiNE)\n* Discord:[https://discord.gg/Arn7TqJBvG](https://discord.gg/Arn7TqJBvG)\n* Twitter:[https://twitter.com/AffineOfficial](https://twitter.com/AffineOfficial)\n",
  "publish": true
}