{
  "title": "What’s new — AFFiNE- 20230615",
  "authors": [
    "Jackie Peng"
  ],
  "tags": [
    "Release Note"
  ],
  "description": "AFFiNE is the alternative of Notion, Miro, and Monday, this article introduces what’s new, and what updates, Improvements, and bug fixes have been released in the new beta version.",
  "created": 1686700800000,
  "updated": 1686787200000,
  "layout": "blog",
  "id": "spj0FBmoL_",
  "slug": "what-is-new-affine-0615",
  "cover": "/blobs/ODVElxKQM0fH_YYsvHDg6eas3d1mV5XGJFMThEEIc1Q=",
  "md": "---\n\n\ntitle: \"What’s new — AFFiNE- 20230615\"\n\n\nauthor: Jackie Peng\n\n\ntags: Release Note\n\n\nslug: what-is-new-affine-0615\n\n\ndescription: AFFiNE is the alternative of Notion, Miro, and Monday, this article introduces what’s new, and what updates, Improvements, and bug fixes have been released in the new beta version.\n\n\ncreated: 2023-06-14\n\n\nupdated: 2023-06-15\n\n\nlayout: blog\n\n\npublish: true\n\n\n---\n\n\n\n![ODVElxKQM0fH_YYsvHDg6eas3d1mV5XGJFMThEEIc1Q=](/blobs/ODVElxKQM0fH_YYsvHDg6eas3d1mV5XGJFMThEEIc1Q=)\n\n\nThe beta version is the right version if you are looking to test and provide feedback on some of our upcoming features and help us check for bugs. It incorporates improvements from the Canary Version.\n\n\n**Note that the subdoc blocks the upgrade of blocksuite, so the new features related to the editor can not be delivered in this beta.**\n\n\n## 1.What’s new\n\n\nHello to all AFFiNE users, whether you use it individually, with friends and family, or as part of a team.We are thrilled to announce the introduction of the new AFFiNE beta version, incorporating a range of significant changes that we have been diligently working on behind the scenes for the past two weeks.\n\n\n### 1) **New features**\n\n\nExciting updates in AFFiNE: **PDF export**, **improved image preview**, and more stable **Notion import support**. Enhance your workflow with seamless sharing, enhanced visuals, and easy migration from Notion. Experience the power of AFFiNE today!\n\n\n### 2) **Improvements**\n\n\nOur latest improvement to AFFiNE brings **a series of iterations and optimizations** in terms of the **date picker and some tiny UI stuff**.\n\n\n### 3) Bug fixed\n\n\nA series of bugs have been fixed, which allow more slick and intuitive use of AFFiNE for our users.\n\n\n## 2.To get started, download the latest beta version\n\n\n\n![qpX169_eqhVDO9Q4osG8vK1ByKjzVjVrFjmfLeuOhgI=](/blobs/qpX169_eqhVDO9Q4osG8vK1ByKjzVjVrFjmfLeuOhgI=)\n\n\n* We invite you to download the beta version first to embark on an exciting journey with our latest enhancements. This will allow you to be among the first to experience the positive benefits we have in store for our valued users.\n\n\n* Want to learn how to get even more out of AFFiNE? Join the conversation in our growing AFFiNE community and get inspired by others, give feedback, or ask any questions you may have.\n\n\n## 3.Detailed iteration\n\n\n### 1) New Features\n\n\n* **Notion/html/markdown/.db import-supported**\n\n\n  * Effortlessly import Notion, HTML, or Markdown content into AFFiNE with just a few simple clicks, preserving formatting, and structure, and saving time, enhancing user experience. Say goodbye to the complicated process of manually converting and adjusting content.\n\n\n  * Link: [https://github.com/toeverything/AFFiNE/pull/2533](https://github.com/toeverything/AFFiNE/pull/2533)\n\n\n  * Note that importing from notion is still experimental (particularly the database import is invalid), and now only supports page-by-page import, which may cause some inconvenience. We welcome any feedback from our users.\n\n\n  \n![Funez4FG6_YYPlgBYoKy3M7F2NJLCtwrE7NplHuuB4Q=](/blobs/Funez4FG6_YYPlgBYoKy3M7F2NJLCtwrE7NplHuuB4Q=)\n\n\n* **PDF, HTML and Markdown export-supported**\n\n\n  * In addition to the existing HTML and markdown export capabilities, we're excited to introduce the new PDF form export feature, With the PDF form export, you can now easily convert your AFFiNE documents into professional-looking PDF files.\n\n\n  * Link: [https://github.com/toeverything/AFFiNE/pull/2604](https://github.com/toeverything/AFFiNE/pull/2604)\n\n\n\n![MO01mtAJREMMi_m1T4ZYdnWg16vA-3_z2zG4hFcRet0=](/blobs/MO01mtAJREMMi_m1T4ZYdnWg16vA-3_z2zG4hFcRet0=)\n\n\n* **Image preview support**\n\n\n  * Currently, AFFiNE has introduced an exciting new feature: image preview support. When uploading images to AFFiNE, you can conveniently preview the details and ensure that your visuals are perfectly aligned with your content. This feature provides a seamless and streamlined workflow, saving your time and effort.\n\n\n  * Link: [https://github.com/toeverything/AFFiNE/pull/2604](https://github.com/toeverything/AFFiNE/pull/2604)\n\n\n\n![AFdk4NfmR13AJkQvu-EghIEnSu8-YNsfJkAlCxI3npY=](/blobs/AFdk4NfmR13AJkQvu-EghIEnSu8-YNsfJkAlCxI3npY=)\n\n\n### 2) Improvements\n\n\n* **Featuring an all-page UI update with filter options**\n\n\n  * Users can now effortlessly access the all-page, which enables them to conveniently sort previous articles in ascending or descending order, or favourites with the filter function. Enjoy efficient organization, quick access to desired content, and a seamless browsing experience.\n\n\n  * Link: [https://github.com/toeverything/AFFiNE/pull/2510](https://github.com/toeverything/AFFiNE/pull/2510) ; [https://github.com/toeverything/AFFiNE/pull/2644](https://github.com/toeverything/AFFiNE/pull/2644)\n\n\n\n![1g2H5Hhy5gspGUGP2LnD5e2O2dyKzVpE-6rvabbR5oA=](/blobs/1g2H5Hhy5gspGUGP2LnD5e2O2dyKzVpE-6rvabbR5oA=)\n\n\n* New preloading content within the edgeless mode to showcase the possibility of using AFFiNE\n\n\n  * The new preloading content within edgeless mode has been uploaded. It embodies the potential and possibilities our users can unleash with the use of AFFiNE. Here, everything you see is achievable.\n\n\n  * Link: [https://github.com/toeverything/blocksuite/pull/2575](https://github.com/toeverything/blocksuite/pull/2575)\n\n\n  * Please note that you are encouraged to create a new workspace to trigger this new content in edgeless mode considering there may exist issues that cause the disappearance of it in the original one.\n\n\n\n![6ANoWk9Wn5mf2IsgS-yy-MRN-cf1iRf4VZfF9ihUAgs=](/blobs/6ANoWk9Wn5mf2IsgS-yy-MRN-cf1iRf4VZfF9ihUAgs=)\n\n\n### 3) Bug fixed\n\n\n* Fixed: toolbar does not trigger in Edgeless mode in some cases\n\n\n  * Details: The problem of not being able to trigger the toolbar within Edgeless mode has now been solved, users now can be preoccupied with what really matters to them.\n\n\n  * Link: [https://github.com/toeverything/blocksuite/pull/2995](https://github.com/toeverything/blocksuite/pull/2995)\n\n\n* Fixed: the top padding should be draggable\n\n\n  * Details: We have fixed an issue where the top padding was not draggable in AFFiNE. Now, you can easily drag the top padding to your desired location, allowing for better customization and layout options.\n\n\n  * Link: [https://github.com/toeverything/AFFiNE/pull/2688](https://github.com/toeverything/AFFiNE/pull/2688)\n\n\n* Fixed: use react-resizable-panels\n\n\n  * Details: This new library enhances the panel resizing functionality, providing a smoother and more intuitive user experience. Now, you can effortlessly resize panels within AFFiNE, adjusting their size and layout according to your preference.\n\n\n  * Link: [https://github.com/toeverything/AFFiNE/pull/2679](https://github.com/toeverything/AFFiNE/pull/2679)\n\n\n* Fixed: incorrect row selection when changing row order\n\n\n  * Details: We have addressed the issue of incorrect row selection when changing the order, ensuring accurate and hassle-free rearrangement of your rows. You may Enjoy the convenience of effortlessly organizing your content.\n\n\n  * Link: [https://github.com/toeverything/blocksuite/pull/2959](https://github.com/toeverything/blocksuite/pull/2959)\n\n\n* Fixed: import workspace may only show the default preload page\n\n\n  * Details: We have fixed an issue in AFFiNE where importing a workspace database file would sometimes result in only the default \"preload\" page being shown. This problem has now been resolved, ensuring that all contents of the imported workspace are properly loaded.\n\n\n  * Link: [https://github.com/toeverything/AFFiNE/pull/2685](https://github.com/toeverything/AFFiNE/pull/2685)\n\n\n* Fixed: database multi-select tab close icon invisible\n\n\n  * Details: We have resolved the issue where the close icon for multi-select tabs in the database was not visible, ensuring effortless navigation and efficient data handling.\n\n\n  * Link: [https://github.com/toeverything/blocksuite/pull/2888](https://github.com/toeverything/blocksuite/pull/2888)\n\n\nWe highly value your feedback and ideas, as you are of utmost importance to us. We would be absolutely thrilled to hear what aspects of our work you find most useful and which areas you feel require improvement. Please do not hesitate to get in touch with us through any of our social media channels to share your valuable insights. We are eagerly looking forward to hearing from you!!\n\n\n* Official Website: [https://affine.pro/](https://affine.pro/)\n\n\n* GitHub: [https://github.com/toeverything/AFFiNE](https://github.com/toeverything/AFFiNE)\n\n\n* Discord: [https://discord.gg/Arn7TqJBvG](https://discord.gg/Arn7TqJBvG)\n\n\n* Telegram: [https://t.me/affineworkos](https://t.me/affineworkos)\n\n\n\n\n\n",
  "publish": true
}