{
  "title": "What’s New - AFFiNE - 20240315",
  "authors": [
    "Yixuan Guo",
    "Meng Cen"
  ],
  "tags": [
    "Release Note"
  ],
  "description": "Discover the power of our latest update! With the new Page Info feature, effortlessly manage your projects on a personal level. Subscribe to our AFFiNE AI for improved writing, presenting, and planning. Say goodbye to pesky bugs and hello to a smoother experience.",
  "created": 1710460800000,
  "updated": 1710460800000,
  "layout": "blog",
  "id": "gxB_9_an3237-0fRu6vdO",
  "slug": "whats-new-affine-20240315",
  "cover": "https://app.affine.pro/api/workspaces/qf73AF6vzWphbTJdN7KiX/blobs/eHMyjy-Aq0AI9SYHlhHyIDFftXVQdEFUwt8PTqLtrVE=.webp",
  "md": "---\n\ntitle: \"What’s New - AFFiNE - 20240315\"\n\nauthor: \"Yixuan Guo, Meng Cen\"\n\ntags: Release Note\n\nslug: whats-new-affine-20240315\n\ndescription: \"Discover the power of our latest update! With the new Page Info feature, effortlessly manage your projects on a personal level. Subscribe to our AFFiNE AI for improved writing, presenting, and planning. Say goodbye to pesky bugs and hello to a smoother experience.\"\n\ncreated: 2024-03-15\n\nupdated: 2024-03-15\n\nlayout: blog\n\npublish: true true\n\n---\n\nOur latest 0.13.0 version brings the **Page Info** feature, perfect for boosting project management on a personal level. Plus, our **AFFiNE AI** are now available for subscription, which facilitates enhanced writing, presentation, planning, and more. We've also tackled those annoying bugs, ensuring a smoother ride. Let's dive in and experience productivity at its finest!\n\n# **New features released in 0.13.0 version**\n\n## **Page info: Direct Insight into Progress**\n\nSimplistic field types come up short for modern knowledge bases that require 'modeling various types of documents' -- that can be your favorite reading list, movie archive, or academic papers . etc\n\n**On the AFFiNE Roadmap, our focus lies in fully integrating all database fields into document metadata.** We're progressively enhancing document indexing and bulk management through database blocks. Presently, you have the flexibility to incorporate any database field into the document page info. This enables a clear presentation of essential details like deadlines or tasks right at the outset of the document, streamlining personal project management. Consequently, your team can locate required documents more efficiently. Furthermore, with the introduction of the 'custom properties' feature, you can tailor how information is displayed. You have the option to reveal or conceal it in the view, or selectively unveil it when pertinent content is present.\n\nIn our latest version 0.13.0, we've updated this feature, paving the way for seamless integration of page info with collections and the 'all pages' view in forthcoming updates.\n\n\n<video muted autoplay loop preload=\"auto\" playsinline>\n            <source src=\"https://app.affine.pro/api/workspaces/qf73AF6vzWphbTJdN7KiX/blobs/MvmEKT-774O6TYC-blDZ1_4qGPkHofkVmVbKVOjrhA0=\" type=\"video/mp4\" />\n          </video>\n\n# **AFFiNE AI: Transforming Ideas into Visuals and Words Seamlessly**\n\n**Explore AFFiNE AI, your true multimodal AI copilot, dedicated to turning \"all your ideas into reality.**\n\n1. **Write Together**: Leveraging AI technology, AFFiNE AI provides intelligent assistance for every step of your writing process, from crafting sentences to entire articles. Whether you're creating content, professionally rewriting, adjusting tone, or correcting spelling and grammar, AFFiNE AI makes your text more vivid and accurate.\n\n1. **Create Together**: Harnessing the capabilities of AI, AFFiNE AI empowers you to turn your sketches or concepts into captivating visual presentations. Whether you're crafting slideshows or designing presentations, AFFiNE AI facilitates clear expression and seamless sharing of your creative ideas.\n\n1. **Plan Together**: AFFiNE AI offers intelligent mind mapping tools to assist you in structuring and visualizing your ideas effortlessly with simple instructions. With automatic sorting and tagging features, it simplifies knowledge management and organization.\n\n**Join our waiting list now to be among the first to experience the leap in creativity and efficiency brought by AFFiNE AI！**\n\n\n![eHMyjy-Aq0AI9SYHlhHyIDFftXVQdEFUwt8PTqLtrVE=](https://app.affine.pro/api/workspaces/qf73AF6vzWphbTJdN7KiX/blobs/eHMyjy-Aq0AI9SYHlhHyIDFftXVQdEFUwt8PTqLtrVE=.webp)\n\n## **Bugs Fixed:**\n\n* fix: backlinks jump\n\n* fix(core): fix page priority load\n\n* fix(core): make sidebar switch transition smooth\n\n* fix(core): remove unexpected loading\n\n* fix(core): cannot scroll when dragging\n\n# **Get Ready to Unlock New Levels of Productivity**\n\nAs we continue our journey of refinement, we extend our sincere gratitude for your interest and support. Our commitment to enhancing AFFiNE remains steadfast, and we are fully dedicated to its continuous improvement.\n\nWe also invite you to stay connected with us on Product Hunt. Your support, through follows and upvotes, truly makes a difference. Your engagement is invaluable to us. Discover more about AFFiNE, an all-in-one workspace designed for both productivity and creativity, at [https://www.producthunt.com/posts/affine-3.](https://www.producthunt.com/posts/affine-3)\n\n<div style=\"text-align:center;\">\n<iframe width=\"560\" height=\"315\" src=\"https://www.youtube.com/embed/WqOe9HgpsDY?si=PHGuSeRbOT9GxuPO\" title=\"YouTube video player\" frameborder=\"0\" allow=\"accelerometer; autoplay; clipboard-write; encrypted-media; gyroscope; picture-in-picture; web-share\" allowfullscreen></iframe>\n</div>\n\n* Official Website: [https://AFFiNE.pro/](https://affine.pro/)\n\n* GitHub: [https://github.com/toeverything/AFFiNE](https://github.com/toeverything/AFFiNE)\n\n* Twitter: [https://twitter.com/AFFiNEOfficial](https://twitter.com/AffineOfficial)\n\n* Community: [https://community.AFFiNE.pro/home](https://community.affine.pro/home)\n\n* Discord: [https://discord.gg/Arn7TqJBvG](https://discord.gg/Arn7TqJBvG)\n\n* Telegram: [https://t.me/AFFiNEworkos](https://t.me/affineworkos)\n\n\n\n",
  "publish": true
}