{
  "title": "What is Social Media Marketing(Definition, Benefits & Examples) ",
  "authors": [
    "Yanxi Liu"
  ],
  "tags": [
    "Content"
  ],
  "description": "Discover the power of social media marketing - where creativity meets connectivity! Unleash the potential of platforms like Facebook, Instagram, Twitter, and LinkedIn to captivate your audience, amplify your brand, and ignite a digital revolution. ",
  "created": 1707264000000,
  "updated": 1707264000000,
  "layout": "blog",
  "id": "8sWojWQIDPYEV8UgajksB",
  "slug": "what-is-social-media-marketing-definition-benefits-and-examples",
  "cover": "https://app.affine.pro/api/workspaces/qf73AF6vzWphbTJdN7KiX/blobs/d8H3fphw2MjAVxHlRY6U1t_Eh3dXEPBsU71s_1FbaN8=",
  "md": "---\n\n\ntitle: \"What is Social Media Marketing(Definition, Benefits & Examples) \"\n\n\nauthor: \"Yanxi Liu\"\n\n\ntags: Content\n\n\nslug: what-is-social-media-marketing-definition-benefits-and-examples\n\n\ndescription: \"Discover the power of social media marketing - where creativity meets connectivity! Unleash the potential of platforms like Facebook, Instagram, Twitter, and LinkedIn to captivate your audience, amplify your brand, and ignite a digital revolution. \"\n\n\ncreated: 2024-02-07\n\n\nupdated: 2024-02-07\n\n\nlayout: blog\n\n\npublish: true\n\n\n---\n\n\n\n![d8H3fphw2MjAVxHlRY6U1t_Eh3dXEPBsU71s_1FbaN8=](https://app.affine.pro/api/workspaces/qf73AF6vzWphbTJdN7KiX/blobs/d8H3fphw2MjAVxHlRY6U1t_Eh3dXEPBsU71s_1FbaN8=)\n\n\nWith a staggering [4.89 billion](https://www.prmoment.com/opinion/how-pr-can-help-tackle-the-growing-epidemic-of-fake-news-and-misinformation) social media users projected for 2023, social media marketing as a dynamic [strategy](https://affine.pro/blog/how-to-build-go-to-market-strategy-free-templates) will be your ticket to reaching new heights, fostering meaningful connections, and driving unprecedented customer engagement.\n\n\nWhether you're a project manager, business owner, or anyone seeking to understand the power of social media marketing, embracing this dynamic strategy can revolutionize your approach to achieving your goals.\n\n\nIn this article, youâ€™ll find a definition of social media marketing and also an explanation of its benefits, the different types, and some tips for getting started.\n\n\n* What is social media marketing?\n\n\n* Social media marketing benefits\n\n\n* Examples of social media marketing\n\n\n* Start your social media marketing in 2024\n\n\n# Definition of the Social Media Marketing\n\n\nWhat is social media marketing? That is a good question! We need to break down the question and explain the social media first.\n\n\nAccording to McKinsey, [social media](https://www.mckinsey.com/featured-insights/mckinsey-explainers/what-is-social-media) is the applications and websites that allow people to interact with other users, businesses, communities, and contentâ€”it is accurate. Still, it also seems to include a large portion of the internet.\n\n\nSocial media marketing uses social media sites like Facebook, Twitter, or LinkedIn to market a companyâ€™s products or services. At its core, social media marketing involves using social media platforms to build brand awareness, drive website traffic, and generate leads or sales. It encompasses various activities such as creating engaging content, sharing videos, running advertisements, and [interacting with the audience](https://affine.pro/blog/affine-0-10-0-launch-week-day-4-5-write-draw-plan-present-collaboratively-anywhere).\n\n\n# Benefits of Social Media Marketing\n\n\nSocial media marketing has great potential to expand reach, foster engagement, make informed decisions, and leverage the power of user-generated content to drive business growth.\n\n\n1. **Increased Reach and Targeted Audience:** Social media platforms provide a cost-effective way to reach a large audience. With the ability to target specific demographics, businesses can ensure that their message is delivered to the right people, maximizing the impact of their marketing efforts.\n\n\n1. **Real-time Engagement and Relationship Building:** Social media enables businesses to engage with their audience in real-time. Through comments, direct messages, or live chats, companies can have meaningful conversations with their customers, address their concerns, and build relationships. This direct interaction helps in understanding the audience better and tailoring marketing strategies accordingly.\n\n\n1. **Data-driven Decision Making:** Social media platforms provide valuable data and analytics that businesses can utilize to measure the success of their campaigns. By analyzing metrics such as reach, engagement, and conversions, companies can gain insights into the [effectiveness](https://affine.pro/blog/crafting-an-effective-one-page-marketing-plan-a-step-by-step-guide) of their social media marketing efforts and make data-driven decisions for future campaigns.\n\n\n1. **Leveraging User-generated Content:** Social media marketing allows businesses to tap into the power of user-generated content. By encouraging customers to share their experiences with a brand or product, businesses can leverage the trust and authenticity that comes with user-generated content. This can greatly enhance brand credibility and attract new customers.\n\n\n# 3 Examples of Social Media Marketing\n\n\n1. **Startup Example:** A new startup with an innovative product can use social media to show off its product through eye-catching photos or videos. By collaborating with influencers in their industry, they can reach a wider audience and gain credibility. Engaging with their audience through comments and direct messages helps them build a community of early adopters who are excited to try their product and spread the word.\n\n\n1. **Consulting Example:** Let's say there's a consulting firm that specializes in financial advice. They can use social media to establish themselves as experts in the industry. By sharing valuable insights, articles, and guides on platforms like LinkedIn, they show their expertise and build trust. Regularly posting helpful content and engaging with professionals in the industry can lead to more visibility, referrals, and new business opportunities.\n\n\n1. **Digital Marketing Agency Example:** For a digital marketing agency, social media is crucial for both their clients and showcasing their own skills. They can create interesting content about digital marketing trends, strategies, and success stories to attract potential clients. By consistently sharing valuable content and interacting with their audience, they become a trusted resource for businesses looking for digital marketing solutions. This can lead to more recognition and new client acquisitions.\n\n\n# How to Create SMM Plan in 7 Steps\n\n\n\n![21m5wmQf5d2cTEWjEqG5JHgSGkXon6Wdu4cciMaRsEE=](https://app.affine.pro/api/workspaces/qf73AF6vzWphbTJdN7KiX/blobs/21m5wmQf5d2cTEWjEqG5JHgSGkXon6Wdu4cciMaRsEE=)\n\n\nNow that we understand some common examples of social media marketing let's dive into creating an effective SMM plan in just seven steps. It's important to note that the more targeted [your strategy](https://affine.pro/blog/crafting-an-effective-one-page-marketing-plan-a-step-by-step-guide) is, the more effective it will be.\n\n\nHootsuite, a top social media management software provider, suggests the following action plan to build an SMM campaign with a clear execution framework and performance metrics:\n\n\n* Align SMM goals to clear business objectives.\n\n\n* Learn your target customer (age, location, income, job title, industry, interests)\n\n\n* Conduct a competitive analysis of your competition (successes and failures)\n\n\n* Audit your current SMM (successes and failures)\n\n\n* [Create a calendar](https://affine.pro/blog/free-content-calendar-templates-social-media-blogs) for SMM content delivery\n\n\n* Create best-in-class content\n\n\n* [Track performance](https://affine.pro/blog/10-best-free-performance-review-templates-examples-2023) and adjust SMM strategy as needed\n\n\n[Created by AFFiNE](http://affine.pro)\n\n\n# **Start Your Social Media Marketing Journey with AFFiNE**\n\n\nSuccessful business starts with organized planning. If you're looking for a way to keep your business goals organized, consider using project management software ---AFFiNE. Powerful software like AFFiNE can help connect your day-to-day [scheduling](https://affine.pro/blog/top-10-best-agile-project-scheduling-software-2023) to long-term social media marketing and finally contribute to your company's success.\n\n\nHere are the key features of AFFiNE\n\n\n* **Rich Template Gallery:** AFFiNE offers a rich template gallery, providing a wide range of templates to help people manage tasks, stay focused, and improve their efficiency. Many of these tools are geared towards scheduling reminders and [mind mapping](https://affine.pro/blog/top-5-mind-maps-examples-and-tools), allowing users to use AFFiNE to assist them in enhancing their productivity.\n\n\n\n![jjB7kqXvP0yEK84H4crT5VV3sVZXar6GvT5CQ1faGvs=](https://app.affine.pro/api/workspaces/qf73AF6vzWphbTJdN7KiX/blobs/jjB7kqXvP0yEK84H4crT5VV3sVZXar6GvT5CQ1faGvs=)\n\n\n[AFFiNE Project Planning Template](http://affine.pro)\n\n\n\n![szqAEHcp8xW5WCdIZM833AaUTbgbRhAN2vpl6fmHw1E=](https://app.affine.pro/api/workspaces/qf73AF6vzWphbTJdN7KiX/blobs/szqAEHcp8xW5WCdIZM833AaUTbgbRhAN2vpl6fmHw1E=)\n\n\n[AFFiNE Gantt Chart Template](http://affine.pro)\n\n\n* **Write, [Draw](https://affine.pro/blog/best-free-digital-whiteboard-apps-2023), and [Plan](https://affine.pro/blog/best-project-planning-tools-software-for-teams-2023) All-in-One:**Enjoy your all-in-one KnowledgeOS solution for effortlessly writing, drawing, and planning on a hyper-fused platform. It supports [kanban](https://affine.pro/blog/affine-080-launch-week-day3), table, and rich-text paragraphs as building blocks to form pages or whiteboards. It carries out integrated processing here in document editing, data processing, or brainstorming.\n\n\n\n![O88V12dZ7eALpdMD8-6eyyfRec5yZyWiQxCnvNEb3r0=](https://app.affine.pro/api/workspaces/qf73AF6vzWphbTJdN7KiX/blobs/O88V12dZ7eALpdMD8-6eyyfRec5yZyWiQxCnvNEb3r0=)\n\n\n* **[Collaborative Capabilities:](https://affine.pro/blog/affine-0-10-0-launch-week-day-5-5-stable-with-cloud-support-finally-available-to-every-pro-in-your-team) The app should have collaborative features for group work, making it easy to share and coordinate projects with others**.\n\n\n  \n![71MN7zgKOg2C73idwSU66YEnVUK8x41Jqwwe2z9CiPU=](https://app.affine.pro/api/workspaces/qf73AF6vzWphbTJdN7KiX/blobs/71MN7zgKOg2C73idwSU66YEnVUK8x41Jqwwe2z9CiPU=)\n\n\nAFFiNE can assist businesses of all sizes in developing and implementing realistic and successful social media marketing plans. We've got you covered, from content creation and social media roll-up plan to crafting and tracking your social media performances. AFFiNE has launched its [Stable Version](https://affine.pro/download), with ongoing efforts to develop a more comprehensive and dependable iteration. Join us on our voyage through our social media channels and be part of the experience. **Come and join us on our journey over on our media platforms.** ðŸš€\n\n\n* Official Website:[https://affine.pro/](https://affine.pro/)\n\n\n* GitHub:[https://github.com/toeverything/AFFiNE](https://github.com/toeverything/AFFiNE)\n\n\n* Discord:[https://discord.gg/Arn7TqJBvG](https://discord.gg/Arn7TqJBvG)\n\n\n* Twitter:[https://twitter.com/AffineOfficial](https://twitter.com/AffineOfficial)\n\n\n",
  "publish": true
}